code_generation/generate/deprecated/deprecated_with_tvm_dependency/log/cuda/abs_cuda.log
{"i": [["[\"abs\", 20, 13, 11, 16]", "cuda -keys=cuda,gpu -arch=sm_80 -max_num_threads=1024 -thread_warp_size=32", [-1, 16, 64, 49152, 2147483647, 1024, 8, 32], "", 0, []], [[], [["FU", 1, [0, 1, 2, 3]], ["SP", 1, 0, 45760, [32], 1], ["AN", 1, 1, 6], ["FU", 1, []], ["AN", 1, 0, 5], ["PR", 1, 0, "auto_unroll_max_step$64"]]]], "r": [[2.71888e-05], 0, 1.90654, 1718941303], "v": "v0.6"}
{"i": [["[\"abs\", 20, 13, 11, 16]", "cuda -keys=cuda,gpu -arch=sm_80 -max_num_threads=1024 -thread_warp_size=32", [-1, 16, 64, 49152, 2147483647, 1024, 8, 32], "", 0, []], [[], [["FU", 1, [0, 1, 2, 3]], ["SP", 1, 0, 45760, [32], 1], ["AN", 1, 1, 6], ["FU", 1, []], ["AN", 1, 0, 5], ["PR", 1, 0, "auto_unroll_max_step$0"]]]], "r": [[2.69449e-05], 0, 1.25088, 1718941303], "v": "v0.6"}
{"i": [["[\"abs\", 20, 13, 11, 16]", "cuda -keys=cuda,gpu -arch=sm_80 -max_num_threads=1024 -thread_warp_size=32", [-1, 16, 64, 49152, 2147483647, 1024, 8, 32], "", 0, []], [[], [["FU", 1, []], ["AN", 1, 0, 6], ["PR", 1, 0, "auto_unroll_max_step$1024"]]]], "r": [[0.00181175], 0, 1.18587, 1718941303], "v": "v0.6"}
{"i": [["[\"abs\", 20, 13, 11, 16]", "cuda -keys=cuda,gpu -arch=sm_80 -max_num_threads=1024 -thread_warp_size=32", [-1, 16, 64, 49152, 2147483647, 1024, 8, 32], "", 0, []], [[], [["FU", 1, []], ["AN", 1, 0, 6], ["PR", 1, 0, "auto_unroll_max_step$16"]]]], "r": [[0.00181161], 0, 0.842743, 1718941304], "v": "v0.6"}
{"i": [["[\"abs\", 20, 13, 11, 16]", "cuda -keys=cuda,gpu -arch=sm_80 -max_num_threads=1024 -thread_warp_size=32", [-1, 16, 64, 49152, 2147483647, 1024, 8, 32], "", 0, []], [[], [["FU", 1, [0, 1, 2, 3]], ["SP", 1, 0, 45760, [32], 1], ["AN", 1, 1, 6], ["FU", 1, []], ["AN", 1, 0, 5], ["PR", 1, 0, "auto_unroll_max_step$512"]]]], "r": [[2.66999e-05], 0, 1.27246, 1718941304], "v": "v0.6"}
