code_generation/generate/deprecated/deprecated_with_tvm_dependency/log/cuda/acos_cuda.log
{"i": [["[\"acos\", 15, 6, 15, 3]", "cuda -keys=cuda,gpu -arch=sm_80 -max_num_threads=1024 -thread_warp_size=32", [-1, 16, 64, 49152, 2147483647, 1024, 8, 32], "", 0, []], [[], [["FU", 1, [0, 1, 2, 3]], ["SP", 1, 0, 4050, [4], 1], ["AN", 1, 0, 5], ["AN", 1, 1, 6]]]], "r": [[7.74016e-06], 0, 2.00505, 1718942823], "v": "v0.6"}
{"i": [["[\"acos\", 15, 6, 15, 3]", "cuda -keys=cuda,gpu -arch=sm_80 -max_num_threads=1024 -thread_warp_size=32", [-1, 16, 64, 49152, 2147483647, 1024, 8, 32], "", 0, []], [[], [["FU", 1, [0, 1, 2, 3]], ["SP", 1, 0, 4050, [64], 1], ["AN", 1, 0, 5], ["AN", 1, 1, 6]]]], "r": [[1.21695e-05], 0, 1.59402, 1718942824], "v": "v0.6"}
{"i": [["[\"acos\", 15, 6, 15, 3]", "cuda -keys=cuda,gpu -arch=sm_80 -max_num_threads=1024 -thread_warp_size=32", [-1, 16, 64, 49152, 2147483647, 1024, 8, 32], "", 0, []], [[], [["FU", 1, [0, 1, 2, 3]], ["SP", 1, 0, 4050, [22], 1], ["AN", 1, 0, 5], ["AN", 1, 1, 6]]]], "r": [[7.72716e-06], 0, 0.944062, 1718942824], "v": "v0.6"}
{"i": [["[\"acos\", 15, 6, 15, 3]", "cuda -keys=cuda,gpu -arch=sm_80 -max_num_threads=1024 -thread_warp_size=32", [-1, 16, 64, 49152, 2147483647, 1024, 8, 32], "", 0, []], [[], [["FU", 1, [0, 1, 2, 3]], ["SP", 1, 0, 4050, [18], 1], ["AN", 1, 0, 5], ["AN", 1, 1, 6]]]], "r": [[1.08154e-05], 0, 1.53471, 1718942825], "v": "v0.6"}
{"i": [["[\"acos\", 15, 6, 15, 3]", "cuda -keys=cuda,gpu -arch=sm_80 -max_num_threads=1024 -thread_warp_size=32", [-1, 16, 64, 49152, 2147483647, 1024, 8, 32], "", 0, []], [[], [["FU", 1, [0, 1, 2, 3]], ["SP", 1, 0, 4050, [9], 1], ["AN", 1, 0, 5], ["AN", 1, 1, 6]]]], "r": [[9.15139e-06], 0, 1.42744, 1718942825], "v": "v0.6"}
{"i": [["[\"acos\", 15, 6, 15, 3]", "cuda -keys=cuda,gpu -arch=sm_80 -max_num_threads=1024 -thread_warp_size=32", [-1, 16, 64, 49152, 2147483647, 1024, 8, 32], "", 0, []], [[], [["FU", 1, [0, 1, 2, 3]], ["SP", 1, 0, 4050, [45], 1], ["AN", 1, 0, 5], ["AN", 1, 1, 6]]]], "r": [[6.17571e-06], 0, 1.14529, 1718942825], "v": "v0.6"}
{"i": [["[\"acos\", 15, 6, 15, 3]", "cuda -keys=cuda,gpu -arch=sm_80 -max_num_threads=1024 -thread_warp_size=32", [-1, 16, 64, 49152, 2147483647, 1024, 8, 32], "", 0, []], [[], [["FU", 1, [0, 1, 2, 3]], ["SP", 1, 0, 4050, [6], 1], ["AN", 1, 0, 5], ["AN", 1, 1, 6]]]], "r": [[8.59779e-06], 0, 1.37194, 1718942826], "v": "v0.6"}
{"i": [["[\"acos\", 15, 6, 15, 3]", "cuda -keys=cuda,gpu -arch=sm_80 -max_num_threads=1024 -thread_warp_size=32", [-1, 16, 64, 49152, 2147483647, 1024, 8, 32], "", 0, []], [[], [["FU", 1, [0, 1, 2, 3]], ["SP", 1, 0, 4050, [32], 1], ["AN", 1, 0, 5], ["AN", 1, 1, 6]]]], "r": [[6.13732e-06], 0, 1.56771, 1718942826], "v": "v0.6"}
{"i": [["[\"acos\", 15, 6, 15, 3]", "cuda -keys=cuda,gpu -arch=sm_80 -max_num_threads=1024 -thread_warp_size=32", [-1, 16, 64, 49152, 2147483647, 1024, 8, 32], "", 0, []], [[], [["FU", 1, [0, 1, 2, 3]], ["SP", 1, 0, 4050, [30], 1], ["AN", 1, 0, 5], ["AN", 1, 1, 6]]]], "r": [[8.72646e-06], 0, 1.15988, 1718942827], "v": "v0.6"}
{"i": [["[\"acos\", 15, 6, 15, 3]", "cuda -keys=cuda,gpu -arch=sm_80 -max_num_threads=1024 -thread_warp_size=32", [-1, 16, 64, 49152, 2147483647, 1024, 8, 32], "", 0, []], [[], [["FU", 1, [0, 1, 2, 3]], ["SP", 1, 0, 4050, [15], 1], ["AN", 1, 0, 5], ["AN", 1, 1, 6]]]], "r": [[6.04917e-06], 0, 0.955131, 1718942827], "v": "v0.6"}
