code_generation/generate/deprecated/deprecated_with_tvm_dependency/log/cuda/adaptive_pool_max_cuda.log
{"i": [["[\"adaptive_pool_max\", 4, 5, 3, 18]", "cuda -keys=cuda,gpu -arch=sm_80 -max_num_threads=1024 -thread_warp_size=32", [-1, 16, 64, 49152, 2147483647, 1024, 8, 32], "", 0, []], [[], [["FU", 1, [0, 1, 2, 3]], ["SP", 1, 0, 1280, [8], 1], ["AN", 1, 0, 5], ["AN", 1, 1, 6], ["PR", 1, 0, "auto_unroll_max_step$64"]]]], "r": [[6.95877e-06], 0, 1.59352, 1718947188], "v": "v0.6"}
{"i": [["[\"adaptive_pool_max\", 4, 5, 3, 18]", "cuda -keys=cuda,gpu -arch=sm_80 -max_num_threads=1024 -thread_warp_size=32", [-1, 16, 64, 49152, 2147483647, 1024, 8, 32], "", 0, []], [[], [["FU", 1, [0, 1, 2, 3]], ["SP", 1, 0, 1280, [40], 1], ["AN", 1, 0, 5], ["AN", 1, 1, 6], ["PR", 1, 0, "auto_unroll_max_step$0"]]]], "r": [[8.93976e-06], 0, 1.15344, 1718947188], "v": "v0.6"}
{"i": [["[\"adaptive_pool_max\", 4, 5, 3, 18]", "cuda -keys=cuda,gpu -arch=sm_80 -max_num_threads=1024 -thread_warp_size=32", [-1, 16, 64, 49152, 2147483647, 1024, 8, 32], "", 0, []], [[], [["FU", 1, [0, 1, 2, 3]], ["SP", 1, 0, 1280, [64], 1], ["AN", 1, 0, 5], ["AN", 1, 1, 6], ["PR", 1, 0, "auto_unroll_max_step$512"]]]], "r": [[6.56814e-06], 0, 1.0686, 1718947189], "v": "v0.6"}
{"i": [["[\"adaptive_pool_max\", 4, 5, 3, 18]", "cuda -keys=cuda,gpu -arch=sm_80 -max_num_threads=1024 -thread_warp_size=32", [-1, 16, 64, 49152, 2147483647, 1024, 8, 32], "", 0, []], [[], [["FU", 1, [0, 1, 2, 3]], ["SP", 1, 0, 1280, [5], 1], ["AN", 1, 0, 5], ["AN", 1, 1, 6], ["PR", 1, 0, "auto_unroll_max_step$16"]]]], "r": [[7.20993e-06], 0, 1.21331, 1718947189], "v": "v0.6"}
{"i": [["[\"adaptive_pool_max\", 4, 5, 3, 18]", "cuda -keys=cuda,gpu -arch=sm_80 -max_num_threads=1024 -thread_warp_size=32", [-1, 16, 64, 49152, 2147483647, 1024, 8, 32], "", 0, []], [[], [["FU", 1, [0, 1, 2, 3]], ["SP", 1, 0, 1280, [16], 1], ["AN", 1, 0, 5], ["AN", 1, 1, 6], ["PR", 1, 0, "auto_unroll_max_step$512"]]]], "r": [[6.91189e-06], 0, 1.15529, 1718947189], "v": "v0.6"}
{"i": [["[\"adaptive_pool_max\", 4, 5, 3, 18]", "cuda -keys=cuda,gpu -arch=sm_80 -max_num_threads=1024 -thread_warp_size=32", [-1, 16, 64, 49152, 2147483647, 1024, 8, 32], "", 0, []], [[], [["FU", 1, [0, 1, 2, 3]], ["SP", 1, 0, 1280, [16], 1], ["AN", 1, 0, 5], ["AN", 1, 1, 6], ["PR", 1, 0, "auto_unroll_max_step$1024"]]]], "r": [[7.58823e-06], 0, 1.3659, 1718947190], "v": "v0.6"}
{"i": [["[\"adaptive_pool_max\", 4, 5, 3, 18]", "cuda -keys=cuda,gpu -arch=sm_80 -max_num_threads=1024 -thread_warp_size=32", [-1, 16, 64, 49152, 2147483647, 1024, 8, 32], "", 0, []], [[], [["FU", 1, [0, 1, 2, 3]], ["SP", 1, 0, 1280, [1], 1], ["AN", 1, 0, 5], ["AN", 1, 1, 6], ["PR", 1, 0, "auto_unroll_max_step$512"]]]], "r": [[8.74532e-06], 0, 0.926219, 1718947190], "v": "v0.6"}
{"i": [["[\"adaptive_pool_max\", 4, 5, 3, 18]", "cuda -keys=cuda,gpu -arch=sm_80 -max_num_threads=1024 -thread_warp_size=32", [-1, 16, 64, 49152, 2147483647, 1024, 8, 32], "", 0, []], [[], [["FU", 1, [0, 1, 2, 3]], ["SP", 1, 0, 1280, [64], 1], ["AN", 1, 0, 5], ["AN", 1, 1, 6], ["PR", 1, 0, "auto_unroll_max_step$0"]]]], "r": [[6.99517e-06], 0, 1.15938, 1718947190], "v": "v0.6"}
{"i": [["[\"adaptive_pool_max\", 4, 5, 3, 18]", "cuda -keys=cuda,gpu -arch=sm_80 -max_num_threads=1024 -thread_warp_size=32", [-1, 16, 64, 49152, 2147483647, 1024, 8, 32], "", 0, []], [[], [["FU", 1, [0, 1, 2, 3]], ["SP", 1, 0, 1280, [4], 1], ["AN", 1, 0, 5], ["AN", 1, 1, 6], ["PR", 1, 0, "auto_unroll_max_step$512"]]]], "r": [[7.165e-06], 0, 1.10337, 1718947191], "v": "v0.6"}
{"i": [["[\"adaptive_pool_max\", 4, 5, 3, 18]", "cuda -keys=cuda,gpu -arch=sm_80 -max_num_threads=1024 -thread_warp_size=32", [-1, 16, 64, 49152, 2147483647, 1024, 8, 32], "", 0, []], [[], [["FU", 1, [0, 1, 2, 3]], ["SP", 1, 0, 1280, [5], 1], ["AN", 1, 0, 5], ["AN", 1, 1, 6], ["PR", 1, 0, "auto_unroll_max_step$1024"]]]], "r": [[7.56464e-06], 0, 1.17428, 1718947191], "v": "v0.6"}
