code_generation/generate/deprecated/deprecated_with_tvm_dependency/log/cuda/add_cuda.log
{"i": [["[\"add\", 6, 12, 3, 15]", "cuda -keys=cuda,gpu -arch=sm_80 -max_num_threads=1024 -thread_warp_size=32", [-1, 16, 64, 49152, 2147483647, 1024, 8, 32], "", 0, []], [[], [["FU", 2, [0, 1, 2, 3]], ["SP", 2, 0, 3240, [15], 1], ["AN", 2, 0, 5], ["AN", 2, 1, 6]]]], "r": [[5.55344e-06], 0, 1.28655, 1718947391], "v": "v0.6"}
{"i": [["[\"add\", 6, 12, 3, 15]", "cuda -keys=cuda,gpu -arch=sm_80 -max_num_threads=1024 -thread_warp_size=32", [-1, 16, 64, 49152, 2147483647, 1024, 8, 32], "", 0, []], [[], [["FU", 2, [0, 1, 2, 3]], ["SP", 2, 0, 3240, [16], 1], ["AN", 2, 0, 5], ["AN", 2, 1, 6]]]], "r": [[5.62913e-06], 0, 0.841599, 1718947392], "v": "v0.6"}
{"i": [["[\"add\", 6, 12, 3, 15]", "cuda -keys=cuda,gpu -arch=sm_80 -max_num_threads=1024 -thread_warp_size=32", [-1, 16, 64, 49152, 2147483647, 1024, 8, 32], "", 0, []], [[], [["FU", 2, [0, 1, 2, 3]], ["SP", 2, 0, 3240, [6], 1], ["AN", 2, 0, 5], ["AN", 2, 1, 6]]]], "r": [[6.14141e-06], 0, 0.920658, 1718947392], "v": "v0.6"}
{"i": [["[\"add\", 6, 12, 3, 15]", "cuda -keys=cuda,gpu -arch=sm_80 -max_num_threads=1024 -thread_warp_size=32", [-1, 16, 64, 49152, 2147483647, 1024, 8, 32], "", 0, []], [[], [["FU", 2, [0, 1, 2, 3]], ["SP", 2, 0, 3240, [12], 1], ["AN", 2, 0, 5], ["AN", 2, 1, 6]]]], "r": [[5.64414e-06], 0, 0.938879, 1718947392], "v": "v0.6"}
{"i": [["[\"add\", 6, 12, 3, 15]", "cuda -keys=cuda,gpu -arch=sm_80 -max_num_threads=1024 -thread_warp_size=32", [-1, 16, 64, 49152, 2147483647, 1024, 8, 32], "", 0, []], [[], [["FU", 2, [0, 1, 2, 3]], ["SP", 2, 0, 3240, [18], 1], ["AN", 2, 0, 5], ["AN", 2, 1, 6]]]], "r": [[5.62934e-06], 0, 0.898175, 1718947392], "v": "v0.6"}
{"i": [["[\"add\", 6, 12, 3, 15]", "cuda -keys=cuda,gpu -arch=sm_80 -max_num_threads=1024 -thread_warp_size=32", [-1, 16, 64, 49152, 2147483647, 1024, 8, 32], "", 0, []], [[], [["FU", 2, [0, 1, 2, 3]], ["SP", 2, 0, 3240, [20], 1], ["AN", 2, 0, 5], ["AN", 2, 1, 6]]]], "r": [[5.62963e-06], 0, 0.903852, 1718947392], "v": "v0.6"}
{"i": [["[\"add\", 6, 12, 3, 15]", "cuda -keys=cuda,gpu -arch=sm_80 -max_num_threads=1024 -thread_warp_size=32", [-1, 16, 64, 49152, 2147483647, 1024, 8, 32], "", 0, []], [[], [["FU", 2, [0, 1, 2, 3]], ["SP", 2, 0, 3240, [8], 1], ["AN", 2, 0, 5], ["AN", 2, 1, 6]]]], "r": [[6.10415e-06], 0, 0.965214, 1718947393], "v": "v0.6"}
{"i": [["[\"add\", 6, 12, 3, 15]", "cuda -keys=cuda,gpu -arch=sm_80 -max_num_threads=1024 -thread_warp_size=32", [-1, 16, 64, 49152, 2147483647, 1024, 8, 32], "", 0, []], [[], [["FU", 2, [0, 1, 2, 3]], ["SP", 2, 0, 3240, [60], 1], ["AN", 2, 0, 5], ["AN", 2, 1, 6]]]], "r": [[5.63525e-06], 0, 0.916509, 1718947393], "v": "v0.6"}
{"i": [["[\"add\", 6, 12, 3, 15]", "cuda -keys=cuda,gpu -arch=sm_80 -max_num_threads=1024 -thread_warp_size=32", [-1, 16, 64, 49152, 2147483647, 1024, 8, 32], "", 0, []], [[], [["FU", 2, [0, 1, 2, 3]], ["SP", 2, 0, 3240, [32], 1], ["AN", 2, 0, 5], ["AN", 2, 1, 6]]]], "r": [[5.63563e-06], 0, 0.830507, 1718947393], "v": "v0.6"}
{"i": [["[\"add\", 6, 12, 3, 15]", "cuda -keys=cuda,gpu -arch=sm_80 -max_num_threads=1024 -thread_warp_size=32", [-1, 16, 64, 49152, 2147483647, 1024, 8, 32], "", 0, []], [[], [["FU", 2, [0, 1, 2, 3]], ["SP", 2, 0, 3240, [36], 1], ["AN", 2, 0, 5], ["AN", 2, 1, 6]]]], "r": [[5.64045e-06], 0, 0.773033, 1718947393], "v": "v0.6"}
