code_generation/generate/deprecated/deprecated_with_tvm_dependency/log/cuda/asinh_cuda.log
{"i": [["[\"asinh\", 5, 16, 12, 4]", "cuda -keys=cuda,gpu -arch=sm_80 -max_num_threads=1024 -thread_warp_size=32", [-1, 16, 64, 49152, 2147483647, 1024, 8, 32], "", 0, []], [[], [["FU", 1, [0, 1, 2, 3]], ["SP", 1, 0, 3840, [12], 1], ["AN", 1, 0, 5], ["AN", 1, 1, 6]]]], "r": [[6.76845e-06], 0, 2.01769, 1718943315], "v": "v0.6"}
{"i": [["[\"asinh\", 5, 16, 12, 4]", "cuda -keys=cuda,gpu -arch=sm_80 -max_num_threads=1024 -thread_warp_size=32", [-1, 16, 64, 49152, 2147483647, 1024, 8, 32], "", 0, []], [[], [["FU", 1, [0, 1, 2, 3]], ["SP", 1, 0, 3840, [24], 1], ["AN", 1, 0, 5], ["AN", 1, 1, 6]]]], "r": [[6.07077e-06], 0, 1.66999, 1718943315], "v": "v0.6"}
{"i": [["[\"asinh\", 5, 16, 12, 4]", "cuda -keys=cuda,gpu -arch=sm_80 -max_num_threads=1024 -thread_warp_size=32", [-1, 16, 64, 49152, 2147483647, 1024, 8, 32], "", 0, []], [[], [["FU", 1, [0, 1, 2, 3]], ["SP", 1, 0, 3840, [6], 1], ["AN", 1, 0, 5], ["AN", 1, 1, 6]]]], "r": [[8.04186e-06], 0, 1.3383, 1718943315], "v": "v0.6"}
{"i": [["[\"asinh\", 5, 16, 12, 4]", "cuda -keys=cuda,gpu -arch=sm_80 -max_num_threads=1024 -thread_warp_size=32", [-1, 16, 64, 49152, 2147483647, 1024, 8, 32], "", 0, []], [[], [["FU", 1, [0, 1, 2, 3]], ["SP", 1, 0, 3840, [32], 1], ["AN", 1, 0, 5], ["AN", 1, 1, 6]]]], "r": [[6.20863e-06], 0, 1.61633, 1718943315], "v": "v0.6"}
{"i": [["[\"asinh\", 5, 16, 12, 4]", "cuda -keys=cuda,gpu -arch=sm_80 -max_num_threads=1024 -thread_warp_size=32", [-1, 16, 64, 49152, 2147483647, 1024, 8, 32], "", 0, []], [[], [["FU", 1, [0, 1, 2, 3]], ["SP", 1, 0, 3840, [10], 1], ["AN", 1, 0, 5], ["AN", 1, 1, 6]]]], "r": [[7.60256e-06], 0, 1.42058, 1718943316], "v": "v0.6"}
{"i": [["[\"asinh\", 5, 16, 12, 4]", "cuda -keys=cuda,gpu -arch=sm_80 -max_num_threads=1024 -thread_warp_size=32", [-1, 16, 64, 49152, 2147483647, 1024, 8, 32], "", 0, []], [[], [["FU", 1, [0, 1, 2, 3]], ["SP", 1, 0, 3840, [5], 1], ["AN", 1, 0, 5], ["AN", 1, 1, 6]]]], "r": [[7.62556e-06], 0, 1.76396, 1718943316], "v": "v0.6"}
{"i": [["[\"asinh\", 5, 16, 12, 4]", "cuda -keys=cuda,gpu -arch=sm_80 -max_num_threads=1024 -thread_warp_size=32", [-1, 16, 64, 49152, 2147483647, 1024, 8, 32], "", 0, []], [[], [["FU", 1, [0, 1, 2, 3]], ["SP", 1, 0, 3840, [30], 1], ["AN", 1, 0, 5], ["AN", 1, 1, 6]]]], "r": [[6.4714e-06], 0, 1.55833, 1718943316], "v": "v0.6"}
{"i": [["[\"asinh\", 5, 16, 12, 4]", "cuda -keys=cuda,gpu -arch=sm_80 -max_num_threads=1024 -thread_warp_size=32", [-1, 16, 64, 49152, 2147483647, 1024, 8, 32], "", 0, []], [[], [["FU", 1, [0, 1, 2, 3]], ["SP", 1, 0, 3840, [48], 1], ["AN", 1, 0, 5], ["AN", 1, 1, 6]]]], "r": [[6.17478e-06], 0, 1.60177, 1718943317], "v": "v0.6"}
{"i": [["[\"asinh\", 5, 16, 12, 4]", "cuda -keys=cuda,gpu -arch=sm_80 -max_num_threads=1024 -thread_warp_size=32", [-1, 16, 64, 49152, 2147483647, 1024, 8, 32], "", 0, []], [[], [["FU", 1, [0, 1, 2, 3]], ["SP", 1, 0, 3840, [20], 1], ["AN", 1, 0, 5], ["AN", 1, 1, 6]]]], "r": [[6.12001e-06], 0, 1.30959, 1718943317], "v": "v0.6"}
{"i": [["[\"asinh\", 5, 16, 12, 4]", "cuda -keys=cuda,gpu -arch=sm_80 -max_num_threads=1024 -thread_warp_size=32", [-1, 16, 64, 49152, 2147483647, 1024, 8, 32], "", 0, []], [[], [["FU", 1, [0, 1, 2, 3]], ["SP", 1, 0, 3840, [3], 1], ["AN", 1, 0, 5], ["AN", 1, 1, 6]]]], "r": [[8.27158e-06], 0, 1.28805, 1718943317], "v": "v0.6"}
