code_generation/generate/deprecated/deprecated_with_tvm_dependency/log/cuda/asin_cuda.log
{"i": [["[\"asin\", 7, 7, 16, 5]", "cuda -keys=cuda,gpu -arch=sm_80 -max_num_threads=1024 -thread_warp_size=32", [-1, 16, 64, 49152, 2147483647, 1024, 8, 32], "", 0, []], [[], [["FU", 1, [0, 1, 2, 3]], ["SP", 1, 0, 3920, [56], 1], ["AN", 1, 0, 5], ["AN", 1, 1, 6]]]], "r": [[5.82759e-06], 0, 1.63706, 1718943079], "v": "v0.6"}
{"i": [["[\"asin\", 7, 7, 16, 5]", "cuda -keys=cuda,gpu -arch=sm_80 -max_num_threads=1024 -thread_warp_size=32", [-1, 16, 64, 49152, 2147483647, 1024, 8, 32], "", 0, []], [[], [["FU", 1, [0, 1, 2, 3]], ["SP", 1, 0, 3920, [28], 1], ["AN", 1, 0, 5], ["AN", 1, 1, 6]]]], "r": [[5.82738e-06], 0, 1.07565, 1718943079], "v": "v0.6"}
{"i": [["[\"asin\", 7, 7, 16, 5]", "cuda -keys=cuda,gpu -arch=sm_80 -max_num_threads=1024 -thread_warp_size=32", [-1, 16, 64, 49152, 2147483647, 1024, 8, 32], "", 0, []], [[], [["FU", 1, [0, 1, 2, 3]], ["SP", 1, 0, 3920, [64], 1], ["AN", 1, 0, 5], ["AN", 1, 1, 6]]]], "r": [[8.36288e-06], 0, 1.21365, 1718943080], "v": "v0.6"}
{"i": [["[\"asin\", 7, 7, 16, 5]", "cuda -keys=cuda,gpu -arch=sm_80 -max_num_threads=1024 -thread_warp_size=32", [-1, 16, 64, 49152, 2147483647, 1024, 8, 32], "", 0, []], [[], [["FU", 1, [0, 1, 2, 3]], ["SP", 1, 0, 3920, [40], 1], ["AN", 1, 0, 5], ["AN", 1, 1, 6]]]], "r": [[5.82826e-06], 0, 1.02473, 1718943080], "v": "v0.6"}
{"i": [["[\"asin\", 7, 7, 16, 5]", "cuda -keys=cuda,gpu -arch=sm_80 -max_num_threads=1024 -thread_warp_size=32", [-1, 16, 64, 49152, 2147483647, 1024, 8, 32], "", 0, []], [[], [["FU", 1, [0, 1, 2, 3]], ["SP", 1, 0, 3920, [32], 1], ["AN", 1, 0, 5], ["AN", 1, 1, 6]]]], "r": [[8.18659e-06], 0, 1.4164, 1718943080], "v": "v0.6"}
{"i": [["[\"asin\", 7, 7, 16, 5]", "cuda -keys=cuda,gpu -arch=sm_80 -max_num_threads=1024 -thread_warp_size=32", [-1, 16, 64, 49152, 2147483647, 1024, 8, 32], "", 0, []], [[], [["FU", 1, [0, 1, 2, 3]], ["SP", 1, 0, 3920, [1], 1], ["AN", 1, 0, 5], ["AN", 1, 1, 6]]]], "r": [[1.21535e-05], 0, 1.29105, 1718943081], "v": "v0.6"}
{"i": [["[\"asin\", 7, 7, 16, 5]", "cuda -keys=cuda,gpu -arch=sm_80 -max_num_threads=1024 -thread_warp_size=32", [-1, 16, 64, 49152, 2147483647, 1024, 8, 32], "", 0, []], [[], [["FU", 1, [0, 1, 2, 3]], ["SP", 1, 0, 3920, [5], 1], ["AN", 1, 0, 5], ["AN", 1, 1, 6]]]], "r": [[6.74841e-06], 0, 1.37859, 1718943081], "v": "v0.6"}
{"i": [["[\"asin\", 7, 7, 16, 5]", "cuda -keys=cuda,gpu -arch=sm_80 -max_num_threads=1024 -thread_warp_size=32", [-1, 16, 64, 49152, 2147483647, 1024, 8, 32], "", 0, []], [[], [["FU", 1, [0, 1, 2, 3]], ["SP", 1, 0, 3920, [7], 1], ["AN", 1, 0, 5], ["AN", 1, 1, 6]]]], "r": [[6.71357e-06], 0, 1.22745, 1718943081], "v": "v0.6"}
{"i": [["[\"asin\", 7, 7, 16, 5]", "cuda -keys=cuda,gpu -arch=sm_80 -max_num_threads=1024 -thread_warp_size=32", [-1, 16, 64, 49152, 2147483647, 1024, 8, 32], "", 0, []], [[], [["FU", 1, [0, 1, 2, 3]], ["SP", 1, 0, 3920, [4], 1], ["AN", 1, 0, 5], ["AN", 1, 1, 6]]]], "r": [[7.70367e-06], 0, 0.997059, 1718943081], "v": "v0.6"}
{"i": [["[\"asin\", 7, 7, 16, 5]", "cuda -keys=cuda,gpu -arch=sm_80 -max_num_threads=1024 -thread_warp_size=32", [-1, 16, 64, 49152, 2147483647, 1024, 8, 32], "", 0, []], [[], [["FU", 1, [0, 1, 2, 3]], ["SP", 1, 0, 3920, [20], 1], ["AN", 1, 0, 5], ["AN", 1, 1, 6]]]], "r": [[2.42834e-05], 0, 1.33934, 1718943082], "v": "v0.6"}
