code_generation/generate/deprecated/deprecated_with_tvm_dependency/log/cuda/asin_cos_cuda.log
{"i": [["[\"asin_cos\", 7, 5, 12, 4]", "cuda -keys=cuda,gpu -arch=sm_80 -max_num_threads=1024 -thread_warp_size=32", [-1, 16, 64, 49152, 2147483647, 1024, 8, 32], "", 0, []], [[], [["CI", 1], ["FU", 2, [0, 1, 2, 3]], ["SP", 2, 0, 1680, [64], 1], ["AN", 2, 0, 5], ["AN", 2, 1, 6]]]], "r": [[6.93342e-06], 0, 1.91996, 1718942058], "v": "v0.6"}
{"i": [["[\"asin_cos\", 7, 5, 12, 4]", "cuda -keys=cuda,gpu -arch=sm_80 -max_num_threads=1024 -thread_warp_size=32", [-1, 16, 64, 49152, 2147483647, 1024, 8, 32], "", 0, []], [[], [["CI", 1], ["FU", 2, [0, 1, 2, 3]], ["SP", 2, 0, 1680, [1], 1], ["AN", 2, 0, 5], ["AN", 2, 1, 6]]]], "r": [[8.80846e-06], 0, 1.21175, 1718942059], "v": "v0.6"}
{"i": [["[\"asin_cos\", 7, 5, 12, 4]", "cuda -keys=cuda,gpu -arch=sm_80 -max_num_threads=1024 -thread_warp_size=32", [-1, 16, 64, 49152, 2147483647, 1024, 8, 32], "", 0, []], [[], [["CI", 1], ["FU", 2, [0, 1, 2, 3]], ["SP", 2, 0, 1680, [24], 1], ["AN", 2, 0, 5], ["AN", 2, 1, 6]]]], "r": [[7.12254e-06], 0, 1.29053, 1718942059], "v": "v0.6"}
{"i": [["[\"asin_cos\", 7, 5, 12, 4]", "cuda -keys=cuda,gpu -arch=sm_80 -max_num_threads=1024 -thread_warp_size=32", [-1, 16, 64, 49152, 2147483647, 1024, 8, 32], "", 0, []], [[], [["CI", 1], ["FU", 2, [0, 1, 2, 3]], ["SP", 2, 0, 1680, [14], 1], ["AN", 2, 0, 5], ["AN", 2, 1, 6]]]], "r": [[5.86924e-06], 0, 1.33785, 1718942059], "v": "v0.6"}
{"i": [["[\"asin_cos\", 7, 5, 12, 4]", "cuda -keys=cuda,gpu -arch=sm_80 -max_num_threads=1024 -thread_warp_size=32", [-1, 16, 64, 49152, 2147483647, 1024, 8, 32], "", 0, []], [[], [["CI", 1], ["FU", 2, [0, 1, 2, 3]], ["SP", 2, 0, 1680, [28], 1], ["AN", 2, 0, 5], ["AN", 2, 1, 6]]]], "r": [[6.51016e-06], 0, 1.35113, 1718942060], "v": "v0.6"}
{"i": [["[\"asin_cos\", 7, 5, 12, 4]", "cuda -keys=cuda,gpu -arch=sm_80 -max_num_threads=1024 -thread_warp_size=32", [-1, 16, 64, 49152, 2147483647, 1024, 8, 32], "", 0, []], [[], [["CI", 1], ["FU", 2, [0, 1, 2, 3]], ["SP", 2, 0, 1680, [5], 1], ["AN", 2, 0, 5], ["AN", 2, 1, 6]]]], "r": [[7.17224e-06], 0, 1.15741, 1718942060], "v": "v0.6"}
{"i": [["[\"asin_cos\", 7, 5, 12, 4]", "cuda -keys=cuda,gpu -arch=sm_80 -max_num_threads=1024 -thread_warp_size=32", [-1, 16, 64, 49152, 2147483647, 1024, 8, 32], "", 0, []], [[], [["CI", 1], ["FU", 2, [0, 1, 2, 3]], ["SP", 2, 0, 1680, [40], 1], ["AN", 2, 0, 5], ["AN", 2, 1, 6]]]], "r": [[6.76993e-06], 0, 1.29437, 1718942060], "v": "v0.6"}
{"i": [["[\"asin_cos\", 7, 5, 12, 4]", "cuda -keys=cuda,gpu -arch=sm_80 -max_num_threads=1024 -thread_warp_size=32", [-1, 16, 64, 49152, 2147483647, 1024, 8, 32], "", 0, []], [[], [["CI", 1], ["FU", 2, [0, 1, 2, 3]], ["SP", 2, 0, 1680, [8], 1], ["AN", 2, 0, 5], ["AN", 2, 1, 6]]]], "r": [[6.04854e-06], 0, 1.30927, 1718942061], "v": "v0.6"}
{"i": [["[\"asin_cos\", 7, 5, 12, 4]", "cuda -keys=cuda,gpu -arch=sm_80 -max_num_threads=1024 -thread_warp_size=32", [-1, 16, 64, 49152, 2147483647, 1024, 8, 32], "", 0, []], [[], [["CI", 1], ["FU", 2, [0, 1, 2, 3]], ["SP", 2, 0, 1680, [7], 1], ["AN", 2, 0, 5], ["AN", 2, 1, 6]]]], "r": [[6.51325e-06], 0, 0.999922, 1718942061], "v": "v0.6"}
{"i": [["[\"asin_cos\", 7, 5, 12, 4]", "cuda -keys=cuda,gpu -arch=sm_80 -max_num_threads=1024 -thread_warp_size=32", [-1, 16, 64, 49152, 2147483647, 1024, 8, 32], "", 0, []], [[], [["CI", 1], ["FU", 2, [0, 1, 2, 3]], ["SP", 2, 0, 1680, [2], 1], ["AN", 2, 0, 5], ["AN", 2, 1, 6]]]], "r": [[7.25089e-06], 0, 1.14339, 1718942061], "v": "v0.6"}
