code_generation/generate/deprecated/deprecated_with_tvm_dependency/log/cuda/atan_cuda.log
{"i": [["[\"atan\", 18, 6, 11, 8]", "cuda -keys=cuda,gpu -arch=sm_80 -max_num_threads=1024 -thread_warp_size=32", [-1, 16, 64, 49152, 2147483647, 1024, 8, 32], "", 0, []], [[], [["FU", 1, [0, 1, 2, 3]], ["SP", 1, 0, 9504, [18], 1], ["AN", 1, 0, 5], ["AN", 1, 1, 6]]]], "r": [[6.56381e-06], 0, 2.65189, 1718941795], "v": "v0.6"}
{"i": [["[\"atan\", 18, 6, 11, 8]", "cuda -keys=cuda,gpu -arch=sm_80 -max_num_threads=1024 -thread_warp_size=32", [-1, 16, 64, 49152, 2147483647, 1024, 8, 32], "", 0, []], [[], [["FU", 1, [0, 1, 2, 3]], ["SP", 1, 0, 9504, [9], 1], ["AN", 1, 0, 5], ["AN", 1, 1, 6]]]], "r": [[7.57969e-06], 0, 1.46965, 1718941796], "v": "v0.6"}
{"i": [["[\"atan\", 18, 6, 11, 8]", "cuda -keys=cuda,gpu -arch=sm_80 -max_num_threads=1024 -thread_warp_size=32", [-1, 16, 64, 49152, 2147483647, 1024, 8, 32], "", 0, []], [[], [["FU", 1, [0, 1, 2, 3]], ["SP", 1, 0, 9504, [1], 1], ["AN", 1, 0, 5], ["AN", 1, 1, 6]]]], "r": [[2.17608e-05], 0, 0.807991, 1718941796], "v": "v0.6"}
{"i": [["[\"atan\", 18, 6, 11, 8]", "cuda -keys=cuda,gpu -arch=sm_80 -max_num_threads=1024 -thread_warp_size=32", [-1, 16, 64, 49152, 2147483647, 1024, 8, 32], "", 0, []], [[], [["FU", 1, [0, 1, 2, 3]], ["SP", 1, 0, 9504, [11], 1], ["AN", 1, 0, 5], ["AN", 1, 1, 6]]]], "r": [[7.70917e-06], 0, 1.22858, 1718941796], "v": "v0.6"}
{"i": [["[\"atan\", 18, 6, 11, 8]", "cuda -keys=cuda,gpu -arch=sm_80 -max_num_threads=1024 -thread_warp_size=32", [-1, 16, 64, 49152, 2147483647, 1024, 8, 32], "", 0, []], [[], [["FU", 1, [0, 1, 2, 3]], ["SP", 1, 0, 9504, [48], 1], ["AN", 1, 0, 5], ["AN", 1, 1, 6]]]], "r": [[9.10073e-06], 0, 1.37673, 1718941797], "v": "v0.6"}
{"i": [["[\"atan\", 18, 6, 11, 8]", "cuda -keys=cuda,gpu -arch=sm_80 -max_num_threads=1024 -thread_warp_size=32", [-1, 16, 64, 49152, 2147483647, 1024, 8, 32], "", 0, []], [[], [["FU", 1, [0, 1, 2, 3]], ["SP", 1, 0, 9504, [32], 1], ["AN", 1, 0, 5], ["AN", 1, 1, 6]]]], "r": [[7.1396e-06], 0, 1.38882, 1718941797], "v": "v0.6"}
{"i": [["[\"atan\", 18, 6, 11, 8]", "cuda -keys=cuda,gpu -arch=sm_80 -max_num_threads=1024 -thread_warp_size=32", [-1, 16, 64, 49152, 2147483647, 1024, 8, 32], "", 0, []], [[], [["FU", 1, [0, 1, 2, 3]], ["SP", 1, 0, 9504, [36], 1], ["AN", 1, 0, 5], ["AN", 1, 1, 6]]]], "r": [[7.073e-06], 0, 1.41342, 1718941797], "v": "v0.6"}
{"i": [["[\"atan\", 18, 6, 11, 8]", "cuda -keys=cuda,gpu -arch=sm_80 -max_num_threads=1024 -thread_warp_size=32", [-1, 16, 64, 49152, 2147483647, 1024, 8, 32], "", 0, []], [[], [["FU", 1, [0, 1, 2, 3]], ["SP", 1, 0, 9504, [22], 1], ["AN", 1, 0, 5], ["AN", 1, 1, 6]]]], "r": [[6.30675e-06], 0, 1.46793, 1718941798], "v": "v0.6"}
{"i": [["[\"atan\", 18, 6, 11, 8]", "cuda -keys=cuda,gpu -arch=sm_80 -max_num_threads=1024 -thread_warp_size=32", [-1, 16, 64, 49152, 2147483647, 1024, 8, 32], "", 0, []], [[], [["FU", 1, [0, 1, 2, 3]], ["SP", 1, 0, 9504, [2], 1], ["AN", 1, 0, 5], ["AN", 1, 1, 6]]]], "r": [[1.40286e-05], 0, 1.16915, 1718941798], "v": "v0.6"}
{"i": [["[\"atan\", 18, 6, 11, 8]", "cuda -keys=cuda,gpu -arch=sm_80 -max_num_threads=1024 -thread_warp_size=32", [-1, 16, 64, 49152, 2147483647, 1024, 8, 32], "", 0, []], [[], [["FU", 1, [0, 1, 2, 3]], ["SP", 1, 0, 9504, [8], 1], ["AN", 1, 0, 5], ["AN", 1, 1, 6]]]], "r": [[7.69837e-06], 0, 1.55211, 1718941798], "v": "v0.6"}
