code_generation/generate/deprecated/deprecated_with_tvm_dependency/log/cuda/atanh_cuda.log
{"i": [["[\"atanh\", 17, 9, 7, 19]", "cuda -keys=cuda,gpu -arch=sm_80 -max_num_threads=1024 -thread_warp_size=32", [-1, 16, 64, 49152, 2147483647, 1024, 8, 32], "", 0, []], [[], [["FU", 1, [0, 1, 2, 3]], ["SP", 1, 0, 20349, [21], 1], ["AN", 1, 0, 5], ["AN", 1, 1, 6]]]], "r": [[7.28602e-06], 0, 1.22843, 1718943614], "v": "v0.6"}
{"i": [["[\"atanh\", 17, 9, 7, 19]", "cuda -keys=cuda,gpu -arch=sm_80 -max_num_threads=1024 -thread_warp_size=32", [-1, 16, 64, 49152, 2147483647, 1024, 8, 32], "", 0, []], [[], [["FU", 1, [0, 1, 2, 3]], ["SP", 1, 0, 20349, [63], 1], ["AN", 1, 0, 5], ["AN", 1, 1, 6]]]], "r": [[6.24571e-06], 0, 1.04492, 1718943615], "v": "v0.6"}
{"i": [["[\"atanh\", 17, 9, 7, 19]", "cuda -keys=cuda,gpu -arch=sm_80 -max_num_threads=1024 -thread_warp_size=32", [-1, 16, 64, 49152, 2147483647, 1024, 8, 32], "", 0, []], [[], [["FU", 1, [0, 1, 2, 3]], ["SP", 1, 0, 20349, [4], 1], ["AN", 1, 0, 5], ["AN", 1, 1, 6]]]], "r": [[1.40841e-05], 0, 0.891435, 1718943615], "v": "v0.6"}
{"i": [["[\"atanh\", 17, 9, 7, 19]", "cuda -keys=cuda,gpu -arch=sm_80 -max_num_threads=1024 -thread_warp_size=32", [-1, 16, 64, 49152, 2147483647, 1024, 8, 32], "", 0, []], [[], [["FU", 1, [0, 1, 2, 3]], ["SP", 1, 0, 20349, [3], 1], ["AN", 1, 0, 5], ["AN", 1, 1, 6]]]], "r": [[1.69838e-05], 0, 1.29767, 1718943615], "v": "v0.6"}
{"i": [["[\"atanh\", 17, 9, 7, 19]", "cuda -keys=cuda,gpu -arch=sm_80 -max_num_threads=1024 -thread_warp_size=32", [-1, 16, 64, 49152, 2147483647, 1024, 8, 32], "", 0, []], [[], [["FU", 1, [0, 1, 2, 3]], ["SP", 1, 0, 20349, [7], 1], ["AN", 1, 0, 5], ["AN", 1, 1, 6]]]], "r": [[1.07225e-05], 0, 1.33147, 1718943616], "v": "v0.6"}
{"i": [["[\"atanh\", 17, 9, 7, 19]", "cuda -keys=cuda,gpu -arch=sm_80 -max_num_threads=1024 -thread_warp_size=32", [-1, 16, 64, 49152, 2147483647, 1024, 8, 32], "", 0, []], [[], [["FU", 1, [0, 1, 2, 3]], ["SP", 1, 0, 20349, [9], 1], ["AN", 1, 0, 5], ["AN", 1, 1, 6]]]], "r": [[9.30911e-06], 0, 0.911114, 1718943616], "v": "v0.6"}
{"i": [["[\"atanh\", 17, 9, 7, 19]", "cuda -keys=cuda,gpu -arch=sm_80 -max_num_threads=1024 -thread_warp_size=32", [-1, 16, 64, 49152, 2147483647, 1024, 8, 32], "", 0, []], [[], [["FU", 1, [0, 1, 2, 3]], ["SP", 1, 0, 20349, [17], 1], ["AN", 1, 0, 5], ["AN", 1, 1, 6]]]], "r": [[1.77873e-05], 0, 1.2308, 1718943617], "v": "v0.6"}
{"i": [["[\"atanh\", 17, 9, 7, 19]", "cuda -keys=cuda,gpu -arch=sm_80 -max_num_threads=1024 -thread_warp_size=32", [-1, 16, 64, 49152, 2147483647, 1024, 8, 32], "", 0, []], [[], [["FU", 1, [0, 1, 2, 3]], ["SP", 1, 0, 20349, [32], 1], ["AN", 1, 0, 5], ["AN", 1, 1, 6]]]], "r": [[6.64154e-06], 0, 0.77354, 1718943617], "v": "v0.6"}
{"i": [["[\"atanh\", 17, 9, 7, 19]", "cuda -keys=cuda,gpu -arch=sm_80 -max_num_threads=1024 -thread_warp_size=32", [-1, 16, 64, 49152, 2147483647, 1024, 8, 32], "", 0, []], [[], [["FU", 1, [0, 1, 2, 3]], ["SP", 1, 0, 20349, [8], 1], ["AN", 1, 0, 5], ["AN", 1, 1, 6]]]], "r": [[9.95627e-06], 0, 1.43533, 1718943617], "v": "v0.6"}
{"i": [["[\"atanh\", 17, 9, 7, 19]", "cuda -keys=cuda,gpu -arch=sm_80 -max_num_threads=1024 -thread_warp_size=32", [-1, 16, 64, 49152, 2147483647, 1024, 8, 32], "", 0, []], [[], [["FU", 1, [0, 1, 2, 3]], ["SP", 1, 0, 20349, [1], 1], ["AN", 1, 0, 5], ["AN", 1, 1, 6]]]], "r": [[3.99877e-05], 0, 1.10878, 1718943618], "v": "v0.6"}
