code_generation/generate/deprecated/deprecated_with_tvm_dependency/log/cuda/batch_norm_cuda.log
{"i": [["[\"batch_norm\", 2, 15, 15, 16]", "cuda -keys=cuda,gpu -arch=sm_80 -max_num_threads=1024 -thread_warp_size=32", [-1, 16, 64, 49152, 2147483647, 1024, 8, 32], "", 0, []], [[], [["CI", 7], ["CI", 6], ["CI", 5], ["CI", 3], ["CI", 2], ["FU", 8, [0, 1, 2, 3]], ["SP", 8, 0, 7200, [6], 1], ["AN", 8, 0, 5], ["AN", 8, 1, 6]]]], "r": [[8.48117e-06], 0, 1.2904, 1718955510], "v": "v0.6"}
{"i": [["[\"batch_norm\", 2, 15, 15, 16]", "cuda -keys=cuda,gpu -arch=sm_80 -max_num_threads=1024 -thread_warp_size=32", [-1, 16, 64, 49152, 2147483647, 1024, 8, 32], "", 0, []], [[], [["CI", 7], ["CI", 6], ["CI", 5], ["CI", 3], ["CI", 2], ["FU", 8, [0, 1, 2, 3]], ["SP", 8, 0, 7200, [1], 1], ["AN", 8, 0, 5], ["AN", 8, 1, 6]]]], "r": [[1.83838e-05], 0, 0.880315, 1718955511], "v": "v0.6"}
{"i": [["[\"batch_norm\", 2, 15, 15, 16]", "cuda -keys=cuda,gpu -arch=sm_80 -max_num_threads=1024 -thread_warp_size=32", [-1, 16, 64, 49152, 2147483647, 1024, 8, 32], "", 0, []], [[], [["CI", 7], ["CI", 6], ["CI", 5], ["CI", 3], ["CI", 2], ["FU", 8, [0, 1, 2, 3]], ["SP", 8, 0, 7200, [2], 1], ["AN", 8, 0, 5], ["AN", 8, 1, 6]]]], "r": [[1.23253e-05], 0, 0.86712, 1718955511], "v": "v0.6"}
{"i": [["[\"batch_norm\", 2, 15, 15, 16]", "cuda -keys=cuda,gpu -arch=sm_80 -max_num_threads=1024 -thread_warp_size=32", [-1, 16, 64, 49152, 2147483647, 1024, 8, 32], "", 0, []], [[], [["CI", 7], ["CI", 6], ["CI", 5], ["CI", 3], ["CI", 2], ["FU", 8, [0, 1, 2, 3]], ["SP", 8, 0, 7200, [20], 1], ["AN", 8, 0, 5], ["AN", 8, 1, 6]]]], "r": [[6.81055e-06], 0, 0.848761, 1718955511], "v": "v0.6"}
{"i": [["[\"batch_norm\", 2, 15, 15, 16]", "cuda -keys=cuda,gpu -arch=sm_80 -max_num_threads=1024 -thread_warp_size=32", [-1, 16, 64, 49152, 2147483647, 1024, 8, 32], "", 0, []], [[], [["CI", 7], ["CI", 6], ["CI", 5], ["CI", 3], ["CI", 2], ["FU", 8, [0, 1, 2, 3]], ["SP", 8, 0, 7200, [50], 1], ["AN", 8, 0, 5], ["AN", 8, 1, 6]]]], "r": [[6.51615e-06], 0, 0.883964, 1718955511], "v": "v0.6"}
{"i": [["[\"batch_norm\", 2, 15, 15, 16]", "cuda -keys=cuda,gpu -arch=sm_80 -max_num_threads=1024 -thread_warp_size=32", [-1, 16, 64, 49152, 2147483647, 1024, 8, 32], "", 0, []], [[], [["CI", 7], ["CI", 6], ["CI", 5], ["CI", 3], ["CI", 2], ["FU", 8, [0, 1, 2, 3]], ["SP", 8, 0, 7200, [3], 1], ["AN", 8, 0, 5], ["AN", 8, 1, 6]]]], "r": [[1.0098e-05], 0, 0.835953, 1718955512], "v": "v0.6"}
{"i": [["[\"batch_norm\", 2, 15, 15, 16]", "cuda -keys=cuda,gpu -arch=sm_80 -max_num_threads=1024 -thread_warp_size=32", [-1, 16, 64, 49152, 2147483647, 1024, 8, 32], "", 0, []], [[], [["CI", 7], ["CI", 6], ["CI", 5], ["CI", 3], ["CI", 2], ["FU", 8, [0, 1, 2, 3]], ["SP", 8, 0, 7200, [60], 1], ["AN", 8, 0, 5], ["AN", 8, 1, 6]]]], "r": [[6.18473e-06], 0, 0.850385, 1718955512], "v": "v0.6"}
{"i": [["[\"batch_norm\", 2, 15, 15, 16]", "cuda -keys=cuda,gpu -arch=sm_80 -max_num_threads=1024 -thread_warp_size=32", [-1, 16, 64, 49152, 2147483647, 1024, 8, 32], "", 0, []], [[], [["CI", 7], ["CI", 6], ["CI", 5], ["CI", 3], ["CI", 2], ["FU", 8, [0, 1, 2, 3]], ["SP", 8, 0, 7200, [5], 1], ["AN", 8, 0, 5], ["AN", 8, 1, 6]]]], "r": [[8.79649e-06], 0, 0.849004, 1718955512], "v": "v0.6"}
{"i": [["[\"batch_norm\", 2, 15, 15, 16]", "cuda -keys=cuda,gpu -arch=sm_80 -max_num_threads=1024 -thread_warp_size=32", [-1, 16, 64, 49152, 2147483647, 1024, 8, 32], "", 0, []], [[], [["CI", 7], ["CI", 6], ["CI", 5], ["CI", 3], ["CI", 2], ["FU", 8, [0, 1, 2, 3]], ["SP", 8, 0, 7200, [25], 1], ["AN", 8, 0, 5], ["AN", 8, 1, 6]]]], "r": [[6.8998e-06], 0, 0.842474, 1718955512], "v": "v0.6"}
{"i": [["[\"batch_norm\", 2, 15, 15, 16]", "cuda -keys=cuda,gpu -arch=sm_80 -max_num_threads=1024 -thread_warp_size=32", [-1, 16, 64, 49152, 2147483647, 1024, 8, 32], "", 0, []], [[], [["CI", 7], ["CI", 6], ["CI", 5], ["CI", 3], ["CI", 2], ["FU", 8, [0, 1, 2, 3]], ["SP", 8, 0, 7200, [15], 1], ["AN", 8, 0, 5], ["AN", 8, 1, 6]]]], "r": [[6.6393e-06], 0, 0.8415, 1718955513], "v": "v0.6"}
