code_generation/generate/deprecated/deprecated_with_tvm_dependency/log/cuda/batch_to_space_nd_cuda.log
{"i": [["[\"batch_to_space_nd\", 15, 12, 6, 8]", "cuda -keys=cuda,gpu -arch=sm_80 -max_num_threads=1024 -thread_warp_size=32", [-1, 16, 64, 49152, 2147483647, 1024, 8, 32], "", 0, []], [[], [["CI", 3], ["CI", 2], ["CI", 1], ["FU", 4, [0, 1, 2, 3]], ["SP", 4, 0, 6912, [48], 1], ["AN", 4, 0, 5], ["AN", 4, 1, 6]]]], "r": [[5.81128e-06], 0, 1.20616, 1718948644], "v": "v0.6"}
{"i": [["[\"batch_to_space_nd\", 15, 12, 6, 8]", "cuda -keys=cuda,gpu -arch=sm_80 -max_num_threads=1024 -thread_warp_size=32", [-1, 16, 64, 49152, 2147483647, 1024, 8, 32], "", 0, []], [[], [["CI", 3], ["CI", 2], ["CI", 1], ["FU", 4, [0, 1, 2, 3]], ["SP", 4, 0, 6912, [3], 1], ["AN", 4, 0, 5], ["AN", 4, 1, 6]]]], "r": [[9.36965e-06], 0, 0.869223, 1718948645], "v": "v0.6"}
{"i": [["[\"batch_to_space_nd\", 15, 12, 6, 8]", "cuda -keys=cuda,gpu -arch=sm_80 -max_num_threads=1024 -thread_warp_size=32", [-1, 16, 64, 49152, 2147483647, 1024, 8, 32], "", 0, []], [[], [["CI", 3], ["CI", 2], ["CI", 1], ["FU", 4, [0, 1, 2, 3]], ["SP", 4, 0, 6912, [8], 1], ["AN", 4, 0, 5], ["AN", 4, 1, 6]]]], "r": [[6.99145e-06], 0, 0.841189, 1718948645], "v": "v0.6"}
{"i": [["[\"batch_to_space_nd\", 15, 12, 6, 8]", "cuda -keys=cuda,gpu -arch=sm_80 -max_num_threads=1024 -thread_warp_size=32", [-1, 16, 64, 49152, 2147483647, 1024, 8, 32], "", 0, []], [[], [["CI", 3], ["CI", 2], ["CI", 1], ["FU", 4, [0, 1, 2, 3]], ["SP", 4, 0, 6912, [16], 1], ["AN", 4, 0, 5], ["AN", 4, 1, 6]]]], "r": [[5.99729e-06], 0, 0.844678, 1718948645], "v": "v0.6"}
{"i": [["[\"batch_to_space_nd\", 15, 12, 6, 8]", "cuda -keys=cuda,gpu -arch=sm_80 -max_num_threads=1024 -thread_warp_size=32", [-1, 16, 64, 49152, 2147483647, 1024, 8, 32], "", 0, []], [[], [["CI", 3], ["CI", 2], ["CI", 1], ["FU", 4, [0, 1, 2, 3]], ["SP", 4, 0, 6912, [36], 1], ["AN", 4, 0, 5], ["AN", 4, 1, 6]]]], "r": [[6.16547e-06], 0, 0.825726, 1718948645], "v": "v0.6"}
{"i": [["[\"batch_to_space_nd\", 15, 12, 6, 8]", "cuda -keys=cuda,gpu -arch=sm_80 -max_num_threads=1024 -thread_warp_size=32", [-1, 16, 64, 49152, 2147483647, 1024, 8, 32], "", 0, []], [[], [["CI", 3], ["CI", 2], ["CI", 1], ["FU", 4, [0, 1, 2, 3]], ["SP", 4, 0, 6912, [6], 1], ["AN", 4, 0, 5], ["AN", 4, 1, 6]]]], "r": [[7.30667e-06], 0, 0.797826, 1718948646], "v": "v0.6"}
{"i": [["[\"batch_to_space_nd\", 15, 12, 6, 8]", "cuda -keys=cuda,gpu -arch=sm_80 -max_num_threads=1024 -thread_warp_size=32", [-1, 16, 64, 49152, 2147483647, 1024, 8, 32], "", 0, []], [[], [["CI", 3], ["CI", 2], ["CI", 1], ["FU", 4, [0, 1, 2, 3]], ["SP", 4, 0, 6912, [27], 1], ["AN", 4, 0, 5], ["AN", 4, 1, 6]]]], "r": [[6.87749e-06], 0, 0.901236, 1718948646], "v": "v0.6"}
{"i": [["[\"batch_to_space_nd\", 15, 12, 6, 8]", "cuda -keys=cuda,gpu -arch=sm_80 -max_num_threads=1024 -thread_warp_size=32", [-1, 16, 64, 49152, 2147483647, 1024, 8, 32], "", 0, []], [[], [["CI", 3], ["CI", 2], ["CI", 1], ["FU", 4, [0, 1, 2, 3]], ["SP", 4, 0, 6912, [54], 1], ["AN", 4, 0, 5], ["AN", 4, 1, 6]]]], "r": [[6.16585e-06], 0, 0.861997, 1718948646], "v": "v0.6"}
{"i": [["[\"batch_to_space_nd\", 15, 12, 6, 8]", "cuda -keys=cuda,gpu -arch=sm_80 -max_num_threads=1024 -thread_warp_size=32", [-1, 16, 64, 49152, 2147483647, 1024, 8, 32], "", 0, []], [[], [["CI", 3], ["CI", 2], ["CI", 1], ["FU", 4, [0, 1, 2, 3]], ["SP", 4, 0, 6912, [24], 1], ["AN", 4, 0, 5], ["AN", 4, 1, 6]]]], "r": [[5.86282e-06], 0, 0.781708, 1718948646], "v": "v0.6"}
{"i": [["[\"batch_to_space_nd\", 15, 12, 6, 8]", "cuda -keys=cuda,gpu -arch=sm_80 -max_num_threads=1024 -thread_warp_size=32", [-1, 16, 64, 49152, 2147483647, 1024, 8, 32], "", 0, []], [[], [["CI", 3], ["CI", 2], ["CI", 1], ["FU", 4, [0, 1, 2, 3]], ["SP", 4, 0, 6912, [32], 1], ["AN", 4, 0, 5], ["AN", 4, 1, 6]]]], "r": [[6.19611e-06], 0, 0.83628, 1718948647], "v": "v0.6"}
