code_generation/generate/deprecated/deprecated_with_tvm_dependency/log/cuda/ceil_cuda.log
{"i": [["[\"ceil\", 3, 10, 2, 10]", "cuda -keys=cuda,gpu -arch=sm_80 -max_num_threads=1024 -thread_warp_size=32", [-1, 16, 64, 49152, 2147483647, 1024, 8, 32], "", 0, []], [[], [["FU", 1, [0, 1, 2, 3]], ["SP", 1, 0, 600, [4], 1], ["AN", 1, 0, 5], ["AN", 1, 1, 6]]]], "r": [[5.95002e-06], 0, 1.8349, 1718944294], "v": "v0.6"}
{"i": [["[\"ceil\", 3, 10, 2, 10]", "cuda -keys=cuda,gpu -arch=sm_80 -max_num_threads=1024 -thread_warp_size=32", [-1, 16, 64, 49152, 2147483647, 1024, 8, 32], "", 0, []], [[], [["FU", 1, [0, 1, 2, 3]], ["SP", 1, 0, 600, [1], 1], ["AN", 1, 0, 5], ["AN", 1, 1, 6]]]], "r": [[6.97359e-06], 0, 1.20047, 1718944294], "v": "v0.6"}
{"i": [["[\"ceil\", 3, 10, 2, 10]", "cuda -keys=cuda,gpu -arch=sm_80 -max_num_threads=1024 -thread_warp_size=32", [-1, 16, 64, 49152, 2147483647, 1024, 8, 32], "", 0, []], [[], [["FU", 1, [0, 1, 2, 3]], ["SP", 1, 0, 600, [5], 1], ["AN", 1, 0, 5], ["AN", 1, 1, 6]]]], "r": [[5.8653e-06], 0, 0.882603, 1718944295], "v": "v0.6"}
{"i": [["[\"ceil\", 3, 10, 2, 10]", "cuda -keys=cuda,gpu -arch=sm_80 -max_num_threads=1024 -thread_warp_size=32", [-1, 16, 64, 49152, 2147483647, 1024, 8, 32], "", 0, []], [[], [["FU", 1, [0, 1, 2, 3]], ["SP", 1, 0, 600, [16], 1], ["AN", 1, 0, 5], ["AN", 1, 1, 6]]]], "r": [[8.16717e-06], 0, 1.41547, 1718944295], "v": "v0.6"}
{"i": [["[\"ceil\", 3, 10, 2, 10]", "cuda -keys=cuda,gpu -arch=sm_80 -max_num_threads=1024 -thread_warp_size=32", [-1, 16, 64, 49152, 2147483647, 1024, 8, 32], "", 0, []], [[], [["FU", 1, [0, 1, 2, 3]], ["SP", 1, 0, 600, [12], 1], ["AN", 1, 0, 5], ["AN", 1, 1, 6]]]], "r": [[6.95024e-06], 0, 1.18463, 1718944295], "v": "v0.6"}
{"i": [["[\"ceil\", 3, 10, 2, 10]", "cuda -keys=cuda,gpu -arch=sm_80 -max_num_threads=1024 -thread_warp_size=32", [-1, 16, 64, 49152, 2147483647, 1024, 8, 32], "", 0, []], [[], [["FU", 1, [0, 1, 2, 3]], ["SP", 1, 0, 600, [30], 1], ["AN", 1, 0, 5], ["AN", 1, 1, 6]]]], "r": [[5.43133e-06], 0, 0.976604, 1718944296], "v": "v0.6"}
{"i": [["[\"ceil\", 3, 10, 2, 10]", "cuda -keys=cuda,gpu -arch=sm_80 -max_num_threads=1024 -thread_warp_size=32", [-1, 16, 64, 49152, 2147483647, 1024, 8, 32], "", 0, []], [[], [["FU", 1, [0, 1, 2, 3]], ["SP", 1, 0, 600, [15], 1], ["AN", 1, 0, 5], ["AN", 1, 1, 6]]]], "r": [[5.3576e-06], 0, 1.30981, 1718944296], "v": "v0.6"}
{"i": [["[\"ceil\", 3, 10, 2, 10]", "cuda -keys=cuda,gpu -arch=sm_80 -max_num_threads=1024 -thread_warp_size=32", [-1, 16, 64, 49152, 2147483647, 1024, 8, 32], "", 0, []], [[], [["FU", 1, [0, 1, 2, 3]], ["SP", 1, 0, 600, [3], 1], ["AN", 1, 0, 5], ["AN", 1, 1, 6]]]], "r": [[6.20679e-06], 0, 1.2671, 1718944296], "v": "v0.6"}
{"i": [["[\"ceil\", 3, 10, 2, 10]", "cuda -keys=cuda,gpu -arch=sm_80 -max_num_threads=1024 -thread_warp_size=32", [-1, 16, 64, 49152, 2147483647, 1024, 8, 32], "", 0, []], [[], [["FU", 1, [0, 1, 2, 3]], ["SP", 1, 0, 600, [8], 1], ["AN", 1, 0, 5], ["AN", 1, 1, 6]]]], "r": [[6.49325e-06], 0, 1.61369, 1718944297], "v": "v0.6"}
{"i": [["[\"ceil\", 3, 10, 2, 10]", "cuda -keys=cuda,gpu -arch=sm_80 -max_num_threads=1024 -thread_warp_size=32", [-1, 16, 64, 49152, 2147483647, 1024, 8, 32], "", 0, []], [[], [["FU", 1, [0, 1, 2, 3]], ["SP", 1, 0, 600, [64], 1], ["AN", 1, 0, 5], ["AN", 1, 1, 6]]]], "r": [[8.50346e-06], 0, 1.21377, 1718944297], "v": "v0.6"}
