code_generation/generate/deprecated/deprecated_with_tvm_dependency/log/cuda/combination_op_cuda.log
{"i": [["[\"combination_op\", 17, 13, 17, 20]", "cuda -keys=cuda,gpu -arch=sm_80 -max_num_threads=1024 -thread_warp_size=32", [-1, 16, 64, 49152, 2147483647, 1024, 8, 32], "", 0, []], [[], [["CI", 3], ["CI", 1], ["FU", 4, [0, 1, 2, 3]], ["SP", 4, 0, 75140, [1], 1], ["AN", 4, 0, 5], ["AN", 4, 1, 6]]]], "r": [[0.000130749], 0, 0.970517, 1719823042], "v": "v0.6"}
{"i": [["[\"combination_op\", 17, 13, 17, 20]", "cuda -keys=cuda,gpu -arch=sm_80 -max_num_threads=1024 -thread_warp_size=32", [-1, 16, 64, 49152, 2147483647, 1024, 8, 32], "", 0, []], [[], [["CI", 3], ["CI", 1], ["FU", 4, [0, 1, 2, 3]], ["SP", 4, 0, 75140, [26], 1], ["AN", 4, 0, 5], ["AN", 4, 1, 6]]]], "r": [[1.15824e-05], 0, 0.555913, 1719823043], "v": "v0.6"}
{"i": [["[\"combination_op\", 17, 13, 17, 20]", "cuda -keys=cuda,gpu -arch=sm_80 -max_num_threads=1024 -thread_warp_size=32", [-1, 16, 64, 49152, 2147483647, 1024, 8, 32], "", 0, []], [[], [["CI", 3], ["CI", 1], ["FU", 4, [0, 1, 2, 3]], ["SP", 4, 0, 75140, [10], 1], ["AN", 4, 0, 5], ["AN", 4, 1, 6]]]], "r": [[1.88912e-05], 0, 0.568335, 1719823043], "v": "v0.6"}
{"i": [["[\"combination_op\", 17, 13, 17, 20]", "cuda -keys=cuda,gpu -arch=sm_80 -max_num_threads=1024 -thread_warp_size=32", [-1, 16, 64, 49152, 2147483647, 1024, 8, 32], "", 0, []], [[], [["CI", 3], ["CI", 1], ["FU", 4, [0, 1, 2, 3]], ["SP", 4, 0, 75140, [2], 1], ["AN", 4, 0, 5], ["AN", 4, 1, 6]]]], "r": [[7.27151e-05], 0, 0.638877, 1719823043], "v": "v0.6"}
{"i": [["[\"combination_op\", 17, 13, 17, 20]", "cuda -keys=cuda,gpu -arch=sm_80 -max_num_threads=1024 -thread_warp_size=32", [-1, 16, 64, 49152, 2147483647, 1024, 8, 32], "", 0, []], [[], [["CI", 3], ["CI", 1], ["FU", 4, [0, 1, 2, 3]], ["SP", 4, 0, 75140, [16], 1], ["AN", 4, 0, 5], ["AN", 4, 1, 6]]]], "r": [[1.51812e-05], 0, 0.543749, 1719823043], "v": "v0.6"}
{"i": [["[\"combination_op\", 17, 13, 17, 20]", "cuda -keys=cuda,gpu -arch=sm_80 -max_num_threads=1024 -thread_warp_size=32", [-1, 16, 64, 49152, 2147483647, 1024, 8, 32], "", 0, []], [[], [["CI", 3], ["CI", 1], ["FU", 4, [0, 1, 2, 3]], ["SP", 4, 0, 75140, [4], 1], ["AN", 4, 0, 5], ["AN", 4, 1, 6]]]], "r": [[3.8146e-05], 0, 0.56885, 1719823044], "v": "v0.6"}
{"i": [["[\"combination_op\", 17, 13, 17, 20]", "cuda -keys=cuda,gpu -arch=sm_80 -max_num_threads=1024 -thread_warp_size=32", [-1, 16, 64, 49152, 2147483647, 1024, 8, 32], "", 0, []], [[], [["CI", 3], ["CI", 1], ["FU", 4, [0, 1, 2, 3]], ["SP", 4, 0, 75140, [8], 1], ["AN", 4, 0, 5], ["AN", 4, 1, 6]]]], "r": [[2.23887e-05], 0, 0.578514, 1719823044], "v": "v0.6"}
{"i": [["[\"combination_op\", 17, 13, 17, 20]", "cuda -keys=cuda,gpu -arch=sm_80 -max_num_threads=1024 -thread_warp_size=32", [-1, 16, 64, 49152, 2147483647, 1024, 8, 32], "", 0, []], [[], [["CI", 3], ["CI", 1], ["FU", 4, [0, 1, 2, 3]], ["SP", 4, 0, 75140, [64], 1], ["AN", 4, 0, 5], ["AN", 4, 1, 6]]]], "r": [[8.04441e-06], 0, 0.529797, 1719823044], "v": "v0.6"}
{"i": [["[\"combination_op\", 17, 13, 17, 20]", "cuda -keys=cuda,gpu -arch=sm_80 -max_num_threads=1024 -thread_warp_size=32", [-1, 16, 64, 49152, 2147483647, 1024, 8, 32], "", 0, []], [[], [["CI", 3], ["CI", 1], ["FU", 4, [0, 1, 2, 3]], ["SP", 4, 0, 75140, [20], 1], ["AN", 4, 0, 5], ["AN", 4, 1, 6]]]], "r": [[1.27761e-05], 0, 0.596542, 1719823044], "v": "v0.6"}
{"i": [["[\"combination_op\", 17, 13, 17, 20]", "cuda -keys=cuda,gpu -arch=sm_80 -max_num_threads=1024 -thread_warp_size=32", [-1, 16, 64, 49152, 2147483647, 1024, 8, 32], "", 0, []], [[], [["CI", 3], ["CI", 1], ["FU", 4, [0, 1, 2, 3]], ["SP", 4, 0, 75140, [52], 1], ["AN", 4, 0, 5], ["AN", 4, 1, 6]]]], "r": [[8.58528e-06], 0, 0.573315, 1719823045], "v": "v0.6"}
