code_generation/generate/deprecated/deprecated_with_tvm_dependency/log/cuda/concatenate_cuda.log
{"i": [["[\"concatenate\", 16, 10, 8, 12]", "cuda -keys=cuda,gpu -arch=sm_80 -max_num_threads=1024 -thread_warp_size=32", [-1, 16, 64, 49152, 2147483647, 1024, 8, 32], "", 0, []], [[], [["FU", 2, [0, 1, 2]], ["SP", 2, 0, 2560, [40], 1], ["AN", 2, 0, 5], ["AN", 2, 1, 6]]]], "r": [[5.84718e-06], 0, 1.46866, 1718949805], "v": "v0.6"}
{"i": [["[\"concatenate\", 16, 10, 8, 12]", "cuda -keys=cuda,gpu -arch=sm_80 -max_num_threads=1024 -thread_warp_size=32", [-1, 16, 64, 49152, 2147483647, 1024, 8, 32], "", 0, []], [[], [["FU", 2, [0, 1, 2]], ["SP", 2, 0, 2560, [16], 1], ["AN", 2, 0, 5], ["AN", 2, 1, 6]]]], "r": [[5.67111e-06], 0, 0.953975, 1718949806], "v": "v0.6"}
{"i": [["[\"concatenate\", 16, 10, 8, 12]", "cuda -keys=cuda,gpu -arch=sm_80 -max_num_threads=1024 -thread_warp_size=32", [-1, 16, 64, 49152, 2147483647, 1024, 8, 32], "", 0, []], [[], [["FU", 2, [0, 1, 2]], ["SP", 2, 0, 2560, [8], 1], ["AN", 2, 0, 5], ["AN", 2, 1, 6]]]], "r": [[6.3933e-06], 0, 1.0705, 1718949806], "v": "v0.6"}
{"i": [["[\"concatenate\", 16, 10, 8, 12]", "cuda -keys=cuda,gpu -arch=sm_80 -max_num_threads=1024 -thread_warp_size=32", [-1, 16, 64, 49152, 2147483647, 1024, 8, 32], "", 0, []], [[], [["FU", 2, [0, 1, 2]], ["SP", 2, 0, 2560, [20], 1], ["AN", 2, 0, 5], ["AN", 2, 1, 6]]]], "r": [[5.71106e-06], 0, 0.82293, 1718949806], "v": "v0.6"}
{"i": [["[\"concatenate\", 16, 10, 8, 12]", "cuda -keys=cuda,gpu -arch=sm_80 -max_num_threads=1024 -thread_warp_size=32", [-1, 16, 64, 49152, 2147483647, 1024, 8, 32], "", 0, []], [[], [["FU", 2, [0, 1, 2]], ["SP", 2, 0, 2560, [2], 1], ["AN", 2, 0, 5], ["AN", 2, 1, 6]]]], "r": [[8.01606e-06], 0, 0.986305, 1718949806], "v": "v0.6"}
{"i": [["[\"concatenate\", 16, 10, 8, 12]", "cuda -keys=cuda,gpu -arch=sm_80 -max_num_threads=1024 -thread_warp_size=32", [-1, 16, 64, 49152, 2147483647, 1024, 8, 32], "", 0, []], [[], [["FU", 2, [0, 1, 2]], ["SP", 2, 0, 2560, [32], 1], ["AN", 2, 0, 5], ["AN", 2, 1, 6]]]], "r": [[5.81946e-06], 0, 0.809273, 1718949807], "v": "v0.6"}
{"i": [["[\"concatenate\", 16, 10, 8, 12]", "cuda -keys=cuda,gpu -arch=sm_80 -max_num_threads=1024 -thread_warp_size=32", [-1, 16, 64, 49152, 2147483647, 1024, 8, 32], "", 0, []], [[], [["FU", 2, [0, 1, 2]], ["SP", 2, 0, 2560, [64], 1], ["AN", 2, 0, 5], ["AN", 2, 1, 6]]]], "r": [[7.10575e-06], 0, 0.979029, 1718949807], "v": "v0.6"}
{"i": [["[\"concatenate\", 16, 10, 8, 12]", "cuda -keys=cuda,gpu -arch=sm_80 -max_num_threads=1024 -thread_warp_size=32", [-1, 16, 64, 49152, 2147483647, 1024, 8, 32], "", 0, []], [[], [["FU", 2, [0, 1, 2]], ["SP", 2, 0, 2560, [10], 1], ["AN", 2, 0, 5], ["AN", 2, 1, 6]]]], "r": [[5.97499e-06], 0, 0.991895, 1718949807], "v": "v0.6"}
{"i": [["[\"concatenate\", 16, 10, 8, 12]", "cuda -keys=cuda,gpu -arch=sm_80 -max_num_threads=1024 -thread_warp_size=32", [-1, 16, 64, 49152, 2147483647, 1024, 8, 32], "", 0, []], [[], [["FU", 2, [0, 1, 2]], ["SP", 2, 0, 2560, [4], 1], ["AN", 2, 0, 5], ["AN", 2, 1, 6]]]], "r": [[6.9327e-06], 0, 0.996452, 1718949808], "v": "v0.6"}
{"i": [["[\"concatenate\", 16, 10, 8, 12]", "cuda -keys=cuda,gpu -arch=sm_80 -max_num_threads=1024 -thread_warp_size=32", [-1, 16, 64, 49152, 2147483647, 1024, 8, 32], "", 0, []], [[], [["FU", 2, [0, 1, 2]], ["SP", 2, 0, 2560, [5], 1], ["AN", 2, 0, 5], ["AN", 2, 1, 6]]]], "r": [[7.50285e-06], 0, 1.04573, 1718949808], "v": "v0.6"}
