code_generation/generate/deprecated/deprecated_with_tvm_dependency/log/cuda/conv1d_cuda.log
{"i": [["[\"conv1d\", 15, 15, 2, 60, 70, 19, 9, [2, 1], [1, 1]]", "cuda -keys=cuda,gpu -arch=sm_80 -max_num_threads=1024 -thread_warp_size=32", [-1, 16, 64, 49152, 2147483647, 1024, 8, 32], "", 0, []], [[], [["CHW", 3, "local"], ["SP", 3, 0, 2, [1, 2, 1, 1], 1], ["SP", 3, 5, 5, [1, 1, 1, 5], 1], ["SP", 3, 10, 4, [1, 1, 2, 2], 1], ["SP", 3, 15, 3, [3, 1], 1], ["SP", 3, 18, 3, [1, 1], 1], ["RE", 3, [0, 5, 10, 1, 6, 11, 2, 7, 12, 15, 18, 16, 19, 3, 8, 13, 17, 20, 4, 9, 14]], ["FSP", 4, 0, 1, 3], ["FSP", 4, 4, 2, 3], ["FSP", 4, 8, 3, 3], ["RE", 4, [0, 4, 8, 1, 5, 9, 2, 6, 10, 3, 7, 11]], ["CA", 3, 4, 8], ["CHR", 2, "shared", [3]], ["CA", 3, 4, 10], ["CHR", 1, "shared", [4]], ["CA", 2, 5, 10], ["CI", 1], ["FU", 6, [0, 1, 2]], ["AN", 6, 0, 5], ["FU", 6, [1, 2, 3]], ["AN", 6, 1, 4], ["FU", 6, [2, 3, 4]], ["AN", 6, 2, 6], ["FU", 4, [0, 1, 2]], ["SP", 4, 0, 3, [1], 1], ["AN", 4, 1, 2], ["FFSP", 4, 0, [3, 2, 1], 1, 1], ["AN", 4, 1, 6], ["FU", 2, [0, 1, 2]], ["SP", 2, 0, 9, [1], 1], ["AN", 2, 1, 2], ["FFSP", 2, 0, [3, 2, 1], 1, 1], ["AN", 2, 1, 6], ["PR", 5, 0, "auto_unroll_max_step$16"]]]], "r": [[7.56973e-06], 0, 1.70582, 1718955936], "v": "v0.6"}
{"i": [["[\"conv1d\", 15, 15, 2, 60, 70, 19, 9, [2, 1], [1, 1]]", "cuda -keys=cuda,gpu -arch=sm_80 -max_num_threads=1024 -thread_warp_size=32", [-1, 16, 64, 49152, 2147483647, 1024, 8, 32], "", 0, []], [[], [["CHW", 3, "local"], ["SP", 3, 0, 2, [1, 1, 1, 1], 1], ["SP", 3, 5, 5, [1, 1, 5, 1], 1], ["SP", 3, 10, 4, [1, 1, 2, 1], 1], ["SP", 3, 15, 3, [1, 3], 1], ["SP", 3, 18, 3, [1, 3], 1], ["RE", 3, [0, 5, 10, 1, 6, 11, 2, 7, 12, 15, 18, 16, 19, 3, 8, 13, 17, 20, 4, 9, 14]], ["FSP", 4, 0, 1, 3], ["FSP", 4, 4, 2, 3], ["FSP", 4, 8, 3, 3], ["RE", 4, [0, 4, 8, 1, 5, 9, 2, 6, 10, 3, 7, 11]], ["CA", 3, 4, 8], ["CHR", 2, "shared", [3]], ["CA", 3, 4, 10], ["CHR", 1, "shared", [4]], ["CA", 2, 5, 10], ["CI", 1], ["FU", 6, [0, 1, 2]], ["AN", 6, 0, 5], ["FU", 6, [1, 2, 3]], ["AN", 6, 1, 4], ["FU", 6, [2, 3, 4]], ["AN", 6, 2, 6], ["FU", 4, [0, 1, 2]], ["SP", 4, 0, 45, [1], 1], ["AN", 4, 1, 2], ["FFSP", 4, 0, [3, 2, 1], 1, 1], ["AN", 4, 1, 6], ["FU", 2, [0, 1, 2]], ["SP", 2, 0, 15, [3], 1], ["AN", 2, 1, 2], ["FFSP", 2, 0, [3, 2, 1], 1, 1], ["AN", 2, 1, 6], ["PR", 5, 0, "auto_unroll_max_step$64"]]]], "r": [[6.41699e-06], 0, 1.21911, 1718955937], "v": "v0.6"}
{"i": [["[\"conv1d\", 15, 15, 2, 60, 70, 19, 9, [2, 1], [1, 1]]", "cuda -keys=cuda,gpu -arch=sm_80 -max_num_threads=1024 -thread_warp_size=32", [-1, 16, 64, 49152, 2147483647, 1024, 8, 32], "", 0, []], [[], [["CHW", 3, "local"], ["SP", 3, 0, 2, [1, 1, 1, 2], 1], ["SP", 3, 5, 5, [5, 1, 1, 1], 1], ["SP", 3, 10, 4, [2, 1, 2, 1], 1], ["SP", 3, 15, 3, [1, 3], 1], ["SP", 3, 18, 3, [1, 3], 1], ["RE", 3, [0, 5, 10, 1, 6, 11, 2, 7, 12, 15, 18, 16, 19, 3, 8, 13, 17, 20, 4, 9, 14]], ["FSP", 4, 0, 1, 3], ["FSP", 4, 4, 2, 3], ["FSP", 4, 8, 3, 3], ["RE", 4, [0, 4, 8, 1, 5, 9, 2, 6, 10, 3, 7, 11]], ["CA", 3, 4, 8], ["CHR", 2, "shared", [3]], ["CA", 3, 4, 10], ["CHR", 1, "shared", [4]], ["CA", 2, 5, 10], ["CI", 1], ["FU", 6, [0, 1, 2]], ["AN", 6, 0, 5], ["FU", 6, [1, 2, 3]], ["AN", 6, 1, 4], ["FU", 6, [2, 3, 4]], ["AN", 6, 2, 6], ["FU", 4, [0, 1, 2]], ["SP", 4, 0, 15, [3], 1], ["AN", 4, 1, 2], ["FFSP", 4, 0, [3, 2, 1], 1, 1], ["AN", 4, 1, 6], ["FU", 2, [0, 1, 2]], ["SP", 2, 0, 18, [1], 1], ["AN", 2, 1, 2], ["FFSP", 2, 0, [3, 2, 1], 1, 1], ["AN", 2, 1, 6], ["PR", 5, 0, "auto_unroll_max_step$1024"]]]], "r": [[7.56627e-06], 0, 1.54394, 1718955937], "v": "v0.6"}
{"i": [["[\"conv1d\", 15, 15, 2, 60, 70, 19, 9, [2, 1], [1, 1]]", "cuda -keys=cuda,gpu -arch=sm_80 -max_num_threads=1024 -thread_warp_size=32", [-1, 16, 64, 49152, 2147483647, 1024, 8, 32], "", 0, []], [[], [["CHW", 3, "local"], ["SP", 3, 0, 2, [1, 1, 2, 1], 1], ["SP", 3, 5, 5, [5, 1, 1, 1], 1], ["SP", 3, 10, 4, [1, 2, 2, 1], 1], ["SP", 3, 15, 3, [3, 1], 1], ["SP", 3, 18, 3, [3, 1], 1], ["RE", 3, [0, 5, 10, 1, 6, 11, 2, 7, 12, 15, 18, 16, 19, 3, 8, 13, 17, 20, 4, 9, 14]], ["FSP", 4, 0, 1, 3], ["FSP", 4, 4, 2, 3], ["FSP", 4, 8, 3, 3], ["RE", 4, [0, 4, 8, 1, 5, 9, 2, 6, 10, 3, 7, 11]], ["CA", 3, 4, 8], ["CHR", 2, "shared", [3]], ["CA", 3, 4, 10], ["CHR", 1, "shared", [4]], ["CA", 2, 5, 10], ["CI", 1], ["FU", 6, [0, 1, 2]], ["AN", 6, 0, 5], ["FU", 6, [1, 2, 3]], ["AN", 6, 1, 4], ["FU", 6, [2, 3, 4]], ["AN", 6, 2, 6], ["FU", 4, [0, 1, 2]], ["SP", 4, 0, 9, [1], 1], ["AN", 4, 1, 2], ["FFSP", 4, 0, [3, 2, 1], 1, 1], ["AN", 4, 1, 6], ["FU", 2, [0, 1, 2]], ["SP", 2, 0, 30, [1], 1], ["AN", 2, 1, 2], ["FFSP", 2, 0, [3, 2, 1], 1, 1], ["AN", 2, 1, 6], ["PR", 5, 0, "auto_unroll_max_step$1024"]]]], "r": [[6.98945e-06], 0, 1.51118, 1718955937], "v": "v0.6"}
{"i": [["[\"conv1d\", 15, 15, 2, 60, 70, 19, 9, [2, 1], [1, 1]]", "cuda -keys=cuda,gpu -arch=sm_80 -max_num_threads=1024 -thread_warp_size=32", [-1, 16, 64, 49152, 2147483647, 1024, 8, 32], "", 0, []], [[], [["CHW", 3, "local"], ["SP", 3, 0, 2, [1, 2, 1, 1], 1], ["SP", 3, 5, 5, [1, 5, 1, 1], 1], ["SP", 3, 10, 4, [1, 1, 1, 2], 1], ["SP", 3, 15, 3, [1, 3], 1], ["SP", 3, 18, 3, [1, 3], 1], ["RE", 3, [0, 5, 10, 1, 6, 11, 2, 7, 12, 15, 18, 16, 19, 3, 8, 13, 17, 20, 4, 9, 14]], ["FSP", 4, 0, 1, 3], ["FSP", 4, 4, 2, 3], ["FSP", 4, 8, 3, 3], ["RE", 4, [0, 4, 8, 1, 5, 9, 2, 6, 10, 3, 7, 11]], ["CA", 3, 4, 8], ["CHR", 2, "shared", [3]], ["CA", 3, 4, 10], ["CHR", 1, "shared", [4]], ["CA", 2, 5, 10], ["CI", 1], ["FU", 6, [0, 1, 2]], ["AN", 6, 0, 5], ["FU", 6, [1, 2, 3]], ["AN", 6, 1, 4], ["FU", 6, [2, 3, 4]], ["AN", 6, 2, 6], ["FU", 4, [0, 1, 2]], ["SP", 4, 0, 3, [3], 1], ["AN", 4, 1, 2], ["FFSP", 4, 0, [3, 2, 1], 1, 1], ["AN", 4, 1, 6], ["FU", 2, [0, 1, 2]], ["SP", 2, 0, 5, [1], 1], ["AN", 2, 1, 2], ["FFSP", 2, 0, [3, 2, 1], 1, 1], ["AN", 2, 1, 6], ["PR", 5, 0, "auto_unroll_max_step$0"]]]], "r": [[5.71605e-06], 0, 1.16082, 1718955937], "v": "v0.6"}
{"i": [["[\"conv1d\", 15, 15, 2, 60, 70, 19, 9, [2, 1], [1, 1]]", "cuda -keys=cuda,gpu -arch=sm_80 -max_num_threads=1024 -thread_warp_size=32", [-1, 16, 64, 49152, 2147483647, 1024, 8, 32], "", 0, []], [[], [["CHW", 3, "local"], ["SP", 3, 0, 2, [1, 1, 1, 2], 1], ["SP", 3, 5, 5, [1, 1, 1, 1], 1], ["SP", 3, 10, 4, [1, 1, 1, 4], 1], ["SP", 3, 15, 3, [1, 1], 1], ["SP", 3, 18, 3, [1, 1], 1], ["RE", 3, [0, 5, 10, 1, 6, 11, 2, 7, 12, 15, 18, 16, 19, 3, 8, 13, 17, 20, 4, 9, 14]], ["FSP", 4, 0, 1, 3], ["FSP", 4, 4, 2, 3], ["FSP", 4, 8, 3, 3], ["RE", 4, [0, 4, 8, 1, 5, 9, 2, 6, 10, 3, 7, 11]], ["CA", 3, 4, 8], ["CHR", 2, "shared", [3]], ["CA", 3, 4, 10], ["CHR", 1, "shared", [4]], ["CA", 2, 5, 10], ["CI", 1], ["FU", 6, [0, 1, 2]], ["AN", 6, 0, 5], ["FU", 6, [1, 2, 3]], ["AN", 6, 1, 4], ["FU", 6, [2, 3, 4]], ["AN", 6, 2, 6], ["FU", 4, [0, 1, 2]], ["SP", 4, 0, 3, [1], 1], ["AN", 4, 1, 2], ["FFSP", 4, 0, [3, 2, 1], 1, 1], ["AN", 4, 1, 6], ["FU", 2, [0, 1, 2]], ["SP", 2, 0, 6, [1], 1], ["AN", 2, 1, 2], ["FFSP", 2, 0, [3, 2, 1], 1, 1], ["AN", 2, 1, 6], ["PR", 5, 0, "auto_unroll_max_step$512"]]]], "r": [[7.96915e-06], 0, 1.18596, 1718955938], "v": "v0.6"}
{"i": [["[\"conv1d\", 15, 15, 2, 60, 70, 19, 9, [2, 1], [1, 1]]", "cuda -keys=cuda,gpu -arch=sm_80 -max_num_threads=1024 -thread_warp_size=32", [-1, 16, 64, 49152, 2147483647, 1024, 8, 32], "", 0, []], [[], [["CHW", 3, "local"], ["SP", 3, 0, 2, [1, 1, 2, 1], 1], ["SP", 3, 5, 5, [1, 1, 1, 1], 1], ["SP", 3, 10, 4, [1, 1, 2, 1], 1], ["SP", 3, 15, 3, [3, 1], 1], ["SP", 3, 18, 3, [3, 1], 1], ["RE", 3, [0, 5, 10, 1, 6, 11, 2, 7, 12, 15, 18, 16, 19, 3, 8, 13, 17, 20, 4, 9, 14]], ["FSP", 4, 0, 1, 3], ["FSP", 4, 4, 2, 3], ["FSP", 4, 8, 3, 3], ["RE", 4, [0, 4, 8, 1, 5, 9, 2, 6, 10, 3, 7, 11]], ["CA", 3, 4, 8], ["CHR", 2, "shared", [3]], ["CA", 3, 4, 10], ["CHR", 1, "shared", [4]], ["CA", 2, 5, 10], ["CI", 1], ["FU", 6, [0, 1, 2]], ["AN", 6, 0, 5], ["FU", 6, [1, 2, 3]], ["AN", 6, 1, 4], ["FU", 6, [2, 3, 4]], ["AN", 6, 2, 6], ["FU", 4, [0, 1, 2]], ["SP", 4, 0, 9, [1], 1], ["AN", 4, 1, 2], ["FFSP", 4, 0, [3, 2, 1], 1, 1], ["AN", 4, 1, 6], ["FU", 2, [0, 1, 2]], ["SP", 2, 0, 30, [1], 1], ["AN", 2, 1, 2], ["FFSP", 2, 0, [3, 2, 1], 1, 1], ["AN", 2, 1, 6], ["PR", 5, 0, "auto_unroll_max_step$0"]]]], "r": [[6.21157e-06], 0, 1.14527, 1718955938], "v": "v0.6"}
{"i": [["[\"conv1d\", 15, 15, 2, 60, 70, 19, 9, [2, 1], [1, 1]]", "cuda -keys=cuda,gpu -arch=sm_80 -max_num_threads=1024 -thread_warp_size=32", [-1, 16, 64, 49152, 2147483647, 1024, 8, 32], "", 0, []], [[], [["CHW", 3, "local"], ["SP", 3, 0, 2, [2, 1, 1, 1], 1], ["SP", 3, 5, 5, [1, 1, 1, 5], 1], ["SP", 3, 10, 4, [1, 2, 2, 1], 1], ["SP", 3, 15, 3, [1, 3], 1], ["SP", 3, 18, 3, [3, 1], 1], ["RE", 3, [0, 5, 10, 1, 6, 11, 2, 7, 12, 15, 18, 16, 19, 3, 8, 13, 17, 20, 4, 9, 14]], ["FSP", 4, 0, 1, 3], ["FSP", 4, 4, 2, 3], ["FSP", 4, 8, 3, 3], ["RE", 4, [0, 4, 8, 1, 5, 9, 2, 6, 10, 3, 7, 11]], ["CA", 3, 4, 8], ["CHR", 2, "shared", [3]], ["CA", 3, 4, 10], ["CHR", 1, "shared", [4]], ["CA", 2, 5, 10], ["CI", 1], ["FU", 6, [0, 1, 2]], ["AN", 6, 0, 5], ["FU", 6, [1, 2, 3]], ["AN", 6, 1, 4], ["FU", 6, [2, 3, 4]], ["AN", 6, 2, 6], ["FU", 4, [0, 1, 2]], ["SP", 4, 0, 45, [3], 1], ["AN", 4, 1, 2], ["FFSP", 4, 0, [3, 2, 1], 1, 1], ["AN", 4, 1, 6], ["FU", 2, [0, 1, 2]], ["SP", 2, 0, 15, [1], 1], ["AN", 2, 1, 2], ["FFSP", 2, 0, [3, 2, 1], 1, 1], ["AN", 2, 1, 6], ["PR", 5, 0, "auto_unroll_max_step$16"]]]], "r": [[7.07982e-06], 0, 1.26756, 1718955938], "v": "v0.6"}
{"i": [["[\"conv1d\", 15, 15, 2, 60, 70, 19, 9, [2, 1], [1, 1]]", "cuda -keys=cuda,gpu -arch=sm_80 -max_num_threads=1024 -thread_warp_size=32", [-1, 16, 64, 49152, 2147483647, 1024, 8, 32], "", 0, []], [[], [["CHW", 3, "local"], ["SP", 3, 0, 2, [1, 1, 1, 2], 1], ["SP", 3, 5, 5, [5, 1, 1, 1], 1], ["SP", 3, 10, 4, [1, 4, 1, 1], 1], ["SP", 3, 15, 3, [1, 1], 1], ["SP", 3, 18, 3, [1, 3], 1], ["RE", 3, [0, 5, 10, 1, 6, 11, 2, 7, 12, 15, 18, 16, 19, 3, 8, 13, 17, 20, 4, 9, 14]], ["FSP", 4, 0, 1, 3], ["FSP", 4, 4, 2, 3], ["FSP", 4, 8, 3, 3], ["RE", 4, [0, 4, 8, 1, 5, 9, 2, 6, 10, 3, 7, 11]], ["CA", 3, 4, 8], ["CHR", 2, "shared", [3]], ["CA", 3, 4, 10], ["CHR", 1, "shared", [4]], ["CA", 2, 5, 10], ["CI", 1], ["FU", 6, [0, 1, 2]], ["AN", 6, 0, 5], ["FU", 6, [1, 2, 3]], ["AN", 6, 1, 4], ["FU", 6, [2, 3, 4]], ["AN", 6, 2, 6], ["FU", 4, [0, 1, 2]], ["SP", 4, 0, 3, [1], 1], ["AN", 4, 1, 2], ["FFSP", 4, 0, [3, 2, 1], 1, 1], ["AN", 4, 1, 6], ["FU", 2, [0, 1, 2]], ["SP", 2, 0, 6, [1], 1], ["AN", 2, 1, 2], ["FFSP", 2, 0, [3, 2, 1], 1, 1], ["AN", 2, 1, 6], ["PR", 5, 0, "auto_unroll_max_step$0"]]]], "r": [[6.62725e-06], 0, 1.20748, 1718955938], "v": "v0.6"}
{"i": [["[\"conv1d\", 15, 15, 2, 60, 70, 19, 9, [2, 1], [1, 1]]", "cuda -keys=cuda,gpu -arch=sm_80 -max_num_threads=1024 -thread_warp_size=32", [-1, 16, 64, 49152, 2147483647, 1024, 8, 32], "", 0, []], [[], [["CHW", 3, "local"], ["SP", 3, 0, 2, [1, 2, 1, 1], 1], ["SP", 3, 5, 5, [1, 5, 1, 1], 1], ["SP", 3, 10, 4, [1, 2, 1, 1], 1], ["SP", 3, 15, 3, [1, 1], 1], ["SP", 3, 18, 3, [1, 3], 1], ["RE", 3, [0, 5, 10, 1, 6, 11, 2, 7, 12, 15, 18, 16, 19, 3, 8, 13, 17, 20, 4, 9, 14]], ["FSP", 4, 0, 1, 3], ["FSP", 4, 4, 2, 3], ["FSP", 4, 8, 3, 3], ["RE", 4, [0, 4, 8, 1, 5, 9, 2, 6, 10, 3, 7, 11]], ["CA", 3, 4, 8], ["CHR", 2, "shared", [3]], ["CA", 3, 4, 10], ["CHR", 1, "shared", [4]], ["CA", 2, 5, 10], ["CI", 1], ["FU", 6, [0, 1, 2]], ["AN", 6, 0, 5], ["FU", 6, [1, 2, 3]], ["AN", 6, 1, 4], ["FU", 6, [2, 3, 4]], ["AN", 6, 2, 6], ["FU", 4, [0, 1, 2]], ["SP", 4, 0, 9, [1], 1], ["AN", 4, 1, 2], ["FFSP", 4, 0, [3, 2, 1], 1, 1], ["AN", 4, 1, 6], ["FU", 2, [0, 1, 2]], ["SP", 2, 0, 9, [1], 1], ["AN", 2, 1, 2], ["FFSP", 2, 0, [3, 2, 1], 1, 1], ["AN", 2, 1, 6], ["PR", 5, 0, "auto_unroll_max_step$0"]]]], "r": [[5.66377e-06], 0, 1.14282, 1718955939], "v": "v0.6"}
