code_generation/generate/deprecated/deprecated_with_tvm_dependency/log/cuda/cos_cuda.log
{"i": [["[\"cos\", 16, 6, 15, 20]", "cuda -keys=cuda,gpu -arch=sm_80 -max_num_threads=1024 -thread_warp_size=32", [-1, 16, 64, 49152, 2147483647, 1024, 8, 32], "", 0, []], [[], [["FU", 1, [0, 1, 2, 3]], ["SP", 1, 0, 28800, [15], 1], ["AN", 1, 0, 5], ["AN", 1, 1, 6]]]], "r": [[8.5722e-06], 0, 1.66976, 1718941584], "v": "v0.6"}
{"i": [["[\"cos\", 16, 6, 15, 20]", "cuda -keys=cuda,gpu -arch=sm_80 -max_num_threads=1024 -thread_warp_size=32", [-1, 16, 64, 49152, 2147483647, 1024, 8, 32], "", 0, []], [[], [["FU", 1, [0, 1, 2, 3]], ["SP", 1, 0, 28800, [25], 1], ["AN", 1, 0, 5], ["AN", 1, 1, 6]]]], "r": [[7.17045e-06], 0, 1.0691, 1718941584], "v": "v0.6"}
{"i": [["[\"cos\", 16, 6, 15, 20]", "cuda -keys=cuda,gpu -arch=sm_80 -max_num_threads=1024 -thread_warp_size=32", [-1, 16, 64, 49152, 2147483647, 1024, 8, 32], "", 0, []], [[], [["FU", 1, [0, 1, 2, 3]], ["SP", 1, 0, 28800, [16], 1], ["AN", 1, 0, 5], ["AN", 1, 1, 6]]]], "r": [[8.28667e-06], 0, 1.23336, 1718941585], "v": "v0.6"}
{"i": [["[\"cos\", 16, 6, 15, 20]", "cuda -keys=cuda,gpu -arch=sm_80 -max_num_threads=1024 -thread_warp_size=32", [-1, 16, 64, 49152, 2147483647, 1024, 8, 32], "", 0, []], [[], [["FU", 1, [0, 1, 2, 3]], ["SP", 1, 0, 28800, [64], 1], ["AN", 1, 0, 5], ["AN", 1, 1, 6]]]], "r": [[6.15418e-06], 0, 1.29652, 1718941585], "v": "v0.6"}
{"i": [["[\"cos\", 16, 6, 15, 20]", "cuda -keys=cuda,gpu -arch=sm_80 -max_num_threads=1024 -thread_warp_size=32", [-1, 16, 64, 49152, 2147483647, 1024, 8, 32], "", 0, []], [[], [["FU", 1, [0, 1, 2, 3]], ["SP", 1, 0, 28800, [4], 1], ["AN", 1, 0, 5], ["AN", 1, 1, 6]]]], "r": [[1.73996e-05], 0, 1.33183, 1718941585], "v": "v0.6"}
{"i": [["[\"cos\", 16, 6, 15, 20]", "cuda -keys=cuda,gpu -arch=sm_80 -max_num_threads=1024 -thread_warp_size=32", [-1, 16, 64, 49152, 2147483647, 1024, 8, 32], "", 0, []], [[], [["FU", 1, [0, 1, 2, 3]], ["SP", 1, 0, 28800, [40], 1], ["AN", 1, 0, 5], ["AN", 1, 1, 6]]]], "r": [[7.76855e-06], 0, 1.30543, 1718941585], "v": "v0.6"}
{"i": [["[\"cos\", 16, 6, 15, 20]", "cuda -keys=cuda,gpu -arch=sm_80 -max_num_threads=1024 -thread_warp_size=32", [-1, 16, 64, 49152, 2147483647, 1024, 8, 32], "", 0, []], [[], [["FU", 1, [0, 1, 2, 3]], ["SP", 1, 0, 28800, [8], 1], ["AN", 1, 0, 5], ["AN", 1, 1, 6]]]], "r": [[1.14936e-05], 0, 1.33853, 1718941586], "v": "v0.6"}
{"i": [["[\"cos\", 16, 6, 15, 20]", "cuda -keys=cuda,gpu -arch=sm_80 -max_num_threads=1024 -thread_warp_size=32", [-1, 16, 64, 49152, 2147483647, 1024, 8, 32], "", 0, []], [[], [["FU", 1, [0, 1, 2, 3]], ["SP", 1, 0, 28800, [18], 1], ["AN", 1, 0, 5], ["AN", 1, 1, 6]]]], "r": [[8.19765e-06], 0, 1.49604, 1718941586], "v": "v0.6"}
{"i": [["[\"cos\", 16, 6, 15, 20]", "cuda -keys=cuda,gpu -arch=sm_80 -max_num_threads=1024 -thread_warp_size=32", [-1, 16, 64, 49152, 2147483647, 1024, 8, 32], "", 0, []], [[], [["FU", 1, [0, 1, 2, 3]], ["SP", 1, 0, 28800, [10], 1], ["AN", 1, 0, 5], ["AN", 1, 1, 6]]]], "r": [[1.00979e-05], 0, 1.24573, 1718941586], "v": "v0.6"}
{"i": [["[\"cos\", 16, 6, 15, 20]", "cuda -keys=cuda,gpu -arch=sm_80 -max_num_threads=1024 -thread_warp_size=32", [-1, 16, 64, 49152, 2147483647, 1024, 8, 32], "", 0, []], [[], [["FU", 1, [0, 1, 2, 3]], ["SP", 1, 0, 28800, [36], 1], ["AN", 1, 0, 5], ["AN", 1, 1, 6]]]], "r": [[7.05791e-06], 0, 1.2912, 1718941587], "v": "v0.6"}
