code_generation/generate/deprecated/deprecated_with_tvm_dependency/log/cuda/cosh_cuda.log
{"i": [["[\"cosh\", 3, 12, 20, 8]", "cuda -keys=cuda,gpu -arch=sm_80 -max_num_threads=1024 -thread_warp_size=32", [-1, 16, 64, 49152, 2147483647, 1024, 8, 32], "", 0, []], [[], [["FU", 1, [0, 1, 2, 3]], ["SP", 1, 0, 5760, [60], 1], ["AN", 1, 0, 5], ["AN", 1, 1, 6]]]], "r": [[5.81971e-06], 0, 1.98375, 1718942588], "v": "v0.6"}
{"i": [["[\"cosh\", 3, 12, 20, 8]", "cuda -keys=cuda,gpu -arch=sm_80 -max_num_threads=1024 -thread_warp_size=32", [-1, 16, 64, 49152, 2147483647, 1024, 8, 32], "", 0, []], [[], [["FU", 1, [0, 1, 2, 3]], ["SP", 1, 0, 5760, [32], 1], ["AN", 1, 0, 5], ["AN", 1, 1, 6]]]], "r": [[6.01067e-06], 0, 1.2814, 1718942588], "v": "v0.6"}
{"i": [["[\"cosh\", 3, 12, 20, 8]", "cuda -keys=cuda,gpu -arch=sm_80 -max_num_threads=1024 -thread_warp_size=32", [-1, 16, 64, 49152, 2147483647, 1024, 8, 32], "", 0, []], [[], [["FU", 1, [0, 1, 2, 3]], ["SP", 1, 0, 5760, [64], 1], ["AN", 1, 0, 5], ["AN", 1, 1, 6]]]], "r": [[7.76931e-06], 0, 1.55391, 1718942588], "v": "v0.6"}
{"i": [["[\"cosh\", 3, 12, 20, 8]", "cuda -keys=cuda,gpu -arch=sm_80 -max_num_threads=1024 -thread_warp_size=32", [-1, 16, 64, 49152, 2147483647, 1024, 8, 32], "", 0, []], [[], [["FU", 1, [0, 1, 2, 3]], ["SP", 1, 0, 5760, [40], 1], ["AN", 1, 0, 5], ["AN", 1, 1, 6]]]], "r": [[6.39039e-06], 0, 1.3112, 1718942589], "v": "v0.6"}
{"i": [["[\"cosh\", 3, 12, 20, 8]", "cuda -keys=cuda,gpu -arch=sm_80 -max_num_threads=1024 -thread_warp_size=32", [-1, 16, 64, 49152, 2147483647, 1024, 8, 32], "", 0, []], [[], [["FU", 1, [0, 1, 2, 3]], ["SP", 1, 0, 5760, [6], 1], ["AN", 1, 0, 5], ["AN", 1, 1, 6]]]], "r": [[7.3825e-06], 0, 1.09557, 1718942589], "v": "v0.6"}
{"i": [["[\"cosh\", 3, 12, 20, 8]", "cuda -keys=cuda,gpu -arch=sm_80 -max_num_threads=1024 -thread_warp_size=32", [-1, 16, 64, 49152, 2147483647, 1024, 8, 32], "", 0, []], [[], [["FU", 1, [0, 1, 2, 3]], ["SP", 1, 0, 5760, [18], 1], ["AN", 1, 0, 5], ["AN", 1, 1, 6]]]], "r": [[5.94813e-06], 0, 1.50628, 1718942589], "v": "v0.6"}
{"i": [["[\"cosh\", 3, 12, 20, 8]", "cuda -keys=cuda,gpu -arch=sm_80 -max_num_threads=1024 -thread_warp_size=32", [-1, 16, 64, 49152, 2147483647, 1024, 8, 32], "", 0, []], [[], [["FU", 1, [0, 1, 2, 3]], ["SP", 1, 0, 5760, [5], 1], ["AN", 1, 0, 5], ["AN", 1, 1, 6]]]], "r": [[7.46135e-06], 0, 1.11247, 1718942590], "v": "v0.6"}
{"i": [["[\"cosh\", 3, 12, 20, 8]", "cuda -keys=cuda,gpu -arch=sm_80 -max_num_threads=1024 -thread_warp_size=32", [-1, 16, 64, 49152, 2147483647, 1024, 8, 32], "", 0, []], [[], [["FU", 1, [0, 1, 2, 3]], ["SP", 1, 0, 5760, [3], 1], ["AN", 1, 0, 5], ["AN", 1, 1, 6]]]], "r": [[9.26163e-06], 0, 1.2741, 1718942590], "v": "v0.6"}
{"i": [["[\"cosh\", 3, 12, 20, 8]", "cuda -keys=cuda,gpu -arch=sm_80 -max_num_threads=1024 -thread_warp_size=32", [-1, 16, 64, 49152, 2147483647, 1024, 8, 32], "", 0, []], [[], [["FU", 1, [0, 1, 2, 3]], ["SP", 1, 0, 5760, [15], 1], ["AN", 1, 0, 5], ["AN", 1, 1, 6]]]], "r": [[6.00643e-06], 0, 1.38463, 1718942590], "v": "v0.6"}
{"i": [["[\"cosh\", 3, 12, 20, 8]", "cuda -keys=cuda,gpu -arch=sm_80 -max_num_threads=1024 -thread_warp_size=32", [-1, 16, 64, 49152, 2147483647, 1024, 8, 32], "", 0, []], [[], [["FU", 1, [0, 1, 2, 3]], ["SP", 1, 0, 5760, [1], 1], ["AN", 1, 0, 5], ["AN", 1, 1, 6]]]], "r": [[1.53746e-05], 0, 1.27134, 1718942591], "v": "v0.6"}
