code_generation/generate/deprecated/deprecated_with_tvm_dependency/log/cuda/depth_to_space_cuda.log
{"i": [["[\"depth_to_space\", 12, 19, 5, 17]", "cuda -keys=cuda,gpu -arch=sm_80 -max_num_threads=1024 -thread_warp_size=32", [-1, 16, 64, 49152, 2147483647, 1024, 8, 32], "", 0, []], [[], [["FU", 1, [0, 1, 2, 3]], ["SP", 1, 0, 16320, [15], 1], ["AN", 1, 0, 5], ["AN", 1, 1, 6]]]], "r": [[7.44628e-06], 0, 1.35238, 1718949968], "v": "v0.6"}
{"i": [["[\"depth_to_space\", 12, 19, 5, 17]", "cuda -keys=cuda,gpu -arch=sm_80 -max_num_threads=1024 -thread_warp_size=32", [-1, 16, 64, 49152, 2147483647, 1024, 8, 32], "", 0, []], [[], [["FU", 1, [0, 1, 2, 3]], ["SP", 1, 0, 16320, [6], 1], ["AN", 1, 0, 5], ["AN", 1, 1, 6]]]], "r": [[1.09898e-05], 0, 0.947159, 1718949969], "v": "v0.6"}
{"i": [["[\"depth_to_space\", 12, 19, 5, 17]", "cuda -keys=cuda,gpu -arch=sm_80 -max_num_threads=1024 -thread_warp_size=32", [-1, 16, 64, 49152, 2147483647, 1024, 8, 32], "", 0, []], [[], [["FU", 1, [0, 1, 2, 3]], ["SP", 1, 0, 16320, [40], 1], ["AN", 1, 0, 5], ["AN", 1, 1, 6]]]], "r": [[7.03097e-06], 0, 0.951192, 1718949969], "v": "v0.6"}
{"i": [["[\"depth_to_space\", 12, 19, 5, 17]", "cuda -keys=cuda,gpu -arch=sm_80 -max_num_threads=1024 -thread_warp_size=32", [-1, 16, 64, 49152, 2147483647, 1024, 8, 32], "", 0, []], [[], [["FU", 1, [0, 1, 2, 3]], ["SP", 1, 0, 16320, [60], 1], ["AN", 1, 0, 5], ["AN", 1, 1, 6]]]], "r": [[6.54578e-06], 0, 0.927315, 1718949969], "v": "v0.6"}
{"i": [["[\"depth_to_space\", 12, 19, 5, 17]", "cuda -keys=cuda,gpu -arch=sm_80 -max_num_threads=1024 -thread_warp_size=32", [-1, 16, 64, 49152, 2147483647, 1024, 8, 32], "", 0, []], [[], [["FU", 1, [0, 1, 2, 3]], ["SP", 1, 0, 16320, [24], 1], ["AN", 1, 0, 5], ["AN", 1, 1, 6]]]], "r": [[6.60562e-06], 0, 0.856999, 1718949970], "v": "v0.6"}
{"i": [["[\"depth_to_space\", 12, 19, 5, 17]", "cuda -keys=cuda,gpu -arch=sm_80 -max_num_threads=1024 -thread_warp_size=32", [-1, 16, 64, 49152, 2147483647, 1024, 8, 32], "", 0, []], [[], [["FU", 1, [0, 1, 2, 3]], ["SP", 1, 0, 16320, [64], 1], ["AN", 1, 0, 5], ["AN", 1, 1, 6]]]], "r": [[6.2135e-06], 0, 0.921631, 1718949970], "v": "v0.6"}
{"i": [["[\"depth_to_space\", 12, 19, 5, 17]", "cuda -keys=cuda,gpu -arch=sm_80 -max_num_threads=1024 -thread_warp_size=32", [-1, 16, 64, 49152, 2147483647, 1024, 8, 32], "", 0, []], [[], [["FU", 1, [0, 1, 2, 3]], ["SP", 1, 0, 16320, [30], 1], ["AN", 1, 0, 5], ["AN", 1, 1, 6]]]], "r": [[6.78961e-06], 0, 0.984211, 1718949970], "v": "v0.6"}
{"i": [["[\"depth_to_space\", 12, 19, 5, 17]", "cuda -keys=cuda,gpu -arch=sm_80 -max_num_threads=1024 -thread_warp_size=32", [-1, 16, 64, 49152, 2147483647, 1024, 8, 32], "", 0, []], [[], [["FU", 1, [0, 1, 2, 3]], ["SP", 1, 0, 16320, [5], 1], ["AN", 1, 0, 5], ["AN", 1, 1, 6]]]], "r": [[1.16439e-05], 0, 0.877507, 1718949970], "v": "v0.6"}
{"i": [["[\"depth_to_space\", 12, 19, 5, 17]", "cuda -keys=cuda,gpu -arch=sm_80 -max_num_threads=1024 -thread_warp_size=32", [-1, 16, 64, 49152, 2147483647, 1024, 8, 32], "", 0, []], [[], [["FU", 1, [0, 1, 2, 3]], ["SP", 1, 0, 16320, [3], 1], ["AN", 1, 0, 5], ["AN", 1, 1, 6]]]], "r": [[1.53097e-05], 0, 0.903165, 1718949971], "v": "v0.6"}
{"i": [["[\"depth_to_space\", 12, 19, 5, 17]", "cuda -keys=cuda,gpu -arch=sm_80 -max_num_threads=1024 -thread_warp_size=32", [-1, 16, 64, 49152, 2147483647, 1024, 8, 32], "", 0, []], [[], [["FU", 1, [0, 1, 2, 3]], ["SP", 1, 0, 16320, [20], 1], ["AN", 1, 0, 5], ["AN", 1, 1, 6]]]], "r": [[1.05079e-05], 0, 0.91187, 1718949971], "v": "v0.6"}
