code_generation/generate/deprecated/deprecated_with_tvm_dependency/log/cuda/dilate_cuda.log
{"i": [["[\"dilate\", 8, 17, 16, 4]", "cuda -keys=cuda,gpu -arch=sm_80 -max_num_threads=1024 -thread_warp_size=32", [-1, 16, 64, 49152, 2147483647, 1024, 8, 32], "", 0, []], [[], [["FU", 1, [0, 1, 2, 3]], ["SP", 1, 0, 8704, [17], 1], ["AN", 1, 0, 5], ["AN", 1, 1, 6]]]], "r": [[6.30993e-06], 0, 1.17596, 1718949099], "v": "v0.6"}
{"i": [["[\"dilate\", 8, 17, 16, 4]", "cuda -keys=cuda,gpu -arch=sm_80 -max_num_threads=1024 -thread_warp_size=32", [-1, 16, 64, 49152, 2147483647, 1024, 8, 32], "", 0, []], [[], [["FU", 1, [0, 1, 2, 3]], ["SP", 1, 0, 8704, [32], 1], ["AN", 1, 0, 5], ["AN", 1, 1, 6]]]], "r": [[5.68487e-06], 0, 0.850706, 1718949099], "v": "v0.6"}
{"i": [["[\"dilate\", 8, 17, 16, 4]", "cuda -keys=cuda,gpu -arch=sm_80 -max_num_threads=1024 -thread_warp_size=32", [-1, 16, 64, 49152, 2147483647, 1024, 8, 32], "", 0, []], [[], [["FU", 1, [0, 1, 2, 3]], ["SP", 1, 0, 8704, [64], 1], ["AN", 1, 0, 5], ["AN", 1, 1, 6]]]], "r": [[5.94054e-06], 0, 0.809773, 1718949099], "v": "v0.6"}
{"i": [["[\"dilate\", 8, 17, 16, 4]", "cuda -keys=cuda,gpu -arch=sm_80 -max_num_threads=1024 -thread_warp_size=32", [-1, 16, 64, 49152, 2147483647, 1024, 8, 32], "", 0, []], [[], [["FU", 1, [0, 1, 2, 3]], ["SP", 1, 0, 8704, [8], 1], ["AN", 1, 0, 5], ["AN", 1, 1, 6]]]], "r": [[7.97988e-06], 0, 0.845683, 1718949099], "v": "v0.6"}
{"i": [["[\"dilate\", 8, 17, 16, 4]", "cuda -keys=cuda,gpu -arch=sm_80 -max_num_threads=1024 -thread_warp_size=32", [-1, 16, 64, 49152, 2147483647, 1024, 8, 32], "", 0, []], [[], [["FU", 1, [0, 1, 2, 3]], ["SP", 1, 0, 8704, [2], 1], ["AN", 1, 0, 5], ["AN", 1, 1, 6]]]], "r": [[1.54851e-05], 0, 0.866903, 1718949100], "v": "v0.6"}
{"i": [["[\"dilate\", 8, 17, 16, 4]", "cuda -keys=cuda,gpu -arch=sm_80 -max_num_threads=1024 -thread_warp_size=32", [-1, 16, 64, 49152, 2147483647, 1024, 8, 32], "", 0, []], [[], [["FU", 1, [0, 1, 2, 3]], ["SP", 1, 0, 8704, [1], 1], ["AN", 1, 0, 5], ["AN", 1, 1, 6]]]], "r": [[2.45813e-05], 0, 0.935922, 1718949100], "v": "v0.6"}
{"i": [["[\"dilate\", 8, 17, 16, 4]", "cuda -keys=cuda,gpu -arch=sm_80 -max_num_threads=1024 -thread_warp_size=32", [-1, 16, 64, 49152, 2147483647, 1024, 8, 32], "", 0, []], [[], [["FU", 1, [0, 1, 2, 3]], ["SP", 1, 0, 8704, [4], 1], ["AN", 1, 0, 5], ["AN", 1, 1, 6]]]], "r": [[1.08645e-05], 0, 0.878536, 1718949100], "v": "v0.6"}
{"i": [["[\"dilate\", 8, 17, 16, 4]", "cuda -keys=cuda,gpu -arch=sm_80 -max_num_threads=1024 -thread_warp_size=32", [-1, 16, 64, 49152, 2147483647, 1024, 8, 32], "", 0, []], [[], [["FU", 1, [0, 1, 2, 3]], ["SP", 1, 0, 8704, [16], 1], ["AN", 1, 0, 5], ["AN", 1, 1, 6]]]], "r": [[7.53884e-06], 0, 0.829485, 1718949100], "v": "v0.6"}
{"i": [["[\"dilate\", 8, 17, 16, 4]", "cuda -keys=cuda,gpu -arch=sm_80 -max_num_threads=1024 -thread_warp_size=32", [-1, 16, 64, 49152, 2147483647, 1024, 8, 32], "", 0, []], [[], [["FU", 1, [0, 1, 2, 3]], ["SP", 1, 0, 8704, [34], 1], ["AN", 1, 0, 5], ["AN", 1, 1, 6]]]], "r": [[7.41562e-06], 0, 0.8741, 1718949101], "v": "v0.6"}
