code_generation/generate/deprecated/deprecated_with_tvm_dependency/log/cuda/erf_cuda.log
{"i": [["[\"erf\", 17, 14, 1, 14]", "cuda -keys=cuda,gpu -arch=sm_80 -max_num_threads=1024 -thread_warp_size=32", [-1, 16, 64, 49152, 2147483647, 1024, 8, 32], "", 0, []], [[], [["FU", 1, [0, 1, 2, 3]], ["SP", 1, 0, 3332, [16], 1], ["AN", 1, 0, 5], ["AN", 1, 1, 6]]]], "r": [[5.75826e-06], 0, 1.79492, 1718944637], "v": "v0.6"}
{"i": [["[\"erf\", 17, 14, 1, 14]", "cuda -keys=cuda,gpu -arch=sm_80 -max_num_threads=1024 -thread_warp_size=32", [-1, 16, 64, 49152, 2147483647, 1024, 8, 32], "", 0, []], [[], [["FU", 1, [0, 1, 2, 3]], ["SP", 1, 0, 3332, [34], 1], ["AN", 1, 0, 5], ["AN", 1, 1, 6]]]], "r": [[7.07892e-06], 0, 1.22722, 1718944638], "v": "v0.6"}
{"i": [["[\"erf\", 17, 14, 1, 14]", "cuda -keys=cuda,gpu -arch=sm_80 -max_num_threads=1024 -thread_warp_size=32", [-1, 16, 64, 49152, 2147483647, 1024, 8, 32], "", 0, []], [[], [["FU", 1, [0, 1, 2, 3]], ["SP", 1, 0, 3332, [49], 1], ["AN", 1, 0, 5], ["AN", 1, 1, 6]]]], "r": [[5.31192e-06], 0, 1.01713, 1718944638], "v": "v0.6"}
{"i": [["[\"erf\", 17, 14, 1, 14]", "cuda -keys=cuda,gpu -arch=sm_80 -max_num_threads=1024 -thread_warp_size=32", [-1, 16, 64, 49152, 2147483647, 1024, 8, 32], "", 0, []], [[], [["FU", 1, [0, 1, 2, 3]], ["SP", 1, 0, 3332, [1], 1], ["AN", 1, 0, 5], ["AN", 1, 1, 6]]]], "r": [[1.12195e-05], 0, 1.39625, 1718944638], "v": "v0.6"}
{"i": [["[\"erf\", 17, 14, 1, 14]", "cuda -keys=cuda,gpu -arch=sm_80 -max_num_threads=1024 -thread_warp_size=32", [-1, 16, 64, 49152, 2147483647, 1024, 8, 32], "", 0, []], [[], [["FU", 1, [0, 1, 2, 3]], ["SP", 1, 0, 3332, [7], 1], ["AN", 1, 0, 5], ["AN", 1, 1, 6]]]], "r": [[7.07086e-06], 0, 1.26053, 1718944639], "v": "v0.6"}
{"i": [["[\"erf\", 17, 14, 1, 14]", "cuda -keys=cuda,gpu -arch=sm_80 -max_num_threads=1024 -thread_warp_size=32", [-1, 16, 64, 49152, 2147483647, 1024, 8, 32], "", 0, []], [[], [["FU", 1, [0, 1, 2, 3]], ["SP", 1, 0, 3332, [4], 1], ["AN", 1, 0, 5], ["AN", 1, 1, 6]]]], "r": [[6.74228e-06], 0, 1.31634, 1718944639], "v": "v0.6"}
{"i": [["[\"erf\", 17, 14, 1, 14]", "cuda -keys=cuda,gpu -arch=sm_80 -max_num_threads=1024 -thread_warp_size=32", [-1, 16, 64, 49152, 2147483647, 1024, 8, 32], "", 0, []], [[], [["FU", 1, [0, 1, 2, 3]], ["SP", 1, 0, 3332, [64], 1], ["AN", 1, 0, 5], ["AN", 1, 1, 6]]]], "r": [[6.12223e-06], 0, 1.37239, 1718944639], "v": "v0.6"}
{"i": [["[\"erf\", 17, 14, 1, 14]", "cuda -keys=cuda,gpu -arch=sm_80 -max_num_threads=1024 -thread_warp_size=32", [-1, 16, 64, 49152, 2147483647, 1024, 8, 32], "", 0, []], [[], [["FU", 1, [0, 1, 2, 3]], ["SP", 1, 0, 3332, [32], 1], ["AN", 1, 0, 5], ["AN", 1, 1, 6]]]], "r": [[5.89004e-06], 0, 1.32978, 1718944640], "v": "v0.6"}
{"i": [["[\"erf\", 17, 14, 1, 14]", "cuda -keys=cuda,gpu -arch=sm_80 -max_num_threads=1024 -thread_warp_size=32", [-1, 16, 64, 49152, 2147483647, 1024, 8, 32], "", 0, []], [[], [["FU", 1, [0, 1, 2, 3]], ["SP", 1, 0, 3332, [2], 1], ["AN", 1, 0, 5], ["AN", 1, 1, 6]]]], "r": [[8.29365e-06], 0, 1.21827, 1718944640], "v": "v0.6"}
{"i": [["[\"erf\", 17, 14, 1, 14]", "cuda -keys=cuda,gpu -arch=sm_80 -max_num_threads=1024 -thread_warp_size=32", [-1, 16, 64, 49152, 2147483647, 1024, 8, 32], "", 0, []], [[], [["FU", 1, [0, 1, 2, 3]], ["SP", 1, 0, 3332, [14], 1], ["AN", 1, 0, 5], ["AN", 1, 1, 6]]]], "r": [[6.15327e-06], 0, 1.22809, 1718944640], "v": "v0.6"}
