code_generation/generate/deprecated/deprecated_with_tvm_dependency/log/cuda/exp_cuda.log
{"i": [["[\"exp\", 3, 17, 9, 16]", "cuda -keys=cuda,gpu -arch=sm_80 -max_num_threads=1024 -thread_warp_size=32", [-1, 16, 64, 49152, 2147483647, 1024, 8, 32], "", 0, []], [[], [["FU", 1, [0, 1, 2, 3]], ["SP", 1, 0, 7344, [34], 1], ["AN", 1, 0, 5], ["AN", 1, 1, 6]]]], "r": [[5.72996e-06], 0, 1.55423, 1718945013], "v": "v0.6"}
{"i": [["[\"exp\", 3, 17, 9, 16]", "cuda -keys=cuda,gpu -arch=sm_80 -max_num_threads=1024 -thread_warp_size=32", [-1, 16, 64, 49152, 2147483647, 1024, 8, 32], "", 0, []], [[], [["FU", 1, [0, 1, 2, 3]], ["SP", 1, 0, 7344, [3], 1], ["AN", 1, 0, 5], ["AN", 1, 1, 6]]]], "r": [[9.55658e-06], 0, 1.2067, 1718945013], "v": "v0.6"}
{"i": [["[\"exp\", 3, 17, 9, 16]", "cuda -keys=cuda,gpu -arch=sm_80 -max_num_threads=1024 -thread_warp_size=32", [-1, 16, 64, 49152, 2147483647, 1024, 8, 32], "", 0, []], [[], [["FU", 1, [0, 1, 2, 3]], ["SP", 1, 0, 7344, [16], 1], ["AN", 1, 0, 5], ["AN", 1, 1, 6]]]], "r": [[6.79892e-06], 0, 1.18669, 1718945013], "v": "v0.6"}
{"i": [["[\"exp\", 3, 17, 9, 16]", "cuda -keys=cuda,gpu -arch=sm_80 -max_num_threads=1024 -thread_warp_size=32", [-1, 16, 64, 49152, 2147483647, 1024, 8, 32], "", 0, []], [[], [["FU", 1, [0, 1, 2, 3]], ["SP", 1, 0, 7344, [4], 1], ["AN", 1, 0, 5], ["AN", 1, 1, 6]]]], "r": [[8.68303e-06], 0, 1.19492, 1718945014], "v": "v0.6"}
{"i": [["[\"exp\", 3, 17, 9, 16]", "cuda -keys=cuda,gpu -arch=sm_80 -max_num_threads=1024 -thread_warp_size=32", [-1, 16, 64, 49152, 2147483647, 1024, 8, 32], "", 0, []], [[], [["FU", 1, [0, 1, 2, 3]], ["SP", 1, 0, 7344, [27], 1], ["AN", 1, 0, 5], ["AN", 1, 1, 6]]]], "r": [[6.35249e-06], 0, 1.20786, 1718945014], "v": "v0.6"}
{"i": [["[\"exp\", 3, 17, 9, 16]", "cuda -keys=cuda,gpu -arch=sm_80 -max_num_threads=1024 -thread_warp_size=32", [-1, 16, 64, 49152, 2147483647, 1024, 8, 32], "", 0, []], [[], [["FU", 1, [0, 1, 2, 3]], ["SP", 1, 0, 7344, [54], 1], ["AN", 1, 0, 5], ["AN", 1, 1, 6]]]], "r": [[7.62252e-06], 0, 1.15027, 1718945014], "v": "v0.6"}
{"i": [["[\"exp\", 3, 17, 9, 16]", "cuda -keys=cuda,gpu -arch=sm_80 -max_num_threads=1024 -thread_warp_size=32", [-1, 16, 64, 49152, 2147483647, 1024, 8, 32], "", 0, []], [[], [["FU", 1, [0, 1, 2, 3]], ["SP", 1, 0, 7344, [12], 1], ["AN", 1, 0, 5], ["AN", 1, 1, 6]]]], "r": [[7.20705e-06], 0, 1.30887, 1718945015], "v": "v0.6"}
{"i": [["[\"exp\", 3, 17, 9, 16]", "cuda -keys=cuda,gpu -arch=sm_80 -max_num_threads=1024 -thread_warp_size=32", [-1, 16, 64, 49152, 2147483647, 1024, 8, 32], "", 0, []], [[], [["FU", 1, [0, 1, 2, 3]], ["SP", 1, 0, 7344, [36], 1], ["AN", 1, 0, 5], ["AN", 1, 1, 6]]]], "r": [[7.79427e-06], 0, 1.32651, 1718945015], "v": "v0.6"}
{"i": [["[\"exp\", 3, 17, 9, 16]", "cuda -keys=cuda,gpu -arch=sm_80 -max_num_threads=1024 -thread_warp_size=32", [-1, 16, 64, 49152, 2147483647, 1024, 8, 32], "", 0, []], [[], [["FU", 1, [0, 1, 2, 3]], ["SP", 1, 0, 7344, [1], 1], ["AN", 1, 0, 5], ["AN", 1, 1, 6]]]], "r": [[1.76173e-05], 0, 1.12932, 1718945015], "v": "v0.6"}
{"i": [["[\"exp\", 3, 17, 9, 16]", "cuda -keys=cuda,gpu -arch=sm_80 -max_num_threads=1024 -thread_warp_size=32", [-1, 16, 64, 49152, 2147483647, 1024, 8, 32], "", 0, []], [[], [["FU", 1, [0, 1, 2, 3]], ["SP", 1, 0, 7344, [24], 1], ["AN", 1, 0, 5], ["AN", 1, 1, 6]]]], "r": [[5.69133e-06], 0, 1.27992, 1718945016], "v": "v0.6"}
