code_generation/generate/deprecated/deprecated_with_tvm_dependency/log/cuda/fast_erf_cuda.log
{"i": [["[\"fast_erf\", 18, 4, 14, 17]", "cuda -keys=cuda,gpu -arch=sm_80 -max_num_threads=1024 -thread_warp_size=32", [-1, 16, 64, 49152, 2147483647, 1024, 8, 32], "", 0, []], [[], [["FU", 1, [0, 1, 2, 3]], ["SP", 1, 0, 17136, [51], 1], ["AN", 1, 0, 5], ["AN", 1, 1, 6]]]], "r": [[6.58532e-06], 0, 1.7332, 1718945416], "v": "v0.6"}
{"i": [["[\"fast_erf\", 18, 4, 14, 17]", "cuda -keys=cuda,gpu -arch=sm_80 -max_num_threads=1024 -thread_warp_size=32", [-1, 16, 64, 49152, 2147483647, 1024, 8, 32], "", 0, []], [[], [["FU", 1, [0, 1, 2, 3]], ["SP", 1, 0, 17136, [18], 1], ["AN", 1, 0, 5], ["AN", 1, 1, 6]]]], "r": [[7.53841e-06], 0, 1.34824, 1718945417], "v": "v0.6"}
{"i": [["[\"fast_erf\", 18, 4, 14, 17]", "cuda -keys=cuda,gpu -arch=sm_80 -max_num_threads=1024 -thread_warp_size=32", [-1, 16, 64, 49152, 2147483647, 1024, 8, 32], "", 0, []], [[], [["FU", 1, [0, 1, 2, 3]], ["SP", 1, 0, 17136, [16], 1], ["AN", 1, 0, 5], ["AN", 1, 1, 6]]]], "r": [[8.08988e-06], 0, 1.30307, 1718945417], "v": "v0.6"}
{"i": [["[\"fast_erf\", 18, 4, 14, 17]", "cuda -keys=cuda,gpu -arch=sm_80 -max_num_threads=1024 -thread_warp_size=32", [-1, 16, 64, 49152, 2147483647, 1024, 8, 32], "", 0, []], [[], [["FU", 1, [0, 1, 2, 3]], ["SP", 1, 0, 17136, [14], 1], ["AN", 1, 0, 5], ["AN", 1, 1, 6]]]], "r": [[8.10365e-06], 0, 1.28461, 1718945417], "v": "v0.6"}
{"i": [["[\"fast_erf\", 18, 4, 14, 17]", "cuda -keys=cuda,gpu -arch=sm_80 -max_num_threads=1024 -thread_warp_size=32", [-1, 16, 64, 49152, 2147483647, 1024, 8, 32], "", 0, []], [[], [["FU", 1, [0, 1, 2, 3]], ["SP", 1, 0, 17136, [4], 1], ["AN", 1, 0, 5], ["AN", 1, 1, 6]]]], "r": [[1.30359e-05], 0, 1.02621, 1718945418], "v": "v0.6"}
{"i": [["[\"fast_erf\", 18, 4, 14, 17]", "cuda -keys=cuda,gpu -arch=sm_80 -max_num_threads=1024 -thread_warp_size=32", [-1, 16, 64, 49152, 2147483647, 1024, 8, 32], "", 0, []], [[], [["FU", 1, [0, 1, 2, 3]], ["SP", 1, 0, 17136, [42], 1], ["AN", 1, 0, 5], ["AN", 1, 1, 6]]]], "r": [[7.64274e-06], 0, 1.28608, 1718945418], "v": "v0.6"}
{"i": [["[\"fast_erf\", 18, 4, 14, 17]", "cuda -keys=cuda,gpu -arch=sm_80 -max_num_threads=1024 -thread_warp_size=32", [-1, 16, 64, 49152, 2147483647, 1024, 8, 32], "", 0, []], [[], [["FU", 1, [0, 1, 2, 3]], ["SP", 1, 0, 17136, [36], 1], ["AN", 1, 0, 5], ["AN", 1, 1, 6]]]], "r": [[8.1532e-06], 0, 1.2545, 1718945418], "v": "v0.6"}
{"i": [["[\"fast_erf\", 18, 4, 14, 17]", "cuda -keys=cuda,gpu -arch=sm_80 -max_num_threads=1024 -thread_warp_size=32", [-1, 16, 64, 49152, 2147483647, 1024, 8, 32], "", 0, []], [[], [["FU", 1, [0, 1, 2, 3]], ["SP", 1, 0, 17136, [32], 1], ["AN", 1, 0, 5], ["AN", 1, 1, 6]]]], "r": [[6.98906e-06], 0, 1.24784, 1718945419], "v": "v0.6"}
{"i": [["[\"fast_erf\", 18, 4, 14, 17]", "cuda -keys=cuda,gpu -arch=sm_80 -max_num_threads=1024 -thread_warp_size=32", [-1, 16, 64, 49152, 2147483647, 1024, 8, 32], "", 0, []], [[], [["FU", 1, [0, 1, 2, 3]], ["SP", 1, 0, 17136, [6], 1], ["AN", 1, 0, 5], ["AN", 1, 1, 6]]]], "r": [[1.07624e-05], 0, 1.29574, 1718945419], "v": "v0.6"}
{"i": [["[\"fast_erf\", 18, 4, 14, 17]", "cuda -keys=cuda,gpu -arch=sm_80 -max_num_threads=1024 -thread_warp_size=32", [-1, 16, 64, 49152, 2147483647, 1024, 8, 32], "", 0, []], [[], [["FU", 1, [0, 1, 2, 3]], ["SP", 1, 0, 17136, [48], 1], ["AN", 1, 0, 5], ["AN", 1, 1, 6]]]], "r": [[1.05927e-05], 0, 1.41562, 1718945420], "v": "v0.6"}
