code_generation/generate/deprecated/deprecated_with_tvm_dependency/log/cuda/fast_tanh_cuda.log
{"i": [["[\"fast_tanh\", 19, 3, 7, 5]", "cuda -keys=cuda,gpu -arch=sm_80 -max_num_threads=1024 -thread_warp_size=32", [-1, 16, 64, 49152, 2147483647, 1024, 8, 32], "", 0, []], [[], [["CI", 2], ["CI", 1], ["FU", 3, [0, 1, 2, 3]], ["SP", 3, 0, 1995, [1], 1], ["AN", 3, 0, 5], ["AN", 3, 1, 6]]]], "r": [[9.30715e-06], 0, 1.74828, 1718946184], "v": "v0.6"}
{"i": [["[\"fast_tanh\", 19, 3, 7, 5]", "cuda -keys=cuda,gpu -arch=sm_80 -max_num_threads=1024 -thread_warp_size=32", [-1, 16, 64, 49152, 2147483647, 1024, 8, 32], "", 0, []], [[], [["CI", 2], ["CI", 1], ["FU", 3, [0, 1, 2, 3]], ["SP", 3, 0, 1995, [15], 1], ["AN", 3, 0, 5], ["AN", 3, 1, 6]]]], "r": [[7.96304e-06], 0, 1.31182, 1718946185], "v": "v0.6"}
{"i": [["[\"fast_tanh\", 19, 3, 7, 5]", "cuda -keys=cuda,gpu -arch=sm_80 -max_num_threads=1024 -thread_warp_size=32", [-1, 16, 64, 49152, 2147483647, 1024, 8, 32], "", 0, []], [[], [["CI", 2], ["CI", 1], ["FU", 3, [0, 1, 2, 3]], ["SP", 3, 0, 1995, [8], 1], ["AN", 3, 0, 5], ["AN", 3, 1, 6]]]], "r": [[6.13146e-06], 0, 1.34197, 1718946185], "v": "v0.6"}
{"i": [["[\"fast_tanh\", 19, 3, 7, 5]", "cuda -keys=cuda,gpu -arch=sm_80 -max_num_threads=1024 -thread_warp_size=32", [-1, 16, 64, 49152, 2147483647, 1024, 8, 32], "", 0, []], [[], [["CI", 2], ["CI", 1], ["FU", 3, [0, 1, 2, 3]], ["SP", 3, 0, 1995, [57], 1], ["AN", 3, 0, 5], ["AN", 3, 1, 6]]]], "r": [[5.92555e-06], 0, 1.26602, 1718946185], "v": "v0.6"}
{"i": [["[\"fast_tanh\", 19, 3, 7, 5]", "cuda -keys=cuda,gpu -arch=sm_80 -max_num_threads=1024 -thread_warp_size=32", [-1, 16, 64, 49152, 2147483647, 1024, 8, 32], "", 0, []], [[], [["CI", 2], ["CI", 1], ["FU", 3, [0, 1, 2, 3]], ["SP", 3, 0, 1995, [32], 1], ["AN", 3, 0, 5], ["AN", 3, 1, 6]]]], "r": [[6.4563e-06], 0, 1.19042, 1718946186], "v": "v0.6"}
{"i": [["[\"fast_tanh\", 19, 3, 7, 5]", "cuda -keys=cuda,gpu -arch=sm_80 -max_num_threads=1024 -thread_warp_size=32", [-1, 16, 64, 49152, 2147483647, 1024, 8, 32], "", 0, []], [[], [["CI", 2], ["CI", 1], ["FU", 3, [0, 1, 2, 3]], ["SP", 3, 0, 1995, [16], 1], ["AN", 3, 0, 5], ["AN", 3, 1, 6]]]], "r": [[6.31661e-06], 0, 1.26172, 1718946186], "v": "v0.6"}
{"i": [["[\"fast_tanh\", 19, 3, 7, 5]", "cuda -keys=cuda,gpu -arch=sm_80 -max_num_threads=1024 -thread_warp_size=32", [-1, 16, 64, 49152, 2147483647, 1024, 8, 32], "", 0, []], [[], [["CI", 2], ["CI", 1], ["FU", 3, [0, 1, 2, 3]], ["SP", 3, 0, 1995, [4], 1], ["AN", 3, 0, 5], ["AN", 3, 1, 6]]]], "r": [[8.26115e-06], 0, 1.13186, 1718946186], "v": "v0.6"}
{"i": [["[\"fast_tanh\", 19, 3, 7, 5]", "cuda -keys=cuda,gpu -arch=sm_80 -max_num_threads=1024 -thread_warp_size=32", [-1, 16, 64, 49152, 2147483647, 1024, 8, 32], "", 0, []], [[], [["CI", 2], ["CI", 1], ["FU", 3, [0, 1, 2, 3]], ["SP", 3, 0, 1995, [24], 1], ["AN", 3, 0, 5], ["AN", 3, 1, 6]]]], "r": [[7.85424e-06], 0, 1.23555, 1718946187], "v": "v0.6"}
{"i": [["[\"fast_tanh\", 19, 3, 7, 5]", "cuda -keys=cuda,gpu -arch=sm_80 -max_num_threads=1024 -thread_warp_size=32", [-1, 16, 64, 49152, 2147483647, 1024, 8, 32], "", 0, []], [[], [["CI", 2], ["CI", 1], ["FU", 3, [0, 1, 2, 3]], ["SP", 3, 0, 1995, [5], 1], ["AN", 3, 0, 5], ["AN", 3, 1, 6]]]], "r": [[7.38372e-06], 0, 1.29715, 1718946187], "v": "v0.6"}
{"i": [["[\"fast_tanh\", 19, 3, 7, 5]", "cuda -keys=cuda,gpu -arch=sm_80 -max_num_threads=1024 -thread_warp_size=32", [-1, 16, 64, 49152, 2147483647, 1024, 8, 32], "", 0, []], [[], [["CI", 2], ["CI", 1], ["FU", 3, [0, 1, 2, 3]], ["SP", 3, 0, 1995, [64], 1], ["AN", 3, 0, 5], ["AN", 3, 1, 6]]]], "r": [[7.66861e-06], 0, 1.27276, 1718946187], "v": "v0.6"}
