code_generation/generate/deprecated/deprecated_with_tvm_dependency/log/cuda/fast_softmax_cuda.log
{"i": [["[\"fast_softmax\", 2, 14, 6, 2]", "cuda -keys=cuda,gpu -arch=sm_80 -max_num_threads=1024 -thread_warp_size=32", [-1, 16, 64, 49152, 2147483647, 1024, 8, 32], "", 0, []], [[], [["CI", 3], ["CI", 2], ["FU", 5, [0, 1, 2, 3]], ["SP", 5, 0, 336, [2], 1], ["AN", 5, 0, 5], ["AN", 5, 1, 6], ["FU", 4, [0, 1, 2]], ["SP", 4, 0, 168, [2], 1], ["AN", 4, 0, 5], ["AN", 4, 1, 6], ["FU", 1, [0, 1, 2]], ["SP", 1, 0, 168, [32], 1], ["AN", 1, 0, 5], ["AN", 1, 1, 6], ["PR", 1, 0, "auto_unroll_max_step$0"], ["PR", 4, 0, "auto_unroll_max_step$64"]]]], "r": [[1.8171e-05], 0, 1.4395, 1718948378], "v": "v0.6"}
{"i": [["[\"fast_softmax\", 2, 14, 6, 2]", "cuda -keys=cuda,gpu -arch=sm_80 -max_num_threads=1024 -thread_warp_size=32", [-1, 16, 64, 49152, 2147483647, 1024, 8, 32], "", 0, []], [[], [["CI", 3], ["CI", 2], ["FU", 5, [0, 1, 2, 3]], ["SP", 5, 0, 336, [32], 1], ["AN", 5, 0, 5], ["AN", 5, 1, 6], ["FU", 4, [0, 1, 2]], ["SP", 4, 0, 168, [32], 1], ["AN", 4, 0, 5], ["AN", 4, 1, 6], ["FU", 1, [0, 1, 2]], ["SP", 1, 0, 168, [14], 1], ["AN", 1, 0, 5], ["AN", 1, 1, 6], ["PR", 1, 0, "auto_unroll_max_step$1024"], ["PR", 4, 0, "auto_unroll_max_step$16"]]]], "r": [[1.7909e-05], 0, 1.12419, 1718948378], "v": "v0.6"}
{"i": [["[\"fast_softmax\", 2, 14, 6, 2]", "cuda -keys=cuda,gpu -arch=sm_80 -max_num_threads=1024 -thread_warp_size=32", [-1, 16, 64, 49152, 2147483647, 1024, 8, 32], "", 0, []], [[], [["CI", 3], ["CI", 2], ["FU", 5, [0, 1, 2, 3]], ["SP", 5, 0, 336, [32], 1], ["AN", 5, 0, 5], ["AN", 5, 1, 6], ["FU", 4, [0, 1, 2]], ["SP", 4, 0, 168, [8], 1], ["AN", 4, 0, 5], ["AN", 4, 1, 6], ["FU", 1, [0, 1, 2]], ["SP", 1, 0, 168, [32], 1], ["AN", 1, 0, 5], ["AN", 1, 1, 6], ["PR", 1, 0, "auto_unroll_max_step$16"], ["PR", 4, 0, "auto_unroll_max_step$1024"]]]], "r": [[1.76577e-05], 0, 1.02722, 1718948379], "v": "v0.6"}
{"i": [["[\"fast_softmax\", 2, 14, 6, 2]", "cuda -keys=cuda,gpu -arch=sm_80 -max_num_threads=1024 -thread_warp_size=32", [-1, 16, 64, 49152, 2147483647, 1024, 8, 32], "", 0, []], [[], [["CI", 3], ["CI", 2], ["FU", 5, [0, 1, 2, 3]], ["SP", 5, 0, 336, [32], 1], ["AN", 5, 0, 5], ["AN", 5, 1, 6], ["FU", 4, [0, 1, 2]], ["SP", 4, 0, 168, [1], 1], ["AN", 4, 0, 5], ["AN", 4, 1, 6], ["FU", 1, [0, 1, 2]], ["SP", 1, 0, 168, [32], 1], ["AN", 1, 0, 5], ["AN", 1, 1, 6], ["PR", 1, 0, "auto_unroll_max_step$1024"], ["PR", 4, 0, "auto_unroll_max_step$64"]]]], "r": [[1.87546e-05], 0, 0.985577, 1718948379], "v": "v0.6"}
{"i": [["[\"fast_softmax\", 2, 14, 6, 2]", "cuda -keys=cuda,gpu -arch=sm_80 -max_num_threads=1024 -thread_warp_size=32", [-1, 16, 64, 49152, 2147483647, 1024, 8, 32], "", 0, []], [[], [["CI", 3], ["CI", 2], ["FU", 5, [0, 1, 2, 3]], ["SP", 5, 0, 336, [8], 1], ["AN", 5, 0, 5], ["AN", 5, 1, 6], ["FU", 4, [0, 1, 2]], ["SP", 4, 0, 168, [32], 1], ["AN", 4, 0, 5], ["AN", 4, 1, 6], ["FU", 1, [0, 1, 2]], ["SP", 1, 0, 168, [16], 1], ["AN", 1, 0, 5], ["AN", 1, 1, 6], ["PR", 1, 0, "auto_unroll_max_step$512"], ["PR", 4, 0, "auto_unroll_max_step$1024"]]]], "r": [[1.78162e-05], 0, 0.973382, 1718948379], "v": "v0.6"}
{"i": [["[\"fast_softmax\", 2, 14, 6, 2]", "cuda -keys=cuda,gpu -arch=sm_80 -max_num_threads=1024 -thread_warp_size=32", [-1, 16, 64, 49152, 2147483647, 1024, 8, 32], "", 0, []], [[], [["CI", 3], ["CI", 2], ["FU", 5, [0, 1, 2, 3]], ["SP", 5, 0, 336, [24], 1], ["AN", 5, 0, 5], ["AN", 5, 1, 6], ["FU", 4, [0, 1, 2]], ["SP", 4, 0, 168, [1], 1], ["AN", 4, 0, 5], ["AN", 4, 1, 6], ["FU", 1, [0, 1, 2]], ["SP", 1, 0, 168, [32], 1], ["AN", 1, 0, 5], ["AN", 1, 1, 6], ["PR", 1, 0, "auto_unroll_max_step$0"], ["PR", 4, 0, "auto_unroll_max_step$512"]]]], "r": [[1.79415e-05], 0, 1.03977, 1718948380], "v": "v0.6"}
{"i": [["[\"fast_softmax\", 2, 14, 6, 2]", "cuda -keys=cuda,gpu -arch=sm_80 -max_num_threads=1024 -thread_warp_size=32", [-1, 16, 64, 49152, 2147483647, 1024, 8, 32], "", 0, []], [[], [["CI", 3], ["CI", 2], ["FU", 5, [0, 1, 2, 3]], ["SP", 5, 0, 336, [32], 1], ["AN", 5, 0, 5], ["AN", 5, 1, 6], ["FU", 4, [0, 1, 2]], ["SP", 4, 0, 168, [32], 1], ["AN", 4, 0, 5], ["AN", 4, 1, 6], ["FU", 1, [0, 1, 2]], ["SP", 1, 0, 168, [1], 1], ["AN", 1, 0, 5], ["AN", 1, 1, 6], ["PR", 1, 0, "auto_unroll_max_step$512"], ["PR", 4, 0, "auto_unroll_max_step$16"]]]], "r": [[1.83203e-05], 0, 1.08814, 1718948380], "v": "v0.6"}
{"i": [["[\"fast_softmax\", 2, 14, 6, 2]", "cuda -keys=cuda,gpu -arch=sm_80 -max_num_threads=1024 -thread_warp_size=32", [-1, 16, 64, 49152, 2147483647, 1024, 8, 32], "", 0, []], [[], [["CI", 3], ["CI", 2], ["FU", 5, [0, 1, 2, 3]], ["SP", 5, 0, 336, [32], 1], ["AN", 5, 0, 5], ["AN", 5, 1, 6], ["FU", 4, [0, 1, 2]], ["SP", 4, 0, 168, [56], 1], ["AN", 4, 0, 5], ["AN", 4, 1, 6], ["FU", 1, [0, 1, 2]], ["SP", 1, 0, 168, [4], 1], ["AN", 1, 0, 5], ["AN", 1, 1, 6], ["PR", 1, 0, "auto_unroll_max_step$1024"], ["PR", 4, 0, "auto_unroll_max_step$512"]]]], "r": [[1.76464e-05], 0, 1.01076, 1718948380], "v": "v0.6"}
{"i": [["[\"fast_softmax\", 2, 14, 6, 2]", "cuda -keys=cuda,gpu -arch=sm_80 -max_num_threads=1024 -thread_warp_size=32", [-1, 16, 64, 49152, 2147483647, 1024, 8, 32], "", 0, []], [[], [["CI", 3], ["CI", 2], ["FU", 5, [0, 1, 2, 3]], ["SP", 5, 0, 336, [1], 1], ["AN", 5, 0, 5], ["AN", 5, 1, 6], ["FU", 4, [0, 1, 2]], ["SP", 4, 0, 168, [32], 1], ["AN", 4, 0, 5], ["AN", 4, 1, 6], ["FU", 1, [0, 1, 2]], ["SP", 1, 0, 168, [1], 1], ["AN", 1, 0, 5], ["AN", 1, 1, 6], ["PR", 1, 0, "auto_unroll_max_step$16"], ["PR", 4, 0, "auto_unroll_max_step$16"]]]], "r": [[1.8245e-05], 0, 1.00225, 1718948381], "v": "v0.6"}
{"i": [["[\"fast_softmax\", 2, 14, 6, 2]", "cuda -keys=cuda,gpu -arch=sm_80 -max_num_threads=1024 -thread_warp_size=32", [-1, 16, 64, 49152, 2147483647, 1024, 8, 32], "", 0, []], [[], [["CI", 3], ["CI", 2], ["FU", 5, [0, 1, 2, 3]], ["SP", 5, 0, 336, [64], 1], ["AN", 5, 0, 5], ["AN", 5, 1, 6], ["FU", 4, [0, 1, 2]], ["SP", 4, 0, 168, [16], 1], ["AN", 4, 0, 5], ["AN", 4, 1, 6], ["FU", 1, [0, 1, 2]], ["SP", 1, 0, 168, [32], 1], ["AN", 1, 0, 5], ["AN", 1, 1, 6], ["PR", 1, 0, "auto_unroll_max_step$512"], ["PR", 4, 0, "auto_unroll_max_step$0"]]]], "r": [[1.76666e-05], 0, 1.03492, 1718948381], "v": "v0.6"}
