code_generation/generate/deprecated/deprecated_with_tvm_dependency/log/cuda/fast_exp_cuda.log
{"i": [["[\"fast_exp\", 5, 15, 16, 14]", "cuda -keys=cuda,gpu -arch=sm_80 -max_num_threads=1024 -thread_warp_size=32", [-1, 16, 64, 49152, 2147483647, 1024, 8, 32], "", 0, []], [[], [["FU", 1, [0, 1, 2, 3]], ["SP", 1, 0, 16800, [12], 1], ["AN", 1, 0, 5], ["AN", 1, 1, 6]]]], "r": [[7.84547e-06], 0, 1.31272, 1718945773], "v": "v0.6"}
{"i": [["[\"fast_exp\", 5, 15, 16, 14]", "cuda -keys=cuda,gpu -arch=sm_80 -max_num_threads=1024 -thread_warp_size=32", [-1, 16, 64, 49152, 2147483647, 1024, 8, 32], "", 0, []], [[], [["FU", 1, [0, 1, 2, 3]], ["SP", 1, 0, 16800, [14], 1], ["AN", 1, 0, 5], ["AN", 1, 1, 6]]]], "r": [[7.89517e-06], 0, 1.1991, 1718945773], "v": "v0.6"}
{"i": [["[\"fast_exp\", 5, 15, 16, 14]", "cuda -keys=cuda,gpu -arch=sm_80 -max_num_threads=1024 -thread_warp_size=32", [-1, 16, 64, 49152, 2147483647, 1024, 8, 32], "", 0, []], [[], [["FU", 1, [0, 1, 2, 3]], ["SP", 1, 0, 16800, [10], 1], ["AN", 1, 0, 5], ["AN", 1, 1, 6]]]], "r": [[8.55486e-06], 0, 1.28734, 1718945773], "v": "v0.6"}
{"i": [["[\"fast_exp\", 5, 15, 16, 14]", "cuda -keys=cuda,gpu -arch=sm_80 -max_num_threads=1024 -thread_warp_size=32", [-1, 16, 64, 49152, 2147483647, 1024, 8, 32], "", 0, []], [[], [["FU", 1, [0, 1, 2, 3]], ["SP", 1, 0, 16800, [32], 1], ["AN", 1, 0, 5], ["AN", 1, 1, 6]]]], "r": [[6.5445e-06], 0, 1.22591, 1718945774], "v": "v0.6"}
{"i": [["[\"fast_exp\", 5, 15, 16, 14]", "cuda -keys=cuda,gpu -arch=sm_80 -max_num_threads=1024 -thread_warp_size=32", [-1, 16, 64, 49152, 2147483647, 1024, 8, 32], "", 0, []], [[], [["FU", 1, [0, 1, 2, 3]], ["SP", 1, 0, 16800, [3], 1], ["AN", 1, 0, 5], ["AN", 1, 1, 6]]]], "r": [[1.51404e-05], 0, 1.18323, 1718945774], "v": "v0.6"}
{"i": [["[\"fast_exp\", 5, 15, 16, 14]", "cuda -keys=cuda,gpu -arch=sm_80 -max_num_threads=1024 -thread_warp_size=32", [-1, 16, 64, 49152, 2147483647, 1024, 8, 32], "", 0, []], [[], [["FU", 1, [0, 1, 2, 3]], ["SP", 1, 0, 16800, [35], 1], ["AN", 1, 0, 5], ["AN", 1, 1, 6]]]], "r": [[6.76786e-06], 0, 1.17674, 1718945774], "v": "v0.6"}
{"i": [["[\"fast_exp\", 5, 15, 16, 14]", "cuda -keys=cuda,gpu -arch=sm_80 -max_num_threads=1024 -thread_warp_size=32", [-1, 16, 64, 49152, 2147483647, 1024, 8, 32], "", 0, []], [[], [["FU", 1, [0, 1, 2, 3]], ["SP", 1, 0, 16800, [2], 1], ["AN", 1, 0, 5], ["AN", 1, 1, 6]]]], "r": [[2.01275e-05], 0, 1.31544, 1718945775], "v": "v0.6"}
{"i": [["[\"fast_exp\", 5, 15, 16, 14]", "cuda -keys=cuda,gpu -arch=sm_80 -max_num_threads=1024 -thread_warp_size=32", [-1, 16, 64, 49152, 2147483647, 1024, 8, 32], "", 0, []], [[], [["FU", 1, [0, 1, 2, 3]], ["SP", 1, 0, 16800, [16], 1], ["AN", 1, 0, 5], ["AN", 1, 1, 6]]]], "r": [[7.48053e-06], 0, 1.07832, 1718945775], "v": "v0.6"}
{"i": [["[\"fast_exp\", 5, 15, 16, 14]", "cuda -keys=cuda,gpu -arch=sm_80 -max_num_threads=1024 -thread_warp_size=32", [-1, 16, 64, 49152, 2147483647, 1024, 8, 32], "", 0, []], [[], [["FU", 1, [0, 1, 2, 3]], ["SP", 1, 0, 16800, [40], 1], ["AN", 1, 0, 5], ["AN", 1, 1, 6]]]], "r": [[7.00158e-06], 0, 1.17807, 1718945775], "v": "v0.6"}
{"i": [["[\"fast_exp\", 5, 15, 16, 14]", "cuda -keys=cuda,gpu -arch=sm_80 -max_num_threads=1024 -thread_warp_size=32", [-1, 16, 64, 49152, 2147483647, 1024, 8, 32], "", 0, []], [[], [["FU", 1, [0, 1, 2, 3]], ["SP", 1, 0, 16800, [56], 1], ["AN", 1, 0, 5], ["AN", 1, 1, 6]]]], "r": [[7.53111e-06], 0, 1.21781, 1718945776], "v": "v0.6"}
