code_generation/generate/deprecated/deprecated_with_tvm_dependency/log/cuda/fifo_buffer_cuda.log
{"i": [["[\"fifo_buffer\", 20, 2, 20, 4]", "cuda -keys=cuda,gpu -arch=sm_80 -max_num_threads=1024 -thread_warp_size=32", [-1, 16, 64, 49152, 2147483647, 1024, 8, 32], "", 0, []], [[], [["FU", 2, [0, 1, 2, 3]], ["SP", 2, 0, 3200, [10], 1], ["AN", 2, 0, 5], ["AN", 2, 1, 6]]]], "r": [[6.21434e-06], 0, 1.50729, 1718949510], "v": "v0.6"}
{"i": [["[\"fifo_buffer\", 20, 2, 20, 4]", "cuda -keys=cuda,gpu -arch=sm_80 -max_num_threads=1024 -thread_warp_size=32", [-1, 16, 64, 49152, 2147483647, 1024, 8, 32], "", 0, []], [[], [["FU", 2, [0, 1, 2, 3]], ["SP", 2, 0, 3200, [16], 1], ["AN", 2, 0, 5], ["AN", 2, 1, 6]]]], "r": [[5.6506e-06], 0, 0.935288, 1718949511], "v": "v0.6"}
{"i": [["[\"fifo_buffer\", 20, 2, 20, 4]", "cuda -keys=cuda,gpu -arch=sm_80 -max_num_threads=1024 -thread_warp_size=32", [-1, 16, 64, 49152, 2147483647, 1024, 8, 32], "", 0, []], [[], [["FU", 2, [0, 1, 2, 3]], ["SP", 2, 0, 3200, [25], 1], ["AN", 2, 0, 5], ["AN", 2, 1, 6]]]], "r": [[5.54438e-06], 0, 0.938184, 1718949511], "v": "v0.6"}
{"i": [["[\"fifo_buffer\", 20, 2, 20, 4]", "cuda -keys=cuda,gpu -arch=sm_80 -max_num_threads=1024 -thread_warp_size=32", [-1, 16, 64, 49152, 2147483647, 1024, 8, 32], "", 0, []], [[], [["FU", 2, [0, 1, 2, 3]], ["SP", 2, 0, 3200, [40], 1], ["AN", 2, 0, 5], ["AN", 2, 1, 6]]]], "r": [[5.46073e-06], 0, 0.810263, 1718949511], "v": "v0.6"}
{"i": [["[\"fifo_buffer\", 20, 2, 20, 4]", "cuda -keys=cuda,gpu -arch=sm_80 -max_num_threads=1024 -thread_warp_size=32", [-1, 16, 64, 49152, 2147483647, 1024, 8, 32], "", 0, []], [[], [["FU", 2, [0, 1, 2, 3]], ["SP", 2, 0, 3200, [5], 1], ["AN", 2, 0, 5], ["AN", 2, 1, 6]]]], "r": [[6.1564e-06], 0, 0.882041, 1718949511], "v": "v0.6"}
{"i": [["[\"fifo_buffer\", 20, 2, 20, 4]", "cuda -keys=cuda,gpu -arch=sm_80 -max_num_threads=1024 -thread_warp_size=32", [-1, 16, 64, 49152, 2147483647, 1024, 8, 32], "", 0, []], [[], [["FU", 2, [0, 1, 2, 3]], ["SP", 2, 0, 3200, [64], 1], ["AN", 2, 0, 5], ["AN", 2, 1, 6]]]], "r": [[6.21601e-06], 0, 0.932207, 1718949512], "v": "v0.6"}
{"i": [["[\"fifo_buffer\", 20, 2, 20, 4]", "cuda -keys=cuda,gpu -arch=sm_80 -max_num_threads=1024 -thread_warp_size=32", [-1, 16, 64, 49152, 2147483647, 1024, 8, 32], "", 0, []], [[], [["FU", 2, [0, 1, 2, 3]], ["SP", 2, 0, 3200, [32], 1], ["AN", 2, 0, 5], ["AN", 2, 1, 6]]]], "r": [[5.27246e-06], 0, 0.964319, 1718949512], "v": "v0.6"}
{"i": [["[\"fifo_buffer\", 20, 2, 20, 4]", "cuda -keys=cuda,gpu -arch=sm_80 -max_num_threads=1024 -thread_warp_size=32", [-1, 16, 64, 49152, 2147483647, 1024, 8, 32], "", 0, []], [[], [["FU", 2, [0, 1, 2, 3]], ["SP", 2, 0, 3200, [1], 1], ["AN", 2, 0, 5], ["AN", 2, 1, 6]]]], "r": [[1.05066e-05], 0, 0.967952, 1718949512], "v": "v0.6"}
{"i": [["[\"fifo_buffer\", 20, 2, 20, 4]", "cuda -keys=cuda,gpu -arch=sm_80 -max_num_threads=1024 -thread_warp_size=32", [-1, 16, 64, 49152, 2147483647, 1024, 8, 32], "", 0, []], [[], [["FU", 2, [0, 1, 2, 3]], ["SP", 2, 0, 3200, [2], 1], ["AN", 2, 0, 5], ["AN", 2, 1, 6]]]], "r": [[8.13433e-06], 0, 1.04686, 1718949513], "v": "v0.6"}
{"i": [["[\"fifo_buffer\", 20, 2, 20, 4]", "cuda -keys=cuda,gpu -arch=sm_80 -max_num_threads=1024 -thread_warp_size=32", [-1, 16, 64, 49152, 2147483647, 1024, 8, 32], "", 0, []], [[], [["FU", 2, [0, 1, 2, 3]], ["SP", 2, 0, 3200, [4], 1], ["AN", 2, 0, 5], ["AN", 2, 1, 6]]]], "r": [[6.82361e-06], 0, 0.961484, 1718949513], "v": "v0.6"}
