code_generation/generate/deprecated/deprecated_with_tvm_dependency/log/cuda/flatten_cuda.log
{"i": [["[\"flatten\", 20, 7, 20, 17]", "cuda -keys=cuda,gpu -arch=sm_80 -max_num_threads=1024 -thread_warp_size=32", [-1, 16, 64, 49152, 2147483647, 1024, 8, 32], "", 0, []], [[], [["FU", 1, [0, 1]], ["SP", 1, 0, 47600, [8], 1], ["AN", 1, 0, 5], ["AN", 1, 1, 6]]]], "r": [[1.49047e-05], 0, 1.27888, 1718949328], "v": "v0.6"}
{"i": [["[\"flatten\", 20, 7, 20, 17]", "cuda -keys=cuda,gpu -arch=sm_80 -max_num_threads=1024 -thread_warp_size=32", [-1, 16, 64, 49152, 2147483647, 1024, 8, 32], "", 0, []], [[], [["FU", 1, [0, 1]], ["SP", 1, 0, 47600, [56], 1], ["AN", 1, 0, 5], ["AN", 1, 1, 6]]]], "r": [[6.74641e-06], 0, 0.86482, 1718949328], "v": "v0.6"}
{"i": [["[\"flatten\", 20, 7, 20, 17]", "cuda -keys=cuda,gpu -arch=sm_80 -max_num_threads=1024 -thread_warp_size=32", [-1, 16, 64, 49152, 2147483647, 1024, 8, 32], "", 0, []], [[], [["FU", 1, [0, 1]], ["SP", 1, 0, 47600, [5], 1], ["AN", 1, 0, 5], ["AN", 1, 1, 6]]]], "r": [[2.12586e-05], 0, 0.85545, 1718949328], "v": "v0.6"}
{"i": [["[\"flatten\", 20, 7, 20, 17]", "cuda -keys=cuda,gpu -arch=sm_80 -max_num_threads=1024 -thread_warp_size=32", [-1, 16, 64, 49152, 2147483647, 1024, 8, 32], "", 0, []], [[], [["FU", 1, [0, 1]], ["SP", 1, 0, 47600, [4], 1], ["AN", 1, 0, 5], ["AN", 1, 1, 6]]]], "r": [[2.50507e-05], 0, 0.946036, 1718949329], "v": "v0.6"}
{"i": [["[\"flatten\", 20, 7, 20, 17]", "cuda -keys=cuda,gpu -arch=sm_80 -max_num_threads=1024 -thread_warp_size=32", [-1, 16, 64, 49152, 2147483647, 1024, 8, 32], "", 0, []], [[], [["FU", 1, [0, 1]], ["SP", 1, 0, 47600, [17], 1], ["AN", 1, 0, 5], ["AN", 1, 1, 6]]]], "r": [[9.91118e-06], 0, 0.832618, 1718949329], "v": "v0.6"}
{"i": [["[\"flatten\", 20, 7, 20, 17]", "cuda -keys=cuda,gpu -arch=sm_80 -max_num_threads=1024 -thread_warp_size=32", [-1, 16, 64, 49152, 2147483647, 1024, 8, 32], "", 0, []], [[], [["FU", 1, [0, 1]], ["SP", 1, 0, 47600, [34], 1], ["AN", 1, 0, 5], ["AN", 1, 1, 6]]]], "r": [[7.75012e-06], 0, 0.856221, 1718949329], "v": "v0.6"}
{"i": [["[\"flatten\", 20, 7, 20, 17]", "cuda -keys=cuda,gpu -arch=sm_80 -max_num_threads=1024 -thread_warp_size=32", [-1, 16, 64, 49152, 2147483647, 1024, 8, 32], "", 0, []], [[], [["FU", 1, [0, 1]], ["SP", 1, 0, 47600, [40], 1], ["AN", 1, 0, 5], ["AN", 1, 1, 6]]]], "r": [[7.27028e-06], 0, 0.807902, 1718949329], "v": "v0.6"}
{"i": [["[\"flatten\", 20, 7, 20, 17]", "cuda -keys=cuda,gpu -arch=sm_80 -max_num_threads=1024 -thread_warp_size=32", [-1, 16, 64, 49152, 2147483647, 1024, 8, 32], "", 0, []], [[], [["FU", 1, [0, 1]], ["SP", 1, 0, 47600, [1], 1], ["AN", 1, 0, 5], ["AN", 1, 1, 6]]]], "r": [[8.33728e-05], 0, 0.811959, 1718949330], "v": "v0.6"}
{"i": [["[\"flatten\", 20, 7, 20, 17]", "cuda -keys=cuda,gpu -arch=sm_80 -max_num_threads=1024 -thread_warp_size=32", [-1, 16, 64, 49152, 2147483647, 1024, 8, 32], "", 0, []], [[], [["FU", 1, [0, 1]], ["SP", 1, 0, 47600, [28], 1], ["AN", 1, 0, 5], ["AN", 1, 1, 6]]]], "r": [[8.21811e-06], 0, 0.919457, 1718949330], "v": "v0.6"}
{"i": [["[\"flatten\", 20, 7, 20, 17]", "cuda -keys=cuda,gpu -arch=sm_80 -max_num_threads=1024 -thread_warp_size=32", [-1, 16, 64, 49152, 2147483647, 1024, 8, 32], "", 0, []], [[], [["FU", 1, [0, 1]], ["SP", 1, 0, 47600, [14], 1], ["AN", 1, 0, 5], ["AN", 1, 1, 6]]]], "r": [[1.10291e-05], 0, 0.853646, 1718949330], "v": "v0.6"}
