code_generation/generate/deprecated/deprecated_with_tvm_dependency/log/cuda/flip_cuda.log
{"i": [["[\"flip\", 17, 8, 7, 17]", "cuda -keys=cuda,gpu -arch=sm_80 -max_num_threads=1024 -thread_warp_size=32", [-1, 16, 64, 49152, 2147483647, 1024, 8, 32], "", 0, []], [[], [["FU", 1, [0, 1, 2, 3]], ["SP", 1, 0, 16184, [34], 1], ["AN", 1, 0, 5], ["AN", 1, 1, 6]]]], "r": [[7.16246e-06], 0, 2.11403, 1718946481], "v": "v0.6"}
{"i": [["[\"flip\", 17, 8, 7, 17]", "cuda -keys=cuda,gpu -arch=sm_80 -max_num_threads=1024 -thread_warp_size=32", [-1, 16, 64, 49152, 2147483647, 1024, 8, 32], "", 0, []], [[], [["FU", 1, [0, 1, 2, 3]], ["SP", 1, 0, 16184, [18], 1], ["AN", 1, 0, 5], ["AN", 1, 1, 6]]]], "r": [[7.00089e-06], 0, 1.31194, 1718946482], "v": "v0.6"}
{"i": [["[\"flip\", 17, 8, 7, 17]", "cuda -keys=cuda,gpu -arch=sm_80 -max_num_threads=1024 -thread_warp_size=32", [-1, 16, 64, 49152, 2147483647, 1024, 8, 32], "", 0, []], [[], [["FU", 1, [0, 1, 2, 3]], ["SP", 1, 0, 16184, [1], 1], ["AN", 1, 0, 5], ["AN", 1, 1, 6]]]], "r": [[3.17489e-05], 0, 1.26574, 1718946482], "v": "v0.6"}
{"i": [["[\"flip\", 17, 8, 7, 17]", "cuda -keys=cuda,gpu -arch=sm_80 -max_num_threads=1024 -thread_warp_size=32", [-1, 16, 64, 49152, 2147483647, 1024, 8, 32], "", 0, []], [[], [["FU", 1, [0, 1, 2, 3]], ["SP", 1, 0, 16184, [17], 1], ["AN", 1, 0, 5], ["AN", 1, 1, 6]]]], "r": [[7.62062e-06], 0, 1.38261, 1718946482], "v": "v0.6"}
{"i": [["[\"flip\", 17, 8, 7, 17]", "cuda -keys=cuda,gpu -arch=sm_80 -max_num_threads=1024 -thread_warp_size=32", [-1, 16, 64, 49152, 2147483647, 1024, 8, 32], "", 0, []], [[], [["FU", 1, [0, 1, 2, 3]], ["SP", 1, 0, 16184, [9], 1], ["AN", 1, 0, 5], ["AN", 1, 1, 6]]]], "r": [[8.40295e-06], 0, 1.2661, 1718946483], "v": "v0.6"}
{"i": [["[\"flip\", 17, 8, 7, 17]", "cuda -keys=cuda,gpu -arch=sm_80 -max_num_threads=1024 -thread_warp_size=32", [-1, 16, 64, 49152, 2147483647, 1024, 8, 32], "", 0, []], [[], [["FU", 1, [0, 1, 2, 3]], ["SP", 1, 0, 16184, [8], 1], ["AN", 1, 0, 5], ["AN", 1, 1, 6]]]], "r": [[8.56122e-06], 0, 1.3995, 1718946483], "v": "v0.6"}
{"i": [["[\"flip\", 17, 8, 7, 17]", "cuda -keys=cuda,gpu -arch=sm_80 -max_num_threads=1024 -thread_warp_size=32", [-1, 16, 64, 49152, 2147483647, 1024, 8, 32], "", 0, []], [[], [["FU", 1, [0, 1, 2, 3]], ["SP", 1, 0, 16184, [4], 1], ["AN", 1, 0, 5], ["AN", 1, 1, 6]]]], "r": [[1.22084e-05], 0, 1.08647, 1718946484], "v": "v0.6"}
{"i": [["[\"flip\", 17, 8, 7, 17]", "cuda -keys=cuda,gpu -arch=sm_80 -max_num_threads=1024 -thread_warp_size=32", [-1, 16, 64, 49152, 2147483647, 1024, 8, 32], "", 0, []], [[], [["FU", 1, [0, 1, 2, 3]], ["SP", 1, 0, 16184, [16], 1], ["AN", 1, 0, 5], ["AN", 1, 1, 6]]]], "r": [[7.10348e-06], 0, 1.07812, 1718946484], "v": "v0.6"}
{"i": [["[\"flip\", 17, 8, 7, 17]", "cuda -keys=cuda,gpu -arch=sm_80 -max_num_threads=1024 -thread_warp_size=32", [-1, 16, 64, 49152, 2147483647, 1024, 8, 32], "", 0, []], [[], [["FU", 1, [0, 1, 2, 3]], ["SP", 1, 0, 16184, [28], 1], ["AN", 1, 0, 5], ["AN", 1, 1, 6]]]], "r": [[8.8368e-06], 0, 1.25917, 1718946484], "v": "v0.6"}
{"i": [["[\"flip\", 17, 8, 7, 17]", "cuda -keys=cuda,gpu -arch=sm_80 -max_num_threads=1024 -thread_warp_size=32", [-1, 16, 64, 49152, 2147483647, 1024, 8, 32], "", 0, []], [[], [["FU", 1, [0, 1, 2, 3]], ["SP", 1, 0, 16184, [14], 1], ["AN", 1, 0, 5], ["AN", 1, 1, 6]]]], "r": [[7.34934e-06], 0, 1.13025, 1718946485], "v": "v0.6"}
