code_generation/generate/deprecated/deprecated_with_tvm_dependency/log/cuda/floor_cuda.log
{"i": [["[\"floor\", 4, 5, 5, 7]", "cuda -keys=cuda,gpu -arch=sm_80 -max_num_threads=1024 -thread_warp_size=32", [-1, 16, 64, 49152, 2147483647, 1024, 8, 32], "", 0, []], [[], [["FU", 1, [0, 1, 2, 3]], ["SP", 1, 0, 700, [8], 1], ["AN", 1, 0, 5], ["AN", 1, 1, 6]]]], "r": [[5.48179e-06], 0, 1.39814, 1718946810], "v": "v0.6"}
{"i": [["[\"floor\", 4, 5, 5, 7]", "cuda -keys=cuda,gpu -arch=sm_80 -max_num_threads=1024 -thread_warp_size=32", [-1, 16, 64, 49152, 2147483647, 1024, 8, 32], "", 0, []], [[], [["FU", 1, [0, 1, 2, 3]], ["SP", 1, 0, 700, [2], 1], ["AN", 1, 0, 5], ["AN", 1, 1, 6]]]], "r": [[6.03269e-06], 0, 1.01115, 1718946810], "v": "v0.6"}
{"i": [["[\"floor\", 4, 5, 5, 7]", "cuda -keys=cuda,gpu -arch=sm_80 -max_num_threads=1024 -thread_warp_size=32", [-1, 16, 64, 49152, 2147483647, 1024, 8, 32], "", 0, []], [[], [["FU", 1, [0, 1, 2, 3]], ["SP", 1, 0, 700, [3], 1], ["AN", 1, 0, 5], ["AN", 1, 1, 6]]]], "r": [[6.17734e-06], 0, 0.858357, 1718946811], "v": "v0.6"}
{"i": [["[\"floor\", 4, 5, 5, 7]", "cuda -keys=cuda,gpu -arch=sm_80 -max_num_threads=1024 -thread_warp_size=32", [-1, 16, 64, 49152, 2147483647, 1024, 8, 32], "", 0, []], [[], [["FU", 1, [0, 1, 2, 3]], ["SP", 1, 0, 700, [25], 1], ["AN", 1, 0, 5], ["AN", 1, 1, 6]]]], "r": [[5.63026e-06], 0, 0.844273, 1718946811], "v": "v0.6"}
{"i": [["[\"floor\", 4, 5, 5, 7]", "cuda -keys=cuda,gpu -arch=sm_80 -max_num_threads=1024 -thread_warp_size=32", [-1, 16, 64, 49152, 2147483647, 1024, 8, 32], "", 0, []], [[], [["FU", 1, [0, 1, 2, 3]], ["SP", 1, 0, 700, [32], 1], ["AN", 1, 0, 5], ["AN", 1, 1, 6]]]], "r": [[5.55188e-06], 0, 0.958867, 1718946811], "v": "v0.6"}
{"i": [["[\"floor\", 4, 5, 5, 7]", "cuda -keys=cuda,gpu -arch=sm_80 -max_num_threads=1024 -thread_warp_size=32", [-1, 16, 64, 49152, 2147483647, 1024, 8, 32], "", 0, []], [[], [["FU", 1, [0, 1, 2, 3]], ["SP", 1, 0, 700, [28], 1], ["AN", 1, 0, 5], ["AN", 1, 1, 6]]]], "r": [[5.6402e-06], 0, 0.907143, 1718946811], "v": "v0.6"}
{"i": [["[\"floor\", 4, 5, 5, 7]", "cuda -keys=cuda,gpu -arch=sm_80 -max_num_threads=1024 -thread_warp_size=32", [-1, 16, 64, 49152, 2147483647, 1024, 8, 32], "", 0, []], [[], [["FU", 1, [0, 1, 2, 3]], ["SP", 1, 0, 700, [20], 1], ["AN", 1, 0, 5], ["AN", 1, 1, 6]]]], "r": [[5.89248e-06], 0, 1.03669, 1718946812], "v": "v0.6"}
{"i": [["[\"floor\", 4, 5, 5, 7]", "cuda -keys=cuda,gpu -arch=sm_80 -max_num_threads=1024 -thread_warp_size=32", [-1, 16, 64, 49152, 2147483647, 1024, 8, 32], "", 0, []], [[], [["FU", 1, [0, 1, 2, 3]], ["SP", 1, 0, 700, [14], 1], ["AN", 1, 0, 5], ["AN", 1, 1, 6]]]], "r": [[5.73096e-06], 0, 0.8959, 1718946812], "v": "v0.6"}
{"i": [["[\"floor\", 4, 5, 5, 7]", "cuda -keys=cuda,gpu -arch=sm_80 -max_num_threads=1024 -thread_warp_size=32", [-1, 16, 64, 49152, 2147483647, 1024, 8, 32], "", 0, []], [[], [["FU", 1, [0, 1, 2, 3]], ["SP", 1, 0, 700, [1], 1], ["AN", 1, 0, 5], ["AN", 1, 1, 6]]]], "r": [[6.55136e-06], 0, 1.11955, 1718946812], "v": "v0.6"}
{"i": [["[\"floor\", 4, 5, 5, 7]", "cuda -keys=cuda,gpu -arch=sm_80 -max_num_threads=1024 -thread_warp_size=32", [-1, 16, 64, 49152, 2147483647, 1024, 8, 32], "", 0, []], [[], [["FU", 1, [0, 1, 2, 3]], ["SP", 1, 0, 700, [16], 1], ["AN", 1, 0, 5], ["AN", 1, 1, 6]]]], "r": [[1.07524e-05], 0, 0.958336, 1718946813], "v": "v0.6"}
