code_generation/generate/deprecated/deprecated_with_tvm_dependency/log/cuda/global_pool_avg_cuda.log
{"i": [["[\"global_pool_avg\", 4, 7, 3, 20]", "cuda -keys=cuda,gpu -arch=sm_80 -max_num_threads=1024 -thread_warp_size=32", [-1, 16, 64, 49152, 2147483647, 1024, 8, 32], "", 0, []], [[], [["FU", 2, [0, 1, 2, 3]], ["AN", 2, 0, 6], ["FU", 1, [0, 1, 2, 3]], ["AN", 1, 0, 6], ["PR", 1, 0, "auto_unroll_max_step$64"]]]], "r": [[1.21648e-05], 0, 1.23007, 1718948894], "v": "v0.6"}
{"i": [["[\"global_pool_avg\", 4, 7, 3, 20]", "cuda -keys=cuda,gpu -arch=sm_80 -max_num_threads=1024 -thread_warp_size=32", [-1, 16, 64, 49152, 2147483647, 1024, 8, 32], "", 0, []], [[], [["FU", 2, [0, 1, 2, 3]], ["AN", 2, 0, 6], ["FU", 1, [0, 1, 2, 3]], ["AN", 1, 0, 6], ["PR", 1, 0, "auto_unroll_max_step$1024"]]]], "r": [[1.21636e-05], 0, 0.783225, 1718948895], "v": "v0.6"}
{"i": [["[\"global_pool_avg\", 4, 7, 3, 20]", "cuda -keys=cuda,gpu -arch=sm_80 -max_num_threads=1024 -thread_warp_size=32", [-1, 16, 64, 49152, 2147483647, 1024, 8, 32], "", 0, []], [[], [["FU", 2, [0, 1, 2, 3]], ["AN", 2, 0, 6], ["FU", 1, [0, 1, 2, 3]], ["AN", 1, 0, 6], ["PR", 1, 0, "auto_unroll_max_step$0"]]]], "r": [[1.21143e-05], 0, 0.780509, 1718948895], "v": "v0.6"}
{"i": [["[\"global_pool_avg\", 4, 7, 3, 20]", "cuda -keys=cuda,gpu -arch=sm_80 -max_num_threads=1024 -thread_warp_size=32", [-1, 16, 64, 49152, 2147483647, 1024, 8, 32], "", 0, []], [[], [["FU", 2, [0, 1, 2, 3]], ["AN", 2, 0, 6], ["FU", 1, [0, 1, 2, 3]], ["AN", 1, 0, 6], ["PR", 1, 0, "auto_unroll_max_step$16"]]]], "r": [[1.21665e-05], 0, 0.772385, 1718948895], "v": "v0.6"}
{"i": [["[\"global_pool_avg\", 4, 7, 3, 20]", "cuda -keys=cuda,gpu -arch=sm_80 -max_num_threads=1024 -thread_warp_size=32", [-1, 16, 64, 49152, 2147483647, 1024, 8, 32], "", 0, []], [[], [["FU", 2, [0, 1, 2, 3]], ["AN", 2, 0, 6], ["FU", 1, [0, 1, 2, 3]], ["AN", 1, 0, 6], ["PR", 1, 0, "auto_unroll_max_step$512"]]]], "r": [[1.23427e-05], 0, 0.820484, 1718948895], "v": "v0.6"}
