code_generation/generate/deprecated/deprecated_with_tvm_dependency/log/cuda/isnan_cuda.log
{"i": [["[\"isnan\", 6, 15, 10, 19]", "cuda -keys=cuda,gpu -arch=sm_80 -max_num_threads=1024 -thread_warp_size=32", [-1, 16, 64, 49152, 2147483647, 1024, 8, 32], "", 0, []], [[], [["FU", 1, [0, 1, 2, 3]], ["SP", 1, 0, 17100, [36], 1], ["AN", 1, 0, 5], ["AN", 1, 1, 6]]]], "r": [[6.47413e-06], 0, 1.69537, 1718947076], "v": "v0.6"}
{"i": [["[\"isnan\", 6, 15, 10, 19]", "cuda -keys=cuda,gpu -arch=sm_80 -max_num_threads=1024 -thread_warp_size=32", [-1, 16, 64, 49152, 2147483647, 1024, 8, 32], "", 0, []], [[], [["FU", 1, [0, 1, 2, 3]], ["SP", 1, 0, 17100, [15], 1], ["AN", 1, 0, 5], ["AN", 1, 1, 6]]]], "r": [[7.41975e-06], 0, 1.11915, 1718947076], "v": "v0.6"}
{"i": [["[\"isnan\", 6, 15, 10, 19]", "cuda -keys=cuda,gpu -arch=sm_80 -max_num_threads=1024 -thread_warp_size=32", [-1, 16, 64, 49152, 2147483647, 1024, 8, 32], "", 0, []], [[], [["FU", 1, [0, 1, 2, 3]], ["SP", 1, 0, 17100, [25], 1], ["AN", 1, 0, 5], ["AN", 1, 1, 6]]]], "r": [[6.66259e-06], 0, 1.14403, 1718947076], "v": "v0.6"}
{"i": [["[\"isnan\", 6, 15, 10, 19]", "cuda -keys=cuda,gpu -arch=sm_80 -max_num_threads=1024 -thread_warp_size=32", [-1, 16, 64, 49152, 2147483647, 1024, 8, 32], "", 0, []], [[], [["FU", 1, [0, 1, 2, 3]], ["SP", 1, 0, 17100, [45], 1], ["AN", 1, 0, 5], ["AN", 1, 1, 6]]]], "r": [[5.91987e-06], 0, 0.840863, 1718947077], "v": "v0.6"}
{"i": [["[\"isnan\", 6, 15, 10, 19]", "cuda -keys=cuda,gpu -arch=sm_80 -max_num_threads=1024 -thread_warp_size=32", [-1, 16, 64, 49152, 2147483647, 1024, 8, 32], "", 0, []], [[], [["FU", 1, [0, 1, 2, 3]], ["SP", 1, 0, 17100, [9], 1], ["AN", 1, 0, 5], ["AN", 1, 1, 6]]]], "r": [[9.0387e-06], 0, 1.19532, 1718947077], "v": "v0.6"}
{"i": [["[\"isnan\", 6, 15, 10, 19]", "cuda -keys=cuda,gpu -arch=sm_80 -max_num_threads=1024 -thread_warp_size=32", [-1, 16, 64, 49152, 2147483647, 1024, 8, 32], "", 0, []], [[], [["FU", 1, [0, 1, 2, 3]], ["SP", 1, 0, 17100, [16], 1], ["AN", 1, 0, 5], ["AN", 1, 1, 6]]]], "r": [[6.9756e-06], 0, 0.948962, 1718947077], "v": "v0.6"}
{"i": [["[\"isnan\", 6, 15, 10, 19]", "cuda -keys=cuda,gpu -arch=sm_80 -max_num_threads=1024 -thread_warp_size=32", [-1, 16, 64, 49152, 2147483647, 1024, 8, 32], "", 0, []], [[], [["FU", 1, [0, 1, 2, 3]], ["SP", 1, 0, 17100, [38], 1], ["AN", 1, 0, 5], ["AN", 1, 1, 6]]]], "r": [[6.48209e-06], 0, 1.15639, 1718947078], "v": "v0.6"}
{"i": [["[\"isnan\", 6, 15, 10, 19]", "cuda -keys=cuda,gpu -arch=sm_80 -max_num_threads=1024 -thread_warp_size=32", [-1, 16, 64, 49152, 2147483647, 1024, 8, 32], "", 0, []], [[], [["FU", 1, [0, 1, 2, 3]], ["SP", 1, 0, 17100, [19], 1], ["AN", 1, 0, 5], ["AN", 1, 1, 6]]]], "r": [[6.83688e-06], 0, 0.957725, 1718947078], "v": "v0.6"}
{"i": [["[\"isnan\", 6, 15, 10, 19]", "cuda -keys=cuda,gpu -arch=sm_80 -max_num_threads=1024 -thread_warp_size=32", [-1, 16, 64, 49152, 2147483647, 1024, 8, 32], "", 0, []], [[], [["FU", 1, [0, 1, 2, 3]], ["SP", 1, 0, 17100, [60], 1], ["AN", 1, 0, 5], ["AN", 1, 1, 6]]]], "r": [[5.87801e-06], 0, 1.14306, 1718947078], "v": "v0.6"}
{"i": [["[\"isnan\", 6, 15, 10, 19]", "cuda -keys=cuda,gpu -arch=sm_80 -max_num_threads=1024 -thread_warp_size=32", [-1, 16, 64, 49152, 2147483647, 1024, 8, 32], "", 0, []], [[], [["FU", 1, [0, 1, 2, 3]], ["SP", 1, 0, 17100, [18], 1], ["AN", 1, 0, 5], ["AN", 1, 1, 6]]]], "r": [[6.9968e-06], 0, 1.00773, 1718947078], "v": "v0.6"}
