code_generation/generate/deprecated/deprecated_with_tvm_dependency/log/cuda/leaky_relu_cuda.log
{"i": [["[\"leaky_relu\", 12, 16, 2, 12]", "cuda -keys=cuda,gpu -arch=sm_80 -max_num_threads=1024 -thread_warp_size=32", [-1, 16, 64, 49152, 2147483647, 1024, 8, 32], "", 0, []], [[], [["FU", 1, [0, 1, 2, 3]], ["SP", 1, 0, 4608, [6], 1], ["AN", 1, 0, 5], ["AN", 1, 1, 6]]]], "r": [[6.60572e-06], 0, 1.84675, 1718950177], "v": "v0.6"}
{"i": [["[\"leaky_relu\", 12, 16, 2, 12]", "cuda -keys=cuda,gpu -arch=sm_80 -max_num_threads=1024 -thread_warp_size=32", [-1, 16, 64, 49152, 2147483647, 1024, 8, 32], "", 0, []], [[], [["FU", 1, [0, 1, 2, 3]], ["SP", 1, 0, 4608, [1], 1], ["AN", 1, 0, 5], ["AN", 1, 1, 6]]]], "r": [[1.31377e-05], 0, 1.20142, 1718950177], "v": "v0.6"}
{"i": [["[\"leaky_relu\", 12, 16, 2, 12]", "cuda -keys=cuda,gpu -arch=sm_80 -max_num_threads=1024 -thread_warp_size=32", [-1, 16, 64, 49152, 2147483647, 1024, 8, 32], "", 0, []], [[], [["FU", 1, [0, 1, 2, 3]], ["SP", 1, 0, 4608, [32], 1], ["AN", 1, 0, 5], ["AN", 1, 1, 6]]]], "r": [[5.43578e-06], 0, 1.12245, 1718950177], "v": "v0.6"}
{"i": [["[\"leaky_relu\", 12, 16, 2, 12]", "cuda -keys=cuda,gpu -arch=sm_80 -max_num_threads=1024 -thread_warp_size=32", [-1, 16, 64, 49152, 2147483647, 1024, 8, 32], "", 0, []], [[], [["FU", 1, [0, 1, 2, 3]], ["SP", 1, 0, 4608, [9], 1], ["AN", 1, 0, 5], ["AN", 1, 1, 6]]]], "r": [[6.44818e-06], 0, 1.45031, 1718950177], "v": "v0.6"}
{"i": [["[\"leaky_relu\", 12, 16, 2, 12]", "cuda -keys=cuda,gpu -arch=sm_80 -max_num_threads=1024 -thread_warp_size=32", [-1, 16, 64, 49152, 2147483647, 1024, 8, 32], "", 0, []], [[], [["FU", 1, [0, 1, 2, 3]], ["SP", 1, 0, 4608, [18], 1], ["AN", 1, 0, 5], ["AN", 1, 1, 6]]]], "r": [[5.82596e-06], 0, 1.10472, 1718950178], "v": "v0.6"}
{"i": [["[\"leaky_relu\", 12, 16, 2, 12]", "cuda -keys=cuda,gpu -arch=sm_80 -max_num_threads=1024 -thread_warp_size=32", [-1, 16, 64, 49152, 2147483647, 1024, 8, 32], "", 0, []], [[], [["FU", 1, [0, 1, 2, 3]], ["SP", 1, 0, 4608, [24], 1], ["AN", 1, 0, 5], ["AN", 1, 1, 6]]]], "r": [[9.11744e-06], 0, 1.48858, 1718950178], "v": "v0.6"}
{"i": [["[\"leaky_relu\", 12, 16, 2, 12]", "cuda -keys=cuda,gpu -arch=sm_80 -max_num_threads=1024 -thread_warp_size=32", [-1, 16, 64, 49152, 2147483647, 1024, 8, 32], "", 0, []], [[], [["FU", 1, [0, 1, 2, 3]], ["SP", 1, 0, 4608, [12], 1], ["AN", 1, 0, 5], ["AN", 1, 1, 6]]]], "r": [[1.1076e-05], 0, 1.37554, 1718950179], "v": "v0.6"}
{"i": [["[\"leaky_relu\", 12, 16, 2, 12]", "cuda -keys=cuda,gpu -arch=sm_80 -max_num_threads=1024 -thread_warp_size=32", [-1, 16, 64, 49152, 2147483647, 1024, 8, 32], "", 0, []], [[], [["FU", 1, [0, 1, 2, 3]], ["SP", 1, 0, 4608, [16], 1], ["AN", 1, 0, 5], ["AN", 1, 1, 6]]]], "r": [[6.20372e-06], 0, 1.30558, 1718950179], "v": "v0.6"}
{"i": [["[\"leaky_relu\", 12, 16, 2, 12]", "cuda -keys=cuda,gpu -arch=sm_80 -max_num_threads=1024 -thread_warp_size=32", [-1, 16, 64, 49152, 2147483647, 1024, 8, 32], "", 0, []], [[], [["FU", 1, [0, 1, 2, 3]], ["SP", 1, 0, 4608, [3], 1], ["AN", 1, 0, 5], ["AN", 1, 1, 6]]]], "r": [[7.80951e-06], 0, 1.01506, 1718950179], "v": "v0.6"}
{"i": [["[\"leaky_relu\", 12, 16, 2, 12]", "cuda -keys=cuda,gpu -arch=sm_80 -max_num_threads=1024 -thread_warp_size=32", [-1, 16, 64, 49152, 2147483647, 1024, 8, 32], "", 0, []], [[], [["FU", 1, [0, 1, 2, 3]], ["SP", 1, 0, 4608, [48], 1], ["AN", 1, 0, 5], ["AN", 1, 1, 6]]]], "r": [[5.5361e-06], 0, 1.10416, 1718950179], "v": "v0.6"}
