code_generation/generate/deprecated/deprecated_with_tvm_dependency/log/cuda/log2_cuda.log
{"i": [["[\"log2\", 5, 15, 11, 15]", "cuda -keys=cuda,gpu -arch=sm_80 -max_num_threads=1024 -thread_warp_size=32", [-1, 16, 64, 49152, 2147483647, 1024, 8, 32], "", 0, []], [[], [["FU", 1, [0, 1, 2, 3]], ["SP", 1, 0, 12375, [4], 1], ["AN", 1, 0, 5], ["AN", 1, 1, 6]]]], "r": [[1.28458e-05], 0, 3.207, 1718948022], "v": "v0.6"}
{"i": [["[\"log2\", 5, 15, 11, 15]", "cuda -keys=cuda,gpu -arch=sm_80 -max_num_threads=1024 -thread_warp_size=32", [-1, 16, 64, 49152, 2147483647, 1024, 8, 32], "", 0, []], [[], [["FU", 1, [0, 1, 2, 3]], ["SP", 1, 0, 12375, [32], 1], ["AN", 1, 0, 5], ["AN", 1, 1, 6]]]], "r": [[6.71774e-06], 0, 1.16249, 1718948022], "v": "v0.6"}
{"i": [["[\"log2\", 5, 15, 11, 15]", "cuda -keys=cuda,gpu -arch=sm_80 -max_num_threads=1024 -thread_warp_size=32", [-1, 16, 64, 49152, 2147483647, 1024, 8, 32], "", 0, []], [[], [["FU", 1, [0, 1, 2, 3]], ["SP", 1, 0, 12375, [25], 1], ["AN", 1, 0, 5], ["AN", 1, 1, 6]]]], "r": [[6.56577e-06], 0, 1.03462, 1718948023], "v": "v0.6"}
{"i": [["[\"log2\", 5, 15, 11, 15]", "cuda -keys=cuda,gpu -arch=sm_80 -max_num_threads=1024 -thread_warp_size=32", [-1, 16, 64, 49152, 2147483647, 1024, 8, 32], "", 0, []], [[], [["FU", 1, [0, 1, 2, 3]], ["SP", 1, 0, 12375, [16], 1], ["AN", 1, 0, 5], ["AN", 1, 1, 6]]]], "r": [[7.11602e-06], 0, 1.07643, 1718948023], "v": "v0.6"}
{"i": [["[\"log2\", 5, 15, 11, 15]", "cuda -keys=cuda,gpu -arch=sm_80 -max_num_threads=1024 -thread_warp_size=32", [-1, 16, 64, 49152, 2147483647, 1024, 8, 32], "", 0, []], [[], [["FU", 1, [0, 1, 2, 3]], ["SP", 1, 0, 12375, [12], 1], ["AN", 1, 0, 5], ["AN", 1, 1, 6]]]], "r": [[8.30335e-06], 0, 0.979209, 1718948023], "v": "v0.6"}
{"i": [["[\"log2\", 5, 15, 11, 15]", "cuda -keys=cuda,gpu -arch=sm_80 -max_num_threads=1024 -thread_warp_size=32", [-1, 16, 64, 49152, 2147483647, 1024, 8, 32], "", 0, []], [[], [["FU", 1, [0, 1, 2, 3]], ["SP", 1, 0, 12375, [3], 1], ["AN", 1, 0, 5], ["AN", 1, 1, 6]]]], "r": [[1.23192e-05], 0, 1.03599, 1718948024], "v": "v0.6"}
{"i": [["[\"log2\", 5, 15, 11, 15]", "cuda -keys=cuda,gpu -arch=sm_80 -max_num_threads=1024 -thread_warp_size=32", [-1, 16, 64, 49152, 2147483647, 1024, 8, 32], "", 0, []], [[], [["FU", 1, [0, 1, 2, 3]], ["SP", 1, 0, 12375, [46], 1], ["AN", 1, 0, 5], ["AN", 1, 1, 6]]]], "r": [[6.99921e-06], 0, 1.06754, 1718948024], "v": "v0.6"}
{"i": [["[\"log2\", 5, 15, 11, 15]", "cuda -keys=cuda,gpu -arch=sm_80 -max_num_threads=1024 -thread_warp_size=32", [-1, 16, 64, 49152, 2147483647, 1024, 8, 32], "", 0, []], [[], [["FU", 1, [0, 1, 2, 3]], ["SP", 1, 0, 12375, [15], 1], ["AN", 1, 0, 5], ["AN", 1, 1, 6]]]], "r": [[7.12556e-06], 0, 1.12814, 1718948024], "v": "v0.6"}
{"i": [["[\"log2\", 5, 15, 11, 15]", "cuda -keys=cuda,gpu -arch=sm_80 -max_num_threads=1024 -thread_warp_size=32", [-1, 16, 64, 49152, 2147483647, 1024, 8, 32], "", 0, []], [[], [["FU", 1, [0, 1, 2, 3]], ["SP", 1, 0, 12375, [45], 1], ["AN", 1, 0, 5], ["AN", 1, 1, 6]]]], "r": [[8.24564e-06], 0, 1.26173, 1718948025], "v": "v0.6"}
{"i": [["[\"log2\", 5, 15, 11, 15]", "cuda -keys=cuda,gpu -arch=sm_80 -max_num_threads=1024 -thread_warp_size=32", [-1, 16, 64, 49152, 2147483647, 1024, 8, 32], "", 0, []], [[], [["FU", 1, [0, 1, 2, 3]], ["SP", 1, 0, 12375, [1], 1], ["AN", 1, 0, 5], ["AN", 1, 1, 6]]]], "r": [[2.59169e-05], 0, 1.04431, 1718948025], "v": "v0.6"}
