code_generation/generate/deprecated/deprecated_with_tvm_dependency/log/cuda/log_softmax_cuda.log
{"i": [["[\"log_softmax\", 8, 13, 18, 13]", "cuda -keys=cuda,gpu -arch=sm_80 -max_num_threads=1024 -thread_warp_size=32", [-1, 16, 64, 49152, 2147483647, 1024, 8, 32], "", 0, []], [[], [["CHW", 3, "local"], ["CI", 3], ["FU", 4, [0, 1, 2, 3]], ["SP", 4, 0, 24336, [4], 1], ["AN", 4, 0, 5], ["AN", 4, 1, 6], ["FU", 2, [0, 1, 2]], ["SP", 2, 0, 1872, [32], 1], ["AN", 2, 0, 5], ["AN", 2, 1, 6], ["FU", 1, [0, 1, 2]], ["SP", 1, 0, 1872, [64], 1], ["AN", 1, 0, 5], ["AN", 1, 1, 6], ["PR", 1, 0, "auto_unroll_max_step$64"], ["PR", 2, 0, "auto_unroll_max_step$64"]]]], "r": [[2.94522e-05], 0, 1.55874, 1718950356], "v": "v0.6"}
{"i": [["[\"log_softmax\", 8, 13, 18, 13]", "cuda -keys=cuda,gpu -arch=sm_80 -max_num_threads=1024 -thread_warp_size=32", [-1, 16, 64, 49152, 2147483647, 1024, 8, 32], "", 0, []], [[], [["CHW", 3, "local"], ["CI", 3], ["FU", 4, [0, 1, 2, 3]], ["SP", 4, 0, 24336, [32], 1], ["AN", 4, 0, 5], ["AN", 4, 1, 6], ["FU", 2, [0, 1, 2]], ["SP", 2, 0, 1872, [16], 1], ["AN", 2, 0, 5], ["AN", 2, 1, 6], ["FU", 1, [0, 1, 2]], ["SP", 1, 0, 1872, [32], 1], ["AN", 1, 0, 5], ["AN", 1, 1, 6], ["PR", 1, 0, "auto_unroll_max_step$16"], ["PR", 2, 0, "auto_unroll_max_step$512"]]]], "r": [[1.92083e-05], 0, 1.36264, 1718950356], "v": "v0.6"}
{"i": [["[\"log_softmax\", 8, 13, 18, 13]", "cuda -keys=cuda,gpu -arch=sm_80 -max_num_threads=1024 -thread_warp_size=32", [-1, 16, 64, 49152, 2147483647, 1024, 8, 32], "", 0, []], [[], [["CHW", 3, "local"], ["CI", 3], ["FU", 4, [0, 1, 2, 3]], ["SP", 4, 0, 24336, [32], 1], ["AN", 4, 0, 5], ["AN", 4, 1, 6], ["FU", 2, [0, 1, 2]], ["SP", 2, 0, 1872, [32], 1], ["AN", 2, 0, 5], ["AN", 2, 1, 6], ["FU", 1, [0, 1, 2]], ["SP", 1, 0, 1872, [2], 1], ["AN", 1, 0, 5], ["AN", 1, 1, 6], ["PR", 1, 0, "auto_unroll_max_step$512"], ["PR", 2, 0, "auto_unroll_max_step$64"]]]], "r": [[2.05323e-05], 0, 1.17135, 1718950357], "v": "v0.6"}
{"i": [["[\"log_softmax\", 8, 13, 18, 13]", "cuda -keys=cuda,gpu -arch=sm_80 -max_num_threads=1024 -thread_warp_size=32", [-1, 16, 64, 49152, 2147483647, 1024, 8, 32], "", 0, []], [[], [["CHW", 3, "local"], ["CI", 3], ["FU", 4, [0, 1, 2, 3]], ["SP", 4, 0, 24336, [64], 1], ["AN", 4, 0, 5], ["AN", 4, 1, 6], ["FU", 2, [0, 1, 2]], ["SP", 2, 0, 1872, [16], 1], ["AN", 2, 0, 5], ["AN", 2, 1, 6], ["FU", 1, [0, 1, 2]], ["SP", 1, 0, 1872, [32], 1], ["AN", 1, 0, 5], ["AN", 1, 1, 6], ["PR", 1, 0, "auto_unroll_max_step$512"], ["PR", 2, 0, "auto_unroll_max_step$16"]]]], "r": [[1.87314e-05], 0, 1.37719, 1718950357], "v": "v0.6"}
{"i": [["[\"log_softmax\", 8, 13, 18, 13]", "cuda -keys=cuda,gpu -arch=sm_80 -max_num_threads=1024 -thread_warp_size=32", [-1, 16, 64, 49152, 2147483647, 1024, 8, 32], "", 0, []], [[], [["CHW", 3, "local"], ["CI", 3], ["FU", 4, [0, 1, 2, 3]], ["SP", 4, 0, 24336, [32], 1], ["AN", 4, 0, 5], ["AN", 4, 1, 6], ["FU", 2, [0, 1, 2]], ["SP", 2, 0, 1872, [2], 1], ["AN", 2, 0, 5], ["AN", 2, 1, 6], ["FU", 1, [0, 1, 2]], ["SP", 1, 0, 1872, [32], 1], ["AN", 1, 0, 5], ["AN", 1, 1, 6], ["PR", 1, 0, "auto_unroll_max_step$512"], ["PR", 2, 0, "auto_unroll_max_step$64"]]]], "r": [[2.2562e-05], 0, 1.2768, 1718950357], "v": "v0.6"}
{"i": [["[\"log_softmax\", 8, 13, 18, 13]", "cuda -keys=cuda,gpu -arch=sm_80 -max_num_threads=1024 -thread_warp_size=32", [-1, 16, 64, 49152, 2147483647, 1024, 8, 32], "", 0, []], [[], [["CHW", 3, "local"], ["CI", 3], ["FU", 4, [0, 1, 2, 3]], ["SP", 4, 0, 24336, [32], 1], ["AN", 4, 0, 5], ["AN", 4, 1, 6], ["FU", 2, [0, 1, 2]], ["SP", 2, 0, 1872, [16], 1], ["AN", 2, 0, 5], ["AN", 2, 1, 6], ["FU", 1, [0, 1, 2]], ["SP", 1, 0, 1872, [4], 1], ["AN", 1, 0, 5], ["AN", 1, 1, 6], ["PR", 1, 0, "auto_unroll_max_step$512"], ["PR", 2, 0, "auto_unroll_max_step$1024"]]]], "r": [[2.00068e-05], 0, 1.07042, 1718950358], "v": "v0.6"}
{"i": [["[\"log_softmax\", 8, 13, 18, 13]", "cuda -keys=cuda,gpu -arch=sm_80 -max_num_threads=1024 -thread_warp_size=32", [-1, 16, 64, 49152, 2147483647, 1024, 8, 32], "", 0, []], [[], [["CHW", 3, "local"], ["CI", 3], ["FU", 4, [0, 1, 2, 3]], ["SP", 4, 0, 24336, [4], 1], ["AN", 4, 0, 5], ["AN", 4, 1, 6], ["FU", 2, [0, 1, 2]], ["SP", 2, 0, 1872, [32], 1], ["AN", 2, 0, 5], ["AN", 2, 1, 6], ["FU", 1, [0, 1, 2]], ["SP", 1, 0, 1872, [64], 1], ["AN", 1, 0, 5], ["AN", 1, 1, 6], ["PR", 1, 0, "auto_unroll_max_step$16"], ["PR", 2, 0, "auto_unroll_max_step$16"]]]], "r": [[2.83797e-05], 0, 1.16007, 1718950358], "v": "v0.6"}
{"i": [["[\"log_softmax\", 8, 13, 18, 13]", "cuda -keys=cuda,gpu -arch=sm_80 -max_num_threads=1024 -thread_warp_size=32", [-1, 16, 64, 49152, 2147483647, 1024, 8, 32], "", 0, []], [[], [["CHW", 3, "local"], ["CI", 3], ["FU", 4, [0, 1, 2, 3]], ["SP", 4, 0, 24336, [1], 1], ["AN", 4, 0, 5], ["AN", 4, 1, 6], ["FU", 2, [0, 1, 2]], ["SP", 2, 0, 1872, [32], 1], ["AN", 2, 0, 5], ["AN", 2, 1, 6], ["FU", 1, [0, 1, 2]], ["SP", 1, 0, 1872, [2], 1], ["AN", 1, 0, 5], ["AN", 1, 1, 6], ["PR", 1, 0, "auto_unroll_max_step$1024"], ["PR", 2, 0, "auto_unroll_max_step$1024"]]]], "r": [[5.96348e-05], 0, 1.31633, 1718950358], "v": "v0.6"}
{"i": [["[\"log_softmax\", 8, 13, 18, 13]", "cuda -keys=cuda,gpu -arch=sm_80 -max_num_threads=1024 -thread_warp_size=32", [-1, 16, 64, 49152, 2147483647, 1024, 8, 32], "", 0, []], [[], [["CHW", 3, "local"], ["CI", 3], ["FU", 4, [0, 1, 2, 3]], ["SP", 4, 0, 24336, [32], 1], ["AN", 4, 0, 5], ["AN", 4, 1, 6], ["FU", 2, [0, 1, 2]], ["SP", 2, 0, 1872, [32], 1], ["AN", 2, 0, 5], ["AN", 2, 1, 6], ["FU", 1, [0, 1, 2]], ["SP", 1, 0, 1872, [2], 1], ["AN", 1, 0, 5], ["AN", 1, 1, 6], ["PR", 1, 0, "auto_unroll_max_step$64"], ["PR", 2, 0, "auto_unroll_max_step$16"]]]], "r": [[2.05323e-05], 0, 1.01671, 1718950359], "v": "v0.6"}
{"i": [["[\"log_softmax\", 8, 13, 18, 13]", "cuda -keys=cuda,gpu -arch=sm_80 -max_num_threads=1024 -thread_warp_size=32", [-1, 16, 64, 49152, 2147483647, 1024, 8, 32], "", 0, []], [[], [["CHW", 3, "local"], ["CI", 3], ["FU", 4, [0, 1, 2, 3]], ["SP", 4, 0, 24336, [32], 1], ["AN", 4, 0, 5], ["AN", 4, 1, 6], ["FU", 2, [0, 1, 2]], ["SP", 2, 0, 1872, [64], 1], ["AN", 2, 0, 5], ["AN", 2, 1, 6], ["FU", 1, [0, 1, 2]], ["SP", 1, 0, 1872, [32], 1], ["AN", 1, 0, 5], ["AN", 1, 1, 6], ["PR", 1, 0, "auto_unroll_max_step$512"], ["PR", 2, 0, "auto_unroll_max_step$0"]]]], "r": [[1.98454e-05], 0, 1.23801, 1718950359], "v": "v0.6"}
