code_generation/generate/deprecated/deprecated_with_tvm_dependency/log/cuda/log_cuda.log
{"i": [["[\"log\", 1, 17, 4, 3]", "cuda -keys=cuda,gpu -arch=sm_80 -max_num_threads=1024 -thread_warp_size=32", [-1, 16, 64, 49152, 2147483647, 1024, 8, 32], "", 0, []], [[], [["FU", 1, [0, 1, 2, 3]], ["SP", 1, 0, 204, [3], 1], ["AN", 1, 0, 5], ["AN", 1, 1, 6]]]], "r": [[5.45239e-06], 0, 1.48587, 1718947263], "v": "v0.6"}
{"i": [["[\"log\", 1, 17, 4, 3]", "cuda -keys=cuda,gpu -arch=sm_80 -max_num_threads=1024 -thread_warp_size=32", [-1, 16, 64, 49152, 2147483647, 1024, 8, 32], "", 0, []], [[], [["FU", 1, [0, 1, 2, 3]], ["SP", 1, 0, 204, [48], 1], ["AN", 1, 0, 5], ["AN", 1, 1, 6]]]], "r": [[5.45933e-06], 0, 0.974571, 1718947264], "v": "v0.6"}
{"i": [["[\"log\", 1, 17, 4, 3]", "cuda -keys=cuda,gpu -arch=sm_80 -max_num_threads=1024 -thread_warp_size=32", [-1, 16, 64, 49152, 2147483647, 1024, 8, 32], "", 0, []], [[], [["FU", 1, [0, 1, 2, 3]], ["SP", 1, 0, 204, [34], 1], ["AN", 1, 0, 5], ["AN", 1, 1, 6]]]], "r": [[5.46648e-06], 0, 0.812157, 1718947264], "v": "v0.6"}
{"i": [["[\"log\", 1, 17, 4, 3]", "cuda -keys=cuda,gpu -arch=sm_80 -max_num_threads=1024 -thread_warp_size=32", [-1, 16, 64, 49152, 2147483647, 1024, 8, 32], "", 0, []], [[], [["FU", 1, [0, 1, 2, 3]], ["SP", 1, 0, 204, [16], 1], ["AN", 1, 0, 5], ["AN", 1, 1, 6]]]], "r": [[5.36064e-06], 0, 0.951967, 1718947264], "v": "v0.6"}
{"i": [["[\"log\", 1, 17, 4, 3]", "cuda -keys=cuda,gpu -arch=sm_80 -max_num_threads=1024 -thread_warp_size=32", [-1, 16, 64, 49152, 2147483647, 1024, 8, 32], "", 0, []], [[], [["FU", 1, [0, 1, 2, 3]], ["SP", 1, 0, 204, [8], 1], ["AN", 1, 0, 5], ["AN", 1, 1, 6]]]], "r": [[5.45226e-06], 0, 0.959653, 1718947264], "v": "v0.6"}
{"i": [["[\"log\", 1, 17, 4, 3]", "cuda -keys=cuda,gpu -arch=sm_80 -max_num_threads=1024 -thread_warp_size=32", [-1, 16, 64, 49152, 2147483647, 1024, 8, 32], "", 0, []], [[], [["FU", 1, [0, 1, 2, 3]], ["SP", 1, 0, 204, [2], 1], ["AN", 1, 0, 5], ["AN", 1, 1, 6]]]], "r": [[6.28741e-06], 0, 0.872813, 1718947265], "v": "v0.6"}
{"i": [["[\"log\", 1, 17, 4, 3]", "cuda -keys=cuda,gpu -arch=sm_80 -max_num_threads=1024 -thread_warp_size=32", [-1, 16, 64, 49152, 2147483647, 1024, 8, 32], "", 0, []], [[], [["FU", 1, [0, 1, 2, 3]], ["SP", 1, 0, 204, [12], 1], ["AN", 1, 0, 5], ["AN", 1, 1, 6]]]], "r": [[5.88033e-06], 0, 0.996723, 1718947265], "v": "v0.6"}
{"i": [["[\"log\", 1, 17, 4, 3]", "cuda -keys=cuda,gpu -arch=sm_80 -max_num_threads=1024 -thread_warp_size=32", [-1, 16, 64, 49152, 2147483647, 1024, 8, 32], "", 0, []], [[], [["FU", 1, [0, 1, 2, 3]], ["SP", 1, 0, 204, [51], 1], ["AN", 1, 0, 5], ["AN", 1, 1, 6]]]], "r": [[6.05177e-06], 0, 0.978337, 1718947265], "v": "v0.6"}
{"i": [["[\"log\", 1, 17, 4, 3]", "cuda -keys=cuda,gpu -arch=sm_80 -max_num_threads=1024 -thread_warp_size=32", [-1, 16, 64, 49152, 2147483647, 1024, 8, 32], "", 0, []], [[], [["FU", 1, [0, 1, 2, 3]], ["SP", 1, 0, 204, [64], 1], ["AN", 1, 0, 5], ["AN", 1, 1, 6]]]], "r": [[5.47898e-06], 0, 0.868535, 1718947266], "v": "v0.6"}
{"i": [["[\"log\", 1, 17, 4, 3]", "cuda -keys=cuda,gpu -arch=sm_80 -max_num_threads=1024 -thread_warp_size=32", [-1, 16, 64, 49152, 2147483647, 1024, 8, 32], "", 0, []], [[], [["FU", 1, [0, 1, 2, 3]], ["SP", 1, 0, 204, [24], 1], ["AN", 1, 0, 5], ["AN", 1, 1, 6]]]], "r": [[6.97215e-06], 0, 0.938457, 1718947266], "v": "v0.6"}
