code_generation/generate/deprecated/deprecated_with_tvm_dependency/log/cuda/max_cuda.log
{"i": [["[\"max\", 2, 20, 5, 18]", "cuda -keys=cuda,gpu -arch=sm_80 -max_num_threads=1024 -thread_warp_size=32", [-1, 16, 64, 49152, 2147483647, 1024, 8, 32], "", 0, []], [[], [["FU", 1, [0, 1, 2, 3]], ["SP", 1, 0, 3600, [32], 1], ["AN", 1, 1, 6], ["FU", 1, []], ["AN", 1, 0, 5], ["PR", 1, 0, "auto_unroll_max_step$0"]]]], "r": [[2.78624e-05], 0, 1.51278, 1718948116], "v": "v0.6"}
{"i": [["[\"max\", 2, 20, 5, 18]", "cuda -keys=cuda,gpu -arch=sm_80 -max_num_threads=1024 -thread_warp_size=32", [-1, 16, 64, 49152, 2147483647, 1024, 8, 32], "", 0, []], [[], [["FU", 1, []], ["AN", 1, 0, 6], ["PR", 1, 0, "auto_unroll_max_step$1024"]]]], "r": [[9.30866e-05], 0, 1.2492, 1718948117], "v": "v0.6"}
{"i": [["[\"max\", 2, 20, 5, 18]", "cuda -keys=cuda,gpu -arch=sm_80 -max_num_threads=1024 -thread_warp_size=32", [-1, 16, 64, 49152, 2147483647, 1024, 8, 32], "", 0, []], [[], [["FU", 1, [0, 1, 2, 3]], ["SP", 1, 0, 3600, [32], 1], ["AN", 1, 1, 6], ["FU", 1, []], ["AN", 1, 0, 5], ["PR", 1, 0, "auto_unroll_max_step$64"]]]], "r": [[2.80529e-05], 0, 1.08955, 1718948117], "v": "v0.6"}
{"i": [["[\"max\", 2, 20, 5, 18]", "cuda -keys=cuda,gpu -arch=sm_80 -max_num_threads=1024 -thread_warp_size=32", [-1, 16, 64, 49152, 2147483647, 1024, 8, 32], "", 0, []], [[], [["FU", 1, []], ["AN", 1, 0, 6], ["PR", 1, 0, "auto_unroll_max_step$512"]]]], "r": [[9.33812e-05], 0, 1.12069, 1718948117], "v": "v0.6"}
{"i": [["[\"max\", 2, 20, 5, 18]", "cuda -keys=cuda,gpu -arch=sm_80 -max_num_threads=1024 -thread_warp_size=32", [-1, 16, 64, 49152, 2147483647, 1024, 8, 32], "", 0, []], [[], [["FU", 1, []], ["AN", 1, 0, 6], ["PR", 1, 0, "auto_unroll_max_step$16"]]]], "r": [[9.31338e-05], 0, 1.02549, 1718948118], "v": "v0.6"}
