code_generation/generate/deprecated/deprecated_with_tvm_dependency/log/cuda/min_cuda.log
{"i": [["[\"min\", 7, 7, 12, 11]", "cuda -keys=cuda,gpu -arch=sm_80 -max_num_threads=1024 -thread_warp_size=32", [-1, 16, 64, 49152, 2147483647, 1024, 8, 32], "", 0, []], [[], [["FU", 1, [0, 1, 2, 3]], ["SP", 1, 0, 6468, [32], 1], ["AN", 1, 1, 6], ["FU", 1, []], ["AN", 1, 0, 5], ["PR", 1, 0, "auto_unroll_max_step$512"]]]], "r": [[4.27721e-05], 0, 1.27956, 1718948279], "v": "v0.6"}
{"i": [["[\"min\", 7, 7, 12, 11]", "cuda -keys=cuda,gpu -arch=sm_80 -max_num_threads=1024 -thread_warp_size=32", [-1, 16, 64, 49152, 2147483647, 1024, 8, 32], "", 0, []], [[], [["FU", 1, []], ["AN", 1, 0, 6], ["PR", 1, 0, "auto_unroll_max_step$16"]]]], "r": [[0.000176975], 0, 0.936387, 1718948279], "v": "v0.6"}
{"i": [["[\"min\", 7, 7, 12, 11]", "cuda -keys=cuda,gpu -arch=sm_80 -max_num_threads=1024 -thread_warp_size=32", [-1, 16, 64, 49152, 2147483647, 1024, 8, 32], "", 0, []], [[], [["FU", 1, [0, 1, 2, 3]], ["SP", 1, 0, 6468, [32], 1], ["AN", 1, 1, 6], ["FU", 1, []], ["AN", 1, 0, 5], ["PR", 1, 0, "auto_unroll_max_step$64"]]]], "r": [[4.30114e-05], 0, 0.817937, 1718948279], "v": "v0.6"}
{"i": [["[\"min\", 7, 7, 12, 11]", "cuda -keys=cuda,gpu -arch=sm_80 -max_num_threads=1024 -thread_warp_size=32", [-1, 16, 64, 49152, 2147483647, 1024, 8, 32], "", 0, []], [[], [["FU", 1, [0, 1, 2, 3]], ["SP", 1, 0, 6468, [32], 1], ["AN", 1, 1, 6], ["FU", 1, []], ["AN", 1, 0, 5], ["PR", 1, 0, "auto_unroll_max_step$1024"]]]], "r": [[4.27961e-05], 0, 1.03888, 1718948280], "v": "v0.6"}
{"i": [["[\"min\", 7, 7, 12, 11]", "cuda -keys=cuda,gpu -arch=sm_80 -max_num_threads=1024 -thread_warp_size=32", [-1, 16, 64, 49152, 2147483647, 1024, 8, 32], "", 0, []], [[], [["FU", 1, [0, 1, 2, 3]], ["SP", 1, 0, 6468, [32], 1], ["AN", 1, 1, 6], ["FU", 1, []], ["AN", 1, 0, 5], ["PR", 1, 0, "auto_unroll_max_step$0"]]]], "r": [[4.2731e-05], 0, 0.829692, 1718948280], "v": "v0.6"}
