code_generation/generate/deprecated/deprecated_with_tvm_dependency/log/cuda/mirror_pad_cuda.log
{"i": [["[\"mirror_pad\", 6, 6, 12, 14]", "cuda -keys=cuda,gpu -arch=sm_80 -max_num_threads=1024 -thread_warp_size=32", [-1, 16, 64, 49152, 2147483647, 1024, 8, 32], "", 0, []], [[], [["FU", 1, [0, 1]], ["SP", 1, 0, 255, [7], 1], ["AN", 1, 0, 5], ["AN", 1, 1, 6]]]], "r": [[7.52723e-06], 0, 1.64487, 1718951166], "v": "v0.6"}
{"i": [["[\"mirror_pad\", 6, 6, 12, 14]", "cuda -keys=cuda,gpu -arch=sm_80 -max_num_threads=1024 -thread_warp_size=32", [-1, 16, 64, 49152, 2147483647, 1024, 8, 32], "", 0, []], [[], [["FU", 1, [0, 1]], ["SP", 1, 0, 255, [4], 1], ["AN", 1, 0, 5], ["AN", 1, 1, 6]]]], "r": [[9.71662e-06], 0, 1.1059, 1718951166], "v": "v0.6"}
{"i": [["[\"mirror_pad\", 6, 6, 12, 14]", "cuda -keys=cuda,gpu -arch=sm_80 -max_num_threads=1024 -thread_warp_size=32", [-1, 16, 64, 49152, 2147483647, 1024, 8, 32], "", 0, []], [[], [["FU", 1, [0, 1]], ["SP", 1, 0, 255, [6], 1], ["AN", 1, 0, 5], ["AN", 1, 1, 6]]]], "r": [[7.53416e-06], 0, 1.03363, 1718951166], "v": "v0.6"}
{"i": [["[\"mirror_pad\", 6, 6, 12, 14]", "cuda -keys=cuda,gpu -arch=sm_80 -max_num_threads=1024 -thread_warp_size=32", [-1, 16, 64, 49152, 2147483647, 1024, 8, 32], "", 0, []], [[], [["FU", 1, [0, 1]], ["SP", 1, 0, 255, [63], 1], ["AN", 1, 0, 5], ["AN", 1, 1, 6]]]], "r": [[5.47714e-06], 0, 1.04546, 1718951167], "v": "v0.6"}
{"i": [["[\"mirror_pad\", 6, 6, 12, 14]", "cuda -keys=cuda,gpu -arch=sm_80 -max_num_threads=1024 -thread_warp_size=32", [-1, 16, 64, 49152, 2147483647, 1024, 8, 32], "", 0, []], [[], [["FU", 1, [0, 1]], ["SP", 1, 0, 255, [18], 1], ["AN", 1, 0, 5], ["AN", 1, 1, 6]]]], "r": [[6.32079e-06], 0, 1.16527, 1718951167], "v": "v0.6"}
{"i": [["[\"mirror_pad\", 6, 6, 12, 14]", "cuda -keys=cuda,gpu -arch=sm_80 -max_num_threads=1024 -thread_warp_size=32", [-1, 16, 64, 49152, 2147483647, 1024, 8, 32], "", 0, []], [[], [["FU", 1, [0, 1]], ["SP", 1, 0, 255, [42], 1], ["AN", 1, 0, 5], ["AN", 1, 1, 6]]]], "r": [[8.49142e-06], 0, 1.04832, 1718951167], "v": "v0.6"}
{"i": [["[\"mirror_pad\", 6, 6, 12, 14]", "cuda -keys=cuda,gpu -arch=sm_80 -max_num_threads=1024 -thread_warp_size=32", [-1, 16, 64, 49152, 2147483647, 1024, 8, 32], "", 0, []], [[], [["FU", 1, [0, 1]], ["SP", 1, 0, 255, [14], 1], ["AN", 1, 0, 5], ["AN", 1, 1, 6]]]], "r": [[5.5465e-06], 0, 0.956203, 1718951168], "v": "v0.6"}
{"i": [["[\"mirror_pad\", 6, 6, 12, 14]", "cuda -keys=cuda,gpu -arch=sm_80 -max_num_threads=1024 -thread_warp_size=32", [-1, 16, 64, 49152, 2147483647, 1024, 8, 32], "", 0, []], [[], [["FU", 1, [0, 1]], ["SP", 1, 0, 255, [48], 1], ["AN", 1, 0, 5], ["AN", 1, 1, 6]]]], "r": [[5.54621e-06], 0, 0.930588, 1718951168], "v": "v0.6"}
{"i": [["[\"mirror_pad\", 6, 6, 12, 14]", "cuda -keys=cuda,gpu -arch=sm_80 -max_num_threads=1024 -thread_warp_size=32", [-1, 16, 64, 49152, 2147483647, 1024, 8, 32], "", 0, []], [[], [["FU", 1, [0, 1]], ["SP", 1, 0, 255, [1], 1], ["AN", 1, 0, 5], ["AN", 1, 1, 6]]]], "r": [[5.88464e-06], 0, 1.00743, 1718951168], "v": "v0.6"}
{"i": [["[\"mirror_pad\", 6, 6, 12, 14]", "cuda -keys=cuda,gpu -arch=sm_80 -max_num_threads=1024 -thread_warp_size=32", [-1, 16, 64, 49152, 2147483647, 1024, 8, 32], "", 0, []], [[], [["FU", 1, [0, 1]], ["SP", 1, 0, 255, [17], 1], ["AN", 1, 0, 5], ["AN", 1, 1, 6]]]], "r": [[6.04242e-06], 0, 0.979883, 1718951168], "v": "v0.6"}
