code_generation/generate/deprecated/deprecated_with_tvm_dependency/log/cuda/multi_out_op_cuda.log
{"i": [["[\"multi_out_op\", 13, 20, 2, 6]", "cuda -keys=cuda,gpu -arch=sm_80 -max_num_threads=1024 -thread_warp_size=32", [-1, 16, 64, 49152, 2147483647, 1024, 8, 32], "", 0, []], [[], [["CI", 2], ["FU", 4, [0, 1, 2, 3]], ["SP", 4, 0, 3120, [8], 1], ["AN", 4, 0, 5], ["AN", 4, 1, 6], ["FU", 3, [0, 1, 2, 3]], ["SP", 3, 0, 3120, [2], 1], ["AN", 3, 0, 5], ["AN", 3, 1, 6]]]], "r": [[1.51269e-05], 0, 0.946872, 1719822887], "v": "v0.6"}
{"i": [["[\"multi_out_op\", 13, 20, 2, 6]", "cuda -keys=cuda,gpu -arch=sm_80 -max_num_threads=1024 -thread_warp_size=32", [-1, 16, 64, 49152, 2147483647, 1024, 8, 32], "", 0, []], [[], [["CI", 2], ["FU", 4, [0, 1, 2, 3]], ["SP", 4, 0, 3120, [16], 1], ["AN", 4, 0, 5], ["AN", 4, 1, 6], ["FU", 3, [0, 1, 2, 3]], ["SP", 3, 0, 3120, [5], 1], ["AN", 3, 0, 5], ["AN", 3, 1, 6]]]], "r": [[1.28446e-05], 0, 0.570894, 1719822888], "v": "v0.6"}
{"i": [["[\"multi_out_op\", 13, 20, 2, 6]", "cuda -keys=cuda,gpu -arch=sm_80 -max_num_threads=1024 -thread_warp_size=32", [-1, 16, 64, 49152, 2147483647, 1024, 8, 32], "", 0, []], [[], [["CI", 2], ["FU", 4, [0, 1, 2, 3]], ["SP", 4, 0, 3120, [5], 1], ["AN", 4, 0, 5], ["AN", 4, 1, 6], ["FU", 3, [0, 1, 2, 3]], ["SP", 3, 0, 3120, [16], 1], ["AN", 3, 0, 5], ["AN", 3, 1, 6]]]], "r": [[1.2535e-05], 0, 0.587371, 1719822888], "v": "v0.6"}
{"i": [["[\"multi_out_op\", 13, 20, 2, 6]", "cuda -keys=cuda,gpu -arch=sm_80 -max_num_threads=1024 -thread_warp_size=32", [-1, 16, 64, 49152, 2147483647, 1024, 8, 32], "", 0, []], [[], [["CI", 2], ["FU", 4, [0, 1, 2, 3]], ["SP", 4, 0, 3120, [2], 1], ["AN", 4, 0, 5], ["AN", 4, 1, 6], ["FU", 3, [0, 1, 2, 3]], ["SP", 3, 0, 3120, [2], 1], ["AN", 3, 0, 5], ["AN", 3, 1, 6]]]], "r": [[1.68566e-05], 0, 0.585126, 1719822888], "v": "v0.6"}
{"i": [["[\"multi_out_op\", 13, 20, 2, 6]", "cuda -keys=cuda,gpu -arch=sm_80 -max_num_threads=1024 -thread_warp_size=32", [-1, 16, 64, 49152, 2147483647, 1024, 8, 32], "", 0, []], [[], [["CI", 2], ["FU", 4, [0, 1, 2, 3]], ["SP", 4, 0, 3120, [8], 1], ["AN", 4, 0, 5], ["AN", 4, 1, 6], ["FU", 3, [0, 1, 2, 3]], ["SP", 3, 0, 3120, [6], 1], ["AN", 3, 0, 5], ["AN", 3, 1, 6]]]], "r": [[1.31589e-05], 0, 0.589426, 1719822888], "v": "v0.6"}
{"i": [["[\"multi_out_op\", 13, 20, 2, 6]", "cuda -keys=cuda,gpu -arch=sm_80 -max_num_threads=1024 -thread_warp_size=32", [-1, 16, 64, 49152, 2147483647, 1024, 8, 32], "", 0, []], [[], [["CI", 2], ["FU", 4, [0, 1, 2, 3]], ["SP", 4, 0, 3120, [10], 1], ["AN", 4, 0, 5], ["AN", 4, 1, 6], ["FU", 3, [0, 1, 2, 3]], ["SP", 3, 0, 3120, [8], 1], ["AN", 3, 0, 5], ["AN", 3, 1, 6]]]], "r": [[1.24209e-05], 0, 0.553552, 1719822889], "v": "v0.6"}
{"i": [["[\"multi_out_op\", 13, 20, 2, 6]", "cuda -keys=cuda,gpu -arch=sm_80 -max_num_threads=1024 -thread_warp_size=32", [-1, 16, 64, 49152, 2147483647, 1024, 8, 32], "", 0, []], [[], [["CI", 2], ["FU", 4, [0, 1, 2, 3]], ["SP", 4, 0, 3120, [8], 1], ["AN", 4, 0, 5], ["AN", 4, 1, 6], ["FU", 3, [0, 1, 2, 3]], ["SP", 3, 0, 3120, [24], 1], ["AN", 3, 0, 5], ["AN", 3, 1, 6]]]], "r": [[1.22259e-05], 0, 0.602429, 1719822889], "v": "v0.6"}
{"i": [["[\"multi_out_op\", 13, 20, 2, 6]", "cuda -keys=cuda,gpu -arch=sm_80 -max_num_threads=1024 -thread_warp_size=32", [-1, 16, 64, 49152, 2147483647, 1024, 8, 32], "", 0, []], [[], [["CI", 2], ["FU", 4, [0, 1, 2, 3]], ["SP", 4, 0, 3120, [16], 1], ["AN", 4, 0, 5], ["AN", 4, 1, 6], ["FU", 3, [0, 1, 2, 3]], ["SP", 3, 0, 3120, [4], 1], ["AN", 3, 0, 5], ["AN", 3, 1, 6]]]], "r": [[1.27688e-05], 0, 0.594693, 1719822889], "v": "v0.6"}
{"i": [["[\"multi_out_op\", 13, 20, 2, 6]", "cuda -keys=cuda,gpu -arch=sm_80 -max_num_threads=1024 -thread_warp_size=32", [-1, 16, 64, 49152, 2147483647, 1024, 8, 32], "", 0, []], [[], [["CI", 2], ["FU", 4, [0, 1, 2, 3]], ["SP", 4, 0, 3120, [3], 1], ["AN", 4, 0, 5], ["AN", 4, 1, 6], ["FU", 3, [0, 1, 2, 3]], ["SP", 3, 0, 3120, [1], 1], ["AN", 3, 0, 5], ["AN", 3, 1, 6]]]], "r": [[1.85556e-05], 0, 0.58764, 1719822889], "v": "v0.6"}
{"i": [["[\"multi_out_op\", 13, 20, 2, 6]", "cuda -keys=cuda,gpu -arch=sm_80 -max_num_threads=1024 -thread_warp_size=32", [-1, 16, 64, 49152, 2147483647, 1024, 8, 32], "", 0, []], [[], [["CI", 2], ["FU", 4, [0, 1, 2, 3]], ["SP", 4, 0, 3120, [52], 1], ["AN", 4, 0, 5], ["AN", 4, 1, 6], ["FU", 3, [0, 1, 2, 3]], ["SP", 3, 0, 3120, [1], 1], ["AN", 3, 0, 5], ["AN", 3, 1, 6]]]], "r": [[1.67985e-05], 0, 0.599448, 1719822890], "v": "v0.6"}
