code_generation/generate/deprecated/deprecated_with_tvm_dependency/log/cuda/negative_cuda.log
{"i": [["[\"negative\", 10, 6, 14, 18]", "cuda -keys=cuda,gpu -arch=sm_80 -max_num_threads=1024 -thread_warp_size=32", [-1, 16, 64, 49152, 2147483647, 1024, 8, 32], "", 0, []], [[], [["FU", 1, [0, 1, 2, 3]], ["SP", 1, 0, 15120, [42], 1], ["AN", 1, 0, 5], ["AN", 1, 1, 6]]]], "r": [[6.31892e-06], 0, 1.55233, 1718948579], "v": "v0.6"}
{"i": [["[\"negative\", 10, 6, 14, 18]", "cuda -keys=cuda,gpu -arch=sm_80 -max_num_threads=1024 -thread_warp_size=32", [-1, 16, 64, 49152, 2147483647, 1024, 8, 32], "", 0, []], [[], [["FU", 1, [0, 1, 2, 3]], ["SP", 1, 0, 15120, [30], 1], ["AN", 1, 0, 5], ["AN", 1, 1, 6]]]], "r": [[6.18936e-06], 0, 1.03104, 1718948580], "v": "v0.6"}
{"i": [["[\"negative\", 10, 6, 14, 18]", "cuda -keys=cuda,gpu -arch=sm_80 -max_num_threads=1024 -thread_warp_size=32", [-1, 16, 64, 49152, 2147483647, 1024, 8, 32], "", 0, []], [[], [["FU", 1, [0, 1, 2, 3]], ["SP", 1, 0, 15120, [20], 1], ["AN", 1, 0, 5], ["AN", 1, 1, 6]]]], "r": [[6.86819e-06], 0, 0.868875, 1718948580], "v": "v0.6"}
{"i": [["[\"negative\", 10, 6, 14, 18]", "cuda -keys=cuda,gpu -arch=sm_80 -max_num_threads=1024 -thread_warp_size=32", [-1, 16, 64, 49152, 2147483647, 1024, 8, 32], "", 0, []], [[], [["FU", 1, [0, 1, 2, 3]], ["SP", 1, 0, 15120, [24], 1], ["AN", 1, 0, 5], ["AN", 1, 1, 6]]]], "r": [[6.55704e-06], 0, 0.987857, 1718948580], "v": "v0.6"}
{"i": [["[\"negative\", 10, 6, 14, 18]", "cuda -keys=cuda,gpu -arch=sm_80 -max_num_threads=1024 -thread_warp_size=32", [-1, 16, 64, 49152, 2147483647, 1024, 8, 32], "", 0, []], [[], [["FU", 1, [0, 1, 2, 3]], ["SP", 1, 0, 15120, [6], 1], ["AN", 1, 0, 5], ["AN", 1, 1, 6]]]], "r": [[9.62925e-06], 0, 1.01362, 1718948580], "v": "v0.6"}
{"i": [["[\"negative\", 10, 6, 14, 18]", "cuda -keys=cuda,gpu -arch=sm_80 -max_num_threads=1024 -thread_warp_size=32", [-1, 16, 64, 49152, 2147483647, 1024, 8, 32], "", 0, []], [[], [["FU", 1, [0, 1, 2, 3]], ["SP", 1, 0, 15120, [12], 1], ["AN", 1, 0, 5], ["AN", 1, 1, 6]]]], "r": [[7.32758e-06], 0, 1.14092, 1718948581], "v": "v0.6"}
{"i": [["[\"negative\", 10, 6, 14, 18]", "cuda -keys=cuda,gpu -arch=sm_80 -max_num_threads=1024 -thread_warp_size=32", [-1, 16, 64, 49152, 2147483647, 1024, 8, 32], "", 0, []], [[], [["FU", 1, [0, 1, 2, 3]], ["SP", 1, 0, 15120, [36], 1], ["AN", 1, 0, 5], ["AN", 1, 1, 6]]]], "r": [[6.43642e-06], 0, 1.07919, 1718948581], "v": "v0.6"}
{"i": [["[\"negative\", 10, 6, 14, 18]", "cuda -keys=cuda,gpu -arch=sm_80 -max_num_threads=1024 -thread_warp_size=32", [-1, 16, 64, 49152, 2147483647, 1024, 8, 32], "", 0, []], [[], [["FU", 1, [0, 1, 2, 3]], ["SP", 1, 0, 15120, [3], 1], ["AN", 1, 0, 5], ["AN", 1, 1, 6]]]], "r": [[1.4091e-05], 0, 1.16119, 1718948581], "v": "v0.6"}
{"i": [["[\"negative\", 10, 6, 14, 18]", "cuda -keys=cuda,gpu -arch=sm_80 -max_num_threads=1024 -thread_warp_size=32", [-1, 16, 64, 49152, 2147483647, 1024, 8, 32], "", 0, []], [[], [["FU", 1, [0, 1, 2, 3]], ["SP", 1, 0, 15120, [9], 1], ["AN", 1, 0, 5], ["AN", 1, 1, 6]]]], "r": [[8.52103e-06], 0, 1.17962, 1718948582], "v": "v0.6"}
{"i": [["[\"negative\", 10, 6, 14, 18]", "cuda -keys=cuda,gpu -arch=sm_80 -max_num_threads=1024 -thread_warp_size=32", [-1, 16, 64, 49152, 2147483647, 1024, 8, 32], "", 0, []], [[], [["FU", 1, [0, 1, 2, 3]], ["SP", 1, 0, 15120, [18], 1], ["AN", 1, 0, 5], ["AN", 1, 1, 6]]]], "r": [[7.17095e-06], 0, 1.0621, 1718948582], "v": "v0.6"}
