code_generation/generate/deprecated/deprecated_with_tvm_dependency/log/cuda/pad_cuda.log
{"i": [["[\"pad\", 19, 19, 16, 17]", "cuda -keys=cuda,gpu -arch=sm_80 -max_num_threads=1024 -thread_warp_size=32", [-1, 16, 64, 49152, 2147483647, 1024, 8, 32], "", 0, []], [[], [["FU", 1, [0, 1]], ["SP", 1, 0, 380, [10], 1], ["AN", 1, 0, 5], ["AN", 1, 1, 6]]]], "r": [[5.84232e-06], 0, 1.23616, 1718951524], "v": "v0.6"}
{"i": [["[\"pad\", 19, 19, 16, 17]", "cuda -keys=cuda,gpu -arch=sm_80 -max_num_threads=1024 -thread_warp_size=32", [-1, 16, 64, 49152, 2147483647, 1024, 8, 32], "", 0, []], [[], [["FU", 1, [0, 1]], ["SP", 1, 0, 380, [38], 1], ["AN", 1, 0, 5], ["AN", 1, 1, 6]]]], "r": [[5.70047e-06], 0, 0.838237, 1718951524], "v": "v0.6"}
{"i": [["[\"pad\", 19, 19, 16, 17]", "cuda -keys=cuda,gpu -arch=sm_80 -max_num_threads=1024 -thread_warp_size=32", [-1, 16, 64, 49152, 2147483647, 1024, 8, 32], "", 0, []], [[], [["FU", 1, [0, 1]], ["SP", 1, 0, 380, [5], 1], ["AN", 1, 0, 5], ["AN", 1, 1, 6]]]], "r": [[5.8458e-06], 0, 0.804084, 1718951524], "v": "v0.6"}
{"i": [["[\"pad\", 19, 19, 16, 17]", "cuda -keys=cuda,gpu -arch=sm_80 -max_num_threads=1024 -thread_warp_size=32", [-1, 16, 64, 49152, 2147483647, 1024, 8, 32], "", 0, []], [[], [["FU", 1, [0, 1]], ["SP", 1, 0, 380, [1], 1], ["AN", 1, 0, 5], ["AN", 1, 1, 6]]]], "r": [[6.34653e-06], 0, 0.818908, 1718951524], "v": "v0.6"}
{"i": [["[\"pad\", 19, 19, 16, 17]", "cuda -keys=cuda,gpu -arch=sm_80 -max_num_threads=1024 -thread_warp_size=32", [-1, 16, 64, 49152, 2147483647, 1024, 8, 32], "", 0, []], [[], [["FU", 1, [0, 1]], ["SP", 1, 0, 380, [16], 1], ["AN", 1, 0, 5], ["AN", 1, 1, 6]]]], "r": [[5.66352e-06], 0, 0.829054, 1718951525], "v": "v0.6"}
{"i": [["[\"pad\", 19, 19, 16, 17]", "cuda -keys=cuda,gpu -arch=sm_80 -max_num_threads=1024 -thread_warp_size=32", [-1, 16, 64, 49152, 2147483647, 1024, 8, 32], "", 0, []], [[], [["FU", 1, [0, 1]], ["SP", 1, 0, 380, [19], 1], ["AN", 1, 0, 5], ["AN", 1, 1, 6]]]], "r": [[5.84596e-06], 0, 0.815539, 1718951525], "v": "v0.6"}
{"i": [["[\"pad\", 19, 19, 16, 17]", "cuda -keys=cuda,gpu -arch=sm_80 -max_num_threads=1024 -thread_warp_size=32", [-1, 16, 64, 49152, 2147483647, 1024, 8, 32], "", 0, []], [[], [["FU", 1, [0, 1]], ["SP", 1, 0, 380, [20], 1], ["AN", 1, 0, 5], ["AN", 1, 1, 6]]]], "r": [[5.83565e-06], 0, 0.818019, 1718951525], "v": "v0.6"}
{"i": [["[\"pad\", 19, 19, 16, 17]", "cuda -keys=cuda,gpu -arch=sm_80 -max_num_threads=1024 -thread_warp_size=32", [-1, 16, 64, 49152, 2147483647, 1024, 8, 32], "", 0, []], [[], [["FU", 1, [0, 1]], ["SP", 1, 0, 380, [32], 1], ["AN", 1, 0, 5], ["AN", 1, 1, 6]]]], "r": [[5.70533e-06], 0, 0.814259, 1718951525], "v": "v0.6"}
{"i": [["[\"pad\", 19, 19, 16, 17]", "cuda -keys=cuda,gpu -arch=sm_80 -max_num_threads=1024 -thread_warp_size=32", [-1, 16, 64, 49152, 2147483647, 1024, 8, 32], "", 0, []], [[], [["FU", 1, [0, 1]], ["SP", 1, 0, 380, [4], 1], ["AN", 1, 0, 5], ["AN", 1, 1, 6]]]], "r": [[5.80398e-06], 0, 0.809538, 1718951526], "v": "v0.6"}
{"i": [["[\"pad\", 19, 19, 16, 17]", "cuda -keys=cuda,gpu -arch=sm_80 -max_num_threads=1024 -thread_warp_size=32", [-1, 16, 64, 49152, 2147483647, 1024, 8, 32], "", 0, []], [[], [["FU", 1, [0, 1]], ["SP", 1, 0, 380, [8], 1], ["AN", 1, 0, 5], ["AN", 1, 1, 6]]]], "r": [[5.66365e-06], 0, 0.836223, 1718951526], "v": "v0.6"}
