code_generation/generate/deprecated/deprecated_with_tvm_dependency/log/cuda/pool3d_cuda.log
{"i": [["[\"pool3d\", 5, 15, 12, 20]", "cuda -keys=cuda,gpu -arch=sm_80 -max_num_threads=1024 -thread_warp_size=32", [-1, 16, 64, 49152, 2147483647, 1024, 8, 32], "", 0, []], [[], [["CI", 1], ["FU", 2, [0, 1, 2, 3, 4]], ["SP", 2, 0, 36000, [15], 1], ["AN", 2, 0, 5], ["AN", 2, 1, 6], ["PR", 2, 0, "auto_unroll_max_step$16"]]]], "r": [[1.04504e-05], 0, 1.30195, 1718952476], "v": "v0.6"}
{"i": [["[\"pool3d\", 5, 15, 12, 20]", "cuda -keys=cuda,gpu -arch=sm_80 -max_num_threads=1024 -thread_warp_size=32", [-1, 16, 64, 49152, 2147483647, 1024, 8, 32], "", 0, []], [[], [["CI", 1], ["FU", 2, [0, 1, 2, 3, 4]], ["SP", 2, 0, 36000, [5], 1], ["AN", 2, 0, 5], ["AN", 2, 1, 6], ["PR", 2, 0, "auto_unroll_max_step$0"]]]], "r": [[1.82541e-05], 0, 0.964721, 1718952476], "v": "v0.6"}
{"i": [["[\"pool3d\", 5, 15, 12, 20]", "cuda -keys=cuda,gpu -arch=sm_80 -max_num_threads=1024 -thread_warp_size=32", [-1, 16, 64, 49152, 2147483647, 1024, 8, 32], "", 0, []], [[], [["CI", 1], ["FU", 2, [0, 1, 2, 3, 4]], ["SP", 2, 0, 36000, [10], 1], ["AN", 2, 0, 5], ["AN", 2, 1, 6], ["PR", 2, 0, "auto_unroll_max_step$512"]]]], "r": [[1.25163e-05], 0, 0.91685, 1718952476], "v": "v0.6"}
{"i": [["[\"pool3d\", 5, 15, 12, 20]", "cuda -keys=cuda,gpu -arch=sm_80 -max_num_threads=1024 -thread_warp_size=32", [-1, 16, 64, 49152, 2147483647, 1024, 8, 32], "", 0, []], [[], [["CI", 1], ["FU", 2, [0, 1, 2, 3, 4]], ["SP", 2, 0, 36000, [5], 1], ["AN", 2, 0, 5], ["AN", 2, 1, 6], ["PR", 2, 0, "auto_unroll_max_step$512"]]]], "r": [[1.84134e-05], 0, 0.939002, 1718952477], "v": "v0.6"}
{"i": [["[\"pool3d\", 5, 15, 12, 20]", "cuda -keys=cuda,gpu -arch=sm_80 -max_num_threads=1024 -thread_warp_size=32", [-1, 16, 64, 49152, 2147483647, 1024, 8, 32], "", 0, []], [[], [["CI", 1], ["FU", 2, [0, 1, 2, 3, 4]], ["SP", 2, 0, 36000, [2], 1], ["AN", 2, 0, 5], ["AN", 2, 1, 6], ["PR", 2, 0, "auto_unroll_max_step$0"]]]], "r": [[3.67748e-05], 0, 0.940194, 1718952477], "v": "v0.6"}
{"i": [["[\"pool3d\", 5, 15, 12, 20]", "cuda -keys=cuda,gpu -arch=sm_80 -max_num_threads=1024 -thread_warp_size=32", [-1, 16, 64, 49152, 2147483647, 1024, 8, 32], "", 0, []], [[], [["CI", 1], ["FU", 2, [0, 1, 2, 3, 4]], ["SP", 2, 0, 36000, [6], 1], ["AN", 2, 0, 5], ["AN", 2, 1, 6], ["PR", 2, 0, "auto_unroll_max_step$64"]]]], "r": [[1.63579e-05], 0, 0.927705, 1718952477], "v": "v0.6"}
{"i": [["[\"pool3d\", 5, 15, 12, 20]", "cuda -keys=cuda,gpu -arch=sm_80 -max_num_threads=1024 -thread_warp_size=32", [-1, 16, 64, 49152, 2147483647, 1024, 8, 32], "", 0, []], [[], [["CI", 1], ["FU", 2, [0, 1, 2, 3, 4]], ["SP", 2, 0, 36000, [50], 1], ["AN", 2, 0, 5], ["AN", 2, 1, 6], ["PR", 2, 0, "auto_unroll_max_step$1024"]]]], "r": [[8.56312e-06], 0, 0.877254, 1718952478], "v": "v0.6"}
{"i": [["[\"pool3d\", 5, 15, 12, 20]", "cuda -keys=cuda,gpu -arch=sm_80 -max_num_threads=1024 -thread_warp_size=32", [-1, 16, 64, 49152, 2147483647, 1024, 8, 32], "", 0, []], [[], [["CI", 1], ["FU", 2, [0, 1, 2, 3, 4]], ["SP", 2, 0, 36000, [36], 1], ["AN", 2, 0, 5], ["AN", 2, 1, 6], ["PR", 2, 0, "auto_unroll_max_step$16"]]]], "r": [[9.03181e-06], 0, 0.898396, 1718952478], "v": "v0.6"}
{"i": [["[\"pool3d\", 5, 15, 12, 20]", "cuda -keys=cuda,gpu -arch=sm_80 -max_num_threads=1024 -thread_warp_size=32", [-1, 16, 64, 49152, 2147483647, 1024, 8, 32], "", 0, []], [[], [["CI", 1], ["FU", 2, [0, 1, 2, 3, 4]], ["SP", 2, 0, 36000, [30], 1], ["AN", 2, 0, 5], ["AN", 2, 1, 6], ["PR", 2, 0, "auto_unroll_max_step$512"]]]], "r": [[8.33225e-06], 0, 0.921295, 1718952478], "v": "v0.6"}
{"i": [["[\"pool3d\", 5, 15, 12, 20]", "cuda -keys=cuda,gpu -arch=sm_80 -max_num_threads=1024 -thread_warp_size=32", [-1, 16, 64, 49152, 2147483647, 1024, 8, 32], "", 0, []], [[], [["CI", 1], ["FU", 2, [0, 1, 2, 3, 4]], ["SP", 2, 0, 36000, [24], 1], ["AN", 2, 0, 5], ["AN", 2, 1, 6], ["PR", 2, 0, "auto_unroll_max_step$0"]]]], "r": [[9.01653e-06], 0, 0.927265, 1718952478], "v": "v0.6"}
