code_generation/generate/deprecated/deprecated_with_tvm_dependency/log/cuda/pool1d_cuda.log
{"i": [["[\"pool1d\", 10, 1, 11, 9]", "cuda -keys=cuda,gpu -arch=sm_80 -max_num_threads=1024 -thread_warp_size=32", [-1, 16, 64, 49152, 2147483647, 1024, 8, 32], "", 0, []], [[], [["CI", 1], ["FU", 2, [0, 1, 2]], ["SP", 2, 0, 50, [12], 1], ["AN", 2, 0, 5], ["AN", 2, 1, 6], ["PR", 2, 0, "auto_unroll_max_step$512"]]]], "r": [[5.4328e-06], 0, 1.28458, 1718951761], "v": "v0.6"}
{"i": [["[\"pool1d\", 10, 1, 11, 9]", "cuda -keys=cuda,gpu -arch=sm_80 -max_num_threads=1024 -thread_warp_size=32", [-1, 16, 64, 49152, 2147483647, 1024, 8, 32], "", 0, []], [[], [["CI", 1], ["FU", 2, [0, 1, 2]], ["SP", 2, 0, 50, [10], 1], ["AN", 2, 0, 5], ["AN", 2, 1, 6], ["PR", 2, 0, "auto_unroll_max_step$64"]]]], "r": [[5.37752e-06], 0, 0.880589, 1718951761], "v": "v0.6"}
{"i": [["[\"pool1d\", 10, 1, 11, 9]", "cuda -keys=cuda,gpu -arch=sm_80 -max_num_threads=1024 -thread_warp_size=32", [-1, 16, 64, 49152, 2147483647, 1024, 8, 32], "", 0, []], [[], [["CI", 1], ["FU", 2, [0, 1, 2]], ["SP", 2, 0, 50, [16], 1], ["AN", 2, 0, 5], ["AN", 2, 1, 6], ["PR", 2, 0, "auto_unroll_max_step$512"]]]], "r": [[5.31104e-06], 0, 0.822628, 1718951761], "v": "v0.6"}
{"i": [["[\"pool1d\", 10, 1, 11, 9]", "cuda -keys=cuda,gpu -arch=sm_80 -max_num_threads=1024 -thread_warp_size=32", [-1, 16, 64, 49152, 2147483647, 1024, 8, 32], "", 0, []], [[], [["CI", 1], ["FU", 2, [0, 1, 2]], ["SP", 2, 0, 50, [32], 1], ["AN", 2, 0, 5], ["AN", 2, 1, 6], ["PR", 2, 0, "auto_unroll_max_step$512"]]]], "r": [[5.34822e-06], 0, 0.869789, 1718951762], "v": "v0.6"}
{"i": [["[\"pool1d\", 10, 1, 11, 9]", "cuda -keys=cuda,gpu -arch=sm_80 -max_num_threads=1024 -thread_warp_size=32", [-1, 16, 64, 49152, 2147483647, 1024, 8, 32], "", 0, []], [[], [["CI", 1], ["FU", 2, [0, 1, 2]], ["SP", 2, 0, 50, [25], 1], ["AN", 2, 0, 5], ["AN", 2, 1, 6], ["PR", 2, 0, "auto_unroll_max_step$0"]]]], "r": [[5.3889e-06], 0, 0.823018, 1718951762], "v": "v0.6"}
{"i": [["[\"pool1d\", 10, 1, 11, 9]", "cuda -keys=cuda,gpu -arch=sm_80 -max_num_threads=1024 -thread_warp_size=32", [-1, 16, 64, 49152, 2147483647, 1024, 8, 32], "", 0, []], [[], [["CI", 1], ["FU", 2, [0, 1, 2]], ["SP", 2, 0, 50, [3], 1], ["AN", 2, 0, 5], ["AN", 2, 1, 6], ["PR", 2, 0, "auto_unroll_max_step$64"]]]], "r": [[5.38663e-06], 0, 0.841985, 1718951762], "v": "v0.6"}
{"i": [["[\"pool1d\", 10, 1, 11, 9]", "cuda -keys=cuda,gpu -arch=sm_80 -max_num_threads=1024 -thread_warp_size=32", [-1, 16, 64, 49152, 2147483647, 1024, 8, 32], "", 0, []], [[], [["CI", 1], ["FU", 2, [0, 1, 2]], ["SP", 2, 0, 50, [8], 1], ["AN", 2, 0, 5], ["AN", 2, 1, 6], ["PR", 2, 0, "auto_unroll_max_step$512"]]]], "r": [[5.35176e-06], 0, 0.863084, 1718951762], "v": "v0.6"}
{"i": [["[\"pool1d\", 10, 1, 11, 9]", "cuda -keys=cuda,gpu -arch=sm_80 -max_num_threads=1024 -thread_warp_size=32", [-1, 16, 64, 49152, 2147483647, 1024, 8, 32], "", 0, []], [[], [["CI", 1], ["FU", 2, [0, 1, 2]], ["SP", 2, 0, 50, [4], 1], ["AN", 2, 0, 5], ["AN", 2, 1, 6], ["PR", 2, 0, "auto_unroll_max_step$1024"]]]], "r": [[5.36414e-06], 0, 0.838029, 1718951763], "v": "v0.6"}
{"i": [["[\"pool1d\", 10, 1, 11, 9]", "cuda -keys=cuda,gpu -arch=sm_80 -max_num_threads=1024 -thread_warp_size=32", [-1, 16, 64, 49152, 2147483647, 1024, 8, 32], "", 0, []], [[], [["CI", 1], ["FU", 2, [0, 1, 2]], ["SP", 2, 0, 50, [2], 1], ["AN", 2, 0, 5], ["AN", 2, 1, 6], ["PR", 2, 0, "auto_unroll_max_step$512"]]]], "r": [[5.641e-06], 0, 0.89876, 1718951763], "v": "v0.6"}
{"i": [["[\"pool1d\", 10, 1, 11, 9]", "cuda -keys=cuda,gpu -arch=sm_80 -max_num_threads=1024 -thread_warp_size=32", [-1, 16, 64, 49152, 2147483647, 1024, 8, 32], "", 0, []], [[], [["CI", 1], ["FU", 2, [0, 1, 2]], ["SP", 2, 0, 50, [24], 1], ["AN", 2, 0, 5], ["AN", 2, 1, 6], ["PR", 2, 0, "auto_unroll_max_step$1024"]]]], "r": [[5.3468e-06], 0, 0.828169, 1718951763], "v": "v0.6"}
