code_generation/generate/deprecated/deprecated_with_tvm_dependency/log/cuda/prelu_cuda.log
{"i": [["[\"prelu\", 10, 17, 1, 19]", "cuda -keys=cuda,gpu -arch=sm_80 -max_num_threads=1024 -thread_warp_size=32", [-1, 16, 64, 49152, 2147483647, 1024, 8, 32], "", 0, []], [[], [["FU", 2, [0, 1, 2, 3]], ["SP", 2, 0, 3230, [34], 1], ["AN", 2, 0, 5], ["AN", 2, 1, 6]]]], "r": [[5.35035e-06], 0, 1.17869, 1718952896], "v": "v0.6"}
{"i": [["[\"prelu\", 10, 17, 1, 19]", "cuda -keys=cuda,gpu -arch=sm_80 -max_num_threads=1024 -thread_warp_size=32", [-1, 16, 64, 49152, 2147483647, 1024, 8, 32], "", 0, []], [[], [["FU", 2, [0, 1, 2, 3]], ["SP", 2, 0, 3230, [19], 1], ["AN", 2, 0, 5], ["AN", 2, 1, 6]]]], "r": [[5.69175e-06], 0, 0.776293, 1718952897], "v": "v0.6"}
{"i": [["[\"prelu\", 10, 17, 1, 19]", "cuda -keys=cuda,gpu -arch=sm_80 -max_num_threads=1024 -thread_warp_size=32", [-1, 16, 64, 49152, 2147483647, 1024, 8, 32], "", 0, []], [[], [["FU", 2, [0, 1, 2, 3]], ["SP", 2, 0, 3230, [64], 1], ["AN", 2, 0, 5], ["AN", 2, 1, 6]]]], "r": [[5.37786e-06], 0, 0.824301, 1718952897], "v": "v0.6"}
{"i": [["[\"prelu\", 10, 17, 1, 19]", "cuda -keys=cuda,gpu -arch=sm_80 -max_num_threads=1024 -thread_warp_size=32", [-1, 16, 64, 49152, 2147483647, 1024, 8, 32], "", 0, []], [[], [["FU", 2, [0, 1, 2, 3]], ["SP", 2, 0, 3230, [6], 1], ["AN", 2, 0, 5], ["AN", 2, 1, 6]]]], "r": [[6.30175e-06], 0, 0.800814, 1718952897], "v": "v0.6"}
{"i": [["[\"prelu\", 10, 17, 1, 19]", "cuda -keys=cuda,gpu -arch=sm_80 -max_num_threads=1024 -thread_warp_size=32", [-1, 16, 64, 49152, 2147483647, 1024, 8, 32], "", 0, []], [[], [["FU", 2, [0, 1, 2, 3]], ["SP", 2, 0, 3230, [3], 1], ["AN", 2, 0, 5], ["AN", 2, 1, 6]]]], "r": [[7.30857e-06], 0, 0.817159, 1718952897], "v": "v0.6"}
{"i": [["[\"prelu\", 10, 17, 1, 19]", "cuda -keys=cuda,gpu -arch=sm_80 -max_num_threads=1024 -thread_warp_size=32", [-1, 16, 64, 49152, 2147483647, 1024, 8, 32], "", 0, []], [[], [["FU", 2, [0, 1, 2, 3]], ["SP", 2, 0, 3230, [17], 1], ["AN", 2, 0, 5], ["AN", 2, 1, 6]]]], "r": [[5.85045e-06], 0, 0.801176, 1718952897], "v": "v0.6"}
{"i": [["[\"prelu\", 10, 17, 1, 19]", "cuda -keys=cuda,gpu -arch=sm_80 -max_num_threads=1024 -thread_warp_size=32", [-1, 16, 64, 49152, 2147483647, 1024, 8, 32], "", 0, []], [[], [["FU", 2, [0, 1, 2, 3]], ["SP", 2, 0, 3230, [4], 1], ["AN", 2, 0, 5], ["AN", 2, 1, 6]]]], "r": [[6.79587e-06], 0, 0.75647, 1718952898], "v": "v0.6"}
{"i": [["[\"prelu\", 10, 17, 1, 19]", "cuda -keys=cuda,gpu -arch=sm_80 -max_num_threads=1024 -thread_warp_size=32", [-1, 16, 64, 49152, 2147483647, 1024, 8, 32], "", 0, []], [[], [["FU", 2, [0, 1, 2, 3]], ["SP", 2, 0, 3230, [1], 1], ["AN", 2, 0, 5], ["AN", 2, 1, 6]]]], "r": [[1.07335e-05], 0, 0.842862, 1718952898], "v": "v0.6"}
{"i": [["[\"prelu\", 10, 17, 1, 19]", "cuda -keys=cuda,gpu -arch=sm_80 -max_num_threads=1024 -thread_warp_size=32", [-1, 16, 64, 49152, 2147483647, 1024, 8, 32], "", 0, []], [[], [["FU", 2, [0, 1, 2, 3]], ["SP", 2, 0, 3230, [24], 1], ["AN", 2, 0, 5], ["AN", 2, 1, 6]]]], "r": [[5.72019e-06], 0, 0.781454, 1718952898], "v": "v0.6"}
{"i": [["[\"prelu\", 10, 17, 1, 19]", "cuda -keys=cuda,gpu -arch=sm_80 -max_num_threads=1024 -thread_warp_size=32", [-1, 16, 64, 49152, 2147483647, 1024, 8, 32], "", 0, []], [[], [["FU", 2, [0, 1, 2, 3]], ["SP", 2, 0, 3230, [38], 1], ["AN", 2, 0, 5], ["AN", 2, 1, 6]]]], "r": [[5.43565e-06], 0, 0.777684, 1718952898], "v": "v0.6"}
