code_generation/generate/deprecated/deprecated_with_tvm_dependency/log/cuda/prod_cuda.log
{"i": [["[\"prod\", 13, 18, 17, 13]", "cuda -keys=cuda,gpu -arch=sm_80 -max_num_threads=1024 -thread_warp_size=32", [-1, 16, 64, 49152, 2147483647, 1024, 8, 32], "", 0, []], [[], [["FU", 1, [0, 1, 2, 3]], ["SP", 1, 0, 51714, [32], 1], ["AN", 1, 1, 6], ["FU", 1, []], ["AN", 1, 0, 5], ["PR", 1, 0, "auto_unroll_max_step$64"]]]], "r": [[0.000363088], 0, 1.58896, 1718948750], "v": "v0.6"}
{"i": [["[\"prod\", 13, 18, 17, 13]", "cuda -keys=cuda,gpu -arch=sm_80 -max_num_threads=1024 -thread_warp_size=32", [-1, 16, 64, 49152, 2147483647, 1024, 8, 32], "", 0, []], [[], [["FU", 1, []], ["AN", 1, 0, 6], ["PR", 1, 0, "auto_unroll_max_step$0"]]]], "r": [[0.00254343], 0, 1.01887, 1718948751], "v": "v0.6"}
{"i": [["[\"prod\", 13, 18, 17, 13]", "cuda -keys=cuda,gpu -arch=sm_80 -max_num_threads=1024 -thread_warp_size=32", [-1, 16, 64, 49152, 2147483647, 1024, 8, 32], "", 0, []], [[], [["FU", 1, []], ["AN", 1, 0, 6], ["PR", 1, 0, "auto_unroll_max_step$512"]]]], "r": [[0.00254322], 0, 1.15932, 1718948751], "v": "v0.6"}
{"i": [["[\"prod\", 13, 18, 17, 13]", "cuda -keys=cuda,gpu -arch=sm_80 -max_num_threads=1024 -thread_warp_size=32", [-1, 16, 64, 49152, 2147483647, 1024, 8, 32], "", 0, []], [[], [["FU", 1, [0, 1, 2, 3]], ["SP", 1, 0, 51714, [32], 1], ["AN", 1, 1, 6], ["FU", 1, []], ["AN", 1, 0, 5], ["PR", 1, 0, "auto_unroll_max_step$16"]]]], "r": [[0.000362912], 0, 1.29294, 1718948751], "v": "v0.6"}
{"i": [["[\"prod\", 13, 18, 17, 13]", "cuda -keys=cuda,gpu -arch=sm_80 -max_num_threads=1024 -thread_warp_size=32", [-1, 16, 64, 49152, 2147483647, 1024, 8, 32], "", 0, []], [[], [["FU", 1, [0, 1, 2, 3]], ["SP", 1, 0, 51714, [32], 1], ["AN", 1, 1, 6], ["FU", 1, []], ["AN", 1, 0, 5], ["PR", 1, 0, "auto_unroll_max_step$1024"]]]], "r": [[0.000362872], 0, 1.07265, 1718948751], "v": "v0.6"}
