code_generation/generate/deprecated/deprecated_with_tvm_dependency/log/cuda/relu_cuda.log
{"i": [["[\"relu\", 3, 13, 18, 19]", "cuda -keys=cuda,gpu -arch=sm_80 -max_num_threads=1024 -thread_warp_size=32", [-1, 16, 64, 49152, 2147483647, 1024, 8, 32], "", 0, []], [[], [["FU", 1, [0, 1, 2, 3]], ["SP", 1, 0, 13338, [38], 1], ["AN", 1, 0, 5], ["AN", 1, 1, 6]]]], "r": [[6.16849e-06], 0, 1.17813, 1718952642], "v": "v0.6"}
{"i": [["[\"relu\", 3, 13, 18, 19]", "cuda -keys=cuda,gpu -arch=sm_80 -max_num_threads=1024 -thread_warp_size=32", [-1, 16, 64, 49152, 2147483647, 1024, 8, 32], "", 0, []], [[], [["FU", 1, [0, 1, 2, 3]], ["SP", 1, 0, 13338, [6], 1], ["AN", 1, 0, 5], ["AN", 1, 1, 6]]]], "r": [[9.29076e-06], 0, 0.82675, 1718952642], "v": "v0.6"}
{"i": [["[\"relu\", 3, 13, 18, 19]", "cuda -keys=cuda,gpu -arch=sm_80 -max_num_threads=1024 -thread_warp_size=32", [-1, 16, 64, 49152, 2147483647, 1024, 8, 32], "", 0, []], [[], [["FU", 1, [0, 1, 2, 3]], ["SP", 1, 0, 13338, [64], 1], ["AN", 1, 0, 5], ["AN", 1, 1, 6]]]], "r": [[6.32283e-06], 0, 0.808805, 1718952642], "v": "v0.6"}
{"i": [["[\"relu\", 3, 13, 18, 19]", "cuda -keys=cuda,gpu -arch=sm_80 -max_num_threads=1024 -thread_warp_size=32", [-1, 16, 64, 49152, 2147483647, 1024, 8, 32], "", 0, []], [[], [["FU", 1, [0, 1, 2, 3]], ["SP", 1, 0, 13338, [57], 1], ["AN", 1, 0, 5], ["AN", 1, 1, 6]]]], "r": [[6.37711e-06], 0, 0.84597, 1718952642], "v": "v0.6"}
{"i": [["[\"relu\", 3, 13, 18, 19]", "cuda -keys=cuda,gpu -arch=sm_80 -max_num_threads=1024 -thread_warp_size=32", [-1, 16, 64, 49152, 2147483647, 1024, 8, 32], "", 0, []], [[], [["FU", 1, [0, 1, 2, 3]], ["SP", 1, 0, 13338, [26], 1], ["AN", 1, 0, 5], ["AN", 1, 1, 6]]]], "r": [[6.14995e-06], 0, 0.756081, 1718952643], "v": "v0.6"}
{"i": [["[\"relu\", 3, 13, 18, 19]", "cuda -keys=cuda,gpu -arch=sm_80 -max_num_threads=1024 -thread_warp_size=32", [-1, 16, 64, 49152, 2147483647, 1024, 8, 32], "", 0, []], [[], [["FU", 1, [0, 1, 2, 3]], ["SP", 1, 0, 13338, [39], 1], ["AN", 1, 0, 5], ["AN", 1, 1, 6]]]], "r": [[6.29153e-06], 0, 0.853954, 1718952643], "v": "v0.6"}
{"i": [["[\"relu\", 3, 13, 18, 19]", "cuda -keys=cuda,gpu -arch=sm_80 -max_num_threads=1024 -thread_warp_size=32", [-1, 16, 64, 49152, 2147483647, 1024, 8, 32], "", 0, []], [[], [["FU", 1, [0, 1, 2, 3]], ["SP", 1, 0, 13338, [9], 1], ["AN", 1, 0, 5], ["AN", 1, 1, 6]]]], "r": [[7.90908e-06], 0, 0.825469, 1718952643], "v": "v0.6"}
{"i": [["[\"relu\", 3, 13, 18, 19]", "cuda -keys=cuda,gpu -arch=sm_80 -max_num_threads=1024 -thread_warp_size=32", [-1, 16, 64, 49152, 2147483647, 1024, 8, 32], "", 0, []], [[], [["FU", 1, [0, 1, 2, 3]], ["SP", 1, 0, 13338, [54], 1], ["AN", 1, 0, 5], ["AN", 1, 1, 6]]]], "r": [[6.37506e-06], 0, 0.8032, 1718952643], "v": "v0.6"}
{"i": [["[\"relu\", 3, 13, 18, 19]", "cuda -keys=cuda,gpu -arch=sm_80 -max_num_threads=1024 -thread_warp_size=32", [-1, 16, 64, 49152, 2147483647, 1024, 8, 32], "", 0, []], [[], [["FU", 1, [0, 1, 2, 3]], ["SP", 1, 0, 13338, [3], 1], ["AN", 1, 0, 5], ["AN", 1, 1, 6]]]], "r": [[1.30841e-05], 0, 0.803934, 1718952644], "v": "v0.6"}
{"i": [["[\"relu\", 3, 13, 18, 19]", "cuda -keys=cuda,gpu -arch=sm_80 -max_num_threads=1024 -thread_warp_size=32", [-1, 16, 64, 49152, 2147483647, 1024, 8, 32], "", 0, []], [[], [["FU", 1, [0, 1, 2, 3]], ["SP", 1, 0, 13338, [27], 1], ["AN", 1, 0, 5], ["AN", 1, 1, 6]]]], "r": [[6.19978e-06], 0, 0.783232, 1718952644], "v": "v0.6"}
