code_generation/generate/deprecated/deprecated_with_tvm_dependency/log/cuda/rms_norm_cuda.log
{"i": [["[\"rms_norm\", 5, 10, 5, 3]", "cuda -keys=cuda,gpu -arch=sm_80 -max_num_threads=1024 -thread_warp_size=32", [-1, 16, 64, 49152, 2147483647, 1024, 8, 32], "", 0, []], [[], [["CI", 6], ["CI", 4], ["CI", 3], ["CI", 1], ["FU", 7, [0, 1, 2, 3]], ["SP", 7, 0, 750, [1], 1], ["AN", 7, 0, 5], ["AN", 7, 1, 6], ["FU", 5, [0, 1, 2]], ["SP", 5, 0, 75, [64], 1], ["AN", 5, 0, 5], ["AN", 5, 1, 6], ["PR", 5, 0, "auto_unroll_max_step$1024"]]]], "r": [[1.27012e-05], 0, 1.2629, 1718954467], "v": "v0.6"}
{"i": [["[\"rms_norm\", 5, 10, 5, 3]", "cuda -keys=cuda,gpu -arch=sm_80 -max_num_threads=1024 -thread_warp_size=32", [-1, 16, 64, 49152, 2147483647, 1024, 8, 32], "", 0, []], [[], [["CI", 6], ["CI", 4], ["CI", 3], ["CI", 1], ["FU", 7, [0, 1, 2, 3]], ["SP", 7, 0, 750, [32], 1], ["AN", 7, 0, 5], ["AN", 7, 1, 6], ["FU", 5, [0, 1, 2]], ["SP", 5, 0, 75, [4], 1], ["AN", 5, 0, 5], ["AN", 5, 1, 6], ["PR", 5, 0, "auto_unroll_max_step$64"]]]], "r": [[1.1307e-05], 0, 0.817274, 1718954467], "v": "v0.6"}
{"i": [["[\"rms_norm\", 5, 10, 5, 3]", "cuda -keys=cuda,gpu -arch=sm_80 -max_num_threads=1024 -thread_warp_size=32", [-1, 16, 64, 49152, 2147483647, 1024, 8, 32], "", 0, []], [[], [["CI", 6], ["CI", 4], ["CI", 3], ["CI", 1], ["FU", 7, [0, 1, 2, 3]], ["SP", 7, 0, 750, [32], 1], ["AN", 7, 0, 5], ["AN", 7, 1, 6], ["FU", 5, [0, 1, 2]], ["SP", 5, 0, 75, [3], 1], ["AN", 5, 0, 5], ["AN", 5, 1, 6], ["PR", 5, 0, "auto_unroll_max_step$512"]]]], "r": [[1.10189e-05], 0, 0.820586, 1718954467], "v": "v0.6"}
{"i": [["[\"rms_norm\", 5, 10, 5, 3]", "cuda -keys=cuda,gpu -arch=sm_80 -max_num_threads=1024 -thread_warp_size=32", [-1, 16, 64, 49152, 2147483647, 1024, 8, 32], "", 0, []], [[], [["CI", 6], ["CI", 4], ["CI", 3], ["CI", 1], ["FU", 7, [0, 1, 2, 3]], ["SP", 7, 0, 750, [2], 1], ["AN", 7, 0, 5], ["AN", 7, 1, 6], ["FU", 5, [0, 1, 2]], ["SP", 5, 0, 75, [4], 1], ["AN", 5, 0, 5], ["AN", 5, 1, 6], ["PR", 5, 0, "auto_unroll_max_step$0"]]]], "r": [[1.21698e-05], 0, 0.808531, 1718954467], "v": "v0.6"}
{"i": [["[\"rms_norm\", 5, 10, 5, 3]", "cuda -keys=cuda,gpu -arch=sm_80 -max_num_threads=1024 -thread_warp_size=32", [-1, 16, 64, 49152, 2147483647, 1024, 8, 32], "", 0, []], [[], [["CI", 6], ["CI", 4], ["CI", 3], ["CI", 1], ["FU", 7, [0, 1, 2, 3]], ["SP", 7, 0, 750, [4], 1], ["AN", 7, 0, 5], ["AN", 7, 1, 6], ["FU", 5, [0, 1, 2]], ["SP", 5, 0, 75, [1], 1], ["AN", 5, 0, 5], ["AN", 5, 1, 6], ["PR", 5, 0, "auto_unroll_max_step$1024"]]]], "r": [[1.22432e-05], 0, 0.821624, 1718954468], "v": "v0.6"}
{"i": [["[\"rms_norm\", 5, 10, 5, 3]", "cuda -keys=cuda,gpu -arch=sm_80 -max_num_threads=1024 -thread_warp_size=32", [-1, 16, 64, 49152, 2147483647, 1024, 8, 32], "", 0, []], [[], [["CI", 6], ["CI", 4], ["CI", 3], ["CI", 1], ["FU", 7, [0, 1, 2, 3]], ["SP", 7, 0, 750, [2], 1], ["AN", 7, 0, 5], ["AN", 7, 1, 6], ["FU", 5, [0, 1, 2]], ["SP", 5, 0, 75, [2], 1], ["AN", 5, 0, 5], ["AN", 5, 1, 6], ["PR", 5, 0, "auto_unroll_max_step$1024"]]]], "r": [[1.22308e-05], 0, 0.811881, 1718954468], "v": "v0.6"}
{"i": [["[\"rms_norm\", 5, 10, 5, 3]", "cuda -keys=cuda,gpu -arch=sm_80 -max_num_threads=1024 -thread_warp_size=32", [-1, 16, 64, 49152, 2147483647, 1024, 8, 32], "", 0, []], [[], [["CI", 6], ["CI", 4], ["CI", 3], ["CI", 1], ["FU", 7, [0, 1, 2, 3]], ["SP", 7, 0, 750, [8], 1], ["AN", 7, 0, 5], ["AN", 7, 1, 6], ["FU", 5, [0, 1, 2]], ["SP", 5, 0, 75, [3], 1], ["AN", 5, 0, 5], ["AN", 5, 1, 6], ["PR", 5, 0, "auto_unroll_max_step$64"]]]], "r": [[1.15476e-05], 0, 0.797591, 1718954468], "v": "v0.6"}
{"i": [["[\"rms_norm\", 5, 10, 5, 3]", "cuda -keys=cuda,gpu -arch=sm_80 -max_num_threads=1024 -thread_warp_size=32", [-1, 16, 64, 49152, 2147483647, 1024, 8, 32], "", 0, []], [[], [["CI", 6], ["CI", 4], ["CI", 3], ["CI", 1], ["FU", 7, [0, 1, 2, 3]], ["SP", 7, 0, 750, [32], 1], ["AN", 7, 0, 5], ["AN", 7, 1, 6], ["FU", 5, [0, 1, 2]], ["SP", 5, 0, 75, [15], 1], ["AN", 5, 0, 5], ["AN", 5, 1, 6], ["PR", 5, 0, "auto_unroll_max_step$64"]]]], "r": [[1.09924e-05], 0, 0.823451, 1718954468], "v": "v0.6"}
{"i": [["[\"rms_norm\", 5, 10, 5, 3]", "cuda -keys=cuda,gpu -arch=sm_80 -max_num_threads=1024 -thread_warp_size=32", [-1, 16, 64, 49152, 2147483647, 1024, 8, 32], "", 0, []], [[], [["CI", 6], ["CI", 4], ["CI", 3], ["CI", 1], ["FU", 7, [0, 1, 2, 3]], ["SP", 7, 0, 750, [50], 1], ["AN", 7, 0, 5], ["AN", 7, 1, 6], ["FU", 5, [0, 1, 2]], ["SP", 5, 0, 75, [32], 1], ["AN", 5, 0, 5], ["AN", 5, 1, 6], ["PR", 5, 0, "auto_unroll_max_step$1024"]]]], "r": [[1.10182e-05], 0, 0.788814, 1718954469], "v": "v0.6"}
{"i": [["[\"rms_norm\", 5, 10, 5, 3]", "cuda -keys=cuda,gpu -arch=sm_80 -max_num_threads=1024 -thread_warp_size=32", [-1, 16, 64, 49152, 2147483647, 1024, 8, 32], "", 0, []], [[], [["CI", 6], ["CI", 4], ["CI", 3], ["CI", 1], ["FU", 7, [0, 1, 2, 3]], ["SP", 7, 0, 750, [32], 1], ["AN", 7, 0, 5], ["AN", 7, 1, 6], ["FU", 5, [0, 1, 2]], ["SP", 5, 0, 75, [16], 1], ["AN", 5, 0, 5], ["AN", 5, 1, 6], ["PR", 5, 0, "auto_unroll_max_step$512"]]]], "r": [[1.10166e-05], 0, 0.846407, 1718954469], "v": "v0.6"}
