code_generation/generate/deprecated/deprecated_with_tvm_dependency/log/cuda/round_cuda.log
{"i": [["[\"round\", 18, 1, 12, 16]", "cuda -keys=cuda,gpu -arch=sm_80 -max_num_threads=1024 -thread_warp_size=32", [-1, 16, 64, 49152, 2147483647, 1024, 8, 32], "", 0, []], [[], [["FU", 1, [0, 1, 2, 3]], ["SP", 1, 0, 3456, [4], 1], ["AN", 1, 0, 5], ["AN", 1, 1, 6]]]], "r": [[7.9399e-06], 0, 1.30555, 1718949099], "v": "v0.6"}
{"i": [["[\"round\", 18, 1, 12, 16]", "cuda -keys=cuda,gpu -arch=sm_80 -max_num_threads=1024 -thread_warp_size=32", [-1, 16, 64, 49152, 2147483647, 1024, 8, 32], "", 0, []], [[], [["FU", 1, [0, 1, 2, 3]], ["SP", 1, 0, 3456, [54], 1], ["AN", 1, 0, 5], ["AN", 1, 1, 6]]]], "r": [[6.18238e-06], 0, 0.806775, 1718949100], "v": "v0.6"}
{"i": [["[\"round\", 18, 1, 12, 16]", "cuda -keys=cuda,gpu -arch=sm_80 -max_num_threads=1024 -thread_warp_size=32", [-1, 16, 64, 49152, 2147483647, 1024, 8, 32], "", 0, []], [[], [["FU", 1, [0, 1, 2, 3]], ["SP", 1, 0, 3456, [8], 1], ["AN", 1, 0, 5], ["AN", 1, 1, 6]]]], "r": [[8.22778e-06], 0, 0.875797, 1718949100], "v": "v0.6"}
{"i": [["[\"round\", 18, 1, 12, 16]", "cuda -keys=cuda,gpu -arch=sm_80 -max_num_threads=1024 -thread_warp_size=32", [-1, 16, 64, 49152, 2147483647, 1024, 8, 32], "", 0, []], [[], [["FU", 1, [0, 1, 2, 3]], ["SP", 1, 0, 3456, [9], 1], ["AN", 1, 0, 5], ["AN", 1, 1, 6]]]], "r": [[7.44547e-06], 0, 0.81728, 1718949100], "v": "v0.6"}
{"i": [["[\"round\", 18, 1, 12, 16]", "cuda -keys=cuda,gpu -arch=sm_80 -max_num_threads=1024 -thread_warp_size=32", [-1, 16, 64, 49152, 2147483647, 1024, 8, 32], "", 0, []], [[], [["FU", 1, [0, 1, 2, 3]], ["SP", 1, 0, 3456, [32], 1], ["AN", 1, 0, 5], ["AN", 1, 1, 6]]]], "r": [[6.76765e-06], 0, 0.818092, 1718949101], "v": "v0.6"}
{"i": [["[\"round\", 18, 1, 12, 16]", "cuda -keys=cuda,gpu -arch=sm_80 -max_num_threads=1024 -thread_warp_size=32", [-1, 16, 64, 49152, 2147483647, 1024, 8, 32], "", 0, []], [[], [["FU", 1, [0, 1, 2, 3]], ["SP", 1, 0, 3456, [18], 1], ["AN", 1, 0, 5], ["AN", 1, 1, 6]]]], "r": [[7.26474e-06], 0, 0.837924, 1718949101], "v": "v0.6"}
{"i": [["[\"round\", 18, 1, 12, 16]", "cuda -keys=cuda,gpu -arch=sm_80 -max_num_threads=1024 -thread_warp_size=32", [-1, 16, 64, 49152, 2147483647, 1024, 8, 32], "", 0, []], [[], [["FU", 1, [0, 1, 2, 3]], ["SP", 1, 0, 3456, [16], 1], ["AN", 1, 0, 5], ["AN", 1, 1, 6]]]], "r": [[6.04108e-06], 0, 0.811552, 1718949101], "v": "v0.6"}
{"i": [["[\"round\", 18, 1, 12, 16]", "cuda -keys=cuda,gpu -arch=sm_80 -max_num_threads=1024 -thread_warp_size=32", [-1, 16, 64, 49152, 2147483647, 1024, 8, 32], "", 0, []], [[], [["FU", 1, [0, 1, 2, 3]], ["SP", 1, 0, 3456, [36], 1], ["AN", 1, 0, 5], ["AN", 1, 1, 6]]]], "r": [[6.46959e-06], 0, 0.816851, 1718949101], "v": "v0.6"}
{"i": [["[\"round\", 18, 1, 12, 16]", "cuda -keys=cuda,gpu -arch=sm_80 -max_num_threads=1024 -thread_warp_size=32", [-1, 16, 64, 49152, 2147483647, 1024, 8, 32], "", 0, []], [[], [["FU", 1, [0, 1, 2, 3]], ["SP", 1, 0, 3456, [64], 1], ["AN", 1, 0, 5], ["AN", 1, 1, 6]]]], "r": [[6.34389e-06], 0, 0.875705, 1718949102], "v": "v0.6"}
{"i": [["[\"round\", 18, 1, 12, 16]", "cuda -keys=cuda,gpu -arch=sm_80 -max_num_threads=1024 -thread_warp_size=32", [-1, 16, 64, 49152, 2147483647, 1024, 8, 32], "", 0, []], [[], [["FU", 1, [0, 1, 2, 3]], ["SP", 1, 0, 3456, [1], 1], ["AN", 1, 0, 5], ["AN", 1, 1, 6]]]], "r": [[1.26429e-05], 0, 0.982261, 1718949102], "v": "v0.6"}
