code_generation/generate/deprecated/deprecated_with_tvm_dependency/log/cuda/rsqrt_cuda.log
{"i": [["[\"rsqrt\", 14, 7, 6, 1]", "cuda -keys=cuda,gpu -arch=sm_80 -max_num_threads=1024 -thread_warp_size=32", [-1, 16, 64, 49152, 2147483647, 1024, 8, 32], "", 0, []], [[], [["FU", 1, [0, 1, 2, 3]], ["SP", 1, 0, 588, [32], 1], ["AN", 1, 0, 5], ["AN", 1, 1, 6]]]], "r": [[5.45192e-06], 0, 1.22011, 1718949275], "v": "v0.6"}
{"i": [["[\"rsqrt\", 14, 7, 6, 1]", "cuda -keys=cuda,gpu -arch=sm_80 -max_num_threads=1024 -thread_warp_size=32", [-1, 16, 64, 49152, 2147483647, 1024, 8, 32], "", 0, []], [[], [["FU", 1, [0, 1, 2, 3]], ["SP", 1, 0, 588, [2], 1], ["AN", 1, 0, 5], ["AN", 1, 1, 6]]]], "r": [[6.39431e-06], 0, 1.03667, 1718949275], "v": "v0.6"}
{"i": [["[\"rsqrt\", 14, 7, 6, 1]", "cuda -keys=cuda,gpu -arch=sm_80 -max_num_threads=1024 -thread_warp_size=32", [-1, 16, 64, 49152, 2147483647, 1024, 8, 32], "", 0, []], [[], [["FU", 1, [0, 1, 2, 3]], ["SP", 1, 0, 588, [49], 1], ["AN", 1, 0, 5], ["AN", 1, 1, 6]]]], "r": [[5.45192e-06], 0, 0.876659, 1718949275], "v": "v0.6"}
{"i": [["[\"rsqrt\", 14, 7, 6, 1]", "cuda -keys=cuda,gpu -arch=sm_80 -max_num_threads=1024 -thread_warp_size=32", [-1, 16, 64, 49152, 2147483647, 1024, 8, 32], "", 0, []], [[], [["FU", 1, [0, 1, 2, 3]], ["SP", 1, 0, 588, [21], 1], ["AN", 1, 0, 5], ["AN", 1, 1, 6]]]], "r": [[1.30564e-05], 0, 1.05301, 1718949276], "v": "v0.6"}
{"i": [["[\"rsqrt\", 14, 7, 6, 1]", "cuda -keys=cuda,gpu -arch=sm_80 -max_num_threads=1024 -thread_warp_size=32", [-1, 16, 64, 49152, 2147483647, 1024, 8, 32], "", 0, []], [[], [["FU", 1, [0, 1, 2, 3]], ["SP", 1, 0, 588, [42], 1], ["AN", 1, 0, 5], ["AN", 1, 1, 6]]]], "r": [[5.65991e-06], 0, 1.19847, 1718949276], "v": "v0.6"}
{"i": [["[\"rsqrt\", 14, 7, 6, 1]", "cuda -keys=cuda,gpu -arch=sm_80 -max_num_threads=1024 -thread_warp_size=32", [-1, 16, 64, 49152, 2147483647, 1024, 8, 32], "", 0, []], [[], [["FU", 1, [0, 1, 2, 3]], ["SP", 1, 0, 588, [64], 1], ["AN", 1, 0, 5], ["AN", 1, 1, 6]]]], "r": [[5.45205e-06], 0, 0.921544, 1718949276], "v": "v0.6"}
{"i": [["[\"rsqrt\", 14, 7, 6, 1]", "cuda -keys=cuda,gpu -arch=sm_80 -max_num_threads=1024 -thread_warp_size=32", [-1, 16, 64, 49152, 2147483647, 1024, 8, 32], "", 0, []], [[], [["FU", 1, [0, 1, 2, 3]], ["SP", 1, 0, 588, [12], 1], ["AN", 1, 0, 5], ["AN", 1, 1, 6]]]], "r": [[5.45163e-06], 0, 0.898004, 1718949276], "v": "v0.6"}
{"i": [["[\"rsqrt\", 14, 7, 6, 1]", "cuda -keys=cuda,gpu -arch=sm_80 -max_num_threads=1024 -thread_warp_size=32", [-1, 16, 64, 49152, 2147483647, 1024, 8, 32], "", 0, []], [[], [["FU", 1, [0, 1, 2, 3]], ["SP", 1, 0, 588, [48], 1], ["AN", 1, 0, 5], ["AN", 1, 1, 6]]]], "r": [[5.39251e-06], 0, 0.972466, 1718949277], "v": "v0.6"}
{"i": [["[\"rsqrt\", 14, 7, 6, 1]", "cuda -keys=cuda,gpu -arch=sm_80 -max_num_threads=1024 -thread_warp_size=32", [-1, 16, 64, 49152, 2147483647, 1024, 8, 32], "", 0, []], [[], [["FU", 1, [0, 1, 2, 3]], ["SP", 1, 0, 588, [4], 1], ["AN", 1, 0, 5], ["AN", 1, 1, 6]]]], "r": [[5.88861e-06], 0, 0.892072, 1718949277], "v": "v0.6"}
{"i": [["[\"rsqrt\", 14, 7, 6, 1]", "cuda -keys=cuda,gpu -arch=sm_80 -max_num_threads=1024 -thread_warp_size=32", [-1, 16, 64, 49152, 2147483647, 1024, 8, 32], "", 0, []], [[], [["FU", 1, [0, 1, 2, 3]], ["SP", 1, 0, 588, [7], 1], ["AN", 1, 0, 5], ["AN", 1, 1, 6]]]], "r": [[5.67577e-06], 0, 1.10824, 1718949277], "v": "v0.6"}
