code_generation/generate/deprecated/deprecated_with_tvm_dependency/log/cuda/scale_shift_nchw_cuda.log
{"i": [["[\"scale_shift_nchw\", 14, 12, 12, 14]", "cuda -keys=cuda,gpu -arch=sm_80 -max_num_threads=1024 -thread_warp_size=32", [-1, 16, 64, 49152, 2147483647, 1024, 8, 32], "", 0, []], [[], [["CHW", 3, "local"], ["CI", 3], ["FU", 4, [0, 1, 2, 3]], ["SP", 4, 0, 28224, [4], 1], ["AN", 4, 0, 5], ["AN", 4, 1, 6]]]], "r": [[1.71548e-05], 0, 1.22609, 1718952734], "v": "v0.6"}
{"i": [["[\"scale_shift_nchw\", 14, 12, 12, 14]", "cuda -keys=cuda,gpu -arch=sm_80 -max_num_threads=1024 -thread_warp_size=32", [-1, 16, 64, 49152, 2147483647, 1024, 8, 32], "", 0, []], [[], [["CHW", 3, "local"], ["CI", 3], ["FU", 4, [0, 1, 2, 3]], ["SP", 4, 0, 28224, [7], 1], ["AN", 4, 0, 5], ["AN", 4, 1, 6]]]], "r": [[1.22145e-05], 0, 0.826488, 1718952734], "v": "v0.6"}
{"i": [["[\"scale_shift_nchw\", 14, 12, 12, 14]", "cuda -keys=cuda,gpu -arch=sm_80 -max_num_threads=1024 -thread_warp_size=32", [-1, 16, 64, 49152, 2147483647, 1024, 8, 32], "", 0, []], [[], [["CHW", 3, "local"], ["CI", 3], ["FU", 4, [0, 1, 2, 3]], ["SP", 4, 0, 28224, [42], 1], ["AN", 4, 0, 5], ["AN", 4, 1, 6]]]], "r": [[6.92479e-06], 0, 0.786927, 1718952734], "v": "v0.6"}
{"i": [["[\"scale_shift_nchw\", 14, 12, 12, 14]", "cuda -keys=cuda,gpu -arch=sm_80 -max_num_threads=1024 -thread_warp_size=32", [-1, 16, 64, 49152, 2147483647, 1024, 8, 32], "", 0, []], [[], [["CHW", 3, "local"], ["CI", 3], ["FU", 4, [0, 1, 2, 3]], ["SP", 4, 0, 28224, [2], 1], ["AN", 4, 0, 5], ["AN", 4, 1, 6]]]], "r": [[2.91347e-05], 0, 0.866557, 1718952734], "v": "v0.6"}
{"i": [["[\"scale_shift_nchw\", 14, 12, 12, 14]", "cuda -keys=cuda,gpu -arch=sm_80 -max_num_threads=1024 -thread_warp_size=32", [-1, 16, 64, 49152, 2147483647, 1024, 8, 32], "", 0, []], [[], [["CHW", 3, "local"], ["CI", 3], ["FU", 4, [0, 1, 2, 3]], ["SP", 4, 0, 28224, [6], 1], ["AN", 4, 0, 5], ["AN", 4, 1, 6]]]], "r": [[1.32145e-05], 0, 0.832364, 1718952735], "v": "v0.6"}
{"i": [["[\"scale_shift_nchw\", 14, 12, 12, 14]", "cuda -keys=cuda,gpu -arch=sm_80 -max_num_threads=1024 -thread_warp_size=32", [-1, 16, 64, 49152, 2147483647, 1024, 8, 32], "", 0, []], [[], [["CHW", 3, "local"], ["CI", 3], ["FU", 4, [0, 1, 2, 3]], ["SP", 4, 0, 28224, [48], 1], ["AN", 4, 0, 5], ["AN", 4, 1, 6]]]], "r": [[6.36776e-06], 0, 0.74021, 1718952735], "v": "v0.6"}
{"i": [["[\"scale_shift_nchw\", 14, 12, 12, 14]", "cuda -keys=cuda,gpu -arch=sm_80 -max_num_threads=1024 -thread_warp_size=32", [-1, 16, 64, 49152, 2147483647, 1024, 8, 32], "", 0, []], [[], [["CHW", 3, "local"], ["CI", 3], ["FU", 4, [0, 1, 2, 3]], ["SP", 4, 0, 28224, [64], 1], ["AN", 4, 0, 5], ["AN", 4, 1, 6]]]], "r": [[6.36486e-06], 0, 0.724021, 1718952735], "v": "v0.6"}
{"i": [["[\"scale_shift_nchw\", 14, 12, 12, 14]", "cuda -keys=cuda,gpu -arch=sm_80 -max_num_threads=1024 -thread_warp_size=32", [-1, 16, 64, 49152, 2147483647, 1024, 8, 32], "", 0, []], [[], [["CHW", 3, "local"], ["CI", 3], ["FU", 4, [0, 1, 2, 3]], ["SP", 4, 0, 28224, [16], 1], ["AN", 4, 0, 5], ["AN", 4, 1, 6]]]], "r": [[8.32106e-06], 0, 0.835226, 1718952735], "v": "v0.6"}
{"i": [["[\"scale_shift_nchw\", 14, 12, 12, 14]", "cuda -keys=cuda,gpu -arch=sm_80 -max_num_threads=1024 -thread_warp_size=32", [-1, 16, 64, 49152, 2147483647, 1024, 8, 32], "", 0, []], [[], [["CHW", 3, "local"], ["CI", 3], ["FU", 4, [0, 1, 2, 3]], ["SP", 4, 0, 28224, [24], 1], ["AN", 4, 0, 5], ["AN", 4, 1, 6]]]], "r": [[7.3355e-06], 0, 0.783086, 1718952736], "v": "v0.6"}
{"i": [["[\"scale_shift_nchw\", 14, 12, 12, 14]", "cuda -keys=cuda,gpu -arch=sm_80 -max_num_threads=1024 -thread_warp_size=32", [-1, 16, 64, 49152, 2147483647, 1024, 8, 32], "", 0, []], [[], [["CHW", 3, "local"], ["CI", 3], ["FU", 4, [0, 1, 2, 3]], ["SP", 4, 0, 28224, [14], 1], ["AN", 4, 0, 5], ["AN", 4, 1, 6]]]], "r": [[8.80907e-06], 0, 0.823035, 1718952736], "v": "v0.6"}
