code_generation/generate/deprecated/deprecated_with_tvm_dependency/log/cuda/scale_shift_nchwc_cuda.log
{"i": [["[\"scale_shift_nchwc\", 4, 17, 16, 12]", "cuda -keys=cuda,gpu -arch=sm_80 -max_num_threads=1024 -thread_warp_size=32", [-1, 16, 64, 49152, 2147483647, 1024, 8, 32], "", 0, []], [[], [["CHW", 3, "local"], ["CI", 3], ["FU", 4, [0, 1, 2, 3, 4]], ["SP", 4, 0, 26112, [17], 1], ["AN", 4, 0, 5], ["AN", 4, 1, 6]]]], "r": [[8.04174e-06], 0, 1.21856, 1718953010], "v": "v0.6"}
{"i": [["[\"scale_shift_nchwc\", 4, 17, 16, 12]", "cuda -keys=cuda,gpu -arch=sm_80 -max_num_threads=1024 -thread_warp_size=32", [-1, 16, 64, 49152, 2147483647, 1024, 8, 32], "", 0, []], [[], [["CHW", 3, "local"], ["CI", 3], ["FU", 4, [0, 1, 2, 3, 4]], ["SP", 4, 0, 26112, [1], 1], ["AN", 4, 0, 5], ["AN", 4, 1, 6]]]], "r": [[4.91061e-05], 0, 0.878701, 1718953010], "v": "v0.6"}
{"i": [["[\"scale_shift_nchwc\", 4, 17, 16, 12]", "cuda -keys=cuda,gpu -arch=sm_80 -max_num_threads=1024 -thread_warp_size=32", [-1, 16, 64, 49152, 2147483647, 1024, 8, 32], "", 0, []], [[], [["CHW", 3, "local"], ["CI", 3], ["FU", 4, [0, 1, 2, 3, 4]], ["SP", 4, 0, 26112, [16], 1], ["AN", 4, 0, 5], ["AN", 4, 1, 6]]]], "r": [[8.26268e-06], 0, 0.803657, 1718953011], "v": "v0.6"}
{"i": [["[\"scale_shift_nchwc\", 4, 17, 16, 12]", "cuda -keys=cuda,gpu -arch=sm_80 -max_num_threads=1024 -thread_warp_size=32", [-1, 16, 64, 49152, 2147483647, 1024, 8, 32], "", 0, []], [[], [["CHW", 3, "local"], ["CI", 3], ["FU", 4, [0, 1, 2, 3, 4]], ["SP", 4, 0, 26112, [4], 1], ["AN", 4, 0, 5], ["AN", 4, 1, 6]]]], "r": [[1.6232e-05], 0, 0.849114, 1718953011], "v": "v0.6"}
{"i": [["[\"scale_shift_nchwc\", 4, 17, 16, 12]", "cuda -keys=cuda,gpu -arch=sm_80 -max_num_threads=1024 -thread_warp_size=32", [-1, 16, 64, 49152, 2147483647, 1024, 8, 32], "", 0, []], [[], [["CHW", 3, "local"], ["CI", 3], ["FU", 4, [0, 1, 2, 3, 4]], ["SP", 4, 0, 26112, [8], 1], ["AN", 4, 0, 5], ["AN", 4, 1, 6]]]], "r": [[1.10077e-05], 0, 0.83007, 1718953011], "v": "v0.6"}
{"i": [["[\"scale_shift_nchwc\", 4, 17, 16, 12]", "cuda -keys=cuda,gpu -arch=sm_80 -max_num_threads=1024 -thread_warp_size=32", [-1, 16, 64, 49152, 2147483647, 1024, 8, 32], "", 0, []], [[], [["CHW", 3, "local"], ["CI", 3], ["FU", 4, [0, 1, 2, 3, 4]], ["SP", 4, 0, 26112, [48], 1], ["AN", 4, 0, 5], ["AN", 4, 1, 6]]]], "r": [[6.61712e-06], 0, 0.833178, 1718953011], "v": "v0.6"}
{"i": [["[\"scale_shift_nchwc\", 4, 17, 16, 12]", "cuda -keys=cuda,gpu -arch=sm_80 -max_num_threads=1024 -thread_warp_size=32", [-1, 16, 64, 49152, 2147483647, 1024, 8, 32], "", 0, []], [[], [["CHW", 3, "local"], ["CI", 3], ["FU", 4, [0, 1, 2, 3, 4]], ["SP", 4, 0, 26112, [51], 1], ["AN", 4, 0, 5], ["AN", 4, 1, 6]]]], "r": [[6.69835e-06], 0, 0.851246, 1718953012], "v": "v0.6"}
{"i": [["[\"scale_shift_nchwc\", 4, 17, 16, 12]", "cuda -keys=cuda,gpu -arch=sm_80 -max_num_threads=1024 -thread_warp_size=32", [-1, 16, 64, 49152, 2147483647, 1024, 8, 32], "", 0, []], [[], [["CHW", 3, "local"], ["CI", 3], ["FU", 4, [0, 1, 2, 3, 4]], ["SP", 4, 0, 26112, [2], 1], ["AN", 4, 0, 5], ["AN", 4, 1, 6]]]], "r": [[2.68711e-05], 0, 0.874254, 1718953012], "v": "v0.6"}
{"i": [["[\"scale_shift_nchwc\", 4, 17, 16, 12]", "cuda -keys=cuda,gpu -arch=sm_80 -max_num_threads=1024 -thread_warp_size=32", [-1, 16, 64, 49152, 2147483647, 1024, 8, 32], "", 0, []], [[], [["CHW", 3, "local"], ["CI", 3], ["FU", 4, [0, 1, 2, 3, 4]], ["SP", 4, 0, 26112, [3], 1], ["AN", 4, 0, 5], ["AN", 4, 1, 6]]]], "r": [[1.99747e-05], 0, 0.814744, 1718953012], "v": "v0.6"}
{"i": [["[\"scale_shift_nchwc\", 4, 17, 16, 12]", "cuda -keys=cuda,gpu -arch=sm_80 -max_num_threads=1024 -thread_warp_size=32", [-1, 16, 64, 49152, 2147483647, 1024, 8, 32], "", 0, []], [[], [["CHW", 3, "local"], ["CI", 3], ["FU", 4, [0, 1, 2, 3, 4]], ["SP", 4, 0, 26112, [24], 1], ["AN", 4, 0, 5], ["AN", 4, 1, 6]]]], "r": [[7.45533e-06], 0, 0.789138, 1718953013], "v": "v0.6"}
