code_generation/generate/deprecated/deprecated_with_tvm_dependency/log/cuda/sigmoid_cuda.log
{"i": [["[\"sigmoid\", 15, 2, 11, 18]", "cuda -keys=cuda,gpu -arch=sm_80 -max_num_threads=1024 -thread_warp_size=32", [-1, 16, 64, 49152, 2147483647, 1024, 8, 32], "", 0, []], [[], [["FU", 1, [0, 1, 2, 3]], ["SP", 1, 0, 5940, [16], 1], ["AN", 1, 0, 5], ["AN", 1, 1, 6]]]], "r": [[6.13523e-06], 0, 1.46411, 1718949781], "v": "v0.6"}
{"i": [["[\"sigmoid\", 15, 2, 11, 18]", "cuda -keys=cuda,gpu -arch=sm_80 -max_num_threads=1024 -thread_warp_size=32", [-1, 16, 64, 49152, 2147483647, 1024, 8, 32], "", 0, []], [[], [["FU", 1, [0, 1, 2, 3]], ["SP", 1, 0, 5940, [22], 1], ["AN", 1, 0, 5], ["AN", 1, 1, 6]]]], "r": [[5.90313e-06], 0, 1.01165, 1718949781], "v": "v0.6"}
{"i": [["[\"sigmoid\", 15, 2, 11, 18]", "cuda -keys=cuda,gpu -arch=sm_80 -max_num_threads=1024 -thread_warp_size=32", [-1, 16, 64, 49152, 2147483647, 1024, 8, 32], "", 0, []], [[], [["FU", 1, [0, 1, 2, 3]], ["SP", 1, 0, 5940, [56], 1], ["AN", 1, 0, 5], ["AN", 1, 1, 6]]]], "r": [[5.72155e-06], 0, 1.01241, 1718949782], "v": "v0.6"}
{"i": [["[\"sigmoid\", 15, 2, 11, 18]", "cuda -keys=cuda,gpu -arch=sm_80 -max_num_threads=1024 -thread_warp_size=32", [-1, 16, 64, 49152, 2147483647, 1024, 8, 32], "", 0, []], [[], [["FU", 1, [0, 1, 2, 3]], ["SP", 1, 0, 5940, [2], 1], ["AN", 1, 0, 5], ["AN", 1, 1, 6]]]], "r": [[1.05147e-05], 0, 0.932819, 1718949782], "v": "v0.6"}
{"i": [["[\"sigmoid\", 15, 2, 11, 18]", "cuda -keys=cuda,gpu -arch=sm_80 -max_num_threads=1024 -thread_warp_size=32", [-1, 16, 64, 49152, 2147483647, 1024, 8, 32], "", 0, []], [[], [["FU", 1, [0, 1, 2, 3]], ["SP", 1, 0, 5940, [1], 1], ["AN", 1, 0, 5], ["AN", 1, 1, 6]]]], "r": [[1.53641e-05], 0, 1.04759, 1718949782], "v": "v0.6"}
{"i": [["[\"sigmoid\", 15, 2, 11, 18]", "cuda -keys=cuda,gpu -arch=sm_80 -max_num_threads=1024 -thread_warp_size=32", [-1, 16, 64, 49152, 2147483647, 1024, 8, 32], "", 0, []], [[], [["FU", 1, [0, 1, 2, 3]], ["SP", 1, 0, 5940, [15], 1], ["AN", 1, 0, 5], ["AN", 1, 1, 6]]]], "r": [[6.55904e-06], 0, 1.01351, 1718949783], "v": "v0.6"}
{"i": [["[\"sigmoid\", 15, 2, 11, 18]", "cuda -keys=cuda,gpu -arch=sm_80 -max_num_threads=1024 -thread_warp_size=32", [-1, 16, 64, 49152, 2147483647, 1024, 8, 32], "", 0, []], [[], [["FU", 1, [0, 1, 2, 3]], ["SP", 1, 0, 5940, [32], 1], ["AN", 1, 0, 5], ["AN", 1, 1, 6]]]], "r": [[5.83212e-06], 0, 1.06, 1718949783], "v": "v0.6"}
{"i": [["[\"sigmoid\", 15, 2, 11, 18]", "cuda -keys=cuda,gpu -arch=sm_80 -max_num_threads=1024 -thread_warp_size=32", [-1, 16, 64, 49152, 2147483647, 1024, 8, 32], "", 0, []], [[], [["FU", 1, [0, 1, 2, 3]], ["SP", 1, 0, 5940, [14], 1], ["AN", 1, 0, 5], ["AN", 1, 1, 6]]]], "r": [[6.17316e-06], 0, 0.931842, 1718949783], "v": "v0.6"}
{"i": [["[\"sigmoid\", 15, 2, 11, 18]", "cuda -keys=cuda,gpu -arch=sm_80 -max_num_threads=1024 -thread_warp_size=32", [-1, 16, 64, 49152, 2147483647, 1024, 8, 32], "", 0, []], [[], [["FU", 1, [0, 1, 2, 3]], ["SP", 1, 0, 5940, [33], 1], ["AN", 1, 0, 5], ["AN", 1, 1, 6]]]], "r": [[5.80226e-06], 0, 0.933843, 1718949783], "v": "v0.6"}
{"i": [["[\"sigmoid\", 15, 2, 11, 18]", "cuda -keys=cuda,gpu -arch=sm_80 -max_num_threads=1024 -thread_warp_size=32", [-1, 16, 64, 49152, 2147483647, 1024, 8, 32], "", 0, []], [[], [["FU", 1, [0, 1, 2, 3]], ["SP", 1, 0, 5940, [27], 1], ["AN", 1, 0, 5], ["AN", 1, 1, 6]]]], "r": [[5.93299e-06], 0, 1.19512, 1718949784], "v": "v0.6"}
