code_generation/generate/deprecated/deprecated_with_tvm_dependency/log/cuda/sign_cuda.log
{"i": [["[\"sign\", 17, 9, 14, 16]", "cuda -keys=cuda,gpu -arch=sm_80 -max_num_threads=1024 -thread_warp_size=32", [-1, 16, 64, 49152, 2147483647, 1024, 8, 32], "", 0, []], [[], [["FU", 1, [0, 1, 2, 3]], ["SP", 1, 0, 34272, [51], 1], ["AN", 1, 0, 5], ["AN", 1, 1, 6]]]], "r": [[6.43923e-06], 0, 1.19143, 1718949946], "v": "v0.6"}
{"i": [["[\"sign\", 17, 9, 14, 16]", "cuda -keys=cuda,gpu -arch=sm_80 -max_num_threads=1024 -thread_warp_size=32", [-1, 16, 64, 49152, 2147483647, 1024, 8, 32], "", 0, []], [[], [["FU", 1, [0, 1, 2, 3]], ["SP", 1, 0, 34272, [28], 1], ["AN", 1, 0, 5], ["AN", 1, 1, 6]]]], "r": [[7.26503e-06], 0, 0.815476, 1718949946], "v": "v0.6"}
{"i": [["[\"sign\", 17, 9, 14, 16]", "cuda -keys=cuda,gpu -arch=sm_80 -max_num_threads=1024 -thread_warp_size=32", [-1, 16, 64, 49152, 2147483647, 1024, 8, 32], "", 0, []], [[], [["FU", 1, [0, 1, 2, 3]], ["SP", 1, 0, 34272, [4], 1], ["AN", 1, 0, 5], ["AN", 1, 1, 6]]]], "r": [[1.96392e-05], 0, 0.831223, 1718949946], "v": "v0.6"}
{"i": [["[\"sign\", 17, 9, 14, 16]", "cuda -keys=cuda,gpu -arch=sm_80 -max_num_threads=1024 -thread_warp_size=32", [-1, 16, 64, 49152, 2147483647, 1024, 8, 32], "", 0, []], [[], [["FU", 1, [0, 1, 2, 3]], ["SP", 1, 0, 34272, [56], 1], ["AN", 1, 0, 5], ["AN", 1, 1, 6]]]], "r": [[7.31106e-06], 0, 0.85509, 1718949947], "v": "v0.6"}
{"i": [["[\"sign\", 17, 9, 14, 16]", "cuda -keys=cuda,gpu -arch=sm_80 -max_num_threads=1024 -thread_warp_size=32", [-1, 16, 64, 49152, 2147483647, 1024, 8, 32], "", 0, []], [[], [["FU", 1, [0, 1, 2, 3]], ["SP", 1, 0, 34272, [1], 1], ["AN", 1, 0, 5], ["AN", 1, 1, 6]]]], "r": [[6.22701e-05], 0, 1.04272, 1718949947], "v": "v0.6"}
{"i": [["[\"sign\", 17, 9, 14, 16]", "cuda -keys=cuda,gpu -arch=sm_80 -max_num_threads=1024 -thread_warp_size=32", [-1, 16, 64, 49152, 2147483647, 1024, 8, 32], "", 0, []], [[], [["FU", 1, [0, 1, 2, 3]], ["SP", 1, 0, 34272, [63], 1], ["AN", 1, 0, 5], ["AN", 1, 1, 6]]]], "r": [[1.05918e-05], 0, 1.05407, 1718949947], "v": "v0.6"}
{"i": [["[\"sign\", 17, 9, 14, 16]", "cuda -keys=cuda,gpu -arch=sm_80 -max_num_threads=1024 -thread_warp_size=32", [-1, 16, 64, 49152, 2147483647, 1024, 8, 32], "", 0, []], [[], [["FU", 1, [0, 1, 2, 3]], ["SP", 1, 0, 34272, [6], 1], ["AN", 1, 0, 5], ["AN", 1, 1, 6]]]], "r": [[1.53348e-05], 0, 0.884819, 1718949948], "v": "v0.6"}
{"i": [["[\"sign\", 17, 9, 14, 16]", "cuda -keys=cuda,gpu -arch=sm_80 -max_num_threads=1024 -thread_warp_size=32", [-1, 16, 64, 49152, 2147483647, 1024, 8, 32], "", 0, []], [[], [["FU", 1, [0, 1, 2, 3]], ["SP", 1, 0, 34272, [24], 1], ["AN", 1, 0, 5], ["AN", 1, 1, 6]]]], "r": [[7.73098e-06], 0, 0.884931, 1718949948], "v": "v0.6"}
{"i": [["[\"sign\", 17, 9, 14, 16]", "cuda -keys=cuda,gpu -arch=sm_80 -max_num_threads=1024 -thread_warp_size=32", [-1, 16, 64, 49152, 2147483647, 1024, 8, 32], "", 0, []], [[], [["FU", 1, [0, 1, 2, 3]], ["SP", 1, 0, 34272, [12], 1], ["AN", 1, 0, 5], ["AN", 1, 1, 6]]]], "r": [[1.01503e-05], 0, 0.870871, 1718949948], "v": "v0.6"}
{"i": [["[\"sign\", 17, 9, 14, 16]", "cuda -keys=cuda,gpu -arch=sm_80 -max_num_threads=1024 -thread_warp_size=32", [-1, 16, 64, 49152, 2147483647, 1024, 8, 32], "", 0, []], [[], [["FU", 1, [0, 1, 2, 3]], ["SP", 1, 0, 34272, [48], 1], ["AN", 1, 0, 5], ["AN", 1, 1, 6]]]], "r": [[9.87893e-06], 0, 0.973899, 1718949949], "v": "v0.6"}
