code_generation/generate/deprecated/deprecated_with_tvm_dependency/log/cuda/sin_cuda.log
{"i": [["[\"sin\", 1, 2, 19, 18]", "cuda -keys=cuda,gpu -arch=sm_80 -max_num_threads=1024 -thread_warp_size=32", [-1, 16, 64, 49152, 2147483647, 1024, 8, 32], "", 0, []], [[], [["FU", 1, [0, 1, 2, 3]], ["SP", 1, 0, 684, [4], 1], ["AN", 1, 0, 5], ["AN", 1, 1, 6]]]], "r": [[5.69607e-06], 0, 1.51203, 1718950225], "v": "v0.6"}
{"i": [["[\"sin\", 1, 2, 19, 18]", "cuda -keys=cuda,gpu -arch=sm_80 -max_num_threads=1024 -thread_warp_size=32", [-1, 16, 64, 49152, 2147483647, 1024, 8, 32], "", 0, []], [[], [["FU", 1, [0, 1, 2, 3]], ["SP", 1, 0, 684, [36], 1], ["AN", 1, 0, 5], ["AN", 1, 1, 6]]]], "r": [[7.36389e-06], 0, 1.09748, 1718950226], "v": "v0.6"}
{"i": [["[\"sin\", 1, 2, 19, 18]", "cuda -keys=cuda,gpu -arch=sm_80 -max_num_threads=1024 -thread_warp_size=32", [-1, 16, 64, 49152, 2147483647, 1024, 8, 32], "", 0, []], [[], [["FU", 1, [0, 1, 2, 3]], ["SP", 1, 0, 684, [18], 1], ["AN", 1, 0, 5], ["AN", 1, 1, 6]]]], "r": [[5.30249e-06], 0, 1.12712, 1718950226], "v": "v0.6"}
{"i": [["[\"sin\", 1, 2, 19, 18]", "cuda -keys=cuda,gpu -arch=sm_80 -max_num_threads=1024 -thread_warp_size=32", [-1, 16, 64, 49152, 2147483647, 1024, 8, 32], "", 0, []], [[], [["FU", 1, [0, 1, 2, 3]], ["SP", 1, 0, 684, [2], 1], ["AN", 1, 0, 5], ["AN", 1, 1, 6]]]], "r": [[7.28929e-06], 0, 1.24188, 1718950226], "v": "v0.6"}
{"i": [["[\"sin\", 1, 2, 19, 18]", "cuda -keys=cuda,gpu -arch=sm_80 -max_num_threads=1024 -thread_warp_size=32", [-1, 16, 64, 49152, 2147483647, 1024, 8, 32], "", 0, []], [[], [["FU", 1, [0, 1, 2, 3]], ["SP", 1, 0, 684, [32], 1], ["AN", 1, 0, 5], ["AN", 1, 1, 6]]]], "r": [[6.41905e-06], 0, 1.09219, 1718950227], "v": "v0.6"}
{"i": [["[\"sin\", 1, 2, 19, 18]", "cuda -keys=cuda,gpu -arch=sm_80 -max_num_threads=1024 -thread_warp_size=32", [-1, 16, 64, 49152, 2147483647, 1024, 8, 32], "", 0, []], [[], [["FU", 1, [0, 1, 2, 3]], ["SP", 1, 0, 684, [6], 1], ["AN", 1, 0, 5], ["AN", 1, 1, 6]]]], "r": [[5.64112e-06], 0, 1.11261, 1718950227], "v": "v0.6"}
{"i": [["[\"sin\", 1, 2, 19, 18]", "cuda -keys=cuda,gpu -arch=sm_80 -max_num_threads=1024 -thread_warp_size=32", [-1, 16, 64, 49152, 2147483647, 1024, 8, 32], "", 0, []], [[], [["FU", 1, [0, 1, 2, 3]], ["SP", 1, 0, 684, [12], 1], ["AN", 1, 0, 5], ["AN", 1, 1, 6]]]], "r": [[6.30832e-06], 0, 1.10961, 1718950227], "v": "v0.6"}
{"i": [["[\"sin\", 1, 2, 19, 18]", "cuda -keys=cuda,gpu -arch=sm_80 -max_num_threads=1024 -thread_warp_size=32", [-1, 16, 64, 49152, 2147483647, 1024, 8, 32], "", 0, []], [[], [["FU", 1, [0, 1, 2, 3]], ["SP", 1, 0, 684, [3], 1], ["AN", 1, 0, 5], ["AN", 1, 1, 6]]]], "r": [[5.82675e-06], 0, 1.0358, 1718950228], "v": "v0.6"}
{"i": [["[\"sin\", 1, 2, 19, 18]", "cuda -keys=cuda,gpu -arch=sm_80 -max_num_threads=1024 -thread_warp_size=32", [-1, 16, 64, 49152, 2147483647, 1024, 8, 32], "", 0, []], [[], [["FU", 1, [0, 1, 2, 3]], ["SP", 1, 0, 684, [19], 1], ["AN", 1, 0, 5], ["AN", 1, 1, 6]]]], "r": [[5.70932e-06], 0, 1.09338, 1718950228], "v": "v0.6"}
{"i": [["[\"sin\", 1, 2, 19, 18]", "cuda -keys=cuda,gpu -arch=sm_80 -max_num_threads=1024 -thread_warp_size=32", [-1, 16, 64, 49152, 2147483647, 1024, 8, 32], "", 0, []], [[], [["FU", 1, [0, 1, 2, 3]], ["SP", 1, 0, 684, [48], 1], ["AN", 1, 0, 5], ["AN", 1, 1, 6]]]], "r": [[5.44224e-06], 0, 1.26193, 1718950228], "v": "v0.6"}
