code_generation/generate/deprecated/deprecated_with_tvm_dependency/log/cuda/sinh_cuda.log
{"i": [["[\"sinh\", 2, 1, 13, 9]", "cuda -keys=cuda,gpu -arch=sm_80 -max_num_threads=1024 -thread_warp_size=32", [-1, 16, 64, 49152, 2147483647, 1024, 8, 32], "", 0, []], [[], [["FU", 1, [0, 1, 2, 3]], ["SP", 1, 0, 234, [4], 1], ["AN", 1, 0, 5], ["AN", 1, 1, 6]]]], "r": [[5.81296e-06], 0, 1.47133, 1718950405], "v": "v0.6"}
{"i": [["[\"sinh\", 2, 1, 13, 9]", "cuda -keys=cuda,gpu -arch=sm_80 -max_num_threads=1024 -thread_warp_size=32", [-1, 16, 64, 49152, 2147483647, 1024, 8, 32], "", 0, []], [[], [["FU", 1, [0, 1, 2, 3]], ["SP", 1, 0, 234, [8], 1], ["AN", 1, 0, 5], ["AN", 1, 1, 6]]]], "r": [[5.8437e-06], 0, 0.826703, 1718950406], "v": "v0.6"}
{"i": [["[\"sinh\", 2, 1, 13, 9]", "cuda -keys=cuda,gpu -arch=sm_80 -max_num_threads=1024 -thread_warp_size=32", [-1, 16, 64, 49152, 2147483647, 1024, 8, 32], "", 0, []], [[], [["FU", 1, [0, 1, 2, 3]], ["SP", 1, 0, 234, [39], 1], ["AN", 1, 0, 5], ["AN", 1, 1, 6]]]], "r": [[5.87859e-06], 0, 0.809331, 1718950406], "v": "v0.6"}
{"i": [["[\"sinh\", 2, 1, 13, 9]", "cuda -keys=cuda,gpu -arch=sm_80 -max_num_threads=1024 -thread_warp_size=32", [-1, 16, 64, 49152, 2147483647, 1024, 8, 32], "", 0, []], [[], [["FU", 1, [0, 1, 2, 3]], ["SP", 1, 0, 234, [1], 1], ["AN", 1, 0, 5], ["AN", 1, 1, 6]]]], "r": [[6.51211e-06], 0, 0.808844, 1718950406], "v": "v0.6"}
{"i": [["[\"sinh\", 2, 1, 13, 9]", "cuda -keys=cuda,gpu -arch=sm_80 -max_num_threads=1024 -thread_warp_size=32", [-1, 16, 64, 49152, 2147483647, 1024, 8, 32], "", 0, []], [[], [["FU", 1, [0, 1, 2, 3]], ["SP", 1, 0, 234, [2], 1], ["AN", 1, 0, 5], ["AN", 1, 1, 6]]]], "r": [[5.96553e-06], 0, 0.791338, 1718950406], "v": "v0.6"}
{"i": [["[\"sinh\", 2, 1, 13, 9]", "cuda -keys=cuda,gpu -arch=sm_80 -max_num_threads=1024 -thread_warp_size=32", [-1, 16, 64, 49152, 2147483647, 1024, 8, 32], "", 0, []], [[], [["FU", 1, [0, 1, 2, 3]], ["SP", 1, 0, 234, [32], 1], ["AN", 1, 0, 5], ["AN", 1, 1, 6]]]], "r": [[5.9241e-06], 0, 0.800026, 1718950407], "v": "v0.6"}
{"i": [["[\"sinh\", 2, 1, 13, 9]", "cuda -keys=cuda,gpu -arch=sm_80 -max_num_threads=1024 -thread_warp_size=32", [-1, 16, 64, 49152, 2147483647, 1024, 8, 32], "", 0, []], [[], [["FU", 1, [0, 1, 2, 3]], ["SP", 1, 0, 234, [13], 1], ["AN", 1, 0, 5], ["AN", 1, 1, 6]]]], "r": [[5.90151e-06], 0, 1.061, 1718950407], "v": "v0.6"}
{"i": [["[\"sinh\", 2, 1, 13, 9]", "cuda -keys=cuda,gpu -arch=sm_80 -max_num_threads=1024 -thread_warp_size=32", [-1, 16, 64, 49152, 2147483647, 1024, 8, 32], "", 0, []], [[], [["FU", 1, [0, 1, 2, 3]], ["SP", 1, 0, 234, [3], 1], ["AN", 1, 0, 5], ["AN", 1, 1, 6]]]], "r": [[5.73441e-06], 0, 1.14478, 1718950407], "v": "v0.6"}
{"i": [["[\"sinh\", 2, 1, 13, 9]", "cuda -keys=cuda,gpu -arch=sm_80 -max_num_threads=1024 -thread_warp_size=32", [-1, 16, 64, 49152, 2147483647, 1024, 8, 32], "", 0, []], [[], [["FU", 1, [0, 1, 2, 3]], ["SP", 1, 0, 234, [9], 1], ["AN", 1, 0, 5], ["AN", 1, 1, 6]]]], "r": [[5.95784e-06], 0, 0.920296, 1718950407], "v": "v0.6"}
{"i": [["[\"sinh\", 2, 1, 13, 9]", "cuda -keys=cuda,gpu -arch=sm_80 -max_num_threads=1024 -thread_warp_size=32", [-1, 16, 64, 49152, 2147483647, 1024, 8, 32], "", 0, []], [[], [["FU", 1, [0, 1, 2, 3]], ["SP", 1, 0, 234, [26], 1], ["AN", 1, 0, 5], ["AN", 1, 1, 6]]]], "r": [[5.87457e-06], 0, 0.873923, 1718950408], "v": "v0.6"}
