code_generation/generate/deprecated/deprecated_with_tvm_dependency/log/cuda/softmax_common_cuda.log
{"i": [["[\"softmax_common\", 6, 18, 17, 14]", "cuda -keys=cuda,gpu -arch=sm_80 -max_num_threads=1024 -thread_warp_size=32", [-1, 16, 64, 49152, 2147483647, 1024, 8, 32], "", 0, []], [[], [["CI", 3], ["CI", 2], ["FU", 5, [0, 1, 2, 3]], ["SP", 5, 0, 25704, [56], 1], ["AN", 5, 0, 5], ["AN", 5, 1, 6], ["FU", 4, [0, 1, 2]], ["SP", 4, 0, 1836, [32], 1], ["AN", 4, 0, 5], ["AN", 4, 1, 6], ["FU", 1, [0, 1, 2]], ["SP", 1, 0, 1836, [1], 1], ["AN", 1, 0, 5], ["AN", 1, 1, 6], ["PR", 1, 0, "auto_unroll_max_step$512"], ["PR", 4, 0, "auto_unroll_max_step$16"]]]], "r": [[2.57009e-05], 0, 1.35225, 1718953615], "v": "v0.6"}
{"i": [["[\"softmax_common\", 6, 18, 17, 14]", "cuda -keys=cuda,gpu -arch=sm_80 -max_num_threads=1024 -thread_warp_size=32", [-1, 16, 64, 49152, 2147483647, 1024, 8, 32], "", 0, []], [[], [["CI", 3], ["CI", 2], ["FU", 5, [0, 1, 2, 3]], ["SP", 5, 0, 25704, [32], 1], ["AN", 5, 0, 5], ["AN", 5, 1, 6], ["FU", 4, [0, 1, 2]], ["SP", 4, 0, 1836, [32], 1], ["AN", 4, 0, 5], ["AN", 4, 1, 6], ["FU", 1, [0, 1, 2]], ["SP", 1, 0, 1836, [1], 1], ["AN", 1, 0, 5], ["AN", 1, 1, 6], ["PR", 1, 0, "auto_unroll_max_step$64"], ["PR", 4, 0, "auto_unroll_max_step$512"]]]], "r": [[2.63489e-05], 0, 0.994044, 1718953615], "v": "v0.6"}
{"i": [["[\"softmax_common\", 6, 18, 17, 14]", "cuda -keys=cuda,gpu -arch=sm_80 -max_num_threads=1024 -thread_warp_size=32", [-1, 16, 64, 49152, 2147483647, 1024, 8, 32], "", 0, []], [[], [["CI", 3], ["CI", 2], ["FU", 5, [0, 1, 2, 3]], ["SP", 5, 0, 25704, [32], 1], ["AN", 5, 0, 5], ["AN", 5, 1, 6], ["FU", 4, [0, 1, 2]], ["SP", 4, 0, 1836, [32], 1], ["AN", 4, 0, 5], ["AN", 4, 1, 6], ["FU", 1, [0, 1, 2]], ["SP", 1, 0, 1836, [4], 1], ["AN", 1, 0, 5], ["AN", 1, 1, 6], ["PR", 1, 0, "auto_unroll_max_step$64"], ["PR", 4, 0, "auto_unroll_max_step$64"]]]], "r": [[2.38891e-05], 0, 0.974624, 1718953615], "v": "v0.6"}
{"i": [["[\"softmax_common\", 6, 18, 17, 14]", "cuda -keys=cuda,gpu -arch=sm_80 -max_num_threads=1024 -thread_warp_size=32", [-1, 16, 64, 49152, 2147483647, 1024, 8, 32], "", 0, []], [[], [["CI", 3], ["CI", 2], ["FU", 5, [0, 1, 2, 3]], ["SP", 5, 0, 25704, [32], 1], ["AN", 5, 0, 5], ["AN", 5, 1, 6], ["FU", 4, [0, 1, 2]], ["SP", 4, 0, 1836, [32], 1], ["AN", 4, 0, 5], ["AN", 4, 1, 6], ["FU", 1, [0, 1, 2]], ["SP", 1, 0, 1836, [8], 1], ["AN", 1, 0, 5], ["AN", 1, 1, 6], ["PR", 1, 0, "auto_unroll_max_step$16"], ["PR", 4, 0, "auto_unroll_max_step$64"]]]], "r": [[2.42728e-05], 0, 0.912759, 1718953616], "v": "v0.6"}
{"i": [["[\"softmax_common\", 6, 18, 17, 14]", "cuda -keys=cuda,gpu -arch=sm_80 -max_num_threads=1024 -thread_warp_size=32", [-1, 16, 64, 49152, 2147483647, 1024, 8, 32], "", 0, []], [[], [["CI", 3], ["CI", 2], ["FU", 5, [0, 1, 2, 3]], ["SP", 5, 0, 25704, [6], 1], ["AN", 5, 0, 5], ["AN", 5, 1, 6], ["FU", 4, [0, 1, 2]], ["SP", 4, 0, 1836, [32], 1], ["AN", 4, 0, 5], ["AN", 4, 1, 6], ["FU", 1, [0, 1, 2]], ["SP", 1, 0, 1836, [2], 1], ["AN", 1, 0, 5], ["AN", 1, 1, 6], ["PR", 1, 0, "auto_unroll_max_step$16"], ["PR", 4, 0, "auto_unroll_max_step$0"]]]], "r": [[3.16723e-05], 0, 1.00446, 1718953616], "v": "v0.6"}
{"i": [["[\"softmax_common\", 6, 18, 17, 14]", "cuda -keys=cuda,gpu -arch=sm_80 -max_num_threads=1024 -thread_warp_size=32", [-1, 16, 64, 49152, 2147483647, 1024, 8, 32], "", 0, []], [[], [["CI", 3], ["CI", 2], ["FU", 5, [0, 1, 2, 3]], ["SP", 5, 0, 25704, [32], 1], ["AN", 5, 0, 5], ["AN", 5, 1, 6], ["FU", 4, [0, 1, 2]], ["SP", 4, 0, 1836, [32], 1], ["AN", 4, 0, 5], ["AN", 4, 1, 6], ["FU", 1, [0, 1, 2]], ["SP", 1, 0, 1836, [32], 1], ["AN", 1, 0, 5], ["AN", 1, 1, 6], ["PR", 1, 0, "auto_unroll_max_step$512"], ["PR", 4, 0, "auto_unroll_max_step$0"]]]], "r": [[2.32625e-05], 0, 0.951591, 1718953616], "v": "v0.6"}
{"i": [["[\"softmax_common\", 6, 18, 17, 14]", "cuda -keys=cuda,gpu -arch=sm_80 -max_num_threads=1024 -thread_warp_size=32", [-1, 16, 64, 49152, 2147483647, 1024, 8, 32], "", 0, []], [[], [["CI", 3], ["CI", 2], ["FU", 5, [0, 1, 2, 3]], ["SP", 5, 0, 25704, [1], 1], ["AN", 5, 0, 5], ["AN", 5, 1, 6], ["FU", 4, [0, 1, 2]], ["SP", 4, 0, 1836, [32], 1], ["AN", 4, 0, 5], ["AN", 4, 1, 6], ["FU", 1, [0, 1, 2]], ["SP", 1, 0, 1836, [6], 1], ["AN", 1, 0, 5], ["AN", 1, 1, 6], ["PR", 1, 0, "auto_unroll_max_step$16"], ["PR", 4, 0, "auto_unroll_max_step$64"]]]], "r": [[6.57918e-05], 0, 0.942375, 1718953617], "v": "v0.6"}
{"i": [["[\"softmax_common\", 6, 18, 17, 14]", "cuda -keys=cuda,gpu -arch=sm_80 -max_num_threads=1024 -thread_warp_size=32", [-1, 16, 64, 49152, 2147483647, 1024, 8, 32], "", 0, []], [[], [["CI", 3], ["CI", 2], ["FU", 5, [0, 1, 2, 3]], ["SP", 5, 0, 25704, [32], 1], ["AN", 5, 0, 5], ["AN", 5, 1, 6], ["FU", 4, [0, 1, 2]], ["SP", 4, 0, 1836, [16], 1], ["AN", 4, 0, 5], ["AN", 4, 1, 6], ["FU", 1, [0, 1, 2]], ["SP", 1, 0, 1836, [32], 1], ["AN", 1, 0, 5], ["AN", 1, 1, 6], ["PR", 1, 0, "auto_unroll_max_step$1024"], ["PR", 4, 0, "auto_unroll_max_step$64"]]]], "r": [[2.32178e-05], 0, 1.00695, 1718953617], "v": "v0.6"}
{"i": [["[\"softmax_common\", 6, 18, 17, 14]", "cuda -keys=cuda,gpu -arch=sm_80 -max_num_threads=1024 -thread_warp_size=32", [-1, 16, 64, 49152, 2147483647, 1024, 8, 32], "", 0, []], [[], [["CI", 3], ["CI", 2], ["FU", 5, [0, 1, 2, 3]], ["SP", 5, 0, 25704, [32], 1], ["AN", 5, 0, 5], ["AN", 5, 1, 6], ["FU", 4, [0, 1, 2]], ["SP", 4, 0, 1836, [32], 1], ["AN", 4, 0, 5], ["AN", 4, 1, 6], ["FU", 1, [0, 1, 2]], ["SP", 1, 0, 1836, [4], 1], ["AN", 1, 0, 5], ["AN", 1, 1, 6], ["PR", 1, 0, "auto_unroll_max_step$64"], ["PR", 4, 0, "auto_unroll_max_step$16"]]]], "r": [[2.41631e-05], 0, 0.956879, 1718953617], "v": "v0.6"}
{"i": [["[\"softmax_common\", 6, 18, 17, 14]", "cuda -keys=cuda,gpu -arch=sm_80 -max_num_threads=1024 -thread_warp_size=32", [-1, 16, 64, 49152, 2147483647, 1024, 8, 32], "", 0, []], [[], [["CI", 3], ["CI", 2], ["FU", 5, [0, 1, 2, 3]], ["SP", 5, 0, 25704, [4], 1], ["AN", 5, 0, 5], ["AN", 5, 1, 6], ["FU", 4, [0, 1, 2]], ["SP", 4, 0, 1836, [32], 1], ["AN", 4, 0, 5], ["AN", 4, 1, 6], ["FU", 1, [0, 1, 2]], ["SP", 1, 0, 1836, [8], 1], ["AN", 1, 0, 5], ["AN", 1, 1, 6], ["PR", 1, 0, "auto_unroll_max_step$16"], ["PR", 4, 0, "auto_unroll_max_step$512"]]]], "r": [[3.36901e-05], 0, 0.98014, 1718953617], "v": "v0.6"}
