code_generation/generate/deprecated/deprecated_with_tvm_dependency/log/cuda/space_to_depth_cuda.log
{"i": [["[\"space_to_depth\", 11, 18, 8, 12]", "cuda -keys=cuda,gpu -arch=sm_80 -max_num_threads=1024 -thread_warp_size=32", [-1, 16, 64, 49152, 2147483647, 1024, 8, 32], "", 0, []], [[], [["FU", 1, [0, 1, 2, 3]], ["SP", 1, 0, 76032, [24], 1], ["AN", 1, 0, 5], ["AN", 1, 1, 6]]]], "r": [[1.11061e-05], 0, 1.22727, 1718953759], "v": "v0.6"}
{"i": [["[\"space_to_depth\", 11, 18, 8, 12]", "cuda -keys=cuda,gpu -arch=sm_80 -max_num_threads=1024 -thread_warp_size=32", [-1, 16, 64, 49152, 2147483647, 1024, 8, 32], "", 0, []], [[], [["FU", 1, [0, 1, 2, 3]], ["SP", 1, 0, 76032, [44], 1], ["AN", 1, 0, 5], ["AN", 1, 1, 6]]]], "r": [[9.03882e-06], 0, 0.794441, 1718953759], "v": "v0.6"}
{"i": [["[\"space_to_depth\", 11, 18, 8, 12]", "cuda -keys=cuda,gpu -arch=sm_80 -max_num_threads=1024 -thread_warp_size=32", [-1, 16, 64, 49152, 2147483647, 1024, 8, 32], "", 0, []], [[], [["FU", 1, [0, 1, 2, 3]], ["SP", 1, 0, 76032, [12], 1], ["AN", 1, 0, 5], ["AN", 1, 1, 6]]]], "r": [[1.60289e-05], 0, 0.808336, 1718953759], "v": "v0.6"}
{"i": [["[\"space_to_depth\", 11, 18, 8, 12]", "cuda -keys=cuda,gpu -arch=sm_80 -max_num_threads=1024 -thread_warp_size=32", [-1, 16, 64, 49152, 2147483647, 1024, 8, 32], "", 0, []], [[], [["FU", 1, [0, 1, 2, 3]], ["SP", 1, 0, 76032, [18], 1], ["AN", 1, 0, 5], ["AN", 1, 1, 6]]]], "r": [[1.28072e-05], 0, 0.820405, 1718953759], "v": "v0.6"}
{"i": [["[\"space_to_depth\", 11, 18, 8, 12]", "cuda -keys=cuda,gpu -arch=sm_80 -max_num_threads=1024 -thread_warp_size=32", [-1, 16, 64, 49152, 2147483647, 1024, 8, 32], "", 0, []], [[], [["FU", 1, [0, 1, 2, 3]], ["SP", 1, 0, 76032, [54], 1], ["AN", 1, 0, 5], ["AN", 1, 1, 6]]]], "r": [[8.34019e-06], 0, 0.799121, 1718953760], "v": "v0.6"}
{"i": [["[\"space_to_depth\", 11, 18, 8, 12]", "cuda -keys=cuda,gpu -arch=sm_80 -max_num_threads=1024 -thread_warp_size=32", [-1, 16, 64, 49152, 2147483647, 1024, 8, 32], "", 0, []], [[], [["FU", 1, [0, 1, 2, 3]], ["SP", 1, 0, 76032, [9], 1], ["AN", 1, 0, 5], ["AN", 1, 1, 6]]]], "r": [[2.02016e-05], 0, 0.796673, 1718953760], "v": "v0.6"}
{"i": [["[\"space_to_depth\", 11, 18, 8, 12]", "cuda -keys=cuda,gpu -arch=sm_80 -max_num_threads=1024 -thread_warp_size=32", [-1, 16, 64, 49152, 2147483647, 1024, 8, 32], "", 0, []], [[], [["FU", 1, [0, 1, 2, 3]], ["SP", 1, 0, 76032, [6], 1], ["AN", 1, 0, 5], ["AN", 1, 1, 6]]]], "r": [[2.69802e-05], 0, 0.811425, 1718953760], "v": "v0.6"}
{"i": [["[\"space_to_depth\", 11, 18, 8, 12]", "cuda -keys=cuda,gpu -arch=sm_80 -max_num_threads=1024 -thread_warp_size=32", [-1, 16, 64, 49152, 2147483647, 1024, 8, 32], "", 0, []], [[], [["FU", 1, [0, 1, 2, 3]], ["SP", 1, 0, 76032, [1], 1], ["AN", 1, 0, 5], ["AN", 1, 1, 6]]]], "r": [[0.000131123], 0, 0.836728, 1718953760], "v": "v0.6"}
{"i": [["[\"space_to_depth\", 11, 18, 8, 12]", "cuda -keys=cuda,gpu -arch=sm_80 -max_num_threads=1024 -thread_warp_size=32", [-1, 16, 64, 49152, 2147483647, 1024, 8, 32], "", 0, []], [[], [["FU", 1, [0, 1, 2, 3]], ["SP", 1, 0, 76032, [22], 1], ["AN", 1, 0, 5], ["AN", 1, 1, 6]]]], "r": [[1.16958e-05], 0, 0.772659, 1718953761], "v": "v0.6"}
{"i": [["[\"space_to_depth\", 11, 18, 8, 12]", "cuda -keys=cuda,gpu -arch=sm_80 -max_num_threads=1024 -thread_warp_size=32", [-1, 16, 64, 49152, 2147483647, 1024, 8, 32], "", 0, []], [[], [["FU", 1, [0, 1, 2, 3]], ["SP", 1, 0, 76032, [32], 1], ["AN", 1, 0, 5], ["AN", 1, 1, 6]]]], "r": [[9.58585e-06], 0, 0.78348, 1718953761], "v": "v0.6"}
