code_generation/generate/deprecated/deprecated_with_tvm_dependency/log/cuda/sqrt_cuda.log
{"i": [["[\"sqrt\", 2, 5, 19, 18]", "cuda -keys=cuda,gpu -arch=sm_80 -max_num_threads=1024 -thread_warp_size=32", [-1, 16, 64, 49152, 2147483647, 1024, 8, 32], "", 0, []], [[], [["FU", 1, [0, 1, 2, 3]], ["SP", 1, 0, 3420, [36], 1], ["AN", 1, 0, 5], ["AN", 1, 1, 6]]]], "r": [[6.01121e-06], 0, 1.34721, 1718950656], "v": "v0.6"}
{"i": [["[\"sqrt\", 2, 5, 19, 18]", "cuda -keys=cuda,gpu -arch=sm_80 -max_num_threads=1024 -thread_warp_size=32", [-1, 16, 64, 49152, 2147483647, 1024, 8, 32], "", 0, []], [[], [["FU", 1, [0, 1, 2, 3]], ["SP", 1, 0, 3420, [24], 1], ["AN", 1, 0, 5], ["AN", 1, 1, 6]]]], "r": [[6.34343e-06], 0, 0.991494, 1718950657], "v": "v0.6"}
{"i": [["[\"sqrt\", 2, 5, 19, 18]", "cuda -keys=cuda,gpu -arch=sm_80 -max_num_threads=1024 -thread_warp_size=32", [-1, 16, 64, 49152, 2147483647, 1024, 8, 32], "", 0, []], [[], [["FU", 1, [0, 1, 2, 3]], ["SP", 1, 0, 3420, [2], 1], ["AN", 1, 0, 5], ["AN", 1, 1, 6]]]], "r": [[8.7923e-06], 0, 0.85794, 1718950657], "v": "v0.6"}
{"i": [["[\"sqrt\", 2, 5, 19, 18]", "cuda -keys=cuda,gpu -arch=sm_80 -max_num_threads=1024 -thread_warp_size=32", [-1, 16, 64, 49152, 2147483647, 1024, 8, 32], "", 0, []], [[], [["FU", 1, [0, 1, 2, 3]], ["SP", 1, 0, 3420, [9], 1], ["AN", 1, 0, 5], ["AN", 1, 1, 6]]]], "r": [[6.43176e-06], 0, 0.848371, 1718950657], "v": "v0.6"}
{"i": [["[\"sqrt\", 2, 5, 19, 18]", "cuda -keys=cuda,gpu -arch=sm_80 -max_num_threads=1024 -thread_warp_size=32", [-1, 16, 64, 49152, 2147483647, 1024, 8, 32], "", 0, []], [[], [["FU", 1, [0, 1, 2, 3]], ["SP", 1, 0, 3420, [15], 1], ["AN", 1, 0, 5], ["AN", 1, 1, 6]]]], "r": [[6.47462e-06], 0, 1.20707, 1718950658], "v": "v0.6"}
{"i": [["[\"sqrt\", 2, 5, 19, 18]", "cuda -keys=cuda,gpu -arch=sm_80 -max_num_threads=1024 -thread_warp_size=32", [-1, 16, 64, 49152, 2147483647, 1024, 8, 32], "", 0, []], [[], [["FU", 1, [0, 1, 2, 3]], ["SP", 1, 0, 3420, [19], 1], ["AN", 1, 0, 5], ["AN", 1, 1, 6]]]], "r": [[6.41079e-06], 0, 0.944553, 1718950658], "v": "v0.6"}
{"i": [["[\"sqrt\", 2, 5, 19, 18]", "cuda -keys=cuda,gpu -arch=sm_80 -max_num_threads=1024 -thread_warp_size=32", [-1, 16, 64, 49152, 2147483647, 1024, 8, 32], "", 0, []], [[], [["FU", 1, [0, 1, 2, 3]], ["SP", 1, 0, 3420, [5], 1], ["AN", 1, 0, 5], ["AN", 1, 1, 6]]]], "r": [[7.78409e-06], 0, 1.14978, 1718950658], "v": "v0.6"}
{"i": [["[\"sqrt\", 2, 5, 19, 18]", "cuda -keys=cuda,gpu -arch=sm_80 -max_num_threads=1024 -thread_warp_size=32", [-1, 16, 64, 49152, 2147483647, 1024, 8, 32], "", 0, []], [[], [["FU", 1, [0, 1, 2, 3]], ["SP", 1, 0, 3420, [12], 1], ["AN", 1, 0, 5], ["AN", 1, 1, 6]]]], "r": [[6.31722e-06], 0, 0.820275, 1718950658], "v": "v0.6"}
{"i": [["[\"sqrt\", 2, 5, 19, 18]", "cuda -keys=cuda,gpu -arch=sm_80 -max_num_threads=1024 -thread_warp_size=32", [-1, 16, 64, 49152, 2147483647, 1024, 8, 32], "", 0, []], [[], [["FU", 1, [0, 1, 2, 3]], ["SP", 1, 0, 3420, [64], 1], ["AN", 1, 0, 5], ["AN", 1, 1, 6]]]], "r": [[5.87574e-06], 0, 0.830155, 1718950659], "v": "v0.6"}
{"i": [["[\"sqrt\", 2, 5, 19, 18]", "cuda -keys=cuda,gpu -arch=sm_80 -max_num_threads=1024 -thread_warp_size=32", [-1, 16, 64, 49152, 2147483647, 1024, 8, 32], "", 0, []], [[], [["FU", 1, [0, 1, 2, 3]], ["SP", 1, 0, 3420, [28], 1], ["AN", 1, 0, 5], ["AN", 1, 1, 6]]]], "r": [[6.53997e-06], 0, 0.977419, 1718950659], "v": "v0.6"}
