code_generation/generate/deprecated/deprecated_with_tvm_dependency/log/cuda/sum_cuda.log
{"i": [["[\"sum\", 10, 1, 17, 13]", "cuda -keys=cuda,gpu -arch=sm_80 -max_num_threads=1024 -thread_warp_size=32", [-1, 16, 64, 49152, 2147483647, 1024, 8, 32], "", 0, []], [[], [["FU", 1, [0, 1, 2, 3]], ["SP", 1, 0, 2210, [32], 1], ["AN", 1, 1, 6], ["FU", 1, []], ["AN", 1, 0, 5], ["PR", 1, 0, "auto_unroll_max_step$16"]]]], "r": [[9.19377e-06], 0, 1.99034, 1718942149], "v": "v0.6"}
{"i": [["[\"sum\", 10, 1, 17, 13]", "cuda -keys=cuda,gpu -arch=sm_80 -max_num_threads=1024 -thread_warp_size=32", [-1, 16, 64, 49152, 2147483647, 1024, 8, 32], "", 0, []], [[], [["FU", 1, [0, 1, 2, 3]], ["SP", 1, 0, 2210, [32], 1], ["AN", 1, 1, 6], ["FU", 1, []], ["AN", 1, 0, 5], ["PR", 1, 0, "auto_unroll_max_step$512"]]]], "r": [[9.18818e-06], 0, 0.699123, 1718942149], "v": "v0.6"}
{"i": [["[\"sum\", 10, 1, 17, 13]", "cuda -keys=cuda,gpu -arch=sm_80 -max_num_threads=1024 -thread_warp_size=32", [-1, 16, 64, 49152, 2147483647, 1024, 8, 32], "", 0, []], [[], [["FU", 1, []], ["AN", 1, 0, 6], ["PR", 1, 0, "auto_unroll_max_step$64"]]]], "r": [[7.34178e-05], 0, 1.48643, 1718942150], "v": "v0.6"}
{"i": [["[\"sum\", 10, 1, 17, 13]", "cuda -keys=cuda,gpu -arch=sm_80 -max_num_threads=1024 -thread_warp_size=32", [-1, 16, 64, 49152, 2147483647, 1024, 8, 32], "", 0, []], [[], [["FU", 1, [0, 1, 2, 3]], ["SP", 1, 0, 2210, [32], 1], ["AN", 1, 1, 6], ["FU", 1, []], ["AN", 1, 0, 5], ["PR", 1, 0, "auto_unroll_max_step$0"]]]], "r": [[9.24675e-06], 0, 0.979182, 1718942150], "v": "v0.6"}
{"i": [["[\"sum\", 10, 1, 17, 13]", "cuda -keys=cuda,gpu -arch=sm_80 -max_num_threads=1024 -thread_warp_size=32", [-1, 16, 64, 49152, 2147483647, 1024, 8, 32], "", 0, []], [[], [["FU", 1, [0, 1, 2, 3]], ["SP", 1, 0, 2210, [32], 1], ["AN", 1, 1, 6], ["FU", 1, []], ["AN", 1, 0, 5], ["PR", 1, 0, "auto_unroll_max_step$1024"]]]], "r": [[9.25398e-06], 0, 1.34567, 1718942150], "v": "v0.6"}
