code_generation/generate/deprecated/deprecated_with_tvm_dependency/log/cuda/tan_cuda.log
{"i": [["[\"tan\", 14, 10, 5, 12]", "cuda -keys=cuda,gpu -arch=sm_80 -max_num_threads=1024 -thread_warp_size=32", [-1, 16, 64, 49152, 2147483647, 1024, 8, 32], "", 0, []], [[], [["FU", 1, [0, 1, 2, 3]], ["SP", 1, 0, 8400, [50], 1], ["AN", 1, 0, 5], ["AN", 1, 1, 6]]]], "r": [[5.86085e-06], 0, 1.31694, 1718950874], "v": "v0.6"}
{"i": [["[\"tan\", 14, 10, 5, 12]", "cuda -keys=cuda,gpu -arch=sm_80 -max_num_threads=1024 -thread_warp_size=32", [-1, 16, 64, 49152, 2147483647, 1024, 8, 32], "", 0, []], [[], [["FU", 1, [0, 1, 2, 3]], ["SP", 1, 0, 8400, [64], 1], ["AN", 1, 0, 5], ["AN", 1, 1, 6]]]], "r": [[6.06783e-06], 0, 1.12049, 1718950875], "v": "v0.6"}
{"i": [["[\"tan\", 14, 10, 5, 12]", "cuda -keys=cuda,gpu -arch=sm_80 -max_num_threads=1024 -thread_warp_size=32", [-1, 16, 64, 49152, 2147483647, 1024, 8, 32], "", 0, []], [[], [["FU", 1, [0, 1, 2, 3]], ["SP", 1, 0, 8400, [25], 1], ["AN", 1, 0, 5], ["AN", 1, 1, 6]]]], "r": [[6.14266e-06], 0, 1.00037, 1718950875], "v": "v0.6"}
{"i": [["[\"tan\", 14, 10, 5, 12]", "cuda -keys=cuda,gpu -arch=sm_80 -max_num_threads=1024 -thread_warp_size=32", [-1, 16, 64, 49152, 2147483647, 1024, 8, 32], "", 0, []], [[], [["FU", 1, [0, 1, 2, 3]], ["SP", 1, 0, 8400, [16], 1], ["AN", 1, 0, 5], ["AN", 1, 1, 6]]]], "r": [[8.23932e-06], 0, 1.08475, 1718950875], "v": "v0.6"}
{"i": [["[\"tan\", 14, 10, 5, 12]", "cuda -keys=cuda,gpu -arch=sm_80 -max_num_threads=1024 -thread_warp_size=32", [-1, 16, 64, 49152, 2147483647, 1024, 8, 32], "", 0, []], [[], [["FU", 1, [0, 1, 2, 3]], ["SP", 1, 0, 8400, [24], 1], ["AN", 1, 0, 5], ["AN", 1, 1, 6]]]], "r": [[6.21476e-06], 0, 0.887104, 1718950876], "v": "v0.6"}
{"i": [["[\"tan\", 14, 10, 5, 12]", "cuda -keys=cuda,gpu -arch=sm_80 -max_num_threads=1024 -thread_warp_size=32", [-1, 16, 64, 49152, 2147483647, 1024, 8, 32], "", 0, []], [[], [["FU", 1, [0, 1, 2, 3]], ["SP", 1, 0, 8400, [1], 1], ["AN", 1, 0, 5], ["AN", 1, 1, 6]]]], "r": [[1.97653e-05], 0, 1.11332, 1718950876], "v": "v0.6"}
{"i": [["[\"tan\", 14, 10, 5, 12]", "cuda -keys=cuda,gpu -arch=sm_80 -max_num_threads=1024 -thread_warp_size=32", [-1, 16, 64, 49152, 2147483647, 1024, 8, 32], "", 0, []], [[], [["FU", 1, [0, 1, 2, 3]], ["SP", 1, 0, 8400, [32], 1], ["AN", 1, 0, 5], ["AN", 1, 1, 6]]]], "r": [[5.9042e-06], 0, 0.88581, 1718950876], "v": "v0.6"}
{"i": [["[\"tan\", 14, 10, 5, 12]", "cuda -keys=cuda,gpu -arch=sm_80 -max_num_threads=1024 -thread_warp_size=32", [-1, 16, 64, 49152, 2147483647, 1024, 8, 32], "", 0, []], [[], [["FU", 1, [0, 1, 2, 3]], ["SP", 1, 0, 8400, [12], 1], ["AN", 1, 0, 5], ["AN", 1, 1, 6]]]], "r": [[6.73333e-06], 0, 0.983253, 1718950876], "v": "v0.6"}
{"i": [["[\"tan\", 14, 10, 5, 12]", "cuda -keys=cuda,gpu -arch=sm_80 -max_num_threads=1024 -thread_warp_size=32", [-1, 16, 64, 49152, 2147483647, 1024, 8, 32], "", 0, []], [[], [["FU", 1, [0, 1, 2, 3]], ["SP", 1, 0, 8400, [6], 1], ["AN", 1, 0, 5], ["AN", 1, 1, 6]]]], "r": [[8.17237e-06], 0, 1.21247, 1718950877], "v": "v0.6"}
{"i": [["[\"tan\", 14, 10, 5, 12]", "cuda -keys=cuda,gpu -arch=sm_80 -max_num_threads=1024 -thread_warp_size=32", [-1, 16, 64, 49152, 2147483647, 1024, 8, 32], "", 0, []], [[], [["FU", 1, [0, 1, 2, 3]], ["SP", 1, 0, 8400, [40], 1], ["AN", 1, 0, 5], ["AN", 1, 1, 6]]]], "r": [[6.12419e-06], 0, 1.01312, 1718950877], "v": "v0.6"}
