code_generation/generate/deprecated/deprecated_with_tvm_dependency/log/cuda/tanh_cuda.log
{"i": [["[\"tanh\", 15, 15, 20, 19]", "cuda -keys=cuda,gpu -arch=sm_80 -max_num_threads=1024 -thread_warp_size=32", [-1, 16, 64, 49152, 2147483647, 1024, 8, 32], "", 0, []], [[], [["FU", 1, [0, 1, 2, 3]], ["SP", 1, 0, 85500, [8], 1], ["AN", 1, 0, 5], ["AN", 1, 1, 6]]]], "r": [[2.37561e-05], 0, 1.44477, 1718951211], "v": "v0.6"}
{"i": [["[\"tanh\", 15, 15, 20, 19]", "cuda -keys=cuda,gpu -arch=sm_80 -max_num_threads=1024 -thread_warp_size=32", [-1, 16, 64, 49152, 2147483647, 1024, 8, 32], "", 0, []], [[], [["FU", 1, [0, 1, 2, 3]], ["SP", 1, 0, 85500, [9], 1], ["AN", 1, 0, 5], ["AN", 1, 1, 6]]]], "r": [[2.14691e-05], 0, 0.816421, 1718951211], "v": "v0.6"}
{"i": [["[\"tanh\", 15, 15, 20, 19]", "cuda -keys=cuda,gpu -arch=sm_80 -max_num_threads=1024 -thread_warp_size=32", [-1, 16, 64, 49152, 2147483647, 1024, 8, 32], "", 0, []], [[], [["FU", 1, [0, 1, 2, 3]], ["SP", 1, 0, 85500, [10], 1], ["AN", 1, 0, 5], ["AN", 1, 1, 6]]]], "r": [[1.9924e-05], 0, 0.83669, 1718951211], "v": "v0.6"}
{"i": [["[\"tanh\", 15, 15, 20, 19]", "cuda -keys=cuda,gpu -arch=sm_80 -max_num_threads=1024 -thread_warp_size=32", [-1, 16, 64, 49152, 2147483647, 1024, 8, 32], "", 0, []], [[], [["FU", 1, [0, 1, 2, 3]], ["SP", 1, 0, 85500, [18], 1], ["AN", 1, 0, 5], ["AN", 1, 1, 6]]]], "r": [[1.37145e-05], 0, 0.846635, 1718951212], "v": "v0.6"}
{"i": [["[\"tanh\", 15, 15, 20, 19]", "cuda -keys=cuda,gpu -arch=sm_80 -max_num_threads=1024 -thread_warp_size=32", [-1, 16, 64, 49152, 2147483647, 1024, 8, 32], "", 0, []], [[], [["FU", 1, [0, 1, 2, 3]], ["SP", 1, 0, 85500, [25], 1], ["AN", 1, 0, 5], ["AN", 1, 1, 6]]]], "r": [[1.15267e-05], 0, 1.09255, 1718951212], "v": "v0.6"}
{"i": [["[\"tanh\", 15, 15, 20, 19]", "cuda -keys=cuda,gpu -arch=sm_80 -max_num_threads=1024 -thread_warp_size=32", [-1, 16, 64, 49152, 2147483647, 1024, 8, 32], "", 0, []], [[], [["FU", 1, [0, 1, 2, 3]], ["SP", 1, 0, 85500, [4], 1], ["AN", 1, 0, 5], ["AN", 1, 1, 6]]]], "r": [[4.06431e-05], 0, 0.909916, 1718951212], "v": "v0.6"}
{"i": [["[\"tanh\", 15, 15, 20, 19]", "cuda -keys=cuda,gpu -arch=sm_80 -max_num_threads=1024 -thread_warp_size=32", [-1, 16, 64, 49152, 2147483647, 1024, 8, 32], "", 0, []], [[], [["FU", 1, [0, 1, 2, 3]], ["SP", 1, 0, 85500, [60], 1], ["AN", 1, 0, 5], ["AN", 1, 1, 6]]]], "r": [[8.26707e-06], 0, 0.851374, 1718951213], "v": "v0.6"}
{"i": [["[\"tanh\", 15, 15, 20, 19]", "cuda -keys=cuda,gpu -arch=sm_80 -max_num_threads=1024 -thread_warp_size=32", [-1, 16, 64, 49152, 2147483647, 1024, 8, 32], "", 0, []], [[], [["FU", 1, [0, 1, 2, 3]], ["SP", 1, 0, 85500, [48], 1], ["AN", 1, 0, 5], ["AN", 1, 1, 6]]]], "r": [[8.82551e-06], 0, 0.758588, 1718951213], "v": "v0.6"}
{"i": [["[\"tanh\", 15, 15, 20, 19]", "cuda -keys=cuda,gpu -arch=sm_80 -max_num_threads=1024 -thread_warp_size=32", [-1, 16, 64, 49152, 2147483647, 1024, 8, 32], "", 0, []], [[], [["FU", 1, [0, 1, 2, 3]], ["SP", 1, 0, 85500, [15], 1], ["AN", 1, 0, 5], ["AN", 1, 1, 6]]]], "r": [[1.5321e-05], 0, 0.817676, 1718951213], "v": "v0.6"}
{"i": [["[\"tanh\", 15, 15, 20, 19]", "cuda -keys=cuda,gpu -arch=sm_80 -max_num_threads=1024 -thread_warp_size=32", [-1, 16, 64, 49152, 2147483647, 1024, 8, 32], "", 0, []], [[], [["FU", 1, [0, 1, 2, 3]], ["SP", 1, 0, 85500, [36], 1], ["AN", 1, 0, 5], ["AN", 1, 1, 6]]]], "r": [[1.05726e-05], 0, 0.923479, 1718951214], "v": "v0.6"}
