code_generation/generate/deprecated/deprecated_with_tvm_dependency/log/cuda/topology_expansion_cuda.log
{"i": [["[\"topology_expansion\"]", "cuda -keys=cuda,gpu -arch=sm_80 -max_num_threads=1024 -thread_warp_size=32", [-1, 16, 64, 49152, 2147483647, 1024, 8, 32], "", 0, []], [[], [["CI", 2], ["CI", 1], ["FU", 3, [0, 1, 2]], ["SP", 3, 0, 72, [8], 1], ["AN", 3, 0, 5], ["AN", 3, 1, 6]]]], "r": [[6.62146e-06], 0, 0.997912, 1720595891], "v": "v0.6"}
{"i": [["[\"topology_expansion\"]", "cuda -keys=cuda,gpu -arch=sm_80 -max_num_threads=1024 -thread_warp_size=32", [-1, 16, 64, 49152, 2147483647, 1024, 8, 32], "", 0, []], [[], [["CI", 2], ["CI", 1], ["FU", 3, [0, 1, 2]], ["SP", 3, 0, 72, [24], 1], ["AN", 3, 0, 5], ["AN", 3, 1, 6]]]], "r": [[5.57413e-06], 0, 0.559218, 1720595891], "v": "v0.6"}
{"i": [["[\"topology_expansion\"]", "cuda -keys=cuda,gpu -arch=sm_80 -max_num_threads=1024 -thread_warp_size=32", [-1, 16, 64, 49152, 2147483647, 1024, 8, 32], "", 0, []], [[], [["CI", 2], ["CI", 1], ["FU", 3, [0, 1, 2]], ["SP", 3, 0, 72, [1], 1], ["AN", 3, 0, 5], ["AN", 3, 1, 6]]]], "r": [[1.24991e-05], 0, 0.559235, 1720595891], "v": "v0.6"}
{"i": [["[\"topology_expansion\"]", "cuda -keys=cuda,gpu -arch=sm_80 -max_num_threads=1024 -thread_warp_size=32", [-1, 16, 64, 49152, 2147483647, 1024, 8, 32], "", 0, []], [[], [["CI", 2], ["CI", 1], ["FU", 3, [0, 1, 2]], ["SP", 3, 0, 72, [3], 1], ["AN", 3, 0, 5], ["AN", 3, 1, 6]]]], "r": [[5.56373e-06], 0, 0.533692, 1720595892], "v": "v0.6"}
{"i": [["[\"topology_expansion\"]", "cuda -keys=cuda,gpu -arch=sm_80 -max_num_threads=1024 -thread_warp_size=32", [-1, 16, 64, 49152, 2147483647, 1024, 8, 32], "", 0, []], [[], [["CI", 2], ["CI", 1], ["FU", 3, [0, 1, 2]], ["SP", 3, 0, 72, [18], 1], ["AN", 3, 0, 5], ["AN", 3, 1, 6]]]], "r": [[5.49033e-06], 0, 0.549463, 1720595892], "v": "v0.6"}
{"i": [["[\"topology_expansion\"]", "cuda -keys=cuda,gpu -arch=sm_80 -max_num_threads=1024 -thread_warp_size=32", [-1, 16, 64, 49152, 2147483647, 1024, 8, 32], "", 0, []], [[], [["CI", 2], ["CI", 1], ["FU", 3, [0, 1, 2]], ["SP", 3, 0, 72, [4], 1], ["AN", 3, 0, 5], ["AN", 3, 1, 6]]]], "r": [[6.73e-06], 0, 0.520056, 1720595892], "v": "v0.6"}
{"i": [["[\"topology_expansion\"]", "cuda -keys=cuda,gpu -arch=sm_80 -max_num_threads=1024 -thread_warp_size=32", [-1, 16, 64, 49152, 2147483647, 1024, 8, 32], "", 0, []], [[], [["CI", 2], ["CI", 1], ["FU", 3, [0, 1, 2]], ["SP", 3, 0, 72, [6], 1], ["AN", 3, 0, 5], ["AN", 3, 1, 6]]]], "r": [[5.90398e-06], 0, 0.552921, 1720595892], "v": "v0.6"}
{"i": [["[\"topology_expansion\"]", "cuda -keys=cuda,gpu -arch=sm_80 -max_num_threads=1024 -thread_warp_size=32", [-1, 16, 64, 49152, 2147483647, 1024, 8, 32], "", 0, []], [[], [["CI", 2], ["CI", 1], ["FU", 3, [0, 1, 2]], ["SP", 3, 0, 72, [9], 1], ["AN", 3, 0, 5], ["AN", 3, 1, 6]]]], "r": [[5.49908e-06], 0, 0.520786, 1720595892], "v": "v0.6"}
{"i": [["[\"topology_expansion\"]", "cuda -keys=cuda,gpu -arch=sm_80 -max_num_threads=1024 -thread_warp_size=32", [-1, 16, 64, 49152, 2147483647, 1024, 8, 32], "", 0, []], [[], [["CI", 2], ["CI", 1], ["FU", 3, [0, 1, 2]], ["SP", 3, 0, 72, [36], 1], ["AN", 3, 0, 5], ["AN", 3, 1, 6]]]], "r": [[5.48208e-06], 0, 0.525949, 1720595893], "v": "v0.6"}
{"i": [["[\"topology_expansion\"]", "cuda -keys=cuda,gpu -arch=sm_80 -max_num_threads=1024 -thread_warp_size=32", [-1, 16, 64, 49152, 2147483647, 1024, 8, 32], "", 0, []], [[], [["CI", 2], ["CI", 1], ["FU", 3, [0, 1, 2]], ["SP", 3, 0, 72, [16], 1], ["AN", 3, 0, 5], ["AN", 3, 1, 6]]]], "r": [[5.47174e-06], 0, 0.536988, 1720595893], "v": "v0.6"}
