code_generation/generate/deprecated/deprecated_with_tvm_dependency/log/cuda/unpack_NCHWc_to_nchw_cuda.log
{"i": [["[\"unpack_NCHWc_to_nchw\", 16, 13, 14, 7]", "cuda -keys=cuda,gpu -arch=sm_80 -max_num_threads=1024 -thread_warp_size=32", [-1, 16, 64, 49152, 2147483647, 1024, 8, 32], "", 0, []], [[], [["FU", 1, [0, 1, 2, 3]], ["SP", 1, 0, 40768, [2], 1], ["AN", 1, 0, 5], ["AN", 1, 1, 6]]]], "r": [[3.96369e-05], 0, 1.26475, 1718954050], "v": "v0.6"}
{"i": [["[\"unpack_NCHWc_to_nchw\", 16, 13, 14, 7]", "cuda -keys=cuda,gpu -arch=sm_80 -max_num_threads=1024 -thread_warp_size=32", [-1, 16, 64, 49152, 2147483647, 1024, 8, 32], "", 0, []], [[], [["FU", 1, [0, 1, 2, 3]], ["SP", 1, 0, 40768, [32], 1], ["AN", 1, 0, 5], ["AN", 1, 1, 6]]]], "r": [[7.56831e-06], 0, 0.759682, 1718954051], "v": "v0.6"}
{"i": [["[\"unpack_NCHWc_to_nchw\", 16, 13, 14, 7]", "cuda -keys=cuda,gpu -arch=sm_80 -max_num_threads=1024 -thread_warp_size=32", [-1, 16, 64, 49152, 2147483647, 1024, 8, 32], "", 0, []], [[], [["FU", 1, [0, 1, 2, 3]], ["SP", 1, 0, 40768, [28], 1], ["AN", 1, 0, 5], ["AN", 1, 1, 6]]]], "r": [[7.7546e-06], 0, 0.807009, 1718954051], "v": "v0.6"}
{"i": [["[\"unpack_NCHWc_to_nchw\", 16, 13, 14, 7]", "cuda -keys=cuda,gpu -arch=sm_80 -max_num_threads=1024 -thread_warp_size=32", [-1, 16, 64, 49152, 2147483647, 1024, 8, 32], "", 0, []], [[], [["FU", 1, [0, 1, 2, 3]], ["SP", 1, 0, 40768, [8], 1], ["AN", 1, 0, 5], ["AN", 1, 1, 6]]]], "r": [[1.40455e-05], 0, 0.821392, 1718954051], "v": "v0.6"}
{"i": [["[\"unpack_NCHWc_to_nchw\", 16, 13, 14, 7]", "cuda -keys=cuda,gpu -arch=sm_80 -max_num_threads=1024 -thread_warp_size=32", [-1, 16, 64, 49152, 2147483647, 1024, 8, 32], "", 0, []], [[], [["FU", 1, [0, 1, 2, 3]], ["SP", 1, 0, 40768, [16], 1], ["AN", 1, 0, 5], ["AN", 1, 1, 6]]]], "r": [[9.57767e-06], 0, 0.796287, 1718954051], "v": "v0.6"}
{"i": [["[\"unpack_NCHWc_to_nchw\", 16, 13, 14, 7]", "cuda -keys=cuda,gpu -arch=sm_80 -max_num_threads=1024 -thread_warp_size=32", [-1, 16, 64, 49152, 2147483647, 1024, 8, 32], "", 0, []], [[], [["FU", 1, [0, 1, 2, 3]], ["SP", 1, 0, 40768, [49], 1], ["AN", 1, 0, 5], ["AN", 1, 1, 6]]]], "r": [[6.65108e-06], 0, 0.75319, 1718954052], "v": "v0.6"}
{"i": [["[\"unpack_NCHWc_to_nchw\", 16, 13, 14, 7]", "cuda -keys=cuda,gpu -arch=sm_80 -max_num_threads=1024 -thread_warp_size=32", [-1, 16, 64, 49152, 2147483647, 1024, 8, 32], "", 0, []], [[], [["FU", 1, [0, 1, 2, 3]], ["SP", 1, 0, 40768, [14], 1], ["AN", 1, 0, 5], ["AN", 1, 1, 6]]]], "r": [[1.02057e-05], 0, 0.826026, 1718954052], "v": "v0.6"}
{"i": [["[\"unpack_NCHWc_to_nchw\", 16, 13, 14, 7]", "cuda -keys=cuda,gpu -arch=sm_80 -max_num_threads=1024 -thread_warp_size=32", [-1, 16, 64, 49152, 2147483647, 1024, 8, 32], "", 0, []], [[], [["FU", 1, [0, 1, 2, 3]], ["SP", 1, 0, 40768, [56], 1], ["AN", 1, 0, 5], ["AN", 1, 1, 6]]]], "r": [[6.65235e-06], 0, 0.76027, 1718954052], "v": "v0.6"}
{"i": [["[\"unpack_NCHWc_to_nchw\", 16, 13, 14, 7]", "cuda -keys=cuda,gpu -arch=sm_80 -max_num_threads=1024 -thread_warp_size=32", [-1, 16, 64, 49152, 2147483647, 1024, 8, 32], "", 0, []], [[], [["FU", 1, [0, 1, 2, 3]], ["SP", 1, 0, 40768, [4], 1], ["AN", 1, 0, 5], ["AN", 1, 1, 6]]]], "r": [[2.25808e-05], 0, 0.849333, 1718954052], "v": "v0.6"}
{"i": [["[\"unpack_NCHWc_to_nchw\", 16, 13, 14, 7]", "cuda -keys=cuda,gpu -arch=sm_80 -max_num_threads=1024 -thread_warp_size=32", [-1, 16, 64, 49152, 2147483647, 1024, 8, 32], "", 0, []], [[], [["FU", 1, [0, 1, 2, 3]], ["SP", 1, 0, 40768, [7], 1], ["AN", 1, 0, 5], ["AN", 1, 1, 6]]]], "r": [[1.51974e-05], 0, 0.782942, 1718954053], "v": "v0.6"}
