code_generation/generate/deprecated/deprecated_with_tvm_dependency/log/cuda/upsampling_cuda.log
{"i": [["[\"upsampling\", 18, 5, 14, 4]", "cuda -keys=cuda,gpu -arch=sm_80 -max_num_threads=1024 -thread_warp_size=32", [-1, 16, 64, 49152, 2147483647, 1024, 8, 32], "", 0, []], [[], [["FU", 1, [0, 1, 2, 3]], ["SP", 1, 0, 80640, [3], 1], ["AN", 1, 0, 5], ["AN", 1, 1, 6]]]], "r": [[5.01579e-05], 0, 1.25615, 1718954217], "v": "v0.6"}
{"i": [["[\"upsampling\", 18, 5, 14, 4]", "cuda -keys=cuda,gpu -arch=sm_80 -max_num_threads=1024 -thread_warp_size=32", [-1, 16, 64, 49152, 2147483647, 1024, 8, 32], "", 0, []], [[], [["FU", 1, [0, 1, 2, 3]], ["SP", 1, 0, 80640, [30], 1], ["AN", 1, 0, 5], ["AN", 1, 1, 6]]]], "r": [[1.02266e-05], 0, 0.855098, 1718954217], "v": "v0.6"}
{"i": [["[\"upsampling\", 18, 5, 14, 4]", "cuda -keys=cuda,gpu -arch=sm_80 -max_num_threads=1024 -thread_warp_size=32", [-1, 16, 64, 49152, 2147483647, 1024, 8, 32], "", 0, []], [[], [["FU", 1, [0, 1, 2, 3]], ["SP", 1, 0, 80640, [12], 1], ["AN", 1, 0, 5], ["AN", 1, 1, 6]]]], "r": [[1.71175e-05], 0, 0.810722, 1718954217], "v": "v0.6"}
{"i": [["[\"upsampling\", 18, 5, 14, 4]", "cuda -keys=cuda,gpu -arch=sm_80 -max_num_threads=1024 -thread_warp_size=32", [-1, 16, 64, 49152, 2147483647, 1024, 8, 32], "", 0, []], [[], [["FU", 1, [0, 1, 2, 3]], ["SP", 1, 0, 80640, [4], 1], ["AN", 1, 0, 5], ["AN", 1, 1, 6]]]], "r": [[3.87752e-05], 0, 0.837202, 1718954217], "v": "v0.6"}
{"i": [["[\"upsampling\", 18, 5, 14, 4]", "cuda -keys=cuda,gpu -arch=sm_80 -max_num_threads=1024 -thread_warp_size=32", [-1, 16, 64, 49152, 2147483647, 1024, 8, 32], "", 0, []], [[], [["FU", 1, [0, 1, 2, 3]], ["SP", 1, 0, 80640, [35], 1], ["AN", 1, 0, 5], ["AN", 1, 1, 6]]]], "r": [[9.79085e-06], 0, 0.761565, 1718954218], "v": "v0.6"}
{"i": [["[\"upsampling\", 18, 5, 14, 4]", "cuda -keys=cuda,gpu -arch=sm_80 -max_num_threads=1024 -thread_warp_size=32", [-1, 16, 64, 49152, 2147483647, 1024, 8, 32], "", 0, []], [[], [["FU", 1, [0, 1, 2, 3]], ["SP", 1, 0, 80640, [15], 1], ["AN", 1, 0, 5], ["AN", 1, 1, 6]]]], "r": [[1.47048e-05], 0, 0.815764, 1718954218], "v": "v0.6"}
{"i": [["[\"upsampling\", 18, 5, 14, 4]", "cuda -keys=cuda,gpu -arch=sm_80 -max_num_threads=1024 -thread_warp_size=32", [-1, 16, 64, 49152, 2147483647, 1024, 8, 32], "", 0, []], [[], [["FU", 1, [0, 1, 2, 3]], ["SP", 1, 0, 80640, [36], 1], ["AN", 1, 0, 5], ["AN", 1, 1, 6]]]], "r": [[9.27242e-06], 0, 0.818292, 1718954218], "v": "v0.6"}
{"i": [["[\"upsampling\", 18, 5, 14, 4]", "cuda -keys=cuda,gpu -arch=sm_80 -max_num_threads=1024 -thread_warp_size=32", [-1, 16, 64, 49152, 2147483647, 1024, 8, 32], "", 0, []], [[], [["FU", 1, [0, 1, 2, 3]], ["SP", 1, 0, 80640, [18], 1], ["AN", 1, 0, 5], ["AN", 1, 1, 6]]]], "r": [[1.29497e-05], 0, 0.845264, 1718954219], "v": "v0.6"}
{"i": [["[\"upsampling\", 18, 5, 14, 4]", "cuda -keys=cuda,gpu -arch=sm_80 -max_num_threads=1024 -thread_warp_size=32", [-1, 16, 64, 49152, 2147483647, 1024, 8, 32], "", 0, []], [[], [["FU", 1, [0, 1, 2, 3]], ["SP", 1, 0, 80640, [5], 1], ["AN", 1, 0, 5], ["AN", 1, 1, 6]]]], "r": [[3.25349e-05], 0, 0.83533, 1718954219], "v": "v0.6"}
{"i": [["[\"upsampling\", 18, 5, 14, 4]", "cuda -keys=cuda,gpu -arch=sm_80 -max_num_threads=1024 -thread_warp_size=32", [-1, 16, 64, 49152, 2147483647, 1024, 8, 32], "", 0, []], [[], [["FU", 1, [0, 1, 2, 3]], ["SP", 1, 0, 80640, [1], 1], ["AN", 1, 0, 5], ["AN", 1, 1, 6]]]], "r": [[0.000138636], 0, 0.881333, 1718954219], "v": "v0.6"}
