code_generation/generate/deprecated/deprecated_simple_v1.0/log/cuda/abs_cuda.log
{"i": [["[\"abs\", 7, 7, 6, 1]", "cuda -keys=cuda,gpu -arch=sm_80 -max_num_threads=1024 -thread_warp_size=32", [-1, 16, 64, 49152, 2147483647, 1024, 8, 32], "", 0, []], [[], [["FU", 1, [0, 1, 2, 3]], ["SP", 1, 0, 294, [16], 1], ["AN", 1, 0, 5], ["AN", 1, 1, 6]]]], "r": [[5.81463e-06], 0, 2.08898, 1721370163], "v": "v0.6"}
{"i": [["[\"abs\", 7, 7, 6, 1]", "cuda -keys=cuda,gpu -arch=sm_80 -max_num_threads=1024 -thread_warp_size=32", [-1, 16, 64, 49152, 2147483647, 1024, 8, 32], "", 0, []], [[], [["FU", 1, [0, 1, 2, 3]], ["SP", 1, 0, 294, [12], 1], ["AN", 1, 0, 5], ["AN", 1, 1, 6]]]], "r": [[5.90888e-06], 0, 1.43249, 1721370163], "v": "v0.6"}
{"i": [["[\"abs\", 7, 7, 6, 1]", "cuda -keys=cuda,gpu -arch=sm_80 -max_num_threads=1024 -thread_warp_size=32", [-1, 16, 64, 49152, 2147483647, 1024, 8, 32], "", 0, []], [[], [["FU", 1, [0, 1, 2, 3]], ["SP", 1, 0, 294, [6], 1], ["AN", 1, 0, 5], ["AN", 1, 1, 6]]]], "r": [[6.94928e-06], 0, 1.51644, 1721370164], "v": "v0.6"}
{"i": [["[\"abs\", 7, 7, 6, 1]", "cuda -keys=cuda,gpu -arch=sm_80 -max_num_threads=1024 -thread_warp_size=32", [-1, 16, 64, 49152, 2147483647, 1024, 8, 32], "", 0, []], [[], [["FU", 1, [0, 1, 2, 3]], ["SP", 1, 0, 294, [14], 1], ["AN", 1, 0, 5], ["AN", 1, 1, 6]]]], "r": [[8.37042e-06], 0, 1.33277, 1721370164], "v": "v0.6"}
{"i": [["[\"abs\", 7, 7, 6, 1]", "cuda -keys=cuda,gpu -arch=sm_80 -max_num_threads=1024 -thread_warp_size=32", [-1, 16, 64, 49152, 2147483647, 1024, 8, 32], "", 0, []], [[], [["FU", 1, [0, 1, 2, 3]], ["SP", 1, 0, 294, [32], 1], ["AN", 1, 0, 5], ["AN", 1, 1, 6]]]], "r": [[8.17317e-06], 0, 1.56239, 1721370165], "v": "v0.6"}
{"i": [["[\"abs\", 7, 7, 6, 1]", "cuda -keys=cuda,gpu -arch=sm_80 -max_num_threads=1024 -thread_warp_size=32", [-1, 16, 64, 49152, 2147483647, 1024, 8, 32], "", 0, []], [[], [["FU", 1, [0, 1, 2, 3]], ["SP", 1, 0, 294, [8], 1], ["AN", 1, 0, 5], ["AN", 1, 1, 6]]]], "r": [[9.63345e-06], 0, 1.39614, 1721370165], "v": "v0.6"}
{"i": [["[\"abs\", 7, 7, 6, 1]", "cuda -keys=cuda,gpu -arch=sm_80 -max_num_threads=1024 -thread_warp_size=32", [-1, 16, 64, 49152, 2147483647, 1024, 8, 32], "", 0, []], [[], [["FU", 1, [0, 1, 2, 3]], ["SP", 1, 0, 294, [36], 1], ["AN", 1, 0, 5], ["AN", 1, 1, 6]]]], "r": [[8.39793e-06], 0, 1.53241, 1721370165], "v": "v0.6"}
{"i": [["[\"abs\", 7, 7, 6, 1]", "cuda -keys=cuda,gpu -arch=sm_80 -max_num_threads=1024 -thread_warp_size=32", [-1, 16, 64, 49152, 2147483647, 1024, 8, 32], "", 0, []], [[], [["FU", 1, [0, 1, 2, 3]], ["SP", 1, 0, 294, [4], 1], ["AN", 1, 0, 5], ["AN", 1, 1, 6]]]], "r": [[1.05153e-05], 0, 1.28016, 1721370166], "v": "v0.6"}
{"i": [["[\"abs\", 7, 7, 6, 1]", "cuda -keys=cuda,gpu -arch=sm_80 -max_num_threads=1024 -thread_warp_size=32", [-1, 16, 64, 49152, 2147483647, 1024, 8, 32], "", 0, []], [[], [["FU", 1, [0, 1, 2, 3]], ["SP", 1, 0, 294, [3], 1], ["AN", 1, 0, 5], ["AN", 1, 1, 6]]]], "r": [[8.97148e-06], 0, 1.46323, 1721370166], "v": "v0.6"}
{"i": [["[\"abs\", 7, 7, 6, 1]", "cuda -keys=cuda,gpu -arch=sm_80 -max_num_threads=1024 -thread_warp_size=32", [-1, 16, 64, 49152, 2147483647, 1024, 8, 32], "", 0, []], [[], [["FU", 1, [0, 1, 2, 3]], ["SP", 1, 0, 294, [49], 1], ["AN", 1, 0, 5], ["AN", 1, 1, 6]]]], "r": [[8.33839e-06], 0, 1.3183, 1721370167], "v": "v0.6"}
