code_generation/generate/deprecated/deprecated_simple_v1.0/log/cuda/acos_cuda.log
{"i": [["[\"acos\", 9, 7, 16, 17]", "cuda -keys=cuda,gpu -arch=sm_80 -max_num_threads=1024 -thread_warp_size=32", [-1, 16, 64, 49152, 2147483647, 1024, 8, 32], "", 0, []], [[], [["FU", 1, [0, 1, 2, 3]], ["SP", 1, 0, 17136, [14], 1], ["AN", 1, 0, 5], ["AN", 1, 1, 6]]]], "r": [[1.00026e-05], 0, 2.41024, 1721383565], "v": "v0.6"}
{"i": [["[\"acos\", 9, 7, 16, 17]", "cuda -keys=cuda,gpu -arch=sm_80 -max_num_threads=1024 -thread_warp_size=32", [-1, 16, 64, 49152, 2147483647, 1024, 8, 32], "", 0, []], [[], [["FU", 1, [0, 1, 2, 3]], ["SP", 1, 0, 17136, [42], 1], ["AN", 1, 0, 5], ["AN", 1, 1, 6]]]], "r": [[7.30829e-06], 0, 2.10296, 1721383565], "v": "v0.6"}
{"i": [["[\"acos\", 9, 7, 16, 17]", "cuda -keys=cuda,gpu -arch=sm_80 -max_num_threads=1024 -thread_warp_size=32", [-1, 16, 64, 49152, 2147483647, 1024, 8, 32], "", 0, []], [[], [["FU", 1, [0, 1, 2, 3]], ["SP", 1, 0, 17136, [16], 1], ["AN", 1, 0, 5], ["AN", 1, 1, 6]]]], "r": [[7.84806e-06], 0, 2.1776, 1721383565], "v": "v0.6"}
{"i": [["[\"acos\", 9, 7, 16, 17]", "cuda -keys=cuda,gpu -arch=sm_80 -max_num_threads=1024 -thread_warp_size=32", [-1, 16, 64, 49152, 2147483647, 1024, 8, 32], "", 0, []], [[], [["FU", 1, [0, 1, 2, 3]], ["SP", 1, 0, 17136, [17], 1], ["AN", 1, 0, 5], ["AN", 1, 1, 6]]]], "r": [[7.25657e-06], 0, 1.81547, 1721383566], "v": "v0.6"}
{"i": [["[\"acos\", 9, 7, 16, 17]", "cuda -keys=cuda,gpu -arch=sm_80 -max_num_threads=1024 -thread_warp_size=32", [-1, 16, 64, 49152, 2147483647, 1024, 8, 32], "", 0, []], [[], [["FU", 1, [0, 1, 2, 3]], ["SP", 1, 0, 17136, [9], 1], ["AN", 1, 0, 5], ["AN", 1, 1, 6]]]], "r": [[8.83357e-06], 0, 1.96312, 1721383566], "v": "v0.6"}
{"i": [["[\"acos\", 9, 7, 16, 17]", "cuda -keys=cuda,gpu -arch=sm_80 -max_num_threads=1024 -thread_warp_size=32", [-1, 16, 64, 49152, 2147483647, 1024, 8, 32], "", 0, []], [[], [["FU", 1, [0, 1, 2, 3]], ["SP", 1, 0, 17136, [21], 1], ["AN", 1, 0, 5], ["AN", 1, 1, 6]]]], "r": [[8.26897e-06], 0, 1.5599, 1721383567], "v": "v0.6"}
{"i": [["[\"acos\", 9, 7, 16, 17]", "cuda -keys=cuda,gpu -arch=sm_80 -max_num_threads=1024 -thread_warp_size=32", [-1, 16, 64, 49152, 2147483647, 1024, 8, 32], "", 0, []], [[], [["FU", 1, [0, 1, 2, 3]], ["SP", 1, 0, 17136, [3], 1], ["AN", 1, 0, 5], ["AN", 1, 1, 6]]]], "r": [[2.05601e-05], 0, 1.17536, 1721383567], "v": "v0.6"}
{"i": [["[\"acos\", 9, 7, 16, 17]", "cuda -keys=cuda,gpu -arch=sm_80 -max_num_threads=1024 -thread_warp_size=32", [-1, 16, 64, 49152, 2147483647, 1024, 8, 32], "", 0, []], [[], [["FU", 1, [0, 1, 2, 3]], ["SP", 1, 0, 17136, [4], 1], ["AN", 1, 0, 5], ["AN", 1, 1, 6]]]], "r": [[1.32654e-05], 0, 1.78943, 1721383567], "v": "v0.6"}
{"i": [["[\"acos\", 9, 7, 16, 17]", "cuda -keys=cuda,gpu -arch=sm_80 -max_num_threads=1024 -thread_warp_size=32", [-1, 16, 64, 49152, 2147483647, 1024, 8, 32], "", 0, []], [[], [["FU", 1, [0, 1, 2, 3]], ["SP", 1, 0, 17136, [63], 1], ["AN", 1, 0, 5], ["AN", 1, 1, 6]]]], "r": [[6.32306e-06], 0, 1.91608, 1721383568], "v": "v0.6"}
{"i": [["[\"acos\", 9, 7, 16, 17]", "cuda -keys=cuda,gpu -arch=sm_80 -max_num_threads=1024 -thread_warp_size=32", [-1, 16, 64, 49152, 2147483647, 1024, 8, 32], "", 0, []], [[], [["FU", 1, [0, 1, 2, 3]], ["SP", 1, 0, 17136, [48], 1], ["AN", 1, 0, 5], ["AN", 1, 1, 6]]]], "r": [[6.93669e-06], 0, 1.72427, 1721383568], "v": "v0.6"}
