code_generation/generate/deprecated/deprecated_simple_v1.0/log/cuda/add_cuda.log
{"i": [["[\"add\", 16, 5, 10, 3]", "cuda -keys=cuda,gpu -arch=sm_80 -max_num_threads=1024 -thread_warp_size=32", [-1, 16, 64, 49152, 2147483647, 1024, 8, 32], "", 0, []], [[], [["FU", 2, [0, 1, 2, 3]], ["SP", 2, 0, 2400, [5], 1], ["AN", 2, 0, 5], ["AN", 2, 1, 6]]]], "r": [[7.94602e-06], 0, 1.79866, 1721373038], "v": "v0.6"}
{"i": [["[\"add\", 16, 5, 10, 3]", "cuda -keys=cuda,gpu -arch=sm_80 -max_num_threads=1024 -thread_warp_size=32", [-1, 16, 64, 49152, 2147483647, 1024, 8, 32], "", 0, []], [[], [["FU", 2, [0, 1, 2, 3]], ["SP", 2, 0, 2400, [3], 1], ["AN", 2, 0, 5], ["AN", 2, 1, 6]]]], "r": [[8.96297e-06], 0, 1.08872, 1721373039], "v": "v0.6"}
{"i": [["[\"add\", 16, 5, 10, 3]", "cuda -keys=cuda,gpu -arch=sm_80 -max_num_threads=1024 -thread_warp_size=32", [-1, 16, 64, 49152, 2147483647, 1024, 8, 32], "", 0, []], [[], [["FU", 2, [0, 1, 2, 3]], ["SP", 2, 0, 2400, [40], 1], ["AN", 2, 0, 5], ["AN", 2, 1, 6]]]], "r": [[8.95882e-06], 0, 1.37045, 1721373039], "v": "v0.6"}
{"i": [["[\"add\", 16, 5, 10, 3]", "cuda -keys=cuda,gpu -arch=sm_80 -max_num_threads=1024 -thread_warp_size=32", [-1, 16, 64, 49152, 2147483647, 1024, 8, 32], "", 0, []], [[], [["FU", 2, [0, 1, 2, 3]], ["SP", 2, 0, 2400, [4], 1], ["AN", 2, 0, 5], ["AN", 2, 1, 6]]]], "r": [[1.07201e-05], 0, 1.25521, 1721373040], "v": "v0.6"}
{"i": [["[\"add\", 16, 5, 10, 3]", "cuda -keys=cuda,gpu -arch=sm_80 -max_num_threads=1024 -thread_warp_size=32", [-1, 16, 64, 49152, 2147483647, 1024, 8, 32], "", 0, []], [[], [["FU", 2, [0, 1, 2, 3]], ["SP", 2, 0, 2400, [16], 1], ["AN", 2, 0, 5], ["AN", 2, 1, 6]]]], "r": [[1.40328e-05], 0, 1.52632, 1721373040], "v": "v0.6"}
{"i": [["[\"add\", 16, 5, 10, 3]", "cuda -keys=cuda,gpu -arch=sm_80 -max_num_threads=1024 -thread_warp_size=32", [-1, 16, 64, 49152, 2147483647, 1024, 8, 32], "", 0, []], [[], [["FU", 2, [0, 1, 2, 3]], ["SP", 2, 0, 2400, [60], 1], ["AN", 2, 0, 5], ["AN", 2, 1, 6]]]], "r": [[8.28486e-06], 0, 1.25012, 1721373041], "v": "v0.6"}
{"i": [["[\"add\", 16, 5, 10, 3]", "cuda -keys=cuda,gpu -arch=sm_80 -max_num_threads=1024 -thread_warp_size=32", [-1, 16, 64, 49152, 2147483647, 1024, 8, 32], "", 0, []], [[], [["FU", 2, [0, 1, 2, 3]], ["SP", 2, 0, 2400, [25], 1], ["AN", 2, 0, 5], ["AN", 2, 1, 6]]]], "r": [[1.2292e-05], 0, 1.57734, 1721373041], "v": "v0.6"}
{"i": [["[\"add\", 16, 5, 10, 3]", "cuda -keys=cuda,gpu -arch=sm_80 -max_num_threads=1024 -thread_warp_size=32", [-1, 16, 64, 49152, 2147483647, 1024, 8, 32], "", 0, []], [[], [["FU", 2, [0, 1, 2, 3]], ["SP", 2, 0, 2400, [48], 1], ["AN", 2, 0, 5], ["AN", 2, 1, 6]]]], "r": [[8.88076e-06], 0, 1.38933, 1721373042], "v": "v0.6"}
{"i": [["[\"add\", 16, 5, 10, 3]", "cuda -keys=cuda,gpu -arch=sm_80 -max_num_threads=1024 -thread_warp_size=32", [-1, 16, 64, 49152, 2147483647, 1024, 8, 32], "", 0, []], [[], [["FU", 2, [0, 1, 2, 3]], ["SP", 2, 0, 2400, [32], 1], ["AN", 2, 0, 5], ["AN", 2, 1, 6]]]], "r": [[1.85428e-05], 0, 1.31613, 1721373042], "v": "v0.6"}
{"i": [["[\"add\", 16, 5, 10, 3]", "cuda -keys=cuda,gpu -arch=sm_80 -max_num_threads=1024 -thread_warp_size=32", [-1, 16, 64, 49152, 2147483647, 1024, 8, 32], "", 0, []], [[], [["FU", 2, [0, 1, 2, 3]], ["SP", 2, 0, 2400, [15], 1], ["AN", 2, 0, 5], ["AN", 2, 1, 6]]]], "r": [[1.03743e-05], 0, 1.57433, 1721373043], "v": "v0.6"}
