code_generation/generate/deprecated/deprecated_simple_v1.0/log/cuda/asin_cuda.log
{"i": [["[\"asin\", 5, 12, 3, 2]", "cuda -keys=cuda,gpu -arch=sm_80 -max_num_threads=1024 -thread_warp_size=32", [-1, 16, 64, 49152, 2147483647, 1024, 8, 32], "", 0, []], [[], [["FU", 1, [0, 1, 2, 3]], ["SP", 1, 0, 360, [24], 1], ["AN", 1, 0, 5], ["AN", 1, 1, 6]]]], "r": [[6.59856e-06], 0, 2.48174, 1721385718], "v": "v0.6"}
{"i": [["[\"asin\", 5, 12, 3, 2]", "cuda -keys=cuda,gpu -arch=sm_80 -max_num_threads=1024 -thread_warp_size=32", [-1, 16, 64, 49152, 2147483647, 1024, 8, 32], "", 0, []], [[], [["FU", 1, [0, 1, 2, 3]], ["SP", 1, 0, 360, [60], 1], ["AN", 1, 0, 5], ["AN", 1, 1, 6]]]], "r": [[6.01878e-06], 0, 1.56427, 1721385719], "v": "v0.6"}
{"i": [["[\"asin\", 5, 12, 3, 2]", "cuda -keys=cuda,gpu -arch=sm_80 -max_num_threads=1024 -thread_warp_size=32", [-1, 16, 64, 49152, 2147483647, 1024, 8, 32], "", 0, []], [[], [["FU", 1, [0, 1, 2, 3]], ["SP", 1, 0, 360, [15], 1], ["AN", 1, 0, 5], ["AN", 1, 1, 6]]]], "r": [[5.88839e-06], 0, 1.60009, 1721385719], "v": "v0.6"}
{"i": [["[\"asin\", 5, 12, 3, 2]", "cuda -keys=cuda,gpu -arch=sm_80 -max_num_threads=1024 -thread_warp_size=32", [-1, 16, 64, 49152, 2147483647, 1024, 8, 32], "", 0, []], [[], [["FU", 1, [0, 1, 2, 3]], ["SP", 1, 0, 360, [32], 1], ["AN", 1, 0, 5], ["AN", 1, 1, 6]]]], "r": [[5.86222e-06], 0, 1.36355, 1721385719], "v": "v0.6"}
{"i": [["[\"asin\", 5, 12, 3, 2]", "cuda -keys=cuda,gpu -arch=sm_80 -max_num_threads=1024 -thread_warp_size=32", [-1, 16, 64, 49152, 2147483647, 1024, 8, 32], "", 0, []], [[], [["FU", 1, [0, 1, 2, 3]], ["SP", 1, 0, 360, [5], 1], ["AN", 1, 0, 5], ["AN", 1, 1, 6]]]], "r": [[7.04838e-06], 0, 1.67636, 1721385720], "v": "v0.6"}
{"i": [["[\"asin\", 5, 12, 3, 2]", "cuda -keys=cuda,gpu -arch=sm_80 -max_num_threads=1024 -thread_warp_size=32", [-1, 16, 64, 49152, 2147483647, 1024, 8, 32], "", 0, []], [[], [["FU", 1, [0, 1, 2, 3]], ["SP", 1, 0, 360, [20], 1], ["AN", 1, 0, 5], ["AN", 1, 1, 6]]]], "r": [[1.27803e-05], 0, 2.19049, 1721385720], "v": "v0.6"}
{"i": [["[\"asin\", 5, 12, 3, 2]", "cuda -keys=cuda,gpu -arch=sm_80 -max_num_threads=1024 -thread_warp_size=32", [-1, 16, 64, 49152, 2147483647, 1024, 8, 32], "", 0, []], [[], [["FU", 1, [0, 1, 2, 3]], ["SP", 1, 0, 360, [10], 1], ["AN", 1, 0, 5], ["AN", 1, 1, 6]]]], "r": [[7.42619e-06], 0, 1.46814, 1721385721], "v": "v0.6"}
{"i": [["[\"asin\", 5, 12, 3, 2]", "cuda -keys=cuda,gpu -arch=sm_80 -max_num_threads=1024 -thread_warp_size=32", [-1, 16, 64, 49152, 2147483647, 1024, 8, 32], "", 0, []], [[], [["FU", 1, [0, 1, 2, 3]], ["SP", 1, 0, 360, [4], 1], ["AN", 1, 0, 5], ["AN", 1, 1, 6]]]], "r": [[6.47467e-06], 0, 1.58765, 1721385721], "v": "v0.6"}
{"i": [["[\"asin\", 5, 12, 3, 2]", "cuda -keys=cuda,gpu -arch=sm_80 -max_num_threads=1024 -thread_warp_size=32", [-1, 16, 64, 49152, 2147483647, 1024, 8, 32], "", 0, []], [[], [["FU", 1, [0, 1, 2, 3]], ["SP", 1, 0, 360, [16], 1], ["AN", 1, 0, 5], ["AN", 1, 1, 6]]]], "r": [[1.11784e-05], 0, 1.66531, 1721385722], "v": "v0.6"}
{"i": [["[\"asin\", 5, 12, 3, 2]", "cuda -keys=cuda,gpu -arch=sm_80 -max_num_threads=1024 -thread_warp_size=32", [-1, 16, 64, 49152, 2147483647, 1024, 8, 32], "", 0, []], [[], [["FU", 1, [0, 1, 2, 3]], ["SP", 1, 0, 360, [3], 1], ["AN", 1, 0, 5], ["AN", 1, 1, 6]]]], "r": [[8.07664e-06], 0, 1.42566, 1721385723], "v": "v0.6"}
