code_generation/generate/deprecated/deprecated_simple_v1.0/log/cuda/asinh_cuda.log
{"i": [["[\"asinh\", 13, 6, 14, 15]", "cuda -keys=cuda,gpu -arch=sm_80 -max_num_threads=1024 -thread_warp_size=32", [-1, 16, 64, 49152, 2147483647, 1024, 8, 32], "", 0, []], [[], [["FU", 1, [0, 1, 2, 3]], ["SP", 1, 0, 16380, [9], 1], ["AN", 1, 0, 5], ["AN", 1, 1, 6]]]], "r": [[9.15203e-06], 0, 2.33379, 1721387632], "v": "v0.6"}
{"i": [["[\"asinh\", 13, 6, 14, 15]", "cuda -keys=cuda,gpu -arch=sm_80 -max_num_threads=1024 -thread_warp_size=32", [-1, 16, 64, 49152, 2147483647, 1024, 8, 32], "", 0, []], [[], [["FU", 1, [0, 1, 2, 3]], ["SP", 1, 0, 16380, [14], 1], ["AN", 1, 0, 5], ["AN", 1, 1, 6]]]], "r": [[9.53007e-06], 0, 1.69034, 1721387632], "v": "v0.6"}
{"i": [["[\"asinh\", 13, 6, 14, 15]", "cuda -keys=cuda,gpu -arch=sm_80 -max_num_threads=1024 -thread_warp_size=32", [-1, 16, 64, 49152, 2147483647, 1024, 8, 32], "", 0, []], [[], [["FU", 1, [0, 1, 2, 3]], ["SP", 1, 0, 16380, [15], 1], ["AN", 1, 0, 5], ["AN", 1, 1, 6]]]], "r": [[8.52019e-06], 0, 2.19049, 1721387633], "v": "v0.6"}
{"i": [["[\"asinh\", 13, 6, 14, 15]", "cuda -keys=cuda,gpu -arch=sm_80 -max_num_threads=1024 -thread_warp_size=32", [-1, 16, 64, 49152, 2147483647, 1024, 8, 32], "", 0, []], [[], [["FU", 1, [0, 1, 2, 3]], ["SP", 1, 0, 16380, [5], 1], ["AN", 1, 0, 5], ["AN", 1, 1, 6]]]], "r": [[1.3098e-05], 0, 2.13165, 1721387633], "v": "v0.6"}
{"i": [["[\"asinh\", 13, 6, 14, 15]", "cuda -keys=cuda,gpu -arch=sm_80 -max_num_threads=1024 -thread_warp_size=32", [-1, 16, 64, 49152, 2147483647, 1024, 8, 32], "", 0, []], [[], [["FU", 1, [0, 1, 2, 3]], ["SP", 1, 0, 16380, [26], 1], ["AN", 1, 0, 5], ["AN", 1, 1, 6]]]], "r": [[9.84018e-06], 0, 1.8751, 1721387634], "v": "v0.6"}
{"i": [["[\"asinh\", 13, 6, 14, 15]", "cuda -keys=cuda,gpu -arch=sm_80 -max_num_threads=1024 -thread_warp_size=32", [-1, 16, 64, 49152, 2147483647, 1024, 8, 32], "", 0, []], [[], [["FU", 1, [0, 1, 2, 3]], ["SP", 1, 0, 16380, [18], 1], ["AN", 1, 0, 5], ["AN", 1, 1, 6]]]], "r": [[1.46239e-05], 0, 1.85051, 1721387635], "v": "v0.6"}
{"i": [["[\"asinh\", 13, 6, 14, 15]", "cuda -keys=cuda,gpu -arch=sm_80 -max_num_threads=1024 -thread_warp_size=32", [-1, 16, 64, 49152, 2147483647, 1024, 8, 32], "", 0, []], [[], [["FU", 1, [0, 1, 2, 3]], ["SP", 1, 0, 16380, [12], 1], ["AN", 1, 0, 5], ["AN", 1, 1, 6]]]], "r": [[1.17841e-05], 0, 1.37634, 1721387635], "v": "v0.6"}
{"i": [["[\"asinh\", 13, 6, 14, 15]", "cuda -keys=cuda,gpu -arch=sm_80 -max_num_threads=1024 -thread_warp_size=32", [-1, 16, 64, 49152, 2147483647, 1024, 8, 32], "", 0, []], [[], [["FU", 1, [0, 1, 2, 3]], ["SP", 1, 0, 16380, [16], 1], ["AN", 1, 0, 5], ["AN", 1, 1, 6]]]], "r": [[8.12775e-06], 0, 1.89259, 1721387636], "v": "v0.6"}
{"i": [["[\"asinh\", 13, 6, 14, 15]", "cuda -keys=cuda,gpu -arch=sm_80 -max_num_threads=1024 -thread_warp_size=32", [-1, 16, 64, 49152, 2147483647, 1024, 8, 32], "", 0, []], [[], [["FU", 1, [0, 1, 2, 3]], ["SP", 1, 0, 16380, [24], 1], ["AN", 1, 0, 5], ["AN", 1, 1, 6]]]], "r": [[6.8948e-06], 0, 1.51294, 1721387636], "v": "v0.6"}
{"i": [["[\"asinh\", 13, 6, 14, 15]", "cuda -keys=cuda,gpu -arch=sm_80 -max_num_threads=1024 -thread_warp_size=32", [-1, 16, 64, 49152, 2147483647, 1024, 8, 32], "", 0, []], [[], [["FU", 1, [0, 1, 2, 3]], ["SP", 1, 0, 16380, [10], 1], ["AN", 1, 0, 5], ["AN", 1, 1, 6]]]], "r": [[1.3771e-05], 0, 1.69483, 1721387636], "v": "v0.6"}
