code_generation/generate/deprecated/deprecated_simple_v1.0/log/cuda/atanh_cuda.log
{"i": [["[\"atanh\", 5, 9, 20, 17]", "cuda -keys=cuda,gpu -arch=sm_80 -max_num_threads=1024 -thread_warp_size=32", [-1, 16, 64, 49152, 2147483647, 1024, 8, 32], "", 0, []], [[], [["FU", 1, [0, 1, 2, 3]], ["SP", 1, 0, 15300, [36], 1], ["AN", 1, 0, 5], ["AN", 1, 1, 6]]]], "r": [[7.67741e-06], 0, 2.5678, 1721389605], "v": "v0.6"}
{"i": [["[\"atanh\", 5, 9, 20, 17]", "cuda -keys=cuda,gpu -arch=sm_80 -max_num_threads=1024 -thread_warp_size=32", [-1, 16, 64, 49152, 2147483647, 1024, 8, 32], "", 0, []], [[], [["FU", 1, [0, 1, 2, 3]], ["SP", 1, 0, 15300, [20], 1], ["AN", 1, 0, 5], ["AN", 1, 1, 6]]]], "r": [[8.09118e-06], 0, 1.22671, 1721389606], "v": "v0.6"}
{"i": [["[\"atanh\", 5, 9, 20, 17]", "cuda -keys=cuda,gpu -arch=sm_80 -max_num_threads=1024 -thread_warp_size=32", [-1, 16, 64, 49152, 2147483647, 1024, 8, 32], "", 0, []], [[], [["FU", 1, [0, 1, 2, 3]], ["SP", 1, 0, 15300, [60], 1], ["AN", 1, 0, 5], ["AN", 1, 1, 6]]]], "r": [[7.73715e-06], 0, 1.51914, 1721389606], "v": "v0.6"}
{"i": [["[\"atanh\", 5, 9, 20, 17]", "cuda -keys=cuda,gpu -arch=sm_80 -max_num_threads=1024 -thread_warp_size=32", [-1, 16, 64, 49152, 2147483647, 1024, 8, 32], "", 0, []], [[], [["FU", 1, [0, 1, 2, 3]], ["SP", 1, 0, 15300, [30], 1], ["AN", 1, 0, 5], ["AN", 1, 1, 6]]]], "r": [[8.55202e-06], 0, 1.38486, 1721389607], "v": "v0.6"}
{"i": [["[\"atanh\", 5, 9, 20, 17]", "cuda -keys=cuda,gpu -arch=sm_80 -max_num_threads=1024 -thread_warp_size=32", [-1, 16, 64, 49152, 2147483647, 1024, 8, 32], "", 0, []], [[], [["FU", 1, [0, 1, 2, 3]], ["SP", 1, 0, 15300, [12], 1], ["AN", 1, 0, 5], ["AN", 1, 1, 6]]]], "r": [[1.16836e-05], 0, 1.37458, 1721389607], "v": "v0.6"}
{"i": [["[\"atanh\", 5, 9, 20, 17]", "cuda -keys=cuda,gpu -arch=sm_80 -max_num_threads=1024 -thread_warp_size=32", [-1, 16, 64, 49152, 2147483647, 1024, 8, 32], "", 0, []], [[], [["FU", 1, [0, 1, 2, 3]], ["SP", 1, 0, 15300, [50], 1], ["AN", 1, 0, 5], ["AN", 1, 1, 6]]]], "r": [[6.51216e-06], 0, 1.32418, 1721389607], "v": "v0.6"}
{"i": [["[\"atanh\", 5, 9, 20, 17]", "cuda -keys=cuda,gpu -arch=sm_80 -max_num_threads=1024 -thread_warp_size=32", [-1, 16, 64, 49152, 2147483647, 1024, 8, 32], "", 0, []], [[], [["FU", 1, [0, 1, 2, 3]], ["SP", 1, 0, 15300, [18], 1], ["AN", 1, 0, 5], ["AN", 1, 1, 6]]]], "r": [[9.57589e-06], 0, 1.47312, 1721389608], "v": "v0.6"}
{"i": [["[\"atanh\", 5, 9, 20, 17]", "cuda -keys=cuda,gpu -arch=sm_80 -max_num_threads=1024 -thread_warp_size=32", [-1, 16, 64, 49152, 2147483647, 1024, 8, 32], "", 0, []], [[], [["FU", 1, [0, 1, 2, 3]], ["SP", 1, 0, 15300, [9], 1], ["AN", 1, 0, 5], ["AN", 1, 1, 6]]]], "r": [[1.07702e-05], 0, 1.684, 1721389609], "v": "v0.6"}
{"i": [["[\"atanh\", 5, 9, 20, 17]", "cuda -keys=cuda,gpu -arch=sm_80 -max_num_threads=1024 -thread_warp_size=32", [-1, 16, 64, 49152, 2147483647, 1024, 8, 32], "", 0, []], [[], [["FU", 1, [0, 1, 2, 3]], ["SP", 1, 0, 15300, [3], 1], ["AN", 1, 0, 5], ["AN", 1, 1, 6]]]], "r": [[2.03026e-05], 0, 1.41363, 1721389609], "v": "v0.6"}
{"i": [["[\"atanh\", 5, 9, 20, 17]", "cuda -keys=cuda,gpu -arch=sm_80 -max_num_threads=1024 -thread_warp_size=32", [-1, 16, 64, 49152, 2147483647, 1024, 8, 32], "", 0, []], [[], [["FU", 1, [0, 1, 2, 3]], ["SP", 1, 0, 15300, [34], 1], ["AN", 1, 0, 5], ["AN", 1, 1, 6]]]], "r": [[6.37081e-06], 0, 1.35097, 1721389609], "v": "v0.6"}
