code_generation/generate/deprecated/deprecated_simple_v1.0/log/cuda/atan_cuda.log
{"i": [["[\"atan\", 10, 8, 13, 13]", "cuda -keys=cuda,gpu -arch=sm_80 -max_num_threads=1024 -thread_warp_size=32", [-1, 16, 64, 49152, 2147483647, 1024, 8, 32], "", 0, []], [[], [["FU", 1, [0, 1, 2, 3]], ["SP", 1, 0, 13520, [4], 1], ["AN", 1, 0, 5], ["AN", 1, 1, 6]]]], "r": [[1.73028e-05], 0, 2.1814, 1721373734], "v": "v0.6"}
{"i": [["[\"atan\", 10, 8, 13, 13]", "cuda -keys=cuda,gpu -arch=sm_80 -max_num_threads=1024 -thread_warp_size=32", [-1, 16, 64, 49152, 2147483647, 1024, 8, 32], "", 0, []], [[], [["FU", 1, [0, 1, 2, 3]], ["SP", 1, 0, 13520, [8], 1], ["AN", 1, 0, 5], ["AN", 1, 1, 6]]]], "r": [[1.33295e-05], 0, 1.555, 1721373734], "v": "v0.6"}
{"i": [["[\"atan\", 10, 8, 13, 13]", "cuda -keys=cuda,gpu -arch=sm_80 -max_num_threads=1024 -thread_warp_size=32", [-1, 16, 64, 49152, 2147483647, 1024, 8, 32], "", 0, []], [[], [["FU", 1, [0, 1, 2, 3]], ["SP", 1, 0, 13520, [26], 1], ["AN", 1, 0, 5], ["AN", 1, 1, 6]]]], "r": [[1.00405e-05], 0, 1.45004, 1721373735], "v": "v0.6"}
{"i": [["[\"atan\", 10, 8, 13, 13]", "cuda -keys=cuda,gpu -arch=sm_80 -max_num_threads=1024 -thread_warp_size=32", [-1, 16, 64, 49152, 2147483647, 1024, 8, 32], "", 0, []], [[], [["FU", 1, [0, 1, 2, 3]], ["SP", 1, 0, 13520, [64], 1], ["AN", 1, 0, 5], ["AN", 1, 1, 6]]]], "r": [[9.42132e-06], 0, 1.192, 1721373735], "v": "v0.6"}
{"i": [["[\"atan\", 10, 8, 13, 13]", "cuda -keys=cuda,gpu -arch=sm_80 -max_num_threads=1024 -thread_warp_size=32", [-1, 16, 64, 49152, 2147483647, 1024, 8, 32], "", 0, []], [[], [["FU", 1, [0, 1, 2, 3]], ["SP", 1, 0, 13520, [20], 1], ["AN", 1, 0, 5], ["AN", 1, 1, 6]]]], "r": [[7.05508e-06], 0, 1.42259, 1721373736], "v": "v0.6"}
{"i": [["[\"atan\", 10, 8, 13, 13]", "cuda -keys=cuda,gpu -arch=sm_80 -max_num_threads=1024 -thread_warp_size=32", [-1, 16, 64, 49152, 2147483647, 1024, 8, 32], "", 0, []], [[], [["FU", 1, [0, 1, 2, 3]], ["SP", 1, 0, 13520, [52], 1], ["AN", 1, 0, 5], ["AN", 1, 1, 6]]]], "r": [[6.80928e-06], 0, 0.913039, 1721373736], "v": "v0.6"}
{"i": [["[\"atan\", 10, 8, 13, 13]", "cuda -keys=cuda,gpu -arch=sm_80 -max_num_threads=1024 -thread_warp_size=32", [-1, 16, 64, 49152, 2147483647, 1024, 8, 32], "", 0, []], [[], [["FU", 1, [0, 1, 2, 3]], ["SP", 1, 0, 13520, [10], 1], ["AN", 1, 0, 5], ["AN", 1, 1, 6]]]], "r": [[8.44489e-06], 0, 1.24241, 1721373736], "v": "v0.6"}
{"i": [["[\"atan\", 10, 8, 13, 13]", "cuda -keys=cuda,gpu -arch=sm_80 -max_num_threads=1024 -thread_warp_size=32", [-1, 16, 64, 49152, 2147483647, 1024, 8, 32], "", 0, []], [[], [["FU", 1, [0, 1, 2, 3]], ["SP", 1, 0, 13520, [40], 1], ["AN", 1, 0, 5], ["AN", 1, 1, 6]]]], "r": [[6.8129e-06], 0, 1.09573, 1721373736], "v": "v0.6"}
{"i": [["[\"atan\", 10, 8, 13, 13]", "cuda -keys=cuda,gpu -arch=sm_80 -max_num_threads=1024 -thread_warp_size=32", [-1, 16, 64, 49152, 2147483647, 1024, 8, 32], "", 0, []], [[], [["FU", 1, [0, 1, 2, 3]], ["SP", 1, 0, 13520, [5], 1], ["AN", 1, 0, 5], ["AN", 1, 1, 6]]]], "r": [[1.05162e-05], 0, 1.46653, 1721373737], "v": "v0.6"}
{"i": [["[\"atan\", 10, 8, 13, 13]", "cuda -keys=cuda,gpu -arch=sm_80 -max_num_threads=1024 -thread_warp_size=32", [-1, 16, 64, 49152, 2147483647, 1024, 8, 32], "", 0, []], [[], [["FU", 1, [0, 1, 2, 3]], ["SP", 1, 0, 13520, [13], 1], ["AN", 1, 0, 5], ["AN", 1, 1, 6]]]], "r": [[8.15022e-06], 0, 1.35844, 1721373737], "v": "v0.6"}
