code_generation/generate/deprecated/deprecated_simple_v1.0/log/cuda/batch_to_space_nd_cuda.log
{"i": [["[\"batch_to_space_nd\", 19, 5, 20, 18]", "cuda -keys=cuda,gpu -arch=sm_80 -max_num_threads=1024 -thread_warp_size=32", [-1, 16, 64, 49152, 2147483647, 1024, 8, 32], "", 0, []], [[], [["CI", 3], ["CI", 2], ["CI", 1], ["FU", 4, [0, 1, 2, 3]], ["SP", 4, 0, 28800, [5], 1], ["AN", 4, 0, 5], ["AN", 4, 1, 6]]]], "r": [[1.51512e-05], 0, 4.71405, 1721384624], "v": "v0.6"}
{"i": [["[\"batch_to_space_nd\", 19, 5, 20, 18]", "cuda -keys=cuda,gpu -arch=sm_80 -max_num_threads=1024 -thread_warp_size=32", [-1, 16, 64, 49152, 2147483647, 1024, 8, 32], "", 0, []], [[], [["CI", 3], ["CI", 2], ["CI", 1], ["FU", 4, [0, 1, 2, 3]], ["SP", 4, 0, 28800, [4], 1], ["AN", 4, 0, 5], ["AN", 4, 1, 6]]]], "r": [[1.7919e-05], 0, 1.61876, 1721384624], "v": "v0.6"}
{"i": [["[\"batch_to_space_nd\", 19, 5, 20, 18]", "cuda -keys=cuda,gpu -arch=sm_80 -max_num_threads=1024 -thread_warp_size=32", [-1, 16, 64, 49152, 2147483647, 1024, 8, 32], "", 0, []], [[], [["CI", 3], ["CI", 2], ["CI", 1], ["FU", 4, [0, 1, 2, 3]], ["SP", 4, 0, 28800, [64], 1], ["AN", 4, 0, 5], ["AN", 4, 1, 6]]]], "r": [[1.37215e-05], 0, 1.80675, 1721384625], "v": "v0.6"}
{"i": [["[\"batch_to_space_nd\", 19, 5, 20, 18]", "cuda -keys=cuda,gpu -arch=sm_80 -max_num_threads=1024 -thread_warp_size=32", [-1, 16, 64, 49152, 2147483647, 1024, 8, 32], "", 0, []], [[], [["CI", 3], ["CI", 2], ["CI", 1], ["FU", 4, [0, 1, 2, 3]], ["SP", 4, 0, 28800, [10], 1], ["AN", 4, 0, 5], ["AN", 4, 1, 6]]]], "r": [[1.06689e-05], 0, 1.92553, 1721384625], "v": "v0.6"}
{"i": [["[\"batch_to_space_nd\", 19, 5, 20, 18]", "cuda -keys=cuda,gpu -arch=sm_80 -max_num_threads=1024 -thread_warp_size=32", [-1, 16, 64, 49152, 2147483647, 1024, 8, 32], "", 0, []], [[], [["CI", 3], ["CI", 2], ["CI", 1], ["FU", 4, [0, 1, 2, 3]], ["SP", 4, 0, 28800, [6], 1], ["AN", 4, 0, 5], ["AN", 4, 1, 6]]]], "r": [[1.41803e-05], 0, 1.8855, 1721384626], "v": "v0.6"}
{"i": [["[\"batch_to_space_nd\", 19, 5, 20, 18]", "cuda -keys=cuda,gpu -arch=sm_80 -max_num_threads=1024 -thread_warp_size=32", [-1, 16, 64, 49152, 2147483647, 1024, 8, 32], "", 0, []], [[], [["CI", 3], ["CI", 2], ["CI", 1], ["FU", 4, [0, 1, 2, 3]], ["SP", 4, 0, 28800, [16], 1], ["AN", 4, 0, 5], ["AN", 4, 1, 6]]]], "r": [[8.52523e-06], 0, 1.4869, 1721384626], "v": "v0.6"}
{"i": [["[\"batch_to_space_nd\", 19, 5, 20, 18]", "cuda -keys=cuda,gpu -arch=sm_80 -max_num_threads=1024 -thread_warp_size=32", [-1, 16, 64, 49152, 2147483647, 1024, 8, 32], "", 0, []], [[], [["CI", 3], ["CI", 2], ["CI", 1], ["FU", 4, [0, 1, 2, 3]], ["SP", 4, 0, 28800, [60], 1], ["AN", 4, 0, 5], ["AN", 4, 1, 6]]]], "r": [[6.83192e-06], 0, 1.63893, 1721384627], "v": "v0.6"}
{"i": [["[\"batch_to_space_nd\", 19, 5, 20, 18]", "cuda -keys=cuda,gpu -arch=sm_80 -max_num_threads=1024 -thread_warp_size=32", [-1, 16, 64, 49152, 2147483647, 1024, 8, 32], "", 0, []], [[], [["CI", 3], ["CI", 2], ["CI", 1], ["FU", 4, [0, 1, 2, 3]], ["SP", 4, 0, 28800, [15], 1], ["AN", 4, 0, 5], ["AN", 4, 1, 6]]]], "r": [[8.75617e-06], 0, 1.31672, 1721384627], "v": "v0.6"}
{"i": [["[\"batch_to_space_nd\", 19, 5, 20, 18]", "cuda -keys=cuda,gpu -arch=sm_80 -max_num_threads=1024 -thread_warp_size=32", [-1, 16, 64, 49152, 2147483647, 1024, 8, 32], "", 0, []], [[], [["CI", 3], ["CI", 2], ["CI", 1], ["FU", 4, [0, 1, 2, 3]], ["SP", 4, 0, 28800, [48], 1], ["AN", 4, 0, 5], ["AN", 4, 1, 6]]]], "r": [[6.85196e-06], 0, 1.68805, 1721384628], "v": "v0.6"}
{"i": [["[\"batch_to_space_nd\", 19, 5, 20, 18]", "cuda -keys=cuda,gpu -arch=sm_80 -max_num_threads=1024 -thread_warp_size=32", [-1, 16, 64, 49152, 2147483647, 1024, 8, 32], "", 0, []], [[], [["CI", 3], ["CI", 2], ["CI", 1], ["FU", 4, [0, 1, 2, 3]], ["SP", 4, 0, 28800, [25], 1], ["AN", 4, 0, 5], ["AN", 4, 1, 6]]]], "r": [[7.29487e-06], 0, 1.58705, 1721384628], "v": "v0.6"}
