code_generation/generate/deprecated/deprecated_simple_v1.0/log/cuda/batch_norm_cuda.log
{"i": [["[\"batch_norm\", 3, 4, 2, 10]", "cuda -keys=cuda,gpu -arch=sm_80 -max_num_threads=1024 -thread_warp_size=32", [-1, 16, 64, 49152, 2147483647, 1024, 8, 32], "", 0, []], [[], [["CI", 7], ["CI", 6], ["CI", 5], ["CI", 3], ["CI", 2], ["FU", 8, [0, 1, 2, 3]], ["SP", 8, 0, 240, [8], 1], ["AN", 8, 0, 5], ["AN", 8, 1, 6]]]], "r": [[6.73433e-06], 0, 1.58593, 1721462371], "v": "v0.6"}
{"i": [["[\"batch_norm\", 3, 4, 2, 10]", "cuda -keys=cuda,gpu -arch=sm_80 -max_num_threads=1024 -thread_warp_size=32", [-1, 16, 64, 49152, 2147483647, 1024, 8, 32], "", 0, []], [[], [["CI", 7], ["CI", 6], ["CI", 5], ["CI", 3], ["CI", 2], ["FU", 8, [0, 1, 2, 3]], ["SP", 8, 0, 240, [5], 1], ["AN", 8, 0, 5], ["AN", 8, 1, 6]]]], "r": [[6.64109e-06], 0, 1.37578, 1721462371], "v": "v0.6"}
{"i": [["[\"batch_norm\", 3, 4, 2, 10]", "cuda -keys=cuda,gpu -arch=sm_80 -max_num_threads=1024 -thread_warp_size=32", [-1, 16, 64, 49152, 2147483647, 1024, 8, 32], "", 0, []], [[], [["CI", 7], ["CI", 6], ["CI", 5], ["CI", 3], ["CI", 2], ["FU", 8, [0, 1, 2, 3]], ["SP", 8, 0, 240, [24], 1], ["AN", 8, 0, 5], ["AN", 8, 1, 6]]]], "r": [[6.83189e-06], 0, 1.24229, 1721462371], "v": "v0.6"}
{"i": [["[\"batch_norm\", 3, 4, 2, 10]", "cuda -keys=cuda,gpu -arch=sm_80 -max_num_threads=1024 -thread_warp_size=32", [-1, 16, 64, 49152, 2147483647, 1024, 8, 32], "", 0, []], [[], [["CI", 7], ["CI", 6], ["CI", 5], ["CI", 3], ["CI", 2], ["FU", 8, [0, 1, 2, 3]], ["SP", 8, 0, 240, [16], 1], ["AN", 8, 0, 5], ["AN", 8, 1, 6]]]], "r": [[5.69007e-06], 0, 1.12384, 1721462372], "v": "v0.6"}
{"i": [["[\"batch_norm\", 3, 4, 2, 10]", "cuda -keys=cuda,gpu -arch=sm_80 -max_num_threads=1024 -thread_warp_size=32", [-1, 16, 64, 49152, 2147483647, 1024, 8, 32], "", 0, []], [[], [["CI", 7], ["CI", 6], ["CI", 5], ["CI", 3], ["CI", 2], ["FU", 8, [0, 1, 2, 3]], ["SP", 8, 0, 240, [6], 1], ["AN", 8, 0, 5], ["AN", 8, 1, 6]]]], "r": [[6.10729e-06], 0, 1.42054, 1721462372], "v": "v0.6"}
{"i": [["[\"batch_norm\", 3, 4, 2, 10]", "cuda -keys=cuda,gpu -arch=sm_80 -max_num_threads=1024 -thread_warp_size=32", [-1, 16, 64, 49152, 2147483647, 1024, 8, 32], "", 0, []], [[], [["CI", 7], ["CI", 6], ["CI", 5], ["CI", 3], ["CI", 2], ["FU", 8, [0, 1, 2, 3]], ["SP", 8, 0, 240, [12], 1], ["AN", 8, 0, 5], ["AN", 8, 1, 6]]]], "r": [[5.96941e-06], 0, 1.19963, 1721462372], "v": "v0.6"}
{"i": [["[\"batch_norm\", 3, 4, 2, 10]", "cuda -keys=cuda,gpu -arch=sm_80 -max_num_threads=1024 -thread_warp_size=32", [-1, 16, 64, 49152, 2147483647, 1024, 8, 32], "", 0, []], [[], [["CI", 7], ["CI", 6], ["CI", 5], ["CI", 3], ["CI", 2], ["FU", 8, [0, 1, 2, 3]], ["SP", 8, 0, 240, [48], 1], ["AN", 8, 0, 5], ["AN", 8, 1, 6]]]], "r": [[6.69649e-06], 0, 1.14333, 1721462373], "v": "v0.6"}
{"i": [["[\"batch_norm\", 3, 4, 2, 10]", "cuda -keys=cuda,gpu -arch=sm_80 -max_num_threads=1024 -thread_warp_size=32", [-1, 16, 64, 49152, 2147483647, 1024, 8, 32], "", 0, []], [[], [["CI", 7], ["CI", 6], ["CI", 5], ["CI", 3], ["CI", 2], ["FU", 8, [0, 1, 2, 3]], ["SP", 8, 0, 240, [60], 1], ["AN", 8, 0, 5], ["AN", 8, 1, 6]]]], "r": [[5.65647e-06], 0, 1.18907, 1721462373], "v": "v0.6"}
{"i": [["[\"batch_norm\", 3, 4, 2, 10]", "cuda -keys=cuda,gpu -arch=sm_80 -max_num_threads=1024 -thread_warp_size=32", [-1, 16, 64, 49152, 2147483647, 1024, 8, 32], "", 0, []], [[], [["CI", 7], ["CI", 6], ["CI", 5], ["CI", 3], ["CI", 2], ["FU", 8, [0, 1, 2, 3]], ["SP", 8, 0, 240, [20], 1], ["AN", 8, 0, 5], ["AN", 8, 1, 6]]]], "r": [[5.65903e-06], 0, 1.19597, 1721462373], "v": "v0.6"}
{"i": [["[\"batch_norm\", 3, 4, 2, 10]", "cuda -keys=cuda,gpu -arch=sm_80 -max_num_threads=1024 -thread_warp_size=32", [-1, 16, 64, 49152, 2147483647, 1024, 8, 32], "", 0, []], [[], [["CI", 7], ["CI", 6], ["CI", 5], ["CI", 3], ["CI", 2], ["FU", 8, [0, 1, 2, 3]], ["SP", 8, 0, 240, [15], 1], ["AN", 8, 0, 5], ["AN", 8, 1, 6]]]], "r": [[5.6962e-06], 0, 1.30205, 1721462373], "v": "v0.6"}
