code_generation/generate/deprecated/deprecated_simple_v1.0/log/cuda/ceil_cuda.log
{"i": [["[\"ceil\", 11, 15, 2, 13]", "cuda -keys=cuda,gpu -arch=sm_80 -max_num_threads=1024 -thread_warp_size=32", [-1, 16, 64, 49152, 2147483647, 1024, 8, 32], "", 0, []], [[], [["FU", 1, [0, 1, 2, 3]], ["SP", 1, 0, 4290, [30], 1], ["AN", 1, 0, 5], ["AN", 1, 1, 6]]]], "r": [[6.08327e-06], 0, 3.32226, 1721392260], "v": "v0.6"}
{"i": [["[\"ceil\", 11, 15, 2, 13]", "cuda -keys=cuda,gpu -arch=sm_80 -max_num_threads=1024 -thread_warp_size=32", [-1, 16, 64, 49152, 2147483647, 1024, 8, 32], "", 0, []], [[], [["FU", 1, [0, 1, 2, 3]], ["SP", 1, 0, 4290, [33], 1], ["AN", 1, 0, 5], ["AN", 1, 1, 6]]]], "r": [[9.67868e-06], 0, 1.49733, 1721392260], "v": "v0.6"}
{"i": [["[\"ceil\", 11, 15, 2, 13]", "cuda -keys=cuda,gpu -arch=sm_80 -max_num_threads=1024 -thread_warp_size=32", [-1, 16, 64, 49152, 2147483647, 1024, 8, 32], "", 0, []], [[], [["FU", 1, [0, 1, 2, 3]], ["SP", 1, 0, 4290, [64], 1], ["AN", 1, 0, 5], ["AN", 1, 1, 6]]]], "r": [[5.6269e-06], 0, 1.40714, 1721392261], "v": "v0.6"}
{"i": [["[\"ceil\", 11, 15, 2, 13]", "cuda -keys=cuda,gpu -arch=sm_80 -max_num_threads=1024 -thread_warp_size=32", [-1, 16, 64, 49152, 2147483647, 1024, 8, 32], "", 0, []], [[], [["FU", 1, [0, 1, 2, 3]], ["SP", 1, 0, 4290, [22], 1], ["AN", 1, 0, 5], ["AN", 1, 1, 6]]]], "r": [[1.2156e-05], 0, 1.60483, 1721392261], "v": "v0.6"}
{"i": [["[\"ceil\", 11, 15, 2, 13]", "cuda -keys=cuda,gpu -arch=sm_80 -max_num_threads=1024 -thread_warp_size=32", [-1, 16, 64, 49152, 2147483647, 1024, 8, 32], "", 0, []], [[], [["FU", 1, [0, 1, 2, 3]], ["SP", 1, 0, 4290, [2], 1], ["AN", 1, 0, 5], ["AN", 1, 1, 6]]]], "r": [[8.85361e-06], 0, 1.36403, 1721392262], "v": "v0.6"}
{"i": [["[\"ceil\", 11, 15, 2, 13]", "cuda -keys=cuda,gpu -arch=sm_80 -max_num_threads=1024 -thread_warp_size=32", [-1, 16, 64, 49152, 2147483647, 1024, 8, 32], "", 0, []], [[], [["FU", 1, [0, 1, 2, 3]], ["SP", 1, 0, 4290, [39], 1], ["AN", 1, 0, 5], ["AN", 1, 1, 6]]]], "r": [[7.19505e-06], 0, 1.41449, 1721392262], "v": "v0.6"}
{"i": [["[\"ceil\", 11, 15, 2, 13]", "cuda -keys=cuda,gpu -arch=sm_80 -max_num_threads=1024 -thread_warp_size=32", [-1, 16, 64, 49152, 2147483647, 1024, 8, 32], "", 0, []], [[], [["FU", 1, [0, 1, 2, 3]], ["SP", 1, 0, 4290, [3], 1], ["AN", 1, 0, 5], ["AN", 1, 1, 6]]]], "r": [[8.27391e-06], 0, 1.79908, 1721392263], "v": "v0.6"}
{"i": [["[\"ceil\", 11, 15, 2, 13]", "cuda -keys=cuda,gpu -arch=sm_80 -max_num_threads=1024 -thread_warp_size=32", [-1, 16, 64, 49152, 2147483647, 1024, 8, 32], "", 0, []], [[], [["FU", 1, [0, 1, 2, 3]], ["SP", 1, 0, 4290, [11], 1], ["AN", 1, 0, 5], ["AN", 1, 1, 6]]]], "r": [[7.46564e-06], 0, 1.79605, 1721392263], "v": "v0.6"}
{"i": [["[\"ceil\", 11, 15, 2, 13]", "cuda -keys=cuda,gpu -arch=sm_80 -max_num_threads=1024 -thread_warp_size=32", [-1, 16, 64, 49152, 2147483647, 1024, 8, 32], "", 0, []], [[], [["FU", 1, [0, 1, 2, 3]], ["SP", 1, 0, 4290, [10], 1], ["AN", 1, 0, 5], ["AN", 1, 1, 6]]]], "r": [[7.88658e-06], 0, 1.52981, 1721392263], "v": "v0.6"}
{"i": [["[\"ceil\", 11, 15, 2, 13]", "cuda -keys=cuda,gpu -arch=sm_80 -max_num_threads=1024 -thread_warp_size=32", [-1, 16, 64, 49152, 2147483647, 1024, 8, 32], "", 0, []], [[], [["FU", 1, [0, 1, 2, 3]], ["SP", 1, 0, 4290, [5], 1], ["AN", 1, 0, 5], ["AN", 1, 1, 6]]]], "r": [[8.32431e-06], 0, 1.68307, 1721392264], "v": "v0.6"}
