code_generation/generate/deprecated/deprecated_simple_v1.0/log/cuda/combination_op_cuda.log
{"i": [["[\"combination_op\", 13, 3, 13, 5]", "cuda -keys=cuda,gpu -arch=sm_80 -max_num_threads=1024 -thread_warp_size=32", [-1, 16, 64, 49152, 2147483647, 1024, 8, 32], "", 0, []], [[], [["CI", 3], ["CI", 1], ["FU", 4, [0, 1, 2, 3]], ["SP", 4, 0, 2535, [39], 1], ["AN", 4, 0, 5], ["AN", 4, 1, 6]]]], "r": [[7.09455e-06], 0, 1.51557, 1721441636], "v": "v0.6"}
{"i": [["[\"combination_op\", 13, 3, 13, 5]", "cuda -keys=cuda,gpu -arch=sm_80 -max_num_threads=1024 -thread_warp_size=32", [-1, 16, 64, 49152, 2147483647, 1024, 8, 32], "", 0, []], [[], [["CI", 3], ["CI", 1], ["FU", 4, [0, 1, 2, 3]], ["SP", 4, 0, 2535, [4], 1], ["AN", 4, 0, 5], ["AN", 4, 1, 6]]]], "r": [[6.98377e-06], 0, 1.02466, 1721441637], "v": "v0.6"}
{"i": [["[\"combination_op\", 13, 3, 13, 5]", "cuda -keys=cuda,gpu -arch=sm_80 -max_num_threads=1024 -thread_warp_size=32", [-1, 16, 64, 49152, 2147483647, 1024, 8, 32], "", 0, []], [[], [["CI", 3], ["CI", 1], ["FU", 4, [0, 1, 2, 3]], ["SP", 4, 0, 2535, [2], 1], ["AN", 4, 0, 5], ["AN", 4, 1, 6]]]], "r": [[8.21035e-06], 0, 1.18911, 1721441637], "v": "v0.6"}
{"i": [["[\"combination_op\", 13, 3, 13, 5]", "cuda -keys=cuda,gpu -arch=sm_80 -max_num_threads=1024 -thread_warp_size=32", [-1, 16, 64, 49152, 2147483647, 1024, 8, 32], "", 0, []], [[], [["CI", 3], ["CI", 1], ["FU", 4, [0, 1, 2, 3]], ["SP", 4, 0, 2535, [6], 1], ["AN", 4, 0, 5], ["AN", 4, 1, 6]]]], "r": [[7.09695e-06], 0, 1.22714, 1721441637], "v": "v0.6"}
{"i": [["[\"combination_op\", 13, 3, 13, 5]", "cuda -keys=cuda,gpu -arch=sm_80 -max_num_threads=1024 -thread_warp_size=32", [-1, 16, 64, 49152, 2147483647, 1024, 8, 32], "", 0, []], [[], [["CI", 3], ["CI", 1], ["FU", 4, [0, 1, 2, 3]], ["SP", 4, 0, 2535, [15], 1], ["AN", 4, 0, 5], ["AN", 4, 1, 6]]]], "r": [[7.63597e-06], 0, 1.23568, 1721441637], "v": "v0.6"}
{"i": [["[\"combination_op\", 13, 3, 13, 5]", "cuda -keys=cuda,gpu -arch=sm_80 -max_num_threads=1024 -thread_warp_size=32", [-1, 16, 64, 49152, 2147483647, 1024, 8, 32], "", 0, []], [[], [["CI", 3], ["CI", 1], ["FU", 4, [0, 1, 2, 3]], ["SP", 4, 0, 2535, [3], 1], ["AN", 4, 0, 5], ["AN", 4, 1, 6]]]], "r": [[7.23191e-06], 0, 1.11338, 1721441638], "v": "v0.6"}
{"i": [["[\"combination_op\", 13, 3, 13, 5]", "cuda -keys=cuda,gpu -arch=sm_80 -max_num_threads=1024 -thread_warp_size=32", [-1, 16, 64, 49152, 2147483647, 1024, 8, 32], "", 0, []], [[], [["CI", 3], ["CI", 1], ["FU", 4, [0, 1, 2, 3]], ["SP", 4, 0, 2535, [5], 1], ["AN", 4, 0, 5], ["AN", 4, 1, 6]]]], "r": [[6.73451e-06], 0, 1.145, 1721441638], "v": "v0.6"}
{"i": [["[\"combination_op\", 13, 3, 13, 5]", "cuda -keys=cuda,gpu -arch=sm_80 -max_num_threads=1024 -thread_warp_size=32", [-1, 16, 64, 49152, 2147483647, 1024, 8, 32], "", 0, []], [[], [["CI", 3], ["CI", 1], ["FU", 4, [0, 1, 2, 3]], ["SP", 4, 0, 2535, [32], 1], ["AN", 4, 0, 5], ["AN", 4, 1, 6]]]], "r": [[6.14312e-06], 0, 1.17924, 1721441638], "v": "v0.6"}
{"i": [["[\"combination_op\", 13, 3, 13, 5]", "cuda -keys=cuda,gpu -arch=sm_80 -max_num_threads=1024 -thread_warp_size=32", [-1, 16, 64, 49152, 2147483647, 1024, 8, 32], "", 0, []], [[], [["CI", 3], ["CI", 1], ["FU", 4, [0, 1, 2, 3]], ["SP", 4, 0, 2535, [16], 1], ["AN", 4, 0, 5], ["AN", 4, 1, 6]]]], "r": [[6.15104e-06], 0, 1.26043, 1721441639], "v": "v0.6"}
{"i": [["[\"combination_op\", 13, 3, 13, 5]", "cuda -keys=cuda,gpu -arch=sm_80 -max_num_threads=1024 -thread_warp_size=32", [-1, 16, 64, 49152, 2147483647, 1024, 8, 32], "", 0, []], [[], [["CI", 3], ["CI", 1], ["FU", 4, [0, 1, 2, 3]], ["SP", 4, 0, 2535, [14], 1], ["AN", 4, 0, 5], ["AN", 4, 1, 6]]]], "r": [[6.85314e-06], 0, 1.21421, 1721441639], "v": "v0.6"}
