code_generation/generate/deprecated/deprecated_simple_v1.0/log/cuda/cos_cuda.log
{"i": [["[\"cos\", 6, 4, 14, 13]", "cuda -keys=cuda,gpu -arch=sm_80 -max_num_threads=1024 -thread_warp_size=32", [-1, 16, 64, 49152, 2147483647, 1024, 8, 32], "", 0, []], [[], [["FU", 1, [0, 1, 2, 3]], ["SP", 1, 0, 4368, [26], 1], ["AN", 1, 0, 5], ["AN", 1, 1, 6]]]], "r": [[5.65488e-06], 0, 1.7203, 1721371727], "v": "v0.6"}
{"i": [["[\"cos\", 6, 4, 14, 13]", "cuda -keys=cuda,gpu -arch=sm_80 -max_num_threads=1024 -thread_warp_size=32", [-1, 16, 64, 49152, 2147483647, 1024, 8, 32], "", 0, []], [[], [["FU", 1, [0, 1, 2, 3]], ["SP", 1, 0, 4368, [1], 1], ["AN", 1, 0, 5], ["AN", 1, 1, 6]]]], "r": [[1.31133e-05], 0, 1.26572, 1721371727], "v": "v0.6"}
{"i": [["[\"cos\", 6, 4, 14, 13]", "cuda -keys=cuda,gpu -arch=sm_80 -max_num_threads=1024 -thread_warp_size=32", [-1, 16, 64, 49152, 2147483647, 1024, 8, 32], "", 0, []], [[], [["FU", 1, [0, 1, 2, 3]], ["SP", 1, 0, 4368, [16], 1], ["AN", 1, 0, 5], ["AN", 1, 1, 6]]]], "r": [[6.38181e-06], 0, 0.948743, 1721371728], "v": "v0.6"}
{"i": [["[\"cos\", 6, 4, 14, 13]", "cuda -keys=cuda,gpu -arch=sm_80 -max_num_threads=1024 -thread_warp_size=32", [-1, 16, 64, 49152, 2147483647, 1024, 8, 32], "", 0, []], [[], [["FU", 1, [0, 1, 2, 3]], ["SP", 1, 0, 4368, [14], 1], ["AN", 1, 0, 5], ["AN", 1, 1, 6]]]], "r": [[7.15337e-06], 0, 1.46671, 1721371728], "v": "v0.6"}
{"i": [["[\"cos\", 6, 4, 14, 13]", "cuda -keys=cuda,gpu -arch=sm_80 -max_num_threads=1024 -thread_warp_size=32", [-1, 16, 64, 49152, 2147483647, 1024, 8, 32], "", 0, []], [[], [["FU", 1, [0, 1, 2, 3]], ["SP", 1, 0, 4368, [48], 1], ["AN", 1, 0, 5], ["AN", 1, 1, 6]]]], "r": [[6.65606e-06], 0, 1.09626, 1721371729], "v": "v0.6"}
{"i": [["[\"cos\", 6, 4, 14, 13]", "cuda -keys=cuda,gpu -arch=sm_80 -max_num_threads=1024 -thread_warp_size=32", [-1, 16, 64, 49152, 2147483647, 1024, 8, 32], "", 0, []], [[], [["FU", 1, [0, 1, 2, 3]], ["SP", 1, 0, 4368, [4], 1], ["AN", 1, 0, 5], ["AN", 1, 1, 6]]]], "r": [[8.22297e-06], 0, 1.33318, 1721371729], "v": "v0.6"}
{"i": [["[\"cos\", 6, 4, 14, 13]", "cuda -keys=cuda,gpu -arch=sm_80 -max_num_threads=1024 -thread_warp_size=32", [-1, 16, 64, 49152, 2147483647, 1024, 8, 32], "", 0, []], [[], [["FU", 1, [0, 1, 2, 3]], ["SP", 1, 0, 4368, [28], 1], ["AN", 1, 0, 5], ["AN", 1, 1, 6]]]], "r": [[6.76549e-06], 0, 1.25538, 1721371729], "v": "v0.6"}
{"i": [["[\"cos\", 6, 4, 14, 13]", "cuda -keys=cuda,gpu -arch=sm_80 -max_num_threads=1024 -thread_warp_size=32", [-1, 16, 64, 49152, 2147483647, 1024, 8, 32], "", 0, []], [[], [["FU", 1, [0, 1, 2, 3]], ["SP", 1, 0, 4368, [6], 1], ["AN", 1, 0, 5], ["AN", 1, 1, 6]]]], "r": [[8.99037e-06], 0, 1.19111, 1721371730], "v": "v0.6"}
{"i": [["[\"cos\", 6, 4, 14, 13]", "cuda -keys=cuda,gpu -arch=sm_80 -max_num_threads=1024 -thread_warp_size=32", [-1, 16, 64, 49152, 2147483647, 1024, 8, 32], "", 0, []], [[], [["FU", 1, [0, 1, 2, 3]], ["SP", 1, 0, 4368, [2], 1], ["AN", 1, 0, 5], ["AN", 1, 1, 6]]]], "r": [[1.25522e-05], 0, 1.28979, 1721371730], "v": "v0.6"}
{"i": [["[\"cos\", 6, 4, 14, 13]", "cuda -keys=cuda,gpu -arch=sm_80 -max_num_threads=1024 -thread_warp_size=32", [-1, 16, 64, 49152, 2147483647, 1024, 8, 32], "", 0, []], [[], [["FU", 1, [0, 1, 2, 3]], ["SP", 1, 0, 4368, [52], 1], ["AN", 1, 0, 5], ["AN", 1, 1, 6]]]], "r": [[9.55335e-06], 0, 1.32644, 1721371731], "v": "v0.6"}
