code_generation/generate/deprecated/deprecated_simple_v1.0/log/cuda/depth_to_space_cuda.log
{"i": [["[\"depth_to_space\", 5, 8, 12, 6]", "cuda -keys=cuda,gpu -arch=sm_80 -max_num_threads=1024 -thread_warp_size=32", [-1, 16, 64, 49152, 2147483647, 1024, 8, 32], "", 0, []], [[], [["FU", 1, [0, 1, 2, 3]], ["SP", 1, 0, 2880, [10], 1], ["AN", 1, 0, 5], ["AN", 1, 1, 6]]]], "r": [[6.09184e-06], 0, 1.90089, 1721412721], "v": "v0.6"}
{"i": [["[\"depth_to_space\", 5, 8, 12, 6]", "cuda -keys=cuda,gpu -arch=sm_80 -max_num_threads=1024 -thread_warp_size=32", [-1, 16, 64, 49152, 2147483647, 1024, 8, 32], "", 0, []], [[], [["FU", 1, [0, 1, 2, 3]], ["SP", 1, 0, 2880, [60], 1], ["AN", 1, 0, 5], ["AN", 1, 1, 6]]]], "r": [[8.58075e-06], 0, 1.44878, 1721412722], "v": "v0.6"}
{"i": [["[\"depth_to_space\", 5, 8, 12, 6]", "cuda -keys=cuda,gpu -arch=sm_80 -max_num_threads=1024 -thread_warp_size=32", [-1, 16, 64, 49152, 2147483647, 1024, 8, 32], "", 0, []], [[], [["FU", 1, [0, 1, 2, 3]], ["SP", 1, 0, 2880, [64], 1], ["AN", 1, 0, 5], ["AN", 1, 1, 6]]]], "r": [[6.13137e-06], 0, 1.31355, 1721412722], "v": "v0.6"}
{"i": [["[\"depth_to_space\", 5, 8, 12, 6]", "cuda -keys=cuda,gpu -arch=sm_80 -max_num_threads=1024 -thread_warp_size=32", [-1, 16, 64, 49152, 2147483647, 1024, 8, 32], "", 0, []], [[], [["FU", 1, [0, 1, 2, 3]], ["SP", 1, 0, 2880, [30], 1], ["AN", 1, 0, 5], ["AN", 1, 1, 6]]]], "r": [[5.83745e-06], 0, 1.31998, 1721412723], "v": "v0.6"}
{"i": [["[\"depth_to_space\", 5, 8, 12, 6]", "cuda -keys=cuda,gpu -arch=sm_80 -max_num_threads=1024 -thread_warp_size=32", [-1, 16, 64, 49152, 2147483647, 1024, 8, 32], "", 0, []], [[], [["FU", 1, [0, 1, 2, 3]], ["SP", 1, 0, 2880, [48], 1], ["AN", 1, 0, 5], ["AN", 1, 1, 6]]]], "r": [[5.4885e-06], 0, 1.12635, 1721412723], "v": "v0.6"}
{"i": [["[\"depth_to_space\", 5, 8, 12, 6]", "cuda -keys=cuda,gpu -arch=sm_80 -max_num_threads=1024 -thread_warp_size=32", [-1, 16, 64, 49152, 2147483647, 1024, 8, 32], "", 0, []], [[], [["FU", 1, [0, 1, 2, 3]], ["SP", 1, 0, 2880, [16], 1], ["AN", 1, 0, 5], ["AN", 1, 1, 6]]]], "r": [[6.1564e-06], 0, 1.32052, 1721412723], "v": "v0.6"}
{"i": [["[\"depth_to_space\", 5, 8, 12, 6]", "cuda -keys=cuda,gpu -arch=sm_80 -max_num_threads=1024 -thread_warp_size=32", [-1, 16, 64, 49152, 2147483647, 1024, 8, 32], "", 0, []], [[], [["FU", 1, [0, 1, 2, 3]], ["SP", 1, 0, 2880, [18], 1], ["AN", 1, 0, 5], ["AN", 1, 1, 6]]]], "r": [[6.16117e-06], 0, 1.01917, 1721412723], "v": "v0.6"}
{"i": [["[\"depth_to_space\", 5, 8, 12, 6]", "cuda -keys=cuda,gpu -arch=sm_80 -max_num_threads=1024 -thread_warp_size=32", [-1, 16, 64, 49152, 2147483647, 1024, 8, 32], "", 0, []], [[], [["FU", 1, [0, 1, 2, 3]], ["SP", 1, 0, 2880, [40], 1], ["AN", 1, 0, 5], ["AN", 1, 1, 6]]]], "r": [[7.80113e-06], 0, 1.24572, 1721412724], "v": "v0.6"}
{"i": [["[\"depth_to_space\", 5, 8, 12, 6]", "cuda -keys=cuda,gpu -arch=sm_80 -max_num_threads=1024 -thread_warp_size=32", [-1, 16, 64, 49152, 2147483647, 1024, 8, 32], "", 0, []], [[], [["FU", 1, [0, 1, 2, 3]], ["SP", 1, 0, 2880, [36], 1], ["AN", 1, 0, 5], ["AN", 1, 1, 6]]]], "r": [[7.06218e-06], 0, 1.29456, 1721412724], "v": "v0.6"}
{"i": [["[\"depth_to_space\", 5, 8, 12, 6]", "cuda -keys=cuda,gpu -arch=sm_80 -max_num_threads=1024 -thread_warp_size=32", [-1, 16, 64, 49152, 2147483647, 1024, 8, 32], "", 0, []], [[], [["FU", 1, [0, 1, 2, 3]], ["SP", 1, 0, 2880, [8], 1], ["AN", 1, 0, 5], ["AN", 1, 1, 6]]]], "r": [[6.1786e-06], 0, 1.29615, 1721412724], "v": "v0.6"}
