code_generation/generate/deprecated/deprecated_simple_v1.0/log/cuda/dilate_cuda.log
{"i": [["[\"dilate\", 19, 16, 15, 19]", "cuda -keys=cuda,gpu -arch=sm_80 -max_num_threads=1024 -thread_warp_size=32", [-1, 16, 64, 49152, 2147483647, 1024, 8, 32], "", 0, []], [[], [["FU", 1, [0, 1, 2, 3]], ["SP", 1, 0, 86640, [48], 1], ["AN", 1, 0, 5], ["AN", 1, 1, 6]]]], "r": [[8.80236e-06], 0, 2.19038, 1721391466], "v": "v0.6"}
{"i": [["[\"dilate\", 19, 16, 15, 19]", "cuda -keys=cuda,gpu -arch=sm_80 -max_num_threads=1024 -thread_warp_size=32", [-1, 16, 64, 49152, 2147483647, 1024, 8, 32], "", 0, []], [[], [["FU", 1, [0, 1, 2, 3]], ["SP", 1, 0, 86640, [5], 1], ["AN", 1, 0, 5], ["AN", 1, 1, 6]]]], "r": [[3.77853e-05], 0, 1.45556, 1721391467], "v": "v0.6"}
{"i": [["[\"dilate\", 19, 16, 15, 19]", "cuda -keys=cuda,gpu -arch=sm_80 -max_num_threads=1024 -thread_warp_size=32", [-1, 16, 64, 49152, 2147483647, 1024, 8, 32], "", 0, []], [[], [["FU", 1, [0, 1, 2, 3]], ["SP", 1, 0, 86640, [2], 1], ["AN", 1, 0, 5], ["AN", 1, 1, 6]]]], "r": [[8.90099e-05], 0, 1.43013, 1721391467], "v": "v0.6"}
{"i": [["[\"dilate\", 19, 16, 15, 19]", "cuda -keys=cuda,gpu -arch=sm_80 -max_num_threads=1024 -thread_warp_size=32", [-1, 16, 64, 49152, 2147483647, 1024, 8, 32], "", 0, []], [[], [["FU", 1, [0, 1, 2, 3]], ["SP", 1, 0, 86640, [16], 1], ["AN", 1, 0, 5], ["AN", 1, 1, 6]]]], "r": [[1.56412e-05], 0, 1.44283, 1721391468], "v": "v0.6"}
{"i": [["[\"dilate\", 19, 16, 15, 19]", "cuda -keys=cuda,gpu -arch=sm_80 -max_num_threads=1024 -thread_warp_size=32", [-1, 16, 64, 49152, 2147483647, 1024, 8, 32], "", 0, []], [[], [["FU", 1, [0, 1, 2, 3]], ["SP", 1, 0, 86640, [4], 1], ["AN", 1, 0, 5], ["AN", 1, 1, 6]]]], "r": [[4.79055e-05], 0, 1.41759, 1721391468], "v": "v0.6"}
{"i": [["[\"dilate\", 19, 16, 15, 19]", "cuda -keys=cuda,gpu -arch=sm_80 -max_num_threads=1024 -thread_warp_size=32", [-1, 16, 64, 49152, 2147483647, 1024, 8, 32], "", 0, []], [[], [["FU", 1, [0, 1, 2, 3]], ["SP", 1, 0, 86640, [24], 1], ["AN", 1, 0, 5], ["AN", 1, 1, 6]]]], "r": [[1.24437e-05], 0, 1.41972, 1721391469], "v": "v0.6"}
{"i": [["[\"dilate\", 19, 16, 15, 19]", "cuda -keys=cuda,gpu -arch=sm_80 -max_num_threads=1024 -thread_warp_size=32", [-1, 16, 64, 49152, 2147483647, 1024, 8, 32], "", 0, []], [[], [["FU", 1, [0, 1, 2, 3]], ["SP", 1, 0, 86640, [12], 1], ["AN", 1, 0, 5], ["AN", 1, 1, 6]]]], "r": [[1.80417e-05], 0, 1.28117, 1721391469], "v": "v0.6"}
{"i": [["[\"dilate\", 19, 16, 15, 19]", "cuda -keys=cuda,gpu -arch=sm_80 -max_num_threads=1024 -thread_warp_size=32", [-1, 16, 64, 49152, 2147483647, 1024, 8, 32], "", 0, []], [[], [["FU", 1, [0, 1, 2, 3]], ["SP", 1, 0, 86640, [30], 1], ["AN", 1, 0, 5], ["AN", 1, 1, 6]]]], "r": [[1.23847e-05], 0, 1.60894, 1721391470], "v": "v0.6"}
{"i": [["[\"dilate\", 19, 16, 15, 19]", "cuda -keys=cuda,gpu -arch=sm_80 -max_num_threads=1024 -thread_warp_size=32", [-1, 16, 64, 49152, 2147483647, 1024, 8, 32], "", 0, []], [[], [["FU", 1, [0, 1, 2, 3]], ["SP", 1, 0, 86640, [10], 1], ["AN", 1, 0, 5], ["AN", 1, 1, 6]]]], "r": [[2.00193e-05], 0, 1.43779, 1721391470], "v": "v0.6"}
{"i": [["[\"dilate\", 19, 16, 15, 19]", "cuda -keys=cuda,gpu -arch=sm_80 -max_num_threads=1024 -thread_warp_size=32", [-1, 16, 64, 49152, 2147483647, 1024, 8, 32], "", 0, []], [[], [["FU", 1, [0, 1, 2, 3]], ["SP", 1, 0, 86640, [15], 1], ["AN", 1, 0, 5], ["AN", 1, 1, 6]]]], "r": [[1.49306e-05], 0, 1.15973, 1721391470], "v": "v0.6"}
