code_generation/generate/deprecated/deprecated_simple_v1.0/log/cuda/erf_cuda.log
{"i": [["[\"erf\", 10, 3, 8, 9]", "cuda -keys=cuda,gpu -arch=sm_80 -max_num_threads=1024 -thread_warp_size=32", [-1, 16, 64, 49152, 2147483647, 1024, 8, 32], "", 0, []], [[], [["FU", 1, [0, 1, 2, 3]], ["SP", 1, 0, 2160, [60], 1], ["AN", 1, 0, 5], ["AN", 1, 1, 6]]]], "r": [[7.58423e-06], 0, 3.29327, 1721394521], "v": "v0.6"}
{"i": [["[\"erf\", 10, 3, 8, 9]", "cuda -keys=cuda,gpu -arch=sm_80 -max_num_threads=1024 -thread_warp_size=32", [-1, 16, 64, 49152, 2147483647, 1024, 8, 32], "", 0, []], [[], [["FU", 1, [0, 1, 2, 3]], ["SP", 1, 0, 2160, [12], 1], ["AN", 1, 0, 5], ["AN", 1, 1, 6]]]], "r": [[6.22071e-06], 0, 1.26084, 1721394521], "v": "v0.6"}
{"i": [["[\"erf\", 10, 3, 8, 9]", "cuda -keys=cuda,gpu -arch=sm_80 -max_num_threads=1024 -thread_warp_size=32", [-1, 16, 64, 49152, 2147483647, 1024, 8, 32], "", 0, []], [[], [["FU", 1, [0, 1, 2, 3]], ["SP", 1, 0, 2160, [18], 1], ["AN", 1, 0, 5], ["AN", 1, 1, 6]]]], "r": [[5.92181e-06], 0, 1.15895, 1721394521], "v": "v0.6"}
{"i": [["[\"erf\", 10, 3, 8, 9]", "cuda -keys=cuda,gpu -arch=sm_80 -max_num_threads=1024 -thread_warp_size=32", [-1, 16, 64, 49152, 2147483647, 1024, 8, 32], "", 0, []], [[], [["FU", 1, [0, 1, 2, 3]], ["SP", 1, 0, 2160, [1], 1], ["AN", 1, 0, 5], ["AN", 1, 1, 6]]]], "r": [[1.00488e-05], 0, 1.11064, 1721394522], "v": "v0.6"}
{"i": [["[\"erf\", 10, 3, 8, 9]", "cuda -keys=cuda,gpu -arch=sm_80 -max_num_threads=1024 -thread_warp_size=32", [-1, 16, 64, 49152, 2147483647, 1024, 8, 32], "", 0, []], [[], [["FU", 1, [0, 1, 2, 3]], ["SP", 1, 0, 2160, [5], 1], ["AN", 1, 0, 5], ["AN", 1, 1, 6]]]], "r": [[8.76173e-06], 0, 1.26636, 1721394522], "v": "v0.6"}
{"i": [["[\"erf\", 10, 3, 8, 9]", "cuda -keys=cuda,gpu -arch=sm_80 -max_num_threads=1024 -thread_warp_size=32", [-1, 16, 64, 49152, 2147483647, 1024, 8, 32], "", 0, []], [[], [["FU", 1, [0, 1, 2, 3]], ["SP", 1, 0, 2160, [36], 1], ["AN", 1, 0, 5], ["AN", 1, 1, 6]]]], "r": [[8.73941e-06], 0, 1.31127, 1721394523], "v": "v0.6"}
{"i": [["[\"erf\", 10, 3, 8, 9]", "cuda -keys=cuda,gpu -arch=sm_80 -max_num_threads=1024 -thread_warp_size=32", [-1, 16, 64, 49152, 2147483647, 1024, 8, 32], "", 0, []], [[], [["FU", 1, [0, 1, 2, 3]], ["SP", 1, 0, 2160, [54], 1], ["AN", 1, 0, 5], ["AN", 1, 1, 6]]]], "r": [[1.18834e-05], 0, 1.36793, 1721394523], "v": "v0.6"}
{"i": [["[\"erf\", 10, 3, 8, 9]", "cuda -keys=cuda,gpu -arch=sm_80 -max_num_threads=1024 -thread_warp_size=32", [-1, 16, 64, 49152, 2147483647, 1024, 8, 32], "", 0, []], [[], [["FU", 1, [0, 1, 2, 3]], ["SP", 1, 0, 2160, [24], 1], ["AN", 1, 0, 5], ["AN", 1, 1, 6]]]], "r": [[9.29162e-06], 0, 1.51916, 1721394524], "v": "v0.6"}
{"i": [["[\"erf\", 10, 3, 8, 9]", "cuda -keys=cuda,gpu -arch=sm_80 -max_num_threads=1024 -thread_warp_size=32", [-1, 16, 64, 49152, 2147483647, 1024, 8, 32], "", 0, []], [[], [["FU", 1, [0, 1, 2, 3]], ["SP", 1, 0, 2160, [8], 1], ["AN", 1, 0, 5], ["AN", 1, 1, 6]]]], "r": [[8.39445e-06], 0, 1.6927, 1721394524], "v": "v0.6"}
{"i": [["[\"erf\", 10, 3, 8, 9]", "cuda -keys=cuda,gpu -arch=sm_80 -max_num_threads=1024 -thread_warp_size=32", [-1, 16, 64, 49152, 2147483647, 1024, 8, 32], "", 0, []], [[], [["FU", 1, [0, 1, 2, 3]], ["SP", 1, 0, 2160, [4], 1], ["AN", 1, 0, 5], ["AN", 1, 1, 6]]]], "r": [[7.29239e-06], 0, 1.74084, 1721394525], "v": "v0.6"}
