code_generation/generate/deprecated/deprecated_simple_v1.0/log/cuda/exp_cuda.log
{"i": [["[\"exp\", 20, 1, 19, 13]", "cuda -keys=cuda,gpu -arch=sm_80 -max_num_threads=1024 -thread_warp_size=32", [-1, 16, 64, 49152, 2147483647, 1024, 8, 32], "", 0, []], [[], [["FU", 1, [0, 1, 2, 3]], ["SP", 1, 0, 4940, [38], 1], ["AN", 1, 0, 5], ["AN", 1, 1, 6]]]], "r": [[5.82269e-06], 0, 1.38158, 1721397194], "v": "v0.6"}
{"i": [["[\"exp\", 20, 1, 19, 13]", "cuda -keys=cuda,gpu -arch=sm_80 -max_num_threads=1024 -thread_warp_size=32", [-1, 16, 64, 49152, 2147483647, 1024, 8, 32], "", 0, []], [[], [["FU", 1, [0, 1, 2, 3]], ["SP", 1, 0, 4940, [1], 1], ["AN", 1, 0, 5], ["AN", 1, 1, 6]]]], "r": [[1.37299e-05], 0, 1.08483, 1721397195], "v": "v0.6"}
{"i": [["[\"exp\", 20, 1, 19, 13]", "cuda -keys=cuda,gpu -arch=sm_80 -max_num_threads=1024 -thread_warp_size=32", [-1, 16, 64, 49152, 2147483647, 1024, 8, 32], "", 0, []], [[], [["FU", 1, [0, 1, 2, 3]], ["SP", 1, 0, 4940, [64], 1], ["AN", 1, 0, 5], ["AN", 1, 1, 6]]]], "r": [[5.50278e-06], 0, 0.966856, 1721397195], "v": "v0.6"}
{"i": [["[\"exp\", 20, 1, 19, 13]", "cuda -keys=cuda,gpu -arch=sm_80 -max_num_threads=1024 -thread_warp_size=32", [-1, 16, 64, 49152, 2147483647, 1024, 8, 32], "", 0, []], [[], [["FU", 1, [0, 1, 2, 3]], ["SP", 1, 0, 4940, [20], 1], ["AN", 1, 0, 5], ["AN", 1, 1, 6]]]], "r": [[6.00702e-06], 0, 1.09766, 1721397195], "v": "v0.6"}
{"i": [["[\"exp\", 20, 1, 19, 13]", "cuda -keys=cuda,gpu -arch=sm_80 -max_num_threads=1024 -thread_warp_size=32", [-1, 16, 64, 49152, 2147483647, 1024, 8, 32], "", 0, []], [[], [["FU", 1, [0, 1, 2, 3]], ["SP", 1, 0, 4940, [32], 1], ["AN", 1, 0, 5], ["AN", 1, 1, 6]]]], "r": [[5.9129e-06], 0, 1.07031, 1721397196], "v": "v0.6"}
{"i": [["[\"exp\", 20, 1, 19, 13]", "cuda -keys=cuda,gpu -arch=sm_80 -max_num_threads=1024 -thread_warp_size=32", [-1, 16, 64, 49152, 2147483647, 1024, 8, 32], "", 0, []], [[], [["FU", 1, [0, 1, 2, 3]], ["SP", 1, 0, 4940, [19], 1], ["AN", 1, 0, 5], ["AN", 1, 1, 6]]]], "r": [[5.93382e-06], 0, 0.947743, 1721397196], "v": "v0.6"}
{"i": [["[\"exp\", 20, 1, 19, 13]", "cuda -keys=cuda,gpu -arch=sm_80 -max_num_threads=1024 -thread_warp_size=32", [-1, 16, 64, 49152, 2147483647, 1024, 8, 32], "", 0, []], [[], [["FU", 1, [0, 1, 2, 3]], ["SP", 1, 0, 4940, [4], 1], ["AN", 1, 0, 5], ["AN", 1, 1, 6]]]], "r": [[7.46125e-06], 0, 0.903212, 1721397196], "v": "v0.6"}
{"i": [["[\"exp\", 20, 1, 19, 13]", "cuda -keys=cuda,gpu -arch=sm_80 -max_num_threads=1024 -thread_warp_size=32", [-1, 16, 64, 49152, 2147483647, 1024, 8, 32], "", 0, []], [[], [["FU", 1, [0, 1, 2, 3]], ["SP", 1, 0, 4940, [10], 1], ["AN", 1, 0, 5], ["AN", 1, 1, 6]]]], "r": [[6.25686e-06], 0, 1.16483, 1721397196], "v": "v0.6"}
{"i": [["[\"exp\", 20, 1, 19, 13]", "cuda -keys=cuda,gpu -arch=sm_80 -max_num_threads=1024 -thread_warp_size=32", [-1, 16, 64, 49152, 2147483647, 1024, 8, 32], "", 0, []], [[], [["FU", 1, [0, 1, 2, 3]], ["SP", 1, 0, 4940, [13], 1], ["AN", 1, 0, 5], ["AN", 1, 1, 6]]]], "r": [[5.9465e-06], 0, 0.996932, 1721397197], "v": "v0.6"}
{"i": [["[\"exp\", 20, 1, 19, 13]", "cuda -keys=cuda,gpu -arch=sm_80 -max_num_threads=1024 -thread_warp_size=32", [-1, 16, 64, 49152, 2147483647, 1024, 8, 32], "", 0, []], [[], [["FU", 1, [0, 1, 2, 3]], ["SP", 1, 0, 4940, [8], 1], ["AN", 1, 0, 5], ["AN", 1, 1, 6]]]], "r": [[8.41513e-06], 0, 1.25296, 1721397197], "v": "v0.6"}
