code_generation/generate/deprecated/deprecated_simple_v1.0/log/cuda/fast_erf_cuda.log
{"i": [["[\"fast_erf\", 9, 4, 13, 5]", "cuda -keys=cuda,gpu -arch=sm_80 -max_num_threads=1024 -thread_warp_size=32", [-1, 16, 64, 49152, 2147483647, 1024, 8, 32], "", 0, []], [[], [["FU", 1, [0, 1, 2, 3]], ["SP", 1, 0, 2340, [8], 1], ["AN", 1, 0, 5], ["AN", 1, 1, 6]]]], "r": [[7.26827e-06], 0, 1.54054, 1721398796], "v": "v0.6"}
{"i": [["[\"fast_erf\", 9, 4, 13, 5]", "cuda -keys=cuda,gpu -arch=sm_80 -max_num_threads=1024 -thread_warp_size=32", [-1, 16, 64, 49152, 2147483647, 1024, 8, 32], "", 0, []], [[], [["FU", 1, [0, 1, 2, 3]], ["SP", 1, 0, 2340, [9], 1], ["AN", 1, 0, 5], ["AN", 1, 1, 6]]]], "r": [[6.47211e-06], 0, 1.09404, 1721398796], "v": "v0.6"}
{"i": [["[\"fast_erf\", 9, 4, 13, 5]", "cuda -keys=cuda,gpu -arch=sm_80 -max_num_threads=1024 -thread_warp_size=32", [-1, 16, 64, 49152, 2147483647, 1024, 8, 32], "", 0, []], [[], [["FU", 1, [0, 1, 2, 3]], ["SP", 1, 0, 2340, [18], 1], ["AN", 1, 0, 5], ["AN", 1, 1, 6]]]], "r": [[6.31729e-06], 0, 1.20759, 1721398796], "v": "v0.6"}
{"i": [["[\"fast_erf\", 9, 4, 13, 5]", "cuda -keys=cuda,gpu -arch=sm_80 -max_num_threads=1024 -thread_warp_size=32", [-1, 16, 64, 49152, 2147483647, 1024, 8, 32], "", 0, []], [[], [["FU", 1, [0, 1, 2, 3]], ["SP", 1, 0, 2340, [5], 1], ["AN", 1, 0, 5], ["AN", 1, 1, 6]]]], "r": [[8.53219e-06], 0, 1.15753, 1721398796], "v": "v0.6"}
{"i": [["[\"fast_erf\", 9, 4, 13, 5]", "cuda -keys=cuda,gpu -arch=sm_80 -max_num_threads=1024 -thread_warp_size=32", [-1, 16, 64, 49152, 2147483647, 1024, 8, 32], "", 0, []], [[], [["FU", 1, [0, 1, 2, 3]], ["SP", 1, 0, 2340, [2], 1], ["AN", 1, 0, 5], ["AN", 1, 1, 6]]]], "r": [[8.28125e-06], 0, 1.39991, 1721398797], "v": "v0.6"}
{"i": [["[\"fast_erf\", 9, 4, 13, 5]", "cuda -keys=cuda,gpu -arch=sm_80 -max_num_threads=1024 -thread_warp_size=32", [-1, 16, 64, 49152, 2147483647, 1024, 8, 32], "", 0, []], [[], [["FU", 1, [0, 1, 2, 3]], ["SP", 1, 0, 2340, [45], 1], ["AN", 1, 0, 5], ["AN", 1, 1, 6]]]], "r": [[8.02005e-06], 0, 0.956621, 1721398797], "v": "v0.6"}
{"i": [["[\"fast_erf\", 9, 4, 13, 5]", "cuda -keys=cuda,gpu -arch=sm_80 -max_num_threads=1024 -thread_warp_size=32", [-1, 16, 64, 49152, 2147483647, 1024, 8, 32], "", 0, []], [[], [["FU", 1, [0, 1, 2, 3]], ["SP", 1, 0, 2340, [3], 1], ["AN", 1, 0, 5], ["AN", 1, 1, 6]]]], "r": [[8.389e-06], 0, 1.11437, 1721398798], "v": "v0.6"}
{"i": [["[\"fast_erf\", 9, 4, 13, 5]", "cuda -keys=cuda,gpu -arch=sm_80 -max_num_threads=1024 -thread_warp_size=32", [-1, 16, 64, 49152, 2147483647, 1024, 8, 32], "", 0, []], [[], [["FU", 1, [0, 1, 2, 3]], ["SP", 1, 0, 2340, [1], 1], ["AN", 1, 0, 5], ["AN", 1, 1, 6]]]], "r": [[9.86365e-06], 0, 1.18952, 1721398798], "v": "v0.6"}
{"i": [["[\"fast_erf\", 9, 4, 13, 5]", "cuda -keys=cuda,gpu -arch=sm_80 -max_num_threads=1024 -thread_warp_size=32", [-1, 16, 64, 49152, 2147483647, 1024, 8, 32], "", 0, []], [[], [["FU", 1, [0, 1, 2, 3]], ["SP", 1, 0, 2340, [15], 1], ["AN", 1, 0, 5], ["AN", 1, 1, 6]]]], "r": [[7.46639e-06], 0, 1.35275, 1721398798], "v": "v0.6"}
{"i": [["[\"fast_erf\", 9, 4, 13, 5]", "cuda -keys=cuda,gpu -arch=sm_80 -max_num_threads=1024 -thread_warp_size=32", [-1, 16, 64, 49152, 2147483647, 1024, 8, 32], "", 0, []], [[], [["FU", 1, [0, 1, 2, 3]], ["SP", 1, 0, 2340, [20], 1], ["AN", 1, 0, 5], ["AN", 1, 1, 6]]]], "r": [[7.45728e-06], 0, 1.36634, 1721398799], "v": "v0.6"}
