code_generation/generate/deprecated/deprecated_simple_v1.0/log/cuda/fast_softmax_cuda.log
{"i": [["[\"fast_softmax\", 7, 2, 9, 10]", "cuda -keys=cuda,gpu -arch=sm_80 -max_num_threads=1024 -thread_warp_size=32", [-1, 16, 64, 49152, 2147483647, 1024, 8, 32], "", 0, []], [[], [["CI", 3], ["CI", 2], ["FU", 5, [0, 1, 2, 3]], ["SP", 5, 0, 1260, [18], 1], ["AN", 5, 0, 5], ["AN", 5, 1, 6], ["FU", 4, [0, 1, 2]], ["SP", 4, 0, 126, [32], 1], ["AN", 4, 0, 5], ["AN", 4, 1, 6], ["FU", 1, [0, 1, 2]], ["SP", 1, 0, 126, [8], 1], ["AN", 1, 0, 5], ["AN", 1, 1, 6], ["PR", 1, 0, "auto_unroll_max_step$0"], ["PR", 4, 0, "auto_unroll_max_step$0"]]]], "r": [[2.67471e-05], 0, 2.78273, 1721383802], "v": "v0.6"}
{"i": [["[\"fast_softmax\", 7, 2, 9, 10]", "cuda -keys=cuda,gpu -arch=sm_80 -max_num_threads=1024 -thread_warp_size=32", [-1, 16, 64, 49152, 2147483647, 1024, 8, 32], "", 0, []], [[], [["CI", 3], ["CI", 2], ["FU", 5, [0, 1, 2, 3]], ["SP", 5, 0, 1260, [4], 1], ["AN", 5, 0, 5], ["AN", 5, 1, 6], ["FU", 4, [0, 1, 2]], ["SP", 4, 0, 126, [32], 1], ["AN", 4, 0, 5], ["AN", 4, 1, 6], ["FU", 1, [0, 1, 2]], ["SP", 1, 0, 126, [40], 1], ["AN", 1, 0, 5], ["AN", 1, 1, 6], ["PR", 1, 0, "auto_unroll_max_step$0"], ["PR", 4, 0, "auto_unroll_max_step$0"]]]], "r": [[2.65636e-05], 0, 1.74403, 1721383802], "v": "v0.6"}
{"i": [["[\"fast_softmax\", 7, 2, 9, 10]", "cuda -keys=cuda,gpu -arch=sm_80 -max_num_threads=1024 -thread_warp_size=32", [-1, 16, 64, 49152, 2147483647, 1024, 8, 32], "", 0, []], [[], [["CI", 3], ["CI", 2], ["FU", 5, [0, 1, 2, 3]], ["SP", 5, 0, 1260, [32], 1], ["AN", 5, 0, 5], ["AN", 5, 1, 6], ["FU", 4, [0, 1, 2]], ["SP", 4, 0, 126, [3], 1], ["AN", 4, 0, 5], ["AN", 4, 1, 6], ["FU", 1, [0, 1, 2]], ["SP", 1, 0, 126, [1], 1], ["AN", 1, 0, 5], ["AN", 1, 1, 6], ["PR", 1, 0, "auto_unroll_max_step$0"], ["PR", 4, 0, "auto_unroll_max_step$0"]]]], "r": [[2.51333e-05], 0, 2.07185, 1721383803], "v": "v0.6"}
{"i": [["[\"fast_softmax\", 7, 2, 9, 10]", "cuda -keys=cuda,gpu -arch=sm_80 -max_num_threads=1024 -thread_warp_size=32", [-1, 16, 64, 49152, 2147483647, 1024, 8, 32], "", 0, []], [[], [["CI", 3], ["CI", 2], ["FU", 5, [0, 1, 2, 3]], ["SP", 5, 0, 1260, [1], 1], ["AN", 5, 0, 5], ["AN", 5, 1, 6], ["FU", 4, [0, 1, 2]], ["SP", 4, 0, 126, [16], 1], ["AN", 4, 0, 5], ["AN", 4, 1, 6], ["FU", 1, [0, 1, 2]], ["SP", 1, 0, 126, [1], 1], ["AN", 1, 0, 5], ["AN", 1, 1, 6], ["PR", 1, 0, "auto_unroll_max_step$0"], ["PR", 4, 0, "auto_unroll_max_step$0"]]]], "r": [[2.3253e-05], 0, 2.07257, 1721383803], "v": "v0.6"}
{"i": [["[\"fast_softmax\", 7, 2, 9, 10]", "cuda -keys=cuda,gpu -arch=sm_80 -max_num_threads=1024 -thread_warp_size=32", [-1, 16, 64, 49152, 2147483647, 1024, 8, 32], "", 0, []], [[], [["CI", 3], ["CI", 2], ["FU", 5, [0, 1, 2, 3]], ["SP", 5, 0, 1260, [32], 1], ["AN", 5, 0, 5], ["AN", 5, 1, 6], ["FU", 4, [0, 1, 2]], ["SP", 4, 0, 126, [14], 1], ["AN", 4, 0, 5], ["AN", 4, 1, 6], ["FU", 1, [0, 1, 2]], ["SP", 1, 0, 126, [32], 1], ["AN", 1, 0, 5], ["AN", 1, 1, 6], ["PR", 1, 0, "auto_unroll_max_step$0"], ["PR", 4, 0, "auto_unroll_max_step$0"]]]], "r": [[3.51127e-05], 0, 2.297, 1721383804], "v": "v0.6"}
{"i": [["[\"fast_softmax\", 7, 2, 9, 10]", "cuda -keys=cuda,gpu -arch=sm_80 -max_num_threads=1024 -thread_warp_size=32", [-1, 16, 64, 49152, 2147483647, 1024, 8, 32], "", 0, []], [[], [["CI", 3], ["CI", 2], ["FU", 5, [0, 1, 2, 3]], ["SP", 5, 0, 1260, [16], 1], ["AN", 5, 0, 5], ["AN", 5, 1, 6], ["FU", 4, [0, 1, 2]], ["SP", 4, 0, 126, [1], 1], ["AN", 4, 0, 5], ["AN", 4, 1, 6], ["FU", 1, [0, 1, 2]], ["SP", 1, 0, 126, [16], 1], ["AN", 1, 0, 5], ["AN", 1, 1, 6], ["PR", 1, 0, "auto_unroll_max_step$0"], ["PR", 4, 0, "auto_unroll_max_step$0"]]]], "r": [[3.21308e-05], 0, 2.36961, 1721383805], "v": "v0.6"}
{"i": [["[\"fast_softmax\", 7, 2, 9, 10]", "cuda -keys=cuda,gpu -arch=sm_80 -max_num_threads=1024 -thread_warp_size=32", [-1, 16, 64, 49152, 2147483647, 1024, 8, 32], "", 0, []], [[], [["CI", 3], ["CI", 2], ["FU", 5, [0, 1, 2, 3]], ["SP", 5, 0, 1260, [1], 1], ["AN", 5, 0, 5], ["AN", 5, 1, 6], ["FU", 4, [0, 1, 2]], ["SP", 4, 0, 126, [1], 1], ["AN", 4, 0, 5], ["AN", 4, 1, 6], ["FU", 1, [0, 1, 2]], ["SP", 1, 0, 126, [2], 1], ["AN", 1, 0, 5], ["AN", 1, 1, 6], ["PR", 1, 0, "auto_unroll_max_step$0"], ["PR", 4, 0, "auto_unroll_max_step$0"]]]], "r": [[3.14883e-05], 0, 2.03106, 1721383805], "v": "v0.6"}
{"i": [["[\"fast_softmax\", 7, 2, 9, 10]", "cuda -keys=cuda,gpu -arch=sm_80 -max_num_threads=1024 -thread_warp_size=32", [-1, 16, 64, 49152, 2147483647, 1024, 8, 32], "", 0, []], [[], [["CI", 3], ["CI", 2], ["FU", 5, [0, 1, 2, 3]], ["SP", 5, 0, 1260, [16], 1], ["AN", 5, 0, 5], ["AN", 5, 1, 6], ["FU", 4, [0, 1, 2]], ["SP", 4, 0, 126, [32], 1], ["AN", 4, 0, 5], ["AN", 4, 1, 6], ["FU", 1, [0, 1, 2]], ["SP", 1, 0, 126, [8], 1], ["AN", 1, 0, 5], ["AN", 1, 1, 6], ["PR", 1, 0, "auto_unroll_max_step$0"], ["PR", 4, 0, "auto_unroll_max_step$0"]]]], "r": [[3.00256e-05], 0, 1.89612, 1721383806], "v": "v0.6"}
{"i": [["[\"fast_softmax\", 7, 2, 9, 10]", "cuda -keys=cuda,gpu -arch=sm_80 -max_num_threads=1024 -thread_warp_size=32", [-1, 16, 64, 49152, 2147483647, 1024, 8, 32], "", 0, []], [[], [["CI", 3], ["CI", 2], ["FU", 5, [0, 1, 2, 3]], ["SP", 5, 0, 1260, [1], 1], ["AN", 5, 0, 5], ["AN", 5, 1, 6], ["FU", 4, [0, 1, 2]], ["SP", 4, 0, 126, [16], 1], ["AN", 4, 0, 5], ["AN", 4, 1, 6], ["FU", 1, [0, 1, 2]], ["SP", 1, 0, 126, [4], 1], ["AN", 1, 0, 5], ["AN", 1, 1, 6], ["PR", 1, 0, "auto_unroll_max_step$0"], ["PR", 4, 0, "auto_unroll_max_step$0"]]]], "r": [[3.25363e-05], 0, 2.09512, 1721383806], "v": "v0.6"}
{"i": [["[\"fast_softmax\", 7, 2, 9, 10]", "cuda -keys=cuda,gpu -arch=sm_80 -max_num_threads=1024 -thread_warp_size=32", [-1, 16, 64, 49152, 2147483647, 1024, 8, 32], "", 0, []], [[], [["CI", 3], ["CI", 2], ["FU", 5, [0, 1, 2, 3]], ["SP", 5, 0, 1260, [32], 1], ["AN", 5, 0, 5], ["AN", 5, 1, 6], ["FU", 4, [0, 1, 2]], ["SP", 4, 0, 126, [4], 1], ["AN", 4, 0, 5], ["AN", 4, 1, 6], ["FU", 1, [0, 1, 2]], ["SP", 1, 0, 126, [1], 1], ["AN", 1, 0, 5], ["AN", 1, 1, 6], ["PR", 1, 0, "auto_unroll_max_step$0"], ["PR", 4, 0, "auto_unroll_max_step$0"]]]], "r": [[2.13882e-05], 0, 2.60211, 1721383807], "v": "v0.6"}
