code_generation/generate/deprecated/deprecated_simple_v1.0/log/cuda/fast_tanh_cuda.log
{"i": [["[\"fast_tanh\", 18, 14, 2, 12]", "cuda -keys=cuda,gpu -arch=sm_80 -max_num_threads=1024 -thread_warp_size=32", [-1, 16, 64, 49152, 2147483647, 1024, 8, 32], "", 0, []], [[], [["CI", 2], ["CI", 1], ["FU", 3, [0, 1, 2, 3]], ["SP", 3, 0, 6048, [2], 1], ["AN", 3, 0, 5], ["AN", 3, 1, 6]]]], "r": [[1.13068e-05], 0, 4.38548, 1721402622], "v": "v0.6"}
{"i": [["[\"fast_tanh\", 18, 14, 2, 12]", "cuda -keys=cuda,gpu -arch=sm_80 -max_num_threads=1024 -thread_warp_size=32", [-1, 16, 64, 49152, 2147483647, 1024, 8, 32], "", 0, []], [[], [["CI", 2], ["CI", 1], ["FU", 3, [0, 1, 2, 3]], ["SP", 3, 0, 6048, [18], 1], ["AN", 3, 0, 5], ["AN", 3, 1, 6]]]], "r": [[6.15746e-06], 0, 1.33239, 1721402622], "v": "v0.6"}
{"i": [["[\"fast_tanh\", 18, 14, 2, 12]", "cuda -keys=cuda,gpu -arch=sm_80 -max_num_threads=1024 -thread_warp_size=32", [-1, 16, 64, 49152, 2147483647, 1024, 8, 32], "", 0, []], [[], [["CI", 2], ["CI", 1], ["FU", 3, [0, 1, 2, 3]], ["SP", 3, 0, 6048, [9], 1], ["AN", 3, 0, 5], ["AN", 3, 1, 6]]]], "r": [[6.72297e-06], 0, 1.36196, 1721402622], "v": "v0.6"}
{"i": [["[\"fast_tanh\", 18, 14, 2, 12]", "cuda -keys=cuda,gpu -arch=sm_80 -max_num_threads=1024 -thread_warp_size=32", [-1, 16, 64, 49152, 2147483647, 1024, 8, 32], "", 0, []], [[], [["CI", 2], ["CI", 1], ["FU", 3, [0, 1, 2, 3]], ["SP", 3, 0, 6048, [16], 1], ["AN", 3, 0, 5], ["AN", 3, 1, 6]]]], "r": [[6.51842e-06], 0, 1.17336, 1721402623], "v": "v0.6"}
{"i": [["[\"fast_tanh\", 18, 14, 2, 12]", "cuda -keys=cuda,gpu -arch=sm_80 -max_num_threads=1024 -thread_warp_size=32", [-1, 16, 64, 49152, 2147483647, 1024, 8, 32], "", 0, []], [[], [["CI", 2], ["CI", 1], ["FU", 3, [0, 1, 2, 3]], ["SP", 3, 0, 6048, [6], 1], ["AN", 3, 0, 5], ["AN", 3, 1, 6]]]], "r": [[7.9375e-06], 0, 1.0692, 1721402623], "v": "v0.6"}
{"i": [["[\"fast_tanh\", 18, 14, 2, 12]", "cuda -keys=cuda,gpu -arch=sm_80 -max_num_threads=1024 -thread_warp_size=32", [-1, 16, 64, 49152, 2147483647, 1024, 8, 32], "", 0, []], [[], [["CI", 2], ["CI", 1], ["FU", 3, [0, 1, 2, 3]], ["SP", 3, 0, 6048, [24], 1], ["AN", 3, 0, 5], ["AN", 3, 1, 6]]]], "r": [[8.64329e-06], 0, 1.38648, 1721402624], "v": "v0.6"}
{"i": [["[\"fast_tanh\", 18, 14, 2, 12]", "cuda -keys=cuda,gpu -arch=sm_80 -max_num_threads=1024 -thread_warp_size=32", [-1, 16, 64, 49152, 2147483647, 1024, 8, 32], "", 0, []], [[], [["CI", 2], ["CI", 1], ["FU", 3, [0, 1, 2, 3]], ["SP", 3, 0, 6048, [32], 1], ["AN", 3, 0, 5], ["AN", 3, 1, 6]]]], "r": [[7.13143e-06], 0, 0.953736, 1721402624], "v": "v0.6"}
{"i": [["[\"fast_tanh\", 18, 14, 2, 12]", "cuda -keys=cuda,gpu -arch=sm_80 -max_num_threads=1024 -thread_warp_size=32", [-1, 16, 64, 49152, 2147483647, 1024, 8, 32], "", 0, []], [[], [["CI", 2], ["CI", 1], ["FU", 3, [0, 1, 2, 3]], ["SP", 3, 0, 6048, [27], 1], ["AN", 3, 0, 5], ["AN", 3, 1, 6]]]], "r": [[6.94646e-06], 0, 1.00873, 1721402624], "v": "v0.6"}
{"i": [["[\"fast_tanh\", 18, 14, 2, 12]", "cuda -keys=cuda,gpu -arch=sm_80 -max_num_threads=1024 -thread_warp_size=32", [-1, 16, 64, 49152, 2147483647, 1024, 8, 32], "", 0, []], [[], [["CI", 2], ["CI", 1], ["FU", 3, [0, 1, 2, 3]], ["SP", 3, 0, 6048, [42], 1], ["AN", 3, 0, 5], ["AN", 3, 1, 6]]]], "r": [[7.48968e-06], 0, 1.28472, 1721402625], "v": "v0.6"}
{"i": [["[\"fast_tanh\", 18, 14, 2, 12]", "cuda -keys=cuda,gpu -arch=sm_80 -max_num_threads=1024 -thread_warp_size=32", [-1, 16, 64, 49152, 2147483647, 1024, 8, 32], "", 0, []], [[], [["CI", 2], ["CI", 1], ["FU", 3, [0, 1, 2, 3]], ["SP", 3, 0, 6048, [54], 1], ["AN", 3, 0, 5], ["AN", 3, 1, 6]]]], "r": [[6.86514e-06], 0, 1.18703, 1721402625], "v": "v0.6"}
