code_generation/generate/deprecated/deprecated_simple_v1.0/log/cuda/fifo_buffer_cuda.log
{"i": [["[\"fifo_buffer\", 15, 19, 15, 20]", "cuda -keys=cuda,gpu -arch=sm_80 -max_num_threads=1024 -thread_warp_size=32", [-1, 16, 64, 49152, 2147483647, 1024, 8, 32], "", 0, []], [[], [["FU", 2, [0, 1, 2, 3]], ["SP", 2, 0, 85500, [38], 1], ["AN", 2, 0, 5], ["AN", 2, 1, 6]]]], "r": [[1.26002e-05], 0, 1.70529, 1721398170], "v": "v0.6"}
{"i": [["[\"fifo_buffer\", 15, 19, 15, 20]", "cuda -keys=cuda,gpu -arch=sm_80 -max_num_threads=1024 -thread_warp_size=32", [-1, 16, 64, 49152, 2147483647, 1024, 8, 32], "", 0, []], [[], [["FU", 2, [0, 1, 2, 3]], ["SP", 2, 0, 85500, [32], 1], ["AN", 2, 0, 5], ["AN", 2, 1, 6]]]], "r": [[1.32184e-05], 0, 1.38961, 1721398170], "v": "v0.6"}
{"i": [["[\"fifo_buffer\", 15, 19, 15, 20]", "cuda -keys=cuda,gpu -arch=sm_80 -max_num_threads=1024 -thread_warp_size=32", [-1, 16, 64, 49152, 2147483647, 1024, 8, 32], "", 0, []], [[], [["FU", 2, [0, 1, 2, 3]], ["SP", 2, 0, 85500, [50], 1], ["AN", 2, 0, 5], ["AN", 2, 1, 6]]]], "r": [[1.16333e-05], 0, 1.40815, 1721398170], "v": "v0.6"}
{"i": [["[\"fifo_buffer\", 15, 19, 15, 20]", "cuda -keys=cuda,gpu -arch=sm_80 -max_num_threads=1024 -thread_warp_size=32", [-1, 16, 64, 49152, 2147483647, 1024, 8, 32], "", 0, []], [[], [["FU", 2, [0, 1, 2, 3]], ["SP", 2, 0, 85500, [4], 1], ["AN", 2, 0, 5], ["AN", 2, 1, 6]]]], "r": [[5.55329e-05], 0, 1.40069, 1721398171], "v": "v0.6"}
{"i": [["[\"fifo_buffer\", 15, 19, 15, 20]", "cuda -keys=cuda,gpu -arch=sm_80 -max_num_threads=1024 -thread_warp_size=32", [-1, 16, 64, 49152, 2147483647, 1024, 8, 32], "", 0, []], [[], [["FU", 2, [0, 1, 2, 3]], ["SP", 2, 0, 85500, [15], 1], ["AN", 2, 0, 5], ["AN", 2, 1, 6]]]], "r": [[1.93401e-05], 0, 1.17711, 1721398171], "v": "v0.6"}
{"i": [["[\"fifo_buffer\", 15, 19, 15, 20]", "cuda -keys=cuda,gpu -arch=sm_80 -max_num_threads=1024 -thread_warp_size=32", [-1, 16, 64, 49152, 2147483647, 1024, 8, 32], "", 0, []], [[], [["FU", 2, [0, 1, 2, 3]], ["SP", 2, 0, 85500, [5], 1], ["AN", 2, 0, 5], ["AN", 2, 1, 6]]]], "r": [[4.45711e-05], 0, 1.51275, 1721398172], "v": "v0.6"}
{"i": [["[\"fifo_buffer\", 15, 19, 15, 20]", "cuda -keys=cuda,gpu -arch=sm_80 -max_num_threads=1024 -thread_warp_size=32", [-1, 16, 64, 49152, 2147483647, 1024, 8, 32], "", 0, []], [[], [["FU", 2, [0, 1, 2, 3]], ["SP", 2, 0, 85500, [19], 1], ["AN", 2, 0, 5], ["AN", 2, 1, 6]]]], "r": [[1.31499e-05], 0, 1.2941, 1721398172], "v": "v0.6"}
{"i": [["[\"fifo_buffer\", 15, 19, 15, 20]", "cuda -keys=cuda,gpu -arch=sm_80 -max_num_threads=1024 -thread_warp_size=32", [-1, 16, 64, 49152, 2147483647, 1024, 8, 32], "", 0, []], [[], [["FU", 2, [0, 1, 2, 3]], ["SP", 2, 0, 85500, [10], 1], ["AN", 2, 0, 5], ["AN", 2, 1, 6]]]], "r": [[1.99245e-05], 0, 0.967083, 1721398172], "v": "v0.6"}
{"i": [["[\"fifo_buffer\", 15, 19, 15, 20]", "cuda -keys=cuda,gpu -arch=sm_80 -max_num_threads=1024 -thread_warp_size=32", [-1, 16, 64, 49152, 2147483647, 1024, 8, 32], "", 0, []], [[], [["FU", 2, [0, 1, 2, 3]], ["SP", 2, 0, 85500, [18], 1], ["AN", 2, 0, 5], ["AN", 2, 1, 6]]]], "r": [[1.33786e-05], 0, 1.01781, 1721398173], "v": "v0.6"}
{"i": [["[\"fifo_buffer\", 15, 19, 15, 20]", "cuda -keys=cuda,gpu -arch=sm_80 -max_num_threads=1024 -thread_warp_size=32", [-1, 16, 64, 49152, 2147483647, 1024, 8, 32], "", 0, []], [[], [["FU", 2, [0, 1, 2, 3]], ["SP", 2, 0, 85500, [25], 1], ["AN", 2, 0, 5], ["AN", 2, 1, 6]]]], "r": [[1.18734e-05], 0, 1.29532, 1721398173], "v": "v0.6"}
