code_generation/generate/deprecated/deprecated_simple_v1.0/log/cuda/flatten_cuda.log
{"i": [["[\"flatten\", 9, 14, 8, 19]", "cuda -keys=cuda,gpu -arch=sm_80 -max_num_threads=1024 -thread_warp_size=32", [-1, 16, 64, 49152, 2147483647, 1024, 8, 32], "", 0, []], [[], [["FU", 1, [0, 1]], ["SP", 1, 0, 19152, [57], 1], ["AN", 1, 0, 5], ["AN", 1, 1, 6]]]], "r": [[7.24724e-06], 0, 2.40738, 1721393136], "v": "v0.6"}
{"i": [["[\"flatten\", 9, 14, 8, 19]", "cuda -keys=cuda,gpu -arch=sm_80 -max_num_threads=1024 -thread_warp_size=32", [-1, 16, 64, 49152, 2147483647, 1024, 8, 32], "", 0, []], [[], [["FU", 1, [0, 1]], ["SP", 1, 0, 19152, [14], 1], ["AN", 1, 0, 5], ["AN", 1, 1, 6]]]], "r": [[1.0136e-05], 0, 1.68063, 1721393137], "v": "v0.6"}
{"i": [["[\"flatten\", 9, 14, 8, 19]", "cuda -keys=cuda,gpu -arch=sm_80 -max_num_threads=1024 -thread_warp_size=32", [-1, 16, 64, 49152, 2147483647, 1024, 8, 32], "", 0, []], [[], [["FU", 1, [0, 1]], ["SP", 1, 0, 19152, [8], 1], ["AN", 1, 0, 5], ["AN", 1, 1, 6]]]], "r": [[9.56704e-06], 0, 1.76087, 1721393137], "v": "v0.6"}
{"i": [["[\"flatten\", 9, 14, 8, 19]", "cuda -keys=cuda,gpu -arch=sm_80 -max_num_threads=1024 -thread_warp_size=32", [-1, 16, 64, 49152, 2147483647, 1024, 8, 32], "", 0, []], [[], [["FU", 1, [0, 1]], ["SP", 1, 0, 19152, [24], 1], ["AN", 1, 0, 5], ["AN", 1, 1, 6]]]], "r": [[8.83176e-06], 0, 1.61968, 1721393137], "v": "v0.6"}
{"i": [["[\"flatten\", 9, 14, 8, 19]", "cuda -keys=cuda,gpu -arch=sm_80 -max_num_threads=1024 -thread_warp_size=32", [-1, 16, 64, 49152, 2147483647, 1024, 8, 32], "", 0, []], [[], [["FU", 1, [0, 1]], ["SP", 1, 0, 19152, [32], 1], ["AN", 1, 0, 5], ["AN", 1, 1, 6]]]], "r": [[7.95888e-06], 0, 1.47685, 1721393138], "v": "v0.6"}
{"i": [["[\"flatten\", 9, 14, 8, 19]", "cuda -keys=cuda,gpu -arch=sm_80 -max_num_threads=1024 -thread_warp_size=32", [-1, 16, 64, 49152, 2147483647, 1024, 8, 32], "", 0, []], [[], [["FU", 1, [0, 1]], ["SP", 1, 0, 19152, [1], 1], ["AN", 1, 0, 5], ["AN", 1, 1, 6]]]], "r": [[3.88963e-05], 0, 1.75965, 1721393138], "v": "v0.6"}
{"i": [["[\"flatten\", 9, 14, 8, 19]", "cuda -keys=cuda,gpu -arch=sm_80 -max_num_threads=1024 -thread_warp_size=32", [-1, 16, 64, 49152, 2147483647, 1024, 8, 32], "", 0, []], [[], [["FU", 1, [0, 1]], ["SP", 1, 0, 19152, [36], 1], ["AN", 1, 0, 5], ["AN", 1, 1, 6]]]], "r": [[6.7844e-06], 0, 1.51438, 1721393139], "v": "v0.6"}
{"i": [["[\"flatten\", 9, 14, 8, 19]", "cuda -keys=cuda,gpu -arch=sm_80 -max_num_threads=1024 -thread_warp_size=32", [-1, 16, 64, 49152, 2147483647, 1024, 8, 32], "", 0, []], [[], [["FU", 1, [0, 1]], ["SP", 1, 0, 19152, [21], 1], ["AN", 1, 0, 5], ["AN", 1, 1, 6]]]], "r": [[6.79088e-06], 0, 1.48824, 1721393139], "v": "v0.6"}
{"i": [["[\"flatten\", 9, 14, 8, 19]", "cuda -keys=cuda,gpu -arch=sm_80 -max_num_threads=1024 -thread_warp_size=32", [-1, 16, 64, 49152, 2147483647, 1024, 8, 32], "", 0, []], [[], [["FU", 1, [0, 1]], ["SP", 1, 0, 19152, [2], 1], ["AN", 1, 0, 5], ["AN", 1, 1, 6]]]], "r": [[2.12717e-05], 0, 1.54326, 1721393140], "v": "v0.6"}
{"i": [["[\"flatten\", 9, 14, 8, 19]", "cuda -keys=cuda,gpu -arch=sm_80 -max_num_threads=1024 -thread_warp_size=32", [-1, 16, 64, 49152, 2147483647, 1024, 8, 32], "", 0, []], [[], [["FU", 1, [0, 1]], ["SP", 1, 0, 19152, [56], 1], ["AN", 1, 0, 5], ["AN", 1, 1, 6]]]], "r": [[6.13337e-06], 0, 1.45135, 1721393140], "v": "v0.6"}
