code_generation/generate/deprecated/deprecated_simple_v1.0/log/cuda/flip_cuda.log
{"i": [["[\"flip\", 18, 5, 4, 14]", "cuda -keys=cuda,gpu -arch=sm_80 -max_num_threads=1024 -thread_warp_size=32", [-1, 16, 64, 49152, 2147483647, 1024, 8, 32], "", 0, []], [[], [["FU", 1, [0, 1, 2, 3]], ["SP", 1, 0, 5040, [45], 1], ["AN", 1, 0, 5], ["AN", 1, 1, 6]]]], "r": [[5.49244e-06], 0, 1.60587, 1721405120], "v": "v0.6"}
{"i": [["[\"flip\", 18, 5, 4, 14]", "cuda -keys=cuda,gpu -arch=sm_80 -max_num_threads=1024 -thread_warp_size=32", [-1, 16, 64, 49152, 2147483647, 1024, 8, 32], "", 0, []], [[], [["FU", 1, [0, 1, 2, 3]], ["SP", 1, 0, 5040, [24], 1], ["AN", 1, 0, 5], ["AN", 1, 1, 6]]]], "r": [[5.94654e-06], 0, 1.03514, 1721405120], "v": "v0.6"}
{"i": [["[\"flip\", 18, 5, 4, 14]", "cuda -keys=cuda,gpu -arch=sm_80 -max_num_threads=1024 -thread_warp_size=32", [-1, 16, 64, 49152, 2147483647, 1024, 8, 32], "", 0, []], [[], [["FU", 1, [0, 1, 2, 3]], ["SP", 1, 0, 5040, [32], 1], ["AN", 1, 0, 5], ["AN", 1, 1, 6]]]], "r": [[5.49433e-06], 0, 1.03401, 1721405120], "v": "v0.6"}
{"i": [["[\"flip\", 18, 5, 4, 14]", "cuda -keys=cuda,gpu -arch=sm_80 -max_num_threads=1024 -thread_warp_size=32", [-1, 16, 64, 49152, 2147483647, 1024, 8, 32], "", 0, []], [[], [["FU", 1, [0, 1, 2, 3]], ["SP", 1, 0, 5040, [21], 1], ["AN", 1, 0, 5], ["AN", 1, 1, 6]]]], "r": [[6.32115e-06], 0, 1.19261, 1721405120], "v": "v0.6"}
{"i": [["[\"flip\", 18, 5, 4, 14]", "cuda -keys=cuda,gpu -arch=sm_80 -max_num_threads=1024 -thread_warp_size=32", [-1, 16, 64, 49152, 2147483647, 1024, 8, 32], "", 0, []], [[], [["FU", 1, [0, 1, 2, 3]], ["SP", 1, 0, 5040, [4], 1], ["AN", 1, 0, 5], ["AN", 1, 1, 6]]]], "r": [[7.46585e-06], 0, 0.988754, 1721405121], "v": "v0.6"}
{"i": [["[\"flip\", 18, 5, 4, 14]", "cuda -keys=cuda,gpu -arch=sm_80 -max_num_threads=1024 -thread_warp_size=32", [-1, 16, 64, 49152, 2147483647, 1024, 8, 32], "", 0, []], [[], [["FU", 1, [0, 1, 2, 3]], ["SP", 1, 0, 5040, [60], 1], ["AN", 1, 0, 5], ["AN", 1, 1, 6]]]], "r": [[5.49143e-06], 0, 0.860374, 1721405121], "v": "v0.6"}
{"i": [["[\"flip\", 18, 5, 4, 14]", "cuda -keys=cuda,gpu -arch=sm_80 -max_num_threads=1024 -thread_warp_size=32", [-1, 16, 64, 49152, 2147483647, 1024, 8, 32], "", 0, []], [[], [["FU", 1, [0, 1, 2, 3]], ["SP", 1, 0, 5040, [30], 1], ["AN", 1, 0, 5], ["AN", 1, 1, 6]]]], "r": [[5.51655e-06], 0, 0.898431, 1721405121], "v": "v0.6"}
{"i": [["[\"flip\", 18, 5, 4, 14]", "cuda -keys=cuda,gpu -arch=sm_80 -max_num_threads=1024 -thread_warp_size=32", [-1, 16, 64, 49152, 2147483647, 1024, 8, 32], "", 0, []], [[], [["FU", 1, [0, 1, 2, 3]], ["SP", 1, 0, 5040, [14], 1], ["AN", 1, 0, 5], ["AN", 1, 1, 6]]]], "r": [[6.02522e-06], 0, 1.08622, 1721405121], "v": "v0.6"}
{"i": [["[\"flip\", 18, 5, 4, 14]", "cuda -keys=cuda,gpu -arch=sm_80 -max_num_threads=1024 -thread_warp_size=32", [-1, 16, 64, 49152, 2147483647, 1024, 8, 32], "", 0, []], [[], [["FU", 1, [0, 1, 2, 3]], ["SP", 1, 0, 5040, [36], 1], ["AN", 1, 0, 5], ["AN", 1, 1, 6]]]], "r": [[5.68252e-06], 0, 0.96739, 1721405122], "v": "v0.6"}
{"i": [["[\"flip\", 18, 5, 4, 14]", "cuda -keys=cuda,gpu -arch=sm_80 -max_num_threads=1024 -thread_warp_size=32", [-1, 16, 64, 49152, 2147483647, 1024, 8, 32], "", 0, []], [[], [["FU", 1, [0, 1, 2, 3]], ["SP", 1, 0, 5040, [35], 1], ["AN", 1, 0, 5], ["AN", 1, 1, 6]]]], "r": [[5.89993e-06], 0, 0.893081, 1721405122], "v": "v0.6"}
