code_generation/generate/deprecated/deprecated_simple_v1.0/log/cuda/isnan_cuda.log
{"i": [["[\"isnan\", 15, 19, 18, 14]", "cuda -keys=cuda,gpu -arch=sm_80 -max_num_threads=1024 -thread_warp_size=32", [-1, 16, 64, 49152, 2147483647, 1024, 8, 32], "", 0, []], [[], [["FU", 1, [0, 1, 2, 3]], ["SP", 1, 0, 71820, [54], 1], ["AN", 1, 0, 5], ["AN", 1, 1, 6]]]], "r": [[7.96951e-06], 0, 1.40503, 1721408728], "v": "v0.6"}
{"i": [["[\"isnan\", 15, 19, 18, 14]", "cuda -keys=cuda,gpu -arch=sm_80 -max_num_threads=1024 -thread_warp_size=32", [-1, 16, 64, 49152, 2147483647, 1024, 8, 32], "", 0, []], [[], [["FU", 1, [0, 1, 2, 3]], ["SP", 1, 0, 71820, [4], 1], ["AN", 1, 0, 5], ["AN", 1, 1, 6]]]], "r": [[3.52421e-05], 0, 1.11397, 1721408728], "v": "v0.6"}
{"i": [["[\"isnan\", 15, 19, 18, 14]", "cuda -keys=cuda,gpu -arch=sm_80 -max_num_threads=1024 -thread_warp_size=32", [-1, 16, 64, 49152, 2147483647, 1024, 8, 32], "", 0, []], [[], [["FU", 1, [0, 1, 2, 3]], ["SP", 1, 0, 71820, [42], 1], ["AN", 1, 0, 5], ["AN", 1, 1, 6]]]], "r": [[8.5042e-06], 0, 0.866842, 1721408729], "v": "v0.6"}
{"i": [["[\"isnan\", 15, 19, 18, 14]", "cuda -keys=cuda,gpu -arch=sm_80 -max_num_threads=1024 -thread_warp_size=32", [-1, 16, 64, 49152, 2147483647, 1024, 8, 32], "", 0, []], [[], [["FU", 1, [0, 1, 2, 3]], ["SP", 1, 0, 71820, [5], 1], ["AN", 1, 0, 5], ["AN", 1, 1, 6]]]], "r": [[2.92173e-05], 0, 0.981595, 1721408729], "v": "v0.6"}
{"i": [["[\"isnan\", 15, 19, 18, 14]", "cuda -keys=cuda,gpu -arch=sm_80 -max_num_threads=1024 -thread_warp_size=32", [-1, 16, 64, 49152, 2147483647, 1024, 8, 32], "", 0, []], [[], [["FU", 1, [0, 1, 2, 3]], ["SP", 1, 0, 71820, [30], 1], ["AN", 1, 0, 5], ["AN", 1, 1, 6]]]], "r": [[9.59805e-06], 0, 0.799044, 1721408729], "v": "v0.6"}
{"i": [["[\"isnan\", 15, 19, 18, 14]", "cuda -keys=cuda,gpu -arch=sm_80 -max_num_threads=1024 -thread_warp_size=32", [-1, 16, 64, 49152, 2147483647, 1024, 8, 32], "", 0, []], [[], [["FU", 1, [0, 1, 2, 3]], ["SP", 1, 0, 71820, [63], 1], ["AN", 1, 0, 5], ["AN", 1, 1, 6]]]], "r": [[7.28538e-06], 0, 1.04544, 1721408730], "v": "v0.6"}
{"i": [["[\"isnan\", 15, 19, 18, 14]", "cuda -keys=cuda,gpu -arch=sm_80 -max_num_threads=1024 -thread_warp_size=32", [-1, 16, 64, 49152, 2147483647, 1024, 8, 32], "", 0, []], [[], [["FU", 1, [0, 1, 2, 3]], ["SP", 1, 0, 71820, [2], 1], ["AN", 1, 0, 5], ["AN", 1, 1, 6]]]], "r": [[6.4034e-05], 0, 0.894502, 1721408730], "v": "v0.6"}
{"i": [["[\"isnan\", 15, 19, 18, 14]", "cuda -keys=cuda,gpu -arch=sm_80 -max_num_threads=1024 -thread_warp_size=32", [-1, 16, 64, 49152, 2147483647, 1024, 8, 32], "", 0, []], [[], [["FU", 1, [0, 1, 2, 3]], ["SP", 1, 0, 71820, [9], 1], ["AN", 1, 0, 5], ["AN", 1, 1, 6]]]], "r": [[1.88546e-05], 0, 0.909838, 1721408730], "v": "v0.6"}
{"i": [["[\"isnan\", 15, 19, 18, 14]", "cuda -keys=cuda,gpu -arch=sm_80 -max_num_threads=1024 -thread_warp_size=32", [-1, 16, 64, 49152, 2147483647, 1024, 8, 32], "", 0, []], [[], [["FU", 1, [0, 1, 2, 3]], ["SP", 1, 0, 71820, [14], 1], ["AN", 1, 0, 5], ["AN", 1, 1, 6]]]], "r": [[1.40658e-05], 0, 1.05918, 1721408731], "v": "v0.6"}
{"i": [["[\"isnan\", 15, 19, 18, 14]", "cuda -keys=cuda,gpu -arch=sm_80 -max_num_threads=1024 -thread_warp_size=32", [-1, 16, 64, 49152, 2147483647, 1024, 8, 32], "", 0, []], [[], [["FU", 1, [0, 1, 2, 3]], ["SP", 1, 0, 71820, [12], 1], ["AN", 1, 0, 5], ["AN", 1, 1, 6]]]], "r": [[1.53954e-05], 0, 0.981736, 1721408731], "v": "v0.6"}
