code_generation/generate/deprecated/deprecated_simple_v1.0/log/cuda/leaky_relu_cuda.log
{"i": [["[\"leaky_relu\", 3, 12, 18, 4]", "cuda -keys=cuda,gpu -arch=sm_80 -max_num_threads=1024 -thread_warp_size=32", [-1, 16, 64, 49152, 2147483647, 1024, 8, 32], "", 0, []], [[], [["FU", 1, [0, 1, 2, 3]], ["SP", 1, 0, 2592, [24], 1], ["AN", 1, 0, 5], ["AN", 1, 1, 6]]]], "r": [[5.73695e-06], 0, 1.10388, 1721417036], "v": "v0.6"}
{"i": [["[\"leaky_relu\", 3, 12, 18, 4]", "cuda -keys=cuda,gpu -arch=sm_80 -max_num_threads=1024 -thread_warp_size=32", [-1, 16, 64, 49152, 2147483647, 1024, 8, 32], "", 0, []], [[], [["FU", 1, [0, 1, 2, 3]], ["SP", 1, 0, 2592, [48], 1], ["AN", 1, 0, 5], ["AN", 1, 1, 6]]]], "r": [[7.5984e-06], 0, 1.27081, 1721417036], "v": "v0.6"}
{"i": [["[\"leaky_relu\", 3, 12, 18, 4]", "cuda -keys=cuda,gpu -arch=sm_80 -max_num_threads=1024 -thread_warp_size=32", [-1, 16, 64, 49152, 2147483647, 1024, 8, 32], "", 0, []], [[], [["FU", 1, [0, 1, 2, 3]], ["SP", 1, 0, 2592, [6], 1], ["AN", 1, 0, 5], ["AN", 1, 1, 6]]]], "r": [[6.95632e-06], 0, 0.914021, 1721417036], "v": "v0.6"}
{"i": [["[\"leaky_relu\", 3, 12, 18, 4]", "cuda -keys=cuda,gpu -arch=sm_80 -max_num_threads=1024 -thread_warp_size=32", [-1, 16, 64, 49152, 2147483647, 1024, 8, 32], "", 0, []], [[], [["FU", 1, [0, 1, 2, 3]], ["SP", 1, 0, 2592, [2], 1], ["AN", 1, 0, 5], ["AN", 1, 1, 6]]]], "r": [[8.26256e-06], 0, 1.04852, 1721417037], "v": "v0.6"}
{"i": [["[\"leaky_relu\", 3, 12, 18, 4]", "cuda -keys=cuda,gpu -arch=sm_80 -max_num_threads=1024 -thread_warp_size=32", [-1, 16, 64, 49152, 2147483647, 1024, 8, 32], "", 0, []], [[], [["FU", 1, [0, 1, 2, 3]], ["SP", 1, 0, 2592, [3], 1], ["AN", 1, 0, 5], ["AN", 1, 1, 6]]]], "r": [[9.39104e-06], 0, 1.57518, 1721417037], "v": "v0.6"}
{"i": [["[\"leaky_relu\", 3, 12, 18, 4]", "cuda -keys=cuda,gpu -arch=sm_80 -max_num_threads=1024 -thread_warp_size=32", [-1, 16, 64, 49152, 2147483647, 1024, 8, 32], "", 0, []], [[], [["FU", 1, [0, 1, 2, 3]], ["SP", 1, 0, 2592, [32], 1], ["AN", 1, 0, 5], ["AN", 1, 1, 6]]]], "r": [[6.40106e-06], 0, 1.03619, 1721417037], "v": "v0.6"}
{"i": [["[\"leaky_relu\", 3, 12, 18, 4]", "cuda -keys=cuda,gpu -arch=sm_80 -max_num_threads=1024 -thread_warp_size=32", [-1, 16, 64, 49152, 2147483647, 1024, 8, 32], "", 0, []], [[], [["FU", 1, [0, 1, 2, 3]], ["SP", 1, 0, 2592, [36], 1], ["AN", 1, 0, 5], ["AN", 1, 1, 6]]]], "r": [[5.91412e-06], 0, 0.943799, 1721417038], "v": "v0.6"}
{"i": [["[\"leaky_relu\", 3, 12, 18, 4]", "cuda -keys=cuda,gpu -arch=sm_80 -max_num_threads=1024 -thread_warp_size=32", [-1, 16, 64, 49152, 2147483647, 1024, 8, 32], "", 0, []], [[], [["FU", 1, [0, 1, 2, 3]], ["SP", 1, 0, 2592, [1], 1], ["AN", 1, 0, 5], ["AN", 1, 1, 6]]]], "r": [[9.61719e-06], 0, 1.02204, 1721417038], "v": "v0.6"}
{"i": [["[\"leaky_relu\", 3, 12, 18, 4]", "cuda -keys=cuda,gpu -arch=sm_80 -max_num_threads=1024 -thread_warp_size=32", [-1, 16, 64, 49152, 2147483647, 1024, 8, 32], "", 0, []], [[], [["FU", 1, [0, 1, 2, 3]], ["SP", 1, 0, 2592, [9], 1], ["AN", 1, 0, 5], ["AN", 1, 1, 6]]]], "r": [[9.53169e-06], 0, 1.32124, 1721417039], "v": "v0.6"}
{"i": [["[\"leaky_relu\", 3, 12, 18, 4]", "cuda -keys=cuda,gpu -arch=sm_80 -max_num_threads=1024 -thread_warp_size=32", [-1, 16, 64, 49152, 2147483647, 1024, 8, 32], "", 0, []], [[], [["FU", 1, [0, 1, 2, 3]], ["SP", 1, 0, 2592, [18], 1], ["AN", 1, 0, 5], ["AN", 1, 1, 6]]]], "r": [[6.73906e-06], 0, 0.871906, 1721417039], "v": "v0.6"}
