code_generation/generate/deprecated/deprecated_simple_v1.0/log/cuda/log10_cuda.log
{"i": [["[\"log10\", 19, 11, 7, 19]", "cuda -keys=cuda,gpu -arch=sm_80 -max_num_threads=1024 -thread_warp_size=32", [-1, 16, 64, 49152, 2147483647, 1024, 8, 32], "", 0, []], [[], [["FU", 1, [0, 1, 2, 3]], ["SP", 1, 0, 27797, [16], 1], ["AN", 1, 0, 5], ["AN", 1, 1, 6]]]], "r": [[8.25614e-06], 0, 1.66127, 1721411713], "v": "v0.6"}
{"i": [["[\"log10\", 19, 11, 7, 19]", "cuda -keys=cuda,gpu -arch=sm_80 -max_num_threads=1024 -thread_warp_size=32", [-1, 16, 64, 49152, 2147483647, 1024, 8, 32], "", 0, []], [[], [["FU", 1, [0, 1, 2, 3]], ["SP", 1, 0, 27797, [2], 1], ["AN", 1, 0, 5], ["AN", 1, 1, 6]]]], "r": [[2.90263e-05], 0, 1.31111, 1721411713], "v": "v0.6"}
{"i": [["[\"log10\", 19, 11, 7, 19]", "cuda -keys=cuda,gpu -arch=sm_80 -max_num_threads=1024 -thread_warp_size=32", [-1, 16, 64, 49152, 2147483647, 1024, 8, 32], "", 0, []], [[], [["FU", 1, [0, 1, 2, 3]], ["SP", 1, 0, 27797, [51], 1], ["AN", 1, 0, 5], ["AN", 1, 1, 6]]]], "r": [[6.73883e-06], 0, 1.0952, 1721411713], "v": "v0.6"}
{"i": [["[\"log10\", 19, 11, 7, 19]", "cuda -keys=cuda,gpu -arch=sm_80 -max_num_threads=1024 -thread_warp_size=32", [-1, 16, 64, 49152, 2147483647, 1024, 8, 32], "", 0, []], [[], [["FU", 1, [0, 1, 2, 3]], ["SP", 1, 0, 27797, [19], 1], ["AN", 1, 0, 5], ["AN", 1, 1, 6]]]], "r": [[7.97014e-06], 0, 0.916364, 1721411714], "v": "v0.6"}
{"i": [["[\"log10\", 19, 11, 7, 19]", "cuda -keys=cuda,gpu -arch=sm_80 -max_num_threads=1024 -thread_warp_size=32", [-1, 16, 64, 49152, 2147483647, 1024, 8, 32], "", 0, []], [[], [["FU", 1, [0, 1, 2, 3]], ["SP", 1, 0, 27797, [7], 1], ["AN", 1, 0, 5], ["AN", 1, 1, 6]]]], "r": [[1.21538e-05], 0, 1.12004, 1721411714], "v": "v0.6"}
{"i": [["[\"log10\", 19, 11, 7, 19]", "cuda -keys=cuda,gpu -arch=sm_80 -max_num_threads=1024 -thread_warp_size=32", [-1, 16, 64, 49152, 2147483647, 1024, 8, 32], "", 0, []], [[], [["FU", 1, [0, 1, 2, 3]], ["SP", 1, 0, 27797, [1], 1], ["AN", 1, 0, 5], ["AN", 1, 1, 6]]]], "r": [[5.20333e-05], 0, 0.936791, 1721411714], "v": "v0.6"}
{"i": [["[\"log10\", 19, 11, 7, 19]", "cuda -keys=cuda,gpu -arch=sm_80 -max_num_threads=1024 -thread_warp_size=32", [-1, 16, 64, 49152, 2147483647, 1024, 8, 32], "", 0, []], [[], [["FU", 1, [0, 1, 2, 3]], ["SP", 1, 0, 27797, [64], 1], ["AN", 1, 0, 5], ["AN", 1, 1, 6]]]], "r": [[6.6754e-06], 0, 1.14663, 1721411715], "v": "v0.6"}
{"i": [["[\"log10\", 19, 11, 7, 19]", "cuda -keys=cuda,gpu -arch=sm_80 -max_num_threads=1024 -thread_warp_size=32", [-1, 16, 64, 49152, 2147483647, 1024, 8, 32], "", 0, []], [[], [["FU", 1, [0, 1, 2, 3]], ["SP", 1, 0, 27797, [11], 1], ["AN", 1, 0, 5], ["AN", 1, 1, 6]]]], "r": [[1.00609e-05], 0, 1.19536, 1721411715], "v": "v0.6"}
{"i": [["[\"log10\", 19, 11, 7, 19]", "cuda -keys=cuda,gpu -arch=sm_80 -max_num_threads=1024 -thread_warp_size=32", [-1, 16, 64, 49152, 2147483647, 1024, 8, 32], "", 0, []], [[], [["FU", 1, [0, 1, 2, 3]], ["SP", 1, 0, 27797, [12], 1], ["AN", 1, 0, 5], ["AN", 1, 1, 6]]]], "r": [[9.77506e-06], 0, 1.2928, 1721411715], "v": "v0.6"}
{"i": [["[\"log10\", 19, 11, 7, 19]", "cuda -keys=cuda,gpu -arch=sm_80 -max_num_threads=1024 -thread_warp_size=32", [-1, 16, 64, 49152, 2147483647, 1024, 8, 32], "", 0, []], [[], [["FU", 1, [0, 1, 2, 3]], ["SP", 1, 0, 27797, [3], 1], ["AN", 1, 0, 5], ["AN", 1, 1, 6]]]], "r": [[2.12231e-05], 0, 1.31723, 1721411716], "v": "v0.6"}
