code_generation/generate/deprecated/deprecated_simple_v1.0/log/cuda/log_softmax_cuda.log
{"i": [["[\"log_softmax\", 9, 9, 13, 19]", "cuda -keys=cuda,gpu -arch=sm_80 -max_num_threads=1024 -thread_warp_size=32", [-1, 16, 64, 49152, 2147483647, 1024, 8, 32], "", 0, []], [[], [["CHW", 3, "local"], ["CI", 3], ["FU", 4, [0, 1, 2, 3]], ["SP", 4, 0, 20007, [16], 1], ["AN", 4, 0, 5], ["AN", 4, 1, 6], ["FU", 2, [0, 1, 2]], ["SP", 2, 0, 1053, [2], 1], ["AN", 2, 0, 5], ["AN", 2, 1, 6], ["FU", 1, [0, 1, 2]], ["SP", 1, 0, 1053, [32], 1], ["AN", 1, 0, 5], ["AN", 1, 1, 6], ["PR", 1, 0, "auto_unroll_max_step$0"], ["PR", 2, 0, "auto_unroll_max_step$0"]]]], "r": [[2.29765e-05], 0, 2.51774, 1721419681], "v": "v0.6"}
{"i": [["[\"log_softmax\", 9, 9, 13, 19]", "cuda -keys=cuda,gpu -arch=sm_80 -max_num_threads=1024 -thread_warp_size=32", [-1, 16, 64, 49152, 2147483647, 1024, 8, 32], "", 0, []], [[], [["CHW", 3, "local"], ["CI", 3], ["FU", 4, [0, 1, 2, 3]], ["SP", 4, 0, 20007, [4], 1], ["AN", 4, 0, 5], ["AN", 4, 1, 6], ["FU", 2, [0, 1, 2]], ["SP", 2, 0, 1053, [32], 1], ["AN", 2, 0, 5], ["AN", 2, 1, 6], ["FU", 1, [0, 1, 2]], ["SP", 1, 0, 1053, [2], 1], ["AN", 1, 0, 5], ["AN", 1, 1, 6], ["PR", 1, 0, "auto_unroll_max_step$0"], ["PR", 2, 0, "auto_unroll_max_step$0"]]]], "r": [[2.70333e-05], 0, 1.53437, 1721419681], "v": "v0.6"}
{"i": [["[\"log_softmax\", 9, 9, 13, 19]", "cuda -keys=cuda,gpu -arch=sm_80 -max_num_threads=1024 -thread_warp_size=32", [-1, 16, 64, 49152, 2147483647, 1024, 8, 32], "", 0, []], [[], [["CHW", 3, "local"], ["CI", 3], ["FU", 4, [0, 1, 2, 3]], ["SP", 4, 0, 20007, [40], 1], ["AN", 4, 0, 5], ["AN", 4, 1, 6], ["FU", 2, [0, 1, 2]], ["SP", 2, 0, 1053, [32], 1], ["AN", 2, 0, 5], ["AN", 2, 1, 6], ["FU", 1, [0, 1, 2]], ["SP", 1, 0, 1053, [8], 1], ["AN", 1, 0, 5], ["AN", 1, 1, 6], ["PR", 1, 0, "auto_unroll_max_step$0"], ["PR", 2, 0, "auto_unroll_max_step$0"]]]], "r": [[1.95353e-05], 0, 1.79795, 1721419681], "v": "v0.6"}
{"i": [["[\"log_softmax\", 9, 9, 13, 19]", "cuda -keys=cuda,gpu -arch=sm_80 -max_num_threads=1024 -thread_warp_size=32", [-1, 16, 64, 49152, 2147483647, 1024, 8, 32], "", 0, []], [[], [["CHW", 3, "local"], ["CI", 3], ["FU", 4, [0, 1, 2, 3]], ["SP", 4, 0, 20007, [16], 1], ["AN", 4, 0, 5], ["AN", 4, 1, 6], ["FU", 2, [0, 1, 2]], ["SP", 2, 0, 1053, [64], 1], ["AN", 2, 0, 5], ["AN", 2, 1, 6], ["FU", 1, [0, 1, 2]], ["SP", 1, 0, 1053, [32], 1], ["AN", 1, 0, 5], ["AN", 1, 1, 6], ["PR", 1, 0, "auto_unroll_max_step$0"], ["PR", 2, 0, "auto_unroll_max_step$0"]]]], "r": [[2.04737e-05], 0, 1.54413, 1721419682], "v": "v0.6"}
{"i": [["[\"log_softmax\", 9, 9, 13, 19]", "cuda -keys=cuda,gpu -arch=sm_80 -max_num_threads=1024 -thread_warp_size=32", [-1, 16, 64, 49152, 2147483647, 1024, 8, 32], "", 0, []], [[], [["CHW", 3, "local"], ["CI", 3], ["FU", 4, [0, 1, 2, 3]], ["SP", 4, 0, 20007, [32], 1], ["AN", 4, 0, 5], ["AN", 4, 1, 6], ["FU", 2, [0, 1, 2]], ["SP", 2, 0, 1053, [32], 1], ["AN", 2, 0, 5], ["AN", 2, 1, 6], ["FU", 1, [0, 1, 2]], ["SP", 1, 0, 1053, [32], 1], ["AN", 1, 0, 5], ["AN", 1, 1, 6], ["PR", 1, 0, "auto_unroll_max_step$0"], ["PR", 2, 0, "auto_unroll_max_step$0"]]]], "r": [[2.09652e-05], 0, 1.18705, 1721419682], "v": "v0.6"}
{"i": [["[\"log_softmax\", 9, 9, 13, 19]", "cuda -keys=cuda,gpu -arch=sm_80 -max_num_threads=1024 -thread_warp_size=32", [-1, 16, 64, 49152, 2147483647, 1024, 8, 32], "", 0, []], [[], [["CHW", 3, "local"], ["CI", 3], ["FU", 4, [0, 1, 2, 3]], ["SP", 4, 0, 20007, [32], 1], ["AN", 4, 0, 5], ["AN", 4, 1, 6], ["FU", 2, [0, 1, 2]], ["SP", 2, 0, 1053, [32], 1], ["AN", 2, 0, 5], ["AN", 2, 1, 6], ["FU", 1, [0, 1, 2]], ["SP", 1, 0, 1053, [2], 1], ["AN", 1, 0, 5], ["AN", 1, 1, 6], ["PR", 1, 0, "auto_unroll_max_step$0"], ["PR", 2, 0, "auto_unroll_max_step$0"]]]], "r": [[2.20312e-05], 0, 1.41073, 1721419683], "v": "v0.6"}
{"i": [["[\"log_softmax\", 9, 9, 13, 19]", "cuda -keys=cuda,gpu -arch=sm_80 -max_num_threads=1024 -thread_warp_size=32", [-1, 16, 64, 49152, 2147483647, 1024, 8, 32], "", 0, []], [[], [["CHW", 3, "local"], ["CI", 3], ["FU", 4, [0, 1, 2, 3]], ["SP", 4, 0, 20007, [16], 1], ["AN", 4, 0, 5], ["AN", 4, 1, 6], ["FU", 2, [0, 1, 2]], ["SP", 2, 0, 1053, [32], 1], ["AN", 2, 0, 5], ["AN", 2, 1, 6], ["FU", 1, [0, 1, 2]], ["SP", 1, 0, 1053, [1], 1], ["AN", 1, 0, 5], ["AN", 1, 1, 6], ["PR", 1, 0, "auto_unroll_max_step$0"], ["PR", 2, 0, "auto_unroll_max_step$0"]]]], "r": [[2.16536e-05], 0, 1.42225, 1721419683], "v": "v0.6"}
{"i": [["[\"log_softmax\", 9, 9, 13, 19]", "cuda -keys=cuda,gpu -arch=sm_80 -max_num_threads=1024 -thread_warp_size=32", [-1, 16, 64, 49152, 2147483647, 1024, 8, 32], "", 0, []], [[], [["CHW", 3, "local"], ["CI", 3], ["FU", 4, [0, 1, 2, 3]], ["SP", 4, 0, 20007, [8], 1], ["AN", 4, 0, 5], ["AN", 4, 1, 6], ["FU", 2, [0, 1, 2]], ["SP", 2, 0, 1053, [32], 1], ["AN", 2, 0, 5], ["AN", 2, 1, 6], ["FU", 1, [0, 1, 2]], ["SP", 1, 0, 1053, [64], 1], ["AN", 1, 0, 5], ["AN", 1, 1, 6], ["PR", 1, 0, "auto_unroll_max_step$0"], ["PR", 2, 0, "auto_unroll_max_step$0"]]]], "r": [[2.23029e-05], 0, 1.7958, 1721419683], "v": "v0.6"}
{"i": [["[\"log_softmax\", 9, 9, 13, 19]", "cuda -keys=cuda,gpu -arch=sm_80 -max_num_threads=1024 -thread_warp_size=32", [-1, 16, 64, 49152, 2147483647, 1024, 8, 32], "", 0, []], [[], [["CHW", 3, "local"], ["CI", 3], ["FU", 4, [0, 1, 2, 3]], ["SP", 4, 0, 20007, [12], 1], ["AN", 4, 0, 5], ["AN", 4, 1, 6], ["FU", 2, [0, 1, 2]], ["SP", 2, 0, 1053, [64], 1], ["AN", 2, 0, 5], ["AN", 2, 1, 6], ["FU", 1, [0, 1, 2]], ["SP", 1, 0, 1053, [32], 1], ["AN", 1, 0, 5], ["AN", 1, 1, 6], ["PR", 1, 0, "auto_unroll_max_step$0"], ["PR", 2, 0, "auto_unroll_max_step$0"]]]], "r": [[2.09926e-05], 0, 1.40045, 1721419684], "v": "v0.6"}
{"i": [["[\"log_softmax\", 9, 9, 13, 19]", "cuda -keys=cuda,gpu -arch=sm_80 -max_num_threads=1024 -thread_warp_size=32", [-1, 16, 64, 49152, 2147483647, 1024, 8, 32], "", 0, []], [[], [["CHW", 3, "local"], ["CI", 3], ["FU", 4, [0, 1, 2, 3]], ["SP", 4, 0, 20007, [2], 1], ["AN", 4, 0, 5], ["AN", 4, 1, 6], ["FU", 2, [0, 1, 2]], ["SP", 2, 0, 1053, [1], 1], ["AN", 2, 0, 5], ["AN", 2, 1, 6], ["FU", 1, [0, 1, 2]], ["SP", 1, 0, 1053, [2], 1], ["AN", 1, 0, 5], ["AN", 1, 1, 6], ["PR", 1, 0, "auto_unroll_max_step$0"], ["PR", 2, 0, "auto_unroll_max_step$0"]]]], "r": [[3.72743e-05], 0, 1.70647, 1721419684], "v": "v0.6"}
