code_generation/generate/deprecated/deprecated_simple_v1.0/log/cuda/lrn_cuda.log
{"i": [["[\"lrn\", 7, 1, 17, 10]", "cuda -keys=cuda,gpu -arch=sm_80 -max_num_threads=1024 -thread_warp_size=32", [-1, 16, 64, 49152, 2147483647, 1024, 8, 32], "", 0, []], [[], [["CI", 3], ["CI", 1], ["FU", 4, [0, 1, 2, 3]], ["SP", 4, 0, 1190, [12], 1], ["AN", 4, 0, 5], ["AN", 4, 1, 6], ["FU", 2, [0, 1, 2, 3]], ["SP", 2, 0, 1190, [16], 1], ["AN", 2, 0, 5], ["AN", 2, 1, 6], ["PR", 2, 0, "auto_unroll_max_step$0"]]]], "r": [[1.30091e-05], 0, 1.72517, 1721420332], "v": "v0.6"}
{"i": [["[\"lrn\", 7, 1, 17, 10]", "cuda -keys=cuda,gpu -arch=sm_80 -max_num_threads=1024 -thread_warp_size=32", [-1, 16, 64, 49152, 2147483647, 1024, 8, 32], "", 0, []], [[], [["CI", 3], ["CI", 1], ["FU", 4, [0, 1, 2, 3]], ["SP", 4, 0, 1190, [5], 1], ["AN", 4, 0, 5], ["AN", 4, 1, 6], ["FU", 2, [0, 1, 2, 3]], ["SP", 2, 0, 1190, [32], 1], ["AN", 2, 0, 5], ["AN", 2, 1, 6], ["PR", 2, 0, "auto_unroll_max_step$0"]]]], "r": [[1.54641e-05], 0, 1.06939, 1721420333], "v": "v0.6"}
{"i": [["[\"lrn\", 7, 1, 17, 10]", "cuda -keys=cuda,gpu -arch=sm_80 -max_num_threads=1024 -thread_warp_size=32", [-1, 16, 64, 49152, 2147483647, 1024, 8, 32], "", 0, []], [[], [["CI", 3], ["CI", 1], ["FU", 4, [0, 1, 2, 3]], ["SP", 4, 0, 1190, [16], 1], ["AN", 4, 0, 5], ["AN", 4, 1, 6], ["FU", 2, [0, 1, 2, 3]], ["SP", 2, 0, 1190, [1], 1], ["AN", 2, 0, 5], ["AN", 2, 1, 6], ["PR", 2, 0, "auto_unroll_max_step$0"]]]], "r": [[1.4061e-05], 0, 1.40044, 1721420333], "v": "v0.6"}
{"i": [["[\"lrn\", 7, 1, 17, 10]", "cuda -keys=cuda,gpu -arch=sm_80 -max_num_threads=1024 -thread_warp_size=32", [-1, 16, 64, 49152, 2147483647, 1024, 8, 32], "", 0, []], [[], [["CI", 3], ["CI", 1], ["FU", 4, [0, 1, 2, 3]], ["SP", 4, 0, 1190, [8], 1], ["AN", 4, 0, 5], ["AN", 4, 1, 6], ["FU", 2, [0, 1, 2, 3]], ["SP", 2, 0, 1190, [32], 1], ["AN", 2, 0, 5], ["AN", 2, 1, 6], ["PR", 2, 0, "auto_unroll_max_step$0"]]]], "r": [[1.42912e-05], 0, 1.33094, 1721420334], "v": "v0.6"}
{"i": [["[\"lrn\", 7, 1, 17, 10]", "cuda -keys=cuda,gpu -arch=sm_80 -max_num_threads=1024 -thread_warp_size=32", [-1, 16, 64, 49152, 2147483647, 1024, 8, 32], "", 0, []], [[], [["CI", 3], ["CI", 1], ["FU", 4, [0, 1, 2, 3]], ["SP", 4, 0, 1190, [34], 1], ["AN", 4, 0, 5], ["AN", 4, 1, 6], ["FU", 2, [0, 1, 2, 3]], ["SP", 2, 0, 1190, [32], 1], ["AN", 2, 0, 5], ["AN", 2, 1, 6], ["PR", 2, 0, "auto_unroll_max_step$0"]]]], "r": [[1.19082e-05], 0, 0.813513, 1721420334], "v": "v0.6"}
{"i": [["[\"lrn\", 7, 1, 17, 10]", "cuda -keys=cuda,gpu -arch=sm_80 -max_num_threads=1024 -thread_warp_size=32", [-1, 16, 64, 49152, 2147483647, 1024, 8, 32], "", 0, []], [[], [["CI", 3], ["CI", 1], ["FU", 4, [0, 1, 2, 3]], ["SP", 4, 0, 1190, [32], 1], ["AN", 4, 0, 5], ["AN", 4, 1, 6], ["FU", 2, [0, 1, 2, 3]], ["SP", 2, 0, 1190, [7], 1], ["AN", 2, 0, 5], ["AN", 2, 1, 6], ["PR", 2, 0, "auto_unroll_max_step$0"]]]], "r": [[1.24669e-05], 0, 1.15622, 1721420334], "v": "v0.6"}
{"i": [["[\"lrn\", 7, 1, 17, 10]", "cuda -keys=cuda,gpu -arch=sm_80 -max_num_threads=1024 -thread_warp_size=32", [-1, 16, 64, 49152, 2147483647, 1024, 8, 32], "", 0, []], [[], [["CI", 3], ["CI", 1], ["FU", 4, [0, 1, 2, 3]], ["SP", 4, 0, 1190, [34], 1], ["AN", 4, 0, 5], ["AN", 4, 1, 6], ["FU", 2, [0, 1, 2, 3]], ["SP", 2, 0, 1190, [34], 1], ["AN", 2, 0, 5], ["AN", 2, 1, 6], ["PR", 2, 0, "auto_unroll_max_step$0"]]]], "r": [[1.19321e-05], 0, 0.839948, 1721420334], "v": "v0.6"}
{"i": [["[\"lrn\", 7, 1, 17, 10]", "cuda -keys=cuda,gpu -arch=sm_80 -max_num_threads=1024 -thread_warp_size=32", [-1, 16, 64, 49152, 2147483647, 1024, 8, 32], "", 0, []], [[], [["CI", 3], ["CI", 1], ["FU", 4, [0, 1, 2, 3]], ["SP", 4, 0, 1190, [16], 1], ["AN", 4, 0, 5], ["AN", 4, 1, 6], ["FU", 2, [0, 1, 2, 3]], ["SP", 2, 0, 1190, [4], 1], ["AN", 2, 0, 5], ["AN", 2, 1, 6], ["PR", 2, 0, "auto_unroll_max_step$0"]]]], "r": [[1.28431e-05], 0, 1.12714, 1721420335], "v": "v0.6"}
{"i": [["[\"lrn\", 7, 1, 17, 10]", "cuda -keys=cuda,gpu -arch=sm_80 -max_num_threads=1024 -thread_warp_size=32", [-1, 16, 64, 49152, 2147483647, 1024, 8, 32], "", 0, []], [[], [["CI", 3], ["CI", 1], ["FU", 4, [0, 1, 2, 3]], ["SP", 4, 0, 1190, [34], 1], ["AN", 4, 0, 5], ["AN", 4, 1, 6], ["FU", 2, [0, 1, 2, 3]], ["SP", 2, 0, 1190, [10], 1], ["AN", 2, 0, 5], ["AN", 2, 1, 6], ["PR", 2, 0, "auto_unroll_max_step$0"]]]], "r": [[1.2417e-05], 0, 1.21423, 1721420335], "v": "v0.6"}
{"i": [["[\"lrn\", 7, 1, 17, 10]", "cuda -keys=cuda,gpu -arch=sm_80 -max_num_threads=1024 -thread_warp_size=32", [-1, 16, 64, 49152, 2147483647, 1024, 8, 32], "", 0, []], [[], [["CI", 3], ["CI", 1], ["FU", 4, [0, 1, 2, 3]], ["SP", 4, 0, 1190, [2], 1], ["AN", 4, 0, 5], ["AN", 4, 1, 6], ["FU", 2, [0, 1, 2, 3]], ["SP", 2, 0, 1190, [35], 1], ["AN", 2, 0, 5], ["AN", 2, 1, 6], ["PR", 2, 0, "auto_unroll_max_step$0"]]]], "r": [[1.3136e-05], 0, 1.137, 1721420335], "v": "v0.6"}
