code_generation/generate/deprecated/deprecated_simple_v1.0/log/cuda/mirror_pad_cuda.log
{"i": [["[\"mirror_pad\", 14, 16, 2, 6]", "cuda -keys=cuda,gpu -arch=sm_80 -max_num_threads=1024 -thread_warp_size=32", [-1, 16, 64, 49152, 2147483647, 1024, 8, 32], "", 0, []], [[], [["FU", 1, [0, 1]], ["SP", 1, 0, 45, [45], 1], ["AN", 1, 0, 5], ["AN", 1, 1, 6]]]], "r": [[4.17022e-05], 0, 2.47494, 1721422793], "v": "v0.6"}
{"i": [["[\"mirror_pad\", 14, 16, 2, 6]", "cuda -keys=cuda,gpu -arch=sm_80 -max_num_threads=1024 -thread_warp_size=32", [-1, 16, 64, 49152, 2147483647, 1024, 8, 32], "", 0, []], [[], [["FU", 1, [0, 1]], ["SP", 1, 0, 45, [15], 1], ["AN", 1, 0, 5], ["AN", 1, 1, 6]]]], "r": [[5.33484e-06], 0, 1.19758, 1721422794], "v": "v0.6"}
{"i": [["[\"mirror_pad\", 14, 16, 2, 6]", "cuda -keys=cuda,gpu -arch=sm_80 -max_num_threads=1024 -thread_warp_size=32", [-1, 16, 64, 49152, 2147483647, 1024, 8, 32], "", 0, []], [[], [["FU", 1, [0, 1]], ["SP", 1, 0, 45, [4], 1], ["AN", 1, 0, 5], ["AN", 1, 1, 6]]]], "r": [[6.04777e-06], 0, 1.28373, 1721422794], "v": "v0.6"}
{"i": [["[\"mirror_pad\", 14, 16, 2, 6]", "cuda -keys=cuda,gpu -arch=sm_80 -max_num_threads=1024 -thread_warp_size=32", [-1, 16, 64, 49152, 2147483647, 1024, 8, 32], "", 0, []], [[], [["FU", 1, [0, 1]], ["SP", 1, 0, 45, [1], 1], ["AN", 1, 0, 5], ["AN", 1, 1, 6]]]], "r": [[8.56213e-06], 0, 1.19795, 1721422795], "v": "v0.6"}
{"i": [["[\"mirror_pad\", 14, 16, 2, 6]", "cuda -keys=cuda,gpu -arch=sm_80 -max_num_threads=1024 -thread_warp_size=32", [-1, 16, 64, 49152, 2147483647, 1024, 8, 32], "", 0, []], [[], [["FU", 1, [0, 1]], ["SP", 1, 0, 45, [20], 1], ["AN", 1, 0, 5], ["AN", 1, 1, 6]]]], "r": [[6.90268e-06], 0, 1.06358, 1721422795], "v": "v0.6"}
{"i": [["[\"mirror_pad\", 14, 16, 2, 6]", "cuda -keys=cuda,gpu -arch=sm_80 -max_num_threads=1024 -thread_warp_size=32", [-1, 16, 64, 49152, 2147483647, 1024, 8, 32], "", 0, []], [[], [["FU", 1, [0, 1]], ["SP", 1, 0, 45, [11], 1], ["AN", 1, 0, 5], ["AN", 1, 1, 6]]]], "r": [[5.29481e-06], 0, 0.919354, 1721422795], "v": "v0.6"}
{"i": [["[\"mirror_pad\", 14, 16, 2, 6]", "cuda -keys=cuda,gpu -arch=sm_80 -max_num_threads=1024 -thread_warp_size=32", [-1, 16, 64, 49152, 2147483647, 1024, 8, 32], "", 0, []], [[], [["FU", 1, [0, 1]], ["SP", 1, 0, 45, [44], 1], ["AN", 1, 0, 5], ["AN", 1, 1, 6]]]], "r": [[7.76562e-06], 0, 1.35034, 1721422796], "v": "v0.6"}
{"i": [["[\"mirror_pad\", 14, 16, 2, 6]", "cuda -keys=cuda,gpu -arch=sm_80 -max_num_threads=1024 -thread_warp_size=32", [-1, 16, 64, 49152, 2147483647, 1024, 8, 32], "", 0, []], [[], [["FU", 1, [0, 1]], ["SP", 1, 0, 45, [22], 1], ["AN", 1, 0, 5], ["AN", 1, 1, 6]]]], "r": [[6.63522e-06], 0, 1.5172, 1721422796], "v": "v0.6"}
{"i": [["[\"mirror_pad\", 14, 16, 2, 6]", "cuda -keys=cuda,gpu -arch=sm_80 -max_num_threads=1024 -thread_warp_size=32", [-1, 16, 64, 49152, 2147483647, 1024, 8, 32], "", 0, []], [[], [["FU", 1, [0, 1]], ["SP", 1, 0, 45, [40], 1], ["AN", 1, 0, 5], ["AN", 1, 1, 6]]]], "r": [[8.17666e-06], 0, 1.18932, 1721422796], "v": "v0.6"}
{"i": [["[\"mirror_pad\", 14, 16, 2, 6]", "cuda -keys=cuda,gpu -arch=sm_80 -max_num_threads=1024 -thread_warp_size=32", [-1, 16, 64, 49152, 2147483647, 1024, 8, 32], "", 0, []], [[], [["FU", 1, [0, 1]], ["SP", 1, 0, 45, [10], 1], ["AN", 1, 0, 5], ["AN", 1, 1, 6]]]], "r": [[5.35987e-06], 0, 1.33086, 1721422797], "v": "v0.6"}
