code_generation/generate/deprecated/deprecated_simple_v1.0/log/cuda/multi_out_op_cuda.log
{"i": [["[\"multi_out_op\", 10, 6, 11, 7]", "cuda -keys=cuda,gpu -arch=sm_80 -max_num_threads=1024 -thread_warp_size=32", [-1, 16, 64, 49152, 2147483647, 1024, 8, 32], "", 0, []], [[], [["CI", 2], ["FU", 4, [0, 1, 2, 3]], ["SP", 4, 0, 4620, [64], 1], ["AN", 4, 0, 5], ["AN", 4, 1, 6], ["FU", 3, [0, 1, 2, 3]], ["SP", 3, 0, 4620, [22], 1], ["AN", 3, 0, 5], ["AN", 3, 1, 6]]]], "r": [[1.61013e-05], 0, 1.61657, 1721444788], "v": "v0.6"}
{"i": [["[\"multi_out_op\", 10, 6, 11, 7]", "cuda -keys=cuda,gpu -arch=sm_80 -max_num_threads=1024 -thread_warp_size=32", [-1, 16, 64, 49152, 2147483647, 1024, 8, 32], "", 0, []], [[], [["CI", 2], ["FU", 4, [0, 1, 2, 3]], ["SP", 4, 0, 4620, [1], 1], ["AN", 4, 0, 5], ["AN", 4, 1, 6], ["FU", 3, [0, 1, 2, 3]], ["SP", 3, 0, 4620, [64], 1], ["AN", 3, 0, 5], ["AN", 3, 1, 6]]]], "r": [[1.96723e-05], 0, 1.56, 1721444788], "v": "v0.6"}
{"i": [["[\"multi_out_op\", 10, 6, 11, 7]", "cuda -keys=cuda,gpu -arch=sm_80 -max_num_threads=1024 -thread_warp_size=32", [-1, 16, 64, 49152, 2147483647, 1024, 8, 32], "", 0, []], [[], [["CI", 2], ["FU", 4, [0, 1, 2, 3]], ["SP", 4, 0, 4620, [12], 1], ["AN", 4, 0, 5], ["AN", 4, 1, 6], ["FU", 3, [0, 1, 2, 3]], ["SP", 3, 0, 4620, [64], 1], ["AN", 3, 0, 5], ["AN", 3, 1, 6]]]], "r": [[1.53417e-05], 0, 1.36573, 1721444788], "v": "v0.6"}
{"i": [["[\"multi_out_op\", 10, 6, 11, 7]", "cuda -keys=cuda,gpu -arch=sm_80 -max_num_threads=1024 -thread_warp_size=32", [-1, 16, 64, 49152, 2147483647, 1024, 8, 32], "", 0, []], [[], [["CI", 2], ["FU", 4, [0, 1, 2, 3]], ["SP", 4, 0, 4620, [48], 1], ["AN", 4, 0, 5], ["AN", 4, 1, 6], ["FU", 3, [0, 1, 2, 3]], ["SP", 3, 0, 4620, [1], 1], ["AN", 3, 0, 5], ["AN", 3, 1, 6]]]], "r": [[1.9557e-05], 0, 1.39745, 1721444789], "v": "v0.6"}
{"i": [["[\"multi_out_op\", 10, 6, 11, 7]", "cuda -keys=cuda,gpu -arch=sm_80 -max_num_threads=1024 -thread_warp_size=32", [-1, 16, 64, 49152, 2147483647, 1024, 8, 32], "", 0, []], [[], [["CI", 2], ["FU", 4, [0, 1, 2, 3]], ["SP", 4, 0, 4620, [32], 1], ["AN", 4, 0, 5], ["AN", 4, 1, 6], ["FU", 3, [0, 1, 2, 3]], ["SP", 3, 0, 4620, [55], 1], ["AN", 3, 0, 5], ["AN", 3, 1, 6]]]], "r": [[1.14984e-05], 0, 1.38467, 1721444789], "v": "v0.6"}
{"i": [["[\"multi_out_op\", 10, 6, 11, 7]", "cuda -keys=cuda,gpu -arch=sm_80 -max_num_threads=1024 -thread_warp_size=32", [-1, 16, 64, 49152, 2147483647, 1024, 8, 32], "", 0, []], [[], [["CI", 2], ["FU", 4, [0, 1, 2, 3]], ["SP", 4, 0, 4620, [64], 1], ["AN", 4, 0, 5], ["AN", 4, 1, 6], ["FU", 3, [0, 1, 2, 3]], ["SP", 3, 0, 4620, [1], 1], ["AN", 3, 0, 5], ["AN", 3, 1, 6]]]], "r": [[1.9762e-05], 0, 1.12801, 1721444789], "v": "v0.6"}
{"i": [["[\"multi_out_op\", 10, 6, 11, 7]", "cuda -keys=cuda,gpu -arch=sm_80 -max_num_threads=1024 -thread_warp_size=32", [-1, 16, 64, 49152, 2147483647, 1024, 8, 32], "", 0, []], [[], [["CI", 2], ["FU", 4, [0, 1, 2, 3]], ["SP", 4, 0, 4620, [1], 1], ["AN", 4, 0, 5], ["AN", 4, 1, 6], ["FU", 3, [0, 1, 2, 3]], ["SP", 3, 0, 4620, [21], 1], ["AN", 3, 0, 5], ["AN", 3, 1, 6]]]], "r": [[1.99913e-05], 0, 1.01247, 1721444790], "v": "v0.6"}
{"i": [["[\"multi_out_op\", 10, 6, 11, 7]", "cuda -keys=cuda,gpu -arch=sm_80 -max_num_threads=1024 -thread_warp_size=32", [-1, 16, 64, 49152, 2147483647, 1024, 8, 32], "", 0, []], [[], [["CI", 2], ["FU", 4, [0, 1, 2, 3]], ["SP", 4, 0, 4620, [20], 1], ["AN", 4, 0, 5], ["AN", 4, 1, 6], ["FU", 3, [0, 1, 2, 3]], ["SP", 3, 0, 4620, [1], 1], ["AN", 3, 0, 5], ["AN", 3, 1, 6]]]], "r": [[1.95764e-05], 0, 1.37663, 1721444790], "v": "v0.6"}
{"i": [["[\"multi_out_op\", 10, 6, 11, 7]", "cuda -keys=cuda,gpu -arch=sm_80 -max_num_threads=1024 -thread_warp_size=32", [-1, 16, 64, 49152, 2147483647, 1024, 8, 32], "", 0, []], [[], [["CI", 2], ["FU", 4, [0, 1, 2, 3]], ["SP", 4, 0, 4620, [15], 1], ["AN", 4, 0, 5], ["AN", 4, 1, 6], ["FU", 3, [0, 1, 2, 3]], ["SP", 3, 0, 4620, [1], 1], ["AN", 3, 0, 5], ["AN", 3, 1, 6]]]], "r": [[1.9991e-05], 0, 0.911521, 1721444790], "v": "v0.6"}
{"i": [["[\"multi_out_op\", 10, 6, 11, 7]", "cuda -keys=cuda,gpu -arch=sm_80 -max_num_threads=1024 -thread_warp_size=32", [-1, 16, 64, 49152, 2147483647, 1024, 8, 32], "", 0, []], [[], [["CI", 2], ["FU", 4, [0, 1, 2, 3]], ["SP", 4, 0, 4620, [6], 1], ["AN", 4, 0, 5], ["AN", 4, 1, 6], ["FU", 3, [0, 1, 2, 3]], ["SP", 3, 0, 4620, [64], 1], ["AN", 3, 0, 5], ["AN", 3, 1, 6]]]], "r": [[2.07534e-05], 0, 1.62401, 1721444791], "v": "v0.6"}
