code_generation/generate/deprecated/deprecated_simple_v1.0/log/cuda/negative_cuda.log
{"i": [["[\"negative\", 4, 9, 6, 10]", "cuda -keys=cuda,gpu -arch=sm_80 -max_num_threads=1024 -thread_warp_size=32", [-1, 16, 64, 49152, 2147483647, 1024, 8, 32], "", 0, []], [[], [["FU", 1, [0, 1, 2, 3]], ["SP", 1, 0, 2160, [36], 1], ["AN", 1, 0, 5], ["AN", 1, 1, 6]]]], "r": [[5.8822e-06], 0, 1.60434, 1721419882], "v": "v0.6"}
{"i": [["[\"negative\", 4, 9, 6, 10]", "cuda -keys=cuda,gpu -arch=sm_80 -max_num_threads=1024 -thread_warp_size=32", [-1, 16, 64, 49152, 2147483647, 1024, 8, 32], "", 0, []], [[], [["FU", 1, [0, 1, 2, 3]], ["SP", 1, 0, 2160, [45], 1], ["AN", 1, 0, 5], ["AN", 1, 1, 6]]]], "r": [[5.92487e-06], 0, 0.851357, 1721419882], "v": "v0.6"}
{"i": [["[\"negative\", 4, 9, 6, 10]", "cuda -keys=cuda,gpu -arch=sm_80 -max_num_threads=1024 -thread_warp_size=32", [-1, 16, 64, 49152, 2147483647, 1024, 8, 32], "", 0, []], [[], [["FU", 1, [0, 1, 2, 3]], ["SP", 1, 0, 2160, [8], 1], ["AN", 1, 0, 5], ["AN", 1, 1, 6]]]], "r": [[5.74068e-06], 0, 1.12803, 1721419882], "v": "v0.6"}
{"i": [["[\"negative\", 4, 9, 6, 10]", "cuda -keys=cuda,gpu -arch=sm_80 -max_num_threads=1024 -thread_warp_size=32", [-1, 16, 64, 49152, 2147483647, 1024, 8, 32], "", 0, []], [[], [["FU", 1, [0, 1, 2, 3]], ["SP", 1, 0, 2160, [2], 1], ["AN", 1, 0, 5], ["AN", 1, 1, 6]]]], "r": [[7.66212e-06], 0, 1.03129, 1721419883], "v": "v0.6"}
{"i": [["[\"negative\", 4, 9, 6, 10]", "cuda -keys=cuda,gpu -arch=sm_80 -max_num_threads=1024 -thread_warp_size=32", [-1, 16, 64, 49152, 2147483647, 1024, 8, 32], "", 0, []], [[], [["FU", 1, [0, 1, 2, 3]], ["SP", 1, 0, 2160, [3], 1], ["AN", 1, 0, 5], ["AN", 1, 1, 6]]]], "r": [[7.03862e-06], 0, 1.11898, 1721419883], "v": "v0.6"}
{"i": [["[\"negative\", 4, 9, 6, 10]", "cuda -keys=cuda,gpu -arch=sm_80 -max_num_threads=1024 -thread_warp_size=32", [-1, 16, 64, 49152, 2147483647, 1024, 8, 32], "", 0, []], [[], [["FU", 1, [0, 1, 2, 3]], ["SP", 1, 0, 2160, [54], 1], ["AN", 1, 0, 5], ["AN", 1, 1, 6]]]], "r": [[5.88388e-06], 0, 0.92215, 1721419883], "v": "v0.6"}
{"i": [["[\"negative\", 4, 9, 6, 10]", "cuda -keys=cuda,gpu -arch=sm_80 -max_num_threads=1024 -thread_warp_size=32", [-1, 16, 64, 49152, 2147483647, 1024, 8, 32], "", 0, []], [[], [["FU", 1, [0, 1, 2, 3]], ["SP", 1, 0, 2160, [5], 1], ["AN", 1, 0, 5], ["AN", 1, 1, 6]]]], "r": [[7.57559e-06], 0, 1.35937, 1721419883], "v": "v0.6"}
{"i": [["[\"negative\", 4, 9, 6, 10]", "cuda -keys=cuda,gpu -arch=sm_80 -max_num_threads=1024 -thread_warp_size=32", [-1, 16, 64, 49152, 2147483647, 1024, 8, 32], "", 0, []], [[], [["FU", 1, [0, 1, 2, 3]], ["SP", 1, 0, 2160, [24], 1], ["AN", 1, 0, 5], ["AN", 1, 1, 6]]]], "r": [[6.08587e-06], 0, 1.02051, 1721419884], "v": "v0.6"}
{"i": [["[\"negative\", 4, 9, 6, 10]", "cuda -keys=cuda,gpu -arch=sm_80 -max_num_threads=1024 -thread_warp_size=32", [-1, 16, 64, 49152, 2147483647, 1024, 8, 32], "", 0, []], [[], [["FU", 1, [0, 1, 2, 3]], ["SP", 1, 0, 2160, [1], 1], ["AN", 1, 0, 5], ["AN", 1, 1, 6]]]], "r": [[9.45979e-06], 0, 0.904326, 1721419884], "v": "v0.6"}
{"i": [["[\"negative\", 4, 9, 6, 10]", "cuda -keys=cuda,gpu -arch=sm_80 -max_num_threads=1024 -thread_warp_size=32", [-1, 16, 64, 49152, 2147483647, 1024, 8, 32], "", 0, []], [[], [["FU", 1, [0, 1, 2, 3]], ["SP", 1, 0, 2160, [18], 1], ["AN", 1, 0, 5], ["AN", 1, 1, 6]]]], "r": [[5.98919e-06], 0, 0.880508, 1721419884], "v": "v0.6"}
