code_generation/generate/deprecated/deprecated_simple_v1.0/log/cuda/pad_cuda.log
{"i": [["[\"pad\", 17, 12, 3, 20]", "cuda -keys=cuda,gpu -arch=sm_80 -max_num_threads=1024 -thread_warp_size=32", [-1, 16, 64, 49152, 2147483647, 1024, 8, 32], "", 0, []], [[], [["FU", 1, [0, 1]], ["SP", 1, 0, 138, [4], 1], ["AN", 1, 0, 5], ["AN", 1, 1, 6]]]], "r": [[5.60543e-06], 0, 1.33368, 1721425108], "v": "v0.6"}
{"i": [["[\"pad\", 17, 12, 3, 20]", "cuda -keys=cuda,gpu -arch=sm_80 -max_num_threads=1024 -thread_warp_size=32", [-1, 16, 64, 49152, 2147483647, 1024, 8, 32], "", 0, []], [[], [["FU", 1, [0, 1]], ["SP", 1, 0, 138, [2], 1], ["AN", 1, 0, 5], ["AN", 1, 1, 6]]]], "r": [[5.30005e-06], 0, 0.707135, 1721425108], "v": "v0.6"}
{"i": [["[\"pad\", 17, 12, 3, 20]", "cuda -keys=cuda,gpu -arch=sm_80 -max_num_threads=1024 -thread_warp_size=32", [-1, 16, 64, 49152, 2147483647, 1024, 8, 32], "", 0, []], [[], [["FU", 1, [0, 1]], ["SP", 1, 0, 138, [1], 1], ["AN", 1, 0, 5], ["AN", 1, 1, 6]]]], "r": [[7.07325e-06], 0, 0.775113, 1721425108], "v": "v0.6"}
{"i": [["[\"pad\", 17, 12, 3, 20]", "cuda -keys=cuda,gpu -arch=sm_80 -max_num_threads=1024 -thread_warp_size=32", [-1, 16, 64, 49152, 2147483647, 1024, 8, 32], "", 0, []], [[], [["FU", 1, [0, 1]], ["SP", 1, 0, 138, [46], 1], ["AN", 1, 0, 5], ["AN", 1, 1, 6]]]], "r": [[5.83112e-06], 0, 0.831003, 1721425109], "v": "v0.6"}
{"i": [["[\"pad\", 17, 12, 3, 20]", "cuda -keys=cuda,gpu -arch=sm_80 -max_num_threads=1024 -thread_warp_size=32", [-1, 16, 64, 49152, 2147483647, 1024, 8, 32], "", 0, []], [[], [["FU", 1, [0, 1]], ["SP", 1, 0, 138, [32], 1], ["AN", 1, 0, 5], ["AN", 1, 1, 6]]]], "r": [[5.34276e-06], 0, 0.862422, 1721425109], "v": "v0.6"}
{"i": [["[\"pad\", 17, 12, 3, 20]", "cuda -keys=cuda,gpu -arch=sm_80 -max_num_threads=1024 -thread_warp_size=32", [-1, 16, 64, 49152, 2147483647, 1024, 8, 32], "", 0, []], [[], [["FU", 1, [0, 1]], ["SP", 1, 0, 138, [64], 1], ["AN", 1, 0, 5], ["AN", 1, 1, 6]]]], "r": [[8.09532e-06], 0, 1.00163, 1721425109], "v": "v0.6"}
{"i": [["[\"pad\", 17, 12, 3, 20]", "cuda -keys=cuda,gpu -arch=sm_80 -max_num_threads=1024 -thread_warp_size=32", [-1, 16, 64, 49152, 2147483647, 1024, 8, 32], "", 0, []], [[], [["FU", 1, [0, 1]], ["SP", 1, 0, 138, [16], 1], ["AN", 1, 0, 5], ["AN", 1, 1, 6]]]], "r": [[5.3001e-06], 0, 0.671442, 1721425109], "v": "v0.6"}
{"i": [["[\"pad\", 17, 12, 3, 20]", "cuda -keys=cuda,gpu -arch=sm_80 -max_num_threads=1024 -thread_warp_size=32", [-1, 16, 64, 49152, 2147483647, 1024, 8, 32], "", 0, []], [[], [["FU", 1, [0, 1]], ["SP", 1, 0, 138, [23], 1], ["AN", 1, 0, 5], ["AN", 1, 1, 6]]]], "r": [[6.43297e-06], 0, 0.728488, 1721425110], "v": "v0.6"}
{"i": [["[\"pad\", 17, 12, 3, 20]", "cuda -keys=cuda,gpu -arch=sm_80 -max_num_threads=1024 -thread_warp_size=32", [-1, 16, 64, 49152, 2147483647, 1024, 8, 32], "", 0, []], [[], [["FU", 1, [0, 1]], ["SP", 1, 0, 138, [6], 1], ["AN", 1, 0, 5], ["AN", 1, 1, 6]]]], "r": [[6.67276e-06], 0, 1.03481, 1721425110], "v": "v0.6"}
{"i": [["[\"pad\", 17, 12, 3, 20]", "cuda -keys=cuda,gpu -arch=sm_80 -max_num_threads=1024 -thread_warp_size=32", [-1, 16, 64, 49152, 2147483647, 1024, 8, 32], "", 0, []], [[], [["FU", 1, [0, 1]], ["SP", 1, 0, 138, [8], 1], ["AN", 1, 0, 5], ["AN", 1, 1, 6]]]], "r": [[8.22115e-06], 0, 0.899036, 1721425110], "v": "v0.6"}
