code_generation/generate/deprecated/deprecated_simple_v1.0/log/cuda/pool2d_cuda.log
{"i": [["[\"pool2d\", 9, 3, 11, 12]", "cuda -keys=cuda,gpu -arch=sm_80 -max_num_threads=1024 -thread_warp_size=32", [-1, 16, 64, 49152, 2147483647, 1024, 8, 32], "", 0, []], [[], [["CI", 1], ["FU", 2, [0, 1, 2, 3]], ["SP", 2, 0, 2916, [28], 1], ["AN", 2, 0, 5], ["AN", 2, 1, 6], ["PR", 2, 0, "auto_unroll_max_step$0"]]]], "r": [[7.55383e-06], 0, 1.62973, 1721430003], "v": "v0.6"}
{"i": [["[\"pool2d\", 9, 3, 11, 12]", "cuda -keys=cuda,gpu -arch=sm_80 -max_num_threads=1024 -thread_warp_size=32", [-1, 16, 64, 49152, 2147483647, 1024, 8, 32], "", 0, []], [[], [["CI", 1], ["FU", 2, [0, 1, 2, 3]], ["SP", 2, 0, 2916, [12], 1], ["AN", 2, 0, 5], ["AN", 2, 1, 6], ["PR", 2, 0, "auto_unroll_max_step$0"]]]], "r": [[6.49891e-06], 0, 1.16103, 1721430003], "v": "v0.6"}
{"i": [["[\"pool2d\", 9, 3, 11, 12]", "cuda -keys=cuda,gpu -arch=sm_80 -max_num_threads=1024 -thread_warp_size=32", [-1, 16, 64, 49152, 2147483647, 1024, 8, 32], "", 0, []], [[], [["CI", 1], ["FU", 2, [0, 1, 2, 3]], ["SP", 2, 0, 2916, [2], 1], ["AN", 2, 0, 5], ["AN", 2, 1, 6], ["PR", 2, 0, "auto_unroll_max_step$0"]]]], "r": [[9.442e-06], 0, 1.2266, 1721430004], "v": "v0.6"}
{"i": [["[\"pool2d\", 9, 3, 11, 12]", "cuda -keys=cuda,gpu -arch=sm_80 -max_num_threads=1024 -thread_warp_size=32", [-1, 16, 64, 49152, 2147483647, 1024, 8, 32], "", 0, []], [[], [["CI", 1], ["FU", 2, [0, 1, 2, 3]], ["SP", 2, 0, 2916, [16], 1], ["AN", 2, 0, 5], ["AN", 2, 1, 6], ["PR", 2, 0, "auto_unroll_max_step$0"]]]], "r": [[7.53342e-06], 0, 0.945805, 1721430004], "v": "v0.6"}
{"i": [["[\"pool2d\", 9, 3, 11, 12]", "cuda -keys=cuda,gpu -arch=sm_80 -max_num_threads=1024 -thread_warp_size=32", [-1, 16, 64, 49152, 2147483647, 1024, 8, 32], "", 0, []], [[], [["CI", 1], ["FU", 2, [0, 1, 2, 3]], ["SP", 2, 0, 2916, [3], 1], ["AN", 2, 0, 5], ["AN", 2, 1, 6], ["PR", 2, 0, "auto_unroll_max_step$0"]]]], "r": [[8.7624e-06], 0, 1.19827, 1721430004], "v": "v0.6"}
{"i": [["[\"pool2d\", 9, 3, 11, 12]", "cuda -keys=cuda,gpu -arch=sm_80 -max_num_threads=1024 -thread_warp_size=32", [-1, 16, 64, 49152, 2147483647, 1024, 8, 32], "", 0, []], [[], [["CI", 1], ["FU", 2, [0, 1, 2, 3]], ["SP", 2, 0, 2916, [36], 1], ["AN", 2, 0, 5], ["AN", 2, 1, 6], ["PR", 2, 0, "auto_unroll_max_step$0"]]]], "r": [[8.09373e-06], 0, 1.00889, 1721430005], "v": "v0.6"}
{"i": [["[\"pool2d\", 9, 3, 11, 12]", "cuda -keys=cuda,gpu -arch=sm_80 -max_num_threads=1024 -thread_warp_size=32", [-1, 16, 64, 49152, 2147483647, 1024, 8, 32], "", 0, []], [[], [["CI", 1], ["FU", 2, [0, 1, 2, 3]], ["SP", 2, 0, 2916, [7], 1], ["AN", 2, 0, 5], ["AN", 2, 1, 6], ["PR", 2, 0, "auto_unroll_max_step$0"]]]], "r": [[9.9621e-06], 0, 1.35192, 1721430005], "v": "v0.6"}
{"i": [["[\"pool2d\", 9, 3, 11, 12]", "cuda -keys=cuda,gpu -arch=sm_80 -max_num_threads=1024 -thread_warp_size=32", [-1, 16, 64, 49152, 2147483647, 1024, 8, 32], "", 0, []], [[], [["CI", 1], ["FU", 2, [0, 1, 2, 3]], ["SP", 2, 0, 2916, [56], 1], ["AN", 2, 0, 5], ["AN", 2, 1, 6], ["PR", 2, 0, "auto_unroll_max_step$0"]]]], "r": [[8.25438e-06], 0, 1.03851, 1721430006], "v": "v0.6"}
{"i": [["[\"pool2d\", 9, 3, 11, 12]", "cuda -keys=cuda,gpu -arch=sm_80 -max_num_threads=1024 -thread_warp_size=32", [-1, 16, 64, 49152, 2147483647, 1024, 8, 32], "", 0, []], [[], [["CI", 1], ["FU", 2, [0, 1, 2, 3]], ["SP", 2, 0, 2916, [32], 1], ["AN", 2, 0, 5], ["AN", 2, 1, 6], ["PR", 2, 0, "auto_unroll_max_step$0"]]]], "r": [[6.70285e-06], 0, 0.927162, 1721430006], "v": "v0.6"}
{"i": [["[\"pool2d\", 9, 3, 11, 12]", "cuda -keys=cuda,gpu -arch=sm_80 -max_num_threads=1024 -thread_warp_size=32", [-1, 16, 64, 49152, 2147483647, 1024, 8, 32], "", 0, []], [[], [["CI", 1], ["FU", 2, [0, 1, 2, 3]], ["SP", 2, 0, 2916, [54], 1], ["AN", 2, 0, 5], ["AN", 2, 1, 6], ["PR", 2, 0, "auto_unroll_max_step$0"]]]], "r": [[6.11767e-06], 0, 0.894901, 1721430006], "v": "v0.6"}
