code_generation/generate/deprecated/deprecated_simple_v1.0/log/cuda/pool3d_cuda.log
{"i": [["[\"pool3d\", 7, 2, 3, 14]", "cuda -keys=cuda,gpu -arch=sm_80 -max_num_threads=1024 -thread_warp_size=32", [-1, 16, 64, 49152, 2147483647, 1024, 8, 32], "", 0, []], [[], [["CI", 1], ["FU", 2, [0, 1, 2, 3, 4]], ["SP", 2, 0, 1568, [16], 1], ["AN", 2, 0, 5], ["AN", 2, 1, 6], ["PR", 2, 0, "auto_unroll_max_step$0"]]]], "r": [[6.35432e-06], 0, 1.46886, 1721433410], "v": "v0.6"}
{"i": [["[\"pool3d\", 7, 2, 3, 14]", "cuda -keys=cuda,gpu -arch=sm_80 -max_num_threads=1024 -thread_warp_size=32", [-1, 16, 64, 49152, 2147483647, 1024, 8, 32], "", 0, []], [[], [["CI", 1], ["FU", 2, [0, 1, 2, 3, 4]], ["SP", 2, 0, 1568, [28], 1], ["AN", 2, 0, 5], ["AN", 2, 1, 6], ["PR", 2, 0, "auto_unroll_max_step$0"]]]], "r": [[7.98396e-06], 0, 1.11469, 1721433411], "v": "v0.6"}
{"i": [["[\"pool3d\", 7, 2, 3, 14]", "cuda -keys=cuda,gpu -arch=sm_80 -max_num_threads=1024 -thread_warp_size=32", [-1, 16, 64, 49152, 2147483647, 1024, 8, 32], "", 0, []], [[], [["CI", 1], ["FU", 2, [0, 1, 2, 3, 4]], ["SP", 2, 0, 1568, [7], 1], ["AN", 2, 0, 5], ["AN", 2, 1, 6], ["PR", 2, 0, "auto_unroll_max_step$0"]]]], "r": [[7.33002e-06], 0, 1.10522, 1721433411], "v": "v0.6"}
{"i": [["[\"pool3d\", 7, 2, 3, 14]", "cuda -keys=cuda,gpu -arch=sm_80 -max_num_threads=1024 -thread_warp_size=32", [-1, 16, 64, 49152, 2147483647, 1024, 8, 32], "", 0, []], [[], [["CI", 1], ["FU", 2, [0, 1, 2, 3, 4]], ["SP", 2, 0, 1568, [8], 1], ["AN", 2, 0, 5], ["AN", 2, 1, 6], ["PR", 2, 0, "auto_unroll_max_step$0"]]]], "r": [[6.96245e-06], 0, 1.03436, 1721433411], "v": "v0.6"}
{"i": [["[\"pool3d\", 7, 2, 3, 14]", "cuda -keys=cuda,gpu -arch=sm_80 -max_num_threads=1024 -thread_warp_size=32", [-1, 16, 64, 49152, 2147483647, 1024, 8, 32], "", 0, []], [[], [["CI", 1], ["FU", 2, [0, 1, 2, 3, 4]], ["SP", 2, 0, 1568, [2], 1], ["AN", 2, 0, 5], ["AN", 2, 1, 6], ["PR", 2, 0, "auto_unroll_max_step$0"]]]], "r": [[8.37346e-06], 0, 1.10387, 1721433412], "v": "v0.6"}
{"i": [["[\"pool3d\", 7, 2, 3, 14]", "cuda -keys=cuda,gpu -arch=sm_80 -max_num_threads=1024 -thread_warp_size=32", [-1, 16, 64, 49152, 2147483647, 1024, 8, 32], "", 0, []], [[], [["CI", 1], ["FU", 2, [0, 1, 2, 3, 4]], ["SP", 2, 0, 1568, [14], 1], ["AN", 2, 0, 5], ["AN", 2, 1, 6], ["PR", 2, 0, "auto_unroll_max_step$0"]]]], "r": [[6.8451e-06], 0, 1.25431, 1721433412], "v": "v0.6"}
{"i": [["[\"pool3d\", 7, 2, 3, 14]", "cuda -keys=cuda,gpu -arch=sm_80 -max_num_threads=1024 -thread_warp_size=32", [-1, 16, 64, 49152, 2147483647, 1024, 8, 32], "", 0, []], [[], [["CI", 1], ["FU", 2, [0, 1, 2, 3, 4]], ["SP", 2, 0, 1568, [1], 1], ["AN", 2, 0, 5], ["AN", 2, 1, 6], ["PR", 2, 0, "auto_unroll_max_step$0"]]]], "r": [[9.23932e-06], 0, 1.10655, 1721433412], "v": "v0.6"}
{"i": [["[\"pool3d\", 7, 2, 3, 14]", "cuda -keys=cuda,gpu -arch=sm_80 -max_num_threads=1024 -thread_warp_size=32", [-1, 16, 64, 49152, 2147483647, 1024, 8, 32], "", 0, []], [[], [["CI", 1], ["FU", 2, [0, 1, 2, 3, 4]], ["SP", 2, 0, 1568, [4], 1], ["AN", 2, 0, 5], ["AN", 2, 1, 6], ["PR", 2, 0, "auto_unroll_max_step$0"]]]], "r": [[7.54992e-06], 0, 1.15342, 1721433413], "v": "v0.6"}
{"i": [["[\"pool3d\", 7, 2, 3, 14]", "cuda -keys=cuda,gpu -arch=sm_80 -max_num_threads=1024 -thread_warp_size=32", [-1, 16, 64, 49152, 2147483647, 1024, 8, 32], "", 0, []], [[], [["CI", 1], ["FU", 2, [0, 1, 2, 3, 4]], ["SP", 2, 0, 1568, [56], 1], ["AN", 2, 0, 5], ["AN", 2, 1, 6], ["PR", 2, 0, "auto_unroll_max_step$0"]]]], "r": [[7.18145e-06], 0, 1.14981, 1721433413], "v": "v0.6"}
{"i": [["[\"pool3d\", 7, 2, 3, 14]", "cuda -keys=cuda,gpu -arch=sm_80 -max_num_threads=1024 -thread_warp_size=32", [-1, 16, 64, 49152, 2147483647, 1024, 8, 32], "", 0, []], [[], [["CI", 1], ["FU", 2, [0, 1, 2, 3, 4]], ["SP", 2, 0, 1568, [49], 1], ["AN", 2, 0, 5], ["AN", 2, 1, 6], ["PR", 2, 0, "auto_unroll_max_step$0"]]]], "r": [[6.49275e-06], 0, 1.18535, 1721433413], "v": "v0.6"}
