code_generation/generate/deprecated/deprecated_simple_v1.0/log/cuda/prelu_cuda.log
{"i": [["[\"prelu\", 3, 14, 3, 16]", "cuda -keys=cuda,gpu -arch=sm_80 -max_num_threads=1024 -thread_warp_size=32", [-1, 16, 64, 49152, 2147483647, 1024, 8, 32], "", 0, []], [[], [["FU", 2, [0, 1, 2, 3]], ["SP", 2, 0, 2016, [42], 1], ["AN", 2, 0, 5], ["AN", 2, 1, 6]]]], "r": [[5.99372e-06], 0, 1.67025, 1721438528], "v": "v0.6"}
{"i": [["[\"prelu\", 3, 14, 3, 16]", "cuda -keys=cuda,gpu -arch=sm_80 -max_num_threads=1024 -thread_warp_size=32", [-1, 16, 64, 49152, 2147483647, 1024, 8, 32], "", 0, []], [[], [["FU", 2, [0, 1, 2, 3]], ["SP", 2, 0, 2016, [7], 1], ["AN", 2, 0, 5], ["AN", 2, 1, 6]]]], "r": [[7.13038e-06], 0, 1.10724, 1721438528], "v": "v0.6"}
{"i": [["[\"prelu\", 3, 14, 3, 16]", "cuda -keys=cuda,gpu -arch=sm_80 -max_num_threads=1024 -thread_warp_size=32", [-1, 16, 64, 49152, 2147483647, 1024, 8, 32], "", 0, []], [[], [["FU", 2, [0, 1, 2, 3]], ["SP", 2, 0, 2016, [48], 1], ["AN", 2, 0, 5], ["AN", 2, 1, 6]]]], "r": [[8.62899e-06], 0, 1.29365, 1721438529], "v": "v0.6"}
{"i": [["[\"prelu\", 3, 14, 3, 16]", "cuda -keys=cuda,gpu -arch=sm_80 -max_num_threads=1024 -thread_warp_size=32", [-1, 16, 64, 49152, 2147483647, 1024, 8, 32], "", 0, []], [[], [["FU", 2, [0, 1, 2, 3]], ["SP", 2, 0, 2016, [21], 1], ["AN", 2, 0, 5], ["AN", 2, 1, 6]]]], "r": [[7.87362e-06], 0, 1.17686, 1721438529], "v": "v0.6"}
{"i": [["[\"prelu\", 3, 14, 3, 16]", "cuda -keys=cuda,gpu -arch=sm_80 -max_num_threads=1024 -thread_warp_size=32", [-1, 16, 64, 49152, 2147483647, 1024, 8, 32], "", 0, []], [[], [["FU", 2, [0, 1, 2, 3]], ["SP", 2, 0, 2016, [1], 1], ["AN", 2, 0, 5], ["AN", 2, 1, 6]]]], "r": [[8.84195e-06], 0, 1.17743, 1721438529], "v": "v0.6"}
{"i": [["[\"prelu\", 3, 14, 3, 16]", "cuda -keys=cuda,gpu -arch=sm_80 -max_num_threads=1024 -thread_warp_size=32", [-1, 16, 64, 49152, 2147483647, 1024, 8, 32], "", 0, []], [[], [["FU", 2, [0, 1, 2, 3]], ["SP", 2, 0, 2016, [12], 1], ["AN", 2, 0, 5], ["AN", 2, 1, 6]]]], "r": [[5.84584e-06], 0, 1.16718, 1721438530], "v": "v0.6"}
{"i": [["[\"prelu\", 3, 14, 3, 16]", "cuda -keys=cuda,gpu -arch=sm_80 -max_num_threads=1024 -thread_warp_size=32", [-1, 16, 64, 49152, 2147483647, 1024, 8, 32], "", 0, []], [[], [["FU", 2, [0, 1, 2, 3]], ["SP", 2, 0, 2016, [24], 1], ["AN", 2, 0, 5], ["AN", 2, 1, 6]]]], "r": [[5.86098e-06], 0, 1.18587, 1721438530], "v": "v0.6"}
{"i": [["[\"prelu\", 3, 14, 3, 16]", "cuda -keys=cuda,gpu -arch=sm_80 -max_num_threads=1024 -thread_warp_size=32", [-1, 16, 64, 49152, 2147483647, 1024, 8, 32], "", 0, []], [[], [["FU", 2, [0, 1, 2, 3]], ["SP", 2, 0, 2016, [2], 1], ["AN", 2, 0, 5], ["AN", 2, 1, 6]]]], "r": [[7.5702e-06], 0, 1.20498, 1721438530], "v": "v0.6"}
{"i": [["[\"prelu\", 3, 14, 3, 16]", "cuda -keys=cuda,gpu -arch=sm_80 -max_num_threads=1024 -thread_warp_size=32", [-1, 16, 64, 49152, 2147483647, 1024, 8, 32], "", 0, []], [[], [["FU", 2, [0, 1, 2, 3]], ["SP", 2, 0, 2016, [14], 1], ["AN", 2, 0, 5], ["AN", 2, 1, 6]]]], "r": [[6.92394e-06], 0, 1.14568, 1721438531], "v": "v0.6"}
{"i": [["[\"prelu\", 3, 14, 3, 16]", "cuda -keys=cuda,gpu -arch=sm_80 -max_num_threads=1024 -thread_warp_size=32", [-1, 16, 64, 49152, 2147483647, 1024, 8, 32], "", 0, []], [[], [["FU", 2, [0, 1, 2, 3]], ["SP", 2, 0, 2016, [3], 1], ["AN", 2, 0, 5], ["AN", 2, 1, 6]]]], "r": [[7.38276e-06], 0, 1.24813, 1721438531], "v": "v0.6"}
