code_generation/generate/deprecated/deprecated_simple_v1.0/log/cuda/relu_cuda.log
{"i": [["[\"relu\", 5, 5, 13, 12]", "cuda -keys=cuda,gpu -arch=sm_80 -max_num_threads=1024 -thread_warp_size=32", [-1, 16, 64, 49152, 2147483647, 1024, 8, 32], "", 0, []], [[], [["FU", 1, [0, 1, 2, 3]], ["SP", 1, 0, 3900, [1], 1], ["AN", 1, 0, 5], ["AN", 1, 1, 6]]]], "r": [[1.18815e-05], 0, 1.37846, 1721435691], "v": "v0.6"}
{"i": [["[\"relu\", 5, 5, 13, 12]", "cuda -keys=cuda,gpu -arch=sm_80 -max_num_threads=1024 -thread_warp_size=32", [-1, 16, 64, 49152, 2147483647, 1024, 8, 32], "", 0, []], [[], [["FU", 1, [0, 1, 2, 3]], ["SP", 1, 0, 3900, [2], 1], ["AN", 1, 0, 5], ["AN", 1, 1, 6]]]], "r": [[8.52699e-06], 0, 0.944609, 1721435691], "v": "v0.6"}
{"i": [["[\"relu\", 5, 5, 13, 12]", "cuda -keys=cuda,gpu -arch=sm_80 -max_num_threads=1024 -thread_warp_size=32", [-1, 16, 64, 49152, 2147483647, 1024, 8, 32], "", 0, []], [[], [["FU", 1, [0, 1, 2, 3]], ["SP", 1, 0, 3900, [10], 1], ["AN", 1, 0, 5], ["AN", 1, 1, 6]]]], "r": [[5.98107e-06], 0, 1.06411, 1721435691], "v": "v0.6"}
{"i": [["[\"relu\", 5, 5, 13, 12]", "cuda -keys=cuda,gpu -arch=sm_80 -max_num_threads=1024 -thread_warp_size=32", [-1, 16, 64, 49152, 2147483647, 1024, 8, 32], "", 0, []], [[], [["FU", 1, [0, 1, 2, 3]], ["SP", 1, 0, 3900, [6], 1], ["AN", 1, 0, 5], ["AN", 1, 1, 6]]]], "r": [[6.34821e-06], 0, 1.10933, 1721435692], "v": "v0.6"}
{"i": [["[\"relu\", 5, 5, 13, 12]", "cuda -keys=cuda,gpu -arch=sm_80 -max_num_threads=1024 -thread_warp_size=32", [-1, 16, 64, 49152, 2147483647, 1024, 8, 32], "", 0, []], [[], [["FU", 1, [0, 1, 2, 3]], ["SP", 1, 0, 3900, [20], 1], ["AN", 1, 0, 5], ["AN", 1, 1, 6]]]], "r": [[5.93161e-06], 0, 0.815927, 1721435692], "v": "v0.6"}
{"i": [["[\"relu\", 5, 5, 13, 12]", "cuda -keys=cuda,gpu -arch=sm_80 -max_num_threads=1024 -thread_warp_size=32", [-1, 16, 64, 49152, 2147483647, 1024, 8, 32], "", 0, []], [[], [["FU", 1, [0, 1, 2, 3]], ["SP", 1, 0, 3900, [13], 1], ["AN", 1, 0, 5], ["AN", 1, 1, 6]]]], "r": [[5.8669e-06], 0, 1.10451, 1721435692], "v": "v0.6"}
{"i": [["[\"relu\", 5, 5, 13, 12]", "cuda -keys=cuda,gpu -arch=sm_80 -max_num_threads=1024 -thread_warp_size=32", [-1, 16, 64, 49152, 2147483647, 1024, 8, 32], "", 0, []], [[], [["FU", 1, [0, 1, 2, 3]], ["SP", 1, 0, 3900, [12], 1], ["AN", 1, 0, 5], ["AN", 1, 1, 6]]]], "r": [[5.92628e-06], 0, 0.896996, 1721435692], "v": "v0.6"}
{"i": [["[\"relu\", 5, 5, 13, 12]", "cuda -keys=cuda,gpu -arch=sm_80 -max_num_threads=1024 -thread_warp_size=32", [-1, 16, 64, 49152, 2147483647, 1024, 8, 32], "", 0, []], [[], [["FU", 1, [0, 1, 2, 3]], ["SP", 1, 0, 3900, [24], 1], ["AN", 1, 0, 5], ["AN", 1, 1, 6]]]], "r": [[6.02535e-06], 0, 0.852962, 1721435692], "v": "v0.6"}
{"i": [["[\"relu\", 5, 5, 13, 12]", "cuda -keys=cuda,gpu -arch=sm_80 -max_num_threads=1024 -thread_warp_size=32", [-1, 16, 64, 49152, 2147483647, 1024, 8, 32], "", 0, []], [[], [["FU", 1, [0, 1, 2, 3]], ["SP", 1, 0, 3900, [25], 1], ["AN", 1, 0, 5], ["AN", 1, 1, 6]]]], "r": [[6.87663e-06], 0, 1.02119, 1721435693], "v": "v0.6"}
{"i": [["[\"relu\", 5, 5, 13, 12]", "cuda -keys=cuda,gpu -arch=sm_80 -max_num_threads=1024 -thread_warp_size=32", [-1, 16, 64, 49152, 2147483647, 1024, 8, 32], "", 0, []], [[], [["FU", 1, [0, 1, 2, 3]], ["SP", 1, 0, 3900, [26], 1], ["AN", 1, 0, 5], ["AN", 1, 1, 6]]]], "r": [[5.65257e-06], 0, 0.915256, 1721435693], "v": "v0.6"}
