code_generation/generate/deprecated/deprecated_simple_v1.0/log/cuda/rms_norm_cuda.log
{"i": [["[\"rms_norm\", 2, 5, 16, 20]", "cuda -keys=cuda,gpu -arch=sm_80 -max_num_threads=1024 -thread_warp_size=32", [-1, 16, 64, 49152, 2147483647, 1024, 8, 32], "", 0, []], [[], [["CI", 6], ["CI", 4], ["CI", 3], ["CI", 1], ["FU", 7, [0, 1, 2, 3]], ["SP", 7, 0, 3200, [10], 1], ["AN", 7, 0, 5], ["AN", 7, 1, 6], ["FU", 5, [0, 1, 2]], ["SP", 5, 0, 640, [64], 1], ["AN", 5, 0, 5], ["AN", 5, 1, 6], ["PR", 5, 0, "auto_unroll_max_step$0"]]]], "r": [[1.21658e-05], 0, 1.6336, 1721461506], "v": "v0.6"}
{"i": [["[\"rms_norm\", 2, 5, 16, 20]", "cuda -keys=cuda,gpu -arch=sm_80 -max_num_threads=1024 -thread_warp_size=32", [-1, 16, 64, 49152, 2147483647, 1024, 8, 32], "", 0, []], [[], [["CI", 6], ["CI", 4], ["CI", 3], ["CI", 1], ["FU", 7, [0, 1, 2, 3]], ["SP", 7, 0, 3200, [32], 1], ["AN", 7, 0, 5], ["AN", 7, 1, 6], ["FU", 5, [0, 1, 2]], ["SP", 5, 0, 640, [32], 1], ["AN", 5, 0, 5], ["AN", 5, 1, 6], ["PR", 5, 0, "auto_unroll_max_step$0"]]]], "r": [[1.5893e-05], 0, 1.18915, 1721461506], "v": "v0.6"}
{"i": [["[\"rms_norm\", 2, 5, 16, 20]", "cuda -keys=cuda,gpu -arch=sm_80 -max_num_threads=1024 -thread_warp_size=32", [-1, 16, 64, 49152, 2147483647, 1024, 8, 32], "", 0, []], [[], [["CI", 6], ["CI", 4], ["CI", 3], ["CI", 1], ["FU", 7, [0, 1, 2, 3]], ["SP", 7, 0, 3200, [2], 1], ["AN", 7, 0, 5], ["AN", 7, 1, 6], ["FU", 5, [0, 1, 2]], ["SP", 5, 0, 640, [16], 1], ["AN", 5, 0, 5], ["AN", 5, 1, 6], ["PR", 5, 0, "auto_unroll_max_step$0"]]]], "r": [[1.46438e-05], 0, 1.20264, 1721461506], "v": "v0.6"}
{"i": [["[\"rms_norm\", 2, 5, 16, 20]", "cuda -keys=cuda,gpu -arch=sm_80 -max_num_threads=1024 -thread_warp_size=32", [-1, 16, 64, 49152, 2147483647, 1024, 8, 32], "", 0, []], [[], [["CI", 6], ["CI", 4], ["CI", 3], ["CI", 1], ["FU", 7, [0, 1, 2, 3]], ["SP", 7, 0, 3200, [64], 1], ["AN", 7, 0, 5], ["AN", 7, 1, 6], ["FU", 5, [0, 1, 2]], ["SP", 5, 0, 640, [10], 1], ["AN", 5, 0, 5], ["AN", 5, 1, 6], ["PR", 5, 0, "auto_unroll_max_step$0"]]]], "r": [[1.18074e-05], 0, 1.16152, 1721461507], "v": "v0.6"}
{"i": [["[\"rms_norm\", 2, 5, 16, 20]", "cuda -keys=cuda,gpu -arch=sm_80 -max_num_threads=1024 -thread_warp_size=32", [-1, 16, 64, 49152, 2147483647, 1024, 8, 32], "", 0, []], [[], [["CI", 6], ["CI", 4], ["CI", 3], ["CI", 1], ["FU", 7, [0, 1, 2, 3]], ["SP", 7, 0, 3200, [16], 1], ["AN", 7, 0, 5], ["AN", 7, 1, 6], ["FU", 5, [0, 1, 2]], ["SP", 5, 0, 640, [1], 1], ["AN", 5, 0, 5], ["AN", 5, 1, 6], ["PR", 5, 0, "auto_unroll_max_step$0"]]]], "r": [[1.34361e-05], 0, 1.44225, 1721461507], "v": "v0.6"}
{"i": [["[\"rms_norm\", 2, 5, 16, 20]", "cuda -keys=cuda,gpu -arch=sm_80 -max_num_threads=1024 -thread_warp_size=32", [-1, 16, 64, 49152, 2147483647, 1024, 8, 32], "", 0, []], [[], [["CI", 6], ["CI", 4], ["CI", 3], ["CI", 1], ["FU", 7, [0, 1, 2, 3]], ["SP", 7, 0, 3200, [1], 1], ["AN", 7, 0, 5], ["AN", 7, 1, 6], ["FU", 5, [0, 1, 2]], ["SP", 5, 0, 640, [64], 1], ["AN", 5, 0, 5], ["AN", 5, 1, 6], ["PR", 5, 0, "auto_unroll_max_step$0"]]]], "r": [[1.74921e-05], 0, 1.15759, 1721461507], "v": "v0.6"}
{"i": [["[\"rms_norm\", 2, 5, 16, 20]", "cuda -keys=cuda,gpu -arch=sm_80 -max_num_threads=1024 -thread_warp_size=32", [-1, 16, 64, 49152, 2147483647, 1024, 8, 32], "", 0, []], [[], [["CI", 6], ["CI", 4], ["CI", 3], ["CI", 1], ["FU", 7, [0, 1, 2, 3]], ["SP", 7, 0, 3200, [25], 1], ["AN", 7, 0, 5], ["AN", 7, 1, 6], ["FU", 5, [0, 1, 2]], ["SP", 5, 0, 640, [16], 1], ["AN", 5, 0, 5], ["AN", 5, 1, 6], ["PR", 5, 0, "auto_unroll_max_step$0"]]]], "r": [[1.22556e-05], 0, 1.33904, 1721461508], "v": "v0.6"}
{"i": [["[\"rms_norm\", 2, 5, 16, 20]", "cuda -keys=cuda,gpu -arch=sm_80 -max_num_threads=1024 -thread_warp_size=32", [-1, 16, 64, 49152, 2147483647, 1024, 8, 32], "", 0, []], [[], [["CI", 6], ["CI", 4], ["CI", 3], ["CI", 1], ["FU", 7, [0, 1, 2, 3]], ["SP", 7, 0, 3200, [64], 1], ["AN", 7, 0, 5], ["AN", 7, 1, 6], ["FU", 5, [0, 1, 2]], ["SP", 5, 0, 640, [64], 1], ["AN", 5, 0, 5], ["AN", 5, 1, 6], ["PR", 5, 0, "auto_unroll_max_step$0"]]]], "r": [[1.16084e-05], 0, 1.01906, 1721461508], "v": "v0.6"}
{"i": [["[\"rms_norm\", 2, 5, 16, 20]", "cuda -keys=cuda,gpu -arch=sm_80 -max_num_threads=1024 -thread_warp_size=32", [-1, 16, 64, 49152, 2147483647, 1024, 8, 32], "", 0, []], [[], [["CI", 6], ["CI", 4], ["CI", 3], ["CI", 1], ["FU", 7, [0, 1, 2, 3]], ["SP", 7, 0, 3200, [20], 1], ["AN", 7, 0, 5], ["AN", 7, 1, 6], ["FU", 5, [0, 1, 2]], ["SP", 5, 0, 640, [4], 1], ["AN", 5, 0, 5], ["AN", 5, 1, 6], ["PR", 5, 0, "auto_unroll_max_step$0"]]]], "r": [[1.81571e-05], 0, 1.4033, 1721461508], "v": "v0.6"}
{"i": [["[\"rms_norm\", 2, 5, 16, 20]", "cuda -keys=cuda,gpu -arch=sm_80 -max_num_threads=1024 -thread_warp_size=32", [-1, 16, 64, 49152, 2147483647, 1024, 8, 32], "", 0, []], [[], [["CI", 6], ["CI", 4], ["CI", 3], ["CI", 1], ["FU", 7, [0, 1, 2, 3]], ["SP", 7, 0, 3200, [40], 1], ["AN", 7, 0, 5], ["AN", 7, 1, 6], ["FU", 5, [0, 1, 2]], ["SP", 5, 0, 640, [1], 1], ["AN", 5, 0, 5], ["AN", 5, 1, 6], ["PR", 5, 0, "auto_unroll_max_step$0"]]]], "r": [[1.36334e-05], 0, 1.13352, 1721461509], "v": "v0.6"}
