code_generation/generate/deprecated/deprecated_simple_v1.0/log/cuda/round_cuda.log
{"i": [["[\"round\", 3, 16, 4, 15]", "cuda -keys=cuda,gpu -arch=sm_80 -max_num_threads=1024 -thread_warp_size=32", [-1, 16, 64, 49152, 2147483647, 1024, 8, 32], "", 0, []], [[], [["FU", 1, [0, 1, 2, 3]], ["SP", 1, 0, 2880, [2], 1], ["AN", 1, 0, 5], ["AN", 1, 1, 6]]]], "r": [[7.86352e-06], 0, 1.35898, 1721424449], "v": "v0.6"}
{"i": [["[\"round\", 3, 16, 4, 15]", "cuda -keys=cuda,gpu -arch=sm_80 -max_num_threads=1024 -thread_warp_size=32", [-1, 16, 64, 49152, 2147483647, 1024, 8, 32], "", 0, []], [[], [["FU", 1, [0, 1, 2, 3]], ["SP", 1, 0, 2880, [48], 1], ["AN", 1, 0, 5], ["AN", 1, 1, 6]]]], "r": [[6.38571e-06], 0, 1.1759, 1721424449], "v": "v0.6"}
{"i": [["[\"round\", 3, 16, 4, 15]", "cuda -keys=cuda,gpu -arch=sm_80 -max_num_threads=1024 -thread_warp_size=32", [-1, 16, 64, 49152, 2147483647, 1024, 8, 32], "", 0, []], [[], [["FU", 1, [0, 1, 2, 3]], ["SP", 1, 0, 2880, [36], 1], ["AN", 1, 0, 5], ["AN", 1, 1, 6]]]], "r": [[5.43355e-06], 0, 1.14046, 1721424450], "v": "v0.6"}
{"i": [["[\"round\", 3, 16, 4, 15]", "cuda -keys=cuda,gpu -arch=sm_80 -max_num_threads=1024 -thread_warp_size=32", [-1, 16, 64, 49152, 2147483647, 1024, 8, 32], "", 0, []], [[], [["FU", 1, [0, 1, 2, 3]], ["SP", 1, 0, 2880, [16], 1], ["AN", 1, 0, 5], ["AN", 1, 1, 6]]]], "r": [[6.90998e-06], 0, 0.987494, 1721424450], "v": "v0.6"}
{"i": [["[\"round\", 3, 16, 4, 15]", "cuda -keys=cuda,gpu -arch=sm_80 -max_num_threads=1024 -thread_warp_size=32", [-1, 16, 64, 49152, 2147483647, 1024, 8, 32], "", 0, []], [[], [["FU", 1, [0, 1, 2, 3]], ["SP", 1, 0, 2880, [10], 1], ["AN", 1, 0, 5], ["AN", 1, 1, 6]]]], "r": [[5.85939e-06], 0, 0.654056, 1721424450], "v": "v0.6"}
{"i": [["[\"round\", 3, 16, 4, 15]", "cuda -keys=cuda,gpu -arch=sm_80 -max_num_threads=1024 -thread_warp_size=32", [-1, 16, 64, 49152, 2147483647, 1024, 8, 32], "", 0, []], [[], [["FU", 1, [0, 1, 2, 3]], ["SP", 1, 0, 2880, [9], 1], ["AN", 1, 0, 5], ["AN", 1, 1, 6]]]], "r": [[6.06272e-06], 0, 1.0377, 1721424450], "v": "v0.6"}
{"i": [["[\"round\", 3, 16, 4, 15]", "cuda -keys=cuda,gpu -arch=sm_80 -max_num_threads=1024 -thread_warp_size=32", [-1, 16, 64, 49152, 2147483647, 1024, 8, 32], "", 0, []], [[], [["FU", 1, [0, 1, 2, 3]], ["SP", 1, 0, 2880, [32], 1], ["AN", 1, 0, 5], ["AN", 1, 1, 6]]]], "r": [[5.74057e-06], 0, 1.02996, 1721424451], "v": "v0.6"}
{"i": [["[\"round\", 3, 16, 4, 15]", "cuda -keys=cuda,gpu -arch=sm_80 -max_num_threads=1024 -thread_warp_size=32", [-1, 16, 64, 49152, 2147483647, 1024, 8, 32], "", 0, []], [[], [["FU", 1, [0, 1, 2, 3]], ["SP", 1, 0, 2880, [45], 1], ["AN", 1, 0, 5], ["AN", 1, 1, 6]]]], "r": [[5.8641e-06], 0, 1.12276, 1721424451], "v": "v0.6"}
{"i": [["[\"round\", 3, 16, 4, 15]", "cuda -keys=cuda,gpu -arch=sm_80 -max_num_threads=1024 -thread_warp_size=32", [-1, 16, 64, 49152, 2147483647, 1024, 8, 32], "", 0, []], [[], [["FU", 1, [0, 1, 2, 3]], ["SP", 1, 0, 2880, [8], 1], ["AN", 1, 0, 5], ["AN", 1, 1, 6]]]], "r": [[1.17638e-05], 0, 1.20543, 1721424451], "v": "v0.6"}
{"i": [["[\"round\", 3, 16, 4, 15]", "cuda -keys=cuda,gpu -arch=sm_80 -max_num_threads=1024 -thread_warp_size=32", [-1, 16, 64, 49152, 2147483647, 1024, 8, 32], "", 0, []], [[], [["FU", 1, [0, 1, 2, 3]], ["SP", 1, 0, 2880, [30], 1], ["AN", 1, 0, 5], ["AN", 1, 1, 6]]]], "r": [[5.3741e-06], 0, 1.07174, 1721424452], "v": "v0.6"}
