code_generation/generate/deprecated/deprecated_simple_v1.0/log/cuda/rsqrt_cuda.log
{"i": [["[\"rsqrt\", 20, 17, 16, 1]", "cuda -keys=cuda,gpu -arch=sm_80 -max_num_threads=1024 -thread_warp_size=32", [-1, 16, 64, 49152, 2147483647, 1024, 8, 32], "", 0, []], [[], [["FU", 1, [0, 1, 2, 3]], ["SP", 1, 0, 5440, [32], 1], ["AN", 1, 0, 5], ["AN", 1, 1, 6]]]], "r": [[5.85049e-06], 0, 1.26792, 1721425941], "v": "v0.6"}
{"i": [["[\"rsqrt\", 20, 17, 16, 1]", "cuda -keys=cuda,gpu -arch=sm_80 -max_num_threads=1024 -thread_warp_size=32", [-1, 16, 64, 49152, 2147483647, 1024, 8, 32], "", 0, []], [[], [["FU", 1, [0, 1, 2, 3]], ["SP", 1, 0, 5440, [1], 1], ["AN", 1, 0, 5], ["AN", 1, 1, 6]]]], "r": [[1.47689e-05], 0, 1.35268, 1721425942], "v": "v0.6"}
{"i": [["[\"rsqrt\", 20, 17, 16, 1]", "cuda -keys=cuda,gpu -arch=sm_80 -max_num_threads=1024 -thread_warp_size=32", [-1, 16, 64, 49152, 2147483647, 1024, 8, 32], "", 0, []], [[], [["FU", 1, [0, 1, 2, 3]], ["SP", 1, 0, 5440, [20], 1], ["AN", 1, 0, 5], ["AN", 1, 1, 6]]]], "r": [[5.87784e-06], 0, 1.28092, 1721425942], "v": "v0.6"}
{"i": [["[\"rsqrt\", 20, 17, 16, 1]", "cuda -keys=cuda,gpu -arch=sm_80 -max_num_threads=1024 -thread_warp_size=32", [-1, 16, 64, 49152, 2147483647, 1024, 8, 32], "", 0, []], [[], [["FU", 1, [0, 1, 2, 3]], ["SP", 1, 0, 5440, [40], 1], ["AN", 1, 0, 5], ["AN", 1, 1, 6]]]], "r": [[7.27868e-06], 0, 1.07977, 1721425942], "v": "v0.6"}
{"i": [["[\"rsqrt\", 20, 17, 16, 1]", "cuda -keys=cuda,gpu -arch=sm_80 -max_num_threads=1024 -thread_warp_size=32", [-1, 16, 64, 49152, 2147483647, 1024, 8, 32], "", 0, []], [[], [["FU", 1, [0, 1, 2, 3]], ["SP", 1, 0, 5440, [64], 1], ["AN", 1, 0, 5], ["AN", 1, 1, 6]]]], "r": [[7.44238e-06], 0, 1.00485, 1721425943], "v": "v0.6"}
{"i": [["[\"rsqrt\", 20, 17, 16, 1]", "cuda -keys=cuda,gpu -arch=sm_80 -max_num_threads=1024 -thread_warp_size=32", [-1, 16, 64, 49152, 2147483647, 1024, 8, 32], "", 0, []], [[], [["FU", 1, [0, 1, 2, 3]], ["SP", 1, 0, 5440, [34], 1], ["AN", 1, 0, 5], ["AN", 1, 1, 6]]]], "r": [[5.87759e-06], 0, 0.997985, 1721425943], "v": "v0.6"}
{"i": [["[\"rsqrt\", 20, 17, 16, 1]", "cuda -keys=cuda,gpu -arch=sm_80 -max_num_threads=1024 -thread_warp_size=32", [-1, 16, 64, 49152, 2147483647, 1024, 8, 32], "", 0, []], [[], [["FU", 1, [0, 1, 2, 3]], ["SP", 1, 0, 5440, [10], 1], ["AN", 1, 0, 5], ["AN", 1, 1, 6]]]], "r": [[6.36272e-06], 0, 1.04492, 1721425943], "v": "v0.6"}
{"i": [["[\"rsqrt\", 20, 17, 16, 1]", "cuda -keys=cuda,gpu -arch=sm_80 -max_num_threads=1024 -thread_warp_size=32", [-1, 16, 64, 49152, 2147483647, 1024, 8, 32], "", 0, []], [[], [["FU", 1, [0, 1, 2, 3]], ["SP", 1, 0, 5440, [16], 1], ["AN", 1, 0, 5], ["AN", 1, 1, 6]]]], "r": [[6.35916e-06], 0, 1.08316, 1721425944], "v": "v0.6"}
{"i": [["[\"rsqrt\", 20, 17, 16, 1]", "cuda -keys=cuda,gpu -arch=sm_80 -max_num_threads=1024 -thread_warp_size=32", [-1, 16, 64, 49152, 2147483647, 1024, 8, 32], "", 0, []], [[], [["FU", 1, [0, 1, 2, 3]], ["SP", 1, 0, 5440, [5], 1], ["AN", 1, 0, 5], ["AN", 1, 1, 6]]]], "r": [[8.07021e-06], 0, 1.24714, 1721425944], "v": "v0.6"}
{"i": [["[\"rsqrt\", 20, 17, 16, 1]", "cuda -keys=cuda,gpu -arch=sm_80 -max_num_threads=1024 -thread_warp_size=32", [-1, 16, 64, 49152, 2147483647, 1024, 8, 32], "", 0, []], [[], [["FU", 1, [0, 1, 2, 3]], ["SP", 1, 0, 5440, [8], 1], ["AN", 1, 0, 5], ["AN", 1, 1, 6]]]], "r": [[7.47627e-06], 0, 1.17172, 1721425944], "v": "v0.6"}
