code_generation/generate/deprecated/deprecated_simple_v1.0/log/cuda/scale_shift_nchwc_cuda.log
{"i": [["[\"scale_shift_nchwc\", 6, 11, 12, 12]", "cuda -keys=cuda,gpu -arch=sm_80 -max_num_threads=1024 -thread_warp_size=32", [-1, 16, 64, 49152, 2147483647, 1024, 8, 32], "", 0, []], [[], [["CHW", 3, "local"], ["CI", 3], ["FU", 4, [0, 1, 2, 3, 4]], ["SP", 4, 0, 19008, [18], 1], ["AN", 4, 0, 5], ["AN", 4, 1, 6]]]], "r": [[1.0641e-05], 0, 1.70783, 1721440743], "v": "v0.6"}
{"i": [["[\"scale_shift_nchwc\", 6, 11, 12, 12]", "cuda -keys=cuda,gpu -arch=sm_80 -max_num_threads=1024 -thread_warp_size=32", [-1, 16, 64, 49152, 2147483647, 1024, 8, 32], "", 0, []], [[], [["CHW", 3, "local"], ["CI", 3], ["FU", 4, [0, 1, 2, 3, 4]], ["SP", 4, 0, 19008, [12], 1], ["AN", 4, 0, 5], ["AN", 4, 1, 6]]]], "r": [[8.19992e-06], 0, 1.38016, 1721440744], "v": "v0.6"}
{"i": [["[\"scale_shift_nchwc\", 6, 11, 12, 12]", "cuda -keys=cuda,gpu -arch=sm_80 -max_num_threads=1024 -thread_warp_size=32", [-1, 16, 64, 49152, 2147483647, 1024, 8, 32], "", 0, []], [[], [["CHW", 3, "local"], ["CI", 3], ["FU", 4, [0, 1, 2, 3, 4]], ["SP", 4, 0, 19008, [4], 1], ["AN", 4, 0, 5], ["AN", 4, 1, 6]]]], "r": [[1.36915e-05], 0, 1.18421, 1721440744], "v": "v0.6"}
{"i": [["[\"scale_shift_nchwc\", 6, 11, 12, 12]", "cuda -keys=cuda,gpu -arch=sm_80 -max_num_threads=1024 -thread_warp_size=32", [-1, 16, 64, 49152, 2147483647, 1024, 8, 32], "", 0, []], [[], [["CHW", 3, "local"], ["CI", 3], ["FU", 4, [0, 1, 2, 3, 4]], ["SP", 4, 0, 19008, [11], 1], ["AN", 4, 0, 5], ["AN", 4, 1, 6]]]], "r": [[8.55067e-06], 0, 1.42585, 1721440744], "v": "v0.6"}
{"i": [["[\"scale_shift_nchwc\", 6, 11, 12, 12]", "cuda -keys=cuda,gpu -arch=sm_80 -max_num_threads=1024 -thread_warp_size=32", [-1, 16, 64, 49152, 2147483647, 1024, 8, 32], "", 0, []], [[], [["CHW", 3, "local"], ["CI", 3], ["FU", 4, [0, 1, 2, 3, 4]], ["SP", 4, 0, 19008, [48], 1], ["AN", 4, 0, 5], ["AN", 4, 1, 6]]]], "r": [[7.1959e-06], 0, 0.757401, 1721440745], "v": "v0.6"}
{"i": [["[\"scale_shift_nchwc\", 6, 11, 12, 12]", "cuda -keys=cuda,gpu -arch=sm_80 -max_num_threads=1024 -thread_warp_size=32", [-1, 16, 64, 49152, 2147483647, 1024, 8, 32], "", 0, []], [[], [["CHW", 3, "local"], ["CI", 3], ["FU", 4, [0, 1, 2, 3, 4]], ["SP", 4, 0, 19008, [36], 1], ["AN", 4, 0, 5], ["AN", 4, 1, 6]]]], "r": [[7.73782e-06], 0, 1.3872, 1721440745], "v": "v0.6"}
{"i": [["[\"scale_shift_nchwc\", 6, 11, 12, 12]", "cuda -keys=cuda,gpu -arch=sm_80 -max_num_threads=1024 -thread_warp_size=32", [-1, 16, 64, 49152, 2147483647, 1024, 8, 32], "", 0, []], [[], [["CHW", 3, "local"], ["CI", 3], ["FU", 4, [0, 1, 2, 3, 4]], ["SP", 4, 0, 19008, [64], 1], ["AN", 4, 0, 5], ["AN", 4, 1, 6]]]], "r": [[6.63337e-06], 0, 0.75817, 1721440745], "v": "v0.6"}
{"i": [["[\"scale_shift_nchwc\", 6, 11, 12, 12]", "cuda -keys=cuda,gpu -arch=sm_80 -max_num_threads=1024 -thread_warp_size=32", [-1, 16, 64, 49152, 2147483647, 1024, 8, 32], "", 0, []], [[], [["CHW", 3, "local"], ["CI", 3], ["FU", 4, [0, 1, 2, 3, 4]], ["SP", 4, 0, 19008, [6], 1], ["AN", 4, 0, 5], ["AN", 4, 1, 6]]]], "r": [[1.07801e-05], 0, 1.13311, 1721440746], "v": "v0.6"}
{"i": [["[\"scale_shift_nchwc\", 6, 11, 12, 12]", "cuda -keys=cuda,gpu -arch=sm_80 -max_num_threads=1024 -thread_warp_size=32", [-1, 16, 64, 49152, 2147483647, 1024, 8, 32], "", 0, []], [[], [["CHW", 3, "local"], ["CI", 3], ["FU", 4, [0, 1, 2, 3, 4]], ["SP", 4, 0, 19008, [16], 1], ["AN", 4, 0, 5], ["AN", 4, 1, 6]]]], "r": [[7.73821e-06], 0, 1.18923, 1721440746], "v": "v0.6"}
{"i": [["[\"scale_shift_nchwc\", 6, 11, 12, 12]", "cuda -keys=cuda,gpu -arch=sm_80 -max_num_threads=1024 -thread_warp_size=32", [-1, 16, 64, 49152, 2147483647, 1024, 8, 32], "", 0, []], [[], [["CHW", 3, "local"], ["CI", 3], ["FU", 4, [0, 1, 2, 3, 4]], ["SP", 4, 0, 19008, [27], 1], ["AN", 4, 0, 5], ["AN", 4, 1, 6]]]], "r": [[1.31393e-05], 0, 0.983047, 1721440746], "v": "v0.6"}
