code_generation/generate/deprecated/deprecated_simple_v1.0/log/cuda/scale_shift_nchw_cuda.log
{"i": [["[\"scale_shift_nchw\", 14, 9, 18, 13]", "cuda -keys=cuda,gpu -arch=sm_80 -max_num_threads=1024 -thread_warp_size=32", [-1, 16, 64, 49152, 2147483647, 1024, 8, 32], "", 0, []], [[], [["CHW", 3, "local"], ["CI", 3], ["FU", 4, [0, 1, 2, 3]], ["SP", 4, 0, 29484, [5], 1], ["AN", 4, 0, 5], ["AN", 4, 1, 6]]]], "r": [[1.57589e-05], 0, 1.6996, 1721437414], "v": "v0.6"}
{"i": [["[\"scale_shift_nchw\", 14, 9, 18, 13]", "cuda -keys=cuda,gpu -arch=sm_80 -max_num_threads=1024 -thread_warp_size=32", [-1, 16, 64, 49152, 2147483647, 1024, 8, 32], "", 0, []], [[], [["CHW", 3, "local"], ["CI", 3], ["FU", 4, [0, 1, 2, 3]], ["SP", 4, 0, 29484, [54], 1], ["AN", 4, 0, 5], ["AN", 4, 1, 6]]]], "r": [[7.55183e-06], 0, 1.43606, 1721437414], "v": "v0.6"}
{"i": [["[\"scale_shift_nchw\", 14, 9, 18, 13]", "cuda -keys=cuda,gpu -arch=sm_80 -max_num_threads=1024 -thread_warp_size=32", [-1, 16, 64, 49152, 2147483647, 1024, 8, 32], "", 0, []], [[], [["CHW", 3, "local"], ["CI", 3], ["FU", 4, [0, 1, 2, 3]], ["SP", 4, 0, 29484, [28], 1], ["AN", 4, 0, 5], ["AN", 4, 1, 6]]]], "r": [[7.68296e-06], 0, 1.41289, 1721437415], "v": "v0.6"}
{"i": [["[\"scale_shift_nchw\", 14, 9, 18, 13]", "cuda -keys=cuda,gpu -arch=sm_80 -max_num_threads=1024 -thread_warp_size=32", [-1, 16, 64, 49152, 2147483647, 1024, 8, 32], "", 0, []], [[], [["CHW", 3, "local"], ["CI", 3], ["FU", 4, [0, 1, 2, 3]], ["SP", 4, 0, 29484, [32], 1], ["AN", 4, 0, 5], ["AN", 4, 1, 6]]]], "r": [[7.967e-06], 0, 1.34111, 1721437415], "v": "v0.6"}
{"i": [["[\"scale_shift_nchw\", 14, 9, 18, 13]", "cuda -keys=cuda,gpu -arch=sm_80 -max_num_threads=1024 -thread_warp_size=32", [-1, 16, 64, 49152, 2147483647, 1024, 8, 32], "", 0, []], [[], [["CHW", 3, "local"], ["CI", 3], ["FU", 4, [0, 1, 2, 3]], ["SP", 4, 0, 29484, [26], 1], ["AN", 4, 0, 5], ["AN", 4, 1, 6]]]], "r": [[7.59132e-06], 0, 1.2636, 1721437415], "v": "v0.6"}
{"i": [["[\"scale_shift_nchw\", 14, 9, 18, 13]", "cuda -keys=cuda,gpu -arch=sm_80 -max_num_threads=1024 -thread_warp_size=32", [-1, 16, 64, 49152, 2147483647, 1024, 8, 32], "", 0, []], [[], [["CHW", 3, "local"], ["CI", 3], ["FU", 4, [0, 1, 2, 3]], ["SP", 4, 0, 29484, [10], 1], ["AN", 4, 0, 5], ["AN", 4, 1, 6]]]], "r": [[1.05963e-05], 0, 0.943328, 1721437416], "v": "v0.6"}
{"i": [["[\"scale_shift_nchw\", 14, 9, 18, 13]", "cuda -keys=cuda,gpu -arch=sm_80 -max_num_threads=1024 -thread_warp_size=32", [-1, 16, 64, 49152, 2147483647, 1024, 8, 32], "", 0, []], [[], [["CHW", 3, "local"], ["CI", 3], ["FU", 4, [0, 1, 2, 3]], ["SP", 4, 0, 29484, [21], 1], ["AN", 4, 0, 5], ["AN", 4, 1, 6]]]], "r": [[8.24857e-06], 0, 2.03115, 1721437417], "v": "v0.6"}
{"i": [["[\"scale_shift_nchw\", 14, 9, 18, 13]", "cuda -keys=cuda,gpu -arch=sm_80 -max_num_threads=1024 -thread_warp_size=32", [-1, 16, 64, 49152, 2147483647, 1024, 8, 32], "", 0, []], [[], [["CHW", 3, "local"], ["CI", 3], ["FU", 4, [0, 1, 2, 3]], ["SP", 4, 0, 29484, [52], 1], ["AN", 4, 0, 5], ["AN", 4, 1, 6]]]], "r": [[1.31252e-05], 0, 2.05563, 1721437418], "v": "v0.6"}
{"i": [["[\"scale_shift_nchw\", 14, 9, 18, 13]", "cuda -keys=cuda,gpu -arch=sm_80 -max_num_threads=1024 -thread_warp_size=32", [-1, 16, 64, 49152, 2147483647, 1024, 8, 32], "", 0, []], [[], [["CHW", 3, "local"], ["CI", 3], ["FU", 4, [0, 1, 2, 3]], ["SP", 4, 0, 29484, [48], 1], ["AN", 4, 0, 5], ["AN", 4, 1, 6]]]], "r": [[8.06086e-06], 0, 1.30772, 1721437419], "v": "v0.6"}
{"i": [["[\"scale_shift_nchw\", 14, 9, 18, 13]", "cuda -keys=cuda,gpu -arch=sm_80 -max_num_threads=1024 -thread_warp_size=32", [-1, 16, 64, 49152, 2147483647, 1024, 8, 32], "", 0, []], [[], [["CHW", 3, "local"], ["CI", 3], ["FU", 4, [0, 1, 2, 3]], ["SP", 4, 0, 29484, [20], 1], ["AN", 4, 0, 5], ["AN", 4, 1, 6]]]], "r": [[8.07401e-06], 0, 1.83822, 1721437420], "v": "v0.6"}
