code_generation/generate/deprecated/deprecated_simple_v1.0/log/cuda/sigmoid_cuda.log
{"i": [["[\"sigmoid\", 5, 7, 8, 19]", "cuda -keys=cuda,gpu -arch=sm_80 -max_num_threads=1024 -thread_warp_size=32", [-1, 16, 64, 49152, 2147483647, 1024, 8, 32], "", 0, []], [[], [["FU", 1, [0, 1, 2, 3]], ["SP", 1, 0, 5320, [56], 1], ["AN", 1, 0, 5], ["AN", 1, 1, 6]]]], "r": [[5.67958e-06], 0, 1.64153, 1721431011], "v": "v0.6"}
{"i": [["[\"sigmoid\", 5, 7, 8, 19]", "cuda -keys=cuda,gpu -arch=sm_80 -max_num_threads=1024 -thread_warp_size=32", [-1, 16, 64, 49152, 2147483647, 1024, 8, 32], "", 0, []], [[], [["FU", 1, [0, 1, 2, 3]], ["SP", 1, 0, 5320, [32], 1], ["AN", 1, 0, 5], ["AN", 1, 1, 6]]]], "r": [[5.67916e-06], 0, 0.849857, 1721431011], "v": "v0.6"}
{"i": [["[\"sigmoid\", 5, 7, 8, 19]", "cuda -keys=cuda,gpu -arch=sm_80 -max_num_threads=1024 -thread_warp_size=32", [-1, 16, 64, 49152, 2147483647, 1024, 8, 32], "", 0, []], [[], [["FU", 1, [0, 1, 2, 3]], ["SP", 1, 0, 5320, [40], 1], ["AN", 1, 0, 5], ["AN", 1, 1, 6]]]], "r": [[5.67933e-06], 0, 1.06703, 1721431011], "v": "v0.6"}
{"i": [["[\"sigmoid\", 5, 7, 8, 19]", "cuda -keys=cuda,gpu -arch=sm_80 -max_num_threads=1024 -thread_warp_size=32", [-1, 16, 64, 49152, 2147483647, 1024, 8, 32], "", 0, []], [[], [["FU", 1, [0, 1, 2, 3]], ["SP", 1, 0, 5320, [28], 1], ["AN", 1, 0, 5], ["AN", 1, 1, 6]]]], "r": [[5.71315e-06], 0, 0.727222, 1721431011], "v": "v0.6"}
{"i": [["[\"sigmoid\", 5, 7, 8, 19]", "cuda -keys=cuda,gpu -arch=sm_80 -max_num_threads=1024 -thread_warp_size=32", [-1, 16, 64, 49152, 2147483647, 1024, 8, 32], "", 0, []], [[], [["FU", 1, [0, 1, 2, 3]], ["SP", 1, 0, 5320, [14], 1], ["AN", 1, 0, 5], ["AN", 1, 1, 6]]]], "r": [[6.14773e-06], 0, 0.858251, 1721431012], "v": "v0.6"}
{"i": [["[\"sigmoid\", 5, 7, 8, 19]", "cuda -keys=cuda,gpu -arch=sm_80 -max_num_threads=1024 -thread_warp_size=32", [-1, 16, 64, 49152, 2147483647, 1024, 8, 32], "", 0, []], [[], [["FU", 1, [0, 1, 2, 3]], ["SP", 1, 0, 5320, [35], 1], ["AN", 1, 0, 5], ["AN", 1, 1, 6]]]], "r": [[7.73107e-06], 0, 1.25994, 1721431012], "v": "v0.6"}
{"i": [["[\"sigmoid\", 5, 7, 8, 19]", "cuda -keys=cuda,gpu -arch=sm_80 -max_num_threads=1024 -thread_warp_size=32", [-1, 16, 64, 49152, 2147483647, 1024, 8, 32], "", 0, []], [[], [["FU", 1, [0, 1, 2, 3]], ["SP", 1, 0, 5320, [7], 1], ["AN", 1, 0, 5], ["AN", 1, 1, 6]]]], "r": [[7.82589e-06], 0, 1.54139, 1721431012], "v": "v0.6"}
{"i": [["[\"sigmoid\", 5, 7, 8, 19]", "cuda -keys=cuda,gpu -arch=sm_80 -max_num_threads=1024 -thread_warp_size=32", [-1, 16, 64, 49152, 2147483647, 1024, 8, 32], "", 0, []], [[], [["FU", 1, [0, 1, 2, 3]], ["SP", 1, 0, 5320, [8], 1], ["AN", 1, 0, 5], ["AN", 1, 1, 6]]]], "r": [[1.24735e-05], 0, 1.11541, 1721431013], "v": "v0.6"}
{"i": [["[\"sigmoid\", 5, 7, 8, 19]", "cuda -keys=cuda,gpu -arch=sm_80 -max_num_threads=1024 -thread_warp_size=32", [-1, 16, 64, 49152, 2147483647, 1024, 8, 32], "", 0, []], [[], [["FU", 1, [0, 1, 2, 3]], ["SP", 1, 0, 5320, [38], 1], ["AN", 1, 0, 5], ["AN", 1, 1, 6]]]], "r": [[5.70528e-06], 0, 0.789707, 1721431013], "v": "v0.6"}
{"i": [["[\"sigmoid\", 5, 7, 8, 19]", "cuda -keys=cuda,gpu -arch=sm_80 -max_num_threads=1024 -thread_warp_size=32", [-1, 16, 64, 49152, 2147483647, 1024, 8, 32], "", 0, []], [[], [["FU", 1, [0, 1, 2, 3]], ["SP", 1, 0, 5320, [10], 1], ["AN", 1, 0, 5], ["AN", 1, 1, 6]]]], "r": [[6.37603e-06], 0, 0.988804, 1721431013], "v": "v0.6"}
