code_generation/generate/deprecated/deprecated_simple_v1.0/log/cuda/sign_cuda.log
{"i": [["[\"sign\", 6, 8, 1, 3]", "cuda -keys=cuda,gpu -arch=sm_80 -max_num_threads=1024 -thread_warp_size=32", [-1, 16, 64, 49152, 2147483647, 1024, 8, 32], "", 0, []], [[], [["FU", 1, [0, 1, 2, 3]], ["SP", 1, 0, 144, [64], 1], ["AN", 1, 0, 5], ["AN", 1, 1, 6]]]], "r": [[2.70969e-05], 0, 1.98503, 1721433619], "v": "v0.6"}
{"i": [["[\"sign\", 6, 8, 1, 3]", "cuda -keys=cuda,gpu -arch=sm_80 -max_num_threads=1024 -thread_warp_size=32", [-1, 16, 64, 49152, 2147483647, 1024, 8, 32], "", 0, []], [[], [["FU", 1, [0, 1, 2, 3]], ["SP", 1, 0, 144, [16], 1], ["AN", 1, 0, 5], ["AN", 1, 1, 6]]]], "r": [[7.50741e-06], 0, 1.36483, 1721433620], "v": "v0.6"}
{"i": [["[\"sign\", 6, 8, 1, 3]", "cuda -keys=cuda,gpu -arch=sm_80 -max_num_threads=1024 -thread_warp_size=32", [-1, 16, 64, 49152, 2147483647, 1024, 8, 32], "", 0, []], [[], [["FU", 1, [0, 1, 2, 3]], ["SP", 1, 0, 144, [18], 1], ["AN", 1, 0, 5], ["AN", 1, 1, 6]]]], "r": [[6.84925e-06], 0, 1.33606, 1721433620], "v": "v0.6"}
{"i": [["[\"sign\", 6, 8, 1, 3]", "cuda -keys=cuda,gpu -arch=sm_80 -max_num_threads=1024 -thread_warp_size=32", [-1, 16, 64, 49152, 2147483647, 1024, 8, 32], "", 0, []], [[], [["FU", 1, [0, 1, 2, 3]], ["SP", 1, 0, 144, [9], 1], ["AN", 1, 0, 5], ["AN", 1, 1, 6]]]], "r": [[8.88454e-06], 0, 1.25846, 1721433620], "v": "v0.6"}
{"i": [["[\"sign\", 6, 8, 1, 3]", "cuda -keys=cuda,gpu -arch=sm_80 -max_num_threads=1024 -thread_warp_size=32", [-1, 16, 64, 49152, 2147483647, 1024, 8, 32], "", 0, []], [[], [["FU", 1, [0, 1, 2, 3]], ["SP", 1, 0, 144, [8], 1], ["AN", 1, 0, 5], ["AN", 1, 1, 6]]]], "r": [[9.38179e-06], 0, 1.14725, 1721433621], "v": "v0.6"}
{"i": [["[\"sign\", 6, 8, 1, 3]", "cuda -keys=cuda,gpu -arch=sm_80 -max_num_threads=1024 -thread_warp_size=32", [-1, 16, 64, 49152, 2147483647, 1024, 8, 32], "", 0, []], [[], [["FU", 1, [0, 1, 2, 3]], ["SP", 1, 0, 144, [3], 1], ["AN", 1, 0, 5], ["AN", 1, 1, 6]]]], "r": [[9.01191e-06], 0, 1.15374, 1721433621], "v": "v0.6"}
{"i": [["[\"sign\", 6, 8, 1, 3]", "cuda -keys=cuda,gpu -arch=sm_80 -max_num_threads=1024 -thread_warp_size=32", [-1, 16, 64, 49152, 2147483647, 1024, 8, 32], "", 0, []], [[], [["FU", 1, [0, 1, 2, 3]], ["SP", 1, 0, 144, [24], 1], ["AN", 1, 0, 5], ["AN", 1, 1, 6]]]], "r": [[5.87625e-06], 0, 1.2322, 1721433622], "v": "v0.6"}
{"i": [["[\"sign\", 6, 8, 1, 3]", "cuda -keys=cuda,gpu -arch=sm_80 -max_num_threads=1024 -thread_warp_size=32", [-1, 16, 64, 49152, 2147483647, 1024, 8, 32], "", 0, []], [[], [["FU", 1, [0, 1, 2, 3]], ["SP", 1, 0, 144, [1], 1], ["AN", 1, 0, 5], ["AN", 1, 1, 6]]]], "r": [[8.42192e-06], 0, 1.17451, 1721433622], "v": "v0.6"}
{"i": [["[\"sign\", 6, 8, 1, 3]", "cuda -keys=cuda,gpu -arch=sm_80 -max_num_threads=1024 -thread_warp_size=32", [-1, 16, 64, 49152, 2147483647, 1024, 8, 32], "", 0, []], [[], [["FU", 1, [0, 1, 2, 3]], ["SP", 1, 0, 144, [6], 1], ["AN", 1, 0, 5], ["AN", 1, 1, 6]]]], "r": [[6.21551e-06], 0, 1.21879, 1721433622], "v": "v0.6"}
{"i": [["[\"sign\", 6, 8, 1, 3]", "cuda -keys=cuda,gpu -arch=sm_80 -max_num_threads=1024 -thread_warp_size=32", [-1, 16, 64, 49152, 2147483647, 1024, 8, 32], "", 0, []], [[], [["FU", 1, [0, 1, 2, 3]], ["SP", 1, 0, 144, [12], 1], ["AN", 1, 0, 5], ["AN", 1, 1, 6]]]], "r": [[7.11729e-06], 0, 1.08558, 1721433623], "v": "v0.6"}
