code_generation/generate/deprecated/deprecated_simple_v1.0/log/cuda/sin_cuda.log
{"i": [["[\"sin\", 8, 19, 5, 4]", "cuda -keys=cuda,gpu -arch=sm_80 -max_num_threads=1024 -thread_warp_size=32", [-1, 16, 64, 49152, 2147483647, 1024, 8, 32], "", 0, []], [[], [["FU", 1, [0, 1, 2, 3]], ["SP", 1, 0, 3040, [1], 1], ["AN", 1, 0, 5], ["AN", 1, 1, 6]]]], "r": [[1.35421e-05], 0, 1.63209, 1721367563], "v": "v0.6"}
{"i": [["[\"sin\", 8, 19, 5, 4]", "cuda -keys=cuda,gpu -arch=sm_80 -max_num_threads=1024 -thread_warp_size=32", [-1, 16, 64, 49152, 2147483647, 1024, 8, 32], "", 0, []], [[], [["FU", 1, [0, 1, 2, 3]], ["SP", 1, 0, 3040, [19], 1], ["AN", 1, 0, 5], ["AN", 1, 1, 6]]]], "r": [[9.79261e-06], 0, 1.29321, 1721367564], "v": "v0.6"}
{"i": [["[\"sin\", 8, 19, 5, 4]", "cuda -keys=cuda,gpu -arch=sm_80 -max_num_threads=1024 -thread_warp_size=32", [-1, 16, 64, 49152, 2147483647, 1024, 8, 32], "", 0, []], [[], [["FU", 1, [0, 1, 2, 3]], ["SP", 1, 0, 3040, [4], 1], ["AN", 1, 0, 5], ["AN", 1, 1, 6]]]], "r": [[1.23744e-05], 0, 1.48096, 1721367564], "v": "v0.6"}
{"i": [["[\"sin\", 8, 19, 5, 4]", "cuda -keys=cuda,gpu -arch=sm_80 -max_num_threads=1024 -thread_warp_size=32", [-1, 16, 64, 49152, 2147483647, 1024, 8, 32], "", 0, []], [[], [["FU", 1, [0, 1, 2, 3]], ["SP", 1, 0, 3040, [32], 1], ["AN", 1, 0, 5], ["AN", 1, 1, 6]]]], "r": [[1.01185e-05], 0, 1.50038, 1721367564], "v": "v0.6"}
{"i": [["[\"sin\", 8, 19, 5, 4]", "cuda -keys=cuda,gpu -arch=sm_80 -max_num_threads=1024 -thread_warp_size=32", [-1, 16, 64, 49152, 2147483647, 1024, 8, 32], "", 0, []], [[], [["FU", 1, [0, 1, 2, 3]], ["SP", 1, 0, 3040, [20], 1], ["AN", 1, 0, 5], ["AN", 1, 1, 6]]]], "r": [[1.29405e-05], 0, 1.40506, 1721367565], "v": "v0.6"}
{"i": [["[\"sin\", 8, 19, 5, 4]", "cuda -keys=cuda,gpu -arch=sm_80 -max_num_threads=1024 -thread_warp_size=32", [-1, 16, 64, 49152, 2147483647, 1024, 8, 32], "", 0, []], [[], [["FU", 1, [0, 1, 2, 3]], ["SP", 1, 0, 3040, [5], 1], ["AN", 1, 0, 5], ["AN", 1, 1, 6]]]], "r": [[1.26216e-05], 0, 1.44132, 1721367565], "v": "v0.6"}
{"i": [["[\"sin\", 8, 19, 5, 4]", "cuda -keys=cuda,gpu -arch=sm_80 -max_num_threads=1024 -thread_warp_size=32", [-1, 16, 64, 49152, 2147483647, 1024, 8, 32], "", 0, []], [[], [["FU", 1, [0, 1, 2, 3]], ["SP", 1, 0, 3040, [8], 1], ["AN", 1, 0, 5], ["AN", 1, 1, 6]]]], "r": [[1.133e-05], 0, 1.63237, 1721367566], "v": "v0.6"}
{"i": [["[\"sin\", 8, 19, 5, 4]", "cuda -keys=cuda,gpu -arch=sm_80 -max_num_threads=1024 -thread_warp_size=32", [-1, 16, 64, 49152, 2147483647, 1024, 8, 32], "", 0, []], [[], [["FU", 1, [0, 1, 2, 3]], ["SP", 1, 0, 3040, [38], 1], ["AN", 1, 0, 5], ["AN", 1, 1, 6]]]], "r": [[1.09837e-05], 0, 0.976471, 1721367566], "v": "v0.6"}
{"i": [["[\"sin\", 8, 19, 5, 4]", "cuda -keys=cuda,gpu -arch=sm_80 -max_num_threads=1024 -thread_warp_size=32", [-1, 16, 64, 49152, 2147483647, 1024, 8, 32], "", 0, []], [[], [["FU", 1, [0, 1, 2, 3]], ["SP", 1, 0, 3040, [40], 1], ["AN", 1, 0, 5], ["AN", 1, 1, 6]]]], "r": [[8.52141e-06], 0, 1.59984, 1721367567], "v": "v0.6"}
{"i": [["[\"sin\", 8, 19, 5, 4]", "cuda -keys=cuda,gpu -arch=sm_80 -max_num_threads=1024 -thread_warp_size=32", [-1, 16, 64, 49152, 2147483647, 1024, 8, 32], "", 0, []], [[], [["FU", 1, [0, 1, 2, 3]], ["SP", 1, 0, 3040, [10], 1], ["AN", 1, 0, 5], ["AN", 1, 1, 6]]]], "r": [[1.43696e-05], 0, 1.50074, 1721367567], "v": "v0.6"}
