code_generation/generate/deprecated/deprecated_simple_v1.0/log/cuda/sinh_cuda.log
{"i": [["[\"sinh\", 11, 19, 3, 7]", "cuda -keys=cuda,gpu -arch=sm_80 -max_num_threads=1024 -thread_warp_size=32", [-1, 16, 64, 49152, 2147483647, 1024, 8, 32], "", 0, []], [[], [["FU", 1, [0, 1, 2, 3]], ["SP", 1, 0, 4389, [11], 1], ["AN", 1, 0, 5], ["AN", 1, 1, 6]]]], "r": [[7.03329e-06], 0, 1.45932, 1721434835], "v": "v0.6"}
{"i": [["[\"sinh\", 11, 19, 3, 7]", "cuda -keys=cuda,gpu -arch=sm_80 -max_num_threads=1024 -thread_warp_size=32", [-1, 16, 64, 49152, 2147483647, 1024, 8, 32], "", 0, []], [[], [["FU", 1, [0, 1, 2, 3]], ["SP", 1, 0, 4389, [7], 1], ["AN", 1, 0, 5], ["AN", 1, 1, 6]]]], "r": [[9.08428e-06], 0, 1.22635, 1721434836], "v": "v0.6"}
{"i": [["[\"sinh\", 11, 19, 3, 7]", "cuda -keys=cuda,gpu -arch=sm_80 -max_num_threads=1024 -thread_warp_size=32", [-1, 16, 64, 49152, 2147483647, 1024, 8, 32], "", 0, []], [[], [["FU", 1, [0, 1, 2, 3]], ["SP", 1, 0, 4389, [57], 1], ["AN", 1, 0, 5], ["AN", 1, 1, 6]]]], "r": [[7.75284e-06], 0, 1.42737, 1721434836], "v": "v0.6"}
{"i": [["[\"sinh\", 11, 19, 3, 7]", "cuda -keys=cuda,gpu -arch=sm_80 -max_num_threads=1024 -thread_warp_size=32", [-1, 16, 64, 49152, 2147483647, 1024, 8, 32], "", 0, []], [[], [["FU", 1, [0, 1, 2, 3]], ["SP", 1, 0, 4389, [16], 1], ["AN", 1, 0, 5], ["AN", 1, 1, 6]]]], "r": [[9.78636e-06], 0, 1.54028, 1721434836], "v": "v0.6"}
{"i": [["[\"sinh\", 11, 19, 3, 7]", "cuda -keys=cuda,gpu -arch=sm_80 -max_num_threads=1024 -thread_warp_size=32", [-1, 16, 64, 49152, 2147483647, 1024, 8, 32], "", 0, []], [[], [["FU", 1, [0, 1, 2, 3]], ["SP", 1, 0, 4389, [19], 1], ["AN", 1, 0, 5], ["AN", 1, 1, 6]]]], "r": [[1.06111e-05], 0, 1.45733, 1721434837], "v": "v0.6"}
{"i": [["[\"sinh\", 11, 19, 3, 7]", "cuda -keys=cuda,gpu -arch=sm_80 -max_num_threads=1024 -thread_warp_size=32", [-1, 16, 64, 49152, 2147483647, 1024, 8, 32], "", 0, []], [[], [["FU", 1, [0, 1, 2, 3]], ["SP", 1, 0, 4389, [21], 1], ["AN", 1, 0, 5], ["AN", 1, 1, 6]]]], "r": [[9.45353e-06], 0, 1.34966, 1721434837], "v": "v0.6"}
{"i": [["[\"sinh\", 11, 19, 3, 7]", "cuda -keys=cuda,gpu -arch=sm_80 -max_num_threads=1024 -thread_warp_size=32", [-1, 16, 64, 49152, 2147483647, 1024, 8, 32], "", 0, []], [[], [["FU", 1, [0, 1, 2, 3]], ["SP", 1, 0, 4389, [33], 1], ["AN", 1, 0, 5], ["AN", 1, 1, 6]]]], "r": [[8.91184e-06], 0, 1.37998, 1721434838], "v": "v0.6"}
{"i": [["[\"sinh\", 11, 19, 3, 7]", "cuda -keys=cuda,gpu -arch=sm_80 -max_num_threads=1024 -thread_warp_size=32", [-1, 16, 64, 49152, 2147483647, 1024, 8, 32], "", 0, []], [[], [["FU", 1, [0, 1, 2, 3]], ["SP", 1, 0, 4389, [4], 1], ["AN", 1, 0, 5], ["AN", 1, 1, 6]]]], "r": [[1.16275e-05], 0, 1.26782, 1721434838], "v": "v0.6"}
{"i": [["[\"sinh\", 11, 19, 3, 7]", "cuda -keys=cuda,gpu -arch=sm_80 -max_num_threads=1024 -thread_warp_size=32", [-1, 16, 64, 49152, 2147483647, 1024, 8, 32], "", 0, []], [[], [["FU", 1, [0, 1, 2, 3]], ["SP", 1, 0, 4389, [2], 1], ["AN", 1, 0, 5], ["AN", 1, 1, 6]]]], "r": [[1.41591e-05], 0, 1.2859, 1721434838], "v": "v0.6"}
{"i": [["[\"sinh\", 11, 19, 3, 7]", "cuda -keys=cuda,gpu -arch=sm_80 -max_num_threads=1024 -thread_warp_size=32", [-1, 16, 64, 49152, 2147483647, 1024, 8, 32], "", 0, []], [[], [["FU", 1, [0, 1, 2, 3]], ["SP", 1, 0, 4389, [8], 1], ["AN", 1, 0, 5], ["AN", 1, 1, 6]]]], "r": [[1.04484e-05], 0, 1.35839, 1721434839], "v": "v0.6"}
