code_generation/generate/deprecated/deprecated_simple_v1.0/log/cuda/sqrt_cuda.log
{"i": [["[\"sqrt\", 9, 13, 5, 18]", "cuda -keys=cuda,gpu -arch=sm_80 -max_num_threads=1024 -thread_warp_size=32", [-1, 16, 64, 49152, 2147483647, 1024, 8, 32], "", 0, []], [[], [["FU", 1, [0, 1, 2, 3]], ["SP", 1, 0, 10530, [3], 1], ["AN", 1, 0, 5], ["AN", 1, 1, 6]]]], "r": [[1.1831e-05], 0, 2.08268, 1721436169], "v": "v0.6"}
{"i": [["[\"sqrt\", 9, 13, 5, 18]", "cuda -keys=cuda,gpu -arch=sm_80 -max_num_threads=1024 -thread_warp_size=32", [-1, 16, 64, 49152, 2147483647, 1024, 8, 32], "", 0, []], [[], [["FU", 1, [0, 1, 2, 3]], ["SP", 1, 0, 10530, [15], 1], ["AN", 1, 0, 5], ["AN", 1, 1, 6]]]], "r": [[7.1366e-06], 0, 1.18077, 1721436169], "v": "v0.6"}
{"i": [["[\"sqrt\", 9, 13, 5, 18]", "cuda -keys=cuda,gpu -arch=sm_80 -max_num_threads=1024 -thread_warp_size=32", [-1, 16, 64, 49152, 2147483647, 1024, 8, 32], "", 0, []], [[], [["FU", 1, [0, 1, 2, 3]], ["SP", 1, 0, 10530, [45], 1], ["AN", 1, 0, 5], ["AN", 1, 1, 6]]]], "r": [[6.01683e-06], 0, 1.50109, 1721436169], "v": "v0.6"}
{"i": [["[\"sqrt\", 9, 13, 5, 18]", "cuda -keys=cuda,gpu -arch=sm_80 -max_num_threads=1024 -thread_warp_size=32", [-1, 16, 64, 49152, 2147483647, 1024, 8, 32], "", 0, []], [[], [["FU", 1, [0, 1, 2, 3]], ["SP", 1, 0, 10530, [27], 1], ["AN", 1, 0, 5], ["AN", 1, 1, 6]]]], "r": [[7.15831e-06], 0, 1.61593, 1721436170], "v": "v0.6"}
{"i": [["[\"sqrt\", 9, 13, 5, 18]", "cuda -keys=cuda,gpu -arch=sm_80 -max_num_threads=1024 -thread_warp_size=32", [-1, 16, 64, 49152, 2147483647, 1024, 8, 32], "", 0, []], [[], [["FU", 1, [0, 1, 2, 3]], ["SP", 1, 0, 10530, [18], 1], ["AN", 1, 0, 5], ["AN", 1, 1, 6]]]], "r": [[7.19263e-06], 0, 1.48827, 1721436170], "v": "v0.6"}
{"i": [["[\"sqrt\", 9, 13, 5, 18]", "cuda -keys=cuda,gpu -arch=sm_80 -max_num_threads=1024 -thread_warp_size=32", [-1, 16, 64, 49152, 2147483647, 1024, 8, 32], "", 0, []], [[], [["FU", 1, [0, 1, 2, 3]], ["SP", 1, 0, 10530, [16], 1], ["AN", 1, 0, 5], ["AN", 1, 1, 6]]]], "r": [[6.77722e-06], 0, 0.886292, 1721436170], "v": "v0.6"}
{"i": [["[\"sqrt\", 9, 13, 5, 18]", "cuda -keys=cuda,gpu -arch=sm_80 -max_num_threads=1024 -thread_warp_size=32", [-1, 16, 64, 49152, 2147483647, 1024, 8, 32], "", 0, []], [[], [["FU", 1, [0, 1, 2, 3]], ["SP", 1, 0, 10530, [54], 1], ["AN", 1, 0, 5], ["AN", 1, 1, 6]]]], "r": [[8.62886e-06], 0, 1.60008, 1721436171], "v": "v0.6"}
{"i": [["[\"sqrt\", 9, 13, 5, 18]", "cuda -keys=cuda,gpu -arch=sm_80 -max_num_threads=1024 -thread_warp_size=32", [-1, 16, 64, 49152, 2147483647, 1024, 8, 32], "", 0, []], [[], [["FU", 1, [0, 1, 2, 3]], ["SP", 1, 0, 10530, [28], 1], ["AN", 1, 0, 5], ["AN", 1, 1, 6]]]], "r": [[7.31775e-06], 0, 1.12106, 1721436171], "v": "v0.6"}
{"i": [["[\"sqrt\", 9, 13, 5, 18]", "cuda -keys=cuda,gpu -arch=sm_80 -max_num_threads=1024 -thread_warp_size=32", [-1, 16, 64, 49152, 2147483647, 1024, 8, 32], "", 0, []], [[], [["FU", 1, [0, 1, 2, 3]], ["SP", 1, 0, 10530, [14], 1], ["AN", 1, 0, 5], ["AN", 1, 1, 6]]]], "r": [[6.71079e-06], 0, 1.23299, 1721436171], "v": "v0.6"}
{"i": [["[\"sqrt\", 9, 13, 5, 18]", "cuda -keys=cuda,gpu -arch=sm_80 -max_num_threads=1024 -thread_warp_size=32", [-1, 16, 64, 49152, 2147483647, 1024, 8, 32], "", 0, []], [[], [["FU", 1, [0, 1, 2, 3]], ["SP", 1, 0, 10530, [6], 1], ["AN", 1, 0, 5], ["AN", 1, 1, 6]]]], "r": [[9.28584e-06], 0, 1.52161, 1721436172], "v": "v0.6"}
