code_generation/generate/deprecated/deprecated_simple_v1.0/log/cuda/strided_slice_cuda.log
{"i": [["[\"strided_slice\", 14, 11, 14, 10]", "cuda -keys=cuda,gpu -arch=sm_80 -max_num_threads=1024 -thread_warp_size=32", [-1, 16, 64, 49152, 2147483647, 1024, 8, 32], "", 0, []], [[], [["FU", 1, [0, 1, 2]], ["SP", 1, 0, 105, [7], 1], ["AN", 1, 0, 5], ["AN", 1, 1, 6]]]], "r": [[5.53296e-06], 0, 1.17836, 1721456954], "v": "v0.6"}
{"i": [["[\"strided_slice\", 14, 11, 14, 10]", "cuda -keys=cuda,gpu -arch=sm_80 -max_num_threads=1024 -thread_warp_size=32", [-1, 16, 64, 49152, 2147483647, 1024, 8, 32], "", 0, []], [[], [["FU", 1, [0, 1, 2]], ["SP", 1, 0, 105, [15], 1], ["AN", 1, 0, 5], ["AN", 1, 1, 6]]]], "r": [[5.50381e-06], 0, 0.954443, 1721456954], "v": "v0.6"}
{"i": [["[\"strided_slice\", 14, 11, 14, 10]", "cuda -keys=cuda,gpu -arch=sm_80 -max_num_threads=1024 -thread_warp_size=32", [-1, 16, 64, 49152, 2147483647, 1024, 8, 32], "", 0, []], [[], [["FU", 1, [0, 1, 2]], ["SP", 1, 0, 105, [32], 1], ["AN", 1, 0, 5], ["AN", 1, 1, 6]]]], "r": [[5.50792e-06], 0, 0.851777, 1721456954], "v": "v0.6"}
{"i": [["[\"strided_slice\", 14, 11, 14, 10]", "cuda -keys=cuda,gpu -arch=sm_80 -max_num_threads=1024 -thread_warp_size=32", [-1, 16, 64, 49152, 2147483647, 1024, 8, 32], "", 0, []], [[], [["FU", 1, [0, 1, 2]], ["SP", 1, 0, 105, [8], 1], ["AN", 1, 0, 5], ["AN", 1, 1, 6]]]], "r": [[6.01788e-06], 0, 0.988559, 1721456954], "v": "v0.6"}
{"i": [["[\"strided_slice\", 14, 11, 14, 10]", "cuda -keys=cuda,gpu -arch=sm_80 -max_num_threads=1024 -thread_warp_size=32", [-1, 16, 64, 49152, 2147483647, 1024, 8, 32], "", 0, []], [[], [["FU", 1, [0, 1, 2]], ["SP", 1, 0, 105, [16], 1], ["AN", 1, 0, 5], ["AN", 1, 1, 6]]]], "r": [[5.47898e-06], 0, 0.762404, 1721456955], "v": "v0.6"}
{"i": [["[\"strided_slice\", 14, 11, 14, 10]", "cuda -keys=cuda,gpu -arch=sm_80 -max_num_threads=1024 -thread_warp_size=32", [-1, 16, 64, 49152, 2147483647, 1024, 8, 32], "", 0, []], [[], [["FU", 1, [0, 1, 2]], ["SP", 1, 0, 105, [21], 1], ["AN", 1, 0, 5], ["AN", 1, 1, 6]]]], "r": [[5.49672e-06], 0, 0.697229, 1721456955], "v": "v0.6"}
{"i": [["[\"strided_slice\", 14, 11, 14, 10]", "cuda -keys=cuda,gpu -arch=sm_80 -max_num_threads=1024 -thread_warp_size=32", [-1, 16, 64, 49152, 2147483647, 1024, 8, 32], "", 0, []], [[], [["FU", 1, [0, 1, 2]], ["SP", 1, 0, 105, [3], 1], ["AN", 1, 0, 5], ["AN", 1, 1, 6]]]], "r": [[5.49863e-06], 0, 0.758151, 1721456955], "v": "v0.6"}
{"i": [["[\"strided_slice\", 14, 11, 14, 10]", "cuda -keys=cuda,gpu -arch=sm_80 -max_num_threads=1024 -thread_warp_size=32", [-1, 16, 64, 49152, 2147483647, 1024, 8, 32], "", 0, []], [[], [["FU", 1, [0, 1, 2]], ["SP", 1, 0, 105, [1], 1], ["AN", 1, 0, 5], ["AN", 1, 1, 6]]]], "r": [[6.42797e-06], 0, 0.97815, 1721456955], "v": "v0.6"}
{"i": [["[\"strided_slice\", 14, 11, 14, 10]", "cuda -keys=cuda,gpu -arch=sm_80 -max_num_threads=1024 -thread_warp_size=32", [-1, 16, 64, 49152, 2147483647, 1024, 8, 32], "", 0, []], [[], [["FU", 1, [0, 1, 2]], ["SP", 1, 0, 105, [2], 1], ["AN", 1, 0, 5], ["AN", 1, 1, 6]]]], "r": [[5.72677e-06], 0, 0.759043, 1721456956], "v": "v0.6"}
{"i": [["[\"strided_slice\", 14, 11, 14, 10]", "cuda -keys=cuda,gpu -arch=sm_80 -max_num_threads=1024 -thread_warp_size=32", [-1, 16, 64, 49152, 2147483647, 1024, 8, 32], "", 0, []], [[], [["FU", 1, [0, 1, 2]], ["SP", 1, 0, 105, [24], 1], ["AN", 1, 0, 5], ["AN", 1, 1, 6]]]], "r": [[5.50578e-06], 0, 0.79932, 1721456956], "v": "v0.6"}
