code_generation/generate/deprecated/deprecated_simple_v1.0/log/cuda/tan_cuda.log
{"i": [["[\"tan\", 9, 19, 3, 12]", "cuda -keys=cuda,gpu -arch=sm_80 -max_num_threads=1024 -thread_warp_size=32", [-1, 16, 64, 49152, 2147483647, 1024, 8, 32], "", 0, []], [[], [["FU", 1, [0, 1, 2, 3]], ["SP", 1, 0, 6156, [38], 1], ["AN", 1, 0, 5], ["AN", 1, 1, 6]]]], "r": [[6.12174e-06], 0, 1.79318, 1721438298], "v": "v0.6"}
{"i": [["[\"tan\", 9, 19, 3, 12]", "cuda -keys=cuda,gpu -arch=sm_80 -max_num_threads=1024 -thread_warp_size=32", [-1, 16, 64, 49152, 2147483647, 1024, 8, 32], "", 0, []], [[], [["FU", 1, [0, 1, 2, 3]], ["SP", 1, 0, 6156, [2], 1], ["AN", 1, 0, 5], ["AN", 1, 1, 6]]]], "r": [[1.13062e-05], 0, 1.31578, 1721438299], "v": "v0.6"}
{"i": [["[\"tan\", 9, 19, 3, 12]", "cuda -keys=cuda,gpu -arch=sm_80 -max_num_threads=1024 -thread_warp_size=32", [-1, 16, 64, 49152, 2147483647, 1024, 8, 32], "", 0, []], [[], [["FU", 1, [0, 1, 2, 3]], ["SP", 1, 0, 6156, [48], 1], ["AN", 1, 0, 5], ["AN", 1, 1, 6]]]], "r": [[7.64135e-06], 0, 1.37319, 1721438299], "v": "v0.6"}
{"i": [["[\"tan\", 9, 19, 3, 12]", "cuda -keys=cuda,gpu -arch=sm_80 -max_num_threads=1024 -thread_warp_size=32", [-1, 16, 64, 49152, 2147483647, 1024, 8, 32], "", 0, []], [[], [["FU", 1, [0, 1, 2, 3]], ["SP", 1, 0, 6156, [12], 1], ["AN", 1, 0, 5], ["AN", 1, 1, 6]]]], "r": [[7.62584e-06], 0, 1.25983, 1721438299], "v": "v0.6"}
{"i": [["[\"tan\", 9, 19, 3, 12]", "cuda -keys=cuda,gpu -arch=sm_80 -max_num_threads=1024 -thread_warp_size=32", [-1, 16, 64, 49152, 2147483647, 1024, 8, 32], "", 0, []], [[], [["FU", 1, [0, 1, 2, 3]], ["SP", 1, 0, 6156, [19], 1], ["AN", 1, 0, 5], ["AN", 1, 1, 6]]]], "r": [[5.95995e-06], 0, 1.27161, 1721438299], "v": "v0.6"}
{"i": [["[\"tan\", 9, 19, 3, 12]", "cuda -keys=cuda,gpu -arch=sm_80 -max_num_threads=1024 -thread_warp_size=32", [-1, 16, 64, 49152, 2147483647, 1024, 8, 32], "", 0, []], [[], [["FU", 1, [0, 1, 2, 3]], ["SP", 1, 0, 6156, [64], 1], ["AN", 1, 0, 5], ["AN", 1, 1, 6]]]], "r": [[6.12115e-06], 0, 1.28569, 1721438300], "v": "v0.6"}
{"i": [["[\"tan\", 9, 19, 3, 12]", "cuda -keys=cuda,gpu -arch=sm_80 -max_num_threads=1024 -thread_warp_size=32", [-1, 16, 64, 49152, 2147483647, 1024, 8, 32], "", 0, []], [[], [["FU", 1, [0, 1, 2, 3]], ["SP", 1, 0, 6156, [4], 1], ["AN", 1, 0, 5], ["AN", 1, 1, 6]]]], "r": [[8.07019e-06], 0, 1.32552, 1721438300], "v": "v0.6"}
{"i": [["[\"tan\", 9, 19, 3, 12]", "cuda -keys=cuda,gpu -arch=sm_80 -max_num_threads=1024 -thread_warp_size=32", [-1, 16, 64, 49152, 2147483647, 1024, 8, 32], "", 0, []], [[], [["FU", 1, [0, 1, 2, 3]], ["SP", 1, 0, 6156, [57], 1], ["AN", 1, 0, 5], ["AN", 1, 1, 6]]]], "r": [[6.74196e-06], 0, 1.0922, 1721438300], "v": "v0.6"}
{"i": [["[\"tan\", 9, 19, 3, 12]", "cuda -keys=cuda,gpu -arch=sm_80 -max_num_threads=1024 -thread_warp_size=32", [-1, 16, 64, 49152, 2147483647, 1024, 8, 32], "", 0, []], [[], [["FU", 1, [0, 1, 2, 3]], ["SP", 1, 0, 6156, [54], 1], ["AN", 1, 0, 5], ["AN", 1, 1, 6]]]], "r": [[6.13046e-06], 0, 1.29084, 1721438301], "v": "v0.6"}
{"i": [["[\"tan\", 9, 19, 3, 12]", "cuda -keys=cuda,gpu -arch=sm_80 -max_num_threads=1024 -thread_warp_size=32", [-1, 16, 64, 49152, 2147483647, 1024, 8, 32], "", 0, []], [[], [["FU", 1, [0, 1, 2, 3]], ["SP", 1, 0, 6156, [18], 1], ["AN", 1, 0, 5], ["AN", 1, 1, 6]]]], "r": [[6.88749e-06], 0, 1.00625, 1721438301], "v": "v0.6"}
