code_generation/generate/deprecated/deprecated_simple_v1.0/log/cuda/tanh_cuda.log
{"i": [["[\"tanh\", 11, 10, 2, 2]", "cuda -keys=cuda,gpu -arch=sm_80 -max_num_threads=1024 -thread_warp_size=32", [-1, 16, 64, 49152, 2147483647, 1024, 8, 32], "", 0, []], [[], [["FU", 1, [0, 1, 2, 3]], ["SP", 1, 0, 440, [1], 1], ["AN", 1, 0, 5], ["AN", 1, 1, 6]]]], "r": [[6.19049e-06], 0, 1.49012, 1721439790], "v": "v0.6"}
{"i": [["[\"tanh\", 11, 10, 2, 2]", "cuda -keys=cuda,gpu -arch=sm_80 -max_num_threads=1024 -thread_warp_size=32", [-1, 16, 64, 49152, 2147483647, 1024, 8, 32], "", 0, []], [[], [["FU", 1, [0, 1, 2, 3]], ["SP", 1, 0, 440, [4], 1], ["AN", 1, 0, 5], ["AN", 1, 1, 6]]]], "r": [[6.65803e-06], 0, 1.15582, 1721439790], "v": "v0.6"}
{"i": [["[\"tanh\", 11, 10, 2, 2]", "cuda -keys=cuda,gpu -arch=sm_80 -max_num_threads=1024 -thread_warp_size=32", [-1, 16, 64, 49152, 2147483647, 1024, 8, 32], "", 0, []], [[], [["FU", 1, [0, 1, 2, 3]], ["SP", 1, 0, 440, [6], 1], ["AN", 1, 0, 5], ["AN", 1, 1, 6]]]], "r": [[5.6631e-06], 0, 1.00728, 1721439791], "v": "v0.6"}
{"i": [["[\"tanh\", 11, 10, 2, 2]", "cuda -keys=cuda,gpu -arch=sm_80 -max_num_threads=1024 -thread_warp_size=32", [-1, 16, 64, 49152, 2147483647, 1024, 8, 32], "", 0, []], [[], [["FU", 1, [0, 1, 2, 3]], ["SP", 1, 0, 440, [8], 1], ["AN", 1, 0, 5], ["AN", 1, 1, 6]]]], "r": [[6.37612e-06], 0, 1.39097, 1721439791], "v": "v0.6"}
{"i": [["[\"tanh\", 11, 10, 2, 2]", "cuda -keys=cuda,gpu -arch=sm_80 -max_num_threads=1024 -thread_warp_size=32", [-1, 16, 64, 49152, 2147483647, 1024, 8, 32], "", 0, []], [[], [["FU", 1, [0, 1, 2, 3]], ["SP", 1, 0, 440, [5], 1], ["AN", 1, 0, 5], ["AN", 1, 1, 6]]]], "r": [[5.68952e-06], 0, 1.58594, 1721439791], "v": "v0.6"}
{"i": [["[\"tanh\", 11, 10, 2, 2]", "cuda -keys=cuda,gpu -arch=sm_80 -max_num_threads=1024 -thread_warp_size=32", [-1, 16, 64, 49152, 2147483647, 1024, 8, 32], "", 0, []], [[], [["FU", 1, [0, 1, 2, 3]], ["SP", 1, 0, 440, [48], 1], ["AN", 1, 0, 5], ["AN", 1, 1, 6]]]], "r": [[5.83976e-06], 0, 1.09077, 1721439791], "v": "v0.6"}
{"i": [["[\"tanh\", 11, 10, 2, 2]", "cuda -keys=cuda,gpu -arch=sm_80 -max_num_threads=1024 -thread_warp_size=32", [-1, 16, 64, 49152, 2147483647, 1024, 8, 32], "", 0, []], [[], [["FU", 1, [0, 1, 2, 3]], ["SP", 1, 0, 440, [10], 1], ["AN", 1, 0, 5], ["AN", 1, 1, 6]]]], "r": [[5.82956e-06], 0, 1.38521, 1721439792], "v": "v0.6"}
{"i": [["[\"tanh\", 11, 10, 2, 2]", "cuda -keys=cuda,gpu -arch=sm_80 -max_num_threads=1024 -thread_warp_size=32", [-1, 16, 64, 49152, 2147483647, 1024, 8, 32], "", 0, []], [[], [["FU", 1, [0, 1, 2, 3]], ["SP", 1, 0, 440, [2], 1], ["AN", 1, 0, 5], ["AN", 1, 1, 6]]]], "r": [[6.3928e-06], 0, 1.43356, 1721439792], "v": "v0.6"}
{"i": [["[\"tanh\", 11, 10, 2, 2]", "cuda -keys=cuda,gpu -arch=sm_80 -max_num_threads=1024 -thread_warp_size=32", [-1, 16, 64, 49152, 2147483647, 1024, 8, 32], "", 0, []], [[], [["FU", 1, [0, 1, 2, 3]], ["SP", 1, 0, 440, [20], 1], ["AN", 1, 0, 5], ["AN", 1, 1, 6]]]], "r": [[7.74117e-06], 0, 1.12352, 1721439792], "v": "v0.6"}
{"i": [["[\"tanh\", 11, 10, 2, 2]", "cuda -keys=cuda,gpu -arch=sm_80 -max_num_threads=1024 -thread_warp_size=32", [-1, 16, 64, 49152, 2147483647, 1024, 8, 32], "", 0, []], [[], [["FU", 1, [0, 1, 2, 3]], ["SP", 1, 0, 440, [24], 1], ["AN", 1, 0, 5], ["AN", 1, 1, 6]]]], "r": [[5.84481e-06], 0, 1.112, 1721439793], "v": "v0.6"}
