code_generation/generate/deprecated/deprecated_simple_v1.0/log/cuda/unpack_NCHWc_to_nchw_cuda.log
{"i": [["[\"unpack_NCHWc_to_nchw\", 3, 7, 12, 8]", "cuda -keys=cuda,gpu -arch=sm_80 -max_num_threads=1024 -thread_warp_size=32", [-1, 16, 64, 49152, 2147483647, 1024, 8, 32], "", 0, []], [[], [["FU", 1, [0, 1, 2, 3]], ["SP", 1, 0, 4032, [48], 1], ["AN", 1, 0, 5], ["AN", 1, 1, 6]]]], "r": [[5.70947e-06], 0, 1.37411, 1721457692], "v": "v0.6"}
{"i": [["[\"unpack_NCHWc_to_nchw\", 3, 7, 12, 8]", "cuda -keys=cuda,gpu -arch=sm_80 -max_num_threads=1024 -thread_warp_size=32", [-1, 16, 64, 49152, 2147483647, 1024, 8, 32], "", 0, []], [[], [["FU", 1, [0, 1, 2, 3]], ["SP", 1, 0, 4032, [64], 1], ["AN", 1, 0, 5], ["AN", 1, 1, 6]]]], "r": [[5.46505e-06], 0, 0.950641, 1721457693], "v": "v0.6"}
{"i": [["[\"unpack_NCHWc_to_nchw\", 3, 7, 12, 8]", "cuda -keys=cuda,gpu -arch=sm_80 -max_num_threads=1024 -thread_warp_size=32", [-1, 16, 64, 49152, 2147483647, 1024, 8, 32], "", 0, []], [[], [["FU", 1, [0, 1, 2, 3]], ["SP", 1, 0, 4032, [16], 1], ["AN", 1, 0, 5], ["AN", 1, 1, 6]]]], "r": [[6.137e-06], 0, 0.783552, 1721457693], "v": "v0.6"}
{"i": [["[\"unpack_NCHWc_to_nchw\", 3, 7, 12, 8]", "cuda -keys=cuda,gpu -arch=sm_80 -max_num_threads=1024 -thread_warp_size=32", [-1, 16, 64, 49152, 2147483647, 1024, 8, 32], "", 0, []], [[], [["FU", 1, [0, 1, 2, 3]], ["SP", 1, 0, 4032, [36], 1], ["AN", 1, 0, 5], ["AN", 1, 1, 6]]]], "r": [[5.84034e-06], 0, 1.03752, 1721457693], "v": "v0.6"}
{"i": [["[\"unpack_NCHWc_to_nchw\", 3, 7, 12, 8]", "cuda -keys=cuda,gpu -arch=sm_80 -max_num_threads=1024 -thread_warp_size=32", [-1, 16, 64, 49152, 2147483647, 1024, 8, 32], "", 0, []], [[], [["FU", 1, [0, 1, 2, 3]], ["SP", 1, 0, 4032, [42], 1], ["AN", 1, 0, 5], ["AN", 1, 1, 6]]]], "r": [[5.8429e-06], 0, 0.770808, 1721457693], "v": "v0.6"}
{"i": [["[\"unpack_NCHWc_to_nchw\", 3, 7, 12, 8]", "cuda -keys=cuda,gpu -arch=sm_80 -max_num_threads=1024 -thread_warp_size=32", [-1, 16, 64, 49152, 2147483647, 1024, 8, 32], "", 0, []], [[], [["FU", 1, [0, 1, 2, 3]], ["SP", 1, 0, 4032, [24], 1], ["AN", 1, 0, 5], ["AN", 1, 1, 6]]]], "r": [[6.6991e-06], 0, 0.813637, 1721457694], "v": "v0.6"}
{"i": [["[\"unpack_NCHWc_to_nchw\", 3, 7, 12, 8]", "cuda -keys=cuda,gpu -arch=sm_80 -max_num_threads=1024 -thread_warp_size=32", [-1, 16, 64, 49152, 2147483647, 1024, 8, 32], "", 0, []], [[], [["FU", 1, [0, 1, 2, 3]], ["SP", 1, 0, 4032, [2], 1], ["AN", 1, 0, 5], ["AN", 1, 1, 6]]]], "r": [[8.73761e-06], 0, 0.910947, 1721457694], "v": "v0.6"}
{"i": [["[\"unpack_NCHWc_to_nchw\", 3, 7, 12, 8]", "cuda -keys=cuda,gpu -arch=sm_80 -max_num_threads=1024 -thread_warp_size=32", [-1, 16, 64, 49152, 2147483647, 1024, 8, 32], "", 0, []], [[], [["FU", 1, [0, 1, 2, 3]], ["SP", 1, 0, 4032, [4], 1], ["AN", 1, 0, 5], ["AN", 1, 1, 6]]]], "r": [[7.14206e-06], 0, 0.832719, 1721457694], "v": "v0.6"}
{"i": [["[\"unpack_NCHWc_to_nchw\", 3, 7, 12, 8]", "cuda -keys=cuda,gpu -arch=sm_80 -max_num_threads=1024 -thread_warp_size=32", [-1, 16, 64, 49152, 2147483647, 1024, 8, 32], "", 0, []], [[], [["FU", 1, [0, 1, 2, 3]], ["SP", 1, 0, 4032, [21], 1], ["AN", 1, 0, 5], ["AN", 1, 1, 6]]]], "r": [[6.19387e-06], 0, 0.957689, 1721457695], "v": "v0.6"}
{"i": [["[\"unpack_NCHWc_to_nchw\", 3, 7, 12, 8]", "cuda -keys=cuda,gpu -arch=sm_80 -max_num_threads=1024 -thread_warp_size=32", [-1, 16, 64, 49152, 2147483647, 1024, 8, 32], "", 0, []], [[], [["FU", 1, [0, 1, 2, 3]], ["SP", 1, 0, 4032, [28], 1], ["AN", 1, 0, 5], ["AN", 1, 1, 6]]]], "r": [[6.96404e-06], 0, 0.81559, 1721457695], "v": "v0.6"}
