code_generation/generate/deprecated/deprecated_simple_v1.0/log/cuda/upsampling_cuda.log
{"i": [["[\"upsampling\", 3, 20, 9, 9]", "cuda -keys=cuda,gpu -arch=sm_80 -max_num_threads=1024 -thread_warp_size=32", [-1, 16, 64, 49152, 2147483647, 1024, 8, 32], "", 0, []], [[], [["FU", 1, [0, 1, 2, 3]], ["SP", 1, 0, 77760, [27], 1], ["AN", 1, 0, 5], ["AN", 1, 1, 6]]]], "r": [[1.04859e-05], 0, 1.23483, 1721459689], "v": "v0.6"}
{"i": [["[\"upsampling\", 3, 20, 9, 9]", "cuda -keys=cuda,gpu -arch=sm_80 -max_num_threads=1024 -thread_warp_size=32", [-1, 16, 64, 49152, 2147483647, 1024, 8, 32], "", 0, []], [[], [["FU", 1, [0, 1, 2, 3]], ["SP", 1, 0, 77760, [3], 1], ["AN", 1, 0, 5], ["AN", 1, 1, 6]]]], "r": [[4.87741e-05], 0, 0.881594, 1721459690], "v": "v0.6"}
{"i": [["[\"upsampling\", 3, 20, 9, 9]", "cuda -keys=cuda,gpu -arch=sm_80 -max_num_threads=1024 -thread_warp_size=32", [-1, 16, 64, 49152, 2147483647, 1024, 8, 32], "", 0, []], [[], [["FU", 1, [0, 1, 2, 3]], ["SP", 1, 0, 77760, [6], 1], ["AN", 1, 0, 5], ["AN", 1, 1, 6]]]], "r": [[2.69378e-05], 0, 0.785094, 1721459690], "v": "v0.6"}
{"i": [["[\"upsampling\", 3, 20, 9, 9]", "cuda -keys=cuda,gpu -arch=sm_80 -max_num_threads=1024 -thread_warp_size=32", [-1, 16, 64, 49152, 2147483647, 1024, 8, 32], "", 0, []], [[], [["FU", 1, [0, 1, 2, 3]], ["SP", 1, 0, 77760, [60], 1], ["AN", 1, 0, 5], ["AN", 1, 1, 6]]]], "r": [[8.46749e-06], 0, 0.773556, 1721459690], "v": "v0.6"}
{"i": [["[\"upsampling\", 3, 20, 9, 9]", "cuda -keys=cuda,gpu -arch=sm_80 -max_num_threads=1024 -thread_warp_size=32", [-1, 16, 64, 49152, 2147483647, 1024, 8, 32], "", 0, []], [[], [["FU", 1, [0, 1, 2, 3]], ["SP", 1, 0, 77760, [45], 1], ["AN", 1, 0, 5], ["AN", 1, 1, 6]]]], "r": [[8.49883e-06], 0, 0.760778, 1721459690], "v": "v0.6"}
{"i": [["[\"upsampling\", 3, 20, 9, 9]", "cuda -keys=cuda,gpu -arch=sm_80 -max_num_threads=1024 -thread_warp_size=32", [-1, 16, 64, 49152, 2147483647, 1024, 8, 32], "", 0, []], [[], [["FU", 1, [0, 1, 2, 3]], ["SP", 1, 0, 77760, [40], 1], ["AN", 1, 0, 5], ["AN", 1, 1, 6]]]], "r": [[8.7843e-06], 0, 0.741856, 1721459691], "v": "v0.6"}
{"i": [["[\"upsampling\", 3, 20, 9, 9]", "cuda -keys=cuda,gpu -arch=sm_80 -max_num_threads=1024 -thread_warp_size=32", [-1, 16, 64, 49152, 2147483647, 1024, 8, 32], "", 0, []], [[], [["FU", 1, [0, 1, 2, 3]], ["SP", 1, 0, 77760, [18], 1], ["AN", 1, 0, 5], ["AN", 1, 1, 6]]]], "r": [[1.27765e-05], 0, 0.731426, 1721459691], "v": "v0.6"}
{"i": [["[\"upsampling\", 3, 20, 9, 9]", "cuda -keys=cuda,gpu -arch=sm_80 -max_num_threads=1024 -thread_warp_size=32", [-1, 16, 64, 49152, 2147483647, 1024, 8, 32], "", 0, []], [[], [["FU", 1, [0, 1, 2, 3]], ["SP", 1, 0, 77760, [48], 1], ["AN", 1, 0, 5], ["AN", 1, 1, 6]]]], "r": [[8.25082e-06], 0, 0.909188, 1721459691], "v": "v0.6"}
{"i": [["[\"upsampling\", 3, 20, 9, 9]", "cuda -keys=cuda,gpu -arch=sm_80 -max_num_threads=1024 -thread_warp_size=32", [-1, 16, 64, 49152, 2147483647, 1024, 8, 32], "", 0, []], [[], [["FU", 1, [0, 1, 2, 3]], ["SP", 1, 0, 77760, [15], 1], ["AN", 1, 0, 5], ["AN", 1, 1, 6]]]], "r": [[1.44183e-05], 0, 0.73453, 1721459692], "v": "v0.6"}
{"i": [["[\"upsampling\", 3, 20, 9, 9]", "cuda -keys=cuda,gpu -arch=sm_80 -max_num_threads=1024 -thread_warp_size=32", [-1, 16, 64, 49152, 2147483647, 1024, 8, 32], "", 0, []], [[], [["FU", 1, [0, 1, 2, 3]], ["SP", 1, 0, 77760, [4], 1], ["AN", 1, 0, 5], ["AN", 1, 1, 6]]]], "r": [[3.82234e-05], 0, 0.775726, 1721459692], "v": "v0.6"}
