code_generation/generate/deprecated/deprecated_pure_without_shape/log/cuda/abs_cuda.log
{"i": [["[\"abs\", 17, 12, 4, 20]", "cuda -keys=cuda,gpu -arch=sm_80 -max_num_threads=1024 -thread_warp_size=32", [-1, 16, 64, 49152, 2147483647, 1024, 8, 32], "", 0, []], [[], [["FU", 1, [0, 1, 2, 3]], ["SP", 1, 0, 16320, [20], 1], ["AN", 1, 0, 5], ["AN", 1, 1, 6]]]], "r": [[6.71547e-06], 0, 1.88648, 1720670567], "v": "v0.6"}
{"i": [["[\"abs\", 17, 12, 4, 20]", "cuda -keys=cuda,gpu -arch=sm_80 -max_num_threads=1024 -thread_warp_size=32", [-1, 16, 64, 49152, 2147483647, 1024, 8, 32], "", 0, []], [[], [["FU", 1, [0, 1, 2, 3]], ["SP", 1, 0, 16320, [15], 1], ["AN", 1, 0, 5], ["AN", 1, 1, 6]]]], "r": [[7.00305e-06], 0, 1.72961, 1720670567], "v": "v0.6"}
{"i": [["[\"abs\", 17, 12, 4, 20]", "cuda -keys=cuda,gpu -arch=sm_80 -max_num_threads=1024 -thread_warp_size=32", [-1, 16, 64, 49152, 2147483647, 1024, 8, 32], "", 0, []], [[], [["FU", 1, [0, 1, 2, 3]], ["SP", 1, 0, 16320, [51], 1], ["AN", 1, 0, 5], ["AN", 1, 1, 6]]]], "r": [[7.94107e-06], 0, 2.13595, 1720670568], "v": "v0.6"}
{"i": [["[\"abs\", 17, 12, 4, 20]", "cuda -keys=cuda,gpu -arch=sm_80 -max_num_threads=1024 -thread_warp_size=32", [-1, 16, 64, 49152, 2147483647, 1024, 8, 32], "", 0, []], [[], [["FU", 1, [0, 1, 2, 3]], ["SP", 1, 0, 16320, [40], 1], ["AN", 1, 0, 5], ["AN", 1, 1, 6]]]], "r": [[7.41453e-06], 0, 1.61441, 1720670568], "v": "v0.6"}
{"i": [["[\"abs\", 17, 12, 4, 20]", "cuda -keys=cuda,gpu -arch=sm_80 -max_num_threads=1024 -thread_warp_size=32", [-1, 16, 64, 49152, 2147483647, 1024, 8, 32], "", 0, []], [[], [["FU", 1, [0, 1, 2, 3]], ["SP", 1, 0, 16320, [24], 1], ["AN", 1, 0, 5], ["AN", 1, 1, 6]]]], "r": [[6.36879e-06], 0, 1.94042, 1720670568], "v": "v0.6"}
{"i": [["[\"abs\", 17, 12, 4, 20]", "cuda -keys=cuda,gpu -arch=sm_80 -max_num_threads=1024 -thread_warp_size=32", [-1, 16, 64, 49152, 2147483647, 1024, 8, 32], "", 0, []], [[], [["FU", 1, [0, 1, 2, 3]], ["SP", 1, 0, 16320, [5], 1], ["AN", 1, 0, 5], ["AN", 1, 1, 6]]]], "r": [[1.07407e-05], 0, 1.77022, 1720670569], "v": "v0.6"}
{"i": [["[\"abs\", 17, 12, 4, 20]", "cuda -keys=cuda,gpu -arch=sm_80 -max_num_threads=1024 -thread_warp_size=32", [-1, 16, 64, 49152, 2147483647, 1024, 8, 32], "", 0, []], [[], [["FU", 1, [0, 1, 2, 3]], ["SP", 1, 0, 16320, [2], 1], ["AN", 1, 0, 5], ["AN", 1, 1, 6]]]], "r": [[1.89603e-05], 0, 1.56754, 1720670569], "v": "v0.6"}
{"i": [["[\"abs\", 17, 12, 4, 20]", "cuda -keys=cuda,gpu -arch=sm_80 -max_num_threads=1024 -thread_warp_size=32", [-1, 16, 64, 49152, 2147483647, 1024, 8, 32], "", 0, []], [[], [["FU", 1, [0, 1, 2, 3]], ["SP", 1, 0, 16320, [8], 1], ["AN", 1, 0, 5], ["AN", 1, 1, 6]]]], "r": [[1.35009e-05], 0, 1.65287, 1720670570], "v": "v0.6"}
{"i": [["[\"abs\", 17, 12, 4, 20]", "cuda -keys=cuda,gpu -arch=sm_80 -max_num_threads=1024 -thread_warp_size=32", [-1, 16, 64, 49152, 2147483647, 1024, 8, 32], "", 0, []], [[], [["FU", 1, [0, 1, 2, 3]], ["SP", 1, 0, 16320, [17], 1], ["AN", 1, 0, 5], ["AN", 1, 1, 6]]]], "r": [[6.8983e-06], 0, 1.43345, 1720670570], "v": "v0.6"}
{"i": [["[\"abs\", 17, 12, 4, 20]", "cuda -keys=cuda,gpu -arch=sm_80 -max_num_threads=1024 -thread_warp_size=32", [-1, 16, 64, 49152, 2147483647, 1024, 8, 32], "", 0, []], [[], [["FU", 1, [0, 1, 2, 3]], ["SP", 1, 0, 16320, [48], 1], ["AN", 1, 0, 5], ["AN", 1, 1, 6]]]], "r": [[5.8609e-06], 0, 1.33998, 1720670570], "v": "v0.6"}
