code_generation/generate/deprecated/deprecated_pure_without_shape/log/cuda/add_cuda.log
{"i": [["[\"add\", 2, 16, 7, 3]", "cuda -keys=cuda,gpu -arch=sm_80 -max_num_threads=1024 -thread_warp_size=32", [-1, 16, 64, 49152, 2147483647, 1024, 8, 32], "", 0, []], [[], [["FU", 2, [0, 1, 2, 3]], ["SP", 2, 0, 672, [12], 1], ["AN", 2, 0, 5], ["AN", 2, 1, 6]]]], "r": [[7.32327e-06], 0, 3.47064, 1720675031], "v": "v0.6"}
{"i": [["[\"add\", 2, 16, 7, 3]", "cuda -keys=cuda,gpu -arch=sm_80 -max_num_threads=1024 -thread_warp_size=32", [-1, 16, 64, 49152, 2147483647, 1024, 8, 32], "", 0, []], [[], [["FU", 2, [0, 1, 2, 3]], ["SP", 2, 0, 672, [14], 1], ["AN", 2, 0, 5], ["AN", 2, 1, 6]]]], "r": [[7.05207e-06], 0, 1.80012, 1720675031], "v": "v0.6"}
{"i": [["[\"add\", 2, 16, 7, 3]", "cuda -keys=cuda,gpu -arch=sm_80 -max_num_threads=1024 -thread_warp_size=32", [-1, 16, 64, 49152, 2147483647, 1024, 8, 32], "", 0, []], [[], [["FU", 2, [0, 1, 2, 3]], ["SP", 2, 0, 672, [48], 1], ["AN", 2, 0, 5], ["AN", 2, 1, 6]]]], "r": [[8.73535e-06], 0, 2.48652, 1720675032], "v": "v0.6"}
{"i": [["[\"add\", 2, 16, 7, 3]", "cuda -keys=cuda,gpu -arch=sm_80 -max_num_threads=1024 -thread_warp_size=32", [-1, 16, 64, 49152, 2147483647, 1024, 8, 32], "", 0, []], [[], [["FU", 2, [0, 1, 2, 3]], ["SP", 2, 0, 672, [8], 1], ["AN", 2, 0, 5], ["AN", 2, 1, 6]]]], "r": [[7.26196e-06], 0, 1.91561, 1720675032], "v": "v0.6"}
{"i": [["[\"add\", 2, 16, 7, 3]", "cuda -keys=cuda,gpu -arch=sm_80 -max_num_threads=1024 -thread_warp_size=32", [-1, 16, 64, 49152, 2147483647, 1024, 8, 32], "", 0, []], [[], [["FU", 2, [0, 1, 2, 3]], ["SP", 2, 0, 672, [6], 1], ["AN", 2, 0, 5], ["AN", 2, 1, 6]]]], "r": [[1.45156e-05], 0, 2.5534, 1720675033], "v": "v0.6"}
{"i": [["[\"add\", 2, 16, 7, 3]", "cuda -keys=cuda,gpu -arch=sm_80 -max_num_threads=1024 -thread_warp_size=32", [-1, 16, 64, 49152, 2147483647, 1024, 8, 32], "", 0, []], [[], [["FU", 2, [0, 1, 2, 3]], ["SP", 2, 0, 672, [32], 1], ["AN", 2, 0, 5], ["AN", 2, 1, 6]]]], "r": [[7.43579e-06], 0, 1.92539, 1720675033], "v": "v0.6"}
{"i": [["[\"add\", 2, 16, 7, 3]", "cuda -keys=cuda,gpu -arch=sm_80 -max_num_threads=1024 -thread_warp_size=32", [-1, 16, 64, 49152, 2147483647, 1024, 8, 32], "", 0, []], [[], [["FU", 2, [0, 1, 2, 3]], ["SP", 2, 0, 672, [42], 1], ["AN", 2, 0, 5], ["AN", 2, 1, 6]]]], "r": [[7.31752e-06], 0, 2.15046, 1720675034], "v": "v0.6"}
{"i": [["[\"add\", 2, 16, 7, 3]", "cuda -keys=cuda,gpu -arch=sm_80 -max_num_threads=1024 -thread_warp_size=32", [-1, 16, 64, 49152, 2147483647, 1024, 8, 32], "", 0, []], [[], [["FU", 2, [0, 1, 2, 3]], ["SP", 2, 0, 672, [56], 1], ["AN", 2, 0, 5], ["AN", 2, 1, 6]]]], "r": [[7.12959e-06], 0, 1.99539, 1720675034], "v": "v0.6"}
{"i": [["[\"add\", 2, 16, 7, 3]", "cuda -keys=cuda,gpu -arch=sm_80 -max_num_threads=1024 -thread_warp_size=32", [-1, 16, 64, 49152, 2147483647, 1024, 8, 32], "", 0, []], [[], [["FU", 2, [0, 1, 2, 3]], ["SP", 2, 0, 672, [2], 1], ["AN", 2, 0, 5], ["AN", 2, 1, 6]]]], "r": [[1.30557e-05], 0, 2.09094, 1720675035], "v": "v0.6"}
{"i": [["[\"add\", 2, 16, 7, 3]", "cuda -keys=cuda,gpu -arch=sm_80 -max_num_threads=1024 -thread_warp_size=32", [-1, 16, 64, 49152, 2147483647, 1024, 8, 32], "", 0, []], [[], [["FU", 2, [0, 1, 2, 3]], ["SP", 2, 0, 672, [4], 1], ["AN", 2, 0, 5], ["AN", 2, 1, 6]]]], "r": [[1.67128e-05], 0, 2.43798, 1720675036], "v": "v0.6"}
