code_generation/generate/deprecated/deprecated_pure_without_shape/log/cuda/asin_cuda.log
{"i": [["[\"asin\", 10, 16, 2, 4]", "cuda -keys=cuda,gpu -arch=sm_80 -max_num_threads=1024 -thread_warp_size=32", [-1, 16, 64, 49152, 2147483647, 1024, 8, 32], "", 0, []], [[], [["FU", 1, [0, 1, 2, 3]], ["SP", 1, 0, 1280, [16], 1], ["AN", 1, 0, 5], ["AN", 1, 1, 6]]]], "r": [[6.08348e-06], 0, 3.17673, 1720688975], "v": "v0.6"}
{"i": [["[\"asin\", 10, 16, 2, 4]", "cuda -keys=cuda,gpu -arch=sm_80 -max_num_threads=1024 -thread_warp_size=32", [-1, 16, 64, 49152, 2147483647, 1024, 8, 32], "", 0, []], [[], [["FU", 1, [0, 1, 2, 3]], ["SP", 1, 0, 1280, [2], 1], ["AN", 1, 0, 5], ["AN", 1, 1, 6]]]], "r": [[7.14156e-06], 0, 1.53024, 1720688975], "v": "v0.6"}
{"i": [["[\"asin\", 10, 16, 2, 4]", "cuda -keys=cuda,gpu -arch=sm_80 -max_num_threads=1024 -thread_warp_size=32", [-1, 16, 64, 49152, 2147483647, 1024, 8, 32], "", 0, []], [[], [["FU", 1, [0, 1, 2, 3]], ["SP", 1, 0, 1280, [40], 1], ["AN", 1, 0, 5], ["AN", 1, 1, 6]]]], "r": [[1.17115e-05], 0, 1.5236, 1720688976], "v": "v0.6"}
{"i": [["[\"asin\", 10, 16, 2, 4]", "cuda -keys=cuda,gpu -arch=sm_80 -max_num_threads=1024 -thread_warp_size=32", [-1, 16, 64, 49152, 2147483647, 1024, 8, 32], "", 0, []], [[], [["FU", 1, [0, 1, 2, 3]], ["SP", 1, 0, 1280, [1], 1], ["AN", 1, 0, 5], ["AN", 1, 1, 6]]]], "r": [[8.00312e-06], 0, 1.87394, 1720688976], "v": "v0.6"}
{"i": [["[\"asin\", 10, 16, 2, 4]", "cuda -keys=cuda,gpu -arch=sm_80 -max_num_threads=1024 -thread_warp_size=32", [-1, 16, 64, 49152, 2147483647, 1024, 8, 32], "", 0, []], [[], [["FU", 1, [0, 1, 2, 3]], ["SP", 1, 0, 1280, [20], 1], ["AN", 1, 0, 5], ["AN", 1, 1, 6]]]], "r": [[5.62359e-06], 0, 2.35567, 1720688976], "v": "v0.6"}
{"i": [["[\"asin\", 10, 16, 2, 4]", "cuda -keys=cuda,gpu -arch=sm_80 -max_num_threads=1024 -thread_warp_size=32", [-1, 16, 64, 49152, 2147483647, 1024, 8, 32], "", 0, []], [[], [["FU", 1, [0, 1, 2, 3]], ["SP", 1, 0, 1280, [32], 1], ["AN", 1, 0, 5], ["AN", 1, 1, 6]]]], "r": [[8.1084e-06], 0, 2.10844, 1720688977], "v": "v0.6"}
{"i": [["[\"asin\", 10, 16, 2, 4]", "cuda -keys=cuda,gpu -arch=sm_80 -max_num_threads=1024 -thread_warp_size=32", [-1, 16, 64, 49152, 2147483647, 1024, 8, 32], "", 0, []], [[], [["FU", 1, [0, 1, 2, 3]], ["SP", 1, 0, 1280, [8], 1], ["AN", 1, 0, 5], ["AN", 1, 1, 6]]]], "r": [[1.10755e-05], 0, 1.78155, 1720688977], "v": "v0.6"}
{"i": [["[\"asin\", 10, 16, 2, 4]", "cuda -keys=cuda,gpu -arch=sm_80 -max_num_threads=1024 -thread_warp_size=32", [-1, 16, 64, 49152, 2147483647, 1024, 8, 32], "", 0, []], [[], [["FU", 1, [0, 1, 2, 3]], ["SP", 1, 0, 1280, [4], 1], ["AN", 1, 0, 5], ["AN", 1, 1, 6]]]], "r": [[6.04967e-06], 0, 1.53372, 1720688978], "v": "v0.6"}
{"i": [["[\"asin\", 10, 16, 2, 4]", "cuda -keys=cuda,gpu -arch=sm_80 -max_num_threads=1024 -thread_warp_size=32", [-1, 16, 64, 49152, 2147483647, 1024, 8, 32], "", 0, []], [[], [["FU", 1, [0, 1, 2, 3]], ["SP", 1, 0, 1280, [5], 1], ["AN", 1, 0, 5], ["AN", 1, 1, 6]]]], "r": [[7.30898e-06], 0, 1.86255, 1720688978], "v": "v0.6"}
{"i": [["[\"asin\", 10, 16, 2, 4]", "cuda -keys=cuda,gpu -arch=sm_80 -max_num_threads=1024 -thread_warp_size=32", [-1, 16, 64, 49152, 2147483647, 1024, 8, 32], "", 0, []], [[], [["FU", 1, [0, 1, 2, 3]], ["SP", 1, 0, 1280, [64], 1], ["AN", 1, 0, 5], ["AN", 1, 1, 6]]]], "r": [[9.0617e-06], 0, 1.32896, 1720688979], "v": "v0.6"}
