code_generation/generate/deprecated/deprecated_pure_without_shape/log/cuda/asinh_cuda.log
{"i": [["[\"asinh\", 7, 15, 17, 1]", "cuda -keys=cuda,gpu -arch=sm_80 -max_num_threads=1024 -thread_warp_size=32", [-1, 16, 64, 49152, 2147483647, 1024, 8, 32], "", 0, []], [[], [["FU", 1, [0, 1, 2, 3]], ["SP", 1, 0, 1785, [35], 1], ["AN", 1, 0, 5], ["AN", 1, 1, 6]]]], "r": [[1.14817e-05], 0, 2.02084, 1720691615], "v": "v0.6"}
{"i": [["[\"asinh\", 7, 15, 17, 1]", "cuda -keys=cuda,gpu -arch=sm_80 -max_num_threads=1024 -thread_warp_size=32", [-1, 16, 64, 49152, 2147483647, 1024, 8, 32], "", 0, []], [[], [["FU", 1, [0, 1, 2, 3]], ["SP", 1, 0, 1785, [24], 1], ["AN", 1, 0, 5], ["AN", 1, 1, 6]]]], "r": [[7.57441e-06], 0, 1.73193, 1720691616], "v": "v0.6"}
{"i": [["[\"asinh\", 7, 15, 17, 1]", "cuda -keys=cuda,gpu -arch=sm_80 -max_num_threads=1024 -thread_warp_size=32", [-1, 16, 64, 49152, 2147483647, 1024, 8, 32], "", 0, []], [[], [["FU", 1, [0, 1, 2, 3]], ["SP", 1, 0, 1785, [48], 1], ["AN", 1, 0, 5], ["AN", 1, 1, 6]]]], "r": [[1.63424e-05], 0, 2.66158, 1720691617], "v": "v0.6"}
{"i": [["[\"asinh\", 7, 15, 17, 1]", "cuda -keys=cuda,gpu -arch=sm_80 -max_num_threads=1024 -thread_warp_size=32", [-1, 16, 64, 49152, 2147483647, 1024, 8, 32], "", 0, []], [[], [["FU", 1, [0, 1, 2, 3]], ["SP", 1, 0, 1785, [6], 1], ["AN", 1, 0, 5], ["AN", 1, 1, 6]]]], "r": [[8.81127e-06], 0, 2.45757, 1720691618], "v": "v0.6"}
{"i": [["[\"asinh\", 7, 15, 17, 1]", "cuda -keys=cuda,gpu -arch=sm_80 -max_num_threads=1024 -thread_warp_size=32", [-1, 16, 64, 49152, 2147483647, 1024, 8, 32], "", 0, []], [[], [["FU", 1, [0, 1, 2, 3]], ["SP", 1, 0, 1785, [21], 1], ["AN", 1, 0, 5], ["AN", 1, 1, 6]]]], "r": [[8.25615e-06], 0, 1.97019, 1720691619], "v": "v0.6"}
{"i": [["[\"asinh\", 7, 15, 17, 1]", "cuda -keys=cuda,gpu -arch=sm_80 -max_num_threads=1024 -thread_warp_size=32", [-1, 16, 64, 49152, 2147483647, 1024, 8, 32], "", 0, []], [[], [["FU", 1, [0, 1, 2, 3]], ["SP", 1, 0, 1785, [2], 1], ["AN", 1, 0, 5], ["AN", 1, 1, 6]]]], "r": [[7.54825e-06], 0, 1.9692, 1720691620], "v": "v0.6"}
{"i": [["[\"asinh\", 7, 15, 17, 1]", "cuda -keys=cuda,gpu -arch=sm_80 -max_num_threads=1024 -thread_warp_size=32", [-1, 16, 64, 49152, 2147483647, 1024, 8, 32], "", 0, []], [[], [["FU", 1, [0, 1, 2, 3]], ["SP", 1, 0, 1785, [7], 1], ["AN", 1, 0, 5], ["AN", 1, 1, 6]]]], "r": [[7.46191e-06], 0, 2.19565, 1720691621], "v": "v0.6"}
{"i": [["[\"asinh\", 7, 15, 17, 1]", "cuda -keys=cuda,gpu -arch=sm_80 -max_num_threads=1024 -thread_warp_size=32", [-1, 16, 64, 49152, 2147483647, 1024, 8, 32], "", 0, []], [[], [["FU", 1, [0, 1, 2, 3]], ["SP", 1, 0, 1785, [3], 1], ["AN", 1, 0, 5], ["AN", 1, 1, 6]]]], "r": [[7.26278e-06], 0, 1.61852, 1720691621], "v": "v0.6"}
{"i": [["[\"asinh\", 7, 15, 17, 1]", "cuda -keys=cuda,gpu -arch=sm_80 -max_num_threads=1024 -thread_warp_size=32", [-1, 16, 64, 49152, 2147483647, 1024, 8, 32], "", 0, []], [[], [["FU", 1, [0, 1, 2, 3]], ["SP", 1, 0, 1785, [18], 1], ["AN", 1, 0, 5], ["AN", 1, 1, 6]]]], "r": [[9.7112e-06], 0, 1.98537, 1720691622], "v": "v0.6"}
{"i": [["[\"asinh\", 7, 15, 17, 1]", "cuda -keys=cuda,gpu -arch=sm_80 -max_num_threads=1024 -thread_warp_size=32", [-1, 16, 64, 49152, 2147483647, 1024, 8, 32], "", 0, []], [[], [["FU", 1, [0, 1, 2, 3]], ["SP", 1, 0, 1785, [1], 1], ["AN", 1, 0, 5], ["AN", 1, 1, 6]]]], "r": [[1.60737e-05], 0, 1.60936, 1720691622], "v": "v0.6"}
