code_generation/generate/deprecated/deprecated_pure_without_shape/log/cuda/atan_cuda.log
{"i": [["[\"atan\", 12, 11, 2, 17]", "cuda -keys=cuda,gpu -arch=sm_80 -max_num_threads=1024 -thread_warp_size=32", [-1, 16, 64, 49152, 2147483647, 1024, 8, 32], "", 0, []], [[], [["FU", 1, [0, 1, 2, 3]], ["SP", 1, 0, 4488, [8], 1], ["AN", 1, 0, 5], ["AN", 1, 1, 6]]]], "r": [[1.90925e-05], 0, 2.96226, 1720677778], "v": "v0.6"}
{"i": [["[\"atan\", 12, 11, 2, 17]", "cuda -keys=cuda,gpu -arch=sm_80 -max_num_threads=1024 -thread_warp_size=32", [-1, 16, 64, 49152, 2147483647, 1024, 8, 32], "", 0, []], [[], [["FU", 1, [0, 1, 2, 3]], ["SP", 1, 0, 4488, [2], 1], ["AN", 1, 0, 5], ["AN", 1, 1, 6]]]], "r": [[1.72302e-05], 0, 1.79713, 1720677779], "v": "v0.6"}
{"i": [["[\"atan\", 12, 11, 2, 17]", "cuda -keys=cuda,gpu -arch=sm_80 -max_num_threads=1024 -thread_warp_size=32", [-1, 16, 64, 49152, 2147483647, 1024, 8, 32], "", 0, []], [[], [["FU", 1, [0, 1, 2, 3]], ["SP", 1, 0, 4488, [22], 1], ["AN", 1, 0, 5], ["AN", 1, 1, 6]]]], "r": [[6.33819e-06], 0, 1.92756, 1720677779], "v": "v0.6"}
{"i": [["[\"atan\", 12, 11, 2, 17]", "cuda -keys=cuda,gpu -arch=sm_80 -max_num_threads=1024 -thread_warp_size=32", [-1, 16, 64, 49152, 2147483647, 1024, 8, 32], "", 0, []], [[], [["FU", 1, [0, 1, 2, 3]], ["SP", 1, 0, 4488, [4], 1], ["AN", 1, 0, 5], ["AN", 1, 1, 6]]]], "r": [[1.23316e-05], 0, 2.17753, 1720677780], "v": "v0.6"}
{"i": [["[\"atan\", 12, 11, 2, 17]", "cuda -keys=cuda,gpu -arch=sm_80 -max_num_threads=1024 -thread_warp_size=32", [-1, 16, 64, 49152, 2147483647, 1024, 8, 32], "", 0, []], [[], [["FU", 1, [0, 1, 2, 3]], ["SP", 1, 0, 4488, [34], 1], ["AN", 1, 0, 5], ["AN", 1, 1, 6]]]], "r": [[1.47435e-05], 0, 1.88733, 1720677781], "v": "v0.6"}
{"i": [["[\"atan\", 12, 11, 2, 17]", "cuda -keys=cuda,gpu -arch=sm_80 -max_num_threads=1024 -thread_warp_size=32", [-1, 16, 64, 49152, 2147483647, 1024, 8, 32], "", 0, []], [[], [["FU", 1, [0, 1, 2, 3]], ["SP", 1, 0, 4488, [17], 1], ["AN", 1, 0, 5], ["AN", 1, 1, 6]]]], "r": [[7.39255e-06], 0, 1.49355, 1720677781], "v": "v0.6"}
{"i": [["[\"atan\", 12, 11, 2, 17]", "cuda -keys=cuda,gpu -arch=sm_80 -max_num_threads=1024 -thread_warp_size=32", [-1, 16, 64, 49152, 2147483647, 1024, 8, 32], "", 0, []], [[], [["FU", 1, [0, 1, 2, 3]], ["SP", 1, 0, 4488, [44], 1], ["AN", 1, 0, 5], ["AN", 1, 1, 6]]]], "r": [[7.64561e-06], 0, 1.95471, 1720677781], "v": "v0.6"}
{"i": [["[\"atan\", 12, 11, 2, 17]", "cuda -keys=cuda,gpu -arch=sm_80 -max_num_threads=1024 -thread_warp_size=32", [-1, 16, 64, 49152, 2147483647, 1024, 8, 32], "", 0, []], [[], [["FU", 1, [0, 1, 2, 3]], ["SP", 1, 0, 4488, [33], 1], ["AN", 1, 0, 5], ["AN", 1, 1, 6]]]], "r": [[6.29193e-06], 0, 1.94718, 1720677782], "v": "v0.6"}
{"i": [["[\"atan\", 12, 11, 2, 17]", "cuda -keys=cuda,gpu -arch=sm_80 -max_num_threads=1024 -thread_warp_size=32", [-1, 16, 64, 49152, 2147483647, 1024, 8, 32], "", 0, []], [[], [["FU", 1, [0, 1, 2, 3]], ["SP", 1, 0, 4488, [12], 1], ["AN", 1, 0, 5], ["AN", 1, 1, 6]]]], "r": [[6.59227e-06], 0, 1.30976, 1720677782], "v": "v0.6"}
{"i": [["[\"atan\", 12, 11, 2, 17]", "cuda -keys=cuda,gpu -arch=sm_80 -max_num_threads=1024 -thread_warp_size=32", [-1, 16, 64, 49152, 2147483647, 1024, 8, 32], "", 0, []], [[], [["FU", 1, [0, 1, 2, 3]], ["SP", 1, 0, 4488, [1], 1], ["AN", 1, 0, 5], ["AN", 1, 1, 6]]]], "r": [[1.7833e-05], 0, 3.17842, 1720677783], "v": "v0.6"}
