code_generation/generate/deprecated/deprecated_pure_without_shape/log/cuda/atanh_cuda.log
{"i": [["[\"atanh\", 12, 7, 12, 13]", "cuda -keys=cuda,gpu -arch=sm_80 -max_num_threads=1024 -thread_warp_size=32", [-1, 16, 64, 49152, 2147483647, 1024, 8, 32], "", 0, []], [[], [["FU", 1, [0, 1, 2, 3]], ["SP", 1, 0, 13104, [26], 1], ["AN", 1, 0, 5], ["AN", 1, 1, 6]]]], "r": [[1.00103e-05], 0, 2.51005, 1720693954], "v": "v0.6"}
{"i": [["[\"atanh\", 12, 7, 12, 13]", "cuda -keys=cuda,gpu -arch=sm_80 -max_num_threads=1024 -thread_warp_size=32", [-1, 16, 64, 49152, 2147483647, 1024, 8, 32], "", 0, []], [[], [["FU", 1, [0, 1, 2, 3]], ["SP", 1, 0, 13104, [24], 1], ["AN", 1, 0, 5], ["AN", 1, 1, 6]]]], "r": [[9.05216e-06], 0, 1.58392, 1720693954], "v": "v0.6"}
{"i": [["[\"atanh\", 12, 7, 12, 13]", "cuda -keys=cuda,gpu -arch=sm_80 -max_num_threads=1024 -thread_warp_size=32", [-1, 16, 64, 49152, 2147483647, 1024, 8, 32], "", 0, []], [[], [["FU", 1, [0, 1, 2, 3]], ["SP", 1, 0, 13104, [39], 1], ["AN", 1, 0, 5], ["AN", 1, 1, 6]]]], "r": [[6.90875e-06], 0, 1.10678, 1720693955], "v": "v0.6"}
{"i": [["[\"atanh\", 12, 7, 12, 13]", "cuda -keys=cuda,gpu -arch=sm_80 -max_num_threads=1024 -thread_warp_size=32", [-1, 16, 64, 49152, 2147483647, 1024, 8, 32], "", 0, []], [[], [["FU", 1, [0, 1, 2, 3]], ["SP", 1, 0, 13104, [13], 1], ["AN", 1, 0, 5], ["AN", 1, 1, 6]]]], "r": [[1.11848e-05], 0, 1.81384, 1720693955], "v": "v0.6"}
{"i": [["[\"atanh\", 12, 7, 12, 13]", "cuda -keys=cuda,gpu -arch=sm_80 -max_num_threads=1024 -thread_warp_size=32", [-1, 16, 64, 49152, 2147483647, 1024, 8, 32], "", 0, []], [[], [["FU", 1, [0, 1, 2, 3]], ["SP", 1, 0, 13104, [63], 1], ["AN", 1, 0, 5], ["AN", 1, 1, 6]]]], "r": [[6.16675e-06], 0, 1.17952, 1720693955], "v": "v0.6"}
{"i": [["[\"atanh\", 12, 7, 12, 13]", "cuda -keys=cuda,gpu -arch=sm_80 -max_num_threads=1024 -thread_warp_size=32", [-1, 16, 64, 49152, 2147483647, 1024, 8, 32], "", 0, []], [[], [["FU", 1, [0, 1, 2, 3]], ["SP", 1, 0, 13104, [56], 1], ["AN", 1, 0, 5], ["AN", 1, 1, 6]]]], "r": [[8.23385e-06], 0, 1.35875, 1720693956], "v": "v0.6"}
{"i": [["[\"atanh\", 12, 7, 12, 13]", "cuda -keys=cuda,gpu -arch=sm_80 -max_num_threads=1024 -thread_warp_size=32", [-1, 16, 64, 49152, 2147483647, 1024, 8, 32], "", 0, []], [[], [["FU", 1, [0, 1, 2, 3]], ["SP", 1, 0, 13104, [12], 1], ["AN", 1, 0, 5], ["AN", 1, 1, 6]]]], "r": [[7.57759e-06], 0, 1.101, 1720693956], "v": "v0.6"}
{"i": [["[\"atanh\", 12, 7, 12, 13]", "cuda -keys=cuda,gpu -arch=sm_80 -max_num_threads=1024 -thread_warp_size=32", [-1, 16, 64, 49152, 2147483647, 1024, 8, 32], "", 0, []], [[], [["FU", 1, [0, 1, 2, 3]], ["SP", 1, 0, 13104, [1], 1], ["AN", 1, 0, 5], ["AN", 1, 1, 6]]]], "r": [[3.36382e-05], 0, 1.80959, 1720693956], "v": "v0.6"}
{"i": [["[\"atanh\", 12, 7, 12, 13]", "cuda -keys=cuda,gpu -arch=sm_80 -max_num_threads=1024 -thread_warp_size=32", [-1, 16, 64, 49152, 2147483647, 1024, 8, 32], "", 0, []], [[], [["FU", 1, [0, 1, 2, 3]], ["SP", 1, 0, 13104, [21], 1], ["AN", 1, 0, 5], ["AN", 1, 1, 6]]]], "r": [[6.77557e-06], 0, 1.00241, 1720693957], "v": "v0.6"}
{"i": [["[\"atanh\", 12, 7, 12, 13]", "cuda -keys=cuda,gpu -arch=sm_80 -max_num_threads=1024 -thread_warp_size=32", [-1, 16, 64, 49152, 2147483647, 1024, 8, 32], "", 0, []], [[], [["FU", 1, [0, 1, 2, 3]], ["SP", 1, 0, 13104, [48], 1], ["AN", 1, 0, 5], ["AN", 1, 1, 6]]]], "r": [[9.71941e-06], 0, 1.23957, 1720693957], "v": "v0.6"}
