code_generation/generate/deprecated/deprecated_pure_without_shape/log/cuda/batch_norm_cuda.log
{"i": [["[\"batch_norm\", 20, 12, 5, 4]", "cuda -keys=cuda,gpu -arch=sm_80 -max_num_threads=1024 -thread_warp_size=32", [-1, 16, 64, 49152, 2147483647, 1024, 8, 32], "", 0, []], [[], [["CI", 7], ["CI", 6], ["CI", 5], ["CI", 3], ["CI", 2], ["FU", 8, [0, 1, 2, 3]], ["SP", 8, 0, 4800, [4], 1], ["AN", 8, 0, 5], ["AN", 8, 1, 6]]]], "r": [[8.02529e-06], 0, 1.68471, 1720777208], "v": "v0.6"}
{"i": [["[\"batch_norm\", 20, 12, 5, 4]", "cuda -keys=cuda,gpu -arch=sm_80 -max_num_threads=1024 -thread_warp_size=32", [-1, 16, 64, 49152, 2147483647, 1024, 8, 32], "", 0, []], [[], [["CI", 7], ["CI", 6], ["CI", 5], ["CI", 3], ["CI", 2], ["FU", 8, [0, 1, 2, 3]], ["SP", 8, 0, 4800, [10], 1], ["AN", 8, 0, 5], ["AN", 8, 1, 6]]]], "r": [[6.62772e-06], 0, 1.14794, 1720777208], "v": "v0.6"}
{"i": [["[\"batch_norm\", 20, 12, 5, 4]", "cuda -keys=cuda,gpu -arch=sm_80 -max_num_threads=1024 -thread_warp_size=32", [-1, 16, 64, 49152, 2147483647, 1024, 8, 32], "", 0, []], [[], [["CI", 7], ["CI", 6], ["CI", 5], ["CI", 3], ["CI", 2], ["FU", 8, [0, 1, 2, 3]], ["SP", 8, 0, 4800, [25], 1], ["AN", 8, 0, 5], ["AN", 8, 1, 6]]]], "r": [[6.20825e-06], 0, 1.14424, 1720777208], "v": "v0.6"}
{"i": [["[\"batch_norm\", 20, 12, 5, 4]", "cuda -keys=cuda,gpu -arch=sm_80 -max_num_threads=1024 -thread_warp_size=32", [-1, 16, 64, 49152, 2147483647, 1024, 8, 32], "", 0, []], [[], [["CI", 7], ["CI", 6], ["CI", 5], ["CI", 3], ["CI", 2], ["FU", 8, [0, 1, 2, 3]], ["SP", 8, 0, 4800, [3], 1], ["AN", 8, 0, 5], ["AN", 8, 1, 6]]]], "r": [[8.6305e-06], 0, 1.25178, 1720777209], "v": "v0.6"}
{"i": [["[\"batch_norm\", 20, 12, 5, 4]", "cuda -keys=cuda,gpu -arch=sm_80 -max_num_threads=1024 -thread_warp_size=32", [-1, 16, 64, 49152, 2147483647, 1024, 8, 32], "", 0, []], [[], [["CI", 7], ["CI", 6], ["CI", 5], ["CI", 3], ["CI", 2], ["FU", 8, [0, 1, 2, 3]], ["SP", 8, 0, 4800, [6], 1], ["AN", 8, 0, 5], ["AN", 8, 1, 6]]]], "r": [[7.07982e-06], 0, 0.989064, 1720777209], "v": "v0.6"}
{"i": [["[\"batch_norm\", 20, 12, 5, 4]", "cuda -keys=cuda,gpu -arch=sm_80 -max_num_threads=1024 -thread_warp_size=32", [-1, 16, 64, 49152, 2147483647, 1024, 8, 32], "", 0, []], [[], [["CI", 7], ["CI", 6], ["CI", 5], ["CI", 3], ["CI", 2], ["FU", 8, [0, 1, 2, 3]], ["SP", 8, 0, 4800, [16], 1], ["AN", 8, 0, 5], ["AN", 8, 1, 6]]]], "r": [[6.50579e-06], 0, 1.12354, 1720777209], "v": "v0.6"}
{"i": [["[\"batch_norm\", 20, 12, 5, 4]", "cuda -keys=cuda,gpu -arch=sm_80 -max_num_threads=1024 -thread_warp_size=32", [-1, 16, 64, 49152, 2147483647, 1024, 8, 32], "", 0, []], [[], [["CI", 7], ["CI", 6], ["CI", 5], ["CI", 3], ["CI", 2], ["FU", 8, [0, 1, 2, 3]], ["SP", 8, 0, 4800, [15], 1], ["AN", 8, 0, 5], ["AN", 8, 1, 6]]]], "r": [[6.51752e-06], 0, 0.864308, 1720777210], "v": "v0.6"}
{"i": [["[\"batch_norm\", 20, 12, 5, 4]", "cuda -keys=cuda,gpu -arch=sm_80 -max_num_threads=1024 -thread_warp_size=32", [-1, 16, 64, 49152, 2147483647, 1024, 8, 32], "", 0, []], [[], [["CI", 7], ["CI", 6], ["CI", 5], ["CI", 3], ["CI", 2], ["FU", 8, [0, 1, 2, 3]], ["SP", 8, 0, 4800, [20], 1], ["AN", 8, 0, 5], ["AN", 8, 1, 6]]]], "r": [[8.40582e-06], 0, 1.02642, 1720777210], "v": "v0.6"}
{"i": [["[\"batch_norm\", 20, 12, 5, 4]", "cuda -keys=cuda,gpu -arch=sm_80 -max_num_threads=1024 -thread_warp_size=32", [-1, 16, 64, 49152, 2147483647, 1024, 8, 32], "", 0, []], [[], [["CI", 7], ["CI", 6], ["CI", 5], ["CI", 3], ["CI", 2], ["FU", 8, [0, 1, 2, 3]], ["SP", 8, 0, 4800, [30], 1], ["AN", 8, 0, 5], ["AN", 8, 1, 6]]]], "r": [[6.1574e-06], 0, 1.35957, 1720777210], "v": "v0.6"}
{"i": [["[\"batch_norm\", 20, 12, 5, 4]", "cuda -keys=cuda,gpu -arch=sm_80 -max_num_threads=1024 -thread_warp_size=32", [-1, 16, 64, 49152, 2147483647, 1024, 8, 32], "", 0, []], [[], [["CI", 7], ["CI", 6], ["CI", 5], ["CI", 3], ["CI", 2], ["FU", 8, [0, 1, 2, 3]], ["SP", 8, 0, 4800, [12], 1], ["AN", 8, 0, 5], ["AN", 8, 1, 6]]]], "r": [[6.70366e-06], 0, 1.33943, 1720777211], "v": "v0.6"}
