code_generation/generate/deprecated/deprecated_pure_without_shape/log/cuda/ceil_cuda.log
{"i": [["[\"ceil\", 14, 2, 2, 16]", "cuda -keys=cuda,gpu -arch=sm_80 -max_num_threads=1024 -thread_warp_size=32", [-1, 16, 64, 49152, 2147483647, 1024, 8, 32], "", 0, []], [[], [["FU", 1, [0, 1, 2, 3]], ["SP", 1, 0, 896, [8], 1], ["AN", 1, 0, 5], ["AN", 1, 1, 6]]]], "r": [[6.76163e-06], 0, 1.56795, 1720696897], "v": "v0.6"}
{"i": [["[\"ceil\", 14, 2, 2, 16]", "cuda -keys=cuda,gpu -arch=sm_80 -max_num_threads=1024 -thread_warp_size=32", [-1, 16, 64, 49152, 2147483647, 1024, 8, 32], "", 0, []], [[], [["FU", 1, [0, 1, 2, 3]], ["SP", 1, 0, 896, [1], 1], ["AN", 1, 0, 5], ["AN", 1, 1, 6]]]], "r": [[1.08193e-05], 0, 1.9393, 1720696898], "v": "v0.6"}
{"i": [["[\"ceil\", 14, 2, 2, 16]", "cuda -keys=cuda,gpu -arch=sm_80 -max_num_threads=1024 -thread_warp_size=32", [-1, 16, 64, 49152, 2147483647, 1024, 8, 32], "", 0, []], [[], [["FU", 1, [0, 1, 2, 3]], ["SP", 1, 0, 896, [2], 1], ["AN", 1, 0, 5], ["AN", 1, 1, 6]]]], "r": [[9.50887e-06], 0, 2.27012, 1720696898], "v": "v0.6"}
{"i": [["[\"ceil\", 14, 2, 2, 16]", "cuda -keys=cuda,gpu -arch=sm_80 -max_num_threads=1024 -thread_warp_size=32", [-1, 16, 64, 49152, 2147483647, 1024, 8, 32], "", 0, []], [[], [["FU", 1, [0, 1, 2, 3]], ["SP", 1, 0, 896, [28], 1], ["AN", 1, 0, 5], ["AN", 1, 1, 6]]]], "r": [[5.43669e-06], 0, 1.54963, 1720696899], "v": "v0.6"}
{"i": [["[\"ceil\", 14, 2, 2, 16]", "cuda -keys=cuda,gpu -arch=sm_80 -max_num_threads=1024 -thread_warp_size=32", [-1, 16, 64, 49152, 2147483647, 1024, 8, 32], "", 0, []], [[], [["FU", 1, [0, 1, 2, 3]], ["SP", 1, 0, 896, [56], 1], ["AN", 1, 0, 5], ["AN", 1, 1, 6]]]], "r": [[1.04307e-05], 0, 2.03549, 1720696899], "v": "v0.6"}
{"i": [["[\"ceil\", 14, 2, 2, 16]", "cuda -keys=cuda,gpu -arch=sm_80 -max_num_threads=1024 -thread_warp_size=32", [-1, 16, 64, 49152, 2147483647, 1024, 8, 32], "", 0, []], [[], [["FU", 1, [0, 1, 2, 3]], ["SP", 1, 0, 896, [4], 1], ["AN", 1, 0, 5], ["AN", 1, 1, 6]]]], "r": [[5.82478e-06], 0, 1.20911, 1720696899], "v": "v0.6"}
{"i": [["[\"ceil\", 14, 2, 2, 16]", "cuda -keys=cuda,gpu -arch=sm_80 -max_num_threads=1024 -thread_warp_size=32", [-1, 16, 64, 49152, 2147483647, 1024, 8, 32], "", 0, []], [[], [["FU", 1, [0, 1, 2, 3]], ["SP", 1, 0, 896, [32], 1], ["AN", 1, 0, 5], ["AN", 1, 1, 6]]]], "r": [[8.44894e-06], 0, 1.45361, 1720696900], "v": "v0.6"}
{"i": [["[\"ceil\", 14, 2, 2, 16]", "cuda -keys=cuda,gpu -arch=sm_80 -max_num_threads=1024 -thread_warp_size=32", [-1, 16, 64, 49152, 2147483647, 1024, 8, 32], "", 0, []], [[], [["FU", 1, [0, 1, 2, 3]], ["SP", 1, 0, 896, [7], 1], ["AN", 1, 0, 5], ["AN", 1, 1, 6]]]], "r": [[5.69606e-06], 0, 1.60575, 1720696900], "v": "v0.6"}
{"i": [["[\"ceil\", 14, 2, 2, 16]", "cuda -keys=cuda,gpu -arch=sm_80 -max_num_threads=1024 -thread_warp_size=32", [-1, 16, 64, 49152, 2147483647, 1024, 8, 32], "", 0, []], [[], [["FU", 1, [0, 1, 2, 3]], ["SP", 1, 0, 896, [64], 1], ["AN", 1, 0, 5], ["AN", 1, 1, 6]]]], "r": [[5.34469e-06], 0, 1.65213, 1720696901], "v": "v0.6"}
{"i": [["[\"ceil\", 14, 2, 2, 16]", "cuda -keys=cuda,gpu -arch=sm_80 -max_num_threads=1024 -thread_warp_size=32", [-1, 16, 64, 49152, 2147483647, 1024, 8, 32], "", 0, []], [[], [["FU", 1, [0, 1, 2, 3]], ["SP", 1, 0, 896, [16], 1], ["AN", 1, 0, 5], ["AN", 1, 1, 6]]]], "r": [[6.72489e-06], 0, 1.63611, 1720696901], "v": "v0.6"}
