code_generation/generate/deprecated/deprecated_pure_without_shape/log/cuda/combination_op_cuda.log
{"i": [["[\"combination_op\", 6, 11, 20, 1]", "cuda -keys=cuda,gpu -arch=sm_80 -max_num_threads=1024 -thread_warp_size=32", [-1, 16, 64, 49152, 2147483647, 1024, 8, 32], "", 0, []], [[], [["CI", 3], ["CI", 1], ["FU", 4, [0, 1, 2, 3]], ["SP", 4, 0, 1320, [11], 1], ["AN", 4, 0, 5], ["AN", 4, 1, 6]]]], "r": [[5.95317e-06], 0, 2.21885, 1720747959], "v": "v0.6"}
{"i": [["[\"combination_op\", 6, 11, 20, 1]", "cuda -keys=cuda,gpu -arch=sm_80 -max_num_threads=1024 -thread_warp_size=32", [-1, 16, 64, 49152, 2147483647, 1024, 8, 32], "", 0, []], [[], [["CI", 3], ["CI", 1], ["FU", 4, [0, 1, 2, 3]], ["SP", 4, 0, 1320, [16], 1], ["AN", 4, 0, 5], ["AN", 4, 1, 6]]]], "r": [[6.71366e-06], 0, 1.50373, 1720747960], "v": "v0.6"}
{"i": [["[\"combination_op\", 6, 11, 20, 1]", "cuda -keys=cuda,gpu -arch=sm_80 -max_num_threads=1024 -thread_warp_size=32", [-1, 16, 64, 49152, 2147483647, 1024, 8, 32], "", 0, []], [[], [["CI", 3], ["CI", 1], ["FU", 4, [0, 1, 2, 3]], ["SP", 4, 0, 1320, [12], 1], ["AN", 4, 0, 5], ["AN", 4, 1, 6]]]], "r": [[6.02118e-06], 0, 0.893137, 1720747960], "v": "v0.6"}
{"i": [["[\"combination_op\", 6, 11, 20, 1]", "cuda -keys=cuda,gpu -arch=sm_80 -max_num_threads=1024 -thread_warp_size=32", [-1, 16, 64, 49152, 2147483647, 1024, 8, 32], "", 0, []], [[], [["CI", 3], ["CI", 1], ["FU", 4, [0, 1, 2, 3]], ["SP", 4, 0, 1320, [60], 1], ["AN", 4, 0, 5], ["AN", 4, 1, 6]]]], "r": [[5.89693e-06], 0, 1.08747, 1720747960], "v": "v0.6"}
{"i": [["[\"combination_op\", 6, 11, 20, 1]", "cuda -keys=cuda,gpu -arch=sm_80 -max_num_threads=1024 -thread_warp_size=32", [-1, 16, 64, 49152, 2147483647, 1024, 8, 32], "", 0, []], [[], [["CI", 3], ["CI", 1], ["FU", 4, [0, 1, 2, 3]], ["SP", 4, 0, 1320, [4], 1], ["AN", 4, 0, 5], ["AN", 4, 1, 6]]]], "r": [[6.37694e-06], 0, 1.00523, 1720747961], "v": "v0.6"}
{"i": [["[\"combination_op\", 6, 11, 20, 1]", "cuda -keys=cuda,gpu -arch=sm_80 -max_num_threads=1024 -thread_warp_size=32", [-1, 16, 64, 49152, 2147483647, 1024, 8, 32], "", 0, []], [[], [["CI", 3], ["CI", 1], ["FU", 4, [0, 1, 2, 3]], ["SP", 4, 0, 1320, [33], 1], ["AN", 4, 0, 5], ["AN", 4, 1, 6]]]], "r": [[5.90272e-06], 0, 1.02113, 1720747961], "v": "v0.6"}
{"i": [["[\"combination_op\", 6, 11, 20, 1]", "cuda -keys=cuda,gpu -arch=sm_80 -max_num_threads=1024 -thread_warp_size=32", [-1, 16, 64, 49152, 2147483647, 1024, 8, 32], "", 0, []], [[], [["CI", 3], ["CI", 1], ["FU", 4, [0, 1, 2, 3]], ["SP", 4, 0, 1320, [1], 1], ["AN", 4, 0, 5], ["AN", 4, 1, 6]]]], "r": [[8.25428e-06], 0, 1.38713, 1720747961], "v": "v0.6"}
{"i": [["[\"combination_op\", 6, 11, 20, 1]", "cuda -keys=cuda,gpu -arch=sm_80 -max_num_threads=1024 -thread_warp_size=32", [-1, 16, 64, 49152, 2147483647, 1024, 8, 32], "", 0, []], [[], [["CI", 3], ["CI", 1], ["FU", 4, [0, 1, 2, 3]], ["SP", 4, 0, 1320, [15], 1], ["AN", 4, 0, 5], ["AN", 4, 1, 6]]]], "r": [[5.90232e-06], 0, 0.992421, 1720747961], "v": "v0.6"}
{"i": [["[\"combination_op\", 6, 11, 20, 1]", "cuda -keys=cuda,gpu -arch=sm_80 -max_num_threads=1024 -thread_warp_size=32", [-1, 16, 64, 49152, 2147483647, 1024, 8, 32], "", 0, []], [[], [["CI", 3], ["CI", 1], ["FU", 4, [0, 1, 2, 3]], ["SP", 4, 0, 1320, [40], 1], ["AN", 4, 0, 5], ["AN", 4, 1, 6]]]], "r": [[5.85242e-06], 0, 1.02079, 1720747962], "v": "v0.6"}
{"i": [["[\"combination_op\", 6, 11, 20, 1]", "cuda -keys=cuda,gpu -arch=sm_80 -max_num_threads=1024 -thread_warp_size=32", [-1, 16, 64, 49152, 2147483647, 1024, 8, 32], "", 0, []], [[], [["CI", 3], ["CI", 1], ["FU", 4, [0, 1, 2, 3]], ["SP", 4, 0, 1320, [2], 1], ["AN", 4, 0, 5], ["AN", 4, 1, 6]]]], "r": [[6.81677e-06], 0, 1.34342, 1720747962], "v": "v0.6"}
