code_generation/generate/deprecated/deprecated_pure_without_shape/log/cuda/conv1d_cuda.log
{"i": [["[\"conv1d\", 15, 16, 6, 33, 46, 11, 16, [1, 1], [1, 1]]", "cuda -keys=cuda,gpu -arch=sm_80 -max_num_threads=1024 -thread_warp_size=32", [-1, 16, 64, 49152, 2147483647, 1024, 8, 32], "", 0, []], [[], [["CHW", 3, "local"], ["SP", 3, 0, 2, [1, 1, 1, 1], 1], ["SP", 3, 5, 5, [1, 1, 1, 1], 1], ["SP", 3, 10, 4, [1, 1, 1, 1], 1], ["SP", 3, 15, 3, [3, 1], 1], ["SP", 3, 18, 3, [1, 1], 1], ["RE", 3, [0, 5, 10, 1, 6, 11, 2, 7, 12, 15, 18, 16, 19, 3, 8, 13, 17, 20, 4, 9, 14]], ["FSP", 4, 0, 1, 3], ["FSP", 4, 4, 2, 3], ["FSP", 4, 8, 3, 3], ["RE", 4, [0, 4, 8, 1, 5, 9, 2, 6, 10, 3, 7, 11]], ["CA", 3, 4, 8], ["CHR", 2, "shared", [3]], ["CA", 3, 4, 10], ["CHR", 1, "shared", [4]], ["CA", 2, 5, 10], ["CI", 1], ["FU", 6, [0, 1, 2]], ["AN", 6, 0, 5], ["FU", 6, [1, 2, 3]], ["AN", 6, 1, 4], ["FU", 6, [2, 3, 4]], ["AN", 6, 2, 6], ["FU", 4, [0, 1, 2]], ["SP", 4, 0, 3, [1], 1], ["AN", 4, 1, 2], ["FFSP", 4, 0, [3, 2, 1], 1, 1], ["AN", 4, 1, 6], ["FU", 2, [0, 1, 2]], ["SP", 2, 0, 3, [3], 1], ["AN", 2, 1, 2], ["FFSP", 2, 0, [3, 2, 1], 1, 1], ["AN", 2, 1, 6], ["PR", 5, 0, "auto_unroll_max_step$0"]]]], "r": [[6.88494e-06], 0, 1.4567, 1720596961], "v": "v0.6"}
{"i": [["[\"conv1d\", 15, 16, 6, 33, 46, 11, 16, [1, 1], [1, 1]]", "cuda -keys=cuda,gpu -arch=sm_80 -max_num_threads=1024 -thread_warp_size=32", [-1, 16, 64, 49152, 2147483647, 1024, 8, 32], "", 0, []], [[], [["CHW", 3, "local"], ["SP", 3, 0, 2, [1, 1, 1, 1], 1], ["SP", 3, 5, 5, [1, 1, 1, 5], 1], ["SP", 3, 10, 4, [2, 1, 2, 1], 1], ["SP", 3, 15, 3, [3, 1], 1], ["SP", 3, 18, 3, [1, 3], 1], ["RE", 3, [0, 5, 10, 1, 6, 11, 2, 7, 12, 15, 18, 16, 19, 3, 8, 13, 17, 20, 4, 9, 14]], ["FSP", 4, 0, 1, 3], ["FSP", 4, 4, 2, 3], ["FSP", 4, 8, 3, 3], ["RE", 4, [0, 4, 8, 1, 5, 9, 2, 6, 10, 3, 7, 11]], ["CA", 3, 4, 8], ["CHR", 2, "shared", [3]], ["CA", 3, 4, 10], ["CHR", 1, "shared", [4]], ["CA", 2, 5, 10], ["CI", 1], ["FU", 6, [0, 1, 2]], ["AN", 6, 0, 5], ["FU", 6, [1, 2, 3]], ["AN", 6, 1, 4], ["FU", 6, [2, 3, 4]], ["AN", 6, 2, 6], ["FU", 4, [0, 1, 2]], ["SP", 4, 0, 45, [1], 1], ["AN", 4, 1, 2], ["FFSP", 4, 0, [3, 2, 1], 1, 1], ["AN", 4, 1, 6], ["FU", 2, [0, 1, 2]], ["SP", 2, 0, 15, [1], 1], ["AN", 2, 1, 2], ["FFSP", 2, 0, [3, 2, 1], 1, 1], ["AN", 2, 1, 6], ["PR", 5, 0, "auto_unroll_max_step$0"]]]], "r": [[9.40266e-06], 0, 1.09022, 1720596962], "v": "v0.6"}
{"i": [["[\"conv1d\", 15, 16, 6, 33, 46, 11, 16, [1, 1], [1, 1]]", "cuda -keys=cuda,gpu -arch=sm_80 -max_num_threads=1024 -thread_warp_size=32", [-1, 16, 64, 49152, 2147483647, 1024, 8, 32], "", 0, []], [[], [["CHW", 3, "local"], ["SP", 3, 0, 2, [2, 1, 1, 1], 1], ["SP", 3, 5, 5, [1, 1, 1, 1], 1], ["SP", 3, 10, 4, [1, 1, 1, 1], 1], ["SP", 3, 15, 3, [1, 3], 1], ["SP", 3, 18, 3, [1, 1], 1], ["RE", 3, [0, 5, 10, 1, 6, 11, 2, 7, 12, 15, 18, 16, 19, 3, 8, 13, 17, 20, 4, 9, 14]], ["FSP", 4, 0, 1, 3], ["FSP", 4, 4, 2, 3], ["FSP", 4, 8, 3, 3], ["RE", 4, [0, 4, 8, 1, 5, 9, 2, 6, 10, 3, 7, 11]], ["CA", 3, 4, 8], ["CHR", 2, "shared", [3]], ["CA", 3, 4, 10], ["CHR", 1, "shared", [4]], ["CA", 2, 5, 10], ["CI", 1], ["FU", 6, [0, 1, 2]], ["AN", 6, 0, 5], ["FU", 6, [1, 2, 3]], ["AN", 6, 1, 4], ["FU", 6, [2, 3, 4]], ["AN", 6, 2, 6], ["FU", 4, [0, 1, 2]], ["SP", 4, 0, 3, [3], 1], ["AN", 4, 1, 2], ["FFSP", 4, 0, [3, 2, 1], 1, 1], ["AN", 4, 1, 6], ["FU", 2, [0, 1, 2]], ["SP", 2, 0, 6, [1], 1], ["AN", 2, 1, 2], ["FFSP", 2, 0, [3, 2, 1], 1, 1], ["AN", 2, 1, 6], ["PR", 5, 0, "auto_unroll_max_step$0"]]]], "r": [[6.34496e-06], 0, 0.895774, 1720596962], "v": "v0.6"}
{"i": [["[\"conv1d\", 15, 16, 6, 33, 46, 11, 16, [1, 1], [1, 1]]", "cuda -keys=cuda,gpu -arch=sm_80 -max_num_threads=1024 -thread_warp_size=32", [-1, 16, 64, 49152, 2147483647, 1024, 8, 32], "", 0, []], [[], [["CHW", 3, "local"], ["SP", 3, 0, 2, [1, 1, 1, 2], 1], ["SP", 3, 5, 5, [1, 1, 1, 5], 1], ["SP", 3, 10, 4, [1, 1, 4, 1], 1], ["SP", 3, 15, 3, [3, 1], 1], ["SP", 3, 18, 3, [1, 3], 1], ["RE", 3, [0, 5, 10, 1, 6, 11, 2, 7, 12, 15, 18, 16, 19, 3, 8, 13, 17, 20, 4, 9, 14]], ["FSP", 4, 0, 1, 3], ["FSP", 4, 4, 2, 3], ["FSP", 4, 8, 3, 3], ["RE", 4, [0, 4, 8, 1, 5, 9, 2, 6, 10, 3, 7, 11]], ["CA", 3, 4, 8], ["CHR", 2, "shared", [3]], ["CA", 3, 4, 10], ["CHR", 1, "shared", [4]], ["CA", 2, 5, 10], ["CI", 1], ["FU", 6, [0, 1, 2]], ["AN", 6, 0, 5], ["FU", 6, [1, 2, 3]], ["AN", 6, 1, 4], ["FU", 6, [2, 3, 4]], ["AN", 6, 2, 6], ["FU", 4, [0, 1, 2]], ["SP", 4, 0, 9, [1], 1], ["AN", 4, 1, 2], ["FFSP", 4, 0, [3, 2, 1], 1, 1], ["AN", 4, 1, 6], ["FU", 2, [0, 1, 2]], ["SP", 2, 0, 54, [1], 1], ["AN", 2, 1, 2], ["FFSP", 2, 0, [3, 2, 1], 1, 1], ["AN", 2, 1, 6], ["PR", 5, 0, "auto_unroll_max_step$0"]]]], "r": [[8.04348e-06], 0, 1.02823, 1720596962], "v": "v0.6"}
{"i": [["[\"conv1d\", 15, 16, 6, 33, 46, 11, 16, [1, 1], [1, 1]]", "cuda -keys=cuda,gpu -arch=sm_80 -max_num_threads=1024 -thread_warp_size=32", [-1, 16, 64, 49152, 2147483647, 1024, 8, 32], "", 0, []], [[], [["CHW", 3, "local"], ["SP", 3, 0, 2, [2, 1, 1, 1], 1], ["SP", 3, 5, 5, [1, 1, 5, 1], 1], ["SP", 3, 10, 4, [1, 2, 2, 1], 1], ["SP", 3, 15, 3, [1, 3], 1], ["SP", 3, 18, 3, [1, 3], 1], ["RE", 3, [0, 5, 10, 1, 6, 11, 2, 7, 12, 15, 18, 16, 19, 3, 8, 13, 17, 20, 4, 9, 14]], ["FSP", 4, 0, 1, 3], ["FSP", 4, 4, 2, 3], ["FSP", 4, 8, 3, 3], ["RE", 4, [0, 4, 8, 1, 5, 9, 2, 6, 10, 3, 7, 11]], ["CA", 3, 4, 8], ["CHR", 2, "shared", [3]], ["CA", 3, 4, 10], ["CHR", 1, "shared", [4]], ["CA", 2, 5, 10], ["CI", 1], ["FU", 6, [0, 1, 2]], ["AN", 6, 0, 5], ["FU", 6, [1, 2, 3]], ["AN", 6, 1, 4], ["FU", 6, [2, 3, 4]], ["AN", 6, 2, 6], ["FU", 4, [0, 1, 2]], ["SP", 4, 0, 9, [1], 1], ["AN", 4, 1, 2], ["FFSP", 4, 0, [3, 2, 1], 1, 1], ["AN", 4, 1, 6], ["FU", 2, [0, 1, 2]], ["SP", 2, 0, 27, [1], 1], ["AN", 2, 1, 2], ["FFSP", 2, 0, [3, 2, 1], 1, 1], ["AN", 2, 1, 6], ["PR", 5, 0, "auto_unroll_max_step$0"]]]], "r": [[7.31227e-06], 0, 1.07368, 1720596962], "v": "v0.6"}
{"i": [["[\"conv1d\", 15, 16, 6, 33, 46, 11, 16, [1, 1], [1, 1]]", "cuda -keys=cuda,gpu -arch=sm_80 -max_num_threads=1024 -thread_warp_size=32", [-1, 16, 64, 49152, 2147483647, 1024, 8, 32], "", 0, []], [[], [["CHW", 3, "local"], ["SP", 3, 0, 2, [1, 1, 1, 2], 1], ["SP", 3, 5, 5, [1, 1, 1, 1], 1], ["SP", 3, 10, 4, [2, 1, 2, 1], 1], ["SP", 3, 15, 3, [3, 1], 1], ["SP", 3, 18, 3, [1, 1], 1], ["RE", 3, [0, 5, 10, 1, 6, 11, 2, 7, 12, 15, 18, 16, 19, 3, 8, 13, 17, 20, 4, 9, 14]], ["FSP", 4, 0, 1, 3], ["FSP", 4, 4, 2, 3], ["FSP", 4, 8, 3, 3], ["RE", 4, [0, 4, 8, 1, 5, 9, 2, 6, 10, 3, 7, 11]], ["CA", 3, 4, 8], ["CHR", 2, "shared", [3]], ["CA", 3, 4, 10], ["CHR", 1, "shared", [4]], ["CA", 2, 5, 10], ["CI", 1], ["FU", 6, [0, 1, 2]], ["AN", 6, 0, 5], ["FU", 6, [1, 2, 3]], ["AN", 6, 1, 4], ["FU", 6, [2, 3, 4]], ["AN", 6, 2, 6], ["FU", 4, [0, 1, 2]], ["SP", 4, 0, 9, [3], 1], ["AN", 4, 1, 2], ["FFSP", 4, 0, [3, 2, 1], 1, 1], ["AN", 4, 1, 6], ["FU", 2, [0, 1, 2]], ["SP", 2, 0, 30, [15], 1], ["AN", 2, 1, 2], ["FFSP", 2, 0, [3, 2, 1], 1, 1], ["AN", 2, 1, 6], ["PR", 5, 0, "auto_unroll_max_step$0"]]]], "r": [[2.26125e-05], 0, 1.05745, 1720596963], "v": "v0.6"}
{"i": [["[\"conv1d\", 15, 16, 6, 33, 46, 11, 16, [1, 1], [1, 1]]", "cuda -keys=cuda,gpu -arch=sm_80 -max_num_threads=1024 -thread_warp_size=32", [-1, 16, 64, 49152, 2147483647, 1024, 8, 32], "", 0, []], [[], [["CHW", 3, "local"], ["SP", 3, 0, 2, [2, 1, 1, 1], 1], ["SP", 3, 5, 5, [1, 1, 5, 1], 1], ["SP", 3, 10, 4, [2, 1, 2, 1], 1], ["SP", 3, 15, 3, [1, 1], 1], ["SP", 3, 18, 3, [1, 3], 1], ["RE", 3, [0, 5, 10, 1, 6, 11, 2, 7, 12, 15, 18, 16, 19, 3, 8, 13, 17, 20, 4, 9, 14]], ["FSP", 4, 0, 1, 3], ["FSP", 4, 4, 2, 3], ["FSP", 4, 8, 3, 3], ["RE", 4, [0, 4, 8, 1, 5, 9, 2, 6, 10, 3, 7, 11]], ["CA", 3, 4, 8], ["CHR", 2, "shared", [3]], ["CA", 3, 4, 10], ["CHR", 1, "shared", [4]], ["CA", 2, 5, 10], ["CI", 1], ["FU", 6, [0, 1, 2]], ["AN", 6, 0, 5], ["FU", 6, [1, 2, 3]], ["AN", 6, 1, 4], ["FU", 6, [2, 3, 4]], ["AN", 6, 2, 6], ["FU", 4, [0, 1, 2]], ["SP", 4, 0, 15, [1], 1], ["AN", 4, 1, 2], ["FFSP", 4, 0, [3, 2, 1], 1, 1], ["AN", 4, 1, 6], ["FU", 2, [0, 1, 2]], ["SP", 2, 0, 5, [1], 1], ["AN", 2, 1, 2], ["FFSP", 2, 0, [3, 2, 1], 1, 1], ["AN", 2, 1, 6], ["PR", 5, 0, "auto_unroll_max_step$0"]]]], "r": [[7.52674e-06], 0, 1.00958, 1720596963], "v": "v0.6"}
{"i": [["[\"conv1d\", 15, 16, 6, 33, 46, 11, 16, [1, 1], [1, 1]]", "cuda -keys=cuda,gpu -arch=sm_80 -max_num_threads=1024 -thread_warp_size=32", [-1, 16, 64, 49152, 2147483647, 1024, 8, 32], "", 0, []], [[], [["CHW", 3, "local"], ["SP", 3, 0, 2, [2, 1, 1, 1], 1], ["SP", 3, 5, 5, [1, 1, 5, 1], 1], ["SP", 3, 10, 4, [1, 1, 4, 1], 1], ["SP", 3, 15, 3, [1, 3], 1], ["SP", 3, 18, 3, [1, 1], 1], ["RE", 3, [0, 5, 10, 1, 6, 11, 2, 7, 12, 15, 18, 16, 19, 3, 8, 13, 17, 20, 4, 9, 14]], ["FSP", 4, 0, 1, 3], ["FSP", 4, 4, 2, 3], ["FSP", 4, 8, 3, 3], ["RE", 4, [0, 4, 8, 1, 5, 9, 2, 6, 10, 3, 7, 11]], ["CA", 3, 4, 8], ["CHR", 2, "shared", [3]], ["CA", 3, 4, 10], ["CHR", 1, "shared", [4]], ["CA", 2, 5, 10], ["CI", 1], ["FU", 6, [0, 1, 2]], ["AN", 6, 0, 5], ["FU", 6, [1, 2, 3]], ["AN", 6, 1, 4], ["FU", 6, [2, 3, 4]], ["AN", 6, 2, 6], ["FU", 4, [0, 1, 2]], ["SP", 4, 0, 45, [1], 1], ["AN", 4, 1, 2], ["FFSP", 4, 0, [3, 2, 1], 1, 1], ["AN", 4, 1, 6], ["FU", 2, [0, 1, 2]], ["SP", 2, 0, 27, [3], 1], ["AN", 2, 1, 2], ["FFSP", 2, 0, [3, 2, 1], 1, 1], ["AN", 2, 1, 6], ["PR", 5, 0, "auto_unroll_max_step$0"]]]], "r": [[8.53333e-06], 0, 1.06371, 1720596963], "v": "v0.6"}
{"i": [["[\"conv1d\", 15, 16, 6, 33, 46, 11, 16, [1, 1], [1, 1]]", "cuda -keys=cuda,gpu -arch=sm_80 -max_num_threads=1024 -thread_warp_size=32", [-1, 16, 64, 49152, 2147483647, 1024, 8, 32], "", 0, []], [[], [["CHW", 3, "local"], ["SP", 3, 0, 2, [2, 1, 1, 1], 1], ["SP", 3, 5, 5, [1, 1, 1, 5], 1], ["SP", 3, 10, 4, [2, 1, 1, 1], 1], ["SP", 3, 15, 3, [1, 3], 1], ["SP", 3, 18, 3, [1, 1], 1], ["RE", 3, [0, 5, 10, 1, 6, 11, 2, 7, 12, 15, 18, 16, 19, 3, 8, 13, 17, 20, 4, 9, 14]], ["FSP", 4, 0, 1, 3], ["FSP", 4, 4, 2, 3], ["FSP", 4, 8, 3, 3], ["RE", 4, [0, 4, 8, 1, 5, 9, 2, 6, 10, 3, 7, 11]], ["CA", 3, 4, 8], ["CHR", 2, "shared", [3]], ["CA", 3, 4, 10], ["CHR", 1, "shared", [4]], ["CA", 2, 5, 10], ["CI", 1], ["FU", 6, [0, 1, 2]], ["AN", 6, 0, 5], ["FU", 6, [1, 2, 3]], ["AN", 6, 1, 4], ["FU", 6, [2, 3, 4]], ["AN", 6, 2, 6], ["FU", 4, [0, 1, 2]], ["SP", 4, 0, 45, [1], 1], ["AN", 4, 1, 2], ["FFSP", 4, 0, [3, 2, 1], 1, 1], ["AN", 4, 1, 6], ["FU", 2, [0, 1, 2]], ["SP", 2, 0, 9, [1], 1], ["AN", 2, 1, 2], ["FFSP", 2, 0, [3, 2, 1], 1, 1], ["AN", 2, 1, 6], ["PR", 5, 0, "auto_unroll_max_step$0"]]]], "r": [[7.29004e-06], 0, 1.0033, 1720596963], "v": "v0.6"}
{"i": [["[\"conv1d\", 15, 16, 6, 33, 46, 11, 16, [1, 1], [1, 1]]", "cuda -keys=cuda,gpu -arch=sm_80 -max_num_threads=1024 -thread_warp_size=32", [-1, 16, 64, 49152, 2147483647, 1024, 8, 32], "", 0, []], [[], [["CHW", 3, "local"], ["SP", 3, 0, 2, [2, 1, 1, 1], 1], ["SP", 3, 5, 5, [1, 1, 5, 1], 1], ["SP", 3, 10, 4, [4, 1, 1, 1], 1], ["SP", 3, 15, 3, [3, 1], 1], ["SP", 3, 18, 3, [1, 1], 1], ["RE", 3, [0, 5, 10, 1, 6, 11, 2, 7, 12, 15, 18, 16, 19, 3, 8, 13, 17, 20, 4, 9, 14]], ["FSP", 4, 0, 1, 3], ["FSP", 4, 4, 2, 3], ["FSP", 4, 8, 3, 3], ["RE", 4, [0, 4, 8, 1, 5, 9, 2, 6, 10, 3, 7, 11]], ["CA", 3, 4, 8], ["CHR", 2, "shared", [3]], ["CA", 3, 4, 10], ["CHR", 1, "shared", [4]], ["CA", 2, 5, 10], ["CI", 1], ["FU", 6, [0, 1, 2]], ["AN", 6, 0, 5], ["FU", 6, [1, 2, 3]], ["AN", 6, 1, 4], ["FU", 6, [2, 3, 4]], ["AN", 6, 2, 6], ["FU", 4, [0, 1, 2]], ["SP", 4, 0, 15, [1], 1], ["AN", 4, 1, 2], ["FFSP", 4, 0, [3, 2, 1], 1, 1], ["AN", 4, 1, 6], ["FU", 2, [0, 1, 2]], ["SP", 2, 0, 3, [1], 1], ["AN", 2, 1, 2], ["FFSP", 2, 0, [3, 2, 1], 1, 1], ["AN", 2, 1, 6], ["PR", 5, 0, "auto_unroll_max_step$0"]]]], "r": [[1.0773e-05], 0, 1.04682, 1720596964], "v": "v0.6"}
