code_generation/generate/deprecated/deprecated_pure_without_shape/log/cuda/cos_cuda.log
{"i": [["[\"cos\", 8, 16, 17, 1]", "cuda -keys=cuda,gpu -arch=sm_80 -max_num_threads=1024 -thread_warp_size=32", [-1, 16, 64, 49152, 2147483647, 1024, 8, 32], "", 0, []], [[], [["FU", 1, [0, 1, 2, 3]], ["SP", 1, 0, 2176, [34], 1], ["AN", 1, 0, 5], ["AN", 1, 1, 6]]]], "r": [[9.39706e-06], 0, 1.93813, 1720674653], "v": "v0.6"}
{"i": [["[\"cos\", 8, 16, 17, 1]", "cuda -keys=cuda,gpu -arch=sm_80 -max_num_threads=1024 -thread_warp_size=32", [-1, 16, 64, 49152, 2147483647, 1024, 8, 32], "", 0, []], [[], [["FU", 1, [0, 1, 2, 3]], ["SP", 1, 0, 2176, [8], 1], ["AN", 1, 0, 5], ["AN", 1, 1, 6]]]], "r": [[6.42845e-06], 0, 2.09052, 1720674653], "v": "v0.6"}
{"i": [["[\"cos\", 8, 16, 17, 1]", "cuda -keys=cuda,gpu -arch=sm_80 -max_num_threads=1024 -thread_warp_size=32", [-1, 16, 64, 49152, 2147483647, 1024, 8, 32], "", 0, []], [[], [["FU", 1, [0, 1, 2, 3]], ["SP", 1, 0, 2176, [17], 1], ["AN", 1, 0, 5], ["AN", 1, 1, 6]]]], "r": [[7.92548e-06], 0, 1.73725, 1720674654], "v": "v0.6"}
{"i": [["[\"cos\", 8, 16, 17, 1]", "cuda -keys=cuda,gpu -arch=sm_80 -max_num_threads=1024 -thread_warp_size=32", [-1, 16, 64, 49152, 2147483647, 1024, 8, 32], "", 0, []], [[], [["FU", 1, [0, 1, 2, 3]], ["SP", 1, 0, 2176, [32], 1], ["AN", 1, 0, 5], ["AN", 1, 1, 6]]]], "r": [[5.30077e-06], 0, 1.94198, 1720674654], "v": "v0.6"}
{"i": [["[\"cos\", 8, 16, 17, 1]", "cuda -keys=cuda,gpu -arch=sm_80 -max_num_threads=1024 -thread_warp_size=32", [-1, 16, 64, 49152, 2147483647, 1024, 8, 32], "", 0, []], [[], [["FU", 1, [0, 1, 2, 3]], ["SP", 1, 0, 2176, [16], 1], ["AN", 1, 0, 5], ["AN", 1, 1, 6]]]], "r": [[5.65794e-06], 0, 2.48873, 1720674655], "v": "v0.6"}
{"i": [["[\"cos\", 8, 16, 17, 1]", "cuda -keys=cuda,gpu -arch=sm_80 -max_num_threads=1024 -thread_warp_size=32", [-1, 16, 64, 49152, 2147483647, 1024, 8, 32], "", 0, []], [[], [["FU", 1, [0, 1, 2, 3]], ["SP", 1, 0, 2176, [1], 1], ["AN", 1, 0, 5], ["AN", 1, 1, 6]]]], "r": [[1.20376e-05], 0, 2.35134, 1720674655], "v": "v0.6"}
{"i": [["[\"cos\", 8, 16, 17, 1]", "cuda -keys=cuda,gpu -arch=sm_80 -max_num_threads=1024 -thread_warp_size=32", [-1, 16, 64, 49152, 2147483647, 1024, 8, 32], "", 0, []], [[], [["FU", 1, [0, 1, 2, 3]], ["SP", 1, 0, 2176, [4], 1], ["AN", 1, 0, 5], ["AN", 1, 1, 6]]]], "r": [[6.24697e-06], 0, 2.28234, 1720674656], "v": "v0.6"}
{"i": [["[\"cos\", 8, 16, 17, 1]", "cuda -keys=cuda,gpu -arch=sm_80 -max_num_threads=1024 -thread_warp_size=32", [-1, 16, 64, 49152, 2147483647, 1024, 8, 32], "", 0, []], [[], [["FU", 1, [0, 1, 2, 3]], ["SP", 1, 0, 2176, [64], 1], ["AN", 1, 0, 5], ["AN", 1, 1, 6]]]], "r": [[1.73891e-05], 0, 2.88391, 1720674657], "v": "v0.6"}
{"i": [["[\"cos\", 8, 16, 17, 1]", "cuda -keys=cuda,gpu -arch=sm_80 -max_num_threads=1024 -thread_warp_size=32", [-1, 16, 64, 49152, 2147483647, 1024, 8, 32], "", 0, []], [[], [["FU", 1, [0, 1, 2, 3]], ["SP", 1, 0, 2176, [2], 1], ["AN", 1, 0, 5], ["AN", 1, 1, 6]]]], "r": [[7.81625e-06], 0, 2.17867, 1720674657], "v": "v0.6"}
