code_generation/generate/deprecated/deprecated_pure_without_shape/log/cuda/cosh_cuda.log
{"i": [["[\"cosh\", 16, 18, 16, 17]", "cuda -keys=cuda,gpu -arch=sm_80 -max_num_threads=1024 -thread_warp_size=32", [-1, 16, 64, 49152, 2147483647, 1024, 8, 32], "", 0, []], [[], [["FU", 1, [0, 1, 2, 3]], ["SP", 1, 0, 78336, [1], 1], ["AN", 1, 0, 5], ["AN", 1, 1, 6]]]], "r": [[0.000134933], 0, 5.47654, 1720683822], "v": "v0.6"}
{"i": [["[\"cosh\", 16, 18, 16, 17]", "cuda -keys=cuda,gpu -arch=sm_80 -max_num_threads=1024 -thread_warp_size=32", [-1, 16, 64, 49152, 2147483647, 1024, 8, 32], "", 0, []], [[], [["FU", 1, [0, 1, 2, 3]], ["SP", 1, 0, 78336, [32], 1], ["AN", 1, 0, 5], ["AN", 1, 1, 6]]]], "r": [[1.92622e-05], 0, 1.87316, 1720683822], "v": "v0.6"}
{"i": [["[\"cosh\", 16, 18, 16, 17]", "cuda -keys=cuda,gpu -arch=sm_80 -max_num_threads=1024 -thread_warp_size=32", [-1, 16, 64, 49152, 2147483647, 1024, 8, 32], "", 0, []], [[], [["FU", 1, [0, 1, 2, 3]], ["SP", 1, 0, 78336, [51], 1], ["AN", 1, 0, 5], ["AN", 1, 1, 6]]]], "r": [[1.01991e-05], 0, 1.1567, 1720683822], "v": "v0.6"}
{"i": [["[\"cosh\", 16, 18, 16, 17]", "cuda -keys=cuda,gpu -arch=sm_80 -max_num_threads=1024 -thread_warp_size=32", [-1, 16, 64, 49152, 2147483647, 1024, 8, 32], "", 0, []], [[], [["FU", 1, [0, 1, 2, 3]], ["SP", 1, 0, 78336, [3], 1], ["AN", 1, 0, 5], ["AN", 1, 1, 6]]]], "r": [[4.90664e-05], 0, 1.71158, 1720683823], "v": "v0.6"}
{"i": [["[\"cosh\", 16, 18, 16, 17]", "cuda -keys=cuda,gpu -arch=sm_80 -max_num_threads=1024 -thread_warp_size=32", [-1, 16, 64, 49152, 2147483647, 1024, 8, 32], "", 0, []], [[], [["FU", 1, [0, 1, 2, 3]], ["SP", 1, 0, 78336, [9], 1], ["AN", 1, 0, 5], ["AN", 1, 1, 6]]]], "r": [[2.86953e-05], 0, 1.72731, 1720683824], "v": "v0.6"}
{"i": [["[\"cosh\", 16, 18, 16, 17]", "cuda -keys=cuda,gpu -arch=sm_80 -max_num_threads=1024 -thread_warp_size=32", [-1, 16, 64, 49152, 2147483647, 1024, 8, 32], "", 0, []], [[], [["FU", 1, [0, 1, 2, 3]], ["SP", 1, 0, 78336, [16], 1], ["AN", 1, 0, 5], ["AN", 1, 1, 6]]]], "r": [[1.48323e-05], 0, 1.83517, 1720683824], "v": "v0.6"}
{"i": [["[\"cosh\", 16, 18, 16, 17]", "cuda -keys=cuda,gpu -arch=sm_80 -max_num_threads=1024 -thread_warp_size=32", [-1, 16, 64, 49152, 2147483647, 1024, 8, 32], "", 0, []], [[], [["FU", 1, [0, 1, 2, 3]], ["SP", 1, 0, 78336, [2], 1], ["AN", 1, 0, 5], ["AN", 1, 1, 6]]]], "r": [[7.07587e-05], 0, 1.79431, 1720683825], "v": "v0.6"}
{"i": [["[\"cosh\", 16, 18, 16, 17]", "cuda -keys=cuda,gpu -arch=sm_80 -max_num_threads=1024 -thread_warp_size=32", [-1, 16, 64, 49152, 2147483647, 1024, 8, 32], "", 0, []], [[], [["FU", 1, [0, 1, 2, 3]], ["SP", 1, 0, 78336, [34], 1], ["AN", 1, 0, 5], ["AN", 1, 1, 6]]]], "r": [[1.38744e-05], 0, 2.02354, 1720683825], "v": "v0.6"}
{"i": [["[\"cosh\", 16, 18, 16, 17]", "cuda -keys=cuda,gpu -arch=sm_80 -max_num_threads=1024 -thread_warp_size=32", [-1, 16, 64, 49152, 2147483647, 1024, 8, 32], "", 0, []], [[], [["FU", 1, [0, 1, 2, 3]], ["SP", 1, 0, 78336, [64], 1], ["AN", 1, 0, 5], ["AN", 1, 1, 6]]]], "r": [[8.158e-06], 0, 2.11389, 1720683826], "v": "v0.6"}
{"i": [["[\"cosh\", 16, 18, 16, 17]", "cuda -keys=cuda,gpu -arch=sm_80 -max_num_threads=1024 -thread_warp_size=32", [-1, 16, 64, 49152, 2147483647, 1024, 8, 32], "", 0, []], [[], [["FU", 1, [0, 1, 2, 3]], ["SP", 1, 0, 78336, [17], 1], ["AN", 1, 0, 5], ["AN", 1, 1, 6]]]], "r": [[1.48648e-05], 0, 1.99683, 1720683826], "v": "v0.6"}
