code_generation/generate/deprecated/deprecated_pure_without_shape/log/cuda/depth_to_space_cuda.log
{"i": [["[\"depth_to_space\", 17, 19, 17, 11]", "cuda -keys=cuda,gpu -arch=sm_80 -max_num_threads=1024 -thread_warp_size=32", [-1, 16, 64, 49152, 2147483647, 1024, 8, 32], "", 0, []], [[], [["FU", 1, [0, 1, 2, 3]], ["SP", 1, 0, 50864, [44], 1], ["AN", 1, 0, 5], ["AN", 1, 1, 6]]]], "r": [[9.49264e-06], 0, 2.18944, 1720708556], "v": "v0.6"}
{"i": [["[\"depth_to_space\", 17, 19, 17, 11]", "cuda -keys=cuda,gpu -arch=sm_80 -max_num_threads=1024 -thread_warp_size=32", [-1, 16, 64, 49152, 2147483647, 1024, 8, 32], "", 0, []], [[], [["FU", 1, [0, 1, 2, 3]], ["SP", 1, 0, 50864, [8], 1], ["AN", 1, 0, 5], ["AN", 1, 1, 6]]]], "r": [[1.63648e-05], 0, 0.874633, 1720708557], "v": "v0.6"}
{"i": [["[\"depth_to_space\", 17, 19, 17, 11]", "cuda -keys=cuda,gpu -arch=sm_80 -max_num_threads=1024 -thread_warp_size=32", [-1, 16, 64, 49152, 2147483647, 1024, 8, 32], "", 0, []], [[], [["FU", 1, [0, 1, 2, 3]], ["SP", 1, 0, 50864, [2], 1], ["AN", 1, 0, 5], ["AN", 1, 1, 6]]]], "r": [[4.80215e-05], 0, 1.5043, 1720708557], "v": "v0.6"}
{"i": [["[\"depth_to_space\", 17, 19, 17, 11]", "cuda -keys=cuda,gpu -arch=sm_80 -max_num_threads=1024 -thread_warp_size=32", [-1, 16, 64, 49152, 2147483647, 1024, 8, 32], "", 0, []], [[], [["FU", 1, [0, 1, 2, 3]], ["SP", 1, 0, 50864, [1], 1], ["AN", 1, 0, 5], ["AN", 1, 1, 6]]]], "r": [[8.90824e-05], 0, 1.35104, 1720708557], "v": "v0.6"}
{"i": [["[\"depth_to_space\", 17, 19, 17, 11]", "cuda -keys=cuda,gpu -arch=sm_80 -max_num_threads=1024 -thread_warp_size=32", [-1, 16, 64, 49152, 2147483647, 1024, 8, 32], "", 0, []], [[], [["FU", 1, [0, 1, 2, 3]], ["SP", 1, 0, 50864, [11], 1], ["AN", 1, 0, 5], ["AN", 1, 1, 6]]]], "r": [[1.3229e-05], 0, 1.47287, 1720708558], "v": "v0.6"}
{"i": [["[\"depth_to_space\", 17, 19, 17, 11]", "cuda -keys=cuda,gpu -arch=sm_80 -max_num_threads=1024 -thread_warp_size=32", [-1, 16, 64, 49152, 2147483647, 1024, 8, 32], "", 0, []], [[], [["FU", 1, [0, 1, 2, 3]], ["SP", 1, 0, 50864, [4], 1], ["AN", 1, 0, 5], ["AN", 1, 1, 6]]]], "r": [[2.70432e-05], 0, 1.53646, 1720708558], "v": "v0.6"}
{"i": [["[\"depth_to_space\", 17, 19, 17, 11]", "cuda -keys=cuda,gpu -arch=sm_80 -max_num_threads=1024 -thread_warp_size=32", [-1, 16, 64, 49152, 2147483647, 1024, 8, 32], "", 0, []], [[], [["FU", 1, [0, 1, 2, 3]], ["SP", 1, 0, 50864, [34], 1], ["AN", 1, 0, 5], ["AN", 1, 1, 6]]]], "r": [[8.73763e-06], 0, 1.45044, 1720708559], "v": "v0.6"}
{"i": [["[\"depth_to_space\", 17, 19, 17, 11]", "cuda -keys=cuda,gpu -arch=sm_80 -max_num_threads=1024 -thread_warp_size=32", [-1, 16, 64, 49152, 2147483647, 1024, 8, 32], "", 0, []], [[], [["FU", 1, [0, 1, 2, 3]], ["SP", 1, 0, 50864, [22], 1], ["AN", 1, 0, 5], ["AN", 1, 1, 6]]]], "r": [[9.54137e-06], 0, 1.60288, 1720708559], "v": "v0.6"}
{"i": [["[\"depth_to_space\", 17, 19, 17, 11]", "cuda -keys=cuda,gpu -arch=sm_80 -max_num_threads=1024 -thread_warp_size=32", [-1, 16, 64, 49152, 2147483647, 1024, 8, 32], "", 0, []], [[], [["FU", 1, [0, 1, 2, 3]], ["SP", 1, 0, 50864, [17], 1], ["AN", 1, 0, 5], ["AN", 1, 1, 6]]]], "r": [[1.06321e-05], 0, 1.63345, 1720708559], "v": "v0.6"}
{"i": [["[\"depth_to_space\", 17, 19, 17, 11]", "cuda -keys=cuda,gpu -arch=sm_80 -max_num_threads=1024 -thread_warp_size=32", [-1, 16, 64, 49152, 2147483647, 1024, 8, 32], "", 0, []], [[], [["FU", 1, [0, 1, 2, 3]], ["SP", 1, 0, 50864, [32], 1], ["AN", 1, 0, 5], ["AN", 1, 1, 6]]]], "r": [[8.26781e-06], 0, 1.48316, 1720708560], "v": "v0.6"}
