code_generation/generate/deprecated/deprecated_pure_without_shape/log/cuda/dilate_cuda.log
{"i": [["[\"dilate\", 10, 9, 6, 15]", "cuda -keys=cuda,gpu -arch=sm_80 -max_num_threads=1024 -thread_warp_size=32", [-1, 16, 64, 49152, 2147483647, 1024, 8, 32], "", 0, []], [[], [["FU", 1, [0, 1, 2, 3]], ["SP", 1, 0, 8100, [4], 1], ["AN", 1, 0, 5], ["AN", 1, 1, 6]]]], "r": [[1.86076e-05], 0, 2.84155, 1720692698], "v": "v0.6"}
{"i": [["[\"dilate\", 10, 9, 6, 15]", "cuda -keys=cuda,gpu -arch=sm_80 -max_num_threads=1024 -thread_warp_size=32", [-1, 16, 64, 49152, 2147483647, 1024, 8, 32], "", 0, []], [[], [["FU", 1, [0, 1, 2, 3]], ["SP", 1, 0, 8100, [20], 1], ["AN", 1, 0, 5], ["AN", 1, 1, 6]]]], "r": [[1.36092e-05], 0, 2.20651, 1720692699], "v": "v0.6"}
{"i": [["[\"dilate\", 10, 9, 6, 15]", "cuda -keys=cuda,gpu -arch=sm_80 -max_num_threads=1024 -thread_warp_size=32", [-1, 16, 64, 49152, 2147483647, 1024, 8, 32], "", 0, []], [[], [["FU", 1, [0, 1, 2, 3]], ["SP", 1, 0, 8100, [9], 1], ["AN", 1, 0, 5], ["AN", 1, 1, 6]]]], "r": [[9.08574e-06], 0, 1.57701, 1720692699], "v": "v0.6"}
{"i": [["[\"dilate\", 10, 9, 6, 15]", "cuda -keys=cuda,gpu -arch=sm_80 -max_num_threads=1024 -thread_warp_size=32", [-1, 16, 64, 49152, 2147483647, 1024, 8, 32], "", 0, []], [[], [["FU", 1, [0, 1, 2, 3]], ["SP", 1, 0, 8100, [50], 1], ["AN", 1, 0, 5], ["AN", 1, 1, 6]]]], "r": [[9.75587e-06], 0, 1.38383, 1720692700], "v": "v0.6"}
{"i": [["[\"dilate\", 10, 9, 6, 15]", "cuda -keys=cuda,gpu -arch=sm_80 -max_num_threads=1024 -thread_warp_size=32", [-1, 16, 64, 49152, 2147483647, 1024, 8, 32], "", 0, []], [[], [["FU", 1, [0, 1, 2, 3]], ["SP", 1, 0, 8100, [32], 1], ["AN", 1, 0, 5], ["AN", 1, 1, 6]]]], "r": [[1.47659e-05], 0, 1.94608, 1720692700], "v": "v0.6"}
{"i": [["[\"dilate\", 10, 9, 6, 15]", "cuda -keys=cuda,gpu -arch=sm_80 -max_num_threads=1024 -thread_warp_size=32", [-1, 16, 64, 49152, 2147483647, 1024, 8, 32], "", 0, []], [[], [["FU", 1, [0, 1, 2, 3]], ["SP", 1, 0, 8100, [25], 1], ["AN", 1, 0, 5], ["AN", 1, 1, 6]]]], "r": [[6.36721e-06], 0, 1.467, 1720692701], "v": "v0.6"}
{"i": [["[\"dilate\", 10, 9, 6, 15]", "cuda -keys=cuda,gpu -arch=sm_80 -max_num_threads=1024 -thread_warp_size=32", [-1, 16, 64, 49152, 2147483647, 1024, 8, 32], "", 0, []], [[], [["FU", 1, [0, 1, 2, 3]], ["SP", 1, 0, 8100, [6], 1], ["AN", 1, 0, 5], ["AN", 1, 1, 6]]]], "r": [[1.90625e-05], 0, 2.22531, 1720692701], "v": "v0.6"}
{"i": [["[\"dilate\", 10, 9, 6, 15]", "cuda -keys=cuda,gpu -arch=sm_80 -max_num_threads=1024 -thread_warp_size=32", [-1, 16, 64, 49152, 2147483647, 1024, 8, 32], "", 0, []], [[], [["FU", 1, [0, 1, 2, 3]], ["SP", 1, 0, 8100, [30], 1], ["AN", 1, 0, 5], ["AN", 1, 1, 6]]]], "r": [[6.32913e-06], 0, 2.69015, 1720692702], "v": "v0.6"}
{"i": [["[\"dilate\", 10, 9, 6, 15]", "cuda -keys=cuda,gpu -arch=sm_80 -max_num_threads=1024 -thread_warp_size=32", [-1, 16, 64, 49152, 2147483647, 1024, 8, 32], "", 0, []], [[], [["FU", 1, [0, 1, 2, 3]], ["SP", 1, 0, 8100, [5], 1], ["AN", 1, 0, 5], ["AN", 1, 1, 6]]]], "r": [[8.61011e-06], 0, 1.48845, 1720692702], "v": "v0.6"}
{"i": [["[\"dilate\", 10, 9, 6, 15]", "cuda -keys=cuda,gpu -arch=sm_80 -max_num_threads=1024 -thread_warp_size=32", [-1, 16, 64, 49152, 2147483647, 1024, 8, 32], "", 0, []], [[], [["FU", 1, [0, 1, 2, 3]], ["SP", 1, 0, 8100, [45], 1], ["AN", 1, 0, 5], ["AN", 1, 1, 6]]]], "r": [[6.09748e-06], 0, 1.62267, 1720692702], "v": "v0.6"}
