code_generation/generate/deprecated/deprecated_pure_without_shape/log/cuda/erf_cuda.log
{"i": [["[\"erf\", 4, 5, 6, 19]", "cuda -keys=cuda,gpu -arch=sm_80 -max_num_threads=1024 -thread_warp_size=32", [-1, 16, 64, 49152, 2147483647, 1024, 8, 32], "", 0, []], [[], [["FU", 1, [0, 1, 2, 3]], ["SP", 1, 0, 2280, [38], 1], ["AN", 1, 0, 5], ["AN", 1, 1, 6]]]], "r": [[5.76203e-06], 0, 2.00746, 1720699541], "v": "v0.6"}
{"i": [["[\"erf\", 4, 5, 6, 19]", "cuda -keys=cuda,gpu -arch=sm_80 -max_num_threads=1024 -thread_warp_size=32", [-1, 16, 64, 49152, 2147483647, 1024, 8, 32], "", 0, []], [[], [["FU", 1, [0, 1, 2, 3]], ["SP", 1, 0, 2280, [30], 1], ["AN", 1, 0, 5], ["AN", 1, 1, 6]]]], "r": [[7.37708e-06], 0, 1.51463, 1720699542], "v": "v0.6"}
{"i": [["[\"erf\", 4, 5, 6, 19]", "cuda -keys=cuda,gpu -arch=sm_80 -max_num_threads=1024 -thread_warp_size=32", [-1, 16, 64, 49152, 2147483647, 1024, 8, 32], "", 0, []], [[], [["FU", 1, [0, 1, 2, 3]], ["SP", 1, 0, 2280, [60], 1], ["AN", 1, 0, 5], ["AN", 1, 1, 6]]]], "r": [[8.86447e-06], 0, 1.52997, 1720699542], "v": "v0.6"}
{"i": [["[\"erf\", 4, 5, 6, 19]", "cuda -keys=cuda,gpu -arch=sm_80 -max_num_threads=1024 -thread_warp_size=32", [-1, 16, 64, 49152, 2147483647, 1024, 8, 32], "", 0, []], [[], [["FU", 1, [0, 1, 2, 3]], ["SP", 1, 0, 2280, [19], 1], ["AN", 1, 0, 5], ["AN", 1, 1, 6]]]], "r": [[7.3028e-06], 0, 1.81448, 1720699542], "v": "v0.6"}
{"i": [["[\"erf\", 4, 5, 6, 19]", "cuda -keys=cuda,gpu -arch=sm_80 -max_num_threads=1024 -thread_warp_size=32", [-1, 16, 64, 49152, 2147483647, 1024, 8, 32], "", 0, []], [[], [["FU", 1, [0, 1, 2, 3]], ["SP", 1, 0, 2280, [4], 1], ["AN", 1, 0, 5], ["AN", 1, 1, 6]]]], "r": [[7.53843e-06], 0, 1.67538, 1720699543], "v": "v0.6"}
{"i": [["[\"erf\", 4, 5, 6, 19]", "cuda -keys=cuda,gpu -arch=sm_80 -max_num_threads=1024 -thread_warp_size=32", [-1, 16, 64, 49152, 2147483647, 1024, 8, 32], "", 0, []], [[], [["FU", 1, [0, 1, 2, 3]], ["SP", 1, 0, 2280, [20], 1], ["AN", 1, 0, 5], ["AN", 1, 1, 6]]]], "r": [[7.29567e-06], 0, 1.6418, 1720699543], "v": "v0.6"}
{"i": [["[\"erf\", 4, 5, 6, 19]", "cuda -keys=cuda,gpu -arch=sm_80 -max_num_threads=1024 -thread_warp_size=32", [-1, 16, 64, 49152, 2147483647, 1024, 8, 32], "", 0, []], [[], [["FU", 1, [0, 1, 2, 3]], ["SP", 1, 0, 2280, [6], 1], ["AN", 1, 0, 5], ["AN", 1, 1, 6]]]], "r": [[1.12964e-05], 0, 1.75993, 1720699544], "v": "v0.6"}
{"i": [["[\"erf\", 4, 5, 6, 19]", "cuda -keys=cuda,gpu -arch=sm_80 -max_num_threads=1024 -thread_warp_size=32", [-1, 16, 64, 49152, 2147483647, 1024, 8, 32], "", 0, []], [[], [["FU", 1, [0, 1, 2, 3]], ["SP", 1, 0, 2280, [1], 1], ["AN", 1, 0, 5], ["AN", 1, 1, 6]]]], "r": [[9.60073e-06], 0, 1.43929, 1720699544], "v": "v0.6"}
{"i": [["[\"erf\", 4, 5, 6, 19]", "cuda -keys=cuda,gpu -arch=sm_80 -max_num_threads=1024 -thread_warp_size=32", [-1, 16, 64, 49152, 2147483647, 1024, 8, 32], "", 0, []], [[], [["FU", 1, [0, 1, 2, 3]], ["SP", 1, 0, 2280, [16], 1], ["AN", 1, 0, 5], ["AN", 1, 1, 6]]]], "r": [[6.27834e-06], 0, 1.58503, 1720699544], "v": "v0.6"}
{"i": [["[\"erf\", 4, 5, 6, 19]", "cuda -keys=cuda,gpu -arch=sm_80 -max_num_threads=1024 -thread_warp_size=32", [-1, 16, 64, 49152, 2147483647, 1024, 8, 32], "", 0, []], [[], [["FU", 1, [0, 1, 2, 3]], ["SP", 1, 0, 2280, [3], 1], ["AN", 1, 0, 5], ["AN", 1, 1, 6]]]], "r": [[8.71631e-06], 0, 1.68251, 1720699545], "v": "v0.6"}
