code_generation/generate/deprecated/deprecated_pure_without_shape/log/cuda/exp_cuda.log
{"i": [["[\"exp\", 13, 20, 16, 18]", "cuda -keys=cuda,gpu -arch=sm_80 -max_num_threads=1024 -thread_warp_size=32", [-1, 16, 64, 49152, 2147483647, 1024, 8, 32], "", 0, []], [[], [["FU", 1, [0, 1, 2, 3]], ["SP", 1, 0, 74880, [60], 1], ["AN", 1, 0, 5], ["AN", 1, 1, 6]]]], "r": [[7.72522e-06], 0, 1.82974, 1720700497], "v": "v0.6"}
{"i": [["[\"exp\", 13, 20, 16, 18]", "cuda -keys=cuda,gpu -arch=sm_80 -max_num_threads=1024 -thread_warp_size=32", [-1, 16, 64, 49152, 2147483647, 1024, 8, 32], "", 0, []], [[], [["FU", 1, [0, 1, 2, 3]], ["SP", 1, 0, 74880, [3], 1], ["AN", 1, 0, 5], ["AN", 1, 1, 6]]]], "r": [[4.6498e-05], 0, 1.45401, 1720700497], "v": "v0.6"}
{"i": [["[\"exp\", 13, 20, 16, 18]", "cuda -keys=cuda,gpu -arch=sm_80 -max_num_threads=1024 -thread_warp_size=32", [-1, 16, 64, 49152, 2147483647, 1024, 8, 32], "", 0, []], [[], [["FU", 1, [0, 1, 2, 3]], ["SP", 1, 0, 74880, [24], 1], ["AN", 1, 0, 5], ["AN", 1, 1, 6]]]], "r": [[1.0718e-05], 0, 1.03545, 1720700497], "v": "v0.6"}
{"i": [["[\"exp\", 13, 20, 16, 18]", "cuda -keys=cuda,gpu -arch=sm_80 -max_num_threads=1024 -thread_warp_size=32", [-1, 16, 64, 49152, 2147483647, 1024, 8, 32], "", 0, []], [[], [["FU", 1, [0, 1, 2, 3]], ["SP", 1, 0, 74880, [2], 1], ["AN", 1, 0, 5], ["AN", 1, 1, 6]]]], "r": [[6.57807e-05], 0, 1.03648, 1720700498], "v": "v0.6"}
{"i": [["[\"exp\", 13, 20, 16, 18]", "cuda -keys=cuda,gpu -arch=sm_80 -max_num_threads=1024 -thread_warp_size=32", [-1, 16, 64, 49152, 2147483647, 1024, 8, 32], "", 0, []], [[], [["FU", 1, [0, 1, 2, 3]], ["SP", 1, 0, 74880, [13], 1], ["AN", 1, 0, 5], ["AN", 1, 1, 6]]]], "r": [[1.50505e-05], 0, 1.55761, 1720700498], "v": "v0.6"}
{"i": [["[\"exp\", 13, 20, 16, 18]", "cuda -keys=cuda,gpu -arch=sm_80 -max_num_threads=1024 -thread_warp_size=32", [-1, 16, 64, 49152, 2147483647, 1024, 8, 32], "", 0, []], [[], [["FU", 1, [0, 1, 2, 3]], ["SP", 1, 0, 74880, [5], 1], ["AN", 1, 0, 5], ["AN", 1, 1, 6]]]], "r": [[3.04776e-05], 0, 1.07212, 1720700499], "v": "v0.6"}
{"i": [["[\"exp\", 13, 20, 16, 18]", "cuda -keys=cuda,gpu -arch=sm_80 -max_num_threads=1024 -thread_warp_size=32", [-1, 16, 64, 49152, 2147483647, 1024, 8, 32], "", 0, []], [[], [["FU", 1, [0, 1, 2, 3]], ["SP", 1, 0, 74880, [30], 1], ["AN", 1, 0, 5], ["AN", 1, 1, 6]]]], "r": [[1.23827e-05], 0, 1.37811, 1720700499], "v": "v0.6"}
{"i": [["[\"exp\", 13, 20, 16, 18]", "cuda -keys=cuda,gpu -arch=sm_80 -max_num_threads=1024 -thread_warp_size=32", [-1, 16, 64, 49152, 2147483647, 1024, 8, 32], "", 0, []], [[], [["FU", 1, [0, 1, 2, 3]], ["SP", 1, 0, 74880, [8], 1], ["AN", 1, 0, 5], ["AN", 1, 1, 6]]]], "r": [[2.1253e-05], 0, 1.12725, 1720700499], "v": "v0.6"}
{"i": [["[\"exp\", 13, 20, 16, 18]", "cuda -keys=cuda,gpu -arch=sm_80 -max_num_threads=1024 -thread_warp_size=32", [-1, 16, 64, 49152, 2147483647, 1024, 8, 32], "", 0, []], [[], [["FU", 1, [0, 1, 2, 3]], ["SP", 1, 0, 74880, [40], 1], ["AN", 1, 0, 5], ["AN", 1, 1, 6]]]], "r": [[2.02407e-05], 0, 1.76542, 1720700500], "v": "v0.6"}
{"i": [["[\"exp\", 13, 20, 16, 18]", "cuda -keys=cuda,gpu -arch=sm_80 -max_num_threads=1024 -thread_warp_size=32", [-1, 16, 64, 49152, 2147483647, 1024, 8, 32], "", 0, []], [[], [["FU", 1, [0, 1, 2, 3]], ["SP", 1, 0, 74880, [1], 1], ["AN", 1, 0, 5], ["AN", 1, 1, 6]]]], "r": [[0.000128616], 0, 1.47676, 1720700500], "v": "v0.6"}
