code_generation/generate/deprecated/deprecated_pure_without_shape/log/cuda/fast_tanh_cuda.log
{"i": [["[\"fast_tanh\", 1, 1, 20, 17]", "cuda -keys=cuda,gpu -arch=sm_80 -max_num_threads=1024 -thread_warp_size=32", [-1, 16, 64, 49152, 2147483647, 1024, 8, 32], "", 0, []], [[], [["CI", 2], ["CI", 1], ["FU", 3, [0, 1, 2, 3]], ["SP", 3, 0, 340, [14], 1], ["AN", 3, 0, 5], ["AN", 3, 1, 6]]]], "r": [[5.67266e-06], 0, 1.68837, 1720709304], "v": "v0.6"}
{"i": [["[\"fast_tanh\", 1, 1, 20, 17]", "cuda -keys=cuda,gpu -arch=sm_80 -max_num_threads=1024 -thread_warp_size=32", [-1, 16, 64, 49152, 2147483647, 1024, 8, 32], "", 0, []], [[], [["CI", 2], ["CI", 1], ["FU", 3, [0, 1, 2, 3]], ["SP", 3, 0, 340, [2], 1], ["AN", 3, 0, 5], ["AN", 3, 1, 6]]]], "r": [[5.84206e-06], 0, 1.09364, 1720709305], "v": "v0.6"}
{"i": [["[\"fast_tanh\", 1, 1, 20, 17]", "cuda -keys=cuda,gpu -arch=sm_80 -max_num_threads=1024 -thread_warp_size=32", [-1, 16, 64, 49152, 2147483647, 1024, 8, 32], "", 0, []], [[], [["CI", 2], ["CI", 1], ["FU", 3, [0, 1, 2, 3]], ["SP", 3, 0, 340, [10], 1], ["AN", 3, 0, 5], ["AN", 3, 1, 6]]]], "r": [[6.94804e-06], 0, 1.19336, 1720709305], "v": "v0.6"}
{"i": [["[\"fast_tanh\", 1, 1, 20, 17]", "cuda -keys=cuda,gpu -arch=sm_80 -max_num_threads=1024 -thread_warp_size=32", [-1, 16, 64, 49152, 2147483647, 1024, 8, 32], "", 0, []], [[], [["CI", 2], ["CI", 1], ["FU", 3, [0, 1, 2, 3]], ["SP", 3, 0, 340, [5], 1], ["AN", 3, 0, 5], ["AN", 3, 1, 6]]]], "r": [[5.69767e-06], 0, 1.00675, 1720709305], "v": "v0.6"}
{"i": [["[\"fast_tanh\", 1, 1, 20, 17]", "cuda -keys=cuda,gpu -arch=sm_80 -max_num_threads=1024 -thread_warp_size=32", [-1, 16, 64, 49152, 2147483647, 1024, 8, 32], "", 0, []], [[], [["CI", 2], ["CI", 1], ["FU", 3, [0, 1, 2, 3]], ["SP", 3, 0, 340, [20], 1], ["AN", 3, 0, 5], ["AN", 3, 1, 6]]]], "r": [[5.43641e-06], 0, 1.12807, 1720709305], "v": "v0.6"}
{"i": [["[\"fast_tanh\", 1, 1, 20, 17]", "cuda -keys=cuda,gpu -arch=sm_80 -max_num_threads=1024 -thread_warp_size=32", [-1, 16, 64, 49152, 2147483647, 1024, 8, 32], "", 0, []], [[], [["CI", 2], ["CI", 1], ["FU", 3, [0, 1, 2, 3]], ["SP", 3, 0, 340, [3], 1], ["AN", 3, 0, 5], ["AN", 3, 1, 6]]]], "r": [[5.96553e-06], 0, 1.29159, 1720709306], "v": "v0.6"}
{"i": [["[\"fast_tanh\", 1, 1, 20, 17]", "cuda -keys=cuda,gpu -arch=sm_80 -max_num_threads=1024 -thread_warp_size=32", [-1, 16, 64, 49152, 2147483647, 1024, 8, 32], "", 0, []], [[], [["CI", 2], ["CI", 1], ["FU", 3, [0, 1, 2, 3]], ["SP", 3, 0, 340, [48], 1], ["AN", 3, 0, 5], ["AN", 3, 1, 6]]]], "r": [[5.46207e-06], 0, 0.927858, 1720709306], "v": "v0.6"}
{"i": [["[\"fast_tanh\", 1, 1, 20, 17]", "cuda -keys=cuda,gpu -arch=sm_80 -max_num_threads=1024 -thread_warp_size=32", [-1, 16, 64, 49152, 2147483647, 1024, 8, 32], "", 0, []], [[], [["CI", 2], ["CI", 1], ["FU", 3, [0, 1, 2, 3]], ["SP", 3, 0, 340, [6], 1], ["AN", 3, 0, 5], ["AN", 3, 1, 6]]]], "r": [[5.71482e-06], 0, 1.30669, 1720709306], "v": "v0.6"}
{"i": [["[\"fast_tanh\", 1, 1, 20, 17]", "cuda -keys=cuda,gpu -arch=sm_80 -max_num_threads=1024 -thread_warp_size=32", [-1, 16, 64, 49152, 2147483647, 1024, 8, 32], "", 0, []], [[], [["CI", 2], ["CI", 1], ["FU", 3, [0, 1, 2, 3]], ["SP", 3, 0, 340, [24], 1], ["AN", 3, 0, 5], ["AN", 3, 1, 6]]]], "r": [[5.67216e-06], 0, 1.1556, 1720709307], "v": "v0.6"}
{"i": [["[\"fast_tanh\", 1, 1, 20, 17]", "cuda -keys=cuda,gpu -arch=sm_80 -max_num_threads=1024 -thread_warp_size=32", [-1, 16, 64, 49152, 2147483647, 1024, 8, 32], "", 0, []], [[], [["CI", 2], ["CI", 1], ["FU", 3, [0, 1, 2, 3]], ["SP", 3, 0, 340, [7], 1], ["AN", 3, 0, 5], ["AN", 3, 1, 6]]]], "r": [[8.47594e-06], 0, 1.34632, 1720709307], "v": "v0.6"}
