code_generation/generate/deprecated/deprecated_pure_without_shape/log/cuda/fast_exp_cuda.log
{"i": [["[\"fast_exp\", 6, 6, 14, 11]", "cuda -keys=cuda,gpu -arch=sm_80 -max_num_threads=1024 -thread_warp_size=32", [-1, 16, 64, 49152, 2147483647, 1024, 8, 32], "", 0, []], [[], [["FU", 1, [0, 1, 2, 3]], ["SP", 1, 0, 5544, [33], 1], ["AN", 1, 0, 5], ["AN", 1, 1, 6]]]], "r": [[5.83175e-06], 0, 1.78823, 1720705398], "v": "v0.6"}
{"i": [["[\"fast_exp\", 6, 6, 14, 11]", "cuda -keys=cuda,gpu -arch=sm_80 -max_num_threads=1024 -thread_warp_size=32", [-1, 16, 64, 49152, 2147483647, 1024, 8, 32], "", 0, []], [[], [["FU", 1, [0, 1, 2, 3]], ["SP", 1, 0, 5544, [12], 1], ["AN", 1, 0, 5], ["AN", 1, 1, 6]]]], "r": [[7.14955e-06], 0, 1.22874, 1720705398], "v": "v0.6"}
{"i": [["[\"fast_exp\", 6, 6, 14, 11]", "cuda -keys=cuda,gpu -arch=sm_80 -max_num_threads=1024 -thread_warp_size=32", [-1, 16, 64, 49152, 2147483647, 1024, 8, 32], "", 0, []], [[], [["FU", 1, [0, 1, 2, 3]], ["SP", 1, 0, 5544, [28], 1], ["AN", 1, 0, 5], ["AN", 1, 1, 6]]]], "r": [[6.45188e-06], 0, 0.925716, 1720705399], "v": "v0.6"}
{"i": [["[\"fast_exp\", 6, 6, 14, 11]", "cuda -keys=cuda,gpu -arch=sm_80 -max_num_threads=1024 -thread_warp_size=32", [-1, 16, 64, 49152, 2147483647, 1024, 8, 32], "", 0, []], [[], [["FU", 1, [0, 1, 2, 3]], ["SP", 1, 0, 5544, [6], 1], ["AN", 1, 0, 5], ["AN", 1, 1, 6]]]], "r": [[6.90244e-06], 0, 1.18771, 1720705399], "v": "v0.6"}
{"i": [["[\"fast_exp\", 6, 6, 14, 11]", "cuda -keys=cuda,gpu -arch=sm_80 -max_num_threads=1024 -thread_warp_size=32", [-1, 16, 64, 49152, 2147483647, 1024, 8, 32], "", 0, []], [[], [["FU", 1, [0, 1, 2, 3]], ["SP", 1, 0, 5544, [63], 1], ["AN", 1, 0, 5], ["AN", 1, 1, 6]]]], "r": [[5.68634e-06], 0, 1.14165, 1720705399], "v": "v0.6"}
{"i": [["[\"fast_exp\", 6, 6, 14, 11]", "cuda -keys=cuda,gpu -arch=sm_80 -max_num_threads=1024 -thread_warp_size=32", [-1, 16, 64, 49152, 2147483647, 1024, 8, 32], "", 0, []], [[], [["FU", 1, [0, 1, 2, 3]], ["SP", 1, 0, 5544, [9], 1], ["AN", 1, 0, 5], ["AN", 1, 1, 6]]]], "r": [[6.352e-06], 0, 1.05774, 1720705400], "v": "v0.6"}
{"i": [["[\"fast_exp\", 6, 6, 14, 11]", "cuda -keys=cuda,gpu -arch=sm_80 -max_num_threads=1024 -thread_warp_size=32", [-1, 16, 64, 49152, 2147483647, 1024, 8, 32], "", 0, []], [[], [["FU", 1, [0, 1, 2, 3]], ["SP", 1, 0, 5544, [16], 1], ["AN", 1, 0, 5], ["AN", 1, 1, 6]]]], "r": [[5.86706e-06], 0, 1.46037, 1720705400], "v": "v0.6"}
{"i": [["[\"fast_exp\", 6, 6, 14, 11]", "cuda -keys=cuda,gpu -arch=sm_80 -max_num_threads=1024 -thread_warp_size=32", [-1, 16, 64, 49152, 2147483647, 1024, 8, 32], "", 0, []], [[], [["FU", 1, [0, 1, 2, 3]], ["SP", 1, 0, 5544, [7], 1], ["AN", 1, 0, 5], ["AN", 1, 1, 6]]]], "r": [[7.87287e-06], 0, 1.11135, 1720705401], "v": "v0.6"}
{"i": [["[\"fast_exp\", 6, 6, 14, 11]", "cuda -keys=cuda,gpu -arch=sm_80 -max_num_threads=1024 -thread_warp_size=32", [-1, 16, 64, 49152, 2147483647, 1024, 8, 32], "", 0, []], [[], [["FU", 1, [0, 1, 2, 3]], ["SP", 1, 0, 5544, [14], 1], ["AN", 1, 0, 5], ["AN", 1, 1, 6]]]], "r": [[7.25991e-06], 0, 1.40027, 1720705401], "v": "v0.6"}
{"i": [["[\"fast_exp\", 6, 6, 14, 11]", "cuda -keys=cuda,gpu -arch=sm_80 -max_num_threads=1024 -thread_warp_size=32", [-1, 16, 64, 49152, 2147483647, 1024, 8, 32], "", 0, []], [[], [["FU", 1, [0, 1, 2, 3]], ["SP", 1, 0, 5544, [42], 1], ["AN", 1, 0, 5], ["AN", 1, 1, 6]]]], "r": [[6.70832e-06], 0, 1.10187, 1720705401], "v": "v0.6"}
