code_generation/generate/deprecated/deprecated_pure_without_shape/log/cuda/fast_erf_cuda.log
{"i": [["[\"fast_erf\", 2, 19, 11, 18]", "cuda -keys=cuda,gpu -arch=sm_80 -max_num_threads=1024 -thread_warp_size=32", [-1, 16, 64, 49152, 2147483647, 1024, 8, 32], "", 0, []], [[], [["FU", 1, [0, 1, 2, 3]], ["SP", 1, 0, 7524, [44], 1], ["AN", 1, 0, 5], ["AN", 1, 1, 6]]]], "r": [[6.0175e-06], 0, 1.91103, 1720702870], "v": "v0.6"}
{"i": [["[\"fast_erf\", 2, 19, 11, 18]", "cuda -keys=cuda,gpu -arch=sm_80 -max_num_threads=1024 -thread_warp_size=32", [-1, 16, 64, 49152, 2147483647, 1024, 8, 32], "", 0, []], [[], [["FU", 1, [0, 1, 2, 3]], ["SP", 1, 0, 7524, [5], 1], ["AN", 1, 0, 5], ["AN", 1, 1, 6]]]], "r": [[8.81679e-06], 0, 1.19281, 1720702871], "v": "v0.6"}
{"i": [["[\"fast_erf\", 2, 19, 11, 18]", "cuda -keys=cuda,gpu -arch=sm_80 -max_num_threads=1024 -thread_warp_size=32", [-1, 16, 64, 49152, 2147483647, 1024, 8, 32], "", 0, []], [[], [["FU", 1, [0, 1, 2, 3]], ["SP", 1, 0, 7524, [32], 1], ["AN", 1, 0, 5], ["AN", 1, 1, 6]]]], "r": [[8.46238e-06], 0, 1.33825, 1720702871], "v": "v0.6"}
{"i": [["[\"fast_erf\", 2, 19, 11, 18]", "cuda -keys=cuda,gpu -arch=sm_80 -max_num_threads=1024 -thread_warp_size=32", [-1, 16, 64, 49152, 2147483647, 1024, 8, 32], "", 0, []], [[], [["FU", 1, [0, 1, 2, 3]], ["SP", 1, 0, 7524, [8], 1], ["AN", 1, 0, 5], ["AN", 1, 1, 6]]]], "r": [[8.08925e-06], 0, 1.21994, 1720702871], "v": "v0.6"}
{"i": [["[\"fast_erf\", 2, 19, 11, 18]", "cuda -keys=cuda,gpu -arch=sm_80 -max_num_threads=1024 -thread_warp_size=32", [-1, 16, 64, 49152, 2147483647, 1024, 8, 32], "", 0, []], [[], [["FU", 1, [0, 1, 2, 3]], ["SP", 1, 0, 7524, [18], 1], ["AN", 1, 0, 5], ["AN", 1, 1, 6]]]], "r": [[7.7603e-06], 0, 1.34436, 1720702872], "v": "v0.6"}
{"i": [["[\"fast_erf\", 2, 19, 11, 18]", "cuda -keys=cuda,gpu -arch=sm_80 -max_num_threads=1024 -thread_warp_size=32", [-1, 16, 64, 49152, 2147483647, 1024, 8, 32], "", 0, []], [[], [["FU", 1, [0, 1, 2, 3]], ["SP", 1, 0, 7524, [20], 1], ["AN", 1, 0, 5], ["AN", 1, 1, 6]]]], "r": [[6.99808e-06], 0, 1.31388, 1720702872], "v": "v0.6"}
{"i": [["[\"fast_erf\", 2, 19, 11, 18]", "cuda -keys=cuda,gpu -arch=sm_80 -max_num_threads=1024 -thread_warp_size=32", [-1, 16, 64, 49152, 2147483647, 1024, 8, 32], "", 0, []], [[], [["FU", 1, [0, 1, 2, 3]], ["SP", 1, 0, 7524, [6], 1], ["AN", 1, 0, 5], ["AN", 1, 1, 6]]]], "r": [[8.41407e-06], 0, 1.28473, 1720702873], "v": "v0.6"}
{"i": [["[\"fast_erf\", 2, 19, 11, 18]", "cuda -keys=cuda,gpu -arch=sm_80 -max_num_threads=1024 -thread_warp_size=32", [-1, 16, 64, 49152, 2147483647, 1024, 8, 32], "", 0, []], [[], [["FU", 1, [0, 1, 2, 3]], ["SP", 1, 0, 7524, [10], 1], ["AN", 1, 0, 5], ["AN", 1, 1, 6]]]], "r": [[7.0854e-06], 0, 1.34696, 1720702873], "v": "v0.6"}
{"i": [["[\"fast_erf\", 2, 19, 11, 18]", "cuda -keys=cuda,gpu -arch=sm_80 -max_num_threads=1024 -thread_warp_size=32", [-1, 16, 64, 49152, 2147483647, 1024, 8, 32], "", 0, []], [[], [["FU", 1, [0, 1, 2, 3]], ["SP", 1, 0, 7524, [36], 1], ["AN", 1, 0, 5], ["AN", 1, 1, 6]]]], "r": [[6.01818e-06], 0, 1.24242, 1720702873], "v": "v0.6"}
{"i": [["[\"fast_erf\", 2, 19, 11, 18]", "cuda -keys=cuda,gpu -arch=sm_80 -max_num_threads=1024 -thread_warp_size=32", [-1, 16, 64, 49152, 2147483647, 1024, 8, 32], "", 0, []], [[], [["FU", 1, [0, 1, 2, 3]], ["SP", 1, 0, 7524, [12], 1], ["AN", 1, 0, 5], ["AN", 1, 1, 6]]]], "r": [[8.94619e-06], 0, 1.28913, 1720702874], "v": "v0.6"}
