code_generation/generate/deprecated/deprecated_pure_without_shape/log/cuda/fast_softmax_cuda.log
{"i": [["[\"fast_softmax\", 12, 13, 14, 17]", "cuda -keys=cuda,gpu -arch=sm_80 -max_num_threads=1024 -thread_warp_size=32", [-1, 16, 64, 49152, 2147483647, 1024, 8, 32], "", 0, []], [[], [["CI", 3], ["CI", 2], ["FU", 5, [0, 1, 2, 3]], ["SP", 5, 0, 37128, [1], 1], ["AN", 5, 0, 5], ["AN", 5, 1, 6], ["FU", 4, [0, 1, 2]], ["SP", 4, 0, 2184, [32], 1], ["AN", 4, 0, 5], ["AN", 4, 1, 6], ["FU", 1, [0, 1, 2]], ["SP", 1, 0, 2184, [8], 1], ["AN", 1, 0, 5], ["AN", 1, 1, 6], ["PR", 1, 0, "auto_unroll_max_step$0"], ["PR", 4, 0, "auto_unroll_max_step$0"]]]], "r": [[8.70605e-05], 0, 2.98808, 1720683741], "v": "v0.6"}
{"i": [["[\"fast_softmax\", 12, 13, 14, 17]", "cuda -keys=cuda,gpu -arch=sm_80 -max_num_threads=1024 -thread_warp_size=32", [-1, 16, 64, 49152, 2147483647, 1024, 8, 32], "", 0, []], [[], [["CI", 3], ["CI", 2], ["FU", 5, [0, 1, 2, 3]], ["SP", 5, 0, 37128, [17], 1], ["AN", 5, 0, 5], ["AN", 5, 1, 6], ["FU", 4, [0, 1, 2]], ["SP", 4, 0, 2184, [32], 1], ["AN", 4, 0, 5], ["AN", 4, 1, 6], ["FU", 1, [0, 1, 2]], ["SP", 1, 0, 2184, [32], 1], ["AN", 1, 0, 5], ["AN", 1, 1, 6], ["PR", 1, 0, "auto_unroll_max_step$0"], ["PR", 4, 0, "auto_unroll_max_step$0"]]]], "r": [[3.9111e-05], 0, 2.68547, 1720683742], "v": "v0.6"}
{"i": [["[\"fast_softmax\", 12, 13, 14, 17]", "cuda -keys=cuda,gpu -arch=sm_80 -max_num_threads=1024 -thread_warp_size=32", [-1, 16, 64, 49152, 2147483647, 1024, 8, 32], "", 0, []], [[], [["CI", 3], ["CI", 2], ["FU", 5, [0, 1, 2, 3]], ["SP", 5, 0, 37128, [24], 1], ["AN", 5, 0, 5], ["AN", 5, 1, 6], ["FU", 4, [0, 1, 2]], ["SP", 4, 0, 2184, [32], 1], ["AN", 4, 0, 5], ["AN", 4, 1, 6], ["FU", 1, [0, 1, 2]], ["SP", 1, 0, 2184, [32], 1], ["AN", 1, 0, 5], ["AN", 1, 1, 6], ["PR", 1, 0, "auto_unroll_max_step$0"], ["PR", 4, 0, "auto_unroll_max_step$0"]]]], "r": [[3.48536e-05], 0, 2.34996, 1720683742], "v": "v0.6"}
{"i": [["[\"fast_softmax\", 12, 13, 14, 17]", "cuda -keys=cuda,gpu -arch=sm_80 -max_num_threads=1024 -thread_warp_size=32", [-1, 16, 64, 49152, 2147483647, 1024, 8, 32], "", 0, []], [[], [["CI", 3], ["CI", 2], ["FU", 5, [0, 1, 2, 3]], ["SP", 5, 0, 37128, [4], 1], ["AN", 5, 0, 5], ["AN", 5, 1, 6], ["FU", 4, [0, 1, 2]], ["SP", 4, 0, 2184, [2], 1], ["AN", 4, 0, 5], ["AN", 4, 1, 6], ["FU", 1, [0, 1, 2]], ["SP", 1, 0, 2184, [32], 1], ["AN", 1, 0, 5], ["AN", 1, 1, 6], ["PR", 1, 0, "auto_unroll_max_step$0"], ["PR", 4, 0, "auto_unroll_max_step$0"]]]], "r": [[3.74145e-05], 0, 1.58595, 1720683743], "v": "v0.6"}
{"i": [["[\"fast_softmax\", 12, 13, 14, 17]", "cuda -keys=cuda,gpu -arch=sm_80 -max_num_threads=1024 -thread_warp_size=32", [-1, 16, 64, 49152, 2147483647, 1024, 8, 32], "", 0, []], [[], [["CI", 3], ["CI", 2], ["FU", 5, [0, 1, 2, 3]], ["SP", 5, 0, 37128, [32], 1], ["AN", 5, 0, 5], ["AN", 5, 1, 6], ["FU", 4, [0, 1, 2]], ["SP", 4, 0, 2184, [16], 1], ["AN", 4, 0, 5], ["AN", 4, 1, 6], ["FU", 1, [0, 1, 2]], ["SP", 1, 0, 2184, [32], 1], ["AN", 1, 0, 5], ["AN", 1, 1, 6], ["PR", 1, 0, "auto_unroll_max_step$0"], ["PR", 4, 0, "auto_unroll_max_step$0"]]]], "r": [[5.0857e-05], 0, 2.1706, 1720683743], "v": "v0.6"}
{"i": [["[\"fast_softmax\", 12, 13, 14, 17]", "cuda -keys=cuda,gpu -arch=sm_80 -max_num_threads=1024 -thread_warp_size=32", [-1, 16, 64, 49152, 2147483647, 1024, 8, 32], "", 0, []], [[], [["CI", 3], ["CI", 2], ["FU", 5, [0, 1, 2, 3]], ["SP", 5, 0, 37128, [64], 1], ["AN", 5, 0, 5], ["AN", 5, 1, 6], ["FU", 4, [0, 1, 2]], ["SP", 4, 0, 2184, [16], 1], ["AN", 4, 0, 5], ["AN", 4, 1, 6], ["FU", 1, [0, 1, 2]], ["SP", 1, 0, 2184, [32], 1], ["AN", 1, 0, 5], ["AN", 1, 1, 6], ["PR", 1, 0, "auto_unroll_max_step$0"], ["PR", 4, 0, "auto_unroll_max_step$0"]]]], "r": [[2.58867e-05], 0, 2.66936, 1720683744], "v": "v0.6"}
{"i": [["[\"fast_softmax\", 12, 13, 14, 17]", "cuda -keys=cuda,gpu -arch=sm_80 -max_num_threads=1024 -thread_warp_size=32", [-1, 16, 64, 49152, 2147483647, 1024, 8, 32], "", 0, []], [[], [["CI", 3], ["CI", 2], ["FU", 5, [0, 1, 2, 3]], ["SP", 5, 0, 37128, [32], 1], ["AN", 5, 0, 5], ["AN", 5, 1, 6], ["FU", 4, [0, 1, 2]], ["SP", 4, 0, 2184, [8], 1], ["AN", 4, 0, 5], ["AN", 4, 1, 6], ["FU", 1, [0, 1, 2]], ["SP", 1, 0, 2184, [64], 1], ["AN", 1, 0, 5], ["AN", 1, 1, 6], ["PR", 1, 0, "auto_unroll_max_step$0"], ["PR", 4, 0, "auto_unroll_max_step$0"]]]], "r": [[2.37954e-05], 0, 2.07617, 1720683744], "v": "v0.6"}
{"i": [["[\"fast_softmax\", 12, 13, 14, 17]", "cuda -keys=cuda,gpu -arch=sm_80 -max_num_threads=1024 -thread_warp_size=32", [-1, 16, 64, 49152, 2147483647, 1024, 8, 32], "", 0, []], [[], [["CI", 3], ["CI", 2], ["FU", 5, [0, 1, 2, 3]], ["SP", 5, 0, 37128, [1], 1], ["AN", 5, 0, 5], ["AN", 5, 1, 6], ["FU", 4, [0, 1, 2]], ["SP", 4, 0, 2184, [1], 1], ["AN", 4, 0, 5], ["AN", 4, 1, 6], ["FU", 1, [0, 1, 2]], ["SP", 1, 0, 2184, [32], 1], ["AN", 1, 0, 5], ["AN", 1, 1, 6], ["PR", 1, 0, "auto_unroll_max_step$0"], ["PR", 4, 0, "auto_unroll_max_step$0"]]]], "r": [[8.52423e-05], 0, 2.39855, 1720683745], "v": "v0.6"}
{"i": [["[\"fast_softmax\", 12, 13, 14, 17]", "cuda -keys=cuda,gpu -arch=sm_80 -max_num_threads=1024 -thread_warp_size=32", [-1, 16, 64, 49152, 2147483647, 1024, 8, 32], "", 0, []], [[], [["CI", 3], ["CI", 2], ["FU", 5, [0, 1, 2, 3]], ["SP", 5, 0, 37128, [32], 1], ["AN", 5, 0, 5], ["AN", 5, 1, 6], ["FU", 4, [0, 1, 2]], ["SP", 4, 0, 2184, [26], 1], ["AN", 4, 0, 5], ["AN", 4, 1, 6], ["FU", 1, [0, 1, 2]], ["SP", 1, 0, 2184, [32], 1], ["AN", 1, 0, 5], ["AN", 1, 1, 6], ["PR", 1, 0, "auto_unroll_max_step$0"], ["PR", 4, 0, "auto_unroll_max_step$0"]]]], "r": [[2.25893e-05], 0, 2.51411, 1720683745], "v": "v0.6"}
{"i": [["[\"fast_softmax\", 12, 13, 14, 17]", "cuda -keys=cuda,gpu -arch=sm_80 -max_num_threads=1024 -thread_warp_size=32", [-1, 16, 64, 49152, 2147483647, 1024, 8, 32], "", 0, []], [[], [["CI", 3], ["CI", 2], ["FU", 5, [0, 1, 2, 3]], ["SP", 5, 0, 37128, [32], 1], ["AN", 5, 0, 5], ["AN", 5, 1, 6], ["FU", 4, [0, 1, 2]], ["SP", 4, 0, 2184, [64], 1], ["AN", 4, 0, 5], ["AN", 4, 1, 6], ["FU", 1, [0, 1, 2]], ["SP", 1, 0, 2184, [4], 1], ["AN", 1, 0, 5], ["AN", 1, 1, 6], ["PR", 1, 0, "auto_unroll_max_step$0"], ["PR", 4, 0, "auto_unroll_max_step$0"]]]], "r": [[3.46603e-05], 0, 1.9978, 1720683746], "v": "v0.6"}
