code_generation/generate/deprecated/deprecated_pure_without_shape/log/cuda/fifo_buffer_cuda.log
{"i": [["[\"fifo_buffer\", 10, 19, 20, 19]", "cuda -keys=cuda,gpu -arch=sm_80 -max_num_threads=1024 -thread_warp_size=32", [-1, 16, 64, 49152, 2147483647, 1024, 8, 32], "", 0, []], [[], [["FU", 2, [0, 1, 2, 3]], ["SP", 2, 0, 72200, [32], 1], ["AN", 2, 0, 5], ["AN", 2, 1, 6]]]], "r": [[9.25795e-06], 0, 2.17211, 1720698678], "v": "v0.6"}
{"i": [["[\"fifo_buffer\", 10, 19, 20, 19]", "cuda -keys=cuda,gpu -arch=sm_80 -max_num_threads=1024 -thread_warp_size=32", [-1, 16, 64, 49152, 2147483647, 1024, 8, 32], "", 0, []], [[], [["FU", 2, [0, 1, 2, 3]], ["SP", 2, 0, 72200, [40], 1], ["AN", 2, 0, 5], ["AN", 2, 1, 6]]]], "r": [[8.24216e-06], 0, 1.13421, 1720698678], "v": "v0.6"}
{"i": [["[\"fifo_buffer\", 10, 19, 20, 19]", "cuda -keys=cuda,gpu -arch=sm_80 -max_num_threads=1024 -thread_warp_size=32", [-1, 16, 64, 49152, 2147483647, 1024, 8, 32], "", 0, []], [[], [["FU", 2, [0, 1, 2, 3]], ["SP", 2, 0, 72200, [10], 1], ["AN", 2, 0, 5], ["AN", 2, 1, 6]]]], "r": [[1.72229e-05], 0, 1.45867, 1720698679], "v": "v0.6"}
{"i": [["[\"fifo_buffer\", 10, 19, 20, 19]", "cuda -keys=cuda,gpu -arch=sm_80 -max_num_threads=1024 -thread_warp_size=32", [-1, 16, 64, 49152, 2147483647, 1024, 8, 32], "", 0, []], [[], [["FU", 2, [0, 1, 2, 3]], ["SP", 2, 0, 72200, [4], 1], ["AN", 2, 0, 5], ["AN", 2, 1, 6]]]], "r": [[3.53505e-05], 0, 1.20145, 1720698679], "v": "v0.6"}
{"i": [["[\"fifo_buffer\", 10, 19, 20, 19]", "cuda -keys=cuda,gpu -arch=sm_80 -max_num_threads=1024 -thread_warp_size=32", [-1, 16, 64, 49152, 2147483647, 1024, 8, 32], "", 0, []], [[], [["FU", 2, [0, 1, 2, 3]], ["SP", 2, 0, 72200, [12], 1], ["AN", 2, 0, 5], ["AN", 2, 1, 6]]]], "r": [[1.55827e-05], 0, 1.83635, 1720698679], "v": "v0.6"}
{"i": [["[\"fifo_buffer\", 10, 19, 20, 19]", "cuda -keys=cuda,gpu -arch=sm_80 -max_num_threads=1024 -thread_warp_size=32", [-1, 16, 64, 49152, 2147483647, 1024, 8, 32], "", 0, []], [[], [["FU", 2, [0, 1, 2, 3]], ["SP", 2, 0, 72200, [64], 1], ["AN", 2, 0, 5], ["AN", 2, 1, 6]]]], "r": [[8.12535e-06], 0, 1.65119, 1720698680], "v": "v0.6"}
{"i": [["[\"fifo_buffer\", 10, 19, 20, 19]", "cuda -keys=cuda,gpu -arch=sm_80 -max_num_threads=1024 -thread_warp_size=32", [-1, 16, 64, 49152, 2147483647, 1024, 8, 32], "", 0, []], [[], [["FU", 2, [0, 1, 2, 3]], ["SP", 2, 0, 72200, [19], 1], ["AN", 2, 0, 5], ["AN", 2, 1, 6]]]], "r": [[1.394e-05], 0, 1.31105, 1720698680], "v": "v0.6"}
{"i": [["[\"fifo_buffer\", 10, 19, 20, 19]", "cuda -keys=cuda,gpu -arch=sm_80 -max_num_threads=1024 -thread_warp_size=32", [-1, 16, 64, 49152, 2147483647, 1024, 8, 32], "", 0, []], [[], [["FU", 2, [0, 1, 2, 3]], ["SP", 2, 0, 72200, [25], 1], ["AN", 2, 0, 5], ["AN", 2, 1, 6]]]], "r": [[1.08533e-05], 0, 1.35985, 1720698681], "v": "v0.6"}
{"i": [["[\"fifo_buffer\", 10, 19, 20, 19]", "cuda -keys=cuda,gpu -arch=sm_80 -max_num_threads=1024 -thread_warp_size=32", [-1, 16, 64, 49152, 2147483647, 1024, 8, 32], "", 0, []], [[], [["FU", 2, [0, 1, 2, 3]], ["SP", 2, 0, 72200, [38], 1], ["AN", 2, 0, 5], ["AN", 2, 1, 6]]]], "r": [[1.04104e-05], 0, 1.5545, 1720698681], "v": "v0.6"}
{"i": [["[\"fifo_buffer\", 10, 19, 20, 19]", "cuda -keys=cuda,gpu -arch=sm_80 -max_num_threads=1024 -thread_warp_size=32", [-1, 16, 64, 49152, 2147483647, 1024, 8, 32], "", 0, []], [[], [["FU", 2, [0, 1, 2, 3]], ["SP", 2, 0, 72200, [24], 1], ["AN", 2, 0, 5], ["AN", 2, 1, 6]]]], "r": [[1.11674e-05], 0, 1.43627, 1720698682], "v": "v0.6"}
