code_generation/generate/deprecated/deprecated_pure_without_shape/log/cuda/flatten_cuda.log
{"i": [["[\"flatten\", 11, 17, 20, 1]", "cuda -keys=cuda,gpu -arch=sm_80 -max_num_threads=1024 -thread_warp_size=32", [-1, 16, 64, 49152, 2147483647, 1024, 8, 32], "", 0, []], [[], [["FU", 1, [0, 1]], ["SP", 1, 0, 3740, [11], 1], ["AN", 1, 0, 5], ["AN", 1, 1, 6]]]], "r": [[6.32615e-06], 0, 2.49764, 1720694894], "v": "v0.6"}
{"i": [["[\"flatten\", 11, 17, 20, 1]", "cuda -keys=cuda,gpu -arch=sm_80 -max_num_threads=1024 -thread_warp_size=32", [-1, 16, 64, 49152, 2147483647, 1024, 8, 32], "", 0, []], [[], [["FU", 1, [0, 1]], ["SP", 1, 0, 3740, [44], 1], ["AN", 1, 0, 5], ["AN", 1, 1, 6]]]], "r": [[1.01475e-05], 0, 1.67975, 1720694894], "v": "v0.6"}
{"i": [["[\"flatten\", 11, 17, 20, 1]", "cuda -keys=cuda,gpu -arch=sm_80 -max_num_threads=1024 -thread_warp_size=32", [-1, 16, 64, 49152, 2147483647, 1024, 8, 32], "", 0, []], [[], [["FU", 1, [0, 1]], ["SP", 1, 0, 3740, [2], 1], ["AN", 1, 0, 5], ["AN", 1, 1, 6]]]], "r": [[8.90697e-06], 0, 1.11085, 1720694895], "v": "v0.6"}
{"i": [["[\"flatten\", 11, 17, 20, 1]", "cuda -keys=cuda,gpu -arch=sm_80 -max_num_threads=1024 -thread_warp_size=32", [-1, 16, 64, 49152, 2147483647, 1024, 8, 32], "", 0, []], [[], [["FU", 1, [0, 1]], ["SP", 1, 0, 3740, [10], 1], ["AN", 1, 0, 5], ["AN", 1, 1, 6]]]], "r": [[7.07934e-06], 0, 1.31607, 1720694895], "v": "v0.6"}
{"i": [["[\"flatten\", 11, 17, 20, 1]", "cuda -keys=cuda,gpu -arch=sm_80 -max_num_threads=1024 -thread_warp_size=32", [-1, 16, 64, 49152, 2147483647, 1024, 8, 32], "", 0, []], [[], [["FU", 1, [0, 1]], ["SP", 1, 0, 3740, [55], 1], ["AN", 1, 0, 5], ["AN", 1, 1, 6]]]], "r": [[6.69012e-06], 0, 1.34128, 1720694895], "v": "v0.6"}
{"i": [["[\"flatten\", 11, 17, 20, 1]", "cuda -keys=cuda,gpu -arch=sm_80 -max_num_threads=1024 -thread_warp_size=32", [-1, 16, 64, 49152, 2147483647, 1024, 8, 32], "", 0, []], [[], [["FU", 1, [0, 1]], ["SP", 1, 0, 3740, [22], 1], ["AN", 1, 0, 5], ["AN", 1, 1, 6]]]], "r": [[5.66921e-06], 0, 1.19719, 1720694896], "v": "v0.6"}
{"i": [["[\"flatten\", 11, 17, 20, 1]", "cuda -keys=cuda,gpu -arch=sm_80 -max_num_threads=1024 -thread_warp_size=32", [-1, 16, 64, 49152, 2147483647, 1024, 8, 32], "", 0, []], [[], [["FU", 1, [0, 1]], ["SP", 1, 0, 3740, [16], 1], ["AN", 1, 0, 5], ["AN", 1, 1, 6]]]], "r": [[8.39918e-06], 0, 1.50645, 1720694896], "v": "v0.6"}
{"i": [["[\"flatten\", 11, 17, 20, 1]", "cuda -keys=cuda,gpu -arch=sm_80 -max_num_threads=1024 -thread_warp_size=32", [-1, 16, 64, 49152, 2147483647, 1024, 8, 32], "", 0, []], [[], [["FU", 1, [0, 1]], ["SP", 1, 0, 3740, [1], 1], ["AN", 1, 0, 5], ["AN", 1, 1, 6]]]], "r": [[1.21454e-05], 0, 1.06203, 1720694896], "v": "v0.6"}
{"i": [["[\"flatten\", 11, 17, 20, 1]", "cuda -keys=cuda,gpu -arch=sm_80 -max_num_threads=1024 -thread_warp_size=32", [-1, 16, 64, 49152, 2147483647, 1024, 8, 32], "", 0, []], [[], [["FU", 1, [0, 1]], ["SP", 1, 0, 3740, [5], 1], ["AN", 1, 0, 5], ["AN", 1, 1, 6]]]], "r": [[7.83489e-06], 0, 1.1524, 1720694897], "v": "v0.6"}
{"i": [["[\"flatten\", 11, 17, 20, 1]", "cuda -keys=cuda,gpu -arch=sm_80 -max_num_threads=1024 -thread_warp_size=32", [-1, 16, 64, 49152, 2147483647, 1024, 8, 32], "", 0, []], [[], [["FU", 1, [0, 1]], ["SP", 1, 0, 3740, [34], 1], ["AN", 1, 0, 5], ["AN", 1, 1, 6]]]], "r": [[8.80146e-06], 0, 1.64937, 1720694897], "v": "v0.6"}
