code_generation/generate/deprecated/deprecated_pure_without_shape/log/cuda/flip_cuda.log
{"i": [["[\"flip\", 4, 14, 20, 17]", "cuda -keys=cuda,gpu -arch=sm_80 -max_num_threads=1024 -thread_warp_size=32", [-1, 16, 64, 49152, 2147483647, 1024, 8, 32], "", 0, []], [[], [["FU", 1, [0, 1, 2, 3]], ["SP", 1, 0, 19040, [56], 1], ["AN", 1, 0, 5], ["AN", 1, 1, 6]]]], "r": [[5.94981e-06], 0, 1.8645, 1720710999], "v": "v0.6"}
{"i": [["[\"flip\", 4, 14, 20, 17]", "cuda -keys=cuda,gpu -arch=sm_80 -max_num_threads=1024 -thread_warp_size=32", [-1, 16, 64, 49152, 2147483647, 1024, 8, 32], "", 0, []], [[], [["FU", 1, [0, 1, 2, 3]], ["SP", 1, 0, 19040, [7], 1], ["AN", 1, 0, 5], ["AN", 1, 1, 6]]]], "r": [[9.84689e-06], 0, 1.31473, 1720711000], "v": "v0.6"}
{"i": [["[\"flip\", 4, 14, 20, 17]", "cuda -keys=cuda,gpu -arch=sm_80 -max_num_threads=1024 -thread_warp_size=32", [-1, 16, 64, 49152, 2147483647, 1024, 8, 32], "", 0, []], [[], [["FU", 1, [0, 1, 2, 3]], ["SP", 1, 0, 19040, [4], 1], ["AN", 1, 0, 5], ["AN", 1, 1, 6]]]], "r": [[1.32379e-05], 0, 1.31974, 1720711000], "v": "v0.6"}
{"i": [["[\"flip\", 4, 14, 20, 17]", "cuda -keys=cuda,gpu -arch=sm_80 -max_num_threads=1024 -thread_warp_size=32", [-1, 16, 64, 49152, 2147483647, 1024, 8, 32], "", 0, []], [[], [["FU", 1, [0, 1, 2, 3]], ["SP", 1, 0, 19040, [2], 1], ["AN", 1, 0, 5], ["AN", 1, 1, 6]]]], "r": [[2.12091e-05], 0, 1.25959, 1720711001], "v": "v0.6"}
{"i": [["[\"flip\", 4, 14, 20, 17]", "cuda -keys=cuda,gpu -arch=sm_80 -max_num_threads=1024 -thread_warp_size=32", [-1, 16, 64, 49152, 2147483647, 1024, 8, 32], "", 0, []], [[], [["FU", 1, [0, 1, 2, 3]], ["SP", 1, 0, 19040, [14], 1], ["AN", 1, 0, 5], ["AN", 1, 1, 6]]]], "r": [[7.50842e-06], 0, 1.23084, 1720711001], "v": "v0.6"}
{"i": [["[\"flip\", 4, 14, 20, 17]", "cuda -keys=cuda,gpu -arch=sm_80 -max_num_threads=1024 -thread_warp_size=32", [-1, 16, 64, 49152, 2147483647, 1024, 8, 32], "", 0, []], [[], [["FU", 1, [0, 1, 2, 3]], ["SP", 1, 0, 19040, [40], 1], ["AN", 1, 0, 5], ["AN", 1, 1, 6]]]], "r": [[6.16881e-06], 0, 1.32046, 1720711001], "v": "v0.6"}
{"i": [["[\"flip\", 4, 14, 20, 17]", "cuda -keys=cuda,gpu -arch=sm_80 -max_num_threads=1024 -thread_warp_size=32", [-1, 16, 64, 49152, 2147483647, 1024, 8, 32], "", 0, []], [[], [["FU", 1, [0, 1, 2, 3]], ["SP", 1, 0, 19040, [16], 1], ["AN", 1, 0, 5], ["AN", 1, 1, 6]]]], "r": [[7.46918e-06], 0, 1.19842, 1720711001], "v": "v0.6"}
{"i": [["[\"flip\", 4, 14, 20, 17]", "cuda -keys=cuda,gpu -arch=sm_80 -max_num_threads=1024 -thread_warp_size=32", [-1, 16, 64, 49152, 2147483647, 1024, 8, 32], "", 0, []], [[], [["FU", 1, [0, 1, 2, 3]], ["SP", 1, 0, 19040, [34], 1], ["AN", 1, 0, 5], ["AN", 1, 1, 6]]]], "r": [[6.48539e-06], 0, 0.98392, 1720711002], "v": "v0.6"}
{"i": [["[\"flip\", 4, 14, 20, 17]", "cuda -keys=cuda,gpu -arch=sm_80 -max_num_threads=1024 -thread_warp_size=32", [-1, 16, 64, 49152, 2147483647, 1024, 8, 32], "", 0, []], [[], [["FU", 1, [0, 1, 2, 3]], ["SP", 1, 0, 19040, [17], 1], ["AN", 1, 0, 5], ["AN", 1, 1, 6]]]], "r": [[7.2069e-06], 0, 1.1802, 1720711002], "v": "v0.6"}
{"i": [["[\"flip\", 4, 14, 20, 17]", "cuda -keys=cuda,gpu -arch=sm_80 -max_num_threads=1024 -thread_warp_size=32", [-1, 16, 64, 49152, 2147483647, 1024, 8, 32], "", 0, []], [[], [["FU", 1, [0, 1, 2, 3]], ["SP", 1, 0, 19040, [28], 1], ["AN", 1, 0, 5], ["AN", 1, 1, 6]]]], "r": [[6.16767e-06], 0, 1.32291, 1720711002], "v": "v0.6"}
