code_generation/generate/deprecated/deprecated_pure_without_shape/log/cuda/floor_cuda.log
{"i": [["[\"floor\", 3, 2, 1, 9]", "cuda -keys=cuda,gpu -arch=sm_80 -max_num_threads=1024 -thread_warp_size=32", [-1, 16, 64, 49152, 2147483647, 1024, 8, 32], "", 0, []], [[], [["FU", 1, [0, 1, 2, 3]], ["SP", 1, 0, 54, [9], 1], ["AN", 1, 0, 5], ["AN", 1, 1, 6]]]], "r": [[5.4419e-06], 0, 1.81736, 1720712010], "v": "v0.6"}
{"i": [["[\"floor\", 3, 2, 1, 9]", "cuda -keys=cuda,gpu -arch=sm_80 -max_num_threads=1024 -thread_warp_size=32", [-1, 16, 64, 49152, 2147483647, 1024, 8, 32], "", 0, []], [[], [["FU", 1, [0, 1, 2, 3]], ["SP", 1, 0, 54, [6], 1], ["AN", 1, 0, 5], ["AN", 1, 1, 6]]]], "r": [[5.38682e-06], 0, 1.16531, 1720712010], "v": "v0.6"}
{"i": [["[\"floor\", 3, 2, 1, 9]", "cuda -keys=cuda,gpu -arch=sm_80 -max_num_threads=1024 -thread_warp_size=32", [-1, 16, 64, 49152, 2147483647, 1024, 8, 32], "", 0, []], [[], [["FU", 1, [0, 1, 2, 3]], ["SP", 1, 0, 54, [24], 1], ["AN", 1, 0, 5], ["AN", 1, 1, 6]]]], "r": [[5.31461e-06], 0, 1.3644, 1720712010], "v": "v0.6"}
{"i": [["[\"floor\", 3, 2, 1, 9]", "cuda -keys=cuda,gpu -arch=sm_80 -max_num_threads=1024 -thread_warp_size=32", [-1, 16, 64, 49152, 2147483647, 1024, 8, 32], "", 0, []], [[], [["FU", 1, [0, 1, 2, 3]], ["SP", 1, 0, 54, [54], 1], ["AN", 1, 0, 5], ["AN", 1, 1, 6]]]], "r": [[5.50448e-06], 0, 1.02664, 1720712011], "v": "v0.6"}
{"i": [["[\"floor\", 3, 2, 1, 9]", "cuda -keys=cuda,gpu -arch=sm_80 -max_num_threads=1024 -thread_warp_size=32", [-1, 16, 64, 49152, 2147483647, 1024, 8, 32], "", 0, []], [[], [["FU", 1, [0, 1, 2, 3]], ["SP", 1, 0, 54, [1], 1], ["AN", 1, 0, 5], ["AN", 1, 1, 6]]]], "r": [[5.47121e-06], 0, 1.17738, 1720712011], "v": "v0.6"}
{"i": [["[\"floor\", 3, 2, 1, 9]", "cuda -keys=cuda,gpu -arch=sm_80 -max_num_threads=1024 -thread_warp_size=32", [-1, 16, 64, 49152, 2147483647, 1024, 8, 32], "", 0, []], [[], [["FU", 1, [0, 1, 2, 3]], ["SP", 1, 0, 54, [12], 1], ["AN", 1, 0, 5], ["AN", 1, 1, 6]]]], "r": [[5.30203e-06], 0, 1.16568, 1720712011], "v": "v0.6"}
{"i": [["[\"floor\", 3, 2, 1, 9]", "cuda -keys=cuda,gpu -arch=sm_80 -max_num_threads=1024 -thread_warp_size=32", [-1, 16, 64, 49152, 2147483647, 1024, 8, 32], "", 0, []], [[], [["FU", 1, [0, 1, 2, 3]], ["SP", 1, 0, 54, [32], 1], ["AN", 1, 0, 5], ["AN", 1, 1, 6]]]], "r": [[5.9628e-06], 0, 1.29368, 1720712012], "v": "v0.6"}
{"i": [["[\"floor\", 3, 2, 1, 9]", "cuda -keys=cuda,gpu -arch=sm_80 -max_num_threads=1024 -thread_warp_size=32", [-1, 16, 64, 49152, 2147483647, 1024, 8, 32], "", 0, []], [[], [["FU", 1, [0, 1, 2, 3]], ["SP", 1, 0, 54, [8], 1], ["AN", 1, 0, 5], ["AN", 1, 1, 6]]]], "r": [[5.34072e-06], 0, 0.754576, 1720712012], "v": "v0.6"}
{"i": [["[\"floor\", 3, 2, 1, 9]", "cuda -keys=cuda,gpu -arch=sm_80 -max_num_threads=1024 -thread_warp_size=32", [-1, 16, 64, 49152, 2147483647, 1024, 8, 32], "", 0, []], [[], [["FU", 1, [0, 1, 2, 3]], ["SP", 1, 0, 54, [27], 1], ["AN", 1, 0, 5], ["AN", 1, 1, 6]]]], "r": [[5.38021e-06], 0, 1.27117, 1720712012], "v": "v0.6"}
{"i": [["[\"floor\", 3, 2, 1, 9]", "cuda -keys=cuda,gpu -arch=sm_80 -max_num_threads=1024 -thread_warp_size=32", [-1, 16, 64, 49152, 2147483647, 1024, 8, 32], "", 0, []], [[], [["FU", 1, [0, 1, 2, 3]], ["SP", 1, 0, 54, [48], 1], ["AN", 1, 0, 5], ["AN", 1, 1, 6]]]], "r": [[5.80982e-06], 0, 1.01974, 1720712012], "v": "v0.6"}
