code_generation/generate/deprecated/deprecated_pure_without_shape/log/cuda/isnan_cuda.log
{"i": [["[\"isnan\", 18, 5, 4, 20]", "cuda -keys=cuda,gpu -arch=sm_80 -max_num_threads=1024 -thread_warp_size=32", [-1, 16, 64, 49152, 2147483647, 1024, 8, 32], "", 0, []], [[], [["FU", 1, [0, 1, 2, 3]], ["SP", 1, 0, 7200, [60], 1], ["AN", 1, 0, 5], ["AN", 1, 1, 6]]]], "r": [[5.45268e-06], 0, 1.7632, 1720713771], "v": "v0.6"}
{"i": [["[\"isnan\", 18, 5, 4, 20]", "cuda -keys=cuda,gpu -arch=sm_80 -max_num_threads=1024 -thread_warp_size=32", [-1, 16, 64, 49152, 2147483647, 1024, 8, 32], "", 0, []], [[], [["FU", 1, [0, 1, 2, 3]], ["SP", 1, 0, 7200, [10], 1], ["AN", 1, 0, 5], ["AN", 1, 1, 6]]]], "r": [[6.99319e-06], 0, 1.42367, 1720713771], "v": "v0.6"}
{"i": [["[\"isnan\", 18, 5, 4, 20]", "cuda -keys=cuda,gpu -arch=sm_80 -max_num_threads=1024 -thread_warp_size=32", [-1, 16, 64, 49152, 2147483647, 1024, 8, 32], "", 0, []], [[], [["FU", 1, [0, 1, 2, 3]], ["SP", 1, 0, 7200, [8], 1], ["AN", 1, 0, 5], ["AN", 1, 1, 6]]]], "r": [[7.90345e-06], 0, 1.5849, 1720713771], "v": "v0.6"}
{"i": [["[\"isnan\", 18, 5, 4, 20]", "cuda -keys=cuda,gpu -arch=sm_80 -max_num_threads=1024 -thread_warp_size=32", [-1, 16, 64, 49152, 2147483647, 1024, 8, 32], "", 0, []], [[], [["FU", 1, [0, 1, 2, 3]], ["SP", 1, 0, 7200, [36], 1], ["AN", 1, 0, 5], ["AN", 1, 1, 6]]]], "r": [[7.13906e-06], 0, 1.50589, 1720713772], "v": "v0.6"}
{"i": [["[\"isnan\", 18, 5, 4, 20]", "cuda -keys=cuda,gpu -arch=sm_80 -max_num_threads=1024 -thread_warp_size=32", [-1, 16, 64, 49152, 2147483647, 1024, 8, 32], "", 0, []], [[], [["FU", 1, [0, 1, 2, 3]], ["SP", 1, 0, 7200, [40], 1], ["AN", 1, 0, 5], ["AN", 1, 1, 6]]]], "r": [[5.88765e-06], 0, 1.49072, 1720713772], "v": "v0.6"}
{"i": [["[\"isnan\", 18, 5, 4, 20]", "cuda -keys=cuda,gpu -arch=sm_80 -max_num_threads=1024 -thread_warp_size=32", [-1, 16, 64, 49152, 2147483647, 1024, 8, 32], "", 0, []], [[], [["FU", 1, [0, 1, 2, 3]], ["SP", 1, 0, 7200, [5], 1], ["AN", 1, 0, 5], ["AN", 1, 1, 6]]]], "r": [[7.73879e-06], 0, 1.19146, 1720713772], "v": "v0.6"}
{"i": [["[\"isnan\", 18, 5, 4, 20]", "cuda -keys=cuda,gpu -arch=sm_80 -max_num_threads=1024 -thread_warp_size=32", [-1, 16, 64, 49152, 2147483647, 1024, 8, 32], "", 0, []], [[], [["FU", 1, [0, 1, 2, 3]], ["SP", 1, 0, 7200, [48], 1], ["AN", 1, 0, 5], ["AN", 1, 1, 6]]]], "r": [[6.83595e-06], 0, 1.44997, 1720713773], "v": "v0.6"}
{"i": [["[\"isnan\", 18, 5, 4, 20]", "cuda -keys=cuda,gpu -arch=sm_80 -max_num_threads=1024 -thread_warp_size=32", [-1, 16, 64, 49152, 2147483647, 1024, 8, 32], "", 0, []], [[], [["FU", 1, [0, 1, 2, 3]], ["SP", 1, 0, 7200, [2], 1], ["AN", 1, 0, 5], ["AN", 1, 1, 6]]]], "r": [[1.13021e-05], 0, 1.35356, 1720713773], "v": "v0.6"}
{"i": [["[\"isnan\", 18, 5, 4, 20]", "cuda -keys=cuda,gpu -arch=sm_80 -max_num_threads=1024 -thread_warp_size=32", [-1, 16, 64, 49152, 2147483647, 1024, 8, 32], "", 0, []], [[], [["FU", 1, [0, 1, 2, 3]], ["SP", 1, 0, 7200, [20], 1], ["AN", 1, 0, 5], ["AN", 1, 1, 6]]]], "r": [[5.9288e-06], 0, 1.28349, 1720713773], "v": "v0.6"}
{"i": [["[\"isnan\", 18, 5, 4, 20]", "cuda -keys=cuda,gpu -arch=sm_80 -max_num_threads=1024 -thread_warp_size=32", [-1, 16, 64, 49152, 2147483647, 1024, 8, 32], "", 0, []], [[], [["FU", 1, [0, 1, 2, 3]], ["SP", 1, 0, 7200, [45], 1], ["AN", 1, 0, 5], ["AN", 1, 1, 6]]]], "r": [[5.69695e-06], 0, 1.4561, 1720713774], "v": "v0.6"}
