code_generation/generate/deprecated/deprecated_pure_without_shape/log/cuda/log_softmax_cuda.log
{"i": [["[\"log_softmax\", 1, 19, 18, 4]", "cuda -keys=cuda,gpu -arch=sm_80 -max_num_threads=1024 -thread_warp_size=32", [-1, 16, 64, 49152, 2147483647, 1024, 8, 32], "", 0, []], [[], [["CHW", 3, "local"], ["CI", 3], ["FU", 4, [0, 1, 2, 3]], ["SP", 4, 0, 1368, [32], 1], ["AN", 4, 0, 5], ["AN", 4, 1, 6], ["FU", 2, [0, 1, 2]], ["SP", 2, 0, 342, [32], 1], ["AN", 2, 0, 5], ["AN", 2, 1, 6], ["FU", 1, [0, 1, 2]], ["SP", 1, 0, 342, [4], 1], ["AN", 1, 0, 5], ["AN", 1, 1, 6], ["PR", 1, 0, "auto_unroll_max_step$0"], ["PR", 2, 0, "auto_unroll_max_step$0"]]]], "r": [[2.53998e-05], 0, 1.95232, 1720717833], "v": "v0.6"}
{"i": [["[\"log_softmax\", 1, 19, 18, 4]", "cuda -keys=cuda,gpu -arch=sm_80 -max_num_threads=1024 -thread_warp_size=32", [-1, 16, 64, 49152, 2147483647, 1024, 8, 32], "", 0, []], [[], [["CHW", 3, "local"], ["CI", 3], ["FU", 4, [0, 1, 2, 3]], ["SP", 4, 0, 1368, [32], 1], ["AN", 4, 0, 5], ["AN", 4, 1, 6], ["FU", 2, [0, 1, 2]], ["SP", 2, 0, 342, [64], 1], ["AN", 2, 0, 5], ["AN", 2, 1, 6], ["FU", 1, [0, 1, 2]], ["SP", 1, 0, 342, [1], 1], ["AN", 1, 0, 5], ["AN", 1, 1, 6], ["PR", 1, 0, "auto_unroll_max_step$0"], ["PR", 2, 0, "auto_unroll_max_step$0"]]]], "r": [[1.68829e-05], 0, 1.35978, 1720717833], "v": "v0.6"}
{"i": [["[\"log_softmax\", 1, 19, 18, 4]", "cuda -keys=cuda,gpu -arch=sm_80 -max_num_threads=1024 -thread_warp_size=32", [-1, 16, 64, 49152, 2147483647, 1024, 8, 32], "", 0, []], [[], [["CHW", 3, "local"], ["CI", 3], ["FU", 4, [0, 1, 2, 3]], ["SP", 4, 0, 1368, [64], 1], ["AN", 4, 0, 5], ["AN", 4, 1, 6], ["FU", 2, [0, 1, 2]], ["SP", 2, 0, 342, [4], 1], ["AN", 2, 0, 5], ["AN", 2, 1, 6], ["FU", 1, [0, 1, 2]], ["SP", 1, 0, 342, [8], 1], ["AN", 1, 0, 5], ["AN", 1, 1, 6], ["PR", 1, 0, "auto_unroll_max_step$0"], ["PR", 2, 0, "auto_unroll_max_step$0"]]]], "r": [[1.70178e-05], 0, 1.37781, 1720717834], "v": "v0.6"}
{"i": [["[\"log_softmax\", 1, 19, 18, 4]", "cuda -keys=cuda,gpu -arch=sm_80 -max_num_threads=1024 -thread_warp_size=32", [-1, 16, 64, 49152, 2147483647, 1024, 8, 32], "", 0, []], [[], [["CHW", 3, "local"], ["CI", 3], ["FU", 4, [0, 1, 2, 3]], ["SP", 4, 0, 1368, [4], 1], ["AN", 4, 0, 5], ["AN", 4, 1, 6], ["FU", 2, [0, 1, 2]], ["SP", 2, 0, 342, [1], 1], ["AN", 2, 0, 5], ["AN", 2, 1, 6], ["FU", 1, [0, 1, 2]], ["SP", 1, 0, 342, [32], 1], ["AN", 1, 0, 5], ["AN", 1, 1, 6], ["PR", 1, 0, "auto_unroll_max_step$0"], ["PR", 2, 0, "auto_unroll_max_step$0"]]]], "r": [[1.84388e-05], 0, 1.37638, 1720717834], "v": "v0.6"}
{"i": [["[\"log_softmax\", 1, 19, 18, 4]", "cuda -keys=cuda,gpu -arch=sm_80 -max_num_threads=1024 -thread_warp_size=32", [-1, 16, 64, 49152, 2147483647, 1024, 8, 32], "", 0, []], [[], [["CHW", 3, "local"], ["CI", 3], ["FU", 4, [0, 1, 2, 3]], ["SP", 4, 0, 1368, [16], 1], ["AN", 4, 0, 5], ["AN", 4, 1, 6], ["FU", 2, [0, 1, 2]], ["SP", 2, 0, 342, [8], 1], ["AN", 2, 0, 5], ["AN", 2, 1, 6], ["FU", 1, [0, 1, 2]], ["SP", 1, 0, 342, [64], 1], ["AN", 1, 0, 5], ["AN", 1, 1, 6], ["PR", 1, 0, "auto_unroll_max_step$0"], ["PR", 2, 0, "auto_unroll_max_step$0"]]]], "r": [[1.74446e-05], 0, 1.10317, 1720717834], "v": "v0.6"}
{"i": [["[\"log_softmax\", 1, 19, 18, 4]", "cuda -keys=cuda,gpu -arch=sm_80 -max_num_threads=1024 -thread_warp_size=32", [-1, 16, 64, 49152, 2147483647, 1024, 8, 32], "", 0, []], [[], [["CHW", 3, "local"], ["CI", 3], ["FU", 4, [0, 1, 2, 3]], ["SP", 4, 0, 1368, [32], 1], ["AN", 4, 0, 5], ["AN", 4, 1, 6], ["FU", 2, [0, 1, 2]], ["SP", 2, 0, 342, [4], 1], ["AN", 2, 0, 5], ["AN", 2, 1, 6], ["FU", 1, [0, 1, 2]], ["SP", 1, 0, 342, [18], 1], ["AN", 1, 0, 5], ["AN", 1, 1, 6], ["PR", 1, 0, "auto_unroll_max_step$0"], ["PR", 2, 0, "auto_unroll_max_step$0"]]]], "r": [[1.66067e-05], 0, 1.4488, 1720717835], "v": "v0.6"}
{"i": [["[\"log_softmax\", 1, 19, 18, 4]", "cuda -keys=cuda,gpu -arch=sm_80 -max_num_threads=1024 -thread_warp_size=32", [-1, 16, 64, 49152, 2147483647, 1024, 8, 32], "", 0, []], [[], [["CHW", 3, "local"], ["CI", 3], ["FU", 4, [0, 1, 2, 3]], ["SP", 4, 0, 1368, [32], 1], ["AN", 4, 0, 5], ["AN", 4, 1, 6], ["FU", 2, [0, 1, 2]], ["SP", 2, 0, 342, [8], 1], ["AN", 2, 0, 5], ["AN", 2, 1, 6], ["FU", 1, [0, 1, 2]], ["SP", 1, 0, 342, [19], 1], ["AN", 1, 0, 5], ["AN", 1, 1, 6], ["PR", 1, 0, "auto_unroll_max_step$0"], ["PR", 2, 0, "auto_unroll_max_step$0"]]]], "r": [[1.63558e-05], 0, 1.28636, 1720717835], "v": "v0.6"}
{"i": [["[\"log_softmax\", 1, 19, 18, 4]", "cuda -keys=cuda,gpu -arch=sm_80 -max_num_threads=1024 -thread_warp_size=32", [-1, 16, 64, 49152, 2147483647, 1024, 8, 32], "", 0, []], [[], [["CHW", 3, "local"], ["CI", 3], ["FU", 4, [0, 1, 2, 3]], ["SP", 4, 0, 1368, [8], 1], ["AN", 4, 0, 5], ["AN", 4, 1, 6], ["FU", 2, [0, 1, 2]], ["SP", 2, 0, 342, [19], 1], ["AN", 2, 0, 5], ["AN", 2, 1, 6], ["FU", 1, [0, 1, 2]], ["SP", 1, 0, 342, [32], 1], ["AN", 1, 0, 5], ["AN", 1, 1, 6], ["PR", 1, 0, "auto_unroll_max_step$0"], ["PR", 2, 0, "auto_unroll_max_step$0"]]]], "r": [[1.76813e-05], 0, 1.38333, 1720717835], "v": "v0.6"}
{"i": [["[\"log_softmax\", 1, 19, 18, 4]", "cuda -keys=cuda,gpu -arch=sm_80 -max_num_threads=1024 -thread_warp_size=32", [-1, 16, 64, 49152, 2147483647, 1024, 8, 32], "", 0, []], [[], [["CHW", 3, "local"], ["CI", 3], ["FU", 4, [0, 1, 2, 3]], ["SP", 4, 0, 1368, [32], 1], ["AN", 4, 0, 5], ["AN", 4, 1, 6], ["FU", 2, [0, 1, 2]], ["SP", 2, 0, 342, [64], 1], ["AN", 2, 0, 5], ["AN", 2, 1, 6], ["FU", 1, [0, 1, 2]], ["SP", 1, 0, 342, [2], 1], ["AN", 1, 0, 5], ["AN", 1, 1, 6], ["PR", 1, 0, "auto_unroll_max_step$0"], ["PR", 2, 0, "auto_unroll_max_step$0"]]]], "r": [[1.66631e-05], 0, 1.1706, 1720717836], "v": "v0.6"}
{"i": [["[\"log_softmax\", 1, 19, 18, 4]", "cuda -keys=cuda,gpu -arch=sm_80 -max_num_threads=1024 -thread_warp_size=32", [-1, 16, 64, 49152, 2147483647, 1024, 8, 32], "", 0, []], [[], [["CHW", 3, "local"], ["CI", 3], ["FU", 4, [0, 1, 2, 3]], ["SP", 4, 0, 1368, [24], 1], ["AN", 4, 0, 5], ["AN", 4, 1, 6], ["FU", 2, [0, 1, 2]], ["SP", 2, 0, 342, [32], 1], ["AN", 2, 0, 5], ["AN", 2, 1, 6], ["FU", 1, [0, 1, 2]], ["SP", 1, 0, 342, [1], 1], ["AN", 1, 0, 5], ["AN", 1, 1, 6], ["PR", 1, 0, "auto_unroll_max_step$0"], ["PR", 2, 0, "auto_unroll_max_step$0"]]]], "r": [[2.3278e-05], 0, 1.71184, 1720717836], "v": "v0.6"}
