code_generation/generate/deprecated/deprecated_pure_without_shape/log/cuda/log_cuda.log
{"i": [["[\"log\", 3, 16, 12, 17]", "cuda -keys=cuda,gpu -arch=sm_80 -max_num_threads=1024 -thread_warp_size=32", [-1, 16, 64, 49152, 2147483647, 1024, 8, 32], "", 0, []], [[], [["FU", 1, [0, 1, 2, 3]], ["SP", 1, 0, 9792, [12], 1], ["AN", 1, 0, 5], ["AN", 1, 1, 6]]]], "r": [[6.64276e-06], 0, 1.44491, 1720715223], "v": "v0.6"}
{"i": [["[\"log\", 3, 16, 12, 17]", "cuda -keys=cuda,gpu -arch=sm_80 -max_num_threads=1024 -thread_warp_size=32", [-1, 16, 64, 49152, 2147483647, 1024, 8, 32], "", 0, []], [[], [["FU", 1, [0, 1, 2, 3]], ["SP", 1, 0, 9792, [36], 1], ["AN", 1, 0, 5], ["AN", 1, 1, 6]]]], "r": [[5.832e-06], 0, 1.39328, 1720715223], "v": "v0.6"}
{"i": [["[\"log\", 3, 16, 12, 17]", "cuda -keys=cuda,gpu -arch=sm_80 -max_num_threads=1024 -thread_warp_size=32", [-1, 16, 64, 49152, 2147483647, 1024, 8, 32], "", 0, []], [[], [["FU", 1, [0, 1, 2, 3]], ["SP", 1, 0, 9792, [24], 1], ["AN", 1, 0, 5], ["AN", 1, 1, 6]]]], "r": [[6.18766e-06], 0, 1.39835, 1720715223], "v": "v0.6"}
{"i": [["[\"log\", 3, 16, 12, 17]", "cuda -keys=cuda,gpu -arch=sm_80 -max_num_threads=1024 -thread_warp_size=32", [-1, 16, 64, 49152, 2147483647, 1024, 8, 32], "", 0, []], [[], [["FU", 1, [0, 1, 2, 3]], ["SP", 1, 0, 9792, [6], 1], ["AN", 1, 0, 5], ["AN", 1, 1, 6]]]], "r": [[8.09504e-06], 0, 0.934163, 1720715224], "v": "v0.6"}
{"i": [["[\"log\", 3, 16, 12, 17]", "cuda -keys=cuda,gpu -arch=sm_80 -max_num_threads=1024 -thread_warp_size=32", [-1, 16, 64, 49152, 2147483647, 1024, 8, 32], "", 0, []], [[], [["FU", 1, [0, 1, 2, 3]], ["SP", 1, 0, 9792, [16], 1], ["AN", 1, 0, 5], ["AN", 1, 1, 6]]]], "r": [[6.31411e-06], 0, 0.886393, 1720715224], "v": "v0.6"}
{"i": [["[\"log\", 3, 16, 12, 17]", "cuda -keys=cuda,gpu -arch=sm_80 -max_num_threads=1024 -thread_warp_size=32", [-1, 16, 64, 49152, 2147483647, 1024, 8, 32], "", 0, []], [[], [["FU", 1, [0, 1, 2, 3]], ["SP", 1, 0, 9792, [48], 1], ["AN", 1, 0, 5], ["AN", 1, 1, 6]]]], "r": [[8.06513e-06], 0, 1.27533, 1720715224], "v": "v0.6"}
{"i": [["[\"log\", 3, 16, 12, 17]", "cuda -keys=cuda,gpu -arch=sm_80 -max_num_threads=1024 -thread_warp_size=32", [-1, 16, 64, 49152, 2147483647, 1024, 8, 32], "", 0, []], [[], [["FU", 1, [0, 1, 2, 3]], ["SP", 1, 0, 9792, [51], 1], ["AN", 1, 0, 5], ["AN", 1, 1, 6]]]], "r": [[8.21297e-06], 0, 1.41891, 1720715225], "v": "v0.6"}
{"i": [["[\"log\", 3, 16, 12, 17]", "cuda -keys=cuda,gpu -arch=sm_80 -max_num_threads=1024 -thread_warp_size=32", [-1, 16, 64, 49152, 2147483647, 1024, 8, 32], "", 0, []], [[], [["FU", 1, [0, 1, 2, 3]], ["SP", 1, 0, 9792, [17], 1], ["AN", 1, 0, 5], ["AN", 1, 1, 6]]]], "r": [[9.55608e-06], 0, 1.01651, 1720715225], "v": "v0.6"}
{"i": [["[\"log\", 3, 16, 12, 17]", "cuda -keys=cuda,gpu -arch=sm_80 -max_num_threads=1024 -thread_warp_size=32", [-1, 16, 64, 49152, 2147483647, 1024, 8, 32], "", 0, []], [[], [["FU", 1, [0, 1, 2, 3]], ["SP", 1, 0, 9792, [64], 1], ["AN", 1, 0, 5], ["AN", 1, 1, 6]]]], "r": [[7.2898e-06], 0, 1.14312, 1720715225], "v": "v0.6"}
{"i": [["[\"log\", 3, 16, 12, 17]", "cuda -keys=cuda,gpu -arch=sm_80 -max_num_threads=1024 -thread_warp_size=32", [-1, 16, 64, 49152, 2147483647, 1024, 8, 32], "", 0, []], [[], [["FU", 1, [0, 1, 2, 3]], ["SP", 1, 0, 9792, [4], 1], ["AN", 1, 0, 5], ["AN", 1, 1, 6]]]], "r": [[9.75426e-06], 0, 1.07313, 1720715226], "v": "v0.6"}
