code_generation/generate/deprecated/deprecated_pure_without_shape/log/cuda/mirror_pad_cuda.log
{"i": [["[\"mirror_pad\", 9, 14, 5, 19]", "cuda -keys=cuda,gpu -arch=sm_80 -max_num_threads=1024 -thread_warp_size=32", [-1, 16, 64, 49152, 2147483647, 1024, 8, 32], "", 0, []], [[], [["FU", 1, [0, 1]], ["SP", 1, 0, 176, [1], 1], ["AN", 1, 0, 5], ["AN", 1, 1, 6]]]], "r": [[6.60607e-06], 0, 2.18099, 1720722648], "v": "v0.6"}
{"i": [["[\"mirror_pad\", 9, 14, 5, 19]", "cuda -keys=cuda,gpu -arch=sm_80 -max_num_threads=1024 -thread_warp_size=32", [-1, 16, 64, 49152, 2147483647, 1024, 8, 32], "", 0, []], [[], [["FU", 1, [0, 1]], ["SP", 1, 0, 176, [22], 1], ["AN", 1, 0, 5], ["AN", 1, 1, 6]]]], "r": [[5.34434e-06], 0, 1.45279, 1720722649], "v": "v0.6"}
{"i": [["[\"mirror_pad\", 9, 14, 5, 19]", "cuda -keys=cuda,gpu -arch=sm_80 -max_num_threads=1024 -thread_warp_size=32", [-1, 16, 64, 49152, 2147483647, 1024, 8, 32], "", 0, []], [[], [["FU", 1, [0, 1]], ["SP", 1, 0, 176, [44], 1], ["AN", 1, 0, 5], ["AN", 1, 1, 6]]]], "r": [[7.37586e-06], 0, 1.58361, 1720722649], "v": "v0.6"}
{"i": [["[\"mirror_pad\", 9, 14, 5, 19]", "cuda -keys=cuda,gpu -arch=sm_80 -max_num_threads=1024 -thread_warp_size=32", [-1, 16, 64, 49152, 2147483647, 1024, 8, 32], "", 0, []], [[], [["FU", 1, [0, 1]], ["SP", 1, 0, 176, [4], 1], ["AN", 1, 0, 5], ["AN", 1, 1, 6]]]], "r": [[5.85444e-06], 0, 1.13043, 1720722649], "v": "v0.6"}
{"i": [["[\"mirror_pad\", 9, 14, 5, 19]", "cuda -keys=cuda,gpu -arch=sm_80 -max_num_threads=1024 -thread_warp_size=32", [-1, 16, 64, 49152, 2147483647, 1024, 8, 32], "", 0, []], [[], [["FU", 1, [0, 1]], ["SP", 1, 0, 176, [2], 1], ["AN", 1, 0, 5], ["AN", 1, 1, 6]]]], "r": [[1.08225e-05], 0, 1.5598, 1720722650], "v": "v0.6"}
{"i": [["[\"mirror_pad\", 9, 14, 5, 19]", "cuda -keys=cuda,gpu -arch=sm_80 -max_num_threads=1024 -thread_warp_size=32", [-1, 16, 64, 49152, 2147483647, 1024, 8, 32], "", 0, []], [[], [["FU", 1, [0, 1]], ["SP", 1, 0, 176, [11], 1], ["AN", 1, 0, 5], ["AN", 1, 1, 6]]]], "r": [[7.40426e-06], 0, 1.26049, 1720722650], "v": "v0.6"}
{"i": [["[\"mirror_pad\", 9, 14, 5, 19]", "cuda -keys=cuda,gpu -arch=sm_80 -max_num_threads=1024 -thread_warp_size=32", [-1, 16, 64, 49152, 2147483647, 1024, 8, 32], "", 0, []], [[], [["FU", 1, [0, 1]], ["SP", 1, 0, 176, [8], 1], ["AN", 1, 0, 5], ["AN", 1, 1, 6]]]], "r": [[5.37479e-06], 0, 1.09855, 1720722650], "v": "v0.6"}
{"i": [["[\"mirror_pad\", 9, 14, 5, 19]", "cuda -keys=cuda,gpu -arch=sm_80 -max_num_threads=1024 -thread_warp_size=32", [-1, 16, 64, 49152, 2147483647, 1024, 8, 32], "", 0, []], [[], [["FU", 1, [0, 1]], ["SP", 1, 0, 176, [16], 1], ["AN", 1, 0, 5], ["AN", 1, 1, 6]]]], "r": [[5.63911e-06], 0, 1.38122, 1720722651], "v": "v0.6"}
{"i": [["[\"mirror_pad\", 9, 14, 5, 19]", "cuda -keys=cuda,gpu -arch=sm_80 -max_num_threads=1024 -thread_warp_size=32", [-1, 16, 64, 49152, 2147483647, 1024, 8, 32], "", 0, []], [[], [["FU", 1, [0, 1]], ["SP", 1, 0, 176, [32], 1], ["AN", 1, 0, 5], ["AN", 1, 1, 6]]]], "r": [[9.88165e-06], 0, 1.5632, 1720722651], "v": "v0.6"}
