code_generation/generate/deprecated/deprecated_pure_without_shape/log/cuda/multi_out_op_cuda.log
{"i": [["[\"multi_out_op\", 17, 10, 1, 8]", "cuda -keys=cuda,gpu -arch=sm_80 -max_num_threads=1024 -thread_warp_size=32", [-1, 16, 64, 49152, 2147483647, 1024, 8, 32], "", 0, []], [[], [["CI", 2], ["FU", 4, [0, 1, 2, 3]], ["SP", 4, 0, 1360, [34], 1], ["AN", 4, 0, 5], ["AN", 4, 1, 6], ["FU", 3, [0, 1, 2, 3]], ["SP", 3, 0, 1360, [10], 1], ["AN", 3, 0, 5], ["AN", 3, 1, 6]]]], "r": [[1.13345e-05], 0, 1.76199, 1720749223], "v": "v0.6"}
{"i": [["[\"multi_out_op\", 17, 10, 1, 8]", "cuda -keys=cuda,gpu -arch=sm_80 -max_num_threads=1024 -thread_warp_size=32", [-1, 16, 64, 49152, 2147483647, 1024, 8, 32], "", 0, []], [[], [["CI", 2], ["FU", 4, [0, 1, 2, 3]], ["SP", 4, 0, 1360, [64], 1], ["AN", 4, 0, 5], ["AN", 4, 1, 6], ["FU", 3, [0, 1, 2, 3]], ["SP", 3, 0, 1360, [4], 1], ["AN", 3, 0, 5], ["AN", 3, 1, 6]]]], "r": [[1.12994e-05], 0, 1.33951, 1720749223], "v": "v0.6"}
{"i": [["[\"multi_out_op\", 17, 10, 1, 8]", "cuda -keys=cuda,gpu -arch=sm_80 -max_num_threads=1024 -thread_warp_size=32", [-1, 16, 64, 49152, 2147483647, 1024, 8, 32], "", 0, []], [[], [["CI", 2], ["FU", 4, [0, 1, 2, 3]], ["SP", 4, 0, 1360, [2], 1], ["AN", 4, 0, 5], ["AN", 4, 1, 6], ["FU", 3, [0, 1, 2, 3]], ["SP", 3, 0, 1360, [34], 1], ["AN", 3, 0, 5], ["AN", 3, 1, 6]]]], "r": [[1.18608e-05], 0, 1.22414, 1720749223], "v": "v0.6"}
{"i": [["[\"multi_out_op\", 17, 10, 1, 8]", "cuda -keys=cuda,gpu -arch=sm_80 -max_num_threads=1024 -thread_warp_size=32", [-1, 16, 64, 49152, 2147483647, 1024, 8, 32], "", 0, []], [[], [["CI", 2], ["FU", 4, [0, 1, 2, 3]], ["SP", 4, 0, 1360, [64], 1], ["AN", 4, 0, 5], ["AN", 4, 1, 6], ["FU", 3, [0, 1, 2, 3]], ["SP", 3, 0, 1360, [1], 1], ["AN", 3, 0, 5], ["AN", 3, 1, 6]]]], "r": [[1.31659e-05], 0, 1.5104, 1720749224], "v": "v0.6"}
{"i": [["[\"multi_out_op\", 17, 10, 1, 8]", "cuda -keys=cuda,gpu -arch=sm_80 -max_num_threads=1024 -thread_warp_size=32", [-1, 16, 64, 49152, 2147483647, 1024, 8, 32], "", 0, []], [[], [["CI", 2], ["FU", 4, [0, 1, 2, 3]], ["SP", 4, 0, 1360, [34], 1], ["AN", 4, 0, 5], ["AN", 4, 1, 6], ["FU", 3, [0, 1, 2, 3]], ["SP", 3, 0, 1360, [64], 1], ["AN", 3, 0, 5], ["AN", 3, 1, 6]]]], "r": [[1.09346e-05], 0, 1.27672, 1720749224], "v": "v0.6"}
{"i": [["[\"multi_out_op\", 17, 10, 1, 8]", "cuda -keys=cuda,gpu -arch=sm_80 -max_num_threads=1024 -thread_warp_size=32", [-1, 16, 64, 49152, 2147483647, 1024, 8, 32], "", 0, []], [[], [["CI", 2], ["FU", 4, [0, 1, 2, 3]], ["SP", 4, 0, 1360, [34], 1], ["AN", 4, 0, 5], ["AN", 4, 1, 6], ["FU", 3, [0, 1, 2, 3]], ["SP", 3, 0, 1360, [8], 1], ["AN", 3, 0, 5], ["AN", 3, 1, 6]]]], "r": [[1.13361e-05], 0, 1.50344, 1720749225], "v": "v0.6"}
{"i": [["[\"multi_out_op\", 17, 10, 1, 8]", "cuda -keys=cuda,gpu -arch=sm_80 -max_num_threads=1024 -thread_warp_size=32", [-1, 16, 64, 49152, 2147483647, 1024, 8, 32], "", 0, []], [[], [["CI", 2], ["FU", 4, [0, 1, 2, 3]], ["SP", 4, 0, 1360, [20], 1], ["AN", 4, 0, 5], ["AN", 4, 1, 6], ["FU", 3, [0, 1, 2, 3]], ["SP", 3, 0, 1360, [4], 1], ["AN", 3, 0, 5], ["AN", 3, 1, 6]]]], "r": [[1.13172e-05], 0, 1.36184, 1720749225], "v": "v0.6"}
{"i": [["[\"multi_out_op\", 17, 10, 1, 8]", "cuda -keys=cuda,gpu -arch=sm_80 -max_num_threads=1024 -thread_warp_size=32", [-1, 16, 64, 49152, 2147483647, 1024, 8, 32], "", 0, []], [[], [["CI", 2], ["FU", 4, [0, 1, 2, 3]], ["SP", 4, 0, 1360, [40], 1], ["AN", 4, 0, 5], ["AN", 4, 1, 6], ["FU", 3, [0, 1, 2, 3]], ["SP", 3, 0, 1360, [8], 1], ["AN", 3, 0, 5], ["AN", 3, 1, 6]]]], "r": [[1.13519e-05], 0, 1.35729, 1720749225], "v": "v0.6"}
{"i": [["[\"multi_out_op\", 17, 10, 1, 8]", "cuda -keys=cuda,gpu -arch=sm_80 -max_num_threads=1024 -thread_warp_size=32", [-1, 16, 64, 49152, 2147483647, 1024, 8, 32], "", 0, []], [[], [["CI", 2], ["FU", 4, [0, 1, 2, 3]], ["SP", 4, 0, 1360, [64], 1], ["AN", 4, 0, 5], ["AN", 4, 1, 6], ["FU", 3, [0, 1, 2, 3]], ["SP", 3, 0, 1360, [16], 1], ["AN", 3, 0, 5], ["AN", 3, 1, 6]]]], "r": [[1.26729e-05], 0, 1.40095, 1720749226], "v": "v0.6"}
{"i": [["[\"multi_out_op\", 17, 10, 1, 8]", "cuda -keys=cuda,gpu -arch=sm_80 -max_num_threads=1024 -thread_warp_size=32", [-1, 16, 64, 49152, 2147483647, 1024, 8, 32], "", 0, []], [[], [["CI", 2], ["FU", 4, [0, 1, 2, 3]], ["SP", 4, 0, 1360, [20], 1], ["AN", 4, 0, 5], ["AN", 4, 1, 6], ["FU", 3, [0, 1, 2, 3]], ["SP", 3, 0, 1360, [32], 1], ["AN", 3, 0, 5], ["AN", 3, 1, 6]]]], "r": [[1.20983e-05], 0, 1.31635, 1720749226], "v": "v0.6"}
