code_generation/generate/deprecated/deprecated_pure_without_shape/log/cuda/negative_cuda.log
{"i": [["[\"negative\", 7, 8, 19, 18]", "cuda -keys=cuda,gpu -arch=sm_80 -max_num_threads=1024 -thread_warp_size=32", [-1, 16, 64, 49152, 2147483647, 1024, 8, 32], "", 0, []], [[], [["FU", 1, [0, 1, 2, 3]], ["SP", 1, 0, 19152, [8], 1], ["AN", 1, 0, 5], ["AN", 1, 1, 6]]]], "r": [[9.61172e-06], 0, 2.31118, 1720729577], "v": "v0.6"}
{"i": [["[\"negative\", 7, 8, 19, 18]", "cuda -keys=cuda,gpu -arch=sm_80 -max_num_threads=1024 -thread_warp_size=32", [-1, 16, 64, 49152, 2147483647, 1024, 8, 32], "", 0, []], [[], [["FU", 1, [0, 1, 2, 3]], ["SP", 1, 0, 19152, [56], 1], ["AN", 1, 0, 5], ["AN", 1, 1, 6]]]], "r": [[6.18074e-06], 0, 1.33213, 1720729577], "v": "v0.6"}
{"i": [["[\"negative\", 7, 8, 19, 18]", "cuda -keys=cuda,gpu -arch=sm_80 -max_num_threads=1024 -thread_warp_size=32", [-1, 16, 64, 49152, 2147483647, 1024, 8, 32], "", 0, []], [[], [["FU", 1, [0, 1, 2, 3]], ["SP", 1, 0, 19152, [6], 1], ["AN", 1, 0, 5], ["AN", 1, 1, 6]]]], "r": [[1.06604e-05], 0, 1.47974, 1720729577], "v": "v0.6"}
{"i": [["[\"negative\", 7, 8, 19, 18]", "cuda -keys=cuda,gpu -arch=sm_80 -max_num_threads=1024 -thread_warp_size=32", [-1, 16, 64, 49152, 2147483647, 1024, 8, 32], "", 0, []], [[], [["FU", 1, [0, 1, 2, 3]], ["SP", 1, 0, 19152, [7], 1], ["AN", 1, 0, 5], ["AN", 1, 1, 6]]]], "r": [[9.98884e-06], 0, 1.29755, 1720729577], "v": "v0.6"}
{"i": [["[\"negative\", 7, 8, 19, 18]", "cuda -keys=cuda,gpu -arch=sm_80 -max_num_threads=1024 -thread_warp_size=32", [-1, 16, 64, 49152, 2147483647, 1024, 8, 32], "", 0, []], [[], [["FU", 1, [0, 1, 2, 3]], ["SP", 1, 0, 19152, [57], 1], ["AN", 1, 0, 5], ["AN", 1, 1, 6]]]], "r": [[7.20321e-06], 0, 1.75017, 1720729578], "v": "v0.6"}
{"i": [["[\"negative\", 7, 8, 19, 18]", "cuda -keys=cuda,gpu -arch=sm_80 -max_num_threads=1024 -thread_warp_size=32", [-1, 16, 64, 49152, 2147483647, 1024, 8, 32], "", 0, []], [[], [["FU", 1, [0, 1, 2, 3]], ["SP", 1, 0, 19152, [14], 1], ["AN", 1, 0, 5], ["AN", 1, 1, 6]]]], "r": [[8.44953e-06], 0, 1.30258, 1720729578], "v": "v0.6"}
{"i": [["[\"negative\", 7, 8, 19, 18]", "cuda -keys=cuda,gpu -arch=sm_80 -max_num_threads=1024 -thread_warp_size=32", [-1, 16, 64, 49152, 2147483647, 1024, 8, 32], "", 0, []], [[], [["FU", 1, [0, 1, 2, 3]], ["SP", 1, 0, 19152, [64], 1], ["AN", 1, 0, 5], ["AN", 1, 1, 6]]]], "r": [[7.27923e-06], 0, 1.61333, 1720729579], "v": "v0.6"}
{"i": [["[\"negative\", 7, 8, 19, 18]", "cuda -keys=cuda,gpu -arch=sm_80 -max_num_threads=1024 -thread_warp_size=32", [-1, 16, 64, 49152, 2147483647, 1024, 8, 32], "", 0, []], [[], [["FU", 1, [0, 1, 2, 3]], ["SP", 1, 0, 19152, [1], 1], ["AN", 1, 0, 5], ["AN", 1, 1, 6]]]], "r": [[3.72499e-05], 0, 1.48468, 1720729579], "v": "v0.6"}
{"i": [["[\"negative\", 7, 8, 19, 18]", "cuda -keys=cuda,gpu -arch=sm_80 -max_num_threads=1024 -thread_warp_size=32", [-1, 16, 64, 49152, 2147483647, 1024, 8, 32], "", 0, []], [[], [["FU", 1, [0, 1, 2, 3]], ["SP", 1, 0, 19152, [42], 1], ["AN", 1, 0, 5], ["AN", 1, 1, 6]]]], "r": [[6.19756e-06], 0, 1.322, 1720729579], "v": "v0.6"}
{"i": [["[\"negative\", 7, 8, 19, 18]", "cuda -keys=cuda,gpu -arch=sm_80 -max_num_threads=1024 -thread_warp_size=32", [-1, 16, 64, 49152, 2147483647, 1024, 8, 32], "", 0, []], [[], [["FU", 1, [0, 1, 2, 3]], ["SP", 1, 0, 19152, [32], 1], ["AN", 1, 0, 5], ["AN", 1, 1, 6]]]], "r": [[6.61328e-06], 0, 1.787, 1720729580], "v": "v0.6"}
