code_generation/generate/deprecated/deprecated_pure_without_shape/log/cuda/pad_cuda.log
{"i": [["[\"pad\", 1, 2, 12, 6]", "cuda -keys=cuda,gpu -arch=sm_80 -max_num_threads=1024 -thread_warp_size=32", [-1, 16, 64, 49152, 2147483647, 1024, 8, 32], "", 0, []], [[], [["FU", 1, [0, 1]], ["SP", 1, 0, 135, [27], 1], ["AN", 1, 0, 5], ["AN", 1, 1, 6]]]], "r": [[5.84399e-06], 0, 1.75194, 1720725444], "v": "v0.6"}
{"i": [["[\"pad\", 1, 2, 12, 6]", "cuda -keys=cuda,gpu -arch=sm_80 -max_num_threads=1024 -thread_warp_size=32", [-1, 16, 64, 49152, 2147483647, 1024, 8, 32], "", 0, []], [[], [["FU", 1, [0, 1]], ["SP", 1, 0, 135, [3], 1], ["AN", 1, 0, 5], ["AN", 1, 1, 6]]]], "r": [[7.32659e-06], 0, 1.08065, 1720725445], "v": "v0.6"}
{"i": [["[\"pad\", 1, 2, 12, 6]", "cuda -keys=cuda,gpu -arch=sm_80 -max_num_threads=1024 -thread_warp_size=32", [-1, 16, 64, 49152, 2147483647, 1024, 8, 32], "", 0, []], [[], [["FU", 1, [0, 1]], ["SP", 1, 0, 135, [22], 1], ["AN", 1, 0, 5], ["AN", 1, 1, 6]]]], "r": [[8.15415e-06], 0, 1.43988, 1720725445], "v": "v0.6"}
{"i": [["[\"pad\", 1, 2, 12, 6]", "cuda -keys=cuda,gpu -arch=sm_80 -max_num_threads=1024 -thread_warp_size=32", [-1, 16, 64, 49152, 2147483647, 1024, 8, 32], "", 0, []], [[], [["FU", 1, [0, 1]], ["SP", 1, 0, 135, [2], 1], ["AN", 1, 0, 5], ["AN", 1, 1, 6]]]], "r": [[8.6544e-06], 0, 1.31681, 1720725446], "v": "v0.6"}
{"i": [["[\"pad\", 1, 2, 12, 6]", "cuda -keys=cuda,gpu -arch=sm_80 -max_num_threads=1024 -thread_warp_size=32", [-1, 16, 64, 49152, 2147483647, 1024, 8, 32], "", 0, []], [[], [["FU", 1, [0, 1]], ["SP", 1, 0, 135, [8], 1], ["AN", 1, 0, 5], ["AN", 1, 1, 6]]]], "r": [[7.46781e-06], 0, 1.28291, 1720725446], "v": "v0.6"}
{"i": [["[\"pad\", 1, 2, 12, 6]", "cuda -keys=cuda,gpu -arch=sm_80 -max_num_threads=1024 -thread_warp_size=32", [-1, 16, 64, 49152, 2147483647, 1024, 8, 32], "", 0, []], [[], [["FU", 1, [0, 1]], ["SP", 1, 0, 135, [44], 1], ["AN", 1, 0, 5], ["AN", 1, 1, 6]]]], "r": [[6.37975e-06], 0, 1.42261, 1720725447], "v": "v0.6"}
{"i": [["[\"pad\", 1, 2, 12, 6]", "cuda -keys=cuda,gpu -arch=sm_80 -max_num_threads=1024 -thread_warp_size=32", [-1, 16, 64, 49152, 2147483647, 1024, 8, 32], "", 0, []], [[], [["FU", 1, [0, 1]], ["SP", 1, 0, 135, [4], 1], ["AN", 1, 0, 5], ["AN", 1, 1, 6]]]], "r": [[5.8468e-06], 0, 1.24556, 1720725447], "v": "v0.6"}
{"i": [["[\"pad\", 1, 2, 12, 6]", "cuda -keys=cuda,gpu -arch=sm_80 -max_num_threads=1024 -thread_warp_size=32", [-1, 16, 64, 49152, 2147483647, 1024, 8, 32], "", 0, []], [[], [["FU", 1, [0, 1]], ["SP", 1, 0, 135, [33], 1], ["AN", 1, 0, 5], ["AN", 1, 1, 6]]]], "r": [[5.85473e-06], 0, 1.35232, 1720725447], "v": "v0.6"}
{"i": [["[\"pad\", 1, 2, 12, 6]", "cuda -keys=cuda,gpu -arch=sm_80 -max_num_threads=1024 -thread_warp_size=32", [-1, 16, 64, 49152, 2147483647, 1024, 8, 32], "", 0, []], [[], [["FU", 1, [0, 1]], ["SP", 1, 0, 135, [16], 1], ["AN", 1, 0, 5], ["AN", 1, 1, 6]]]], "r": [[5.89007e-06], 0, 1.10844, 1720725448], "v": "v0.6"}
{"i": [["[\"pad\", 1, 2, 12, 6]", "cuda -keys=cuda,gpu -arch=sm_80 -max_num_threads=1024 -thread_warp_size=32", [-1, 16, 64, 49152, 2147483647, 1024, 8, 32], "", 0, []], [[], [["FU", 1, [0, 1]], ["SP", 1, 0, 135, [1], 1], ["AN", 1, 0, 5], ["AN", 1, 1, 6]]]], "r": [[5.67224e-06], 0, 1.30649, 1720725448], "v": "v0.6"}
