code_generation/generate/deprecated/deprecated_pure_without_shape/log/cuda/pool3d_cuda.log
{"i": [["[\"pool3d\", 5, 3, 13, 10]", "cuda -keys=cuda,gpu -arch=sm_80 -max_num_threads=1024 -thread_warp_size=32", [-1, 16, 64, 49152, 2147483647, 1024, 8, 32], "", 0, []], [[], [["CI", 1], ["FU", 2, [0, 1, 2, 3, 4]], ["SP", 2, 0, 4200, [35], 1], ["AN", 2, 0, 5], ["AN", 2, 1, 6], ["PR", 2, 0, "auto_unroll_max_step$0"]]]], "r": [[6.61487e-06], 0, 1.70925, 1720734257], "v": "v0.6"}
{"i": [["[\"pool3d\", 5, 3, 13, 10]", "cuda -keys=cuda,gpu -arch=sm_80 -max_num_threads=1024 -thread_warp_size=32", [-1, 16, 64, 49152, 2147483647, 1024, 8, 32], "", 0, []], [[], [["CI", 1], ["FU", 2, [0, 1, 2, 3, 4]], ["SP", 2, 0, 4200, [8], 1], ["AN", 2, 0, 5], ["AN", 2, 1, 6], ["PR", 2, 0, "auto_unroll_max_step$0"]]]], "r": [[8.18468e-06], 0, 1.35098, 1720734258], "v": "v0.6"}
{"i": [["[\"pool3d\", 5, 3, 13, 10]", "cuda -keys=cuda,gpu -arch=sm_80 -max_num_threads=1024 -thread_warp_size=32", [-1, 16, 64, 49152, 2147483647, 1024, 8, 32], "", 0, []], [[], [["CI", 1], ["FU", 2, [0, 1, 2, 3, 4]], ["SP", 2, 0, 4200, [42], 1], ["AN", 2, 0, 5], ["AN", 2, 1, 6], ["PR", 2, 0, "auto_unroll_max_step$0"]]]], "r": [[7.30971e-06], 0, 1.23006, 1720734258], "v": "v0.6"}
{"i": [["[\"pool3d\", 5, 3, 13, 10]", "cuda -keys=cuda,gpu -arch=sm_80 -max_num_threads=1024 -thread_warp_size=32", [-1, 16, 64, 49152, 2147483647, 1024, 8, 32], "", 0, []], [[], [["CI", 1], ["FU", 2, [0, 1, 2, 3, 4]], ["SP", 2, 0, 4200, [7], 1], ["AN", 2, 0, 5], ["AN", 2, 1, 6], ["PR", 2, 0, "auto_unroll_max_step$0"]]]], "r": [[7.01323e-06], 0, 1.30471, 1720734258], "v": "v0.6"}
{"i": [["[\"pool3d\", 5, 3, 13, 10]", "cuda -keys=cuda,gpu -arch=sm_80 -max_num_threads=1024 -thread_warp_size=32", [-1, 16, 64, 49152, 2147483647, 1024, 8, 32], "", 0, []], [[], [["CI", 1], ["FU", 2, [0, 1, 2, 3, 4]], ["SP", 2, 0, 4200, [50], 1], ["AN", 2, 0, 5], ["AN", 2, 1, 6], ["PR", 2, 0, "auto_unroll_max_step$0"]]]], "r": [[7.59095e-06], 0, 1.43993, 1720734259], "v": "v0.6"}
{"i": [["[\"pool3d\", 5, 3, 13, 10]", "cuda -keys=cuda,gpu -arch=sm_80 -max_num_threads=1024 -thread_warp_size=32", [-1, 16, 64, 49152, 2147483647, 1024, 8, 32], "", 0, []], [[], [["CI", 1], ["FU", 2, [0, 1, 2, 3, 4]], ["SP", 2, 0, 4200, [6], 1], ["AN", 2, 0, 5], ["AN", 2, 1, 6], ["PR", 2, 0, "auto_unroll_max_step$0"]]]], "r": [[7.81612e-06], 0, 1.32714, 1720734259], "v": "v0.6"}
{"i": [["[\"pool3d\", 5, 3, 13, 10]", "cuda -keys=cuda,gpu -arch=sm_80 -max_num_threads=1024 -thread_warp_size=32", [-1, 16, 64, 49152, 2147483647, 1024, 8, 32], "", 0, []], [[], [["CI", 1], ["FU", 2, [0, 1, 2, 3, 4]], ["SP", 2, 0, 4200, [15], 1], ["AN", 2, 0, 5], ["AN", 2, 1, 6], ["PR", 2, 0, "auto_unroll_max_step$0"]]]], "r": [[7.7054e-06], 0, 1.43707, 1720734260], "v": "v0.6"}
{"i": [["[\"pool3d\", 5, 3, 13, 10]", "cuda -keys=cuda,gpu -arch=sm_80 -max_num_threads=1024 -thread_warp_size=32", [-1, 16, 64, 49152, 2147483647, 1024, 8, 32], "", 0, []], [[], [["CI", 1], ["FU", 2, [0, 1, 2, 3, 4]], ["SP", 2, 0, 4200, [40], 1], ["AN", 2, 0, 5], ["AN", 2, 1, 6], ["PR", 2, 0, "auto_unroll_max_step$0"]]]], "r": [[7.28254e-06], 0, 1.38196, 1720734260], "v": "v0.6"}
{"i": [["[\"pool3d\", 5, 3, 13, 10]", "cuda -keys=cuda,gpu -arch=sm_80 -max_num_threads=1024 -thread_warp_size=32", [-1, 16, 64, 49152, 2147483647, 1024, 8, 32], "", 0, []], [[], [["CI", 1], ["FU", 2, [0, 1, 2, 3, 4]], ["SP", 2, 0, 4200, [32], 1], ["AN", 2, 0, 5], ["AN", 2, 1, 6], ["PR", 2, 0, "auto_unroll_max_step$0"]]]], "r": [[9.50997e-06], 0, 1.42043, 1720734260], "v": "v0.6"}
{"i": [["[\"pool3d\", 5, 3, 13, 10]", "cuda -keys=cuda,gpu -arch=sm_80 -max_num_threads=1024 -thread_warp_size=32", [-1, 16, 64, 49152, 2147483647, 1024, 8, 32], "", 0, []], [[], [["CI", 1], ["FU", 2, [0, 1, 2, 3, 4]], ["SP", 2, 0, 4200, [2], 1], ["AN", 2, 0, 5], ["AN", 2, 1, 6], ["PR", 2, 0, "auto_unroll_max_step$0"]]]], "r": [[9.84077e-06], 0, 1.43445, 1720734261], "v": "v0.6"}
