code_generation/generate/deprecated/deprecated_pure_without_shape/log/cuda/prelu_cuda.log
{"i": [["[\"prelu\", 2, 2, 15, 17]", "cuda -keys=cuda,gpu -arch=sm_80 -max_num_threads=1024 -thread_warp_size=32", [-1, 16, 64, 49152, 2147483647, 1024, 8, 32], "", 0, []], [[], [["FU", 2, [0, 1, 2, 3]], ["SP", 2, 0, 1020, [17], 1], ["AN", 2, 0, 5], ["AN", 2, 1, 6]]]], "r": [[5.45243e-06], 0, 1.62756, 1720738917], "v": "v0.6"}
{"i": [["[\"prelu\", 2, 2, 15, 17]", "cuda -keys=cuda,gpu -arch=sm_80 -max_num_threads=1024 -thread_warp_size=32", [-1, 16, 64, 49152, 2147483647, 1024, 8, 32], "", 0, []], [[], [["FU", 2, [0, 1, 2, 3]], ["SP", 2, 0, 1020, [2], 1], ["AN", 2, 0, 5], ["AN", 2, 1, 6]]]], "r": [[8.48455e-06], 0, 1.21076, 1720738917], "v": "v0.6"}
{"i": [["[\"prelu\", 2, 2, 15, 17]", "cuda -keys=cuda,gpu -arch=sm_80 -max_num_threads=1024 -thread_warp_size=32", [-1, 16, 64, 49152, 2147483647, 1024, 8, 32], "", 0, []], [[], [["FU", 2, [0, 1, 2, 3]], ["SP", 2, 0, 1020, [24], 1], ["AN", 2, 0, 5], ["AN", 2, 1, 6]]]], "r": [[5.45188e-06], 0, 1.50948, 1720738918], "v": "v0.6"}
{"i": [["[\"prelu\", 2, 2, 15, 17]", "cuda -keys=cuda,gpu -arch=sm_80 -max_num_threads=1024 -thread_warp_size=32", [-1, 16, 64, 49152, 2147483647, 1024, 8, 32], "", 0, []], [[], [["FU", 2, [0, 1, 2, 3]], ["SP", 2, 0, 1020, [15], 1], ["AN", 2, 0, 5], ["AN", 2, 1, 6]]]], "r": [[5.39347e-06], 0, 1.43386, 1720738918], "v": "v0.6"}
{"i": [["[\"prelu\", 2, 2, 15, 17]", "cuda -keys=cuda,gpu -arch=sm_80 -max_num_threads=1024 -thread_warp_size=32", [-1, 16, 64, 49152, 2147483647, 1024, 8, 32], "", 0, []], [[], [["FU", 2, [0, 1, 2, 3]], ["SP", 2, 0, 1020, [5], 1], ["AN", 2, 0, 5], ["AN", 2, 1, 6]]]], "r": [[5.88543e-06], 0, 1.37437, 1720738918], "v": "v0.6"}
{"i": [["[\"prelu\", 2, 2, 15, 17]", "cuda -keys=cuda,gpu -arch=sm_80 -max_num_threads=1024 -thread_warp_size=32", [-1, 16, 64, 49152, 2147483647, 1024, 8, 32], "", 0, []], [[], [["FU", 2, [0, 1, 2, 3]], ["SP", 2, 0, 1020, [3], 1], ["AN", 2, 0, 5], ["AN", 2, 1, 6]]]], "r": [[5.91928e-06], 0, 1.49464, 1720738919], "v": "v0.6"}
{"i": [["[\"prelu\", 2, 2, 15, 17]", "cuda -keys=cuda,gpu -arch=sm_80 -max_num_threads=1024 -thread_warp_size=32", [-1, 16, 64, 49152, 2147483647, 1024, 8, 32], "", 0, []], [[], [["FU", 2, [0, 1, 2, 3]], ["SP", 2, 0, 1020, [4], 1], ["AN", 2, 0, 5], ["AN", 2, 1, 6]]]], "r": [[9.55036e-06], 0, 1.12058, 1720738919], "v": "v0.6"}
{"i": [["[\"prelu\", 2, 2, 15, 17]", "cuda -keys=cuda,gpu -arch=sm_80 -max_num_threads=1024 -thread_warp_size=32", [-1, 16, 64, 49152, 2147483647, 1024, 8, 32], "", 0, []], [[], [["FU", 2, [0, 1, 2, 3]], ["SP", 2, 0, 1020, [20], 1], ["AN", 2, 0, 5], ["AN", 2, 1, 6]]]], "r": [[8.06781e-06], 0, 1.47879, 1720738920], "v": "v0.6"}
{"i": [["[\"prelu\", 2, 2, 15, 17]", "cuda -keys=cuda,gpu -arch=sm_80 -max_num_threads=1024 -thread_warp_size=32", [-1, 16, 64, 49152, 2147483647, 1024, 8, 32], "", 0, []], [[], [["FU", 2, [0, 1, 2, 3]], ["SP", 2, 0, 1020, [60], 1], ["AN", 2, 0, 5], ["AN", 2, 1, 6]]]], "r": [[5.4583e-06], 0, 1.34717, 1720738920], "v": "v0.6"}
{"i": [["[\"prelu\", 2, 2, 15, 17]", "cuda -keys=cuda,gpu -arch=sm_80 -max_num_threads=1024 -thread_warp_size=32", [-1, 16, 64, 49152, 2147483647, 1024, 8, 32], "", 0, []], [[], [["FU", 2, [0, 1, 2, 3]], ["SP", 2, 0, 1020, [1], 1], ["AN", 2, 0, 5], ["AN", 2, 1, 6]]]], "r": [[6.91543e-06], 0, 1.23276, 1720738920], "v": "v0.6"}
