code_generation/generate/deprecated/deprecated_pure_without_shape/log/cuda/relu_cuda.log
{"i": [["[\"relu\", 4, 15, 13, 16]", "cuda -keys=cuda,gpu -arch=sm_80 -max_num_threads=1024 -thread_warp_size=32", [-1, 16, 64, 49152, 2147483647, 1024, 8, 32], "", 0, []], [[], [["FU", 1, [0, 1, 2, 3]], ["SP", 1, 0, 12480, [10], 1], ["AN", 1, 0, 5], ["AN", 1, 1, 6]]]], "r": [[7.35971e-06], 0, 1.60136, 1720735352], "v": "v0.6"}
{"i": [["[\"relu\", 4, 15, 13, 16]", "cuda -keys=cuda,gpu -arch=sm_80 -max_num_threads=1024 -thread_warp_size=32", [-1, 16, 64, 49152, 2147483647, 1024, 8, 32], "", 0, []], [[], [["FU", 1, [0, 1, 2, 3]], ["SP", 1, 0, 12480, [4], 1], ["AN", 1, 0, 5], ["AN", 1, 1, 6]]]], "r": [[1.10104e-05], 0, 1.39547, 1720735352], "v": "v0.6"}
{"i": [["[\"relu\", 4, 15, 13, 16]", "cuda -keys=cuda,gpu -arch=sm_80 -max_num_threads=1024 -thread_warp_size=32", [-1, 16, 64, 49152, 2147483647, 1024, 8, 32], "", 0, []], [[], [["FU", 1, [0, 1, 2, 3]], ["SP", 1, 0, 12480, [12], 1], ["AN", 1, 0, 5], ["AN", 1, 1, 6]]]], "r": [[7.40268e-06], 0, 1.50722, 1720735352], "v": "v0.6"}
{"i": [["[\"relu\", 4, 15, 13, 16]", "cuda -keys=cuda,gpu -arch=sm_80 -max_num_threads=1024 -thread_warp_size=32", [-1, 16, 64, 49152, 2147483647, 1024, 8, 32], "", 0, []], [[], [["FU", 1, [0, 1, 2, 3]], ["SP", 1, 0, 12480, [5], 1], ["AN", 1, 0, 5], ["AN", 1, 1, 6]]]], "r": [[9.85539e-06], 0, 1.30571, 1720735353], "v": "v0.6"}
{"i": [["[\"relu\", 4, 15, 13, 16]", "cuda -keys=cuda,gpu -arch=sm_80 -max_num_threads=1024 -thread_warp_size=32", [-1, 16, 64, 49152, 2147483647, 1024, 8, 32], "", 0, []], [[], [["FU", 1, [0, 1, 2, 3]], ["SP", 1, 0, 12480, [64], 1], ["AN", 1, 0, 5], ["AN", 1, 1, 6]]]], "r": [[6.22519e-06], 0, 1.38486, 1720735353], "v": "v0.6"}
{"i": [["[\"relu\", 4, 15, 13, 16]", "cuda -keys=cuda,gpu -arch=sm_80 -max_num_threads=1024 -thread_warp_size=32", [-1, 16, 64, 49152, 2147483647, 1024, 8, 32], "", 0, []], [[], [["FU", 1, [0, 1, 2, 3]], ["SP", 1, 0, 12480, [2], 1], ["AN", 1, 0, 5], ["AN", 1, 1, 6]]]], "r": [[1.61003e-05], 0, 0.930118, 1720735353], "v": "v0.6"}
{"i": [["[\"relu\", 4, 15, 13, 16]", "cuda -keys=cuda,gpu -arch=sm_80 -max_num_threads=1024 -thread_warp_size=32", [-1, 16, 64, 49152, 2147483647, 1024, 8, 32], "", 0, []], [[], [["FU", 1, [0, 1, 2, 3]], ["SP", 1, 0, 12480, [16], 1], ["AN", 1, 0, 5], ["AN", 1, 1, 6]]]], "r": [[6.96782e-06], 0, 1.44003, 1720735353], "v": "v0.6"}
{"i": [["[\"relu\", 4, 15, 13, 16]", "cuda -keys=cuda,gpu -arch=sm_80 -max_num_threads=1024 -thread_warp_size=32", [-1, 16, 64, 49152, 2147483647, 1024, 8, 32], "", 0, []], [[], [["FU", 1, [0, 1, 2, 3]], ["SP", 1, 0, 12480, [48], 1], ["AN", 1, 0, 5], ["AN", 1, 1, 6]]]], "r": [[6.37885e-06], 0, 1.50995, 1720735354], "v": "v0.6"}
{"i": [["[\"relu\", 4, 15, 13, 16]", "cuda -keys=cuda,gpu -arch=sm_80 -max_num_threads=1024 -thread_warp_size=32", [-1, 16, 64, 49152, 2147483647, 1024, 8, 32], "", 0, []], [[], [["FU", 1, [0, 1, 2, 3]], ["SP", 1, 0, 12480, [39], 1], ["AN", 1, 0, 5], ["AN", 1, 1, 6]]]], "r": [[1.13989e-05], 0, 1.54469, 1720735354], "v": "v0.6"}
{"i": [["[\"relu\", 4, 15, 13, 16]", "cuda -keys=cuda,gpu -arch=sm_80 -max_num_threads=1024 -thread_warp_size=32", [-1, 16, 64, 49152, 2147483647, 1024, 8, 32], "", 0, []], [[], [["FU", 1, [0, 1, 2, 3]], ["SP", 1, 0, 12480, [6], 1], ["AN", 1, 0, 5], ["AN", 1, 1, 6]]]], "r": [[9.51208e-06], 0, 1.30048, 1720735355], "v": "v0.6"}
