code_generation/generate/deprecated/deprecated_pure_without_shape/log/cuda/rms_norm_cuda.log
{"i": [["[\"rms_norm\", 14, 9, 17, 16]", "cuda -keys=cuda,gpu -arch=sm_80 -max_num_threads=1024 -thread_warp_size=32", [-1, 16, 64, 49152, 2147483647, 1024, 8, 32], "", 0, []], [[], [["CI", 6], ["CI", 4], ["CI", 3], ["CI", 1], ["FU", 7, [0, 1, 2, 3]], ["SP", 7, 0, 34272, [4], 1], ["AN", 7, 0, 5], ["AN", 7, 1, 6], ["FU", 5, [0, 1, 2]], ["SP", 5, 0, 3808, [1], 1], ["AN", 5, 0, 5], ["AN", 5, 1, 6], ["PR", 5, 0, "auto_unroll_max_step$0"]]]], "r": [[3.23567e-05], 0, 1.5486, 1720774756], "v": "v0.6"}
{"i": [["[\"rms_norm\", 14, 9, 17, 16]", "cuda -keys=cuda,gpu -arch=sm_80 -max_num_threads=1024 -thread_warp_size=32", [-1, 16, 64, 49152, 2147483647, 1024, 8, 32], "", 0, []], [[], [["CI", 6], ["CI", 4], ["CI", 3], ["CI", 1], ["FU", 7, [0, 1, 2, 3]], ["SP", 7, 0, 34272, [3], 1], ["AN", 7, 0, 5], ["AN", 7, 1, 6], ["FU", 5, [0, 1, 2]], ["SP", 5, 0, 3808, [16], 1], ["AN", 5, 0, 5], ["AN", 5, 1, 6], ["PR", 5, 0, "auto_unroll_max_step$0"]]]], "r": [[3.04777e-05], 0, 1.01656, 1720774756], "v": "v0.6"}
{"i": [["[\"rms_norm\", 14, 9, 17, 16]", "cuda -keys=cuda,gpu -arch=sm_80 -max_num_threads=1024 -thread_warp_size=32", [-1, 16, 64, 49152, 2147483647, 1024, 8, 32], "", 0, []], [[], [["CI", 6], ["CI", 4], ["CI", 3], ["CI", 1], ["FU", 7, [0, 1, 2, 3]], ["SP", 7, 0, 34272, [17], 1], ["AN", 7, 0, 5], ["AN", 7, 1, 6], ["FU", 5, [0, 1, 2]], ["SP", 5, 0, 3808, [8], 1], ["AN", 5, 0, 5], ["AN", 5, 1, 6], ["PR", 5, 0, "auto_unroll_max_step$0"]]]], "r": [[1.52837e-05], 0, 1.01607, 1720774756], "v": "v0.6"}
{"i": [["[\"rms_norm\", 14, 9, 17, 16]", "cuda -keys=cuda,gpu -arch=sm_80 -max_num_threads=1024 -thread_warp_size=32", [-1, 16, 64, 49152, 2147483647, 1024, 8, 32], "", 0, []], [[], [["CI", 6], ["CI", 4], ["CI", 3], ["CI", 1], ["FU", 7, [0, 1, 2, 3]], ["SP", 7, 0, 34272, [12], 1], ["AN", 7, 0, 5], ["AN", 7, 1, 6], ["FU", 5, [0, 1, 2]], ["SP", 5, 0, 3808, [2], 1], ["AN", 5, 0, 5], ["AN", 5, 1, 6], ["PR", 5, 0, "auto_unroll_max_step$0"]]]], "r": [[2.27966e-05], 0, 1.10563, 1720774757], "v": "v0.6"}
{"i": [["[\"rms_norm\", 14, 9, 17, 16]", "cuda -keys=cuda,gpu -arch=sm_80 -max_num_threads=1024 -thread_warp_size=32", [-1, 16, 64, 49152, 2147483647, 1024, 8, 32], "", 0, []], [[], [["CI", 6], ["CI", 4], ["CI", 3], ["CI", 1], ["FU", 7, [0, 1, 2, 3]], ["SP", 7, 0, 34272, [28], 1], ["AN", 7, 0, 5], ["AN", 7, 1, 6], ["FU", 5, [0, 1, 2]], ["SP", 5, 0, 3808, [2], 1], ["AN", 5, 0, 5], ["AN", 5, 1, 6], ["PR", 5, 0, "auto_unroll_max_step$0"]]]], "r": [[1.71487e-05], 0, 0.842946, 1720774757], "v": "v0.6"}
{"i": [["[\"rms_norm\", 14, 9, 17, 16]", "cuda -keys=cuda,gpu -arch=sm_80 -max_num_threads=1024 -thread_warp_size=32", [-1, 16, 64, 49152, 2147483647, 1024, 8, 32], "", 0, []], [[], [["CI", 6], ["CI", 4], ["CI", 3], ["CI", 1], ["FU", 7, [0, 1, 2, 3]], ["SP", 7, 0, 34272, [7], 1], ["AN", 7, 0, 5], ["AN", 7, 1, 6], ["FU", 5, [0, 1, 2]], ["SP", 5, 0, 3808, [4], 1], ["AN", 5, 0, 5], ["AN", 5, 1, 6], ["PR", 5, 0, "auto_unroll_max_step$0"]]]], "r": [[2.15832e-05], 0, 1.049, 1720774757], "v": "v0.6"}
{"i": [["[\"rms_norm\", 14, 9, 17, 16]", "cuda -keys=cuda,gpu -arch=sm_80 -max_num_threads=1024 -thread_warp_size=32", [-1, 16, 64, 49152, 2147483647, 1024, 8, 32], "", 0, []], [[], [["CI", 6], ["CI", 4], ["CI", 3], ["CI", 1], ["FU", 7, [0, 1, 2, 3]], ["SP", 7, 0, 34272, [56], 1], ["AN", 7, 0, 5], ["AN", 7, 1, 6], ["FU", 5, [0, 1, 2]], ["SP", 5, 0, 3808, [28], 1], ["AN", 5, 0, 5], ["AN", 5, 1, 6], ["PR", 5, 0, "auto_unroll_max_step$0"]]]], "r": [[1.42959e-05], 0, 1.11477, 1720774758], "v": "v0.6"}
{"i": [["[\"rms_norm\", 14, 9, 17, 16]", "cuda -keys=cuda,gpu -arch=sm_80 -max_num_threads=1024 -thread_warp_size=32", [-1, 16, 64, 49152, 2147483647, 1024, 8, 32], "", 0, []], [[], [["CI", 6], ["CI", 4], ["CI", 3], ["CI", 1], ["FU", 7, [0, 1, 2, 3]], ["SP", 7, 0, 34272, [16], 1], ["AN", 7, 0, 5], ["AN", 7, 1, 6], ["FU", 5, [0, 1, 2]], ["SP", 5, 0, 3808, [16], 1], ["AN", 5, 0, 5], ["AN", 5, 1, 6], ["PR", 5, 0, "auto_unroll_max_step$0"]]]], "r": [[1.53244e-05], 0, 1.06488, 1720774758], "v": "v0.6"}
{"i": [["[\"rms_norm\", 14, 9, 17, 16]", "cuda -keys=cuda,gpu -arch=sm_80 -max_num_threads=1024 -thread_warp_size=32", [-1, 16, 64, 49152, 2147483647, 1024, 8, 32], "", 0, []], [[], [["CI", 6], ["CI", 4], ["CI", 3], ["CI", 1], ["FU", 7, [0, 1, 2, 3]], ["SP", 7, 0, 34272, [56], 1], ["AN", 7, 0, 5], ["AN", 7, 1, 6], ["FU", 5, [0, 1, 2]], ["SP", 5, 0, 3808, [16], 1], ["AN", 5, 0, 5], ["AN", 5, 1, 6], ["PR", 5, 0, "auto_unroll_max_step$0"]]]], "r": [[1.30543e-05], 0, 0.936201, 1720774759], "v": "v0.6"}
{"i": [["[\"rms_norm\", 14, 9, 17, 16]", "cuda -keys=cuda,gpu -arch=sm_80 -max_num_threads=1024 -thread_warp_size=32", [-1, 16, 64, 49152, 2147483647, 1024, 8, 32], "", 0, []], [[], [["CI", 6], ["CI", 4], ["CI", 3], ["CI", 1], ["FU", 7, [0, 1, 2, 3]], ["SP", 7, 0, 34272, [56], 1], ["AN", 7, 0, 5], ["AN", 7, 1, 6], ["FU", 5, [0, 1, 2]], ["SP", 5, 0, 3808, [4], 1], ["AN", 5, 0, 5], ["AN", 5, 1, 6], ["PR", 5, 0, "auto_unroll_max_step$0"]]]], "r": [[1.50878e-05], 0, 1.07083, 1720774759], "v": "v0.6"}
