code_generation/generate/deprecated/deprecated_pure_without_shape/log/cuda/round_cuda.log
{"i": [["[\"round\", 10, 1, 8, 19]", "cuda -keys=cuda,gpu -arch=sm_80 -max_num_threads=1024 -thread_warp_size=32", [-1, 16, 64, 49152, 2147483647, 1024, 8, 32], "", 0, []], [[], [["FU", 1, [0, 1, 2, 3]], ["SP", 1, 0, 1520, [40], 1], ["AN", 1, 0, 5], ["AN", 1, 1, 6]]]], "r": [[5.26801e-06], 0, 1.90714, 1720733552], "v": "v0.6"}
{"i": [["[\"round\", 10, 1, 8, 19]", "cuda -keys=cuda,gpu -arch=sm_80 -max_num_threads=1024 -thread_warp_size=32", [-1, 16, 64, 49152, 2147483647, 1024, 8, 32], "", 0, []], [[], [["FU", 1, [0, 1, 2, 3]], ["SP", 1, 0, 1520, [38], 1], ["AN", 1, 0, 5], ["AN", 1, 1, 6]]]], "r": [[5.21731e-06], 0, 1.2555, 1720733552], "v": "v0.6"}
{"i": [["[\"round\", 10, 1, 8, 19]", "cuda -keys=cuda,gpu -arch=sm_80 -max_num_threads=1024 -thread_warp_size=32", [-1, 16, 64, 49152, 2147483647, 1024, 8, 32], "", 0, []], [[], [["FU", 1, [0, 1, 2, 3]], ["SP", 1, 0, 1520, [2], 1], ["AN", 1, 0, 5], ["AN", 1, 1, 6]]]], "r": [[6.62461e-06], 0, 1.5239, 1720733553], "v": "v0.6"}
{"i": [["[\"round\", 10, 1, 8, 19]", "cuda -keys=cuda,gpu -arch=sm_80 -max_num_threads=1024 -thread_warp_size=32", [-1, 16, 64, 49152, 2147483647, 1024, 8, 32], "", 0, []], [[], [["FU", 1, [0, 1, 2, 3]], ["SP", 1, 0, 1520, [32], 1], ["AN", 1, 0, 5], ["AN", 1, 1, 6]]]], "r": [[5.21812e-06], 0, 1.40308, 1720733553], "v": "v0.6"}
{"i": [["[\"round\", 10, 1, 8, 19]", "cuda -keys=cuda,gpu -arch=sm_80 -max_num_threads=1024 -thread_warp_size=32", [-1, 16, 64, 49152, 2147483647, 1024, 8, 32], "", 0, []], [[], [["FU", 1, [0, 1, 2, 3]], ["SP", 1, 0, 1520, [4], 1], ["AN", 1, 0, 5], ["AN", 1, 1, 6]]]], "r": [[6.0355e-06], 0, 0.900643, 1720733553], "v": "v0.6"}
{"i": [["[\"round\", 10, 1, 8, 19]", "cuda -keys=cuda,gpu -arch=sm_80 -max_num_threads=1024 -thread_warp_size=32", [-1, 16, 64, 49152, 2147483647, 1024, 8, 32], "", 0, []], [[], [["FU", 1, [0, 1, 2, 3]], ["SP", 1, 0, 1520, [1], 1], ["AN", 1, 0, 5], ["AN", 1, 1, 6]]]], "r": [[8.00888e-06], 0, 1.29515, 1720733553], "v": "v0.6"}
{"i": [["[\"round\", 10, 1, 8, 19]", "cuda -keys=cuda,gpu -arch=sm_80 -max_num_threads=1024 -thread_warp_size=32", [-1, 16, 64, 49152, 2147483647, 1024, 8, 32], "", 0, []], [[], [["FU", 1, [0, 1, 2, 3]], ["SP", 1, 0, 1520, [19], 1], ["AN", 1, 0, 5], ["AN", 1, 1, 6]]]], "r": [[5.54615e-06], 0, 0.852294, 1720733554], "v": "v0.6"}
{"i": [["[\"round\", 10, 1, 8, 19]", "cuda -keys=cuda,gpu -arch=sm_80 -max_num_threads=1024 -thread_warp_size=32", [-1, 16, 64, 49152, 2147483647, 1024, 8, 32], "", 0, []], [[], [["FU", 1, [0, 1, 2, 3]], ["SP", 1, 0, 1520, [20], 1], ["AN", 1, 0, 5], ["AN", 1, 1, 6]]]], "r": [[8.16319e-06], 0, 1.36875, 1720733554], "v": "v0.6"}
{"i": [["[\"round\", 10, 1, 8, 19]", "cuda -keys=cuda,gpu -arch=sm_80 -max_num_threads=1024 -thread_warp_size=32", [-1, 16, 64, 49152, 2147483647, 1024, 8, 32], "", 0, []], [[], [["FU", 1, [0, 1, 2, 3]], ["SP", 1, 0, 1520, [8], 1], ["AN", 1, 0, 5], ["AN", 1, 1, 6]]]], "r": [[6.2632e-06], 0, 1.56765, 1720733554], "v": "v0.6"}
{"i": [["[\"round\", 10, 1, 8, 19]", "cuda -keys=cuda,gpu -arch=sm_80 -max_num_threads=1024 -thread_warp_size=32", [-1, 16, 64, 49152, 2147483647, 1024, 8, 32], "", 0, []], [[], [["FU", 1, [0, 1, 2, 3]], ["SP", 1, 0, 1520, [5], 1], ["AN", 1, 0, 5], ["AN", 1, 1, 6]]]], "r": [[8.293e-06], 0, 1.56192, 1720733555], "v": "v0.6"}
