code_generation/generate/deprecated/deprecated_pure_without_shape/log/cuda/rsqrt_cuda.log
{"i": [["[\"rsqrt\", 15, 9, 5, 10]", "cuda -keys=cuda,gpu -arch=sm_80 -max_num_threads=1024 -thread_warp_size=32", [-1, 16, 64, 49152, 2147483647, 1024, 8, 32], "", 0, []], [[], [["FU", 1, [0, 1, 2, 3]], ["SP", 1, 0, 6750, [3], 1], ["AN", 1, 0, 5], ["AN", 1, 1, 6]]]], "r": [[9.60416e-06], 0, 1.66674, 1720735385], "v": "v0.6"}
{"i": [["[\"rsqrt\", 15, 9, 5, 10]", "cuda -keys=cuda,gpu -arch=sm_80 -max_num_threads=1024 -thread_warp_size=32", [-1, 16, 64, 49152, 2147483647, 1024, 8, 32], "", 0, []], [[], [["FU", 1, [0, 1, 2, 3]], ["SP", 1, 0, 6750, [10], 1], ["AN", 1, 0, 5], ["AN", 1, 1, 6]]]], "r": [[8.92122e-06], 0, 1.13652, 1720735385], "v": "v0.6"}
{"i": [["[\"rsqrt\", 15, 9, 5, 10]", "cuda -keys=cuda,gpu -arch=sm_80 -max_num_threads=1024 -thread_warp_size=32", [-1, 16, 64, 49152, 2147483647, 1024, 8, 32], "", 0, []], [[], [["FU", 1, [0, 1, 2, 3]], ["SP", 1, 0, 6750, [30], 1], ["AN", 1, 0, 5], ["AN", 1, 1, 6]]]], "r": [[6.82622e-06], 0, 0.989405, 1720735386], "v": "v0.6"}
{"i": [["[\"rsqrt\", 15, 9, 5, 10]", "cuda -keys=cuda,gpu -arch=sm_80 -max_num_threads=1024 -thread_warp_size=32", [-1, 16, 64, 49152, 2147483647, 1024, 8, 32], "", 0, []], [[], [["FU", 1, [0, 1, 2, 3]], ["SP", 1, 0, 6750, [32], 1], ["AN", 1, 0, 5], ["AN", 1, 1, 6]]]], "r": [[6.35279e-06], 0, 0.829691, 1720735386], "v": "v0.6"}
{"i": [["[\"rsqrt\", 15, 9, 5, 10]", "cuda -keys=cuda,gpu -arch=sm_80 -max_num_threads=1024 -thread_warp_size=32", [-1, 16, 64, 49152, 2147483647, 1024, 8, 32], "", 0, []], [[], [["FU", 1, [0, 1, 2, 3]], ["SP", 1, 0, 6750, [2], 1], ["AN", 1, 0, 5], ["AN", 1, 1, 6]]]], "r": [[1.17471e-05], 0, 1.10049, 1720735386], "v": "v0.6"}
{"i": [["[\"rsqrt\", 15, 9, 5, 10]", "cuda -keys=cuda,gpu -arch=sm_80 -max_num_threads=1024 -thread_warp_size=32", [-1, 16, 64, 49152, 2147483647, 1024, 8, 32], "", 0, []], [[], [["FU", 1, [0, 1, 2, 3]], ["SP", 1, 0, 6750, [1], 1], ["AN", 1, 0, 5], ["AN", 1, 1, 6]]]], "r": [[1.70333e-05], 0, 1.0767, 1720735387], "v": "v0.6"}
{"i": [["[\"rsqrt\", 15, 9, 5, 10]", "cuda -keys=cuda,gpu -arch=sm_80 -max_num_threads=1024 -thread_warp_size=32", [-1, 16, 64, 49152, 2147483647, 1024, 8, 32], "", 0, []], [[], [["FU", 1, [0, 1, 2, 3]], ["SP", 1, 0, 6750, [9], 1], ["AN", 1, 0, 5], ["AN", 1, 1, 6]]]], "r": [[7.55231e-06], 0, 1.19806, 1720735387], "v": "v0.6"}
{"i": [["[\"rsqrt\", 15, 9, 5, 10]", "cuda -keys=cuda,gpu -arch=sm_80 -max_num_threads=1024 -thread_warp_size=32", [-1, 16, 64, 49152, 2147483647, 1024, 8, 32], "", 0, []], [[], [["FU", 1, [0, 1, 2, 3]], ["SP", 1, 0, 6750, [28], 1], ["AN", 1, 0, 5], ["AN", 1, 1, 6]]]], "r": [[6.25531e-06], 0, 1.00476, 1720735387], "v": "v0.6"}
{"i": [["[\"rsqrt\", 15, 9, 5, 10]", "cuda -keys=cuda,gpu -arch=sm_80 -max_num_threads=1024 -thread_warp_size=32", [-1, 16, 64, 49152, 2147483647, 1024, 8, 32], "", 0, []], [[], [["FU", 1, [0, 1, 2, 3]], ["SP", 1, 0, 6750, [5], 1], ["AN", 1, 0, 5], ["AN", 1, 1, 6]]]], "r": [[8.66099e-06], 0, 1.25986, 1720735388], "v": "v0.6"}
{"i": [["[\"rsqrt\", 15, 9, 5, 10]", "cuda -keys=cuda,gpu -arch=sm_80 -max_num_threads=1024 -thread_warp_size=32", [-1, 16, 64, 49152, 2147483647, 1024, 8, 32], "", 0, []], [[], [["FU", 1, [0, 1, 2, 3]], ["SP", 1, 0, 6750, [24], 1], ["AN", 1, 0, 5], ["AN", 1, 1, 6]]]], "r": [[6.44828e-06], 0, 1.19475, 1720735388], "v": "v0.6"}
