code_generation/generate/deprecated/deprecated_pure_without_shape/log/cuda/scale_shift_nchwc_cuda.log
{"i": [["[\"scale_shift_nchwc\", 7, 13, 9, 8]", "cuda -keys=cuda,gpu -arch=sm_80 -max_num_threads=1024 -thread_warp_size=32", [-1, 16, 64, 49152, 2147483647, 1024, 8, 32], "", 0, []], [[], [["CHW", 3, "local"], ["CI", 3], ["FU", 4, [0, 1, 2, 3, 4]], ["SP", 4, 0, 13104, [26], 1], ["AN", 4, 0, 5], ["AN", 4, 1, 6]]]], "r": [[6.30661e-06], 0, 1.66387, 1720740945], "v": "v0.6"}
{"i": [["[\"scale_shift_nchwc\", 7, 13, 9, 8]", "cuda -keys=cuda,gpu -arch=sm_80 -max_num_threads=1024 -thread_warp_size=32", [-1, 16, 64, 49152, 2147483647, 1024, 8, 32], "", 0, []], [[], [["CHW", 3, "local"], ["CI", 3], ["FU", 4, [0, 1, 2, 3, 4]], ["SP", 4, 0, 13104, [24], 1], ["AN", 4, 0, 5], ["AN", 4, 1, 6]]]], "r": [[6.81607e-06], 0, 1.19239, 1720740945], "v": "v0.6"}
{"i": [["[\"scale_shift_nchwc\", 7, 13, 9, 8]", "cuda -keys=cuda,gpu -arch=sm_80 -max_num_threads=1024 -thread_warp_size=32", [-1, 16, 64, 49152, 2147483647, 1024, 8, 32], "", 0, []], [[], [["CHW", 3, "local"], ["CI", 3], ["FU", 4, [0, 1, 2, 3, 4]], ["SP", 4, 0, 13104, [13], 1], ["AN", 4, 0, 5], ["AN", 4, 1, 6]]]], "r": [[7.2183e-06], 0, 1.25872, 1720740946], "v": "v0.6"}
{"i": [["[\"scale_shift_nchwc\", 7, 13, 9, 8]", "cuda -keys=cuda,gpu -arch=sm_80 -max_num_threads=1024 -thread_warp_size=32", [-1, 16, 64, 49152, 2147483647, 1024, 8, 32], "", 0, []], [[], [["CHW", 3, "local"], ["CI", 3], ["FU", 4, [0, 1, 2, 3, 4]], ["SP", 4, 0, 13104, [14], 1], ["AN", 4, 0, 5], ["AN", 4, 1, 6]]]], "r": [[7.21179e-06], 0, 1.46983, 1720740946], "v": "v0.6"}
{"i": [["[\"scale_shift_nchwc\", 7, 13, 9, 8]", "cuda -keys=cuda,gpu -arch=sm_80 -max_num_threads=1024 -thread_warp_size=32", [-1, 16, 64, 49152, 2147483647, 1024, 8, 32], "", 0, []], [[], [["CHW", 3, "local"], ["CI", 3], ["FU", 4, [0, 1, 2, 3, 4]], ["SP", 4, 0, 13104, [36], 1], ["AN", 4, 0, 5], ["AN", 4, 1, 6]]]], "r": [[6.30611e-06], 0, 1.34789, 1720740946], "v": "v0.6"}
{"i": [["[\"scale_shift_nchwc\", 7, 13, 9, 8]", "cuda -keys=cuda,gpu -arch=sm_80 -max_num_threads=1024 -thread_warp_size=32", [-1, 16, 64, 49152, 2147483647, 1024, 8, 32], "", 0, []], [[], [["CHW", 3, "local"], ["CI", 3], ["FU", 4, [0, 1, 2, 3, 4]], ["SP", 4, 0, 13104, [52], 1], ["AN", 4, 0, 5], ["AN", 4, 1, 6]]]], "r": [[6.3176e-06], 0, 1.01603, 1720740947], "v": "v0.6"}
{"i": [["[\"scale_shift_nchwc\", 7, 13, 9, 8]", "cuda -keys=cuda,gpu -arch=sm_80 -max_num_threads=1024 -thread_warp_size=32", [-1, 16, 64, 49152, 2147483647, 1024, 8, 32], "", 0, []], [[], [["CHW", 3, "local"], ["CI", 3], ["FU", 4, [0, 1, 2, 3, 4]], ["SP", 4, 0, 13104, [39], 1], ["AN", 4, 0, 5], ["AN", 4, 1, 6]]]], "r": [[7.2942e-06], 0, 1.11638, 1720740947], "v": "v0.6"}
{"i": [["[\"scale_shift_nchwc\", 7, 13, 9, 8]", "cuda -keys=cuda,gpu -arch=sm_80 -max_num_threads=1024 -thread_warp_size=32", [-1, 16, 64, 49152, 2147483647, 1024, 8, 32], "", 0, []], [[], [["CHW", 3, "local"], ["CI", 3], ["FU", 4, [0, 1, 2, 3, 4]], ["SP", 4, 0, 13104, [3], 1], ["AN", 4, 0, 5], ["AN", 4, 1, 6]]]], "r": [[1.297e-05], 0, 1.34289, 1720740947], "v": "v0.6"}
{"i": [["[\"scale_shift_nchwc\", 7, 13, 9, 8]", "cuda -keys=cuda,gpu -arch=sm_80 -max_num_threads=1024 -thread_warp_size=32", [-1, 16, 64, 49152, 2147483647, 1024, 8, 32], "", 0, []], [[], [["CHW", 3, "local"], ["CI", 3], ["FU", 4, [0, 1, 2, 3, 4]], ["SP", 4, 0, 13104, [8], 1], ["AN", 4, 0, 5], ["AN", 4, 1, 6]]]], "r": [[8.21449e-06], 0, 1.22666, 1720740948], "v": "v0.6"}
{"i": [["[\"scale_shift_nchwc\", 7, 13, 9, 8]", "cuda -keys=cuda,gpu -arch=sm_80 -max_num_threads=1024 -thread_warp_size=32", [-1, 16, 64, 49152, 2147483647, 1024, 8, 32], "", 0, []], [[], [["CHW", 3, "local"], ["CI", 3], ["FU", 4, [0, 1, 2, 3, 4]], ["SP", 4, 0, 13104, [4], 1], ["AN", 4, 0, 5], ["AN", 4, 1, 6]]]], "r": [[1.10584e-05], 0, 1.48747, 1720740948], "v": "v0.6"}
