code_generation/generate/deprecated/deprecated_pure_without_shape/log/cuda/scale_shift_nchw_cuda.log
{"i": [["[\"scale_shift_nchw\", 6, 5, 11, 17]", "cuda -keys=cuda,gpu -arch=sm_80 -max_num_threads=1024 -thread_warp_size=32", [-1, 16, 64, 49152, 2147483647, 1024, 8, 32], "", 0, []], [[], [["CHW", 3, "local"], ["CI", 3], ["FU", 4, [0, 1, 2, 3]], ["SP", 4, 0, 5610, [55], 1], ["AN", 4, 0, 5], ["AN", 4, 1, 6]]]], "r": [[5.90306e-06], 0, 1.5054, 1720736577], "v": "v0.6"}
{"i": [["[\"scale_shift_nchw\", 6, 5, 11, 17]", "cuda -keys=cuda,gpu -arch=sm_80 -max_num_threads=1024 -thread_warp_size=32", [-1, 16, 64, 49152, 2147483647, 1024, 8, 32], "", 0, []], [[], [["CHW", 3, "local"], ["CI", 3], ["FU", 4, [0, 1, 2, 3]], ["SP", 4, 0, 5610, [6], 1], ["AN", 4, 0, 5], ["AN", 4, 1, 6]]]], "r": [[6.84011e-06], 0, 1.39167, 1720736577], "v": "v0.6"}
{"i": [["[\"scale_shift_nchw\", 6, 5, 11, 17]", "cuda -keys=cuda,gpu -arch=sm_80 -max_num_threads=1024 -thread_warp_size=32", [-1, 16, 64, 49152, 2147483647, 1024, 8, 32], "", 0, []], [[], [["CHW", 3, "local"], ["CI", 3], ["FU", 4, [0, 1, 2, 3]], ["SP", 4, 0, 5610, [3], 1], ["AN", 4, 0, 5], ["AN", 4, 1, 6]]]], "r": [[8.33823e-06], 0, 1.04126, 1720736578], "v": "v0.6"}
{"i": [["[\"scale_shift_nchw\", 6, 5, 11, 17]", "cuda -keys=cuda,gpu -arch=sm_80 -max_num_threads=1024 -thread_warp_size=32", [-1, 16, 64, 49152, 2147483647, 1024, 8, 32], "", 0, []], [[], [["CHW", 3, "local"], ["CI", 3], ["FU", 4, [0, 1, 2, 3]], ["SP", 4, 0, 5610, [1], 1], ["AN", 4, 0, 5], ["AN", 4, 1, 6]]]], "r": [[1.47493e-05], 0, 1.26944, 1720736578], "v": "v0.6"}
{"i": [["[\"scale_shift_nchw\", 6, 5, 11, 17]", "cuda -keys=cuda,gpu -arch=sm_80 -max_num_threads=1024 -thread_warp_size=32", [-1, 16, 64, 49152, 2147483647, 1024, 8, 32], "", 0, []], [[], [["CHW", 3, "local"], ["CI", 3], ["FU", 4, [0, 1, 2, 3]], ["SP", 4, 0, 5610, [33], 1], ["AN", 4, 0, 5], ["AN", 4, 1, 6]]]], "r": [[5.91288e-06], 0, 0.930011, 1720736578], "v": "v0.6"}
{"i": [["[\"scale_shift_nchw\", 6, 5, 11, 17]", "cuda -keys=cuda,gpu -arch=sm_80 -max_num_threads=1024 -thread_warp_size=32", [-1, 16, 64, 49152, 2147483647, 1024, 8, 32], "", 0, []], [[], [["CHW", 3, "local"], ["CI", 3], ["FU", 4, [0, 1, 2, 3]], ["SP", 4, 0, 5610, [5], 1], ["AN", 4, 0, 5], ["AN", 4, 1, 6]]]], "r": [[7.45582e-06], 0, 1.52035, 1720736579], "v": "v0.6"}
{"i": [["[\"scale_shift_nchw\", 6, 5, 11, 17]", "cuda -keys=cuda,gpu -arch=sm_80 -max_num_threads=1024 -thread_warp_size=32", [-1, 16, 64, 49152, 2147483647, 1024, 8, 32], "", 0, []], [[], [["CHW", 3, "local"], ["CI", 3], ["FU", 4, [0, 1, 2, 3]], ["SP", 4, 0, 5610, [34], 1], ["AN", 4, 0, 5], ["AN", 4, 1, 6]]]], "r": [[6.54353e-06], 0, 1.04379, 1720736579], "v": "v0.6"}
{"i": [["[\"scale_shift_nchw\", 6, 5, 11, 17]", "cuda -keys=cuda,gpu -arch=sm_80 -max_num_threads=1024 -thread_warp_size=32", [-1, 16, 64, 49152, 2147483647, 1024, 8, 32], "", 0, []], [[], [["CHW", 3, "local"], ["CI", 3], ["FU", 4, [0, 1, 2, 3]], ["SP", 4, 0, 5610, [11], 1], ["AN", 4, 0, 5], ["AN", 4, 1, 6]]]], "r": [[6.9756e-06], 0, 1.39423, 1720736579], "v": "v0.6"}
{"i": [["[\"scale_shift_nchw\", 6, 5, 11, 17]", "cuda -keys=cuda,gpu -arch=sm_80 -max_num_threads=1024 -thread_warp_size=32", [-1, 16, 64, 49152, 2147483647, 1024, 8, 32], "", 0, []], [[], [["CHW", 3, "local"], ["CI", 3], ["FU", 4, [0, 1, 2, 3]], ["SP", 4, 0, 5610, [30], 1], ["AN", 4, 0, 5], ["AN", 4, 1, 6]]]], "r": [[5.8705e-06], 0, 1.43843, 1720736580], "v": "v0.6"}
{"i": [["[\"scale_shift_nchw\", 6, 5, 11, 17]", "cuda -keys=cuda,gpu -arch=sm_80 -max_num_threads=1024 -thread_warp_size=32", [-1, 16, 64, 49152, 2147483647, 1024, 8, 32], "", 0, []], [[], [["CHW", 3, "local"], ["CI", 3], ["FU", 4, [0, 1, 2, 3]], ["SP", 4, 0, 5610, [15], 1], ["AN", 4, 0, 5], ["AN", 4, 1, 6]]]], "r": [[6.36086e-06], 0, 1.28426, 1720736580], "v": "v0.6"}
