code_generation/generate/deprecated/deprecated_pure_without_shape/log/cuda/sigmoid_cuda.log
{"i": [["[\"sigmoid\", 1, 20, 7, 1]", "cuda -keys=cuda,gpu -arch=sm_80 -max_num_threads=1024 -thread_warp_size=32", [-1, 16, 64, 49152, 2147483647, 1024, 8, 32], "", 0, []], [[], [["FU", 1, [0, 1, 2, 3]], ["SP", 1, 0, 140, [8], 1], ["AN", 1, 0, 5], ["AN", 1, 1, 6]]]], "r": [[5.47583e-06], 0, 1.73593, 1720738608], "v": "v0.6"}
{"i": [["[\"sigmoid\", 1, 20, 7, 1]", "cuda -keys=cuda,gpu -arch=sm_80 -max_num_threads=1024 -thread_warp_size=32", [-1, 16, 64, 49152, 2147483647, 1024, 8, 32], "", 0, []], [[], [["FU", 1, [0, 1, 2, 3]], ["SP", 1, 0, 140, [7], 1], ["AN", 1, 0, 5], ["AN", 1, 1, 6]]]], "r": [[7.35282e-06], 0, 1.35929, 1720738608], "v": "v0.6"}
{"i": [["[\"sigmoid\", 1, 20, 7, 1]", "cuda -keys=cuda,gpu -arch=sm_80 -max_num_threads=1024 -thread_warp_size=32", [-1, 16, 64, 49152, 2147483647, 1024, 8, 32], "", 0, []], [[], [["FU", 1, [0, 1, 2, 3]], ["SP", 1, 0, 140, [4], 1], ["AN", 1, 0, 5], ["AN", 1, 1, 6]]]], "r": [[6.45636e-06], 0, 1.37117, 1720738608], "v": "v0.6"}
{"i": [["[\"sigmoid\", 1, 20, 7, 1]", "cuda -keys=cuda,gpu -arch=sm_80 -max_num_threads=1024 -thread_warp_size=32", [-1, 16, 64, 49152, 2147483647, 1024, 8, 32], "", 0, []], [[], [["FU", 1, [0, 1, 2, 3]], ["SP", 1, 0, 140, [32], 1], ["AN", 1, 0, 5], ["AN", 1, 1, 6]]]], "r": [[5.70219e-06], 0, 1.32262, 1720738609], "v": "v0.6"}
{"i": [["[\"sigmoid\", 1, 20, 7, 1]", "cuda -keys=cuda,gpu -arch=sm_80 -max_num_threads=1024 -thread_warp_size=32", [-1, 16, 64, 49152, 2147483647, 1024, 8, 32], "", 0, []], [[], [["FU", 1, [0, 1, 2, 3]], ["SP", 1, 0, 140, [20], 1], ["AN", 1, 0, 5], ["AN", 1, 1, 6]]]], "r": [[7.81183e-06], 0, 1.88869, 1720738609], "v": "v0.6"}
{"i": [["[\"sigmoid\", 1, 20, 7, 1]", "cuda -keys=cuda,gpu -arch=sm_80 -max_num_threads=1024 -thread_warp_size=32", [-1, 16, 64, 49152, 2147483647, 1024, 8, 32], "", 0, []], [[], [["FU", 1, [0, 1, 2, 3]], ["SP", 1, 0, 140, [1], 1], ["AN", 1, 0, 5], ["AN", 1, 1, 6]]]], "r": [[8.11949e-06], 0, 1.6084, 1720738610], "v": "v0.6"}
{"i": [["[\"sigmoid\", 1, 20, 7, 1]", "cuda -keys=cuda,gpu -arch=sm_80 -max_num_threads=1024 -thread_warp_size=32", [-1, 16, 64, 49152, 2147483647, 1024, 8, 32], "", 0, []], [[], [["FU", 1, [0, 1, 2, 3]], ["SP", 1, 0, 140, [16], 1], ["AN", 1, 0, 5], ["AN", 1, 1, 6]]]], "r": [[5.47537e-06], 0, 1.45541, 1720738610], "v": "v0.6"}
{"i": [["[\"sigmoid\", 1, 20, 7, 1]", "cuda -keys=cuda,gpu -arch=sm_80 -max_num_threads=1024 -thread_warp_size=32", [-1, 16, 64, 49152, 2147483647, 1024, 8, 32], "", 0, []], [[], [["FU", 1, [0, 1, 2, 3]], ["SP", 1, 0, 140, [14], 1], ["AN", 1, 0, 5], ["AN", 1, 1, 6]]]], "r": [[5.48166e-06], 0, 1.39416, 1720738610], "v": "v0.6"}
{"i": [["[\"sigmoid\", 1, 20, 7, 1]", "cuda -keys=cuda,gpu -arch=sm_80 -max_num_threads=1024 -thread_warp_size=32", [-1, 16, 64, 49152, 2147483647, 1024, 8, 32], "", 0, []], [[], [["FU", 1, [0, 1, 2, 3]], ["SP", 1, 0, 140, [64], 1], ["AN", 1, 0, 5], ["AN", 1, 1, 6]]]], "r": [[5.47575e-06], 0, 1.27588, 1720738610], "v": "v0.6"}
{"i": [["[\"sigmoid\", 1, 20, 7, 1]", "cuda -keys=cuda,gpu -arch=sm_80 -max_num_threads=1024 -thread_warp_size=32", [-1, 16, 64, 49152, 2147483647, 1024, 8, 32], "", 0, []], [[], [["FU", 1, [0, 1, 2, 3]], ["SP", 1, 0, 140, [5], 1], ["AN", 1, 0, 5], ["AN", 1, 1, 6]]]], "r": [[5.7623e-06], 0, 1.41293, 1720738611], "v": "v0.6"}
