code_generation/generate/deprecated/deprecated_pure_without_shape/log/cuda/sign_cuda.log
{"i": [["[\"sign\", 1, 10, 17, 6]", "cuda -keys=cuda,gpu -arch=sm_80 -max_num_threads=1024 -thread_warp_size=32", [-1, 16, 64, 49152, 2147483647, 1024, 8, 32], "", 0, []], [[], [["FU", 1, [0, 1, 2, 3]], ["SP", 1, 0, 1020, [15], 1], ["AN", 1, 0, 5], ["AN", 1, 1, 6]]]], "r": [[5.66952e-06], 0, 1.80457, 1720740007], "v": "v0.6"}
{"i": [["[\"sign\", 1, 10, 17, 6]", "cuda -keys=cuda,gpu -arch=sm_80 -max_num_threads=1024 -thread_warp_size=32", [-1, 16, 64, 49152, 2147483647, 1024, 8, 32], "", 0, []], [[], [["FU", 1, [0, 1, 2, 3]], ["SP", 1, 0, 1020, [3], 1], ["AN", 1, 0, 5], ["AN", 1, 1, 6]]]], "r": [[7.71676e-06], 0, 1.43508, 1720740007], "v": "v0.6"}
{"i": [["[\"sign\", 1, 10, 17, 6]", "cuda -keys=cuda,gpu -arch=sm_80 -max_num_threads=1024 -thread_warp_size=32", [-1, 16, 64, 49152, 2147483647, 1024, 8, 32], "", 0, []], [[], [["FU", 1, [0, 1, 2, 3]], ["SP", 1, 0, 1020, [60], 1], ["AN", 1, 0, 5], ["AN", 1, 1, 6]]]], "r": [[6.92367e-06], 0, 1.41397, 1720740007], "v": "v0.6"}
{"i": [["[\"sign\", 1, 10, 17, 6]", "cuda -keys=cuda,gpu -arch=sm_80 -max_num_threads=1024 -thread_warp_size=32", [-1, 16, 64, 49152, 2147483647, 1024, 8, 32], "", 0, []], [[], [["FU", 1, [0, 1, 2, 3]], ["SP", 1, 0, 1020, [48], 1], ["AN", 1, 0, 5], ["AN", 1, 1, 6]]]], "r": [[5.71543e-06], 0, 1.13735, 1720740008], "v": "v0.6"}
{"i": [["[\"sign\", 1, 10, 17, 6]", "cuda -keys=cuda,gpu -arch=sm_80 -max_num_threads=1024 -thread_warp_size=32", [-1, 16, 64, 49152, 2147483647, 1024, 8, 32], "", 0, []], [[], [["FU", 1, [0, 1, 2, 3]], ["SP", 1, 0, 1020, [8], 1], ["AN", 1, 0, 5], ["AN", 1, 1, 6]]]], "r": [[8.01387e-06], 0, 1.46668, 1720740008], "v": "v0.6"}
{"i": [["[\"sign\", 1, 10, 17, 6]", "cuda -keys=cuda,gpu -arch=sm_80 -max_num_threads=1024 -thread_warp_size=32", [-1, 16, 64, 49152, 2147483647, 1024, 8, 32], "", 0, []], [[], [["FU", 1, [0, 1, 2, 3]], ["SP", 1, 0, 1020, [6], 1], ["AN", 1, 0, 5], ["AN", 1, 1, 6]]]], "r": [[8.79344e-06], 0, 1.58493, 1720740008], "v": "v0.6"}
{"i": [["[\"sign\", 1, 10, 17, 6]", "cuda -keys=cuda,gpu -arch=sm_80 -max_num_threads=1024 -thread_warp_size=32", [-1, 16, 64, 49152, 2147483647, 1024, 8, 32], "", 0, []], [[], [["FU", 1, [0, 1, 2, 3]], ["SP", 1, 0, 1020, [32], 1], ["AN", 1, 0, 5], ["AN", 1, 1, 6]]]], "r": [[7.5404e-06], 0, 1.52276, 1720740009], "v": "v0.6"}
{"i": [["[\"sign\", 1, 10, 17, 6]", "cuda -keys=cuda,gpu -arch=sm_80 -max_num_threads=1024 -thread_warp_size=32", [-1, 16, 64, 49152, 2147483647, 1024, 8, 32], "", 0, []], [[], [["FU", 1, [0, 1, 2, 3]], ["SP", 1, 0, 1020, [4], 1], ["AN", 1, 0, 5], ["AN", 1, 1, 6]]]], "r": [[6.49132e-06], 0, 1.33662, 1720740009], "v": "v0.6"}
{"i": [["[\"sign\", 1, 10, 17, 6]", "cuda -keys=cuda,gpu -arch=sm_80 -max_num_threads=1024 -thread_warp_size=32", [-1, 16, 64, 49152, 2147483647, 1024, 8, 32], "", 0, []], [[], [["FU", 1, [0, 1, 2, 3]], ["SP", 1, 0, 1020, [5], 1], ["AN", 1, 0, 5], ["AN", 1, 1, 6]]]], "r": [[5.84936e-06], 0, 1.19248, 1720740010], "v": "v0.6"}
{"i": [["[\"sign\", 1, 10, 17, 6]", "cuda -keys=cuda,gpu -arch=sm_80 -max_num_threads=1024 -thread_warp_size=32", [-1, 16, 64, 49152, 2147483647, 1024, 8, 32], "", 0, []], [[], [["FU", 1, [0, 1, 2, 3]], ["SP", 1, 0, 1020, [20], 1], ["AN", 1, 0, 5], ["AN", 1, 1, 6]]]], "r": [[5.38782e-06], 0, 1.4822, 1720740010], "v": "v0.6"}
