code_generation/generate/deprecated/deprecated_pure_without_shape/log/cuda/sin_cuda.log
{"i": [["[\"sin\", 4, 4, 20, 8]", "cuda -keys=cuda,gpu -arch=sm_80 -max_num_threads=1024 -thread_warp_size=32", [-1, 16, 64, 49152, 2147483647, 1024, 8, 32], "", 0, []], [[], [["FU", 1, [0, 1, 2, 3]], ["SP", 1, 0, 2560, [40], 1], ["AN", 1, 0, 5], ["AN", 1, 1, 6]]]], "r": [[6.5515e-06], 0, 2.12147, 1720666813], "v": "v0.6"}
{"i": [["[\"sin\", 4, 4, 20, 8]", "cuda -keys=cuda,gpu -arch=sm_80 -max_num_threads=1024 -thread_warp_size=32", [-1, 16, 64, 49152, 2147483647, 1024, 8, 32], "", 0, []], [[], [["FU", 1, [0, 1, 2, 3]], ["SP", 1, 0, 2560, [16], 1], ["AN", 1, 0, 5], ["AN", 1, 1, 6]]]], "r": [[5.55853e-06], 0, 1.26951, 1720666814], "v": "v0.6"}
{"i": [["[\"sin\", 4, 4, 20, 8]", "cuda -keys=cuda,gpu -arch=sm_80 -max_num_threads=1024 -thread_warp_size=32", [-1, 16, 64, 49152, 2147483647, 1024, 8, 32], "", 0, []], [[], [["FU", 1, [0, 1, 2, 3]], ["SP", 1, 0, 2560, [64], 1], ["AN", 1, 0, 5], ["AN", 1, 1, 6]]]], "r": [[8.53371e-06], 0, 1.30463, 1720666814], "v": "v0.6"}
{"i": [["[\"sin\", 4, 4, 20, 8]", "cuda -keys=cuda,gpu -arch=sm_80 -max_num_threads=1024 -thread_warp_size=32", [-1, 16, 64, 49152, 2147483647, 1024, 8, 32], "", 0, []], [[], [["FU", 1, [0, 1, 2, 3]], ["SP", 1, 0, 2560, [1], 1], ["AN", 1, 0, 5], ["AN", 1, 1, 6]]]], "r": [[1.03885e-05], 0, 1.64211, 1720666814], "v": "v0.6"}
{"i": [["[\"sin\", 4, 4, 20, 8]", "cuda -keys=cuda,gpu -arch=sm_80 -max_num_threads=1024 -thread_warp_size=32", [-1, 16, 64, 49152, 2147483647, 1024, 8, 32], "", 0, []], [[], [["FU", 1, [0, 1, 2, 3]], ["SP", 1, 0, 2560, [8], 1], ["AN", 1, 0, 5], ["AN", 1, 1, 6]]]], "r": [[7.61794e-06], 0, 1.26168, 1720666815], "v": "v0.6"}
{"i": [["[\"sin\", 4, 4, 20, 8]", "cuda -keys=cuda,gpu -arch=sm_80 -max_num_threads=1024 -thread_warp_size=32", [-1, 16, 64, 49152, 2147483647, 1024, 8, 32], "", 0, []], [[], [["FU", 1, [0, 1, 2, 3]], ["SP", 1, 0, 2560, [10], 1], ["AN", 1, 0, 5], ["AN", 1, 1, 6]]]], "r": [[7.41927e-06], 0, 1.68569, 1720666815], "v": "v0.6"}
{"i": [["[\"sin\", 4, 4, 20, 8]", "cuda -keys=cuda,gpu -arch=sm_80 -max_num_threads=1024 -thread_warp_size=32", [-1, 16, 64, 49152, 2147483647, 1024, 8, 32], "", 0, []], [[], [["FU", 1, [0, 1, 2, 3]], ["SP", 1, 0, 2560, [20], 1], ["AN", 1, 0, 5], ["AN", 1, 1, 6]]]], "r": [[5.6277e-06], 0, 1.6223, 1720666815], "v": "v0.6"}
{"i": [["[\"sin\", 4, 4, 20, 8]", "cuda -keys=cuda,gpu -arch=sm_80 -max_num_threads=1024 -thread_warp_size=32", [-1, 16, 64, 49152, 2147483647, 1024, 8, 32], "", 0, []], [[], [["FU", 1, [0, 1, 2, 3]], ["SP", 1, 0, 2560, [4], 1], ["AN", 1, 0, 5], ["AN", 1, 1, 6]]]], "r": [[9.73804e-06], 0, 1.52382, 1720666816], "v": "v0.6"}
{"i": [["[\"sin\", 4, 4, 20, 8]", "cuda -keys=cuda,gpu -arch=sm_80 -max_num_threads=1024 -thread_warp_size=32", [-1, 16, 64, 49152, 2147483647, 1024, 8, 32], "", 0, []], [[], [["FU", 1, [0, 1, 2, 3]], ["SP", 1, 0, 2560, [2], 1], ["AN", 1, 0, 5], ["AN", 1, 1, 6]]]], "r": [[7.91686e-06], 0, 1.44445, 1720666816], "v": "v0.6"}
{"i": [["[\"sin\", 4, 4, 20, 8]", "cuda -keys=cuda,gpu -arch=sm_80 -max_num_threads=1024 -thread_warp_size=32", [-1, 16, 64, 49152, 2147483647, 1024, 8, 32], "", 0, []], [[], [["FU", 1, [0, 1, 2, 3]], ["SP", 1, 0, 2560, [5], 1], ["AN", 1, 0, 5], ["AN", 1, 1, 6]]]], "r": [[6.86804e-06], 0, 1.49148, 1720666816], "v": "v0.6"}
