code_generation/generate/deprecated/deprecated_pure_without_shape/log/cuda/sinh_cuda.log
{"i": [["[\"sinh\", 12, 7, 8, 10]", "cuda -keys=cuda,gpu -arch=sm_80 -max_num_threads=1024 -thread_warp_size=32", [-1, 16, 64, 49152, 2147483647, 1024, 8, 32], "", 0, []], [[], [["FU", 1, [0, 1, 2, 3]], ["SP", 1, 0, 6720, [4], 1], ["AN", 1, 0, 5], ["AN", 1, 1, 6]]]], "r": [[8.52769e-06], 0, 1.7173, 1720741282], "v": "v0.6"}
{"i": [["[\"sinh\", 12, 7, 8, 10]", "cuda -keys=cuda,gpu -arch=sm_80 -max_num_threads=1024 -thread_warp_size=32", [-1, 16, 64, 49152, 2147483647, 1024, 8, 32], "", 0, []], [[], [["FU", 1, [0, 1, 2, 3]], ["SP", 1, 0, 6720, [42], 1], ["AN", 1, 0, 5], ["AN", 1, 1, 6]]]], "r": [[7.19744e-06], 0, 1.2751, 1720741282], "v": "v0.6"}
{"i": [["[\"sinh\", 12, 7, 8, 10]", "cuda -keys=cuda,gpu -arch=sm_80 -max_num_threads=1024 -thread_warp_size=32", [-1, 16, 64, 49152, 2147483647, 1024, 8, 32], "", 0, []], [[], [["FU", 1, [0, 1, 2, 3]], ["SP", 1, 0, 6720, [28], 1], ["AN", 1, 0, 5], ["AN", 1, 1, 6]]]], "r": [[6.46083e-06], 0, 1.05278, 1720741283], "v": "v0.6"}
{"i": [["[\"sinh\", 12, 7, 8, 10]", "cuda -keys=cuda,gpu -arch=sm_80 -max_num_threads=1024 -thread_warp_size=32", [-1, 16, 64, 49152, 2147483647, 1024, 8, 32], "", 0, []], [[], [["FU", 1, [0, 1, 2, 3]], ["SP", 1, 0, 6720, [5], 1], ["AN", 1, 0, 5], ["AN", 1, 1, 6]]]], "r": [[8.01365e-06], 0, 1.15976, 1720741283], "v": "v0.6"}
{"i": [["[\"sinh\", 12, 7, 8, 10]", "cuda -keys=cuda,gpu -arch=sm_80 -max_num_threads=1024 -thread_warp_size=32", [-1, 16, 64, 49152, 2147483647, 1024, 8, 32], "", 0, []], [[], [["FU", 1, [0, 1, 2, 3]], ["SP", 1, 0, 6720, [6], 1], ["AN", 1, 0, 5], ["AN", 1, 1, 6]]]], "r": [[7.51894e-06], 0, 1.47219, 1720741283], "v": "v0.6"}
{"i": [["[\"sinh\", 12, 7, 8, 10]", "cuda -keys=cuda,gpu -arch=sm_80 -max_num_threads=1024 -thread_warp_size=32", [-1, 16, 64, 49152, 2147483647, 1024, 8, 32], "", 0, []], [[], [["FU", 1, [0, 1, 2, 3]], ["SP", 1, 0, 6720, [60], 1], ["AN", 1, 0, 5], ["AN", 1, 1, 6]]]], "r": [[5.86014e-06], 0, 1.32258, 1720741284], "v": "v0.6"}
{"i": [["[\"sinh\", 12, 7, 8, 10]", "cuda -keys=cuda,gpu -arch=sm_80 -max_num_threads=1024 -thread_warp_size=32", [-1, 16, 64, 49152, 2147483647, 1024, 8, 32], "", 0, []], [[], [["FU", 1, [0, 1, 2, 3]], ["SP", 1, 0, 6720, [21], 1], ["AN", 1, 0, 5], ["AN", 1, 1, 6]]]], "r": [[9.53254e-06], 0, 1.38165, 1720741284], "v": "v0.6"}
{"i": [["[\"sinh\", 12, 7, 8, 10]", "cuda -keys=cuda,gpu -arch=sm_80 -max_num_threads=1024 -thread_warp_size=32", [-1, 16, 64, 49152, 2147483647, 1024, 8, 32], "", 0, []], [[], [["FU", 1, [0, 1, 2, 3]], ["SP", 1, 0, 6720, [12], 1], ["AN", 1, 0, 5], ["AN", 1, 1, 6]]]], "r": [[6.58317e-06], 0, 1.37549, 1720741284], "v": "v0.6"}
{"i": [["[\"sinh\", 12, 7, 8, 10]", "cuda -keys=cuda,gpu -arch=sm_80 -max_num_threads=1024 -thread_warp_size=32", [-1, 16, 64, 49152, 2147483647, 1024, 8, 32], "", 0, []], [[], [["FU", 1, [0, 1, 2, 3]], ["SP", 1, 0, 6720, [32], 1], ["AN", 1, 0, 5], ["AN", 1, 1, 6]]]], "r": [[7.92429e-06], 0, 1.35238, 1720741285], "v": "v0.6"}
{"i": [["[\"sinh\", 12, 7, 8, 10]", "cuda -keys=cuda,gpu -arch=sm_80 -max_num_threads=1024 -thread_warp_size=32", [-1, 16, 64, 49152, 2147483647, 1024, 8, 32], "", 0, []], [[], [["FU", 1, [0, 1, 2, 3]], ["SP", 1, 0, 6720, [64], 1], ["AN", 1, 0, 5], ["AN", 1, 1, 6]]]], "r": [[6.28471e-06], 0, 1.28977, 1720741285], "v": "v0.6"}
