code_generation/generate/deprecated/deprecated_pure_without_shape/log/cuda/softmax_common_cuda.log
{"i": [["[\"softmax_common\", 12, 7, 11, 2]", "cuda -keys=cuda,gpu -arch=sm_80 -max_num_threads=1024 -thread_warp_size=32", [-1, 16, 64, 49152, 2147483647, 1024, 8, 32], "", 0, []], [[], [["CI", 3], ["CI", 2], ["FU", 5, [0, 1, 2, 3]], ["SP", 5, 0, 1848, [4], 1], ["AN", 5, 0, 5], ["AN", 5, 1, 6], ["FU", 4, [0, 1, 2]], ["SP", 4, 0, 924, [2], 1], ["AN", 4, 0, 5], ["AN", 4, 1, 6], ["FU", 1, [0, 1, 2]], ["SP", 1, 0, 924, [1], 1], ["AN", 1, 0, 5], ["AN", 1, 1, 6], ["PR", 1, 0, "auto_unroll_max_step$0"], ["PR", 4, 0, "auto_unroll_max_step$0"]]]], "r": [[2.10759e-05], 0, 1.818, 1720747497], "v": "v0.6"}
{"i": [["[\"softmax_common\", 12, 7, 11, 2]", "cuda -keys=cuda,gpu -arch=sm_80 -max_num_threads=1024 -thread_warp_size=32", [-1, 16, 64, 49152, 2147483647, 1024, 8, 32], "", 0, []], [[], [["CI", 3], ["CI", 2], ["FU", 5, [0, 1, 2, 3]], ["SP", 5, 0, 1848, [32], 1], ["AN", 5, 0, 5], ["AN", 5, 1, 6], ["FU", 4, [0, 1, 2]], ["SP", 4, 0, 924, [64], 1], ["AN", 4, 0, 5], ["AN", 4, 1, 6], ["FU", 1, [0, 1, 2]], ["SP", 1, 0, 924, [64], 1], ["AN", 1, 0, 5], ["AN", 1, 1, 6], ["PR", 1, 0, "auto_unroll_max_step$0"], ["PR", 4, 0, "auto_unroll_max_step$0"]]]], "r": [[1.71928e-05], 0, 1.383, 1720747497], "v": "v0.6"}
{"i": [["[\"softmax_common\", 12, 7, 11, 2]", "cuda -keys=cuda,gpu -arch=sm_80 -max_num_threads=1024 -thread_warp_size=32", [-1, 16, 64, 49152, 2147483647, 1024, 8, 32], "", 0, []], [[], [["CI", 3], ["CI", 2], ["FU", 5, [0, 1, 2, 3]], ["SP", 5, 0, 1848, [1], 1], ["AN", 5, 0, 5], ["AN", 5, 1, 6], ["FU", 4, [0, 1, 2]], ["SP", 4, 0, 924, [16], 1], ["AN", 4, 0, 5], ["AN", 4, 1, 6], ["FU", 1, [0, 1, 2]], ["SP", 1, 0, 924, [32], 1], ["AN", 1, 0, 5], ["AN", 1, 1, 6], ["PR", 1, 0, "auto_unroll_max_step$0"], ["PR", 4, 0, "auto_unroll_max_step$0"]]]], "r": [[2.56056e-05], 0, 1.15386, 1720747498], "v": "v0.6"}
{"i": [["[\"softmax_common\", 12, 7, 11, 2]", "cuda -keys=cuda,gpu -arch=sm_80 -max_num_threads=1024 -thread_warp_size=32", [-1, 16, 64, 49152, 2147483647, 1024, 8, 32], "", 0, []], [[], [["CI", 3], ["CI", 2], ["FU", 5, [0, 1, 2, 3]], ["SP", 5, 0, 1848, [32], 1], ["AN", 5, 0, 5], ["AN", 5, 1, 6], ["FU", 4, [0, 1, 2]], ["SP", 4, 0, 924, [32], 1], ["AN", 4, 0, 5], ["AN", 4, 1, 6], ["FU", 1, [0, 1, 2]], ["SP", 1, 0, 924, [6], 1], ["AN", 1, 0, 5], ["AN", 1, 1, 6], ["PR", 1, 0, "auto_unroll_max_step$0"], ["PR", 4, 0, "auto_unroll_max_step$0"]]]], "r": [[1.76541e-05], 0, 1.19348, 1720747498], "v": "v0.6"}
{"i": [["[\"softmax_common\", 12, 7, 11, 2]", "cuda -keys=cuda,gpu -arch=sm_80 -max_num_threads=1024 -thread_warp_size=32", [-1, 16, 64, 49152, 2147483647, 1024, 8, 32], "", 0, []], [[], [["CI", 3], ["CI", 2], ["FU", 5, [0, 1, 2, 3]], ["SP", 5, 0, 1848, [1], 1], ["AN", 5, 0, 5], ["AN", 5, 1, 6], ["FU", 4, [0, 1, 2]], ["SP", 4, 0, 924, [4], 1], ["AN", 4, 0, 5], ["AN", 4, 1, 6], ["FU", 1, [0, 1, 2]], ["SP", 1, 0, 924, [32], 1], ["AN", 1, 0, 5], ["AN", 1, 1, 6], ["PR", 1, 0, "auto_unroll_max_step$0"], ["PR", 4, 0, "auto_unroll_max_step$0"]]]], "r": [[2.05023e-05], 0, 1.06077, 1720747499], "v": "v0.6"}
{"i": [["[\"softmax_common\", 12, 7, 11, 2]", "cuda -keys=cuda,gpu -arch=sm_80 -max_num_threads=1024 -thread_warp_size=32", [-1, 16, 64, 49152, 2147483647, 1024, 8, 32], "", 0, []], [[], [["CI", 3], ["CI", 2], ["FU", 5, [0, 1, 2, 3]], ["SP", 5, 0, 1848, [32], 1], ["AN", 5, 0, 5], ["AN", 5, 1, 6], ["FU", 4, [0, 1, 2]], ["SP", 4, 0, 924, [64], 1], ["AN", 4, 0, 5], ["AN", 4, 1, 6], ["FU", 1, [0, 1, 2]], ["SP", 1, 0, 924, [32], 1], ["AN", 1, 0, 5], ["AN", 1, 1, 6], ["PR", 1, 0, "auto_unroll_max_step$0"], ["PR", 4, 0, "auto_unroll_max_step$0"]]]], "r": [[2.7016e-05], 0, 1.44241, 1720747499], "v": "v0.6"}
{"i": [["[\"softmax_common\", 12, 7, 11, 2]", "cuda -keys=cuda,gpu -arch=sm_80 -max_num_threads=1024 -thread_warp_size=32", [-1, 16, 64, 49152, 2147483647, 1024, 8, 32], "", 0, []], [[], [["CI", 3], ["CI", 2], ["FU", 5, [0, 1, 2, 3]], ["SP", 5, 0, 1848, [32], 1], ["AN", 5, 0, 5], ["AN", 5, 1, 6], ["FU", 4, [0, 1, 2]], ["SP", 4, 0, 924, [3], 1], ["AN", 4, 0, 5], ["AN", 4, 1, 6], ["FU", 1, [0, 1, 2]], ["SP", 1, 0, 924, [32], 1], ["AN", 1, 0, 5], ["AN", 1, 1, 6], ["PR", 1, 0, "auto_unroll_max_step$0"], ["PR", 4, 0, "auto_unroll_max_step$0"]]]], "r": [[1.8108e-05], 0, 1.36829, 1720747500], "v": "v0.6"}
{"i": [["[\"softmax_common\", 12, 7, 11, 2]", "cuda -keys=cuda,gpu -arch=sm_80 -max_num_threads=1024 -thread_warp_size=32", [-1, 16, 64, 49152, 2147483647, 1024, 8, 32], "", 0, []], [[], [["CI", 3], ["CI", 2], ["FU", 5, [0, 1, 2, 3]], ["SP", 5, 0, 1848, [22], 1], ["AN", 5, 0, 5], ["AN", 5, 1, 6], ["FU", 4, [0, 1, 2]], ["SP", 4, 0, 924, [32], 1], ["AN", 4, 0, 5], ["AN", 4, 1, 6], ["FU", 1, [0, 1, 2]], ["SP", 1, 0, 924, [16], 1], ["AN", 1, 0, 5], ["AN", 1, 1, 6], ["PR", 1, 0, "auto_unroll_max_step$0"], ["PR", 4, 0, "auto_unroll_max_step$0"]]]], "r": [[1.83347e-05], 0, 1.17339, 1720747500], "v": "v0.6"}
{"i": [["[\"softmax_common\", 12, 7, 11, 2]", "cuda -keys=cuda,gpu -arch=sm_80 -max_num_threads=1024 -thread_warp_size=32", [-1, 16, 64, 49152, 2147483647, 1024, 8, 32], "", 0, []], [[], [["CI", 3], ["CI", 2], ["FU", 5, [0, 1, 2, 3]], ["SP", 5, 0, 1848, [2], 1], ["AN", 5, 0, 5], ["AN", 5, 1, 6], ["FU", 4, [0, 1, 2]], ["SP", 4, 0, 924, [32], 1], ["AN", 4, 0, 5], ["AN", 4, 1, 6], ["FU", 1, [0, 1, 2]], ["SP", 1, 0, 924, [32], 1], ["AN", 1, 0, 5], ["AN", 1, 1, 6], ["PR", 1, 0, "auto_unroll_max_step$0"], ["PR", 4, 0, "auto_unroll_max_step$0"]]]], "r": [[1.84228e-05], 0, 1.19907, 1720747500], "v": "v0.6"}
{"i": [["[\"softmax_common\", 12, 7, 11, 2]", "cuda -keys=cuda,gpu -arch=sm_80 -max_num_threads=1024 -thread_warp_size=32", [-1, 16, 64, 49152, 2147483647, 1024, 8, 32], "", 0, []], [[], [["CI", 3], ["CI", 2], ["FU", 5, [0, 1, 2, 3]], ["SP", 5, 0, 1848, [32], 1], ["AN", 5, 0, 5], ["AN", 5, 1, 6], ["FU", 4, [0, 1, 2]], ["SP", 4, 0, 924, [64], 1], ["AN", 4, 0, 5], ["AN", 4, 1, 6], ["FU", 1, [0, 1, 2]], ["SP", 1, 0, 924, [8], 1], ["AN", 1, 0, 5], ["AN", 1, 1, 6], ["PR", 1, 0, "auto_unroll_max_step$0"], ["PR", 4, 0, "auto_unroll_max_step$0"]]]], "r": [[1.81473e-05], 0, 1.33307, 1720747501], "v": "v0.6"}
