code_generation/generate/deprecated/deprecated_pure_without_shape/log/cuda/space_to_depth_cuda.log
{"i": [["[\"space_to_depth\", 13, 4, 1, 2]", "cuda -keys=cuda,gpu -arch=sm_80 -max_num_threads=1024 -thread_warp_size=32", [-1, 16, 64, 49152, 2147483647, 1024, 8, 32], "", 0, []], [[], [["FU", 1, [0, 1, 2, 3]], ["SP", 1, 0, 416, [13], 1], ["AN", 1, 0, 5], ["AN", 1, 1, 6]]]], "r": [[5.65295e-06], 0, 1.93686, 1720748774], "v": "v0.6"}
{"i": [["[\"space_to_depth\", 13, 4, 1, 2]", "cuda -keys=cuda,gpu -arch=sm_80 -max_num_threads=1024 -thread_warp_size=32", [-1, 16, 64, 49152, 2147483647, 1024, 8, 32], "", 0, []], [[], [["FU", 1, [0, 1, 2, 3]], ["SP", 1, 0, 416, [26], 1], ["AN", 1, 0, 5], ["AN", 1, 1, 6]]]], "r": [[5.70797e-06], 0, 1.41081, 1720748774], "v": "v0.6"}
{"i": [["[\"space_to_depth\", 13, 4, 1, 2]", "cuda -keys=cuda,gpu -arch=sm_80 -max_num_threads=1024 -thread_warp_size=32", [-1, 16, 64, 49152, 2147483647, 1024, 8, 32], "", 0, []], [[], [["FU", 1, [0, 1, 2, 3]], ["SP", 1, 0, 416, [1], 1], ["AN", 1, 0, 5], ["AN", 1, 1, 6]]]], "r": [[6.56454e-06], 0, 1.44574, 1720748774], "v": "v0.6"}
{"i": [["[\"space_to_depth\", 13, 4, 1, 2]", "cuda -keys=cuda,gpu -arch=sm_80 -max_num_threads=1024 -thread_warp_size=32", [-1, 16, 64, 49152, 2147483647, 1024, 8, 32], "", 0, []], [[], [["FU", 1, [0, 1, 2, 3]], ["SP", 1, 0, 416, [8], 1], ["AN", 1, 0, 5], ["AN", 1, 1, 6]]]], "r": [[7.20512e-06], 0, 1.55938, 1720748775], "v": "v0.6"}
{"i": [["[\"space_to_depth\", 13, 4, 1, 2]", "cuda -keys=cuda,gpu -arch=sm_80 -max_num_threads=1024 -thread_warp_size=32", [-1, 16, 64, 49152, 2147483647, 1024, 8, 32], "", 0, []], [[], [["FU", 1, [0, 1, 2, 3]], ["SP", 1, 0, 416, [4], 1], ["AN", 1, 0, 5], ["AN", 1, 1, 6]]]], "r": [[7.79297e-06], 0, 1.2487, 1720748775], "v": "v0.6"}
{"i": [["[\"space_to_depth\", 13, 4, 1, 2]", "cuda -keys=cuda,gpu -arch=sm_80 -max_num_threads=1024 -thread_warp_size=32", [-1, 16, 64, 49152, 2147483647, 1024, 8, 32], "", 0, []], [[], [["FU", 1, [0, 1, 2, 3]], ["SP", 1, 0, 416, [52], 1], ["AN", 1, 0, 5], ["AN", 1, 1, 6]]]], "r": [[5.65584e-06], 0, 1.5834, 1720748775], "v": "v0.6"}
{"i": [["[\"space_to_depth\", 13, 4, 1, 2]", "cuda -keys=cuda,gpu -arch=sm_80 -max_num_threads=1024 -thread_warp_size=32", [-1, 16, 64, 49152, 2147483647, 1024, 8, 32], "", 0, []], [[], [["FU", 1, [0, 1, 2, 3]], ["SP", 1, 0, 416, [16], 1], ["AN", 1, 0, 5], ["AN", 1, 1, 6]]]], "r": [[9.46133e-06], 0, 1.75314, 1720748776], "v": "v0.6"}
{"i": [["[\"space_to_depth\", 13, 4, 1, 2]", "cuda -keys=cuda,gpu -arch=sm_80 -max_num_threads=1024 -thread_warp_size=32", [-1, 16, 64, 49152, 2147483647, 1024, 8, 32], "", 0, []], [[], [["FU", 1, [0, 1, 2, 3]], ["SP", 1, 0, 416, [32], 1], ["AN", 1, 0, 5], ["AN", 1, 1, 6]]]], "r": [[8.2019e-06], 0, 1.32418, 1720748776], "v": "v0.6"}
{"i": [["[\"space_to_depth\", 13, 4, 1, 2]", "cuda -keys=cuda,gpu -arch=sm_80 -max_num_threads=1024 -thread_warp_size=32", [-1, 16, 64, 49152, 2147483647, 1024, 8, 32], "", 0, []], [[], [["FU", 1, [0, 1, 2, 3]], ["SP", 1, 0, 416, [2], 1], ["AN", 1, 0, 5], ["AN", 1, 1, 6]]]], "r": [[6.92824e-06], 0, 1.33372, 1720748777], "v": "v0.6"}
