code_generation/generate/deprecated/deprecated_pure_without_shape/log/cuda/sqrt_cuda.log
{"i": [["[\"sqrt\", 13, 16, 2, 14]", "cuda -keys=cuda,gpu -arch=sm_80 -max_num_threads=1024 -thread_warp_size=32", [-1, 16, 64, 49152, 2147483647, 1024, 8, 32], "", 0, []], [[], [["FU", 1, [0, 1, 2, 3]], ["SP", 1, 0, 5824, [4], 1], ["AN", 1, 0, 5], ["AN", 1, 1, 6]]]], "r": [[8.19058e-06], 0, 1.9524, 1720741900], "v": "v0.6"}
{"i": [["[\"sqrt\", 13, 16, 2, 14]", "cuda -keys=cuda,gpu -arch=sm_80 -max_num_threads=1024 -thread_warp_size=32", [-1, 16, 64, 49152, 2147483647, 1024, 8, 32], "", 0, []], [[], [["FU", 1, [0, 1, 2, 3]], ["SP", 1, 0, 5824, [64], 1], ["AN", 1, 0, 5], ["AN", 1, 1, 6]]]], "r": [[8.3924e-06], 0, 1.57729, 1720741901], "v": "v0.6"}
{"i": [["[\"sqrt\", 13, 16, 2, 14]", "cuda -keys=cuda,gpu -arch=sm_80 -max_num_threads=1024 -thread_warp_size=32", [-1, 16, 64, 49152, 2147483647, 1024, 8, 32], "", 0, []], [[], [["FU", 1, [0, 1, 2, 3]], ["SP", 1, 0, 5824, [8], 1], ["AN", 1, 0, 5], ["AN", 1, 1, 6]]]], "r": [[8.37674e-06], 0, 1.67426, 1720741901], "v": "v0.6"}
{"i": [["[\"sqrt\", 13, 16, 2, 14]", "cuda -keys=cuda,gpu -arch=sm_80 -max_num_threads=1024 -thread_warp_size=32", [-1, 16, 64, 49152, 2147483647, 1024, 8, 32], "", 0, []], [[], [["FU", 1, [0, 1, 2, 3]], ["SP", 1, 0, 5824, [56], 1], ["AN", 1, 0, 5], ["AN", 1, 1, 6]]]], "r": [[7.2005e-06], 0, 1.65575, 1720741901], "v": "v0.6"}
{"i": [["[\"sqrt\", 13, 16, 2, 14]", "cuda -keys=cuda,gpu -arch=sm_80 -max_num_threads=1024 -thread_warp_size=32", [-1, 16, 64, 49152, 2147483647, 1024, 8, 32], "", 0, []], [[], [["FU", 1, [0, 1, 2, 3]], ["SP", 1, 0, 5824, [14], 1], ["AN", 1, 0, 5], ["AN", 1, 1, 6]]]], "r": [[8.08259e-06], 0, 1.55462, 1720741902], "v": "v0.6"}
{"i": [["[\"sqrt\", 13, 16, 2, 14]", "cuda -keys=cuda,gpu -arch=sm_80 -max_num_threads=1024 -thread_warp_size=32", [-1, 16, 64, 49152, 2147483647, 1024, 8, 32], "", 0, []], [[], [["FU", 1, [0, 1, 2, 3]], ["SP", 1, 0, 5824, [16], 1], ["AN", 1, 0, 5], ["AN", 1, 1, 6]]]], "r": [[8.73367e-06], 0, 1.33881, 1720741902], "v": "v0.6"}
{"i": [["[\"sqrt\", 13, 16, 2, 14]", "cuda -keys=cuda,gpu -arch=sm_80 -max_num_threads=1024 -thread_warp_size=32", [-1, 16, 64, 49152, 2147483647, 1024, 8, 32], "", 0, []], [[], [["FU", 1, [0, 1, 2, 3]], ["SP", 1, 0, 5824, [7], 1], ["AN", 1, 0, 5], ["AN", 1, 1, 6]]]], "r": [[8.43108e-06], 0, 1.43344, 1720741903], "v": "v0.6"}
{"i": [["[\"sqrt\", 13, 16, 2, 14]", "cuda -keys=cuda,gpu -arch=sm_80 -max_num_threads=1024 -thread_warp_size=32", [-1, 16, 64, 49152, 2147483647, 1024, 8, 32], "", 0, []], [[], [["FU", 1, [0, 1, 2, 3]], ["SP", 1, 0, 5824, [52], 1], ["AN", 1, 0, 5], ["AN", 1, 1, 6]]]], "r": [[8.14904e-06], 0, 1.44917, 1720741903], "v": "v0.6"}
{"i": [["[\"sqrt\", 13, 16, 2, 14]", "cuda -keys=cuda,gpu -arch=sm_80 -max_num_threads=1024 -thread_warp_size=32", [-1, 16, 64, 49152, 2147483647, 1024, 8, 32], "", 0, []], [[], [["FU", 1, [0, 1, 2, 3]], ["SP", 1, 0, 5824, [28], 1], ["AN", 1, 0, 5], ["AN", 1, 1, 6]]]], "r": [[7.29047e-06], 0, 0.957928, 1720741903], "v": "v0.6"}
{"i": [["[\"sqrt\", 13, 16, 2, 14]", "cuda -keys=cuda,gpu -arch=sm_80 -max_num_threads=1024 -thread_warp_size=32", [-1, 16, 64, 49152, 2147483647, 1024, 8, 32], "", 0, []], [[], [["FU", 1, [0, 1, 2, 3]], ["SP", 1, 0, 5824, [13], 1], ["AN", 1, 0, 5], ["AN", 1, 1, 6]]]], "r": [[6.11015e-06], 0, 1.59423, 1720741904], "v": "v0.6"}
