code_generation/generate/deprecated/deprecated_pure_without_shape/log/cuda/strided_slice_cuda.log
{"i": [["[\"strided_slice\", 13, 13, 8, 9]", "cuda -keys=cuda,gpu -arch=sm_80 -max_num_threads=1024 -thread_warp_size=32", [-1, 16, 64, 49152, 2147483647, 1024, 8, 32], "", 0, []], [[], [["FU", 1, [0, 1, 2]], ["SP", 1, 0, 90, [30], 1], ["AN", 1, 0, 5], ["AN", 1, 1, 6]]]], "r": [[5.49185e-06], 0, 1.35275, 1720768650], "v": "v0.6"}
{"i": [["[\"strided_slice\", 13, 13, 8, 9]", "cuda -keys=cuda,gpu -arch=sm_80 -max_num_threads=1024 -thread_warp_size=32", [-1, 16, 64, 49152, 2147483647, 1024, 8, 32], "", 0, []], [[], [["FU", 1, [0, 1, 2]], ["SP", 1, 0, 90, [2], 1], ["AN", 1, 0, 5], ["AN", 1, 1, 6]]]], "r": [[5.83925e-06], 0, 0.97649, 1720768650], "v": "v0.6"}
{"i": [["[\"strided_slice\", 13, 13, 8, 9]", "cuda -keys=cuda,gpu -arch=sm_80 -max_num_threads=1024 -thread_warp_size=32", [-1, 16, 64, 49152, 2147483647, 1024, 8, 32], "", 0, []], [[], [["FU", 1, [0, 1, 2]], ["SP", 1, 0, 90, [1], 1], ["AN", 1, 0, 5], ["AN", 1, 1, 6]]]], "r": [[6.38189e-06], 0, 1.00994, 1720768650], "v": "v0.6"}
{"i": [["[\"strided_slice\", 13, 13, 8, 9]", "cuda -keys=cuda,gpu -arch=sm_80 -max_num_threads=1024 -thread_warp_size=32", [-1, 16, 64, 49152, 2147483647, 1024, 8, 32], "", 0, []], [[], [["FU", 1, [0, 1, 2]], ["SP", 1, 0, 90, [5], 1], ["AN", 1, 0, 5], ["AN", 1, 1, 6]]]], "r": [[6.93024e-06], 0, 0.973282, 1720768651], "v": "v0.6"}
{"i": [["[\"strided_slice\", 13, 13, 8, 9]", "cuda -keys=cuda,gpu -arch=sm_80 -max_num_threads=1024 -thread_warp_size=32", [-1, 16, 64, 49152, 2147483647, 1024, 8, 32], "", 0, []], [[], [["FU", 1, [0, 1, 2]], ["SP", 1, 0, 90, [45], 1], ["AN", 1, 0, 5], ["AN", 1, 1, 6]]]], "r": [[5.82877e-06], 0, 0.975044, 1720768651], "v": "v0.6"}
{"i": [["[\"strided_slice\", 13, 13, 8, 9]", "cuda -keys=cuda,gpu -arch=sm_80 -max_num_threads=1024 -thread_warp_size=32", [-1, 16, 64, 49152, 2147483647, 1024, 8, 32], "", 0, []], [[], [["FU", 1, [0, 1, 2]], ["SP", 1, 0, 90, [18], 1], ["AN", 1, 0, 5], ["AN", 1, 1, 6]]]], "r": [[5.82885e-06], 0, 0.940408, 1720768651], "v": "v0.6"}
{"i": [["[\"strided_slice\", 13, 13, 8, 9]", "cuda -keys=cuda,gpu -arch=sm_80 -max_num_threads=1024 -thread_warp_size=32", [-1, 16, 64, 49152, 2147483647, 1024, 8, 32], "", 0, []], [[], [["FU", 1, [0, 1, 2]], ["SP", 1, 0, 90, [4], 1], ["AN", 1, 0, 5], ["AN", 1, 1, 6]]]], "r": [[5.87076e-06], 0, 0.958481, 1720768651], "v": "v0.6"}
{"i": [["[\"strided_slice\", 13, 13, 8, 9]", "cuda -keys=cuda,gpu -arch=sm_80 -max_num_threads=1024 -thread_warp_size=32", [-1, 16, 64, 49152, 2147483647, 1024, 8, 32], "", 0, []], [[], [["FU", 1, [0, 1, 2]], ["SP", 1, 0, 90, [32], 1], ["AN", 1, 0, 5], ["AN", 1, 1, 6]]]], "r": [[6.73231e-06], 0, 0.972506, 1720768652], "v": "v0.6"}
{"i": [["[\"strided_slice\", 13, 13, 8, 9]", "cuda -keys=cuda,gpu -arch=sm_80 -max_num_threads=1024 -thread_warp_size=32", [-1, 16, 64, 49152, 2147483647, 1024, 8, 32], "", 0, []], [[], [["FU", 1, [0, 1, 2]], ["SP", 1, 0, 90, [16], 1], ["AN", 1, 0, 5], ["AN", 1, 1, 6]]]], "r": [[5.83816e-06], 0, 0.812751, 1720768652], "v": "v0.6"}
{"i": [["[\"strided_slice\", 13, 13, 8, 9]", "cuda -keys=cuda,gpu -arch=sm_80 -max_num_threads=1024 -thread_warp_size=32", [-1, 16, 64, 49152, 2147483647, 1024, 8, 32], "", 0, []], [[], [["FU", 1, [0, 1, 2]], ["SP", 1, 0, 90, [10], 1], ["AN", 1, 0, 5], ["AN", 1, 1, 6]]]], "r": [[5.8458e-06], 0, 0.89644, 1720768652], "v": "v0.6"}
