code_generation/generate/deprecated/deprecated_pure_without_shape/log/cuda/tan_cuda.log
{"i": [["[\"tan\", 13, 8, 8, 10]", "cuda -keys=cuda,gpu -arch=sm_80 -max_num_threads=1024 -thread_warp_size=32", [-1, 16, 64, 49152, 2147483647, 1024, 8, 32], "", 0, []], [[], [["FU", 1, [0, 1, 2, 3]], ["SP", 1, 0, 8320, [5], 1], ["AN", 1, 0, 5], ["AN", 1, 1, 6]]]], "r": [[8.34561e-06], 0, 1.84608, 1720743942], "v": "v0.6"}
{"i": [["[\"tan\", 13, 8, 8, 10]", "cuda -keys=cuda,gpu -arch=sm_80 -max_num_threads=1024 -thread_warp_size=32", [-1, 16, 64, 49152, 2147483647, 1024, 8, 32], "", 0, []], [[], [["FU", 1, [0, 1, 2, 3]], ["SP", 1, 0, 8320, [10], 1], ["AN", 1, 0, 5], ["AN", 1, 1, 6]]]], "r": [[6.70175e-06], 0, 1.28854, 1720743943], "v": "v0.6"}
{"i": [["[\"tan\", 13, 8, 8, 10]", "cuda -keys=cuda,gpu -arch=sm_80 -max_num_threads=1024 -thread_warp_size=32", [-1, 16, 64, 49152, 2147483647, 1024, 8, 32], "", 0, []], [[], [["FU", 1, [0, 1, 2, 3]], ["SP", 1, 0, 8320, [20], 1], ["AN", 1, 0, 5], ["AN", 1, 1, 6]]]], "r": [[6.20796e-06], 0, 1.46557, 1720743943], "v": "v0.6"}
{"i": [["[\"tan\", 13, 8, 8, 10]", "cuda -keys=cuda,gpu -arch=sm_80 -max_num_threads=1024 -thread_warp_size=32", [-1, 16, 64, 49152, 2147483647, 1024, 8, 32], "", 0, []], [[], [["FU", 1, [0, 1, 2, 3]], ["SP", 1, 0, 8320, [64], 1], ["AN", 1, 0, 5], ["AN", 1, 1, 6]]]], "r": [[5.72173e-06], 0, 1.44365, 1720743943], "v": "v0.6"}
{"i": [["[\"tan\", 13, 8, 8, 10]", "cuda -keys=cuda,gpu -arch=sm_80 -max_num_threads=1024 -thread_warp_size=32", [-1, 16, 64, 49152, 2147483647, 1024, 8, 32], "", 0, []], [[], [["FU", 1, [0, 1, 2, 3]], ["SP", 1, 0, 8320, [4], 1], ["AN", 1, 0, 5], ["AN", 1, 1, 6]]]], "r": [[9.03032e-06], 0, 1.37632, 1720743943], "v": "v0.6"}
{"i": [["[\"tan\", 13, 8, 8, 10]", "cuda -keys=cuda,gpu -arch=sm_80 -max_num_threads=1024 -thread_warp_size=32", [-1, 16, 64, 49152, 2147483647, 1024, 8, 32], "", 0, []], [[], [["FU", 1, [0, 1, 2, 3]], ["SP", 1, 0, 8320, [26], 1], ["AN", 1, 0, 5], ["AN", 1, 1, 6]]]], "r": [[6.11783e-06], 0, 1.53394, 1720743944], "v": "v0.6"}
{"i": [["[\"tan\", 13, 8, 8, 10]", "cuda -keys=cuda,gpu -arch=sm_80 -max_num_threads=1024 -thread_warp_size=32", [-1, 16, 64, 49152, 2147483647, 1024, 8, 32], "", 0, []], [[], [["FU", 1, [0, 1, 2, 3]], ["SP", 1, 0, 8320, [32], 1], ["AN", 1, 0, 5], ["AN", 1, 1, 6]]]], "r": [[6.85237e-06], 0, 1.52596, 1720743944], "v": "v0.6"}
{"i": [["[\"tan\", 13, 8, 8, 10]", "cuda -keys=cuda,gpu -arch=sm_80 -max_num_threads=1024 -thread_warp_size=32", [-1, 16, 64, 49152, 2147483647, 1024, 8, 32], "", 0, []], [[], [["FU", 1, [0, 1, 2, 3]], ["SP", 1, 0, 8320, [16], 1], ["AN", 1, 0, 5], ["AN", 1, 1, 6]]]], "r": [[6.15704e-06], 0, 1.28409, 1720743944], "v": "v0.6"}
{"i": [["[\"tan\", 13, 8, 8, 10]", "cuda -keys=cuda,gpu -arch=sm_80 -max_num_threads=1024 -thread_warp_size=32", [-1, 16, 64, 49152, 2147483647, 1024, 8, 32], "", 0, []], [[], [["FU", 1, [0, 1, 2, 3]], ["SP", 1, 0, 8320, [2], 1], ["AN", 1, 0, 5], ["AN", 1, 1, 6]]]], "r": [[1.25701e-05], 0, 1.33497, 1720743944], "v": "v0.6"}
{"i": [["[\"tan\", 13, 8, 8, 10]", "cuda -keys=cuda,gpu -arch=sm_80 -max_num_threads=1024 -thread_warp_size=32", [-1, 16, 64, 49152, 2147483647, 1024, 8, 32], "", 0, []], [[], [["FU", 1, [0, 1, 2, 3]], ["SP", 1, 0, 8320, [1], 1], ["AN", 1, 0, 5], ["AN", 1, 1, 6]]]], "r": [[1.95143e-05], 0, 1.00054, 1720743945], "v": "v0.6"}
