code_generation/generate/deprecated/deprecated_pure_without_shape/log/cuda/tanh_cuda.log
{"i": [["[\"tanh\", 14, 5, 9, 20]", "cuda -keys=cuda,gpu -arch=sm_80 -max_num_threads=1024 -thread_warp_size=32", [-1, 16, 64, 49152, 2147483647, 1024, 8, 32], "", 0, []], [[], [["FU", 1, [0, 1, 2, 3]], ["SP", 1, 0, 12600, [7], 1], ["AN", 1, 0, 5], ["AN", 1, 1, 6]]]], "r": [[8.78122e-06], 0, 1.42602, 1720745046], "v": "v0.6"}
{"i": [["[\"tanh\", 14, 5, 9, 20]", "cuda -keys=cuda,gpu -arch=sm_80 -max_num_threads=1024 -thread_warp_size=32", [-1, 16, 64, 49152, 2147483647, 1024, 8, 32], "", 0, []], [[], [["FU", 1, [0, 1, 2, 3]], ["SP", 1, 0, 12600, [42], 1], ["AN", 1, 0, 5], ["AN", 1, 1, 6]]]], "r": [[7.04213e-06], 0, 1.54721, 1720745046], "v": "v0.6"}
{"i": [["[\"tanh\", 14, 5, 9, 20]", "cuda -keys=cuda,gpu -arch=sm_80 -max_num_threads=1024 -thread_warp_size=32", [-1, 16, 64, 49152, 2147483647, 1024, 8, 32], "", 0, []], [[], [["FU", 1, [0, 1, 2, 3]], ["SP", 1, 0, 12600, [30], 1], ["AN", 1, 0, 5], ["AN", 1, 1, 6]]]], "r": [[7.01875e-06], 0, 0.982324, 1720745046], "v": "v0.6"}
{"i": [["[\"tanh\", 14, 5, 9, 20]", "cuda -keys=cuda,gpu -arch=sm_80 -max_num_threads=1024 -thread_warp_size=32", [-1, 16, 64, 49152, 2147483647, 1024, 8, 32], "", 0, []], [[], [["FU", 1, [0, 1, 2, 3]], ["SP", 1, 0, 12600, [45], 1], ["AN", 1, 0, 5], ["AN", 1, 1, 6]]]], "r": [[7.59023e-06], 0, 1.12257, 1720745047], "v": "v0.6"}
{"i": [["[\"tanh\", 14, 5, 9, 20]", "cuda -keys=cuda,gpu -arch=sm_80 -max_num_threads=1024 -thread_warp_size=32", [-1, 16, 64, 49152, 2147483647, 1024, 8, 32], "", 0, []], [[], [["FU", 1, [0, 1, 2, 3]], ["SP", 1, 0, 12600, [56], 1], ["AN", 1, 0, 5], ["AN", 1, 1, 6]]]], "r": [[9.47583e-06], 0, 1.93453, 1720745047], "v": "v0.6"}
{"i": [["[\"tanh\", 14, 5, 9, 20]", "cuda -keys=cuda,gpu -arch=sm_80 -max_num_threads=1024 -thread_warp_size=32", [-1, 16, 64, 49152, 2147483647, 1024, 8, 32], "", 0, []], [[], [["FU", 1, [0, 1, 2, 3]], ["SP", 1, 0, 12600, [50], 1], ["AN", 1, 0, 5], ["AN", 1, 1, 6]]]], "r": [[7.71819e-06], 0, 1.15159, 1720745047], "v": "v0.6"}
{"i": [["[\"tanh\", 14, 5, 9, 20]", "cuda -keys=cuda,gpu -arch=sm_80 -max_num_threads=1024 -thread_warp_size=32", [-1, 16, 64, 49152, 2147483647, 1024, 8, 32], "", 0, []], [[], [["FU", 1, [0, 1, 2, 3]], ["SP", 1, 0, 12600, [12], 1], ["AN", 1, 0, 5], ["AN", 1, 1, 6]]]], "r": [[7.9791e-06], 0, 1.50162, 1720745048], "v": "v0.6"}
{"i": [["[\"tanh\", 14, 5, 9, 20]", "cuda -keys=cuda,gpu -arch=sm_80 -max_num_threads=1024 -thread_warp_size=32", [-1, 16, 64, 49152, 2147483647, 1024, 8, 32], "", 0, []], [[], [["FU", 1, [0, 1, 2, 3]], ["SP", 1, 0, 12600, [9], 1], ["AN", 1, 0, 5], ["AN", 1, 1, 6]]]], "r": [[8.60687e-06], 0, 0.992137, 1720745048], "v": "v0.6"}
{"i": [["[\"tanh\", 14, 5, 9, 20]", "cuda -keys=cuda,gpu -arch=sm_80 -max_num_threads=1024 -thread_warp_size=32", [-1, 16, 64, 49152, 2147483647, 1024, 8, 32], "", 0, []], [[], [["FU", 1, [0, 1, 2, 3]], ["SP", 1, 0, 12600, [35], 1], ["AN", 1, 0, 5], ["AN", 1, 1, 6]]]], "r": [[6.70889e-06], 0, 1.50217, 1720745049], "v": "v0.6"}
{"i": [["[\"tanh\", 14, 5, 9, 20]", "cuda -keys=cuda,gpu -arch=sm_80 -max_num_threads=1024 -thread_warp_size=32", [-1, 16, 64, 49152, 2147483647, 1024, 8, 32], "", 0, []], [[], [["FU", 1, [0, 1, 2, 3]], ["SP", 1, 0, 12600, [15], 1], ["AN", 1, 0, 5], ["AN", 1, 1, 6]]]], "r": [[7.15251e-06], 0, 1.21346, 1720745049], "v": "v0.6"}
