code_generation/generate/deprecated/deprecated_pure_without_shape/log/cuda/unpack_NCHWc_to_nchw_cuda.log
{"i": [["[\"unpack_NCHWc_to_nchw\", 4, 2, 17, 2]", "cuda -keys=cuda,gpu -arch=sm_80 -max_num_threads=1024 -thread_warp_size=32", [-1, 16, 64, 49152, 2147483647, 1024, 8, 32], "", 0, []], [[], [["FU", 1, [0, 1, 2, 3]], ["SP", 1, 0, 544, [4], 1], ["AN", 1, 0, 5], ["AN", 1, 1, 6]]]], "r": [[5.83741e-06], 0, 1.65031, 1720769014], "v": "v0.6"}
{"i": [["[\"unpack_NCHWc_to_nchw\", 4, 2, 17, 2]", "cuda -keys=cuda,gpu -arch=sm_80 -max_num_threads=1024 -thread_warp_size=32", [-1, 16, 64, 49152, 2147483647, 1024, 8, 32], "", 0, []], [[], [["FU", 1, [0, 1, 2, 3]], ["SP", 1, 0, 544, [32], 1], ["AN", 1, 0, 5], ["AN", 1, 1, 6]]]], "r": [[1.09242e-05], 0, 1.29779, 1720769015], "v": "v0.6"}
{"i": [["[\"unpack_NCHWc_to_nchw\", 4, 2, 17, 2]", "cuda -keys=cuda,gpu -arch=sm_80 -max_num_threads=1024 -thread_warp_size=32", [-1, 16, 64, 49152, 2147483647, 1024, 8, 32], "", 0, []], [[], [["FU", 1, [0, 1, 2, 3]], ["SP", 1, 0, 544, [34], 1], ["AN", 1, 0, 5], ["AN", 1, 1, 6]]]], "r": [[7.18637e-06], 0, 1.3802, 1720769015], "v": "v0.6"}
{"i": [["[\"unpack_NCHWc_to_nchw\", 4, 2, 17, 2]", "cuda -keys=cuda,gpu -arch=sm_80 -max_num_threads=1024 -thread_warp_size=32", [-1, 16, 64, 49152, 2147483647, 1024, 8, 32], "", 0, []], [[], [["FU", 1, [0, 1, 2, 3]], ["SP", 1, 0, 544, [16], 1], ["AN", 1, 0, 5], ["AN", 1, 1, 6]]]], "r": [[7.60294e-06], 0, 1.06498, 1720769016], "v": "v0.6"}
{"i": [["[\"unpack_NCHWc_to_nchw\", 4, 2, 17, 2]", "cuda -keys=cuda,gpu -arch=sm_80 -max_num_threads=1024 -thread_warp_size=32", [-1, 16, 64, 49152, 2147483647, 1024, 8, 32], "", 0, []], [[], [["FU", 1, [0, 1, 2, 3]], ["SP", 1, 0, 544, [1], 1], ["AN", 1, 0, 5], ["AN", 1, 1, 6]]]], "r": [[6.35e-06], 0, 2.02511, 1720769017], "v": "v0.6"}
{"i": [["[\"unpack_NCHWc_to_nchw\", 4, 2, 17, 2]", "cuda -keys=cuda,gpu -arch=sm_80 -max_num_threads=1024 -thread_warp_size=32", [-1, 16, 64, 49152, 2147483647, 1024, 8, 32], "", 0, []], [[], [["FU", 1, [0, 1, 2, 3]], ["SP", 1, 0, 544, [8], 1], ["AN", 1, 0, 5], ["AN", 1, 1, 6]]]], "r": [[5.87302e-06], 0, 1.52882, 1720769018], "v": "v0.6"}
{"i": [["[\"unpack_NCHWc_to_nchw\", 4, 2, 17, 2]", "cuda -keys=cuda,gpu -arch=sm_80 -max_num_threads=1024 -thread_warp_size=32", [-1, 16, 64, 49152, 2147483647, 1024, 8, 32], "", 0, []], [[], [["FU", 1, [0, 1, 2, 3]], ["SP", 1, 0, 544, [2], 1], ["AN", 1, 0, 5], ["AN", 1, 1, 6]]]], "r": [[7.34542e-06], 0, 1.11498, 1720769018], "v": "v0.6"}
{"i": [["[\"unpack_NCHWc_to_nchw\", 4, 2, 17, 2]", "cuda -keys=cuda,gpu -arch=sm_80 -max_num_threads=1024 -thread_warp_size=32", [-1, 16, 64, 49152, 2147483647, 1024, 8, 32], "", 0, []], [[], [["FU", 1, [0, 1, 2, 3]], ["SP", 1, 0, 544, [17], 1], ["AN", 1, 0, 5], ["AN", 1, 1, 6]]]], "r": [[7.90107e-06], 0, 1.65035, 1720769019], "v": "v0.6"}
