code_generation/generate/deprecated/deprecated_pure_without_shape/log/cuda/upsampling_cuda.log
{"i": [["[\"upsampling\", 10, 8, 12, 19]", "cuda -keys=cuda,gpu -arch=sm_80 -max_num_threads=1024 -thread_warp_size=32", [-1, 16, 64, 49152, 2147483647, 1024, 8, 32], "", 0, []], [[], [["FU", 1, [0, 1, 2, 3]], ["SP", 1, 0, 291840, [2], 1], ["AN", 1, 0, 5], ["AN", 1, 1, 6]]]], "r": [[0.000248114], 0, 1.35369, 1720772271], "v": "v0.6"}
{"i": [["[\"upsampling\", 10, 8, 12, 19]", "cuda -keys=cuda,gpu -arch=sm_80 -max_num_threads=1024 -thread_warp_size=32", [-1, 16, 64, 49152, 2147483647, 1024, 8, 32], "", 0, []], [[], [["FU", 1, [0, 1, 2, 3]], ["SP", 1, 0, 291840, [10], 1], ["AN", 1, 0, 5], ["AN", 1, 1, 6]]]], "r": [[5.43679e-05], 0, 1.01794, 1720772271], "v": "v0.6"}
{"i": [["[\"upsampling\", 10, 8, 12, 19]", "cuda -keys=cuda,gpu -arch=sm_80 -max_num_threads=1024 -thread_warp_size=32", [-1, 16, 64, 49152, 2147483647, 1024, 8, 32], "", 0, []], [[], [["FU", 1, [0, 1, 2, 3]], ["SP", 1, 0, 291840, [38], 1], ["AN", 1, 0, 5], ["AN", 1, 1, 6]]]], "r": [[1.8119e-05], 0, 1.24617, 1720772271], "v": "v0.6"}
{"i": [["[\"upsampling\", 10, 8, 12, 19]", "cuda -keys=cuda,gpu -arch=sm_80 -max_num_threads=1024 -thread_warp_size=32", [-1, 16, 64, 49152, 2147483647, 1024, 8, 32], "", 0, []], [[], [["FU", 1, [0, 1, 2, 3]], ["SP", 1, 0, 291840, [4], 1], ["AN", 1, 0, 5], ["AN", 1, 1, 6]]]], "r": [[0.000126349], 0, 1.07591, 1720772272], "v": "v0.6"}
{"i": [["[\"upsampling\", 10, 8, 12, 19]", "cuda -keys=cuda,gpu -arch=sm_80 -max_num_threads=1024 -thread_warp_size=32", [-1, 16, 64, 49152, 2147483647, 1024, 8, 32], "", 0, []], [[], [["FU", 1, [0, 1, 2, 3]], ["SP", 1, 0, 291840, [1], 1], ["AN", 1, 0, 5], ["AN", 1, 1, 6]]]], "r": [[0.00048798], 0, 1.21174, 1720772272], "v": "v0.6"}
{"i": [["[\"upsampling\", 10, 8, 12, 19]", "cuda -keys=cuda,gpu -arch=sm_80 -max_num_threads=1024 -thread_warp_size=32", [-1, 16, 64, 49152, 2147483647, 1024, 8, 32], "", 0, []], [[], [["FU", 1, [0, 1, 2, 3]], ["SP", 1, 0, 291840, [3], 1], ["AN", 1, 0, 5], ["AN", 1, 1, 6]]]], "r": [[0.000166249], 0, 1.00995, 1720772273], "v": "v0.6"}
{"i": [["[\"upsampling\", 10, 8, 12, 19]", "cuda -keys=cuda,gpu -arch=sm_80 -max_num_threads=1024 -thread_warp_size=32", [-1, 16, 64, 49152, 2147483647, 1024, 8, 32], "", 0, []], [[], [["FU", 1, [0, 1, 2, 3]], ["SP", 1, 0, 291840, [16], 1], ["AN", 1, 0, 5], ["AN", 1, 1, 6]]]], "r": [[3.66384e-05], 0, 1.16554, 1720772273], "v": "v0.6"}
{"i": [["[\"upsampling\", 10, 8, 12, 19]", "cuda -keys=cuda,gpu -arch=sm_80 -max_num_threads=1024 -thread_warp_size=32", [-1, 16, 64, 49152, 2147483647, 1024, 8, 32], "", 0, []], [[], [["FU", 1, [0, 1, 2, 3]], ["SP", 1, 0, 291840, [20], 1], ["AN", 1, 0, 5], ["AN", 1, 1, 6]]]], "r": [[3.03786e-05], 0, 1.06992, 1720772273], "v": "v0.6"}
{"i": [["[\"upsampling\", 10, 8, 12, 19]", "cuda -keys=cuda,gpu -arch=sm_80 -max_num_threads=1024 -thread_warp_size=32", [-1, 16, 64, 49152, 2147483647, 1024, 8, 32], "", 0, []], [[], [["FU", 1, [0, 1, 2, 3]], ["SP", 1, 0, 291840, [15], 1], ["AN", 1, 0, 5], ["AN", 1, 1, 6]]]], "r": [[3.82349e-05], 0, 1.21637, 1720772274], "v": "v0.6"}
{"i": [["[\"upsampling\", 10, 8, 12, 19]", "cuda -keys=cuda,gpu -arch=sm_80 -max_num_threads=1024 -thread_warp_size=32", [-1, 16, 64, 49152, 2147483647, 1024, 8, 32], "", 0, []], [[], [["FU", 1, [0, 1, 2, 3]], ["SP", 1, 0, 291840, [64], 1], ["AN", 1, 0, 5], ["AN", 1, 1, 6]]]], "r": [[1.35069e-05], 0, 1.12386, 1720772274], "v": "v0.6"}
