code_generation/generate/log/cuda/combination_op_cuda.log
{"i": [["[\"combination_op\", 38, 32, 30, 99]", "cuda -keys=cuda,gpu -arch=sm_80 -max_num_threads=1024 -thread_warp_size=32", [-1, 16, 64, 49152, 2147483647, 1024, 8, 32], "", 0, []], [[], [["CI", 3], ["CI", 1], ["FU", 4, [0, 1, 2, 3]], ["SP", 4, 0, 3611520, [6], 1], ["AN", 4, 0, 5], ["AN", 4, 1, 6]]]], "r": [[0.00150009], 0, 1.45199, 1721641820], "v": "v0.6"}
{"i": [["[\"combination_op\", 38, 32, 30, 99]", "cuda -keys=cuda,gpu -arch=sm_80 -max_num_threads=1024 -thread_warp_size=32", [-1, 16, 64, 49152, 2147483647, 1024, 8, 32], "", 0, []], [[], [["CI", 3], ["CI", 1], ["FU", 4, [0, 1, 2, 3]], ["SP", 4, 0, 3611520, [19], 1], ["AN", 4, 0, 5], ["AN", 4, 1, 6]]]], "r": [[0.000484212], 0, 0.891126, 1721641820], "v": "v0.6"}
{"i": [["[\"combination_op\", 38, 32, 30, 99]", "cuda -keys=cuda,gpu -arch=sm_80 -max_num_threads=1024 -thread_warp_size=32", [-1, 16, 64, 49152, 2147483647, 1024, 8, 32], "", 0, []], [[], [["CI", 3], ["CI", 1], ["FU", 4, [0, 1, 2, 3]], ["SP", 4, 0, 3611520, [20], 1], ["AN", 4, 0, 5], ["AN", 4, 1, 6]]]], "r": [[0.000309121], 0, 0.762498, 1721641821], "v": "v0.6"}
{"i": [["[\"combination_op\", 38, 32, 30, 99]", "cuda -keys=cuda,gpu -arch=sm_80 -max_num_threads=1024 -thread_warp_size=32", [-1, 16, 64, 49152, 2147483647, 1024, 8, 32], "", 0, []], [[], [["CI", 3], ["CI", 1], ["FU", 4, [0, 1, 2, 3]], ["SP", 4, 0, 3611520, [3], 1], ["AN", 4, 0, 5], ["AN", 4, 1, 6]]]], "r": [[0.00202093], 0, 0.660272, 1721641821], "v": "v0.6"}
{"i": [["[\"combination_op\", 38, 32, 30, 99]", "cuda -keys=cuda,gpu -arch=sm_80 -max_num_threads=1024 -thread_warp_size=32", [-1, 16, 64, 49152, 2147483647, 1024, 8, 32], "", 0, []], [[], [["CI", 3], ["CI", 1], ["FU", 4, [0, 1, 2, 3]], ["SP", 4, 0, 3611520, [30], 1], ["AN", 4, 0, 5], ["AN", 4, 1, 6]]]], "r": [[0.000208668], 0, 0.767248, 1721641822], "v": "v0.6"}
{"i": [["[\"combination_op\", 38, 32, 30, 99]", "cuda -keys=cuda,gpu -arch=sm_80 -max_num_threads=1024 -thread_warp_size=32", [-1, 16, 64, 49152, 2147483647, 1024, 8, 32], "", 0, []], [[], [["CI", 3], ["CI", 1], ["FU", 4, [0, 1, 2, 3]], ["SP", 4, 0, 3611520, [4], 1], ["AN", 4, 0, 5], ["AN", 4, 1, 6]]]], "r": [[0.00151686], 0, 0.777515, 1721641822], "v": "v0.6"}
{"i": [["[\"combination_op\", 38, 32, 30, 99]", "cuda -keys=cuda,gpu -arch=sm_80 -max_num_threads=1024 -thread_warp_size=32", [-1, 16, 64, 49152, 2147483647, 1024, 8, 32], "", 0, []], [[], [["CI", 3], ["CI", 1], ["FU", 4, [0, 1, 2, 3]], ["SP", 4, 0, 3611520, [9], 1], ["AN", 4, 0, 5], ["AN", 4, 1, 6]]]], "r": [[0.000673845], 0, 0.755088, 1721641823], "v": "v0.6"}
{"i": [["[\"combination_op\", 38, 32, 30, 99]", "cuda -keys=cuda,gpu -arch=sm_80 -max_num_threads=1024 -thread_warp_size=32", [-1, 16, 64, 49152, 2147483647, 1024, 8, 32], "", 0, []], [[], [["CI", 3], ["CI", 1], ["FU", 4, [0, 1, 2, 3]], ["SP", 4, 0, 3611520, [15], 1], ["AN", 4, 0, 5], ["AN", 4, 1, 6]]]], "r": [[0.000408242], 0, 0.758207, 1721641823], "v": "v0.6"}
{"i": [["[\"combination_op\", 38, 32, 30, 99]", "cuda -keys=cuda,gpu -arch=sm_80 -max_num_threads=1024 -thread_warp_size=32", [-1, 16, 64, 49152, 2147483647, 1024, 8, 32], "", 0, []], [[], [["CI", 3], ["CI", 1], ["FU", 4, [0, 1, 2, 3]], ["SP", 4, 0, 3611520, [1], 1], ["AN", 4, 0, 5], ["AN", 4, 1, 6]]]], "r": [[0.00601293], 0, 0.681065, 1721641823], "v": "v0.6"}
{"i": [["[\"combination_op\", 38, 32, 30, 99]", "cuda -keys=cuda,gpu -arch=sm_80 -max_num_threads=1024 -thread_warp_size=32", [-1, 16, 64, 49152, 2147483647, 1024, 8, 32], "", 0, []], [[], [["CI", 3], ["CI", 1], ["FU", 4, [0, 1, 2, 3]], ["SP", 4, 0, 3611520, [45], 1], ["AN", 4, 0, 5], ["AN", 4, 1, 6]]]], "r": [[0.000167778], 0, 0.799013, 1721641824], "v": "v0.6"}
