code_generation/generate/log/cuda/exp_cuda.log
{"i": [["[\"exp\", 61, 57, 85, 39]", "cuda -keys=cuda,gpu -arch=sm_80 -max_num_threads=1024 -thread_warp_size=32", [-1, 16, 64, 49152, 2147483647, 1024, 8, 32], "", 0, []], [[], [["FU", 1, [0, 1, 2, 3]], ["SP", 1, 0, 11526255, [45], 1], ["AN", 1, 0, 5], ["AN", 1, 1, 6]]]], "r": [[0.000431498], 0, 1.33328, 1721785283], "v": "v0.6"}
{"i": [["[\"exp\", 61, 57, 85, 39]", "cuda -keys=cuda,gpu -arch=sm_80 -max_num_threads=1024 -thread_warp_size=32", [-1, 16, 64, 49152, 2147483647, 1024, 8, 32], "", 0, []], [[], [["FU", 1, [0, 1, 2, 3]], ["SP", 1, 0, 11526255, [57], 1], ["AN", 1, 0, 5], ["AN", 1, 1, 6]]]], "r": [[0.000342294], 0, 0.976132, 1721785283], "v": "v0.6"}
{"i": [["[\"exp\", 61, 57, 85, 39]", "cuda -keys=cuda,gpu -arch=sm_80 -max_num_threads=1024 -thread_warp_size=32", [-1, 16, 64, 49152, 2147483647, 1024, 8, 32], "", 0, []], [[], [["FU", 1, [0, 1, 2, 3]], ["SP", 1, 0, 11526255, [13], 1], ["AN", 1, 0, 5], ["AN", 1, 1, 6]]]], "r": [[0.00148274], 0, 0.98902, 1721785284], "v": "v0.6"}
{"i": [["[\"exp\", 61, 57, 85, 39]", "cuda -keys=cuda,gpu -arch=sm_80 -max_num_threads=1024 -thread_warp_size=32", [-1, 16, 64, 49152, 2147483647, 1024, 8, 32], "", 0, []], [[], [["FU", 1, [0, 1, 2, 3]], ["SP", 1, 0, 11526255, [5], 1], ["AN", 1, 0, 5], ["AN", 1, 1, 6]]]], "r": [[0.00383372], 0, 0.874303, 1721785285], "v": "v0.6"}
{"i": [["[\"exp\", 61, 57, 85, 39]", "cuda -keys=cuda,gpu -arch=sm_80 -max_num_threads=1024 -thread_warp_size=32", [-1, 16, 64, 49152, 2147483647, 1024, 8, 32], "", 0, []], [[], [["FU", 1, [0, 1, 2, 3]], ["SP", 1, 0, 11526255, [24], 1], ["AN", 1, 0, 5], ["AN", 1, 1, 6]]]], "r": [[0.000800499], 0, 0.983285, 1721785285], "v": "v0.6"}
{"i": [["[\"exp\", 61, 57, 85, 39]", "cuda -keys=cuda,gpu -arch=sm_80 -max_num_threads=1024 -thread_warp_size=32", [-1, 16, 64, 49152, 2147483647, 1024, 8, 32], "", 0, []], [[], [["FU", 1, [0, 1, 2, 3]], ["SP", 1, 0, 11526255, [15], 1], ["AN", 1, 0, 5], ["AN", 1, 1, 6]]]], "r": [[0.00127287], 0, 0.978667, 1721785286], "v": "v0.6"}
{"i": [["[\"exp\", 61, 57, 85, 39]", "cuda -keys=cuda,gpu -arch=sm_80 -max_num_threads=1024 -thread_warp_size=32", [-1, 16, 64, 49152, 2147483647, 1024, 8, 32], "", 0, []], [[], [["FU", 1, [0, 1, 2, 3]], ["SP", 1, 0, 11526255, [12], 1], ["AN", 1, 0, 5], ["AN", 1, 1, 6]]]], "r": [[0.0015921], 0, 0.862673, 1721785287], "v": "v0.6"}
{"i": [["[\"exp\", 61, 57, 85, 39]", "cuda -keys=cuda,gpu -arch=sm_80 -max_num_threads=1024 -thread_warp_size=32", [-1, 16, 64, 49152, 2147483647, 1024, 8, 32], "", 0, []], [[], [["FU", 1, [0, 1, 2, 3]], ["SP", 1, 0, 11526255, [48], 1], ["AN", 1, 0, 5], ["AN", 1, 1, 6]]]], "r": [[0.000404657], 0, 0.984565, 1721785287], "v": "v0.6"}
{"i": [["[\"exp\", 61, 57, 85, 39]", "cuda -keys=cuda,gpu -arch=sm_80 -max_num_threads=1024 -thread_warp_size=32", [-1, 16, 64, 49152, 2147483647, 1024, 8, 32], "", 0, []], [[], [["FU", 1, [0, 1, 2, 3]], ["SP", 1, 0, 11526255, [51], 1], ["AN", 1, 0, 5], ["AN", 1, 1, 6]]]], "r": [[0.000381656], 0, 1.01525, 1721785288], "v": "v0.6"}
{"i": [["[\"exp\", 61, 57, 85, 39]", "cuda -keys=cuda,gpu -arch=sm_80 -max_num_threads=1024 -thread_warp_size=32", [-1, 16, 64, 49152, 2147483647, 1024, 8, 32], "", 0, []], [[], [["FU", 1, [0, 1, 2, 3]], ["SP", 1, 0, 11526255, [3], 1], ["AN", 1, 0, 5], ["AN", 1, 1, 6]]]], "r": [[0.00628495], 0, 0.874817, 1721785289], "v": "v0.6"}
