code_generation/generate/log/cuda/fast_tanh_cuda.log
{"i": [["[\"fast_tanh\", 64, 59, 96, 78]", "cuda -keys=cuda,gpu -arch=sm_80 -max_num_threads=1024 -thread_warp_size=32", [-1, 16, 64, 49152, 2147483647, 1024, 8, 32], "", 0, []], [[], [["CI", 2], ["CI", 1], ["FU", 3, [0, 1, 2, 3]], ["SP", 3, 0, 28274688, [1], 1], ["AN", 3, 0, 5], ["AN", 3, 1, 6]]]], "r": [[0.0694187], 0, 2.01259, 1721638471], "v": "v0.6"}
{"i": [["[\"fast_tanh\", 64, 59, 96, 78]", "cuda -keys=cuda,gpu -arch=sm_80 -max_num_threads=1024 -thread_warp_size=32", [-1, 16, 64, 49152, 2147483647, 1024, 8, 32], "", 0, []], [[], [["CI", 2], ["CI", 1], ["FU", 3, [0, 1, 2, 3]], ["SP", 3, 0, 28274688, [9], 1], ["AN", 3, 0, 5], ["AN", 3, 1, 6]]]], "r": [[0.0075196], 0, 1.54408, 1721638472], "v": "v0.6"}
{"i": [["[\"fast_tanh\", 64, 59, 96, 78]", "cuda -keys=cuda,gpu -arch=sm_80 -max_num_threads=1024 -thread_warp_size=32", [-1, 16, 64, 49152, 2147483647, 1024, 8, 32], "", 0, []], [[], [["CI", 2], ["CI", 1], ["FU", 3, [0, 1, 2, 3]], ["SP", 3, 0, 28274688, [13], 1], ["AN", 3, 0, 5], ["AN", 3, 1, 6]]]], "r": [[0.00532275], 0, 1.53017, 1721638473], "v": "v0.6"}
{"i": [["[\"fast_tanh\", 64, 59, 96, 78]", "cuda -keys=cuda,gpu -arch=sm_80 -max_num_threads=1024 -thread_warp_size=32", [-1, 16, 64, 49152, 2147483647, 1024, 8, 32], "", 0, []], [[], [["CI", 2], ["CI", 1], ["FU", 3, [0, 1, 2, 3]], ["SP", 3, 0, 28274688, [16], 1], ["AN", 3, 0, 5], ["AN", 3, 1, 6]]]], "r": [[0.00302487], 0, 1.55438, 1721638474], "v": "v0.6"}
{"i": [["[\"fast_tanh\", 64, 59, 96, 78]", "cuda -keys=cuda,gpu -arch=sm_80 -max_num_threads=1024 -thread_warp_size=32", [-1, 16, 64, 49152, 2147483647, 1024, 8, 32], "", 0, []], [[], [["CI", 2], ["CI", 1], ["FU", 3, [0, 1, 2, 3]], ["SP", 3, 0, 28274688, [2], 1], ["AN", 3, 0, 5], ["AN", 3, 1, 6]]]], "r": [[0.0347136], 0, 1.54144, 1721638476], "v": "v0.6"}
{"i": [["[\"fast_tanh\", 64, 59, 96, 78]", "cuda -keys=cuda,gpu -arch=sm_80 -max_num_threads=1024 -thread_warp_size=32", [-1, 16, 64, 49152, 2147483647, 1024, 8, 32], "", 0, []], [[], [["CI", 2], ["CI", 1], ["FU", 3, [0, 1, 2, 3]], ["SP", 3, 0, 28274688, [36], 1], ["AN", 3, 0, 5], ["AN", 3, 1, 6]]]], "r": [[0.00132024], 0, 1.62315, 1721638477], "v": "v0.6"}
{"i": [["[\"fast_tanh\", 64, 59, 96, 78]", "cuda -keys=cuda,gpu -arch=sm_80 -max_num_threads=1024 -thread_warp_size=32", [-1, 16, 64, 49152, 2147483647, 1024, 8, 32], "", 0, []], [[], [["CI", 2], ["CI", 1], ["FU", 3, [0, 1, 2, 3]], ["SP", 3, 0, 28274688, [64], 1], ["AN", 3, 0, 5], ["AN", 3, 1, 6]]]], "r": [[0.000738752], 0, 1.61182, 1721638478], "v": "v0.6"}
{"i": [["[\"fast_tanh\", 64, 59, 96, 78]", "cuda -keys=cuda,gpu -arch=sm_80 -max_num_threads=1024 -thread_warp_size=32", [-1, 16, 64, 49152, 2147483647, 1024, 8, 32], "", 0, []], [[], [["CI", 2], ["CI", 1], ["FU", 3, [0, 1, 2, 3]], ["SP", 3, 0, 28274688, [18], 1], ["AN", 3, 0, 5], ["AN", 3, 1, 6]]]], "r": [[0.00260248], 0, 1.52631, 1721638480], "v": "v0.6"}
{"i": [["[\"fast_tanh\", 64, 59, 96, 78]", "cuda -keys=cuda,gpu -arch=sm_80 -max_num_threads=1024 -thread_warp_size=32", [-1, 16, 64, 49152, 2147483647, 1024, 8, 32], "", 0, []], [[], [["CI", 2], ["CI", 1], ["FU", 3, [0, 1, 2, 3]], ["SP", 3, 0, 28274688, [26], 1], ["AN", 3, 0, 5], ["AN", 3, 1, 6]]]], "r": [[0.00179282], 0, 1.51154, 1721638481], "v": "v0.6"}
{"i": [["[\"fast_tanh\", 64, 59, 96, 78]", "cuda -keys=cuda,gpu -arch=sm_80 -max_num_threads=1024 -thread_warp_size=32", [-1, 16, 64, 49152, 2147483647, 1024, 8, 32], "", 0, []], [[], [["CI", 2], ["CI", 1], ["FU", 3, [0, 1, 2, 3]], ["SP", 3, 0, 28274688, [59], 1], ["AN", 3, 0, 5], ["AN", 3, 1, 6]]]], "r": [[0.000799098], 0, 1.60802, 1721638482], "v": "v0.6"}
