code_generation/generate/log/cuda/fast_erf_cuda.log
{"i": [["[\"fast_erf\", 40, 59, 67, 38]", "cuda -keys=cuda,gpu -arch=sm_80 -max_num_threads=1024 -thread_warp_size=32", [-1, 16, 64, 49152, 2147483647, 1024, 8, 32], "", 0, []], [[], [["FU", 1, [0, 1, 2, 3]], ["SP", 1, 0, 6008560, [19], 1], ["AN", 1, 0, 5], ["AN", 1, 1, 6]]]], "r": [[0.000531182], 0, 1.27562, 1721785653], "v": "v0.6"}
{"i": [["[\"fast_erf\", 40, 59, 67, 38]", "cuda -keys=cuda,gpu -arch=sm_80 -max_num_threads=1024 -thread_warp_size=32", [-1, 16, 64, 49152, 2147483647, 1024, 8, 32], "", 0, []], [[], [["FU", 1, [0, 1, 2, 3]], ["SP", 1, 0, 6008560, [10], 1], ["AN", 1, 0, 5], ["AN", 1, 1, 6]]]], "r": [[0.000998496], 0, 0.973557, 1721785653], "v": "v0.6"}
{"i": [["[\"fast_erf\", 40, 59, 67, 38]", "cuda -keys=cuda,gpu -arch=sm_80 -max_num_threads=1024 -thread_warp_size=32", [-1, 16, 64, 49152, 2147483647, 1024, 8, 32], "", 0, []], [[], [["FU", 1, [0, 1, 2, 3]], ["SP", 1, 0, 6008560, [16], 1], ["AN", 1, 0, 5], ["AN", 1, 1, 6]]]], "r": [[0.000629783], 0, 0.830519, 1721785654], "v": "v0.6"}
{"i": [["[\"fast_erf\", 40, 59, 67, 38]", "cuda -keys=cuda,gpu -arch=sm_80 -max_num_threads=1024 -thread_warp_size=32", [-1, 16, 64, 49152, 2147483647, 1024, 8, 32], "", 0, []], [[], [["FU", 1, [0, 1, 2, 3]], ["SP", 1, 0, 6008560, [20], 1], ["AN", 1, 0, 5], ["AN", 1, 1, 6]]]], "r": [[0.00050587], 0, 0.96058, 1721785654], "v": "v0.6"}
{"i": [["[\"fast_erf\", 40, 59, 67, 38]", "cuda -keys=cuda,gpu -arch=sm_80 -max_num_threads=1024 -thread_warp_size=32", [-1, 16, 64, 49152, 2147483647, 1024, 8, 32], "", 0, []], [[], [["FU", 1, [0, 1, 2, 3]], ["SP", 1, 0, 6008560, [59], 1], ["AN", 1, 0, 5], ["AN", 1, 1, 6]]]], "r": [[0.000176929], 0, 0.949442, 1721785655], "v": "v0.6"}
{"i": [["[\"fast_erf\", 40, 59, 67, 38]", "cuda -keys=cuda,gpu -arch=sm_80 -max_num_threads=1024 -thread_warp_size=32", [-1, 16, 64, 49152, 2147483647, 1024, 8, 32], "", 0, []], [[], [["FU", 1, [0, 1, 2, 3]], ["SP", 1, 0, 6008560, [2], 1], ["AN", 1, 0, 5], ["AN", 1, 1, 6]]]], "r": [[0.00489521], 0, 0.862833, 1721785656], "v": "v0.6"}
