code_generation/generate/log/cuda/flip_cuda.log
{"i": [["[\"flip\", 76, 66, 75, 39]", "cuda -keys=cuda,gpu -arch=sm_80 -max_num_threads=1024 -thread_warp_size=32", [-1, 16, 64, 49152, 2147483647, 1024, 8, 32], "", 0, []], [[], [["FU", 1, [0, 1, 2, 3]], ["SP", 1, 0, 14671800, [13], 1], ["AN", 1, 0, 5], ["AN", 1, 1, 6]]]], "r": [[0.00282154], 0, 1.63781, 1721638674], "v": "v0.6"}
{"i": [["[\"flip\", 76, 66, 75, 39]", "cuda -keys=cuda,gpu -arch=sm_80 -max_num_threads=1024 -thread_warp_size=32", [-1, 16, 64, 49152, 2147483647, 1024, 8, 32], "", 0, []], [[], [["FU", 1, [0, 1, 2, 3]], ["SP", 1, 0, 14671800, [18], 1], ["AN", 1, 0, 5], ["AN", 1, 1, 6]]]], "r": [[0.00201549], 0, 1.24018, 1721638675], "v": "v0.6"}
{"i": [["[\"flip\", 76, 66, 75, 39]", "cuda -keys=cuda,gpu -arch=sm_80 -max_num_threads=1024 -thread_warp_size=32", [-1, 16, 64, 49152, 2147483647, 1024, 8, 32], "", 0, []], [[], [["FU", 1, [0, 1, 2, 3]], ["SP", 1, 0, 14671800, [27], 1], ["AN", 1, 0, 5], ["AN", 1, 1, 6]]]], "r": [[0.001351], 0, 1.24137, 1721638676], "v": "v0.6"}
{"i": [["[\"flip\", 76, 66, 75, 39]", "cuda -keys=cuda,gpu -arch=sm_80 -max_num_threads=1024 -thread_warp_size=32", [-1, 16, 64, 49152, 2147483647, 1024, 8, 32], "", 0, []], [[], [["FU", 1, [0, 1, 2, 3]], ["SP", 1, 0, 14671800, [38], 1], ["AN", 1, 0, 5], ["AN", 1, 1, 6]]]], "r": [[0.000964709], 0, 1.25107, 1721638677], "v": "v0.6"}
{"i": [["[\"flip\", 76, 66, 75, 39]", "cuda -keys=cuda,gpu -arch=sm_80 -max_num_threads=1024 -thread_warp_size=32", [-1, 16, 64, 49152, 2147483647, 1024, 8, 32], "", 0, []], [[], [["FU", 1, [0, 1, 2, 3]], ["SP", 1, 0, 14671800, [30], 1], ["AN", 1, 0, 5], ["AN", 1, 1, 6]]]], "r": [[0.00121773], 0, 1.24342, 1721638678], "v": "v0.6"}
{"i": [["[\"flip\", 76, 66, 75, 39]", "cuda -keys=cuda,gpu -arch=sm_80 -max_num_threads=1024 -thread_warp_size=32", [-1, 16, 64, 49152, 2147483647, 1024, 8, 32], "", 0, []], [[], [["FU", 1, [0, 1, 2, 3]], ["SP", 1, 0, 14671800, [2], 1], ["AN", 1, 0, 5], ["AN", 1, 1, 6]]]], "r": [[0.017492], 0, 1.08603, 1721638679], "v": "v0.6"}
{"i": [["[\"flip\", 76, 66, 75, 39]", "cuda -keys=cuda,gpu -arch=sm_80 -max_num_threads=1024 -thread_warp_size=32", [-1, 16, 64, 49152, 2147483647, 1024, 8, 32], "", 0, []], [[], [["FU", 1, [0, 1, 2, 3]], ["SP", 1, 0, 14671800, [4], 1], ["AN", 1, 0, 5], ["AN", 1, 1, 6]]]], "r": [[0.0089284], 0, 1.05633, 1721638680], "v": "v0.6"}
{"i": [["[\"flip\", 76, 66, 75, 39]", "cuda -keys=cuda,gpu -arch=sm_80 -max_num_threads=1024 -thread_warp_size=32", [-1, 16, 64, 49152, 2147483647, 1024, 8, 32], "", 0, []], [[], [["FU", 1, [0, 1, 2, 3]], ["SP", 1, 0, 14671800, [25], 1], ["AN", 1, 0, 5], ["AN", 1, 1, 6]]]], "r": [[0.00145817], 0, 1.23353, 1721638681], "v": "v0.6"}
{"i": [["[\"flip\", 76, 66, 75, 39]", "cuda -keys=cuda,gpu -arch=sm_80 -max_num_threads=1024 -thread_warp_size=32", [-1, 16, 64, 49152, 2147483647, 1024, 8, 32], "", 0, []], [[], [["FU", 1, [0, 1, 2, 3]], ["SP", 1, 0, 14671800, [54], 1], ["AN", 1, 0, 5], ["AN", 1, 1, 6]]]], "r": [[0.000683592], 0, 1.23641, 1721638682], "v": "v0.6"}
{"i": [["[\"flip\", 76, 66, 75, 39]", "cuda -keys=cuda,gpu -arch=sm_80 -max_num_threads=1024 -thread_warp_size=32", [-1, 16, 64, 49152, 2147483647, 1024, 8, 32], "", 0, []], [[], [["FU", 1, [0, 1, 2, 3]], ["SP", 1, 0, 14671800, [33], 1], ["AN", 1, 0, 5], ["AN", 1, 1, 6]]]], "r": [[0.00110899], 0, 1.23961, 1721638683], "v": "v0.6"}
