code_generation/generate/log/cuda/isnan_cuda.log
{"i": [["[\"isnan\", 36, 46, 46, 42]", "cuda -keys=cuda,gpu -arch=sm_80 -max_num_threads=1024 -thread_warp_size=32", [-1, 16, 64, 49152, 2147483647, 1024, 8, 32], "", 0, []], [[], [["FU", 1, [0, 1, 2, 3]], ["SP", 1, 0, 3199392, [46], 1], ["AN", 1, 0, 5], ["AN", 1, 1, 6]]]], "r": [[0.000118656], 0, 1.01024, 1721639002], "v": "v0.6"}
{"i": [["[\"isnan\", 36, 46, 46, 42]", "cuda -keys=cuda,gpu -arch=sm_80 -max_num_threads=1024 -thread_warp_size=32", [-1, 16, 64, 49152, 2147483647, 1024, 8, 32], "", 0, []], [[], [["FU", 1, [0, 1, 2, 3]], ["SP", 1, 0, 3199392, [8], 1], ["AN", 1, 0, 5], ["AN", 1, 1, 6]]]], "r": [[0.000665864], 0, 0.678692, 1721639002], "v": "v0.6"}
{"i": [["[\"isnan\", 36, 46, 46, 42]", "cuda -keys=cuda,gpu -arch=sm_80 -max_num_threads=1024 -thread_warp_size=32", [-1, 16, 64, 49152, 2147483647, 1024, 8, 32], "", 0, []], [[], [["FU", 1, [0, 1, 2, 3]], ["SP", 1, 0, 3199392, [42], 1], ["AN", 1, 0, 5], ["AN", 1, 1, 6]]]], "r": [[0.000130713], 0, 0.688408, 1721639003], "v": "v0.6"}
{"i": [["[\"isnan\", 36, 46, 46, 42]", "cuda -keys=cuda,gpu -arch=sm_80 -max_num_threads=1024 -thread_warp_size=32", [-1, 16, 64, 49152, 2147483647, 1024, 8, 32], "", 0, []], [[], [["FU", 1, [0, 1, 2, 3]], ["SP", 1, 0, 3199392, [9], 1], ["AN", 1, 0, 5], ["AN", 1, 1, 6]]]], "r": [[0.000592395], 0, 0.678845, 1721639003], "v": "v0.6"}
{"i": [["[\"isnan\", 36, 46, 46, 42]", "cuda -keys=cuda,gpu -arch=sm_80 -max_num_threads=1024 -thread_warp_size=32", [-1, 16, 64, 49152, 2147483647, 1024, 8, 32], "", 0, []], [[], [["FU", 1, [0, 1, 2, 3]], ["SP", 1, 0, 3199392, [36], 1], ["AN", 1, 0, 5], ["AN", 1, 1, 6]]]], "r": [[0.000149921], 0, 0.67048, 1721639003], "v": "v0.6"}
{"i": [["[\"isnan\", 36, 46, 46, 42]", "cuda -keys=cuda,gpu -arch=sm_80 -max_num_threads=1024 -thread_warp_size=32", [-1, 16, 64, 49152, 2147483647, 1024, 8, 32], "", 0, []], [[], [["FU", 1, [0, 1, 2, 3]], ["SP", 1, 0, 3199392, [16], 1], ["AN", 1, 0, 5], ["AN", 1, 1, 6]]]], "r": [[0.000336681], 0, 0.678939, 1721639004], "v": "v0.6"}
{"i": [["[\"isnan\", 36, 46, 46, 42]", "cuda -keys=cuda,gpu -arch=sm_80 -max_num_threads=1024 -thread_warp_size=32", [-1, 16, 64, 49152, 2147483647, 1024, 8, 32], "", 0, []], [[], [["FU", 1, [0, 1, 2, 3]], ["SP", 1, 0, 3199392, [23], 1], ["AN", 1, 0, 5], ["AN", 1, 1, 6]]]], "r": [[0.000234051], 0, 0.669448, 1721639004], "v": "v0.6"}
{"i": [["[\"isnan\", 36, 46, 46, 42]", "cuda -keys=cuda,gpu -arch=sm_80 -max_num_threads=1024 -thread_warp_size=32", [-1, 16, 64, 49152, 2147483647, 1024, 8, 32], "", 0, []], [[], [["FU", 1, [0, 1, 2, 3]], ["SP", 1, 0, 3199392, [6], 1], ["AN", 1, 0, 5], ["AN", 1, 1, 6]]]], "r": [[0.000884842], 0, 0.677889, 1721639005], "v": "v0.6"}
{"i": [["[\"isnan\", 36, 46, 46, 42]", "cuda -keys=cuda,gpu -arch=sm_80 -max_num_threads=1024 -thread_warp_size=32", [-1, 16, 64, 49152, 2147483647, 1024, 8, 32], "", 0, []], [[], [["FU", 1, [0, 1, 2, 3]], ["SP", 1, 0, 3199392, [18], 1], ["AN", 1, 0, 5], ["AN", 1, 1, 6]]]], "r": [[0.000299815], 0, 0.666629, 1721639005], "v": "v0.6"}
{"i": [["[\"isnan\", 36, 46, 46, 42]", "cuda -keys=cuda,gpu -arch=sm_80 -max_num_threads=1024 -thread_warp_size=32", [-1, 16, 64, 49152, 2147483647, 1024, 8, 32], "", 0, []], [[], [["FU", 1, [0, 1, 2, 3]], ["SP", 1, 0, 3199392, [7], 1], ["AN", 1, 0, 5], ["AN", 1, 1, 6]]]], "r": [[0.000759317], 0, 0.67972, 1721639005], "v": "v0.6"}
