code_generation/generate/log/cuda/log2_cuda.log
{"i": [["[\"log2\", 72, 87, 76, 98]", "cuda -keys=cuda,gpu -arch=sm_80 -max_num_threads=1024 -thread_warp_size=32", [-1, 16, 64, 49152, 2147483647, 1024, 8, 32], "", 0, []], [[], [["FU", 1, [0, 1, 2, 3]], ["SP", 1, 0, 46654272, [32], 1], ["AN", 1, 0, 5], ["AN", 1, 1, 6]]]], "r": [[0.00241528], 0, 2.7084, 1721639429], "v": "v0.6"}
{"i": [["[\"log2\", 72, 87, 76, 98]", "cuda -keys=cuda,gpu -arch=sm_80 -max_num_threads=1024 -thread_warp_size=32", [-1, 16, 64, 49152, 2147483647, 1024, 8, 32], "", 0, []], [[], [["FU", 1, [0, 1, 2, 3]], ["SP", 1, 0, 46654272, [63], 1], ["AN", 1, 0, 5], ["AN", 1, 1, 6]]]], "r": [[0.00123339], 0, 2.29012, 1721639431], "v": "v0.6"}
{"i": [["[\"log2\", 72, 87, 76, 98]", "cuda -keys=cuda,gpu -arch=sm_80 -max_num_threads=1024 -thread_warp_size=32", [-1, 16, 64, 49152, 2147483647, 1024, 8, 32], "", 0, []], [[], [["FU", 1, [0, 1, 2, 3]], ["SP", 1, 0, 46654272, [1], 1], ["AN", 1, 0, 5], ["AN", 1, 1, 6]]]], "r": [[0.0769758], 0, 2.36309, 1721639434], "v": "v0.6"}
{"i": [["[\"log2\", 72, 87, 76, 98]", "cuda -keys=cuda,gpu -arch=sm_80 -max_num_threads=1024 -thread_warp_size=32", [-1, 16, 64, 49152, 2147483647, 1024, 8, 32], "", 0, []], [[], [["FU", 1, [0, 1, 2, 3]], ["SP", 1, 0, 46654272, [36], 1], ["AN", 1, 0, 5], ["AN", 1, 1, 6]]]], "r": [[0.00213063], 0, 2.17561, 1721639435], "v": "v0.6"}
{"i": [["[\"log2\", 72, 87, 76, 98]", "cuda -keys=cuda,gpu -arch=sm_80 -max_num_threads=1024 -thread_warp_size=32", [-1, 16, 64, 49152, 2147483647, 1024, 8, 32], "", 0, []], [[], [["FU", 1, [0, 1, 2, 3]], ["SP", 1, 0, 46654272, [54], 1], ["AN", 1, 0, 5], ["AN", 1, 1, 6]]]], "r": [[0.00216634], 0, 2.4258, 1721639438], "v": "v0.6"}
{"i": [["[\"log2\", 72, 87, 76, 98]", "cuda -keys=cuda,gpu -arch=sm_80 -max_num_threads=1024 -thread_warp_size=32", [-1, 16, 64, 49152, 2147483647, 1024, 8, 32], "", 0, []], [[], [["FU", 1, [0, 1, 2, 3]], ["SP", 1, 0, 46654272, [9], 1], ["AN", 1, 0, 5], ["AN", 1, 1, 6]]]], "r": [[0.0124613], 0, 2.2261, 1721639439], "v": "v0.6"}
{"i": [["[\"log2\", 72, 87, 76, 98]", "cuda -keys=cuda,gpu -arch=sm_80 -max_num_threads=1024 -thread_warp_size=32", [-1, 16, 64, 49152, 2147483647, 1024, 8, 32], "", 0, []], [[], [["FU", 1, [0, 1, 2, 3]], ["SP", 1, 0, 46654272, [64], 1], ["AN", 1, 0, 5], ["AN", 1, 1, 6]]]], "r": [[0.00121339], 0, 2.32073, 1721639442], "v": "v0.6"}
{"i": [["[\"log2\", 72, 87, 76, 98]", "cuda -keys=cuda,gpu -arch=sm_80 -max_num_threads=1024 -thread_warp_size=32", [-1, 16, 64, 49152, 2147483647, 1024, 8, 32], "", 0, []], [[], [["FU", 1, [0, 1, 2, 3]], ["SP", 1, 0, 46654272, [21], 1], ["AN", 1, 0, 5], ["AN", 1, 1, 6]]]], "r": [[0.00369995], 0, 2.17767, 1721639443], "v": "v0.6"}
{"i": [["[\"log2\", 72, 87, 76, 98]", "cuda -keys=cuda,gpu -arch=sm_80 -max_num_threads=1024 -thread_warp_size=32", [-1, 16, 64, 49152, 2147483647, 1024, 8, 32], "", 0, []], [[], [["FU", 1, [0, 1, 2, 3]], ["SP", 1, 0, 46654272, [24], 1], ["AN", 1, 0, 5], ["AN", 1, 1, 6]]]], "r": [[0.00320598], 0, 2.16002, 1721639445], "v": "v0.6"}
{"i": [["[\"log2\", 72, 87, 76, 98]", "cuda -keys=cuda,gpu -arch=sm_80 -max_num_threads=1024 -thread_warp_size=32", [-1, 16, 64, 49152, 2147483647, 1024, 8, 32], "", 0, []], [[], [["FU", 1, [0, 1, 2, 3]], ["SP", 1, 0, 46654272, [14], 1], ["AN", 1, 0, 5], ["AN", 1, 1, 6]]]], "r": [[0.00554711], 0, 2.17435, 1721639447], "v": "v0.6"}
