code_generation/generate/log/cuda/log_cuda.log
{"i": [["[\"log\", 78, 54, 90, 46]", "cuda -keys=cuda,gpu -arch=sm_80 -max_num_threads=1024 -thread_warp_size=32", [-1, 16, 64, 49152, 2147483647, 1024, 8, 32], "", 0, []], [[], [["FU", 1, [0, 1, 2, 3]], ["SP", 1, 0, 17437680, [40], 1], ["AN", 1, 0, 5], ["AN", 1, 1, 6]]]], "r": [[0.000728057], 0, 1.72219, 1721639153], "v": "v0.6"}
{"i": [["[\"log\", 78, 54, 90, 46]", "cuda -keys=cuda,gpu -arch=sm_80 -max_num_threads=1024 -thread_warp_size=32", [-1, 16, 64, 49152, 2147483647, 1024, 8, 32], "", 0, []], [[], [["FU", 1, [0, 1, 2, 3]], ["SP", 1, 0, 17437680, [48], 1], ["AN", 1, 0, 5], ["AN", 1, 1, 6]]]], "r": [[0.000608925], 0, 1.21785, 1721639154], "v": "v0.6"}
{"i": [["[\"log\", 78, 54, 90, 46]", "cuda -keys=cuda,gpu -arch=sm_80 -max_num_threads=1024 -thread_warp_size=32", [-1, 16, 64, 49152, 2147483647, 1024, 8, 32], "", 0, []], [[], [["FU", 1, [0, 1, 2, 3]], ["SP", 1, 0, 17437680, [10], 1], ["AN", 1, 0, 5], ["AN", 1, 1, 6]]]], "r": [[0.00287324], 0, 1.12035, 1721639155], "v": "v0.6"}
{"i": [["[\"log\", 78, 54, 90, 46]", "cuda -keys=cuda,gpu -arch=sm_80 -max_num_threads=1024 -thread_warp_size=32", [-1, 16, 64, 49152, 2147483647, 1024, 8, 32], "", 0, []], [[], [["FU", 1, [0, 1, 2, 3]], ["SP", 1, 0, 17437680, [60], 1], ["AN", 1, 0, 5], ["AN", 1, 1, 6]]]], "r": [[0.000487552], 0, 1.20282, 1721639156], "v": "v0.6"}
{"i": [["[\"log\", 78, 54, 90, 46]", "cuda -keys=cuda,gpu -arch=sm_80 -max_num_threads=1024 -thread_warp_size=32", [-1, 16, 64, 49152, 2147483647, 1024, 8, 32], "", 0, []], [[], [["FU", 1, [0, 1, 2, 3]], ["SP", 1, 0, 17437680, [23], 1], ["AN", 1, 0, 5], ["AN", 1, 1, 6]]]], "r": [[0.00125987], 0, 1.21221, 1721639157], "v": "v0.6"}
{"i": [["[\"log\", 78, 54, 90, 46]", "cuda -keys=cuda,gpu -arch=sm_80 -max_num_threads=1024 -thread_warp_size=32", [-1, 16, 64, 49152, 2147483647, 1024, 8, 32], "", 0, []], [[], [["FU", 1, [0, 1, 2, 3]], ["SP", 1, 0, 17437680, [12], 1], ["AN", 1, 0, 5], ["AN", 1, 1, 6]]]], "r": [[0.00240729], 0, 1.11633, 1721639157], "v": "v0.6"}
{"i": [["[\"log\", 78, 54, 90, 46]", "cuda -keys=cuda,gpu -arch=sm_80 -max_num_threads=1024 -thread_warp_size=32", [-1, 16, 64, 49152, 2147483647, 1024, 8, 32], "", 0, []], [[], [["FU", 1, [0, 1, 2, 3]], ["SP", 1, 0, 17437680, [54], 1], ["AN", 1, 0, 5], ["AN", 1, 1, 6]]]], "r": [[0.000542072], 0, 1.20403, 1721639158], "v": "v0.6"}
{"i": [["[\"log\", 78, 54, 90, 46]", "cuda -keys=cuda,gpu -arch=sm_80 -max_num_threads=1024 -thread_warp_size=32", [-1, 16, 64, 49152, 2147483647, 1024, 8, 32], "", 0, []], [[], [["FU", 1, [0, 1, 2, 3]], ["SP", 1, 0, 17437680, [13], 1], ["AN", 1, 0, 5], ["AN", 1, 1, 6]]]], "r": [[0.00222999], 0, 1.10933, 1721639159], "v": "v0.6"}
{"i": [["[\"log\", 78, 54, 90, 46]", "cuda -keys=cuda,gpu -arch=sm_80 -max_num_threads=1024 -thread_warp_size=32", [-1, 16, 64, 49152, 2147483647, 1024, 8, 32], "", 0, []], [[], [["FU", 1, [0, 1, 2, 3]], ["SP", 1, 0, 17437680, [15], 1], ["AN", 1, 0, 5], ["AN", 1, 1, 6]]]], "r": [[0.00190589], 0, 1.10753, 1721639160], "v": "v0.6"}
{"i": [["[\"log\", 78, 54, 90, 46]", "cuda -keys=cuda,gpu -arch=sm_80 -max_num_threads=1024 -thread_warp_size=32", [-1, 16, 64, 49152, 2147483647, 1024, 8, 32], "", 0, []], [[], [["FU", 1, [0, 1, 2, 3]], ["SP", 1, 0, 17437680, [9], 1], ["AN", 1, 0, 5], ["AN", 1, 1, 6]]]], "r": [[0.00319798], 0, 1.09876, 1721639161], "v": "v0.6"}
