code_generation/generate/log/cuda/multi_out_op_cuda.log
{"i": [["[\"multi_out_op\", 45, 55, 99, 96]", "cuda -keys=cuda,gpu -arch=sm_80 -max_num_threads=1024 -thread_warp_size=32", [-1, 16, 64, 49152, 2147483647, 1024, 8, 32], "", 0, []], [[], [["CI", 2], ["FU", 4, [0, 1, 2, 3]], ["SP", 4, 0, 23522400, [8], 1], ["AN", 4, 0, 5], ["AN", 4, 1, 6], ["FU", 3, [0, 1, 2, 3]], ["SP", 3, 0, 23522400, [4], 1], ["AN", 3, 0, 5], ["AN", 3, 1, 6]]]], "r": [[0.0145151], 0, 2.8319, 1721642114], "v": "v0.6"}
{"i": [["[\"multi_out_op\", 45, 55, 99, 96]", "cuda -keys=cuda,gpu -arch=sm_80 -max_num_threads=1024 -thread_warp_size=32", [-1, 16, 64, 49152, 2147483647, 1024, 8, 32], "", 0, []], [[], [["CI", 2], ["FU", 4, [0, 1, 2, 3]], ["SP", 4, 0, 23522400, [2], 1], ["AN", 4, 0, 5], ["AN", 4, 1, 6], ["FU", 3, [0, 1, 2, 3]], ["SP", 3, 0, 23522400, [11], 1], ["AN", 3, 0, 5], ["AN", 3, 1, 6]]]], "r": [[0.0344102], 0, 2.24547, 1721642116], "v": "v0.6"}
{"i": [["[\"multi_out_op\", 45, 55, 99, 96]", "cuda -keys=cuda,gpu -arch=sm_80 -max_num_threads=1024 -thread_warp_size=32", [-1, 16, 64, 49152, 2147483647, 1024, 8, 32], "", 0, []], [[], [["CI", 2], ["FU", 4, [0, 1, 2, 3]], ["SP", 4, 0, 23522400, [2], 1], ["AN", 4, 0, 5], ["AN", 4, 1, 6], ["FU", 3, [0, 1, 2, 3]], ["SP", 3, 0, 23522400, [16], 1], ["AN", 3, 0, 5], ["AN", 3, 1, 6]]]], "r": [[0.021503], 0, 2.31313, 1721642118], "v": "v0.6"}
{"i": [["[\"multi_out_op\", 45, 55, 99, 96]", "cuda -keys=cuda,gpu -arch=sm_80 -max_num_threads=1024 -thread_warp_size=32", [-1, 16, 64, 49152, 2147483647, 1024, 8, 32], "", 0, []], [[], [["CI", 2], ["FU", 4, [0, 1, 2, 3]], ["SP", 4, 0, 23522400, [54], 1], ["AN", 4, 0, 5], ["AN", 4, 1, 6], ["FU", 3, [0, 1, 2, 3]], ["SP", 3, 0, 23522400, [4], 1], ["AN", 3, 0, 5], ["AN", 3, 1, 6]]]], "r": [[0.0147656], 0, 2.28488, 1721642120], "v": "v0.6"}
{"i": [["[\"multi_out_op\", 45, 55, 99, 96]", "cuda -keys=cuda,gpu -arch=sm_80 -max_num_threads=1024 -thread_warp_size=32", [-1, 16, 64, 49152, 2147483647, 1024, 8, 32], "", 0, []], [[], [["CI", 2], ["FU", 4, [0, 1, 2, 3]], ["SP", 4, 0, 23522400, [48], 1], ["AN", 4, 0, 5], ["AN", 4, 1, 6], ["FU", 3, [0, 1, 2, 3]], ["SP", 3, 0, 23522400, [8], 1], ["AN", 3, 0, 5], ["AN", 3, 1, 6]]]], "r": [[0.00562294], 0, 2.34748, 1721642122], "v": "v0.6"}
{"i": [["[\"multi_out_op\", 45, 55, 99, 96]", "cuda -keys=cuda,gpu -arch=sm_80 -max_num_threads=1024 -thread_warp_size=32", [-1, 16, 64, 49152, 2147483647, 1024, 8, 32], "", 0, []], [[], [["CI", 2], ["FU", 4, [0, 1, 2, 3]], ["SP", 4, 0, 23522400, [60], 1], ["AN", 4, 0, 5], ["AN", 4, 1, 6], ["FU", 3, [0, 1, 2, 3]], ["SP", 3, 0, 23522400, [32], 1], ["AN", 3, 0, 5], ["AN", 3, 1, 6]]]], "r": [[0.00273396], 0, 2.24073, 1721642124], "v": "v0.6"}
{"i": [["[\"multi_out_op\", 45, 55, 99, 96]", "cuda -keys=cuda,gpu -arch=sm_80 -max_num_threads=1024 -thread_warp_size=32", [-1, 16, 64, 49152, 2147483647, 1024, 8, 32], "", 0, []], [[], [["CI", 2], ["FU", 4, [0, 1, 2, 3]], ["SP", 4, 0, 23522400, [16], 1], ["AN", 4, 0, 5], ["AN", 4, 1, 6], ["FU", 3, [0, 1, 2, 3]], ["SP", 3, 0, 23522400, [12], 1], ["AN", 3, 0, 5], ["AN", 3, 1, 6]]]], "r": [[0.0056193], 0, 2.24073, 1721642125], "v": "v0.6"}
{"i": [["[\"multi_out_op\", 45, 55, 99, 96]", "cuda -keys=cuda,gpu -arch=sm_80 -max_num_threads=1024 -thread_warp_size=32", [-1, 16, 64, 49152, 2147483647, 1024, 8, 32], "", 0, []], [[], [["CI", 2], ["FU", 4, [0, 1, 2, 3]], ["SP", 4, 0, 23522400, [32], 1], ["AN", 4, 0, 5], ["AN", 4, 1, 6], ["FU", 3, [0, 1, 2, 3]], ["SP", 3, 0, 23522400, [8], 1], ["AN", 3, 0, 5], ["AN", 3, 1, 6]]]], "r": [[0.00609722], 0, 2.25257, 1721642127], "v": "v0.6"}
{"i": [["[\"multi_out_op\", 45, 55, 99, 96]", "cuda -keys=cuda,gpu -arch=sm_80 -max_num_threads=1024 -thread_warp_size=32", [-1, 16, 64, 49152, 2147483647, 1024, 8, 32], "", 0, []], [[], [["CI", 2], ["FU", 4, [0, 1, 2, 3]], ["SP", 4, 0, 23522400, [44], 1], ["AN", 4, 0, 5], ["AN", 4, 1, 6], ["FU", 3, [0, 1, 2, 3]], ["SP", 3, 0, 23522400, [16], 1], ["AN", 3, 0, 5], ["AN", 3, 1, 6]]]], "r": [[0.00501569], 0, 2.22705, 1721642129], "v": "v0.6"}
{"i": [["[\"multi_out_op\", 45, 55, 99, 96]", "cuda -keys=cuda,gpu -arch=sm_80 -max_num_threads=1024 -thread_warp_size=32", [-1, 16, 64, 49152, 2147483647, 1024, 8, 32], "", 0, []], [[], [["CI", 2], ["FU", 4, [0, 1, 2, 3]], ["SP", 4, 0, 23522400, [50], 1], ["AN", 4, 0, 5], ["AN", 4, 1, 6], ["FU", 3, [0, 1, 2, 3]], ["SP", 3, 0, 23522400, [32], 1], ["AN", 3, 0, 5], ["AN", 3, 1, 6]]]], "r": [[0.00348143], 0, 2.2634, 1721642131], "v": "v0.6"}
