code_generation/generate/log/cuda/negative_cuda.log
{"i": [["[\"negative\", 37, 34, 31, 88]", "cuda -keys=cuda,gpu -arch=sm_80 -max_num_threads=1024 -thread_warp_size=32", [-1, 16, 64, 49152, 2147483647, 1024, 8, 32], "", 0, []], [[], [["FU", 1, [0, 1, 2, 3]], ["SP", 1, 0, 3431824, [22], 1], ["AN", 1, 0, 5], ["AN", 1, 1, 6]]]], "r": [[0.00027488], 0, 1.1643, 1721639826], "v": "v0.6"}
{"i": [["[\"negative\", 37, 34, 31, 88]", "cuda -keys=cuda,gpu -arch=sm_80 -max_num_threads=1024 -thread_warp_size=32", [-1, 16, 64, 49152, 2147483647, 1024, 8, 32], "", 0, []], [[], [["FU", 1, [0, 1, 2, 3]], ["SP", 1, 0, 3431824, [32], 1], ["AN", 1, 0, 5], ["AN", 1, 1, 6]]]], "r": [[0.000274694], 0, 0.805635, 1721639826], "v": "v0.6"}
{"i": [["[\"negative\", 37, 34, 31, 88]", "cuda -keys=cuda,gpu -arch=sm_80 -max_num_threads=1024 -thread_warp_size=32", [-1, 16, 64, 49152, 2147483647, 1024, 8, 32], "", 0, []], [[], [["FU", 1, [0, 1, 2, 3]], ["SP", 1, 0, 3431824, [1], 1], ["AN", 1, 0, 5], ["AN", 1, 1, 6]]]], "r": [[0.00843747], 0, 0.624051, 1721639827], "v": "v0.6"}
{"i": [["[\"negative\", 37, 34, 31, 88]", "cuda -keys=cuda,gpu -arch=sm_80 -max_num_threads=1024 -thread_warp_size=32", [-1, 16, 64, 49152, 2147483647, 1024, 8, 32], "", 0, []], [[], [["FU", 1, [0, 1, 2, 3]], ["SP", 1, 0, 3431824, [31], 1], ["AN", 1, 0, 5], ["AN", 1, 1, 6]]]], "r": [[0.000244985], 0, 0.758126, 1721639827], "v": "v0.6"}
{"i": [["[\"negative\", 37, 34, 31, 88]", "cuda -keys=cuda,gpu -arch=sm_80 -max_num_threads=1024 -thread_warp_size=32", [-1, 16, 64, 49152, 2147483647, 1024, 8, 32], "", 0, []], [[], [["FU", 1, [0, 1, 2, 3]], ["SP", 1, 0, 3431824, [11], 1], ["AN", 1, 0, 5], ["AN", 1, 1, 6]]]], "r": [[0.000523764], 0, 0.677409, 1721639827], "v": "v0.6"}
{"i": [["[\"negative\", 37, 34, 31, 88]", "cuda -keys=cuda,gpu -arch=sm_80 -max_num_threads=1024 -thread_warp_size=32", [-1, 16, 64, 49152, 2147483647, 1024, 8, 32], "", 0, []], [[], [["FU", 1, [0, 1, 2, 3]], ["SP", 1, 0, 3431824, [62], 1], ["AN", 1, 0, 5], ["AN", 1, 1, 6]]]], "r": [[0.000145685], 0, 0.805523, 1721639828], "v": "v0.6"}
{"i": [["[\"negative\", 37, 34, 31, 88]", "cuda -keys=cuda,gpu -arch=sm_80 -max_num_threads=1024 -thread_warp_size=32", [-1, 16, 64, 49152, 2147483647, 1024, 8, 32], "", 0, []], [[], [["FU", 1, [0, 1, 2, 3]], ["SP", 1, 0, 3431824, [37], 1], ["AN", 1, 0, 5], ["AN", 1, 1, 6]]]], "r": [[0.000238076], 0, 0.803256, 1721639829], "v": "v0.6"}
{"i": [["[\"negative\", 37, 34, 31, 88]", "cuda -keys=cuda,gpu -arch=sm_80 -max_num_threads=1024 -thread_warp_size=32", [-1, 16, 64, 49152, 2147483647, 1024, 8, 32], "", 0, []], [[], [["FU", 1, [0, 1, 2, 3]], ["SP", 1, 0, 3431824, [8], 1], ["AN", 1, 0, 5], ["AN", 1, 1, 6]]]], "r": [[0.00106757], 0, 0.7976, 1721639829], "v": "v0.6"}
{"i": [["[\"negative\", 37, 34, 31, 88]", "cuda -keys=cuda,gpu -arch=sm_80 -max_num_threads=1024 -thread_warp_size=32", [-1, 16, 64, 49152, 2147483647, 1024, 8, 32], "", 0, []], [[], [["FU", 1, [0, 1, 2, 3]], ["SP", 1, 0, 3431824, [16], 1], ["AN", 1, 0, 5], ["AN", 1, 1, 6]]]], "r": [[0.00054299], 0, 0.796529, 1721639830], "v": "v0.6"}
{"i": [["[\"negative\", 37, 34, 31, 88]", "cuda -keys=cuda,gpu -arch=sm_80 -max_num_threads=1024 -thread_warp_size=32", [-1, 16, 64, 49152, 2147483647, 1024, 8, 32], "", 0, []], [[], [["FU", 1, [0, 1, 2, 3]], ["SP", 1, 0, 3431824, [44], 1], ["AN", 1, 0, 5], ["AN", 1, 1, 6]]]], "r": [[0.000177605], 0, 0.749636, 1721639830], "v": "v0.6"}
