code_generation/generate/log/cuda/sigmoid_cuda.log
{"i": [["[\"sigmoid\", 42, 30, 98, 97]", "cuda -keys=cuda,gpu -arch=sm_80 -max_num_threads=1024 -thread_warp_size=32", [-1, 16, 64, 49152, 2147483647, 1024, 8, 32], "", 0, []], [[], [["FU", 1, [0, 1, 2, 3]], ["SP", 1, 0, 11977560, [56], 1], ["AN", 1, 0, 5], ["AN", 1, 1, 6]]]], "r": [[0.000361657], 0, 1.36717, 1721640634], "v": "v0.6"}
{"i": [["[\"sigmoid\", 42, 30, 98, 97]", "cuda -keys=cuda,gpu -arch=sm_80 -max_num_threads=1024 -thread_warp_size=32", [-1, 16, 64, 49152, 2147483647, 1024, 8, 32], "", 0, []], [[], [["FU", 1, [0, 1, 2, 3]], ["SP", 1, 0, 11977560, [12], 1], ["AN", 1, 0, 5], ["AN", 1, 1, 6]]]], "r": [[0.00163422], 0, 0.893437, 1721640634], "v": "v0.6"}
{"i": [["[\"sigmoid\", 42, 30, 98, 97]", "cuda -keys=cuda,gpu -arch=sm_80 -max_num_threads=1024 -thread_warp_size=32", [-1, 16, 64, 49152, 2147483647, 1024, 8, 32], "", 0, []], [[], [["FU", 1, [0, 1, 2, 3]], ["SP", 1, 0, 11977560, [49], 1], ["AN", 1, 0, 5], ["AN", 1, 1, 6]]]], "r": [[0.000412775], 0, 1.00331, 1721640635], "v": "v0.6"}
{"i": [["[\"sigmoid\", 42, 30, 98, 97]", "cuda -keys=cuda,gpu -arch=sm_80 -max_num_threads=1024 -thread_warp_size=32", [-1, 16, 64, 49152, 2147483647, 1024, 8, 32], "", 0, []], [[], [["FU", 1, [0, 1, 2, 3]], ["SP", 1, 0, 11977560, [30], 1], ["AN", 1, 0, 5], ["AN", 1, 1, 6]]]], "r": [[0.000668857], 0, 1.01198, 1721640636], "v": "v0.6"}
{"i": [["[\"sigmoid\", 42, 30, 98, 97]", "cuda -keys=cuda,gpu -arch=sm_80 -max_num_threads=1024 -thread_warp_size=32", [-1, 16, 64, 49152, 2147483647, 1024, 8, 32], "", 0, []], [[], [["FU", 1, [0, 1, 2, 3]], ["SP", 1, 0, 11977560, [14], 1], ["AN", 1, 0, 5], ["AN", 1, 1, 6]]]], "r": [[0.00141876], 0, 1.01763, 1721640637], "v": "v0.6"}
{"i": [["[\"sigmoid\", 42, 30, 98, 97]", "cuda -keys=cuda,gpu -arch=sm_80 -max_num_threads=1024 -thread_warp_size=32", [-1, 16, 64, 49152, 2147483647, 1024, 8, 32], "", 0, []], [[], [["FU", 1, [0, 1, 2, 3]], ["SP", 1, 0, 11977560, [63], 1], ["AN", 1, 0, 5], ["AN", 1, 1, 6]]]], "r": [[0.00032233], 0, 1.00358, 1721640637], "v": "v0.6"}
{"i": [["[\"sigmoid\", 42, 30, 98, 97]", "cuda -keys=cuda,gpu -arch=sm_80 -max_num_threads=1024 -thread_warp_size=32", [-1, 16, 64, 49152, 2147483647, 1024, 8, 32], "", 0, []], [[], [["FU", 1, [0, 1, 2, 3]], ["SP", 1, 0, 11977560, [21], 1], ["AN", 1, 0, 5], ["AN", 1, 1, 6]]]], "r": [[0.000949213], 0, 1.00695, 1721640638], "v": "v0.6"}
{"i": [["[\"sigmoid\", 42, 30, 98, 97]", "cuda -keys=cuda,gpu -arch=sm_80 -max_num_threads=1024 -thread_warp_size=32", [-1, 16, 64, 49152, 2147483647, 1024, 8, 32], "", 0, []], [[], [["FU", 1, [0, 1, 2, 3]], ["SP", 1, 0, 11977560, [24], 1], ["AN", 1, 0, 5], ["AN", 1, 1, 6]]]], "r": [[0.000833992], 0, 1.00003, 1721640639], "v": "v0.6"}
{"i": [["[\"sigmoid\", 42, 30, 98, 97]", "cuda -keys=cuda,gpu -arch=sm_80 -max_num_threads=1024 -thread_warp_size=32", [-1, 16, 64, 49152, 2147483647, 1024, 8, 32], "", 0, []], [[], [["FU", 1, [0, 1, 2, 3]], ["SP", 1, 0, 11977560, [45], 1], ["AN", 1, 0, 5], ["AN", 1, 1, 6]]]], "r": [[0.000448605], 0, 1.00333, 1721640639], "v": "v0.6"}
{"i": [["[\"sigmoid\", 42, 30, 98, 97]", "cuda -keys=cuda,gpu -arch=sm_80 -max_num_threads=1024 -thread_warp_size=32", [-1, 16, 64, 49152, 2147483647, 1024, 8, 32], "", 0, []], [[], [["FU", 1, [0, 1, 2, 3]], ["SP", 1, 0, 11977560, [6], 1], ["AN", 1, 0, 5], ["AN", 1, 1, 6]]]], "r": [[0.00331542], 0, 0.900324, 1721640640], "v": "v0.6"}
