code_generation/generate/log/cuda/sign_cuda.log
{"i": [["[\"sign\", 53, 100, 52, 33]", "cuda -keys=cuda,gpu -arch=sm_80 -max_num_threads=1024 -thread_warp_size=32", [-1, 16, 64, 49152, 2147483647, 1024, 8, 32], "", 0, []], [[], [["FU", 1, [0, 1, 2, 3]], ["SP", 1, 0, 9094800, [26], 1], ["AN", 1, 0, 5], ["AN", 1, 1, 6]]]], "r": [[0.000874399], 0, 1.56896, 1721640826], "v": "v0.6"}
{"i": [["[\"sign\", 53, 100, 52, 33]", "cuda -keys=cuda,gpu -arch=sm_80 -max_num_threads=1024 -thread_warp_size=32", [-1, 16, 64, 49152, 2147483647, 1024, 8, 32], "", 0, []], [[], [["FU", 1, [0, 1, 2, 3]], ["SP", 1, 0, 9094800, [48], 1], ["AN", 1, 0, 5], ["AN", 1, 1, 6]]]], "r": [[0.000480867], 0, 1.01393, 1721640827], "v": "v0.6"}
{"i": [["[\"sign\", 53, 100, 52, 33]", "cuda -keys=cuda,gpu -arch=sm_80 -max_num_threads=1024 -thread_warp_size=32", [-1, 16, 64, 49152, 2147483647, 1024, 8, 32], "", 0, []], [[], [["FU", 1, [0, 1, 2, 3]], ["SP", 1, 0, 9094800, [53], 1], ["AN", 1, 0, 5], ["AN", 1, 1, 6]]]], "r": [[0.000451328], 0, 1.02947, 1721640828], "v": "v0.6"}
{"i": [["[\"sign\", 53, 100, 52, 33]", "cuda -keys=cuda,gpu -arch=sm_80 -max_num_threads=1024 -thread_warp_size=32", [-1, 16, 64, 49152, 2147483647, 1024, 8, 32], "", 0, []], [[], [["FU", 1, [0, 1, 2, 3]], ["SP", 1, 0, 9094800, [25], 1], ["AN", 1, 0, 5], ["AN", 1, 1, 6]]]], "r": [[0.000910448], 0, 1.01557, 1721640828], "v": "v0.6"}
{"i": [["[\"sign\", 53, 100, 52, 33]", "cuda -keys=cuda,gpu -arch=sm_80 -max_num_threads=1024 -thread_warp_size=32", [-1, 16, 64, 49152, 2147483647, 1024, 8, 32], "", 0, []], [[], [["FU", 1, [0, 1, 2, 3]], ["SP", 1, 0, 9094800, [33], 1], ["AN", 1, 0, 5], ["AN", 1, 1, 6]]]], "r": [[0.000691472], 0, 1.05618, 1721640829], "v": "v0.6"}
{"i": [["[\"sign\", 53, 100, 52, 33]", "cuda -keys=cuda,gpu -arch=sm_80 -max_num_threads=1024 -thread_warp_size=32", [-1, 16, 64, 49152, 2147483647, 1024, 8, 32], "", 0, []], [[], [["FU", 1, [0, 1, 2, 3]], ["SP", 1, 0, 9094800, [40], 1], ["AN", 1, 0, 5], ["AN", 1, 1, 6]]]], "r": [[0.000574061], 0, 1.01933, 1721640830], "v": "v0.6"}
{"i": [["[\"sign\", 53, 100, 52, 33]", "cuda -keys=cuda,gpu -arch=sm_80 -max_num_threads=1024 -thread_warp_size=32", [-1, 16, 64, 49152, 2147483647, 1024, 8, 32], "", 0, []], [[], [["FU", 1, [0, 1, 2, 3]], ["SP", 1, 0, 9094800, [44], 1], ["AN", 1, 0, 5], ["AN", 1, 1, 6]]]], "r": [[0.000523074], 0, 1.01325, 1721640831], "v": "v0.6"}
{"i": [["[\"sign\", 53, 100, 52, 33]", "cuda -keys=cuda,gpu -arch=sm_80 -max_num_threads=1024 -thread_warp_size=32", [-1, 16, 64, 49152, 2147483647, 1024, 8, 32], "", 0, []], [[], [["FU", 1, [0, 1, 2, 3]], ["SP", 1, 0, 9094800, [13], 1], ["AN", 1, 0, 5], ["AN", 1, 1, 6]]]], "r": [[0.00173381], 0, 1.01226, 1721640831], "v": "v0.6"}
{"i": [["[\"sign\", 53, 100, 52, 33]", "cuda -keys=cuda,gpu -arch=sm_80 -max_num_threads=1024 -thread_warp_size=32", [-1, 16, 64, 49152, 2147483647, 1024, 8, 32], "", 0, []], [[], [["FU", 1, [0, 1, 2, 3]], ["SP", 1, 0, 9094800, [6], 1], ["AN", 1, 0, 5], ["AN", 1, 1, 6]]]], "r": [[0.00258423], 0, 0.814683, 1721640832], "v": "v0.6"}
{"i": [["[\"sign\", 53, 100, 52, 33]", "cuda -keys=cuda,gpu -arch=sm_80 -max_num_threads=1024 -thread_warp_size=32", [-1, 16, 64, 49152, 2147483647, 1024, 8, 32], "", 0, []], [[], [["FU", 1, [0, 1, 2, 3]], ["SP", 1, 0, 9094800, [50], 1], ["AN", 1, 0, 5], ["AN", 1, 1, 6]]]], "r": [[0.000461141], 0, 1.00731, 1721640833], "v": "v0.6"}
