code_generation/generate/log/cuda/sinh_cuda.log
{"i": [["[\"sinh\", 92, 90, 87, 45]", "cuda -keys=cuda,gpu -arch=sm_80 -max_num_threads=1024 -thread_warp_size=32", [-1, 16, 64, 49152, 2147483647, 1024, 8, 32], "", 0, []], [[], [["FU", 1, [0, 1, 2, 3]], ["SP", 1, 0, 32416200, [64], 1], ["AN", 1, 0, 5], ["AN", 1, 1, 6]]]], "r": [[0.00126153], 0, 2.47563, 1721640987], "v": "v0.6"}
{"i": [["[\"sinh\", 92, 90, 87, 45]", "cuda -keys=cuda,gpu -arch=sm_80 -max_num_threads=1024 -thread_warp_size=32", [-1, 16, 64, 49152, 2147483647, 1024, 8, 32], "", 0, []], [[], [["FU", 1, [0, 1, 2, 3]], ["SP", 1, 0, 32416200, [9], 1], ["AN", 1, 0, 5], ["AN", 1, 1, 6]]]], "r": [[0.00891107], 0, 1.71556, 1721640989], "v": "v0.6"}
{"i": [["[\"sinh\", 92, 90, 87, 45]", "cuda -keys=cuda,gpu -arch=sm_80 -max_num_threads=1024 -thread_warp_size=32", [-1, 16, 64, 49152, 2147483647, 1024, 8, 32], "", 0, []], [[], [["FU", 1, [0, 1, 2, 3]], ["SP", 1, 0, 32416200, [5], 1], ["AN", 1, 0, 5], ["AN", 1, 1, 6]]]], "r": [[0.015871], 0, 1.76565, 1721640990], "v": "v0.6"}
{"i": [["[\"sinh\", 92, 90, 87, 45]", "cuda -keys=cuda,gpu -arch=sm_80 -max_num_threads=1024 -thread_warp_size=32", [-1, 16, 64, 49152, 2147483647, 1024, 8, 32], "", 0, []], [[], [["FU", 1, [0, 1, 2, 3]], ["SP", 1, 0, 32416200, [18], 1], ["AN", 1, 0, 5], ["AN", 1, 1, 6]]]], "r": [[0.00548656], 0, 1.84554, 1721640992], "v": "v0.6"}
{"i": [["[\"sinh\", 92, 90, 87, 45]", "cuda -keys=cuda,gpu -arch=sm_80 -max_num_threads=1024 -thread_warp_size=32", [-1, 16, 64, 49152, 2147483647, 1024, 8, 32], "", 0, []], [[], [["FU", 1, [0, 1, 2, 3]], ["SP", 1, 0, 32416200, [40], 1], ["AN", 1, 0, 5], ["AN", 1, 1, 6]]]], "r": [[0.00270991], 0, 2.01209, 1721640993], "v": "v0.6"}
{"i": [["[\"sinh\", 92, 90, 87, 45]", "cuda -keys=cuda,gpu -arch=sm_80 -max_num_threads=1024 -thread_warp_size=32", [-1, 16, 64, 49152, 2147483647, 1024, 8, 32], "", 0, []], [[], [["FU", 1, [0, 1, 2, 3]], ["SP", 1, 0, 32416200, [60], 1], ["AN", 1, 0, 5], ["AN", 1, 1, 6]]]], "r": [[0.00178713], 0, 2.00193, 1721640995], "v": "v0.6"}
{"i": [["[\"sinh\", 92, 90, 87, 45]", "cuda -keys=cuda,gpu -arch=sm_80 -max_num_threads=1024 -thread_warp_size=32", [-1, 16, 64, 49152, 2147483647, 1024, 8, 32], "", 0, []], [[], [["FU", 1, [0, 1, 2, 3]], ["SP", 1, 0, 32416200, [3], 1], ["AN", 1, 0, 5], ["AN", 1, 1, 6]]]], "r": [[0.0341903], 0, 1.67423, 1721640996], "v": "v0.6"}
{"i": [["[\"sinh\", 92, 90, 87, 45]", "cuda -keys=cuda,gpu -arch=sm_80 -max_num_threads=1024 -thread_warp_size=32", [-1, 16, 64, 49152, 2147483647, 1024, 8, 32], "", 0, []], [[], [["FU", 1, [0, 1, 2, 3]], ["SP", 1, 0, 32416200, [12], 1], ["AN", 1, 0, 5], ["AN", 1, 1, 6]]]], "r": [[0.00660997], 0, 1.6914, 1721640998], "v": "v0.6"}
{"i": [["[\"sinh\", 92, 90, 87, 45]", "cuda -keys=cuda,gpu -arch=sm_80 -max_num_threads=1024 -thread_warp_size=32", [-1, 16, 64, 49152, 2147483647, 1024, 8, 32], "", 0, []], [[], [["FU", 1, [0, 1, 2, 3]], ["SP", 1, 0, 32416200, [46], 1], ["AN", 1, 0, 5], ["AN", 1, 1, 6]]]], "r": [[0.00175144], 0, 1.86155, 1721640999], "v": "v0.6"}
{"i": [["[\"sinh\", 92, 90, 87, 45]", "cuda -keys=cuda,gpu -arch=sm_80 -max_num_threads=1024 -thread_warp_size=32", [-1, 16, 64, 49152, 2147483647, 1024, 8, 32], "", 0, []], [[], [["FU", 1, [0, 1, 2, 3]], ["SP", 1, 0, 32416200, [16], 1], ["AN", 1, 0, 5], ["AN", 1, 1, 6]]]], "r": [[0.00502868], 0, 1.67508, 1721641001], "v": "v0.6"}
