code_generation/generate/log/cuda/sqrt_cuda.log
{"i": [["[\"sqrt\", 30, 70, 61, 43]", "cuda -keys=cuda,gpu -arch=sm_80 -max_num_threads=1024 -thread_warp_size=32", [-1, 16, 64, 49152, 2147483647, 1024, 8, 32], "", 0, []], [[], [["FU", 1, [0, 1, 2, 3]], ["SP", 1, 0, 5508300, [28], 1], ["AN", 1, 0, 5], ["AN", 1, 1, 6]]]], "r": [[0.000665688], 0, 1.68625, 1721641130], "v": "v0.6"}
{"i": [["[\"sqrt\", 30, 70, 61, 43]", "cuda -keys=cuda,gpu -arch=sm_80 -max_num_threads=1024 -thread_warp_size=32", [-1, 16, 64, 49152, 2147483647, 1024, 8, 32], "", 0, []], [[], [["FU", 1, [0, 1, 2, 3]], ["SP", 1, 0, 5508300, [43], 1], ["AN", 1, 0, 5], ["AN", 1, 1, 6]]]], "r": [[0.00043638], 0, 0.9948, 1721641131], "v": "v0.6"}
{"i": [["[\"sqrt\", 30, 70, 61, 43]", "cuda -keys=cuda,gpu -arch=sm_80 -max_num_threads=1024 -thread_warp_size=32", [-1, 16, 64, 49152, 2147483647, 1024, 8, 32], "", 0, []], [[], [["FU", 1, [0, 1, 2, 3]], ["SP", 1, 0, 5508300, [20], 1], ["AN", 1, 0, 5], ["AN", 1, 1, 6]]]], "r": [[0.000922346], 0, 1.00002, 1721641131], "v": "v0.6"}
{"i": [["[\"sqrt\", 30, 70, 61, 43]", "cuda -keys=cuda,gpu -arch=sm_80 -max_num_threads=1024 -thread_warp_size=32", [-1, 16, 64, 49152, 2147483647, 1024, 8, 32], "", 0, []], [[], [["FU", 1, [0, 1, 2, 3]], ["SP", 1, 0, 5508300, [14], 1], ["AN", 1, 0, 5], ["AN", 1, 1, 6]]]], "r": [[0.00100629], 0, 0.887308, 1721641132], "v": "v0.6"}
{"i": [["[\"sqrt\", 30, 70, 61, 43]", "cuda -keys=cuda,gpu -arch=sm_80 -max_num_threads=1024 -thread_warp_size=32", [-1, 16, 64, 49152, 2147483647, 1024, 8, 32], "", 0, []], [[], [["FU", 1, [0, 1, 2, 3]], ["SP", 1, 0, 5508300, [8], 1], ["AN", 1, 0, 5], ["AN", 1, 1, 6]]]], "r": [[0.00174384], 0, 0.901425, 1721641133], "v": "v0.6"}
{"i": [["[\"sqrt\", 30, 70, 61, 43]", "cuda -keys=cuda,gpu -arch=sm_80 -max_num_threads=1024 -thread_warp_size=32", [-1, 16, 64, 49152, 2147483647, 1024, 8, 32], "", 0, []], [[], [["FU", 1, [0, 1, 2, 3]], ["SP", 1, 0, 5508300, [25], 1], ["AN", 1, 0, 5], ["AN", 1, 1, 6]]]], "r": [[0.000743125], 0, 1.00294, 1721641133], "v": "v0.6"}
{"i": [["[\"sqrt\", 30, 70, 61, 43]", "cuda -keys=cuda,gpu -arch=sm_80 -max_num_threads=1024 -thread_warp_size=32", [-1, 16, 64, 49152, 2147483647, 1024, 8, 32], "", 0, []], [[], [["FU", 1, [0, 1, 2, 3]], ["SP", 1, 0, 5508300, [7], 1], ["AN", 1, 0, 5], ["AN", 1, 1, 6]]]], "r": [[0.00258819], 0, 1.00745, 1721641134], "v": "v0.6"}
{"i": [["[\"sqrt\", 30, 70, 61, 43]", "cuda -keys=cuda,gpu -arch=sm_80 -max_num_threads=1024 -thread_warp_size=32", [-1, 16, 64, 49152, 2147483647, 1024, 8, 32], "", 0, []], [[], [["FU", 1, [0, 1, 2, 3]], ["SP", 1, 0, 5508300, [32], 1], ["AN", 1, 0, 5], ["AN", 1, 1, 6]]]], "r": [[0.000528752], 0, 0.948954, 1721641135], "v": "v0.6"}
{"i": [["[\"sqrt\", 30, 70, 61, 43]", "cuda -keys=cuda,gpu -arch=sm_80 -max_num_threads=1024 -thread_warp_size=32", [-1, 16, 64, 49152, 2147483647, 1024, 8, 32], "", 0, []], [[], [["FU", 1, [0, 1, 2, 3]], ["SP", 1, 0, 5508300, [4], 1], ["AN", 1, 0, 5], ["AN", 1, 1, 6]]]], "r": [[0.00337986], 0, 0.691438, 1721641135], "v": "v0.6"}
{"i": [["[\"sqrt\", 30, 70, 61, 43]", "cuda -keys=cuda,gpu -arch=sm_80 -max_num_threads=1024 -thread_warp_size=32", [-1, 16, 64, 49152, 2147483647, 1024, 8, 32], "", 0, []], [[], [["FU", 1, [0, 1, 2, 3]], ["SP", 1, 0, 5508300, [15], 1], ["AN", 1, 0, 5], ["AN", 1, 1, 6]]]], "r": [[0.000916163], 0, 0.883156, 1721641136], "v": "v0.6"}
