code_generation/generate/log/cuda/tan_cuda.log
{"i": [["[\"tan\", 52, 91, 35, 59]", "cuda -keys=cuda,gpu -arch=sm_80 -max_num_threads=1024 -thread_warp_size=32", [-1, 16, 64, 49152, 2147483647, 1024, 8, 32], "", 0, []], [[], [["FU", 1, [0, 1, 2, 3]], ["SP", 1, 0, 9771580, [4], 1], ["AN", 1, 0, 5], ["AN", 1, 1, 6]]]], "r": [[0.0040133], 0, 1.27276, 1721641279], "v": "v0.6"}
{"i": [["[\"tan\", 52, 91, 35, 59]", "cuda -keys=cuda,gpu -arch=sm_80 -max_num_threads=1024 -thread_warp_size=32", [-1, 16, 64, 49152, 2147483647, 1024, 8, 32], "", 0, []], [[], [["FU", 1, [0, 1, 2, 3]], ["SP", 1, 0, 9771580, [7], 1], ["AN", 1, 0, 5], ["AN", 1, 1, 6]]]], "r": [[0.00345918], 0, 0.846699, 1721641279], "v": "v0.6"}
{"i": [["[\"tan\", 52, 91, 35, 59]", "cuda -keys=cuda,gpu -arch=sm_80 -max_num_threads=1024 -thread_warp_size=32", [-1, 16, 64, 49152, 2147483647, 1024, 8, 32], "", 0, []], [[], [["FU", 1, [0, 1, 2, 3]], ["SP", 1, 0, 9771580, [8], 1], ["AN", 1, 0, 5], ["AN", 1, 1, 6]]]], "r": [[0.00296701], 0, 0.855778, 1721641280], "v": "v0.6"}
{"i": [["[\"tan\", 52, 91, 35, 59]", "cuda -keys=cuda,gpu -arch=sm_80 -max_num_threads=1024 -thread_warp_size=32", [-1, 16, 64, 49152, 2147483647, 1024, 8, 32], "", 0, []], [[], [["FU", 1, [0, 1, 2, 3]], ["SP", 1, 0, 9771580, [49], 1], ["AN", 1, 0, 5], ["AN", 1, 1, 6]]]], "r": [[0.00050437], 0, 1.05226, 1721641281], "v": "v0.6"}
{"i": [["[\"tan\", 52, 91, 35, 59]", "cuda -keys=cuda,gpu -arch=sm_80 -max_num_threads=1024 -thread_warp_size=32", [-1, 16, 64, 49152, 2147483647, 1024, 8, 32], "", 0, []], [[], [["FU", 1, [0, 1, 2, 3]], ["SP", 1, 0, 9771580, [10], 1], ["AN", 1, 0, 5], ["AN", 1, 1, 6]]]], "r": [[0.00242059], 0, 0.832135, 1721641281], "v": "v0.6"}
{"i": [["[\"tan\", 52, 91, 35, 59]", "cuda -keys=cuda,gpu -arch=sm_80 -max_num_threads=1024 -thread_warp_size=32", [-1, 16, 64, 49152, 2147483647, 1024, 8, 32], "", 0, []], [[], [["FU", 1, [0, 1, 2, 3]], ["SP", 1, 0, 9771580, [9], 1], ["AN", 1, 0, 5], ["AN", 1, 1, 6]]]], "r": [[0.00265706], 0, 0.849442, 1721641282], "v": "v0.6"}
{"i": [["[\"tan\", 52, 91, 35, 59]", "cuda -keys=cuda,gpu -arch=sm_80 -max_num_threads=1024 -thread_warp_size=32", [-1, 16, 64, 49152, 2147483647, 1024, 8, 32], "", 0, []], [[], [["FU", 1, [0, 1, 2, 3]], ["SP", 1, 0, 9771580, [3], 1], ["AN", 1, 0, 5], ["AN", 1, 1, 6]]]], "r": [[0.00795582], 0, 0.86483, 1721641282], "v": "v0.6"}
{"i": [["[\"tan\", 52, 91, 35, 59]", "cuda -keys=cuda,gpu -arch=sm_80 -max_num_threads=1024 -thread_warp_size=32", [-1, 16, 64, 49152, 2147483647, 1024, 8, 32], "", 0, []], [[], [["FU", 1, [0, 1, 2, 3]], ["SP", 1, 0, 9771580, [13], 1], ["AN", 1, 0, 5], ["AN", 1, 1, 6]]]], "r": [[0.00186641], 0, 1.05696, 1721641283], "v": "v0.6"}
{"i": [["[\"tan\", 52, 91, 35, 59]", "cuda -keys=cuda,gpu -arch=sm_80 -max_num_threads=1024 -thread_warp_size=32", [-1, 16, 64, 49152, 2147483647, 1024, 8, 32], "", 0, []], [[], [["FU", 1, [0, 1, 2, 3]], ["SP", 1, 0, 9771580, [1], 1], ["AN", 1, 0, 5], ["AN", 1, 1, 6]]]], "r": [[0.0236538], 0, 0.91526, 1721641284], "v": "v0.6"}
{"i": [["[\"tan\", 52, 91, 35, 59]", "cuda -keys=cuda,gpu -arch=sm_80 -max_num_threads=1024 -thread_warp_size=32", [-1, 16, 64, 49152, 2147483647, 1024, 8, 32], "", 0, []], [[], [["FU", 1, [0, 1, 2, 3]], ["SP", 1, 0, 9771580, [35], 1], ["AN", 1, 0, 5], ["AN", 1, 1, 6]]]], "r": [[0.000684795], 0, 1.03883, 1721641284], "v": "v0.6"}
