code_generation/generate/log/cuda/tanh_cuda.log
{"i": [["[\"tanh\", 49, 84, 65, 45]", "cuda -keys=cuda,gpu -arch=sm_80 -max_num_threads=1024 -thread_warp_size=32", [-1, 16, 64, 49152, 2147483647, 1024, 8, 32], "", 0, []], [[], [["FU", 1, [0, 1, 2, 3]], ["SP", 1, 0, 12039300, [50], 1], ["AN", 1, 0, 5], ["AN", 1, 1, 6]]]], "r": [[0.000606599], 0, 1.69762, 1721641442], "v": "v0.6"}
{"i": [["[\"tanh\", 49, 84, 65, 45]", "cuda -keys=cuda,gpu -arch=sm_80 -max_num_threads=1024 -thread_warp_size=32", [-1, 16, 64, 49152, 2147483647, 1024, 8, 32], "", 0, []], [[], [["FU", 1, [0, 1, 2, 3]], ["SP", 1, 0, 12039300, [14], 1], ["AN", 1, 0, 5], ["AN", 1, 1, 6]]]], "r": [[0.00210725], 0, 1.1233, 1721641443], "v": "v0.6"}
{"i": [["[\"tanh\", 49, 84, 65, 45]", "cuda -keys=cuda,gpu -arch=sm_80 -max_num_threads=1024 -thread_warp_size=32", [-1, 16, 64, 49152, 2147483647, 1024, 8, 32], "", 0, []], [[], [["FU", 1, [0, 1, 2, 3]], ["SP", 1, 0, 12039300, [4], 1], ["AN", 1, 0, 5], ["AN", 1, 1, 6]]]], "r": [[0.00934419], 0, 0.94563, 1721641443], "v": "v0.6"}
{"i": [["[\"tanh\", 49, 84, 65, 45]", "cuda -keys=cuda,gpu -arch=sm_80 -max_num_threads=1024 -thread_warp_size=32", [-1, 16, 64, 49152, 2147483647, 1024, 8, 32], "", 0, []], [[], [["FU", 1, [0, 1, 2, 3]], ["SP", 1, 0, 12039300, [45], 1], ["AN", 1, 0, 5], ["AN", 1, 1, 6]]]], "r": [[0.000671556], 0, 1.13823, 1721641444], "v": "v0.6"}
{"i": [["[\"tanh\", 49, 84, 65, 45]", "cuda -keys=cuda,gpu -arch=sm_80 -max_num_threads=1024 -thread_warp_size=32", [-1, 16, 64, 49152, 2147483647, 1024, 8, 32], "", 0, []], [[], [["FU", 1, [0, 1, 2, 3]], ["SP", 1, 0, 12039300, [25], 1], ["AN", 1, 0, 5], ["AN", 1, 1, 6]]]], "r": [[0.00119906], 0, 1.12492, 1721641445], "v": "v0.6"}
{"i": [["[\"tanh\", 49, 84, 65, 45]", "cuda -keys=cuda,gpu -arch=sm_80 -max_num_threads=1024 -thread_warp_size=32", [-1, 16, 64, 49152, 2147483647, 1024, 8, 32], "", 0, []], [[], [["FU", 1, [0, 1, 2, 3]], ["SP", 1, 0, 12039300, [10], 1], ["AN", 1, 0, 5], ["AN", 1, 1, 6]]]], "r": [[0.00295818], 0, 0.938204, 1721641446], "v": "v0.6"}
{"i": [["[\"tanh\", 49, 84, 65, 45]", "cuda -keys=cuda,gpu -arch=sm_80 -max_num_threads=1024 -thread_warp_size=32", [-1, 16, 64, 49152, 2147483647, 1024, 8, 32], "", 0, []], [[], [["FU", 1, [0, 1, 2, 3]], ["SP", 1, 0, 12039300, [63], 1], ["AN", 1, 0, 5], ["AN", 1, 1, 6]]]], "r": [[0.000483766], 0, 1.12783, 1721641446], "v": "v0.6"}
{"i": [["[\"tanh\", 49, 84, 65, 45]", "cuda -keys=cuda,gpu -arch=sm_80 -max_num_threads=1024 -thread_warp_size=32", [-1, 16, 64, 49152, 2147483647, 1024, 8, 32], "", 0, []], [[], [["FU", 1, [0, 1, 2, 3]], ["SP", 1, 0, 12039300, [26], 1], ["AN", 1, 0, 5], ["AN", 1, 1, 6]]]], "r": [[0.00115542], 0, 1.13073, 1721641447], "v": "v0.6"}
{"i": [["[\"tanh\", 49, 84, 65, 45]", "cuda -keys=cuda,gpu -arch=sm_80 -max_num_threads=1024 -thread_warp_size=32", [-1, 16, 64, 49152, 2147483647, 1024, 8, 32], "", 0, []], [[], [["FU", 1, [0, 1, 2, 3]], ["SP", 1, 0, 12039300, [15], 1], ["AN", 1, 0, 5], ["AN", 1, 1, 6]]]], "r": [[0.00199173], 0, 1.12953, 1721641448], "v": "v0.6"}
{"i": [["[\"tanh\", 49, 84, 65, 45]", "cuda -keys=cuda,gpu -arch=sm_80 -max_num_threads=1024 -thread_warp_size=32", [-1, 16, 64, 49152, 2147483647, 1024, 8, 32], "", 0, []], [[], [["FU", 1, [0, 1, 2, 3]], ["SP", 1, 0, 12039300, [5], 1], ["AN", 1, 0, 5], ["AN", 1, 1, 6]]]], "r": [[0.0039823], 0, 0.910515, 1721641449], "v": "v0.6"}
