code_generation/generate/log/cuda/topology_expansion_cuda.log
{"i": [["[\"topology_expansion\", [\"abs\", \"atanh\", \"abs\", \"cos\", \"exp\", \"atanh\", \"asinh\"]]", "cuda -keys=cuda,gpu -arch=sm_80 -max_num_threads=1024 -thread_warp_size=32", [-1, 16, 64, 49152, 2147483647, 1024, 8, 32], "", 0, []], [[], [["CI", 5], ["CI", 2], ["FU", 7, [0, 1, 2]], ["SP", 7, 0, 72, [64], 1], ["AN", 7, 0, 5], ["AN", 7, 1, 6], ["FU", 6, [0, 1, 2]], ["SP", 6, 0, 72, [64], 1], ["AN", 6, 0, 5], ["AN", 6, 1, 6], ["FU", 4, [0, 1, 2]], ["SP", 4, 0, 72, [4], 1], ["AN", 4, 0, 5], ["AN", 4, 1, 6], ["FU", 3, [0, 1, 2]], ["SP", 3, 0, 72, [32], 1], ["AN", 3, 0, 5], ["AN", 3, 1, 6], ["FU", 1, [0, 1, 2]], ["SP", 1, 0, 72, [32], 1], ["AN", 1, 0, 5], ["AN", 1, 1, 6]]]], "r": [[3.10355e-05], 0, 1.30646, 1721177028], "v": "v0.6"}
{"i": [["[\"topology_expansion\", [\"abs\", \"atanh\", \"abs\", \"cos\", \"exp\", \"atanh\", \"asinh\"]]", "cuda -keys=cuda,gpu -arch=sm_80 -max_num_threads=1024 -thread_warp_size=32", [-1, 16, 64, 49152, 2147483647, 1024, 8, 32], "", 0, []], [[], [["CI", 5], ["CI", 2], ["FU", 7, [0, 1, 2]], ["SP", 7, 0, 72, [16], 1], ["AN", 7, 0, 5], ["AN", 7, 1, 6], ["FU", 6, [0, 1, 2]], ["SP", 6, 0, 72, [32], 1], ["AN", 6, 0, 5], ["AN", 6, 1, 6], ["FU", 4, [0, 1, 2]], ["SP", 4, 0, 72, [32], 1], ["AN", 4, 0, 5], ["AN", 4, 1, 6], ["FU", 3, [0, 1, 2]], ["SP", 3, 0, 72, [32], 1], ["AN", 3, 0, 5], ["AN", 3, 1, 6], ["FU", 1, [0, 1, 2]], ["SP", 1, 0, 72, [1], 1], ["AN", 1, 0, 5], ["AN", 1, 1, 6]]]], "r": [[2.9084e-05], 0, 0.939795, 1721177028], "v": "v0.6"}
{"i": [["[\"topology_expansion\", [\"abs\", \"atanh\", \"abs\", \"cos\", \"exp\", \"atanh\", \"asinh\"]]", "cuda -keys=cuda,gpu -arch=sm_80 -max_num_threads=1024 -thread_warp_size=32", [-1, 16, 64, 49152, 2147483647, 1024, 8, 32], "", 0, []], [[], [["CI", 5], ["CI", 2], ["FU", 7, [0, 1, 2]], ["SP", 7, 0, 72, [64], 1], ["AN", 7, 0, 5], ["AN", 7, 1, 6], ["FU", 6, [0, 1, 2]], ["SP", 6, 0, 72, [8], 1], ["AN", 6, 0, 5], ["AN", 6, 1, 6], ["FU", 4, [0, 1, 2]], ["SP", 4, 0, 72, [32], 1], ["AN", 4, 0, 5], ["AN", 4, 1, 6], ["FU", 3, [0, 1, 2]], ["SP", 3, 0, 72, [32], 1], ["AN", 3, 0, 5], ["AN", 3, 1, 6], ["FU", 1, [0, 1, 2]], ["SP", 1, 0, 72, [32], 1], ["AN", 1, 0, 5], ["AN", 1, 1, 6]]]], "r": [[2.97972e-05], 0, 0.979465, 1721177029], "v": "v0.6"}
{"i": [["[\"topology_expansion\", [\"abs\", \"atanh\", \"abs\", \"cos\", \"exp\", \"atanh\", \"asinh\"]]", "cuda -keys=cuda,gpu -arch=sm_80 -max_num_threads=1024 -thread_warp_size=32", [-1, 16, 64, 49152, 2147483647, 1024, 8, 32], "", 0, []], [[], [["CI", 5], ["CI", 2], ["FU", 7, [0, 1, 2]], ["SP", 7, 0, 72, [32], 1], ["AN", 7, 0, 5], ["AN", 7, 1, 6], ["FU", 6, [0, 1, 2]], ["SP", 6, 0, 72, [32], 1], ["AN", 6, 0, 5], ["AN", 6, 1, 6], ["FU", 4, [0, 1, 2]], ["SP", 4, 0, 72, [4], 1], ["AN", 4, 0, 5], ["AN", 4, 1, 6], ["FU", 3, [0, 1, 2]], ["SP", 3, 0, 72, [64], 1], ["AN", 3, 0, 5], ["AN", 3, 1, 6], ["FU", 1, [0, 1, 2]], ["SP", 1, 0, 72, [32], 1], ["AN", 1, 0, 5], ["AN", 1, 1, 6]]]], "r": [[2.95534e-05], 0, 0.988728, 1721177029], "v": "v0.6"}
{"i": [["[\"topology_expansion\", [\"abs\", \"atanh\", \"abs\", \"cos\", \"exp\", \"atanh\", \"asinh\"]]", "cuda -keys=cuda,gpu -arch=sm_80 -max_num_threads=1024 -thread_warp_size=32", [-1, 16, 64, 49152, 2147483647, 1024, 8, 32], "", 0, []], [[], [["CI", 5], ["CI", 2], ["FU", 7, [0, 1, 2]], ["SP", 7, 0, 72, [1], 1], ["AN", 7, 0, 5], ["AN", 7, 1, 6], ["FU", 6, [0, 1, 2]], ["SP", 6, 0, 72, [32], 1], ["AN", 6, 0, 5], ["AN", 6, 1, 6], ["FU", 4, [0, 1, 2]], ["SP", 4, 0, 72, [1], 1], ["AN", 4, 0, 5], ["AN", 4, 1, 6], ["FU", 3, [0, 1, 2]], ["SP", 3, 0, 72, [32], 1], ["AN", 3, 0, 5], ["AN", 3, 1, 6], ["FU", 1, [0, 1, 2]], ["SP", 1, 0, 72, [32], 1], ["AN", 1, 0, 5], ["AN", 1, 1, 6]]]], "r": [[3.09255e-05], 0, 0.945512, 1721177030], "v": "v0.6"}
{"i": [["[\"topology_expansion\", [\"abs\", \"atanh\", \"abs\", \"cos\", \"exp\", \"atanh\", \"asinh\"]]", "cuda -keys=cuda,gpu -arch=sm_80 -max_num_threads=1024 -thread_warp_size=32", [-1, 16, 64, 49152, 2147483647, 1024, 8, 32], "", 0, []], [[], [["CI", 5], ["CI", 2], ["FU", 7, [0, 1, 2]], ["SP", 7, 0, 72, [4], 1], ["AN", 7, 0, 5], ["AN", 7, 1, 6], ["FU", 6, [0, 1, 2]], ["SP", 6, 0, 72, [32], 1], ["AN", 6, 0, 5], ["AN", 6, 1, 6], ["FU", 4, [0, 1, 2]], ["SP", 4, 0, 72, [32], 1], ["AN", 4, 0, 5], ["AN", 4, 1, 6], ["FU", 3, [0, 1, 2]], ["SP", 3, 0, 72, [8], 1], ["AN", 3, 0, 5], ["AN", 3, 1, 6], ["FU", 1, [0, 1, 2]], ["SP", 1, 0, 72, [64], 1], ["AN", 1, 0, 5], ["AN", 1, 1, 6]]]], "r": [[2.9004e-05], 0, 0.961181, 1721177030], "v": "v0.6"}
{"i": [["[\"topology_expansion\", [\"abs\", \"atanh\", \"abs\", \"cos\", \"exp\", \"atanh\", \"asinh\"]]", "cuda -keys=cuda,gpu -arch=sm_80 -max_num_threads=1024 -thread_warp_size=32", [-1, 16, 64, 49152, 2147483647, 1024, 8, 32], "", 0, []], [[], [["CI", 5], ["CI", 2], ["FU", 7, [0, 1, 2]], ["SP", 7, 0, 72, [32], 1], ["AN", 7, 0, 5], ["AN", 7, 1, 6], ["FU", 6, [0, 1, 2]], ["SP", 6, 0, 72, [4], 1], ["AN", 6, 0, 5], ["AN", 6, 1, 6], ["FU", 4, [0, 1, 2]], ["SP", 4, 0, 72, [4], 1], ["AN", 4, 0, 5], ["AN", 4, 1, 6], ["FU", 3, [0, 1, 2]], ["SP", 3, 0, 72, [64], 1], ["AN", 3, 0, 5], ["AN", 3, 1, 6], ["FU", 1, [0, 1, 2]], ["SP", 1, 0, 72, [32], 1], ["AN", 1, 0, 5], ["AN", 1, 1, 6]]]], "r": [[2.90037e-05], 0, 0.967975, 1721177031], "v": "v0.6"}
{"i": [["[\"topology_expansion\", [\"abs\", \"atanh\", \"abs\", \"cos\", \"exp\", \"atanh\", \"asinh\"]]", "cuda -keys=cuda,gpu -arch=sm_80 -max_num_threads=1024 -thread_warp_size=32", [-1, 16, 64, 49152, 2147483647, 1024, 8, 32], "", 0, []], [[], [["CI", 5], ["CI", 2], ["FU", 7, [0, 1, 2]], ["SP", 7, 0, 72, [32], 1], ["AN", 7, 0, 5], ["AN", 7, 1, 6], ["FU", 6, [0, 1, 2]], ["SP", 6, 0, 72, [32], 1], ["AN", 6, 0, 5], ["AN", 6, 1, 6], ["FU", 4, [0, 1, 2]], ["SP", 4, 0, 72, [32], 1], ["AN", 4, 0, 5], ["AN", 4, 1, 6], ["FU", 3, [0, 1, 2]], ["SP", 3, 0, 72, [32], 1], ["AN", 3, 0, 5], ["AN", 3, 1, 6], ["FU", 1, [0, 1, 2]], ["SP", 1, 0, 72, [8], 1], ["AN", 1, 0, 5], ["AN", 1, 1, 6]]]], "r": [[2.95131e-05], 0, 0.96384, 1721177031], "v": "v0.6"}
{"i": [["[\"topology_expansion\", [\"abs\", \"atanh\", \"abs\", \"cos\", \"exp\", \"atanh\", \"asinh\"]]", "cuda -keys=cuda,gpu -arch=sm_80 -max_num_threads=1024 -thread_warp_size=32", [-1, 16, 64, 49152, 2147483647, 1024, 8, 32], "", 0, []], [[], [["CI", 5], ["CI", 2], ["FU", 7, [0, 1, 2]], ["SP", 7, 0, 72, [32], 1], ["AN", 7, 0, 5], ["AN", 7, 1, 6], ["FU", 6, [0, 1, 2]], ["SP", 6, 0, 72, [32], 1], ["AN", 6, 0, 5], ["AN", 6, 1, 6], ["FU", 4, [0, 1, 2]], ["SP", 4, 0, 72, [32], 1], ["AN", 4, 0, 5], ["AN", 4, 1, 6], ["FU", 3, [0, 1, 2]], ["SP", 3, 0, 72, [1], 1], ["AN", 3, 0, 5], ["AN", 3, 1, 6], ["FU", 1, [0, 1, 2]], ["SP", 1, 0, 72, [8], 1], ["AN", 1, 0, 5], ["AN", 1, 1, 6]]]], "r": [[3.09242e-05], 0, 0.953032, 1721177032], "v": "v0.6"}
{"i": [["[\"topology_expansion\", [\"abs\", \"atanh\", \"abs\", \"cos\", \"exp\", \"atanh\", \"asinh\"]]", "cuda -keys=cuda,gpu -arch=sm_80 -max_num_threads=1024 -thread_warp_size=32", [-1, 16, 64, 49152, 2147483647, 1024, 8, 32], "", 0, []], [[], [["CI", 5], ["CI", 2], ["FU", 7, [0, 1, 2]], ["SP", 7, 0, 72, [32], 1], ["AN", 7, 0, 5], ["AN", 7, 1, 6], ["FU", 6, [0, 1, 2]], ["SP", 6, 0, 72, [1], 1], ["AN", 6, 0, 5], ["AN", 6, 1, 6], ["FU", 4, [0, 1, 2]], ["SP", 4, 0, 72, [8], 1], ["AN", 4, 0, 5], ["AN", 4, 1, 6], ["FU", 3, [0, 1, 2]], ["SP", 3, 0, 72, [32], 1], ["AN", 3, 0, 5], ["AN", 3, 1, 6], ["FU", 1, [0, 1, 2]], ["SP", 1, 0, 72, [32], 1], ["AN", 1, 0, 5], ["AN", 1, 1, 6]]]], "r": [[3.03268e-05], 0, 0.963583, 1721177032], "v": "v0.6"}
